text,date,id
"unknown: Mareep 82.2% (10/13/14 - Thunder Shock/Thunderbolt - s:normal) til 16:25:21(29m 3s). http://maps.google.com/maps?q=33.22589300644473,-117.34782964252395 …",2017-03-31 19:02:38,847947273548046336
Grand National 2016: Sam Waley-Cohen all set for Black Thunder ride in Grand # GrandNational2016… https://goo.gl/fb/K7Y5rh,2017-03-31 19:02:36,847947265671143426
"Good Luck to all the ""Thunder Chicken"" Hunters tomorrow morning in the Volunteer State-Opening Day! Hope many get to see the ""Flop.""",2017-03-31 19:02:32,847947246880657409
"I liked a @ YouTube video from @ baronvongamez http://youtu.be/E9K-_kydZp0?a War Thunder Helicopters Gameplay, Apache, Mi-35 Hind vs T-90a &",2017-03-31 19:02:25,847947219537997824
"Hoy tenemos partidazos por @ espn, # Rockets vs # Warriors y # spurs vs # thunder",2017-03-31 19:02:25,847947218762051584
Spurs vs thunder tonight.....,2017-03-31 19:02:25,847947218015453184
Let's do this! Jackals and Thunder for the last time in Glens Falls,2017-03-31 19:02:22,847947203255685124
RIP,2017-03-31 19:02:21,847947201129140224
03-31 Thunder vs. Spurs 2016 final score: Oklahoma City shocks... https://goo.gl/fb/1g6Z7N # sanantoniospurs,2017-03-31 19:02:18,847947189750046720
Rio Rancho NM Fri Mar 31st PM Forecast: TONIGHT Partly Cloudy Lo 35 SATURDAY Thunder Storms Hi 50,2017-03-31 19:02:15,847947176877674496
Rancho West NM Fri Mar 31st PM Forecast: TONIGHT Partly Cloudy Lo 35 SATURDAY Thunder Storms Hi 50,2017-03-31 19:02:15,847947173874585601
Panorama Heights NM Fri Mar 31st PM Forecast: TONIGHT Partly Cloudy Lo 35 SATURDAY Thunder Storms Hi 50,2017-03-31 19:02:14,847947170573676545
Los Padillas NM Fri Mar 31st PM Forecast: TONIGHT Partly Cloudy Lo 35 SATURDAY Thunder Storms Hi 50,2017-03-31 19:02:13,847947166995939328
Albuquerque NM Fri Mar 31st PM Forecast: TONIGHT Partly Cloudy Lo 35 SATURDAY Thunder Storms Hi 50,2017-03-31 19:02:07,847947141406392321
"Raichu (40.0%) Spark/Thunder Punch 2/9/7 (ATK/DEF/STA) Despawns at 16:31:06 https://maps.google.com/maps?saddr=My+Location&daddr=34.221387411907536,-118.5488372831051 …",2017-03-31 19:02:03,847947127301050368
It's thunder storming and I absolutely love it,2017-03-31 19:02:01,847947115749920772
"Mareep - 37.8% - 8/2/7 (Thunder Shock - 5,Body Slam - 50). Until 16:27:29 (25m 34s). North Lacey - Johnson Point http://maps.google.com/maps?q=47.08534675733624,-122.81309228568193 …",2017-03-31 19:01:54,847947088109240320
I need this thunder to chill,2017-03-31 19:01:50,847947071005089792
"Raise your words, not voice. It is rain that grows flowers, not thunder. - Rumi # quote",2017-03-31 19:01:45,847947050234912768
thunder/spurs and rockets/warriors on ESPN,2017-03-31 19:01:41,847947035001184258
Pedir aquele açaizin pra ver o jogo do thunder..,2017-03-31 19:01:40,847947030014111745
"huh funny, same as blue thunder Jr, but her four head light on fire, like a light blue fire, kind of like this one pic.twitter.com/M1E4X3p4os",2017-03-31 19:01:39,847947024335032322
Shitty weather = spurs v thunder and Ws v Rockets plus studio night,2017-03-31 19:01:38,847947021210267648
I'm Derek Fisher in his years with the Thunder. https://twitter.com/16winsaring/status/847932517940248576 …,2017-03-31 19:01:21,847946951123513344
lightning! yes! thunder!! yes!!,2017-03-31 19:01:19,847946942944612352
thunder so strong it sounded like somebody was knocking on the door,2017-03-31 19:01:05,847946880440991744
"Ampharos 33.3% (5/4/6/Charge Beam/Thunder) till 16:29:05 (28m 1s). lvl30+ CP:1604 (L23) http://maps.google.com/maps?q=37.410116252899165,-122.06487960286235 …",2017-03-31 19:01:03,847946872287186944
ECHL LIVE UPDATES: Adirondack Thunder vs. Elmira Jackals http://bit.ly/2nTTf6C,2017-03-31 19:01:00,847946863030525952
Let's go Russ and the Thunder!,2017-03-31 19:01:00,847946861705138177
Agregué un video a una lista de reproducción de @ YouTube http://youtu.be/bU73POwnvVI?a War Thunder #Hermoso el Leopard 2,2017-03-31 19:01:00,847946859738013696
"Pues creo que hoy me voy a ver el San Antonio Spurs - Oklahoma city thunder, dara hoy westbrook otro pasito hacia la historia? Noche de NBA!",2017-03-31 19:01:00,847946859670888448
I love rainy days & thunder storms,2017-03-31 19:00:53,847946834014240769
Line Update: Oklahoma City Thunder are now +3 from +2.5 vs San Antonio Spurs recorded at 07:00 # SportsBetting # NBA # Basketball,2017-03-31 19:00:09,847946649041338370
"À 19h, le 31 mars 2017 Il fait 93,6°S au Canada Extrêmes retranchés: min: -25,6°C à Iqaluit max: 13,7°C à Thunder Bay",2017-03-31 19:00:05,847946631123283968
The Oklahoma City Thunder kept the right NBA superstar... http://fb.me/1iMjVegZE,2017-03-31 19:00:03,847946624202678272
"Disfruta en TN8 del mejor baloncesto del mundo, con los juegos de la NBA: Hawks vs Bulls y Hornets vs Thunder. ¡No te los perdás! pic.twitter.com/zRtAmvGn4h",2017-03-31 19:00:01,847946614404677632
Thunder up?? I think yes!! # whynot # thunderup # russellwestbrook # mvp https://www.instagram.com/p/BSUfVn6jR46/,2017-03-31 19:00:00,847946610755731457
Man War thunder knows how to make events. I wonder if this is only here for April fools # aprilfoolspic.twitter.com/CYDuk3dMXH,2017-03-31 18:59:17,847946430664908801
Thunder & Lightning. # 45Friday # Funk # DrumBreak # OpenDrumsOnly # DITC # CrateFlexin # GetYaCratesUp… https://www.instagram.com/p/BSUfMdyBnkY/,2017-03-31 18:58:46,847946298980319232
I added a video to a @ YouTube playlist http://youtu.be/SVTI5WevuG4?a Herald of Ice & Thunder Autobomber - Build Guide,2017-03-31 18:58:40,847946275010088960
Play with me buddeh,2017-03-31 18:58:22,847946198396747776
That was actually kind of funny.,2017-03-31 18:58:18,847946183599431682
I am selling Country Thunder 2017 tickets!! 2 Friday (April 7th)… https://www.instagram.com/p/BSUfIl3DNqsQLvnpb9RZzOwVMEDrW2yzxfzsAY0/ …,2017-03-31 18:58:16,847946173063344128
Nope,2017-03-31 18:58:13,847946159297622016
War Thunder Helicopteros vs tanques: http://youtu.be/PZBsgIaJ23c?a vía @ YouTube,2017-03-31 18:58:12,847946157137571840
cheer for the Thunder tonight. A thunder win and the warriors running the rockets would be great for our TL.,2017-03-31 18:58:10,847946146991493121
So there are rules: like don't judge anybody sexually. Unless you find a husband trying to observe fidelity. OMGosh. Thunder and lightening.,2017-03-31 18:58:04,847946122404540422
https://m.facebook.com/story.php?story_fbid=10155184775433637&id=5989193636 … # Thunder,2017-03-31 18:58:03,847946119149608960
ポッピンQは見ないです(^_^;) でも、SAO上映の際は塚口に行きます！,2017-03-31 18:57:56,847946089885859840
THIS IS HUGE: The next person to order a bucket of beer and mention this tweet gets 2 Thunder tickets and parking for tonight's game at 7!,2017-03-31 18:57:11,847945901838675968
I'm just saying. The comment I made about Westbrook and the Thunder winning it all doesn't seem so radical anymore,2017-03-31 18:56:52,847945822960586752
the menzingers are playing at fucking thunder road in somerville and this lil flu-stricken person sure wishes they saw that 6 hours earlier,2017-03-31 18:56:46,847945796637143040
"Face it, the game is slow and boring",2017-03-31 18:56:36,847945752559185920
God of thunder God of lightning come together right now punto sekavo,2017-03-31 18:56:35,847945749874843648
"Get Here! |Mareep |(53.3%)|(8/5/11) Thunder Shock/Thunderbolt til:(07:13:14pm)|(16m 46s) # ChuckTownRareshttp://maps.google.com/maps?q=32.805432277341275,-79.94405915850179 …",2017-03-31 18:56:27,847945714311335936
"unknown: Mareep 82.2% (10/13/14 - Thunder Shock/Thunderbolt - s:normal) til 16:25:21(29m 3s). http://maps.google.com/maps?q=33.22589300644473,-117.34782964252395 …",2017-03-31 18:56:16,847945671017586690
I'm really fucking scared of thunder.,2017-03-31 18:56:10,847945643368865792
"But we're dumb and ghetto bc we go to Lanier, why they stealing our thunder?",2017-03-31 18:56:07,847945633340194816
Its slower but ill have to admit Thunder is used to play those shitty newer CODs. He likes the double jumping shit and wallruning allo'that,2017-03-31 18:55:39,847945515618754561
pic.twitter.com/DwRghntZUu,2017-03-31 18:55:33,847945487835680769
It's supposed to thunder storm tomorrow night and we sleeping outside,2017-03-31 18:55:26,847945459431862272
"Stealing Galaxy S8's thunder? This phone is rumored to have superslim bezels, too: Samsung… https://goo.gl/fb/83hjga",2017-03-31 18:55:07,847945381212278786
i hate thunder storms with a passion. currently in my bed under covers,2017-03-31 18:55:02,847945360047779840
Still excited for ww2pic.twitter.com/sU6ILmlvqF,2017-03-31 18:54:58,847945343031554049
"Yep, agree. The faster CODs and advanced movements take skill to learn. The Remaster is dull & uneventful. Snipers and Campers.",2017-03-31 18:54:54,847945327361445888
Watch out Devin.....Haken stealing some of your thunder... https://twitter.com/Raeigis/status/847405658332774400 …,2017-03-31 18:54:37,847945253130838016
@ ThunderVegas # thundervegas time now lets go five more minutes!! I'm wearing my thunder shirt !!,2017-03-31 18:54:23,847945198105747456
"Мне понравилось видео ""MODERN MBT & ATTACK HELICOPTER (War Thunder April Fools 2017 Gameplay)""",2017-03-31 18:54:23,847945196058882049
Thunder lightening in # Islamabad,2017-03-31 18:54:18,847945174273597440
"Mareep (62.2% 8/9/11) w/ Thunder Shock/Thunderbolt has appeared! Available until 06:24:06pm (29m 46s) http://maps.google.com/maps?q=43.545535497694075,-96.74015806295944 …",2017-03-31 18:54:17,847945170096140288
https://youtu.be/yPNFVj-pISU White Zombie Thunder Kiss ' 65. Official video. pic.twitter.com/GLoPeVnbsR,2017-03-31 18:54:15,847945161191694336
Let's get it on!,2017-03-31 18:53:58,847945091847262208
If you know me well and I have went radio silent a storm is brewing inside full of thunder I won't speak over you... http://fb.me/1jxAsSvjw,2017-03-31 18:53:51,847945062520672256
"Adirondack Thunder starters: G J.P. Anderson, D Roman Dyukov, D Ryan Culkin, F Austin Orszulak, F Cullen Bradshaw, F Conor Riley.",2017-03-31 18:53:38,847945008464498688
might have to jump back on to see if its worth it!,2017-03-31 18:53:12,847944898846138368
"its literally everyone using m16 with stopping power camping their asses off. He's not used to the fast pace, everyone just simply camps",2017-03-31 18:52:57,847944836267347968
"that rising thunder is ""eclat."" that's your warning.",2017-03-31 18:52:53,847944817904582656
"""I'm tellin' you, you don't need that guy // it's so black and white, he's stealin' your thunder // baby, Blue Ain't Your Color.""",2017-03-31 18:52:52,847944812686868482
"Pikachu available until 07:19:30pm (26m 46s). Thunder Shock / Wild Charge (84.4% - 10/15/13) http://maps.google.com/maps?q=39.06749792779765,-77.04443790283997 …",2017-03-31 18:52:48,847944797688123392
とか言ってみるエイプリルフール((,2017-03-31 18:52:44,847944780516474880
KSN News at 6 tracking return rain/thunder 1st half weekend. 2nd half weekend looks better. Be ready with our free http://ksn.com/storm-tracker-3-weather-app/ …,2017-03-31 18:52:26,847944703970611201
KSN News at 6 tracking return rain/thunder 1st half weekend. 2nd half weekend looks better. Be ready with our free http://ksn.com/storm-tracker-3-weather-app/ …,2017-03-31 18:52:25,847944702011768832
"Russell Westbrook 'You, the real MVP' # thunder # NBA # OKCThunder http://sport-ne.ws/3m6g pic.twitter.com/i3jeAWmjXa",2017-03-31 18:52:24,847944697502978049
War Thunder Now Features Modern Military! https://www.gaminginstincts.com/war-thunder-now-features-modern-military/ … # MMO # PC # PS4,2017-03-31 18:52:19,847944675323502593
I just went & bought her some bundles gave her some hunnits her head was thunder @ MoneyBaggYo,2017-03-31 18:52:10,847944640334626818
Is the Prop Hunt mode really an official mode?,2017-03-31 18:52:09,847944632612900865
Levo em consideração a ultima semana do calendário: Thunder > Warriors > Blazers > Warriors num b2b.,2017-03-31 18:52:02,847944605798612992
Check out my broadcast from my PlayStation 4! # PS4live (War Thunder) live at https://www.twitch.tv/frostyinfusionz,2017-03-31 18:51:59,847944591516942336
The only game I won't root for the Thunder though is when they play my boys. # GoSpursGo # RussellWestbrook,2017-03-31 18:51:51,847944558264684544
"If the bulls and the thunder meet in the Finals: who would you want to win? Taj, Dougie, and Angry Russ or the Bulls",2017-03-31 18:51:47,847944542536036352
Slasher (Michael myer) was fun too last weekend,2017-03-31 18:51:44,847944528187330560
Great summoners think alike Not that the others were bad But the thunder element is superior,2017-03-31 18:51:38,847944505449992194
"Get Here! |Jolteon |(53.3%)|(5/13/6) Volt Switch/Thunder til:(07:19:59pm)|(28m 21s) # MountPleasantRareshttp://maps.google.com/maps?q=32.79860497049437,-79.89421176537094 …",2017-03-31 18:51:36,847944497879232514
# NBA # Thunder +3 # freeplays,2017-03-31 18:51:33,847944481420791808
"Tonight's Thunder Starters: Culkin, Dyukov, Orszulak, Bradshaw, Riley with Anderson in-between the pipes. # ECHL",2017-03-31 18:51:22,847944436374007809
banter,2017-03-31 18:51:15,847944409094258692
Me ha gustado un vídeo de @ YouTube de @ draw_thunder (http://youtu.be/Tgj8exwR1dw?a - DRAW VS ZAC | Pokemon Platino Nuzlocke EP1).,2017-03-31 18:51:10,847944387984322560
It isn't slow or boring you're just used to the newer shitty CoDs that require no thought,2017-03-31 18:51:08,847944379415371776
"should've added it from the start, a whole new kind of game",2017-03-31 18:51:06,847944371865571328
Pacers +6 Thunder +3 b.5 Rockets +10 b.5 Kings +12 b.5 Gl guys,2017-03-31 18:51:06,847944368723984384
the new war thunder update is lit,2017-03-31 18:51:00,847944346368438272
Hail and thunder?! Fuck no baby,2017-03-31 18:51:00,847944345881903105
"# JackalsHockey Starters: F| Rankin, Mosey, Sandler D| Leboeuf, Vandane G| Jason Kasdorf J.P. Anderson starts for Thunder pic.twitter.com/iN60rX03ft",2017-03-31 18:50:47,847944290449973248
MWR was one of the biggest disappointments in gaming slow and boring AF but thanks to # prophunt it's now easily the best cod ever made,2017-03-31 18:50:22,847944186997428224
pic.twitter.com/E6oQ00m1xN,2017-03-31 18:50:13,847944149458399237
The Thunder playing tonight makes the night shift 1637262622x better,2017-03-31 18:50:12,847944144316227586
"I'll say this. In order for the thunder to be ""good"" they have to steal points... and that starts with Russ grabbing the board and RUNNING",2017-03-31 18:50:01,847944098409566208
Here's how the # Thunder will look for the weekend opener. Halladay has a 94.6 save percentage over his last seven starts. # AllAboardpic.twitter.com/nZCT4iiFQn,2017-03-31 18:50:00,847944094735360002
Why am I such a baby when it comes to thunder storms or really just anything that isn't sunny,2017-03-31 18:49:50,847944050909081603
"Sorry, mom. I snuck out to see # TheMads instead of watch the # WFinalFour. ""Nerrrrrrd,"" cried Thunder as I left. ""Nerrrrrrrd!"" pic.twitter.com/AdR7JmhU2l",2017-03-31 18:49:49,847944046479888387
"Pikachu 64.4% (7/8/14) Thunder Shock/Thunderbolt [Northside] 2600 W Solway St 51104 06:13:55pm (24m 7s) http://maps.google.com/maps?q=42.517224372585666,-96.4143497048831 …",2017-03-31 18:49:46,847944033502679041
"Sat beside the most wonderful, progressive teacher from Thunder Bay who told me about making her report cards gender neutral. Heart. Soared.",2017-03-31 18:49:39,847944006344613888
McBuckets getting up shots for # Thunder pic.twitter.com/dy9CVRaCvA,2017-03-31 18:49:26,847943949444632576
"direct fusion, thunder Drv! do we transfer weight injct*thermocouple: link(PdeliveryVerbose(Sbt)iaS we relate its unit weight",2017-03-31 18:49:20,847943925574676480
"Jolteon (77.8%) Thunder Shock/Discharge 11/12/12 (ATK/DEF/STA) Despawns at 16:19:03 https://maps.google.com/maps?saddr=My+Location&daddr=34.208890743347574,-118.60227408646449 …",2017-03-31 18:49:17,847943914174767104
どもども、宇治にきました♪,2017-03-31 18:49:14,847943898584432640
My Edited WAR THUNDER ( IX tanks omg yess soo good ): http://youtu.be/ZT0YAJ8p7UE?a via @ YouTube,2017-03-31 18:49:10,847943883195654144
Es viernes y juegan Spurs - Thunder y Rockets - Warriors . Que ganas de no tener amigos (?) y poder quedarme en casa,2017-03-31 18:49:04,847943857111257088
Johnny Thunders,2017-03-31 18:48:31,847943719605215232
Thunder Dragon Breeder! I just bred a Thunder Dragon in DragonVale! Visit my park to check it out! http://bit.ly/A7Dtgj,2017-03-31 18:48:26,847943700936359937
"Teams that had a rough day, going 0-3; Rise 16N2, North Idaho Thunder 14 Gold and 16 Black, Idaho Impact 16, PLV 16-2 Pumas",2017-03-31 18:48:25,847943693931642880
Monster Energy Attempts To Run From Laughable Trademark Spat It Started With Thunder Beast Root Beer - Techdirt http://bit.ly/2nsjX33,2017-03-31 18:48:06,847943613267013636
[Thunder] ECHL LIVE UPDATES: Adirondack Thunder vs. Elmira Jackals http://bit.ly/2oIAsIw,2017-03-31 18:48:05,847943612549787648
"Mareep 51.1% Thunder Shock, Body Slam Available until 18:10:55 (22m 56s). http://maps.google.com/maps?q=41.994856422262,-88.20004158962823 …",2017-03-31 18:47:59,847943583957217280
I added a video to a @ YouTube playlist http://youtu.be/fs4LI9ipJkw?a War Thunder - Beautiful Kills Compilation - Simulator Battles,2017-03-31 18:47:58,847943582497505280
"watched Marvel's Iron Fist 1x03 ""Rolling Thunder Cannon Punch"" https://trakt.tv/shows/marvel-s-iron-fist/seasons/1/episodes/3 … # trakt",2017-03-31 18:47:40,847943504542273536
"""I want it to be my decision if I rest or not. Until I feel that way, I'm going to play as long as I'm able to play."" -Westbrook # thunder pic.twitter.com/wEDfAZEqAz",2017-03-31 18:47:38,847943497269248001
I liked a @ YouTube video from @ slickbee http://youtu.be/dspjWx_1Aus?a LEOPARD 2A5 15 KILLS! - War Thunder RB Gameplay,2017-03-31 18:47:28,847943456144183299
Pop and the Spurs are going to do everything in their power to see that Russ doesn't do Russ things. Big night for the rest of the Thunder.,2017-03-31 18:47:08,847943372249731075
.@AlexRoig_DT previews tonight's prime time matchup between the Thunder and Spurs. # ThunderUphttp://dailythunder.com/spurs-vs-thunder-pregame-primer-12/ …,2017-03-31 18:46:47,847943282843938817
"Not just Thunder Buddies, but also true buddies :-P",2017-03-31 18:46:41,847943257933963264
Eu acho q eu vo passar raiva demais porem vou assistir Thunder x Spurs,2017-03-31 18:46:38,847943245812441092
Me ha gustado un vídeo de @ YouTube de @ marcagudo99 (http://youtu.be/C-ClHb6jnYM?a - WCW Thunder NWO Wolfpac vs NWO | 7th January 1999).,2017-03-31 18:46:29,847943209523314688
"if there's thunder can I hide in your foreskin, kamui-kun",2017-03-31 18:46:27,847943198559186946
When I heard the thunder pic.twitter.com/tzXrmwo4DB,2017-03-31 18:46:24,847943187369000960
"MIAA SB Opener at Calvin: Thunder 2nd in nation in HRs/game. Kenna Hartline, Fox lead MIAA HRs. Bachna 1st in Slugging, 2nd in RBI.",2017-03-31 18:45:59,847943084147191808
smh # NowWatching Biegya on Thunder TV. smh,2017-03-31 18:45:51,847943046968868864
This thunder needs to relax,2017-03-31 18:45:50,847943046104788993
This thunder is no joke,2017-03-31 18:45:47,847943033790353408
This thunder and lightning got me scared,2017-03-31 18:45:38,847942992568647689
This thunder is something serious,2017-03-31 18:45:37,847942990400299009
That thunder got me SHOOOOK,2017-03-31 18:45:29,847942957131075586
Me ha gustado un vídeo de @ YouTube de @ cr_ceuta (http://youtu.be/rjy4gJM94ZM?a - WAR THUNDER Helicopteros????????).,2017-03-31 18:45:24,847942936478318592
Vou perder nos Spus vs Thunders,2017-03-31 18:45:12,847942883168718849
GIVE ME THUNDER GIVE ME LIGHTNING AND I WILL GIVE YOU EVERY PART OF ME,2017-03-31 18:45:11,847942880064925697
Thunder Video Converter Pro - video convert&cut Utilities Video | Mac App |1196415141| ****… http://dlvr.it/NmlcNN # macUtilitiesVideo,2017-03-31 18:45:09,847942874079481857
"If you dont know who the Thunder Beast is, google his spinning back eldow finish. http://BJPenn.com should have it # Bellator175 # APFChttps://twitter.com/mmafighting/status/847856059893125120 …",2017-03-31 18:45:03,847942849136123905
"Friday night, studio night. Life is good! — feeling grateful at Blue Thunder Audio Productions, LLC http://fb.me/1RERMRWiS",2017-03-31 18:45:03,847942848494305280
"Mareep IV:60.0%(15/3/9) Move Set: Thunder Shock/Thunderbolt Available until 19:14:02 (28m 58s). http://maps.google.com/maps?q=27.919928693113203,-82.49638329932597 …",2017-03-31 18:45:03,847942848435675136
"[Alcorcon] Hitmonchan (66.7%) [Counter , Thunder Punch](27m 52s). http://maps.google.com/maps?q=40.3471772787035,-3.840840330318348 …",2017-03-31 18:44:54,847942810133307392
Well it does if U have to steal Obama's thunder,2017-03-31 18:44:54,847942809026011137
"NASCAR Thunder 2002 (Sony PlayStation 2, 2001) NO BOOKLET http://www.videogames33.info/US/landing-static/twitter01/?id=http://rover.ebay.com/rover/1/711-53200-19255-0/1?ff3=2&toolid=10039&campid=5337889875&item=142332442484&vectorid=229466&lgeo=1 …pic.twitter.com/vxanC4hxcp",2017-03-31 18:44:48,847942786024448000
that gif,2017-03-31 18:44:45,847942772824973312
"War Thunder Gameplay Tally-ho! Welcome to some more BBBritish War Thunder Gameplay. Today, we partake in some https://is.gd/IGaN82",2017-03-31 18:44:44,847942766625603584
"Raise your words, not your voice. It is rain that grows flowers, not thunder. ~ Rumi",2017-03-31 18:44:29,847942704818515968
"Mareep 62.2% [Thunder Shock , Discharge](19m 22s) Available until 07:03:41pm. http://maps.google.com/maps?q=27.254118304329566,-80.3779132054621 …",2017-03-31 18:44:19,847942664091774977
Check out my broadcast from my PlayStation 4! # PS4live (War Thunder) live at https://www.twitch.tv/packagedoneasy,2017-03-31 18:44:15,847942645343277056
THUNDER UP!!! Lisa Jaro Owens — eating dinner with great friends at Mahogany Prime Steakhouse - Downtown http://fb.me/2lVLWo2Yz,2017-03-31 18:44:10,847942627051921408
@ thunder_mother Happy birthday Alex!,2017-03-31 18:44:06,847942609544806401
"# NBA / Ticket du soir : Toronto raptors oklahoma city thunder Memphis Grizzlies : 4,04 # ParionsSport # TeamParieur",2017-03-31 18:44:06,847942609079345152
War thunderのエイプリルフールネタほんと好き もっとやれ,2017-03-31 18:44:05,847942606046732288
What kinda thunder was that ?,2017-03-31 18:43:50,847942540649254913
Almost peed on myself when I heard the thunder https://twitter.com/xolovemadiee/status/847942252181815296 …,2017-03-31 18:43:50,847942539281879040
Waiting.to be Thunder Struck! # trishtastic # girlsnight # newlydivorced # thuderfromdownunder… https://www.instagram.com/p/BSUdeUwBxHr/,2017-03-31 18:43:44,847942516653436928
Označil(-a) som video @ YouTube http://youtu.be/_5btp8e1FXE?a Mastodon - Blood and Thunder (Cello Cover) ako Páči sa mi,2017-03-31 18:43:12,847942380187725824
♤ Slash ♤ Thunder ♤ 라이트닝 슬래쉬!,2017-03-31 18:43:04,847942349762117632
"In Arizona, U.S. Customs and Border Protection to recruit at 'Country Thunder Arizona,' a country music festival http://azc.cc/2oucH73",2017-03-31 18:43:01,847942334855753728
なんだかwar thunder神アプデっぽいことしてるやんけ,2017-03-31 18:42:45,847942266585067521
Ooooh I hate storms lightening and thunder scare tf oughtta me and I'm by myself,2017-03-31 18:42:34,847942224096763904
THIS THUNDER GOT ME FUCKED UP,2017-03-31 18:42:12,847942129410351105
That thunder omg,2017-03-31 18:42:04,847942097437171713
"Hi, This is not ok. Can you DM us your contact info, order number, and what item you ordered/received?",2017-03-31 18:42:03,847942091338637312
Two potentially great games on ESPN tonight! Spurs/Thunder and Warriors/Rockets. Cant wait! I LOVE BASKETBALL!! # GOSPURSGO,2017-03-31 18:42:03,847942090503991296
"Canyon Lake: Mareep 80.0% (10/14/12 - Thunder Shock/Thunderbolt - 6.23kg/0.56m/small) til 16:11:27 (29m 32s). http://maps.google.com/maps?q=33.67491913555612,-117.25525691284291 …",2017-03-31 18:41:55,847942057163280384
White Zombie - Thunder Kiss '65 https://youtu.be/yPNFVj-pISU via @ YouTube,2017-03-31 18:41:54,847942056181772288
du the witcher ou war thunder ou dark souls 3 :),2017-03-31 18:41:49,847942032421257216
"If I was the thunder, I would want him getting every defensive rebound to start a one person wrecking crew fast break every single time",2017-03-31 18:41:23,847941924719923204
良いなあ,2017-03-31 18:41:19,847941907057483776
"We'll warn you ahead of time, we've acquired @Hubbsy9 since we last met and on top scoring he can do this:pic.twitter.com/vbMKz6Zg6K",2017-03-31 18:40:32,847941709195620352
そろそろ我慢の限界だ,2017-03-31 18:40:22,847941669253136384
こっからトレホの頭がのぞいたら、完全になにがなんだかわかりませんね。,2017-03-31 18:40:16,847941641637724160
The Rockets have a better record then the Thunder because James Harden is a better basketball player than Russell Westbrook. By far.,2017-03-31 18:40:08,847941610730115073
# ThunderUp # ThunderBasketball Spurs vs. Thunder: Pregame Primer # WeAreThunderhttp://dld.bz/f8TMQ,2017-03-31 18:40:06,847941602685407234
Thunder Update: The Russell Westbrook Morehttps://goo.gl/i9Dwjl pic.twitter.com/dBRH9AHdcd,2017-03-31 18:39:46,847941519084572672
# Pazloveando con Thunders Bikes donde encontrarás los mejor en ciclismo y mucho más!! # PazLove http://fb.me/QO8PZld9,2017-03-31 18:39:45,847941514311245825
Fav bond movies: Licence to kill Casino royale In her majesty secret service Thunder ball Spy who loved me Octopussy Gold finger YOLT,2017-03-31 18:39:31,847941456232943616
