text,date,id
闇ダラケ。,2017-03-31 19:59:54,847961683263868928
"The Smoke that Thunders by Mzy1. Victoria Falls, Zambia/Zimbabwe. pic.twitter.com/oKHnMkr1aJ",2017-03-27 11:40:48,846386529459056641
@ FantasyLabsNBA thunder lineup?,2017-03-31 19:59:39,847961622761136129
"CUP: Mareep 55.6% (3/7/15/Thunder Shock/Discharge) till 17:25:30 (25m 57s). lvl30+ CP:150 (L7) http://maps.google.com/maps?q=37.322886644823804,-122.07340250172396 …",2017-03-31 19:59:32,847961592402595842
"No, my dog isn't scared of the normal things like thunder or weird noises. What is he scared of then? He's scared of my lacrosse stick...",2017-03-31 19:59:27,847961570697244672
when you come home from school and your parents tell you we're going to the thunder game tonight >>,2017-03-31 19:59:26,847961566008025092
Thunder kill the power play. Thunder have looked good on penalty kill.,2017-03-31 19:59:12,847961506939625473
"Spurs x Thunder e Warriors x Hockets. Que noite, amigos(as).... # nba",2017-03-31 19:59:07,847961485661933569
"Light rain in COS, waiting for the change over to snow, but a little thunder snow south of Salida? # cowxpic.twitter.com/TPe04gHscy",2017-03-31 19:59:07,847961485024399360
NBA San Antonio Spurs vs Oklahoma City Thunder - Come see us for the best sports streaming and free live tv http://tvkeg.com/channel-78/,2017-03-31 19:59:00,847961457547395073
Psychonoise2 White Zombie Thunder Kiss '65 http://www.radionomy.com/radiorebel666,2017-03-31 19:58:48,847961405177421824
Can it be Country Thunder yet orrrrrrr,2017-03-31 19:58:43,847961388345548800
"Pikachu available until 08:20:20pm (22m 2s). Thunder Shock / Discharge (86.7% - 15/10/14) http://maps.google.com/maps?q=37.231246563917395,-77.40021929139405 …",2017-03-31 19:58:22,847961299019497472
"Mareep (60.0% 15/6/6, Thunder Shock / Thunderbolt). Available until 17:27:58 (29m 45s). http://maps.google.com/maps?q=37.23922982780543,-121.86511148011718 …",2017-03-31 19:58:12,847961256199729152
Thunder beating the Spurs tonight,2017-03-31 19:58:04,847961224369381377
"Thunder Daze, 1 Apr 2017 # Nightlife http://www.newslocker.com/en-uk/news/nightlife/thunder-daze-1-apr-2017/ …",2017-03-31 19:58:04,847961222406434816
pic.twitter.com/qaH1w5r6TQ,2017-03-31 19:57:52,847961171894382592
"Like thunder from the sky! Sworn to fight n die! We're warriors, warriors of the world! Rally the # Redvolution!https://youtu.be/KE_6NPBiofQ",2017-03-31 19:57:41,847961127732617217
Partidazos hoy: Spurs vs Thunder ; Rockets vs Warriors,2017-03-31 19:57:17,847961025831940097
War Thunder now features modern military: http://ift.tt/2nFQBiI : http://global-news.co/,2017-03-31 19:57:11,847960999412080641
Desde las 21hs arranca # Spurs vs # Thunder # Basket # Nba,2017-03-31 19:57:10,847960997017124865
"A wild Pikachu has appeared! Available until 02:26:49 (29m 40s) IV: 97.78 Move: Thunder Shock/Discharge. http://maps.google.com/maps?q=56.15278624055517,10.187931004386845 …",2017-03-31 19:57:08,847960986430709762
Thunder win tonight westbrook wins MVP,2017-03-31 19:57:00,847960954386231296
Monster Energy Attempts To Run From Laughable Trademark Spat It Started With Thunder Beast Root Beer .. http://bit.ly/2nrZFH6 # trademarks,2017-03-31 19:56:58,847960946530066432
#8: Plans: Plans Royal Thunder | Format: MP3 Music From the Album: Wick Release Date: March 31… https://goo.gl/fb/iDxXbx # HardRock # Metal,2017-03-31 19:56:58,847960944688984064
I liked a @ YouTube video from @ mgbonyoutube http://youtu.be/C03YhfuYyNA?a Totally Serious Leopard 2A5 Review | War Thunder,2017-03-31 19:56:54,847960927634939904
# NBA | Transmisión En Vivo Directo | San Antonio Spurs vs Oklahoma City Thunder… http://sportsbetparlay.com/2017/03/nba-%f0%9f%93%ba-transmision-en-vivo-directo-san-antonio-spurs-vs-oklahoma-city-thunder-baloncesto-basketball-disponible-en-android/ …pic.twitter.com/98CiuygbFQ,2017-03-31 19:56:44,847960888351096832
I'm bout to watch this Thunder/Spurs game and tell my son I could do everything they do if you give me a week!,2017-03-31 19:56:44,847960887944237057
Iron Fist: Rolling Thunder Cannon Punch (S1.E3) # IMDbhttp://www.imdb.com/title/tt4174030/ …,2017-03-31 19:56:40,847960869065682945
キュアブラック……！？,2017-03-31 19:56:31,847960833103548416
don't know if i should watch the cavs or thunder game,2017-03-31 19:56:25,847960808197902336
thunder gon forever be known as the Niggas who had Kd Westbrook ..harden and ..serge and didn't do shit wit em smh,2017-03-31 19:56:20,847960785909407746
The best sound in life is a soft summers rain hitting the leaves while thunder rolls in the distance.,2017-03-31 19:56:16,847960770365272065
I liked a @ YouTube video from @ phlydaily http://youtu.be/lO-laRLGJUc?a MODERN MBT & ATTACK HELICOPTER (War Thunder April Fools 2017,2017-03-31 19:56:00,847960703784943616
Spurs/Thunder. Rockets/Warriors. ATL United. My night is set.,2017-03-31 19:55:44,847960635703001088
dat hoe aint thunder then i don't wan her # goofypic.twitter.com/G7Mnt0IJUK,2017-03-31 19:55:42,847960626127409154
what kind of pants do clouds wear? - - - - - - - - - - - thunder pants,2017-03-31 19:55:41,847960622142676992
"I'm at @ WalmartCanada in Thunder Bay, Ontario https://www.swarmapp.com/c/hWrBNYPVHfE",2017-03-31 19:55:32,847960583412600832
Thunder goal! Peter MacArthur puts in his own rebound off Kasdorf's skate at 4:02 of 2nd. Thunder up 2-0,2017-03-31 19:55:25,847960554769715201
日本とブラジルくらいの距離がある説,2017-03-31 19:55:24,847960552601042944
"My dog is afraid of thunder, and there is a freaking thunder storm outside, so tonight means no sleeping for me, cuz I have to be with her.",2017-03-31 19:55:23,847960547337392132
War Thunder now features modern military http://ift.tt/2nss67y,2017-03-31 19:55:20,847960535895355392
March: 56% / +11.14 units 4 units: Spurs/Thunder UNDER 208 # NBA # LegitPicks # MarathonNotASprint # BetWithTheBook # FadeThePublic,2017-03-31 19:55:19,847960531063275521
If you take Russ away the thunder are the worst team in the league,2017-03-31 19:55:15,847960515129245696
"Marriage is made in Heaven, but so is Thunder & Lightning, wood sign, l… http://tuppu.net/11b476fa # djantle # YardSignspic.twitter.com/cDo19QXayH",2017-03-31 19:55:15,847960512935624705
"You might want to edit the post , there's some stuff in there twice , and it says thunder - OKC playoff instead of warriors-OKC",2017-03-31 19:55:10,847960492907704320
"Raise your words, not voice. It is rain that grows flowers, not thunder. - # Rumi # quote # inspiration # RT # advicepic.twitter.com/hR9N0rYvo6",2017-03-31 19:55:08,847960483353300992
real skateboards. Thunders. And bones hella butter!,2017-03-31 19:54:55,847960429955489793
Welcome back Pete MacArthur. He puts Adirondack up by two with Montgomery getting the assist. 2-0 Thunder lead. # ECHL,2017-03-31 19:54:53,847960422972100608
"Lmao facts!!! And If he has a good game thunder fans will be like ""yea but he has help""",2017-03-31 19:54:47,847960396182978561
"In Photos: @ thundertowers at @ Vicar_Street, # Dublin - 30.03.17 by @shaunnearyphoto | http://www.purerawk.com/2017/04/in-photos-thunder-vicar-street-dublin-ireland-30032017/ … # thunder # live # RipItUppic.twitter.com/vqQzjrkk5h",2017-03-31 19:54:47,847960394845097984
"[CENTRO] Hitmonchan (44.4%) [Counter , Thunder Punch](26m 56s). http://maps.google.com/maps?q=40.43754919382037,-3.7407716329847496 …",2017-03-31 19:54:41,847960370564222976
Thunder up Baby..,2017-03-31 19:54:27,847960313337176064
NBA roundup: Thunder stun Spurs in Game 2 # SpursGame... http://dlvr.it/NmmZCz,2017-03-31 19:54:15,847960263638695937
"Got tonight off. About to cook some shrimp and watch the Spurs vs Thunder. Back to the grind tomorrow, 11-7.",2017-03-31 19:54:15,847960262900625415
Destacado: La automotriz china Thunder Power abrirá un centro de I+D y una fábrica en Barce… http://j.mp/2op18yC pic.twitter.com/AO1IvEveFw,2017-03-31 19:54:01,847960204889214976
"/c of thunder and mass of murky clouds in the distance. ""...the weather forecast....said there will be a storm, so /c",2017-03-31 19:54:01,847960203370811392
結晶がああああ,2017-03-31 19:53:59,847960196949229568
"So I've heard I have company now: TBT to 2015 tweet: ""Just being honest - I watch the Thunder to watch Russell Westbrook play not KD""",2017-03-31 19:53:59,847960195921850372
Spurs/Thunder then Rockets/Warriors tonight is a good night for basketball,2017-03-31 19:53:45,847960137918795776
This Spurs Thunder game is about to be so lifeless,2017-03-31 19:53:45,847960137339998211
"Mareep - 53.3% - 14/10/0 (Thunder Shock - 5,Discharge - 65). Until 17:22:04 (28m 19s). Lacey http://maps.google.com/maps?q=46.990578573303615,-122.79214321604437 …",2017-03-31 19:53:44,847960133665566720
I liked a @ YouTube video http://youtu.be/THUS62StVps?a Jay Ferguson-Thunder Island (Live),2017-03-31 19:53:39,847960110798385156
"Mareep IV:37.8%(10/3/4) Move Set: Thunder Shock/Thunderbolt Available until 20:17:52 (24m 21s). http://maps.google.com/maps?q=35.94573991647776,-78.9172878098917 …",2017-03-31 19:53:30,847960074584772608
OKC Thunder +1.5 first half (77 win 70),2017-03-31 19:53:04,847959965713268736
All observers agree that the Thunder's marsupilami put a hand on the MVP trophy,2017-03-31 19:53:01,847959951670640641
"2012 AIR JORDAN 4 IV ""THUNDER"" RETRO. BLACK/White-TOUR YELLOW. DEADSTOCK SZ. 8, W/ original Box,… https://www.instagram.com/p/BSUlZ0iA2tP/",2017-03-31 19:53:00,847959948344668160
Micahpic.twitter.com/fSod96MA6M,2017-03-31 19:52:52,847959916123959301
"Mareep (37.8% 5/10/2) w/ Thunder Shock/Discharge has appeared! Available until 07:18:34pm (25m 46s) http://maps.google.com/maps?q=43.542733521388215,-96.68858216972207 …",2017-03-31 19:52:45,847959883634921472
"""Hush now, don't be scared. Through this tide of darkness. Shadows may march, thunders may roar. But peace will soon prevail.""",2017-03-31 19:52:43,847959875334402048
"Thunder have no chance against the Spurs tonight, right?",2017-03-31 19:52:40,847959862298513409
"Mareep until 08:22:23pm (29m 46s). 58% (12/13/1 A/D/S), Thunder Shock / Discharge. 5.6km S of downtown. http://maps.google.com/maps?q=42.23439664324474,-83.73506289649842 …",2017-03-31 19:52:36,847959846880260096
Spurs vs Thunder?! Who do I even go for here? Let them both win! Love both of these teams and their star players,2017-03-31 19:52:23,847959791246782464
いや、怪しすぎて？,2017-03-31 19:52:13,847959752420188160
Spurs vs thunder,2017-03-31 19:52:12,847959744610312193
"2012 AIR JORDAN 4 IV ""THUNDER"" RETRO. BLACK/White-TOUR YELLOW. DEADSTOCK SZ. 8, W/ original Box,… https://www.instagram.com/p/BSUlSr1AWyo/",2017-03-31 19:52:02,847959703439192064
"Lomas Sante Fe Golf: Mareep 84.4% (12/15/11 - Thunder Shock/Body Slam - s:normal) til 17:20:59(28m 59s). http://maps.google.com/maps?q=33.000402323518955,-117.2391809009448 …",2017-03-31 19:51:59,847959693645332480
"Encinitas: Mareep 84.4% (12/15/11 - Thunder Shock/Body Slam - s:normal) til 17:20:59(28m 59s). http://maps.google.com/maps?q=33.000402323518955,-117.2391809009448 …",2017-03-31 19:51:59,847959693590798336
正直一瞬ネタツイかと思って3キロで検索掛けた,2017-03-31 19:51:59,847959691577630720
"If I'm a peasant, what are you?",2017-03-31 19:51:59,847959690457763840
"the thunder or the 12""+?",2017-03-31 19:51:56,847959677677817856
Elmira power play. Thunder's Keegan Kanzig off 2:00 for hooking at 1:56.,2017-03-31 19:51:49,847959649450156033
"For NBA, no plays here, but Mavs-Grizz under 192 sounds OK. In the big games, I'd probably lean Thunder at +3/3.5, and Rockets at +9",2017-03-31 19:51:46,847959635613159424
Friday # NBA Thunder +2.5 The NBA is that car wreck I can't stop looking at. Going light. pic.twitter.com/A2lxr63NoT,2017-03-31 19:51:40,847959610988298240
Does that mean we start losing again?,2017-03-31 19:51:22,847959537596477444
I don't pay attention to peasants,2017-03-31 19:51:18,847959519162454016
"Get Here! |Mareep |(33.3%)|(10/2/3) Thunder Shock/Thunderbolt til:(08:00:54pm)|(9m 37s) # RedBankRares http://maps.google.com/maps?q=33.921904869386495,-81.22972389937138 …",2017-03-31 19:51:18,847959518009069568
This week we celebrated the return of the thunder and shared traditions of how our families mark the first thunderstorm of the year.,2017-03-31 19:51:14,847959504268533762
Planes para hoy:San Antonio spurs vs Oklahoma city thunder y depues Houston rockets vs Golden state.,2017-03-31 19:51:08,847959479933169664
Ready for this @ okcthunder and spurs games! Gonna be lit at the Peak! Big game for thunder! # MVP # WhyNot # RussellWestbrook # ThunderUp,2017-03-31 19:51:08,847959476602900480
Devin Booker went one pick before the Thunder. Man that would've been real nice,2017-03-31 19:50:56,847959425868603392
"I seen niggas come and go, I need a hunnit summers, so when it rain, I gotta be prepared for the thunder",2017-03-31 19:50:51,847959404846690305
"Favoriterna är väl sex pistols, Ramones, sisters of mercy, the stooges, Ebba grön, sen artister, Patti Smith, Billy idol,Johnny thunders osv",2017-03-31 19:50:49,847959397049544704
"2012 AIR JORDAN 4 IV ""THUNDER"" RETRO. BLACK/White-TOUR YELLOW. DEADSTOCK SZ. 8, W/ original Box,… https://www.instagram.com/p/BSUlIiEAfF8/",2017-03-31 19:50:39,847959357014802432
"""""Even if you fall down and tumble, do not give up.” - Thunder/Cheondoong of MBLAQ [Hello Baby Episode 4]""""",2017-03-31 19:50:35,847959340703035392
Aランク以下の攻撃無効化とかバーサーカーかよ……神性特効でころころしなきゃ……,2017-03-31 19:50:21,847959282272280577
Thunder only happens when it's raining.,2017-03-31 19:50:17,847959264094244864
Me ha gustado un vídeo de @ YouTube de @ gamersreactcomp (http://youtu.be/b8wWPXP5Ho4?a - Gamers Reactions to the Thunder Strike (Night Only),2017-03-31 19:50:16,847959259707047936
"End 1: Muskegon 2, # Thunder 0 # Thunder close the first strong, outshooting Muskegon 6-3 in the final 10 minutes. # BLMvsMUS",2017-03-31 19:50:12,847959243680567297
7. Call me a child but I do not like loud thunder and being close to lightning that shit makes me uneasy,2017-03-31 19:49:59,847959188160618496
"War Thunder War Thunder is a next generation MMO combat game dedicated to World War II military aviation, armored https://is.gd/LYZUZo",2017-03-31 19:49:58,847959185862008832
Just saw @ TheBillyMartin in the hall. Thunder Up!,2017-03-31 19:49:49,847959147526180864
Westbrook scores 57 in Thunder’s 114-106 OT win over Magic http://rincon-sports.com/2017/03/30/westbrook-scores-57-in-thunders-114-106-ot-win-over-magic-2/?utm_campaign=twitter&utm_medium=twitter&utm_source=twitter …,2017-03-31 19:49:48,847959141293228032
Can't tell if the Thunder beat the Spurs tonight,2017-03-31 19:49:44,847959126076424193
No nigga you can't. Move away.,2017-03-31 19:49:40,847959108305260544
@ ThunderS7ruck your worst fear is coming true... pic.twitter.com/oyuiTRrWzF,2017-03-31 19:49:25,847959047718526978
I had it the first day they opened back up. . Couldn't wait.,2017-03-31 19:49:13,847958995935670273
"South Tucson: Ampharos 55.6% (6/9/10 - Charge Beam/Thunder/normal til 17:18:52(29m 42s). http://maps.google.com/maps?q=32.194271768919585,-110.99346156798639 …",2017-03-31 19:49:10,847958982102720513
"West Tucson: Ampharos 55.6% (6/9/10 - Charge Beam/Thunder/normal til 17:18:52(29m 42s). http://maps.google.com/maps?q=32.194271768919585,-110.99346156798639 …",2017-03-31 19:49:10,847958981792350208
"Raise your words, not voice. It is rain that grows flowers, not thunder. - Rumi # quote",2017-03-31 19:49:09,847958978848075776
うわ、ヤバすぎるから間違えて警察呼ぶかも,2017-03-31 19:49:09,847958978323546113
Thunder And Lightning - Black Eyed Child # nowplaying on Eat This # Rock & # Metal Webradio http://eatthismetal.blogspot.gr/,2017-03-31 19:48:51,847958903237337088
皆さん準備出来てますか？あっ違った。,2017-03-31 19:48:46,847958882488012800
All this thunder.,2017-03-31 19:48:37,847958845167026176
Thunder ML +140 # NBA # SportsBetting,2017-03-31 19:48:35,847958835079897089
Russell Westbrook looks to further his MVP campaign and move closer to the record books. Spurs at Thunder. 7 ct on ESPN. # ThunderUppic.twitter.com/s7xzG2BLmn,2017-03-31 19:48:29,847958812422270976
"Character wise, Jago/Sabrewulf/Thunder or Tusk are good starters. Wulf may be your best bet as he has almost Sheik-esque reset potential.",2017-03-31 19:48:26,847958797545091072
Spurs @Thunder! lesgo!!,2017-03-31 19:48:25,847958792566226944
よりによってエイプリルフールっていうのがおもろい,2017-03-31 19:48:24,847958788564897792
caught up on the thunder games I missed and right in time for # OKCvsSAS in 12 minutes let's GOOOOO,2017-03-31 19:48:17,847958762010939393
"""Every search has a story. Find itup -Chris Thunder",2017-03-31 19:48:16,847958756759654401
"Oklahoma City trends now: Russ, Thunder, Westbrook, Tecumseh, Oklahoma City. http://toplocalnow.com/us/oklahoma-city/topics …",2017-03-31 19:48:04,847958706096492544
Not a Thunder fan because I am objective about my opinions and use all of the evidence available to support my decisions? You're foolish.,2017-03-31 19:48:02,847958698282684417
あ、服装写真送っておいて欲しかった,2017-03-31 19:47:56,847958671585824769
"""Digi Thunder (Serangan kilat)"" -Tentomon",2017-03-31 19:47:48,847958638182375424
Let's go # Thunder !,2017-03-31 19:47:45,847958626186801153
"Thunder vs. Chicago Bulls Game Recap – Dec. 25, 2015 # ChicagoBulls http://dlvr.it/NmmT2x # ChicagoBulls",2017-03-31 19:47:10,847958479864086528
"Yuta-kun isn't fond of insects. That's why my companions, Peachy and Thunder, are always helping us ♪",2017-03-31 19:47:09,847958476575748096
Sly rains thunder,2017-03-31 19:47:09,847958474873085952
でもケラノウスがあの硬さで後衛とか信じたくねぇ！,2017-03-31 19:47:00,847958437338075136
"Eso no viene en el dato, ojalá y lo logre, pero más que gane thunder",2017-03-31 19:47:00,847958435563843584
"HOY, 21:30 hs por # ESPN San Antonio Spurs vs Oklahoma Thunders pic.twitter.com/GVH3LroAcV",2017-03-31 19:46:55,847958416488353792
Mine yourselves a perfect & wild weekend. # btm # dlp # dlp25 @Big Thunder Mountain https://www.instagram.com/p/BSUkrOilI98/,2017-03-31 19:46:42,847958361387782145
"Taj Gibson (illness) ruled out for Thunder, Domantas Sabonis replacing him http://bit.ly/2oIJuFp",2017-03-31 19:46:38,847958344014864388
"Pikachu (93.3% 13/14/15, Thunder Shock / Discharge) until 17:11:02 (24m 53s). http://maps.google.com/maps?q=33.977210814051276,-117.33240383979084 …",2017-03-31 19:46:30,847958312079339521
Tonitrophobia is the fear of thunder. # socialmedia # marketing,2017-03-31 19:46:28,847958304785649665
react to thunder vs magic,2017-03-31 19:46:28,847958301556051968
Sky rains thunder,2017-03-31 19:46:13,847958239799017472
new Kendrick playing while Thunder warms up,2017-03-31 19:46:12,847958237827788802
BLOOD AND THUNDER!,2017-03-31 19:46:12,847958236435161088
"it is rain that grows flowers, not thunder",2017-03-31 19:46:12,847958236229775361
"Thunder starting: Westbrook, Oladipo, Roberson, Domantas Sabonis, and Adams # DraftKings # FanDuel # NBA # DFS # ProBallMetrics",2017-03-31 19:46:11,847958232853340164
No mind them make thunder fire all of dem na fine girl dem dy find # bbnaija,2017-03-31 19:46:06,847958213224017920
"""Huge Thunder fan"" and ""Westbrook doesn't deserve MVP"" you obviously are no Thunder fan https://twitter.com/hughcgb/status/847936164313038853 …",2017-03-31 19:45:56,847958167841632256
Spurs vs. OKC Thunder 8:00 on ESPN (Russell Westbrook is 3 triple doubles away from tying Oscar Robertson in a season in NBA history) pic.twitter.com/ViZDSpZWUa,2017-03-31 19:45:52,847958151257305088
あはははは ワタシに服のセンスをモトメナイデ,2017-03-31 19:45:47,847958131481034752
WE make the mile hi THUNDER!! https://twitter.com/broncoonlynews/status/847957870691983360 …,2017-03-31 19:45:45,847958122287087616
THE THUNDER COMING OUT TO humble GIVES ME LIFE ITS LIT,2017-03-31 19:45:33,847958071985012736
Grand National 2016: Sam Waley-Cohen all set for Black Thunder ride in Grand… https://goo.gl/fb/30tVpq,2017-03-31 19:45:31,847958063617277953
# Rawalpindi | It's currently Thunder in the Vicinity and 23C outside.,2017-03-31 19:45:24,847958035536465920
"Mareep IV: 33.3% (4/9/2). Thunder Shock/Body Slam. CP: 531 Expires: 20:08:42 (23m 18s). http://maps.google.com/maps?q=26.46421373915018,-80.0866226814536 …",2017-03-31 19:45:24,847958033086922752
Boomhauer is literally Thunder. # PlayKIhttps://twitter.com/spookperson/status/847918587767513088 …,2017-03-31 19:45:19,847958014522933248
I wanna go,2017-03-31 19:45:06,847957961515421696
No because his pissed giving his entire life to politicians and has epic fail. Mean while a business man steals his thunder.,2017-03-31 19:45:01,847957940560646144
# Thunder INJURIES: Taj Gibson (Unknown Illness) is OUT,2017-03-31 19:45:01,847957937112797184
Thunder Lord - Metal Thunder http://BarbWiresRadio.Com # Premier # HardRock Radio,2017-03-31 19:45:00,847957934965485569
ゆうこちゃん的には笑顔は設定上NGな訳ですね にしてもかまちゃんの扱いw,2017-03-31 19:44:48,847957883090223104
The Thunder cheerleaders are somethin else.,2017-03-31 19:44:42,847957860118134785
Not my MVP pick. Turnovers..That's why the # thunder have such a bad record. # westbrook 35th Ast. Per To. https://espn.go.com/nba/statistics/player/_/stat/assists/sort/assistTurnoverRatio/position/point-guards … # nba # MVP,2017-03-31 19:44:42,847957857437794304
Glad I'm not watching the Thunder game,2017-03-31 19:44:36,847957835317170181
"oEvery search has a styry. Find it."" -Chris Thunder",2017-03-31 19:44:34,847957824781119490
"Just heard thunder outside, how beautiful",2017-03-31 19:44:31,847957812986732544
War Thunderのエイプリルフールイベント楽しすぎ,2017-03-31 19:44:04,847957701258649600
Atribuí nota 8.5 ao episódio 1x3 - Rolling Thunder Cannon Punch de Marvel's Iron Fist http://bit.ly/2myyLf2 # bancodeseries,2017-03-31 19:43:59,847957680073342976
分かりにくいwww,2017-03-31 19:43:59,847957678290640896
Kawhi aquecendo pro jogo! Thunder vs Spurs daqui a pouco na ESPN # NBAnaESPNpic.twitter.com/s4cbED5Usa,2017-03-31 19:43:59,847957677858861056
Excited for this thunder game... let's gooooo #0 !!!,2017-03-31 19:43:55,847957660033056773
Thunder vs Spurs tonight,2017-03-31 19:43:43,847957611655962626
会えなかったら覚えてろよてめぇ,2017-03-31 19:43:41,847957604072431617
this thunder bout strong,2017-03-31 19:43:34,847957573240320000
Amazing race through the streets of Bendigo ...lookout for the Thunder girls !!! http://fb.me/8DB1PnjSf,2017-03-31 19:43:34,847957571646259201
Good morning everyone! ^~^ I woke up with the biggest thunder ever lmao scared afff,2017-03-31 19:43:31,847957560657301504
Thunder numbers: Larocque 3 Fortino 8 Stacey 43,2017-03-31 19:43:22,847957522698948609
"All of this light on my neck, I had to bring thunder I told her I… https://www.instagram.com/p/BSUkS34AFXaQJwcjr76Px6zEJr1Tj_hACldLS40/ …",2017-03-31 19:43:19,847957512573919235
"Lake Elsinore: Mareep 80.0% (15/10/11 - Thunder Shock/Discharge - 3.74kg/0.43m/tiny) til 17:11:43 (28m 25s). http://maps.google.com/maps?q=33.698310325530905,-117.39097877103147 …",2017-03-31 19:43:17,847957504407420928
A faint clap of thunder Even if rain comes not I will stay here Together with you,2017-03-31 19:43:13,847957484371197954
は？おまえぶっころぬぞ,2017-03-31 19:43:11,847957476003659776
♤ Kich ♤ Thunder ♤ Mach ♤ 라이트닝 소닉!!,2017-03-31 19:43:05,847957452385435649
OPの金髪戦士アイギス様説！！,2017-03-31 19:43:00,847957431829225473
@ NBA I truly hate the idea of having co-mvp's but I'm a thunder fan so @ russwest44 for mvp # thundernation # westbrookformvp,2017-03-31 19:42:45,847957367803314180
Oh fuck no I hateeee thunder,2017-03-31 19:42:35,847957325172363264
# nba: Spurs vs Thunder → http://bit.ly/1JYmmqg,2017-03-31 19:42:24,847957280985370624
Continuous thunder and the house that heaven built make me cry bc im an over emotional garbage can,2017-03-31 19:42:18,847957253877452800
"# Hitmonchan 37.8% (6/8/3) Moves: [Bullet Punch | Thunder Punch] City: [Naperville] Timer: [07:10:56pm]-(28m 43s) http://maps.google.com/maps?q=41.71983206075891,-88.18168870229253 …",2017-03-31 19:42:12,847957230934777857
"New post added at Cadalool - Live: Oklahoma City Thunder vs San Antonio Spurs Thunder vs Spurs Saturday, April... http://fb.me/5v16cMOwb",2017-03-31 19:42:12,847957230729220100
# NBA # Thunder Kyle Singler will play in Friday's game vs San Antonio. @ KyleSingler,2017-03-31 19:42:02,847957186751934464
Great work by @ tbpsmedia! Making Thunder Bay safer for everyone. https://twitter.com/tbpsmedia/status/847909139091271681 …,2017-03-31 19:41:58,847957171438575616
Tampa Thunder 2020 - Gerst vs Florida Lightning http://fb.me/8wtolYiJU,2017-03-31 19:41:56,847957162873819136
Dave &amp; Elle Beard from Training Fix enjoying the game with friends &amp; family tonight ... THUNDER UP !!! http://fb.me/197PbZS11,2017-03-31 19:41:51,847957140283285505
りょ〜かい いっぱい話しかける テンション高いけどよろしくな！！,2017-03-31 19:41:48,847957127679180800
http://ift.tt/2nymcnO Air Jordan 4 Thunder Sz 9.5,2017-03-31 19:41:44,847957112395268097
# NBA # StartingFive # Thunder [G] Westbrook [G] Oladipo [F] Roberson [F] Sabonis [C] Adams vs Spurs on Friday,2017-03-31 19:41:42,847957104325513216
"Thunder starting: Westbrook, Oladipo, Roberson, Domantas Sabonis, and Adams",2017-03-31 19:41:42,847957103193059328
