text,date,id
What's going on OKC? Five takeaways: Thunder show C's still have work to do… http://dlvr.it/MyNXgJ Get found -> http://goo.gl/GNn5iH,2016-12-24 16:35:04,812773613426180097
Line Update: Oklahoma City Thunder is now -5 from -4.5 vs Minnesota Timberwolves recorded at 04:35 # SportsBetting # NCAAF # CollegeFootball,2016-12-24 16:35:03,812773608326045697
# Loblaw: Loss # Prevention # Representative - Thunder Bay... in # ThunderBay # job https://workfor.us/loblawcareers/31s7v47 … # FreshFuturepic.twitter.com/KpgFY1idgl,2016-12-24 16:34:58,812773587534880768
a toy nice thing tho is that thunder is it's own white noise to mix n match so you can do rain with or without it,2016-12-24 16:34:57,812773583760015361
When stores water their vegetables do they make the thunder sound so the vegetables think they're still in the wild?,2016-12-24 16:34:45,812773533172387840
mad max: beyond thunder dome is a christmas movie,2016-12-24 16:34:36,812773495029514244
I liked a @ YouTube video from @ chris_smoove http://youtu.be/KQWw19j7m6Q?a NBA 2K17 Play Now 4K - Russell Westbrook Posters! Thunder PS4 Pro,2016-12-24 16:33:12,812773141059694593
Loki watches and smiles hoping that Thor would like the unicorn mug and plushie with a set of pyjamas,2016-12-24 16:32:48,812773041369481217
Celtics Cavs Spurs Thunder Lakers https://twitter.com/NBA/status/812704629700120576 …,2016-12-24 16:32:40,812773009484378114
Me gustó un video de @ YouTube http://youtu.be/fp-qIWd7QD8?a [AMV] Dragon Slayers vs Faust - Thunders Mighty Roar,2016-12-24 16:31:40,812772758014791681
"[Pasir Ris] Wild Pikachu spotted at 2 Pasir Ris Farmway 1!100%, Quick Attack/Thunder. Disappears 06:00:09 (29m 5s). http://maps.google.com/maps?q=1.3990208,103.94181717 …",2016-12-24 16:31:07,812772617283366912
"Loki chuckles ""'tis needeth a little more mine brother.""",2016-12-24 16:30:48,812772537620905985
"Mi Nochebuena es estar SOLO, beber Thunder Bitch a morro, oler Bunitex y escuchar esto en bucle... https://www.youtube.com/watch?v=gEfBELeGdtg …",2016-12-24 16:30:44,812772520193589250
Now playing (Thunder Blade) Koichi Namiki - Galaxy Force II & Thunder Blade Original Sound Track - Thunder Blade [BGM1] - [Rating: 0/5] w...,2016-12-24 16:30:04,812772356359946240
thunder scares me a lot pic.twitter.com/Z45EhSvLbC,2016-12-24 16:29:56,812772320234405888
Bell from racism hung cm drill thunder husk ft Feb serum Jan bottom full calc pic.twitter.com/OzTBMkps2t,2016-12-24 16:29:44,812772269961396224
"Gostei de um vídeo @ YouTube http://youtu.be/rwE9H8Zt4WI?aOklahoma … City Thunder vs Boston Celtics - Full Game Highlights | Dec 23, 2016 |",2016-12-24 16:29:35,812772232300793856
"Electabuzz appeared! IV: 55.56% (0/15/10). Moves: Thunder Shock,Thunder Punch. At 305 N Ocean Blvd. 28m 27s left. http://maps.google.com/maps?q=33.826005892611356,-78.64780809671282 …",2016-12-24 16:29:25,812772192081604608
Hoopin' at the Thunder court at 3:30. Don't forget ankle braces and bring your girl at your own risk! Lol.,2016-12-24 16:29:10,812772125853548544
. @ AirCanada Many thanks to AC staff in Thunder Bay & AC8535 for finding my phone & for putting up with the FindMyPhone alarms! # XmasMiracle!,2016-12-24 16:28:51,812772048149815296
To try explain why some days hurt more than others Is like asking rain to sing above the thunder,2016-12-24 16:28:39,812771996782170112
"76:618 Seem'd all one mutual cry: I never heard So musical a discord, such sweet thunder. # AMNDBots",2016-12-24 16:28:10,812771874409062400
"""what rum mine brother? I've never seen any."" Loki pours the rest over the cake he was baking",2016-12-24 16:27:02,812771592015118337
"Christmas morning thunder possible. Hail possible in any stronger storm. HRRR future radar, clouds, temps. # kswx # mowx @ KCTV5pic.twitter.com/770Pit1Lbs",2016-12-24 16:26:54,812771555822465025
Ett surtout soyez tous derrière le Thunder dans la nuit de dimanche à lundi à 2h qui se déplace au Timberwolves!!,2016-12-24 16:26:47,812771526168739841
"Can you hear, can you hear me thunder... My first # vegemite @Lane Cove West https://www.instagram.com/p/BOajjoHj8cV/",2016-12-24 16:26:44,812771515246792705
"TY god of thunder, many just seem to not care, only a few will like, shame too as there are thousands on here!",2016-12-24 16:26:34,812771473991421952
"My niece and nephew baked me cinnamon rolls for Christmas and put ""Thunder"" on the front so sweet. # ThunderUppic.twitter.com/WbUKveqfXI",2016-12-24 16:26:33,812771470262890496
"NBA: Russell Westbrook (45 pts, 11 reb, 11 ast) records 3rd straight 40-plus point game as Thunder top Celtics 117-112via @ ESPN",2016-12-24 16:26:25,812771437492596736
@ leenahar_87 @ PaulMalignaggi someone thought you were Thunder. Genius!,2016-12-24 16:26:23,812771426864336900
"I liked a @ YouTube video http://youtu.be/rwE9H8Zt4WI?a Oklahoma City Thunder vs Boston Celtics - Full Game Highlights | Dec 23, 2016 |",2016-12-24 16:26:20,812771416059867136
De War Thunder :v,2016-12-24 16:26:11,812771376696348672
تربيتك,2016-12-24 16:26:02,812771338771398656
けっちThunder,2016-12-24 16:25:51,812771293011406848
Exo - thunder,2016-12-24 16:25:26,812771186232827904
I liked a @ YouTube video http://youtu.be/CabwV8JyHG8?a MOST INSANE Custom Battle EVER - Volcano Team Death MATCH (War Thunder),2016-12-24 16:25:25,812771184790138884
Ich mag das @ YouTube-Video von @ MarkusMusic: http://youtu.be/4oRRA9WB4SI?a War Thunder Lets Play Trailer | JohnGee Furzfichte,2016-12-24 16:25:08,812771114481025024
stfu you cum guzzling thunder cunt,2016-12-24 16:25:00,812771079081066496
ههههههه أوك,2016-12-24 16:24:48,812771030611689472
"What I'm doing this Christmas ? Getting back into coloring aka Thunder Boar!! Yes, 4 years of art school working out haha pic.twitter.com/R0YnKK5VKe",2016-12-24 16:24:38,812770988240801792
Don't be mean to my boy thunder https://twitter.com/dejayymellimel/status/812770650049970177 …,2016-12-24 16:24:37,812770982133960704
I added a video to a @ YouTube playlist http://youtu.be/U-rqdcIPHig?a One Dance | Curry Vs Thunder | 2015-2016 NBA Playoffs Game 7,2016-12-24 16:24:23,812770923547918336
"THUNDER, THUNDER, THUNDERCATS HOOO!!! https://www.instagram.com/p/BOajSJTjTsq/",2016-12-24 16:24:21,812770915641659393
Merry Christmas from MJM Thunder Products http://www.offsprey.com/2016/12/merry-christmas-from-mjm-thunder-products/ …pic.twitter.com/egBwYUvk3e,2016-12-24 16:24:11,812770872842919936
"Pikachu available until 16:53:50 (29m 45s). Quick Attack / Thunder (91.11% - 15/14/12) http://maps.google.com/maps?q=37.26065271448816,-80.05842558447155 …",2016-12-24 16:24:05,812770847035420672
"Raise your words, not voice. It is rain that grows flowers, not thunder. - Rumi # quote",2016-12-24 16:24:04,812770846372728832
# NoNatalEu vou ajudar o Thunder a voltar com o canal,2016-12-24 16:23:55,812770807386607621
"//my Loki's only joking because, in the norse beliefs Christmas Eve is Thor's birthday.",2016-12-24 16:23:48,812770776214622208
I'm only honest when it rains If I time it right the thunder breaks when I open my mouth. I want to tell you but I don't know how.,2016-12-24 16:23:39,812770740609093636
"Pikachu available until 16:51:43 (28m 20s). Thunder Shock / Discharge (97.78% - 14/15/15) http://maps.google.com/maps?q=37.286712077077404,-80.06217990882251 …",2016-12-24 16:23:23,812770672095141888
War Thunder Lets Play Trailer | JohnGee Furzfichte: http://youtu.be/4oRRA9WB4SI?a über @ YouTube,2016-12-24 16:22:59,812770573214449668
Love this moment every year when the 2008 Lions pop the cork on the Cherry NyQuil and crack open an ice cold Dr. Thunder to celebrate,2016-12-24 16:22:58,812770566725898241
Thunder at Celtics: Russ Explosion Down The Stretch http://www.fillingthelane.com/understanding-the-game/bball-breakdown/thunder-at-celtics-russ-explosion-down-the-stretch/ …,2016-12-24 16:22:26,812770433175003136
"Does anyone have any nice high resolution pictures of Thunder Bay, Lakehead University, the Sleeping Gia http://ruq.us/D3Fh6Jr # ThunderBay",2016-12-24 16:22:22,812770416074887173
"MELBOURNE, AUSTRALIA - DECEMBER 22: Chris Green of the Thunder... http://dlvr.it/MyNQKh pic.twitter.com/xwUOyIZFYG",2016-12-24 16:22:14,812770381438140416
I read Distant Thunder by Larissa Ione https://www.goodreads.com/review/show?id=1700037965 …,2016-12-24 16:22:02,812770331853197312
"Raichu appeared! IV: 64.44% (13/10/6). Moves: Spark,Thunder Punch. At 513 Callalily Ct. 13m 36s left. http://maps.google.com/maps?q=33.761618326742564,-78.91622692294288 …",2016-12-24 16:21:56,812770306360279040
Bit stormy here on the gold coast... who needs a # Christmas thunder buddy?,2016-12-24 16:20:48,812770022028259329
Miami has a little thunder and lighting going on with Drake and Ajayi,2016-12-24 16:20:43,812770002977914880
"ICYMI - # NBA: Another unreal stat line for Westbrook: 45 pts, 11 rebs, 11 dimes as the Thunder beat the Celtics. http://bit.ly/2hlyoXu",2016-12-24 16:20:01,812769825260965892
fucking right! I thought maybe they were actually going to take away the Lions thunder. The worst team in history is still my team!,2016-12-24 16:19:32,812769702795739137
Thunder at Celtics: Russ Explosion Down The Stretch https://youtu.be/yMZOZ_802hc,2016-12-24 16:19:07,812769597313032192
arrepio toda vez que começa a tocar thunder,2016-12-24 16:18:55,812769549271662593
Podoba mi się film Japan's First 150mm Derp Tank | Type 4 Ho-Ro | War Thunder [AB] w @ YouTube od @ mgbonyoutube –,2016-12-24 16:18:54,812769543760347136
"""all right thou must be coming down with something.""",2016-12-24 16:18:40,812769483492327424
Mírenle esos thunder thighs a Mon,2016-12-24 16:18:02,812769328093335552
"Boston’s four-game winning streak was snapped by the Thunder Friday night, but B... # Celtics http://www.nba.com/celtics/video/postgame/report2-vsokc-122316 …pic.twitter.com/YuX5WPXGaI",2016-12-24 16:17:30,812769191866564608
Knicks cavs Spurs thunder and clippers if they don't rest anyone,2016-12-24 16:17:27,812769177329160192
Safehaven Marine launches Thunder Child high-speed vessel in Cork Harbour - West Cork Times http://ift.tt/2hUwWL8,2016-12-24 16:17:20,812769150313627648
Ceraunophobia is the fear of thunder and lightning. # us # usa,2016-12-24 16:17:17,812769139127451648
"""Art thou all right mine brother?""",2016-12-24 16:17:12,812769117228990464
"we should get some rest.""",2016-12-24 16:16:20,812768897732579328
"""I know they were down 3+ scores, but people don't just put up numbers like that by accident.""",2016-12-24 16:16:05,812768834566455296
"""Yes. We can do them. We can add them to the muffin package and of course leave some for us."" He said with a smile. ""But+",2016-12-24 16:16:04,812768832205049857
تدلل وأكدر اسويه بالبيت تجنن أو نطلبلك من مطعم قريب مو مشكله,2016-12-24 16:15:49,812768768602603520
i want manjoumes thunder,2016-12-24 16:15:49,812768766958379008
"Raise your words, not voice. It is rain that grows flowers, not thunder. - Rumi # quote",2016-12-24 16:15:43,812768742300127233
"Jolteon (62.22%-10/15/3,Thunder Shock/Discharge) Until 13:45:05 (29m 27s) http://maps.google.com/maps?q=33.89963193431307,-118.04298868448586 …",2016-12-24 16:15:37,812768717780094977
"That's a wrap for Christmas Eve. Left us with thunder and lightning and I mean literally, suits 2016. # merrychristmas # HappyHanukkah",2016-12-24 16:15:25,812768667335356416
"@ PFTCommenter look what grit and sneaky athleticism this snowman has, courtesy of ""the great white thunder from down under"" @ matthewdellypic.twitter.com/epujKKcQYd",2016-12-24 16:15:18,812768637153120256
Pur- Tungsten Momiska Drop Blue Thunder (1/64 OZ) - http://fishingrodsreelsandgear.com/product/pur-tungsten-momiska-drop-blue-thunder-jig-pack-of-2/?attribute_pa_size=1-64-oz …pic.twitter.com/bvTqGceCZu,2016-12-24 16:15:13,812768617536180224
LISTEN. Holiday edition of Roar of Thunder Podcast. Download for iPhone. https://itunes.apple.com/us/podcast/roar-of-thunder-podcast/id1171889802?mt=2 …,2016-12-24 16:14:42,812768486342750208
Cerebral thunder...,2016-12-24 16:14:42,812768485461946368
***UPDATE*** Winter storm warning in effect for: City of Thunder Bay Hazardous winter conditions are expected.... http://fb.me/63pgBSTAZ,2016-12-24 16:14:39,812768475680829440
Thunder on Christmas eve,2016-12-24 16:14:20,812768394927706112
# NowPlaying Thunder & Lightning by Motörhead ♫ http://spoti.fi/1NYfzQ0,2016-12-24 16:14:04,812768327646883840
おは〜,2016-12-24 16:13:20,812768143193960448
THUNDER TUMBLER Radio Control 360-Degree Rally Car @. Karim https://youtu.be/O_HheOiF8Cs,2016-12-24 16:13:04,812768078148861956
I love thunder so much,2016-12-24 16:12:32,812767943100657664
We are at rainforest cafe and their simulated thunderstorm just happened and my mom said the dua for thunder she thinks she's so funny,2016-12-24 16:12:14,812767868119089153
Pur- Tungsten Momiska Drop Blue Thunder (1/32 OZ) - http://fishingrodsreelsandgear.com/product/pur-tungsten-momiska-drop-blue-thunder-jig-pack-of-2/?attribute_pa_size=1-32-oz …pic.twitter.com/5sySdm5YhQ,2016-12-24 16:11:14,812767612799041536
"Pikachu has appeared! Expected despawn: 03:40:33pm(29m 35s) IV:95.56% (15/13/15) Moves:Thunder Shock, Thunderbolt http://maps.google.com/maps?q=29.683895063770553,-95.47741246988672 …",2016-12-24 16:10:57,812767542607572992
"Ran into Mike & Thunder today at Bass Pro Shop! Thunder had a great time & is ready for Santa Claus, to bring him a big, tasty bone! pic.twitter.com/4vTTtCm6yf",2016-12-24 16:10:41,812767476283047936
***UPDATE*** Winter storm warning in effect for: City of Thunder Bay Hazardous winter conditions are expected.... http://fb.me/G6VSrMEo,2016-12-24 16:10:07,812767334960136192
The thunder are doing there thing Westbrook MVP,2016-12-24 16:08:48,812767001454268418
Radio Hits: Kane Brown - Thunder In The Rain is on Q106.8 Country # RadioHitsOnTheQ,2016-12-24 16:08:11,812766846923501570
Holy FUCK ford GT 05 passed on the other side of the highway. Fucking thunder on wheels,2016-12-24 16:08:06,812766826937597952
Pur- Tungsten Momiska Drop Blue Thunder Jig [Pack of 2] - http://fishingrodsreelsandgear.com/product/pur-tungsten-momiska-drop-blue-thunder-jig-pack-of-2/ …pic.twitter.com/ISsCe8BRus,2016-12-24 16:07:13,812766605994098688
"wow not bad. Bout 2-3 degrees here i think. It was HOT earlier. We had rain, sun, thunder, lightning and hail. CRAZY CHRISTMAS",2016-12-24 16:06:31,812766427895754752
"WINTER STORM WARNING IN EFFECT, Thunder Bay ON. Issued: 3:50pm on Sat, Dec 24th by Environment Canada. http://SocialWx.ca/YQT161224W2",2016-12-24 16:06:27,812766409683931136
"WINTER STORM WARNING IN EFFECT, Thunder Bay ON. Issued: 3:50pm on Sat, Dec 24th by Environment Canada. http://SocialWx.ca/YQT161224W2",2016-12-24 16:06:26,812766407880425472
I've officially made my move to the Thunder.,2016-12-24 16:06:25,812766404051107842
What you do so naturally you're the thunder and I am the lightning...,2016-12-24 16:06:17,812766369120780288
***UPDATE*** Winter storm warning in effect for: City of Thunder Bay Hazardous winter conditions are expected.... http://fb.me/V6lGf67y,2016-12-24 16:06:04,812766315194753024
"Loki smiles back ""thou can openeth it anytime mine brother.""",2016-12-24 16:05:59,812766295011823616
Herh..Thunder fire u. https://twitter.com/meds40/status/812765181117943808 …,2016-12-24 16:04:34,812765937178906624
I thought you could only buy water thunder fire stones,2016-12-24 16:04:09,812765833030148096
"I FUCKING HATE THAT IM A COYOTES, DBACKS, THUNDER AND CHARGERS FAN. I WILL DIE OF A HEART ATTACK BEFORE 30",2016-12-24 16:02:45,812765479433445376
hmmm so you got em thunder-like?,2016-12-24 16:02:43,812765472106184704
"“May Thunder Strike Down Anyone That Wishes Us Death” – Nigerian Soldier, Chibuzor Ever http://nigerianbuzz.com/index.php/2016/12/24/may-thunder-strike-down-anyone-that-wishes-us-death-nigerian-soldier-chibuzor-ever/ …pic.twitter.com/u3oklbNIqE",2016-12-24 16:02:23,812765388043931654
@ NBA_Math Westbrook is a beast! NOBODY plays with his energy! Fun to watch! Haters gna hate regardless. Thunder up!!!,2016-12-24 16:02:01,812765296515842048
歌い納め、Thunder snake ATSUGI楽しかったよー！ そして2016年みなさま本当にありがとうございました。 去年よりライブの本数は減らしたけれど、なんだかんだ言って駆け巡ってしまった1年となりました。 来年も自分らしく行きますよ☆ 楽しいことをたくさんします☆,2016-12-24 16:02:01,812765294401757184
Thunder strike you,2016-12-24 16:01:44,812765224327675904
"[Sembawang] Wild Raichu spotted at 31 Senoko Rd!24%, Thunder Shock/Brick Break. Disappears 05:30:59 (29m 26s). http://maps.google.com/maps?q=1.46403501,103.79703921 …",2016-12-24 16:01:35,812765187581345793
http://Twitch.tv/joxol Thunder chicken breakdown,2016-12-24 16:01:28,812765157810008065
Heavens Artillery Thunder @niume_official https://niume.com/post/204096 # Niume,2016-12-24 16:01:27,812765150902099969
UtilityDive: Op-Ed: Can New England steal California's storage thunder? http://bit.ly/2hBJXGi,2016-12-24 16:01:18,812765114223001600
Op-Ed: Can New England steal California's storage thunder? http://bit.ly/2hBJXGi,2016-12-24 16:01:01,812765042340937728
White Zombie - Thunder Kiss '65 http://rdo.to/IROCK # irockradio # listenlive,2016-12-24 16:00:41,812764957804728320
"There are 2 because in Universe mode I made 2 brands each with their own belts. blue = Thunder, green = Velocity",2016-12-24 16:00:39,812764951190339587
Westbrook triple-double leads Thunder past Celtics 117-112 http://es.pn/2i3TI3x,2016-12-24 16:00:37,812764943032418305
Winter storm warning in effect for Thunder Bay. http://www.weather.gc.ca/warnings/report_e.html?on59 … # Tbay,2016-12-24 16:00:09,812764825239650304
Funny Moment | War Thunder | Holy Sh*t: http://youtu.be/GXuJC0OyCOk?a via @ YouTube,2016-12-24 16:00:08,812764819325652992
ぶらさん @ fripSide福岡＆忘年会、今起きたのですか…。早く準備にとりかかりなさい,2016-12-24 16:00:04,812764805287264257
# NBA ¡Ricky Rubio tampoco se perderá el # NBAXmas! ¿Dará alguna asistencia como esta vs # Thunders? Vía @ NBAspainpic.twitter.com/vMyk9EtYuA,2016-12-24 16:00:03,812764799725666306
These Oklahoma City Thunder players just landed a spot on Santa Claus' naughty list. http://fb.me/1m2FzM4sS,2016-12-24 16:00:02,812764797469159425
"NEXT WEEK! Ring in 2017 with RXP and Thunder & Buttons! Drink specials, prizes, karaoke and more! Details: http://1039rxp.com/2016/12/19/thunder-buttons-new-years-eve/ …pic.twitter.com/fqYKImXRCc",2016-12-24 16:00:02,812764795262775297
City Asking For Streets To Be Clear Of Vehicles | CJUK Thunder Bay | Magic 99.9 http://fb.me/8nfclDjx6,2016-12-24 15:59:40,812764701956440064
Yoo Happy Birthday @ TyM98 don't let # babyjesus steal your thunder,2016-12-24 15:59:37,812764690505932800
I liked a @ YouTube video http://youtu.be/mtaxyI12bwc?a The Simpsons Funniest Moments #187 thunder storm,2016-12-24 15:59:35,812764683241459712
Them Thunder Thighs https://twitter.com/KGABO__S/status/812732057377996800 …,2016-12-24 15:59:16,812764604346548224
"Let this thunder, herald your end",2016-12-24 15:58:29,812764406496915456
Also check out the Thunder Road companion page with lots of extra material http://midnight-fire.net/tr We’re on our way home.,2016-12-24 15:57:58,812764277639643137
"Loki smiles and nods ""Aye 'tis mine brother.""",2016-12-24 15:57:19,812764111058640896
Read Mud & Thunder ▸ # askmrn # nascar http://paper.li/SonofIndy/1373295476?edition_id=89d70d70-c9d8-11e6-9152-0cc47a0d1609 …,2016-12-24 15:57:18,812764109909262336
"Pikachu appeared! IV: 46.67% (11/2/8). Moves: Quick Attack,Thunder. At 2313-2399 Leonard Ave. 30m 20s left. http://maps.google.com/maps?q=33.830852259213714,-79.07178774117078 …",2016-12-24 15:57:14,812764091500687360
with a smile.,2016-12-24 15:56:27,812763893491765248
I'm sorry. I swear to god I put up there,2016-12-24 15:56:16,812763849019494400
"""We can if that's what you want for breakfast. We can make muffins and then some Christmas Cookies if you like?"" He said+",2016-12-24 15:56:15,812763843034251265
"Мне понравилось видео ""ПРЕДНОВОГОДНЯЯ ТУНДРА - War Thunder"" (http://youtu.be/3guvbGMMFVY?a )",2016-12-24 15:56:06,812763805109325824
ぶらさん @ fripSide福岡＆忘年会、おはよーおはよー,2016-12-24 15:55:37,812763684615245824
メリークリスマス！,2016-12-24 15:55:19,812763609902116864
War Thunder- Tanques Alemães #1: http://youtu.be/WUJtIUfq6BQ?a via @ YouTube,2016-12-24 15:54:33,812763416800722945
"[Geylang] Wild Pikachu spotted at 22 Eunos Cres!100%, Thunder Shock/Thunder. Disappears 05:23:11 (29m 23s). http://maps.google.com/maps?q=1.3245624,103.9024818 …",2016-12-24 15:53:51,812763239369113600
Migo gang like the Thunder cats,2016-12-24 15:53:23,812763122012450817
Devil whispers resound like thunders,2016-12-24 15:53:19,812763107219087360
"Pikachu appeared! IV: 53.33% (3/13/8). Moves: Thunder Shock,Thunderbolt. At 2901 Church St. 21m 38s left. http://maps.google.com/maps?q=33.86137175614444,-79.09323378547941 …",2016-12-24 15:53:05,812763046548566018
It has now been three days since I published my novel Thunder Road - Ice and Fire http://midnight-fire.net/tr/TRIaFthebook.html … the ultimate survivalist story,2016-12-24 15:53:00,812763024629047298
Delicate Sound of Thunder live,2016-12-24 15:52:51,812762988625043457
"Reached over 300 likes on Ray Thunder. Not sure if that's a good thing or a bad thing, considering the number of views vs that.",2016-12-24 15:52:42,812762951471992832
Thunder Feather,2016-12-24 15:51:44,812762706662957056
Report: # Thunder and # Magic keeping an eye on the market for a scoring threat.,2016-12-24 15:51:34,812762665663795201
"I done wrestled with an alligator, I done tussled with a whale; handcuffed lightning, thrown thunder in jail - Muhammad ali",2016-12-24 15:51:28,812762639432642560
# nowplaying Embrace of the Endless Ocean by Amon Amarth on Twilight of the Thunder God in KaiserTone ♪♪ pic.twitter.com/OA0IkYX0Ze,2016-12-24 15:51:09,812762562500493312
"Thunder Road was playing at Gillette Stadium. ""It's a town full of losers"" would be much more appropriate if this was at MetLife.",2016-12-24 15:50:37,812762427486048256
It's been rather warm since the insane cold last week. Might even get some thunder. On xmas. In Minnesota. Climate change?,2016-12-24 15:50:30,812762396016148480
ICYMI - # NBA: We break down the electrifying X'Mas Day matchup between the young Timberwolves Thunder. http://bit.ly/2hA9YWh,2016-12-24 15:50:02,812762277506007040
really?pic.twitter.com/ysAzflVlSW,2016-12-24 15:49:57,812762258342285313
Merry Christmas from Australia have a wonderful day. Chance of showers and some thunder today @ StormHour # StormHourpic.twitter.com/X4KiUOfcFi,2016-12-24 15:49:33,812762156613529600
It's so adorable how the racists keep trying to get our attention back after the Russians stole their thunder.,2016-12-24 15:49:22,812762111332012033
"""Eve.y search has a otory. Find it."" -Chris Thunder",2016-12-24 15:49:05,812762041454829568
Should @THUNDER_iOS win my latest giveaway? @ 8ball_,2016-12-24 15:48:49,812761972777291776
"Мне понравилось видео ""НОЧЬ перед РОЖДЕСТВОМ в War Thunder! 23:30 МСК!""",2016-12-24 15:48:48,812761967161131014
I liked a @ YouTube video http://youtu.be/qnnjhJ6Qmfo?a DEFENSE OF JAPAN (War Thunder Gameplay),2016-12-24 15:48:36,812761916812754944
I hear Thunder Road at Gillette,2016-12-24 15:48:21,812761857052262400
"Magneton appeared! IV: 66.67% (14/15/1). Moves: Thunder Shock,Flash Cannon. At 1908 N Ocean Blvd. 21m 0s left. http://maps.google.com/maps?q=33.82638319643118,-78.64816269047412 …",2016-12-24 15:48:18,812761843278168064
Yup!https://twitter.com/8ball_/status/812761765457039361 …,2016-12-24 15:48:16,812761833929113601
"Мне понравилось видео ""НОЧЬ перед РОЖДЕСТВОМ в War Thunder! 23:30 МСК!""",2016-12-24 15:47:59,812761765704564736
it's gonna rain on Christmas for me and Thunder,2016-12-24 15:47:44,812761698826330113
THUNDER BALL 24/12/2016 WIN: 32-67-34-84-89 MAC: 39-90-65-62-12 Play online @ www.winnersgoldenchance.com,2016-12-24 15:47:20,812761600432214017
# nowplaying Live for the Kill by Amon Amarth on Twilight of the Thunder God in KaiserTone ♪♪ pic.twitter.com/Qy7E642g9h,2016-12-24 15:47:00,812761518244708352
"No doubt, Santa's got one of the last of the V-8's! Thunder on, my friend!",2016-12-24 15:46:50,812761472438779908
"Hitmonchan (24.44%-4/6/1,Bullet Punch/Thunder Punch) Until 13:16:37 (29m 54s) http://maps.google.com/maps?q=33.94196258423343,-117.98782029006829 …",2016-12-24 15:46:43,812761443418312704
TIX http://Dlvr.it/8t9vLd Boston # Celtics Oklahoma City Thunder MINT Season Ticket 12/23/16 2016… http://dlvr.it/MyN2sf # Tickets # Ticket,2016-12-24 15:46:28,812761381971759104
ｳｫｫｫｫｫｫｫｫｧｧｧｱｱｱｧｷｬｷｬｧｷｬｷｬｧｷｬｷｬｧｷｬｷｬｧｫ‼︎【MR.ROLLING THUNDER】,2016-12-24 15:46:00,812761265525248000
"Brook Lopez has 16 points, leading the Nets to a 85-62 third-quarter lead on the decimated Thunder.",2016-12-24 15:46:00,812761265508519936
Me acabo de gastar tal Rolling Thunder al capturar una gamba suicida que Noya estaría orgulloso.,2016-12-24 15:45:31,812761141676044289
"Thunder Bay Christmas Kettle campaign surpasses its $190,000 objective, sets new record. # tbayhttp://ow.ly/nO0L307qJwn",2016-12-24 15:45:16,812761080724422658
This is an easy one to answer: no way!https://twitter.com/8ball_/status/812760916496384000 …,2016-12-24 15:45:12,812761062508527616
