text,date,id
"http://ift.tt/2hdRAlt Regular Fit Straight Leg Jeans, Thunder Size 34 x 30, Style #200… http://ift.tt/2ipivj1 pic.twitter.com/RB0DEL4sP6",2016-12-24 14:26:31,812741262776401928
[CRASH! The sounds of rumbling thunder and lightning marks the appearance of the Demonic God. Snakes emerging with a scorpion] ~,2016-12-24 14:26:27,812741244774477829
"Мне понравилось видео ""Ту-14Т - ""Зачем ты нужен?"" | War Thunder"" (http://youtu.be/6TBzYQZVSGA?a ) на",2016-12-24 14:25:52,812741099064266753
# IGN Killer Instinct Official Reimagining Thunder Trailer https://goo.gl/0SEYfx,2016-12-24 14:25:50,812741089866158080
"He añadido un vídeo a una lista de reproducción de @ YouTube (http://youtu.be/RbFSnF8r7Ao?a - Game Play ""War Thunder"" Español Tanque",2016-12-24 14:25:41,812741050213269504
Thunder. Black diamond moguls. Above my ability level? Only just barely. Burned the crap out of… https://www.instagram.com/p/BOaVsWBhX2J/,2016-12-24 14:25:36,812741031183585281
"【TVPP】EXO - Thunder, 엑소 - 천둥 @2014 KMF Live ร้อนไปหมดดดด โอ้ยยยย https://www.youtube.com/watch?v=h8DQzwjFQKU&feature=share …",2016-12-24 14:25:35,812741028310458368
NBA: Thunders beat Celtics 117-112 # Iran # IranPower # Newspic.twitter.com/Y900cA7ULj,2016-12-24 14:25:33,812741017107447808
I liked a @ YouTube video http://youtu.be/3KZ3xstslwk?a WESTBROOK TAKES AD TO IN-N-OUT! OKLAHOMA CITY THUNDER vs NEW ORLEANS PELICANS,2016-12-24 14:24:55,812740858273525760
Listen and note daddyyo ain't just fire it's thunder and lightning # starboy daddyyo on repeat @ wizkidayo,2016-12-24 14:24:52,812740844793040896
,2016-12-24 14:24:15,812740692611043329
my brothers definition of a christmas movie is tropic thunder wtf,2016-12-24 14:24:14,812740688165081088
Best Tier 5 Heavy Tank in Game - T 10M - War Thunder Showcase: http://youtu.be/-dgpUSQFJds?a via @ YouTube,2016-12-24 14:24:06,812740653977391104
"Thunder fire u, I'm not drunk https://twitter.com/Omayowalemi/status/812740068158881792 …",2016-12-24 14:24:04,812740646209486848
"Raise your words, not your voice. It is rain that grows flowers, not thunder. # peace",2016-12-24 14:23:49,812740583538229248
@ slickbee War Thunder isn't making my Christmas very merry pic.twitter.com/qV2FUPGSOO,2016-12-24 14:23:06,812740400373006340
didn't get woken up by insanely loud thunder today. that's always good,2016-12-24 14:22:19,812740206981849088
"Мне понравилось видео ""1960 Cadillac Hearse ""Thunder Taker"""" (http://youtu.be/zVdA3lcQ0uE?a ) пользователя",2016-12-24 14:22:10,812740169229017089
lmaooooooo wtf is a thunder buddy,2016-12-24 14:21:43,812740053868933120
"[Videó] Thunder Show - Lent, de nem kint http://warthunder.hu/news/video-thunder-show---lent-de-nem-kint … http://fb.me/1IG1DnjA7",2016-12-24 14:21:42,812740051239051264
"Pikachu available until 14:51:20 (29m 48s). Thunder Shock / Thunderbolt (97.78% - 14/15/15) http://maps.google.com/maps?q=37.58709171158367,-77.50089149794817 …",2016-12-24 14:21:32,812740008352378880
Down to Dunk Ep. 303: Christmas Pod - Daily Thunder http://aggbot.com/Oklahoma-City-Thunber-News/article/29485552 …,2016-12-24 14:21:22,812739967025815553
I liked a @ YouTube video http://youtu.be/3KZ3xstslwk?a WESTBROOK TAKES AD TO IN-N-OUT! OKLAHOMA CITY THUNDER vs NEW ORLEANS PELICANS,2016-12-24 14:21:20,812739955957133312
"[Videó] Thunder Show - Lent, de nem kint http://warthunder.hu/news/video-thunder-show---lent-de-nem-kint … http://fb.me/5xV0P8rzK",2016-12-24 14:21:09,812739910801170432
Andre Roberson Has Become the OKC Minute Man by @ soakedinblue # Thunder # NBAhttp://thunderousintentions.com/2016/12/24/andre-roberson-okc-minute-man/ …,2016-12-24 14:20:28,812739739430383617
oe mais kawhi il est beau,2016-12-24 14:20:03,812739635227004928
"Мне понравилось видео ""Cash Game $25/50 NLH | Phil Hellmuth, Maria Ho | Thunder Valley |- Part 6 -| Livestream",2016-12-24 14:19:27,812739482260832256
i an your brother haha time to make thunder mad like all brothers do,2016-12-24 14:19:04,812739385061994498
"Видео ""War Thunder на Intel Xeon E5-2670 в паре с gtx1060"" (http://youtu.be/0eDRq1AgiGw?a ) на @ YouTube добавлено в",2016-12-24 14:18:51,812739332717080576
Seoul Knights - Seoul Thunders betting tip. Read in full >> http://zpr.io/PG4XF # basketball. Okay we're seeing a lot of points in this l,2016-12-24 14:18:35,812739263498489856
"Мне понравилось видео ""WAR THUNDER - Мы за СССР!"" (http://youtu.be/Ph7e9y1FB-0?a ) пользователя",2016-12-24 14:18:29,812739239859339264
# TheBestGiftIs black thunder dildo 3000,2016-12-24 14:18:05,812739139946876930
NBA: Thunders beat Celtics 117-112 http://www.presstv.ir/Detail/2016/12/24/503305/Thunders-beat-Celtics-117112 … # Iran # Syria # Ksa # Usa # Ukpic.twitter.com/VeisNJtn3A,2016-12-24 14:17:57,812739104332869632
SOARIN' BIG THUNDER MOUNTAIN RAILROAD SEVEN DWARFS MINE TRAIN STAR TOURS OLAF SPLASH MOUTAIN KILIMANJARO SAFARIS EVEREST,2016-12-24 14:17:38,812739025618538497
"Мне понравилось видео ""Cash Game $25/50 NLH | Phil Hellmuth, Maria Ho | Thunder Valley |- Part 5 -| Livestream",2016-12-24 14:17:27,812738981947473921
"Jolteon (28.89%-9/2/2,Thunder Shock/Thunder) Until 11:47:17 (29m 54s) http://maps.google.com/maps?q=33.90086296317731,-118.02496706580321 …",2016-12-24 14:17:22,812738961336463360
TWolves Thunder going to be a Basket fest RT @ WhateverFam_: Thunder vs twolves n clippers lakers God spare me lmao,2016-12-24 14:17:05,812738887881805824
Storms Thunder Stomp Gigantic Dragon :0,2016-12-24 14:17:03,812738879056965632
"Мне понравилось видео ""Cash Game $25/50 NLH | Phil Hellmuth, Maria Ho | Thunder Valley |- Part 4 -| Livestream",2016-12-24 14:16:45,812738804977205252
"Jolteon (35.56%-10/0/6,Thunder Shock/Thunder) Until 11:46:37 (29m 53s) http://maps.google.com/maps?q=33.91655776124175,-118.03457272545388 …",2016-12-24 14:16:44,812738798278713344
"H2O on Power. The Queen Of course, the Thunder From Down Under strippers are getting a",2016-12-24 14:16:44,812738798224375808
Durant en los Thunder...,2016-12-24 14:16:32,812738747787804673
"Raise your words, not voice. It is rain that grows flowers, not thunder. - Rumi # quote http://vitw.it/link/MPKMA",2016-12-24 14:15:45,812738550349361153
A study found that riding the Big Thunder Mountain Railroad roller coaster at Disney World helps ease the passage of small kidney stones.,2016-12-24 14:15:18,812738438537576448
"Pikachu (93.33%-15/14/13,Quick Attack/Thunder) Until 11:45:00 (29m 43s) http://maps.google.com/maps?q=33.936545513775116,-118.04692209317415 …",2016-12-24 14:15:16,812738431876878336
Duelos de # Navidad en la # NBA Warriors - Cavaliers Bulls - Spurs Celtics - Knicks Clippers - Lakers Timberwolves - Thunder pic.twitter.com/Liqbkyd47c,2016-12-24 14:15:10,812738407474614272
"A guy slapped my ass last night so with a face like thunder I said ""don't you fucking dare do that again""...fair to say he fucked off.",2016-12-24 14:14:55,812738342509039617
Thunder vs twolves n clippers lakers God spare me lmao,2016-12-24 14:14:29,812738234551861248
Would you rather have snow storms or thunder storms on Christmas? # OPD404 # ChristmasEve # Christmas,2016-12-24 14:14:27,812738224447688704
"Wolves won't practice today, will fly to OKC this afternoon, have Xmas Eve dinner together, shoot Xmas morning & play Thunder 7 pm tomorrow",2016-12-24 14:14:13,812738165664608256
"Magnemite 84.44% IV has appeared! A11/D13/S14, Thunder Shock/Thunderbolt. Available until 20:43:48 (29m 46s). http://maps.google.com/maps?q=55.70991046679253,13.193124522954681 …",2016-12-24 14:14:02,812738119313354752
Views from OKC: Thunder (Russell Westbrook) take down Boston # OKC https://serve.fans/r/7a3cd26b15 pic.twitter.com/jcZNPpoB5W,2016-12-24 14:13:57,812738099658784769
"The closer you draw to the mall of the atemporal rarissima, the easier it becomes for the monopods to steal your thunder.",2016-12-24 14:13:56,812738095053500416
"Lulu: ""First down the Moonflow to the Guado city of Guadosalam... Then we cross the Thunder Plains to the temple of Macalania.""",2016-12-24 14:13:40,812738028422590464
Thunder Lord - The Blood-Red Moon http://BarbWiresRadio.Com # Premier # HardRock Radio,2016-12-24 14:13:29,812737979953385477
"Pikachu appeared! IV: 53.33% (8/5/11). Moves: Quick Attack,Thunder. At 2309 9th Ave. 30m 11s left. http://maps.google.com/maps?q=33.82948081232984,-79.07090508480218 …",2016-12-24 14:13:27,812737972890169344
Not sure if thunder or Ein el helwe Merry christmas!!!,2016-12-24 14:13:21,812737949737558016
NASCAR Thunder 2003. PSX. https://youtu.be/CinJuVtdp3Y,2016-12-24 14:12:51,812737823728144384
"His thunder on thy head, devouring fire.",2016-12-24 14:11:17,812737430298054656
"Pikachu available until 14:37:41 (26m 26s). Quick Attack / Thunder (95.56% - 14/14/15) http://maps.google.com/maps?q=37.55371994537872,-77.45034230782441 …",2016-12-24 14:11:16,812737422421360642
2016 Racing Post Novices' Chase tips Back 7/4 Identity Thief to steal Min's thunder in Grade One showdown >http://www.racingtips.com/category/tips/leoparstown-boxing-day-racing-post-novices-chase-tips-20161223-0003/ …<pic.twitter.com/GqJ8irxiJn,2016-12-24 14:11:09,812737396173324288
"NBA 2K17 - Russell Westbrook And-One Runner | Thunder vs Knicks | November 28, 2016 | 2016-17 NBA: http://youtu.be/87WeoG3J8as?a via",2016-12-24 14:11:09,812737395959463936
I liked a @ YouTube video http://youtu.be/G36TSf0MtIo?a War Thunder Premium Review: Ki-100-II [Sharp Edged],2016-12-24 14:11:04,812737374547546113
ฉันชอบวิดีโอ @ YouTube http://youtu.be/gppfNn6hDy0?a 《SEXY》 Thunder (천둥) - Sign @인기가요 Inkigayo,2016-12-24 14:10:54,812737331723702272
Heir of Thunder by Karissa Laurel is out now! Check out the blog tour for a chance to # WIN a copy + Amazon GC! http://cbybookclub.blogspot.com/2016/12/blog-tour-promo-giveaway-heir-of.html?utm_source=feedburner&utm_medium=email&utm_campaign=Feed%3A+CBYBookClub+%28CBY+Book+Club%29 …,2016-12-24 14:10:37,812737261896957952
there's thunder & snow rn @mexico,2016-12-24 14:10:28,812737221069414400
"You will hear thunder and remember me, And think: she wanted storms. Anna Akhmatova http://fb.me/29ybC0v2K",2016-12-24 14:10:11,812737151548919808
"I liked a @ YouTube video http://youtu.be/ZC7zv62g6tI?a Thunder Tiger, Raptor E550 3 blade !",2016-12-24 14:10:00,812737104463667200
おもしろですか！？,2016-12-24 14:09:39,812737016089616385
Neues vom FGG Mitglied GrampyGames: Der Thunder Hammer - Let's Play Darksiders Warmastered... http://fb.me/1UBpebInE,2016-12-24 14:09:29,812736974784253952
MOST INSANE Custom Battle EVER - Volcano Team Death MATCH (War Thunder) - http://warthunder.princeonlinevideos.com/?p=803 pic.twitter.com/sI5wsVCMpv,2016-12-24 14:09:04,812736872141103104
"If they abrade the abandoned projects need pampering too. Watch it, he has the name of thunder these repairs were necessary.",2016-12-24 14:09:00,812736855200452608
I liked a @ YouTube video http://youtu.be/PC6tvZbaE7I?a Isaiah Thomas Gets Crushed By Steven Adams Screen | Thunder vs Celtics | 2016-17 NBA,2016-12-24 14:08:59,812736848980299776
TYPE 60 - 2 In The CHAMBER (War Thunder 1.65 Tanks Gameplay) - http://warthunder.princeonlinevideos.com/?p=802 pic.twitter.com/1vFLfqqzmn,2016-12-24 14:08:58,812736843938549760
i think i hear thunder rumbling out on the bay,2016-12-24 14:08:51,812736818001022976
"One of my best movie lines ""when am done with you, you are gonna eat lightning and crap thunder, you will the italian lightning stallion",2016-12-24 14:08:32,812736737327874048
Okc no thunder i let that ring fly https://twitter.com/woridstarlaugh/status/812728959888658434 …,2016-12-24 14:08:23,812736699302379520
"Raise your words, not voice. It is rain that grows flowers, not thunder. - Rumi # quote",2016-12-24 14:08:22,812736695204532224
♪Green grand~ Pink storm~ Blue splash~ Yellow thunder~ Red fire~~! 모험이 곧~ 시작된다~♪,2016-12-24 14:08:11,812736648135876608
"Мне понравилось видео ""Объект 906 ""УБИЙЦА на ПЛАВУ!"" War Thunder НОВИНКА!""",2016-12-24 14:08:05,812736621523177476
"He focused on the sound of thunder outside to try and stay awake, but her soft thumb on his cheek brought him back. ""Are -",2016-12-24 14:08:00,812736603793817600
"Yah they are. But email clients, even Thunder Bird can't bate Outlook",2016-12-24 14:07:34,812736491189313536
"Legend of Thunder Pack, Available Free to Killer Instinct Players Today http://bit.ly/2ijrEpp pic.twitter.com/tBLnSPqnBi",2016-12-24 14:07:31,812736480430931973
lmao I don't fuck with none of you liers nooooo more I thought we were all thunder buddies,2016-12-24 14:07:04,812736369017679872
"As a thunder, the lightning emblaze the gloomy world,- of this moment, his sister disappeared into thin air",2016-12-24 14:06:00,812736099151855616
だから新右衛門さん！！ナムサンダーは南無Thunderではないとあれほど言っているでしょ！私は雷の使い手ではありません！！！,2016-12-24 14:05:40,812736013038555136
"Soccer scheduling a 'nightmare' since Sports Dome collapse, says Thunder Bay coach http://upflow.co/l/UMLR pic.twitter.com/YtpFBR8A9r",2016-12-24 14:04:58,812735837523865600
God was invented by cave men to explain thunder.,2016-12-24 14:04:49,812735799464722432
"Thunder lagi sibuk,kangen?Dm/mention coba.sekian",2016-12-24 14:04:23,812735692585340928
The right way to start Christmas Eve. # NowPlaying Thunder Kiss '65 by White Zombie. https://shz.am/t5244871,2016-12-24 14:04:02,812735604278427648
Call of Duty Black ops 3|8 man with rolling thunder|Gorgon gameplay.: http://youtu.be/1-H3VgOKk8c?a prin @ YouTube,2016-12-24 14:04:01,812735598431760384
Known all the words since I was a wee girl # NowPlaying Thunder Road by Bruce Springsteen ♫ http://spoti.fi/JMVb76,2016-12-24 14:03:55,812735573148438528
"Pikachu has appeared! Expected despawn: 01:33:39pm(29m 49s) IV:86.67% (12/12/15) Moves:Quick Attack, Thunder http://maps.google.com/maps?q=29.67910552897666,-95.49068499895225 …",2016-12-24 14:03:49,812735550998323201
"I liked a @ YouTube video http://youtu.be/rmvs4hwO4OM?a Thunder Tiger, Raptor E550 3 blade, first hover !",2016-12-24 14:03:39,812735505905360897
Oklahoma City Thunder vs. New Orleans Pelicans The top scorers in the # NBA go head-to-head on Wednesday ni https://is.gd/t7GJ0C # betnba,2016-12-24 14:03:12,812735393548406784
bones; « the heart of cremation » « smoking and rolling » « rest in peace » « corduroy » « thunder »,2016-12-24 14:02:07,812735120935452673
War Thunderフレンド募集中！！ 名前 CURURU ヌーブプレイヤーでもよければお願いします！！,2016-12-24 14:02:06,812735118947160065
Russell Westbrook and the Oklahoma City Thunder will add even more highlights to this clip after tomorrow's game! http://fb.me/7KoGH6rXj,2016-12-24 14:02:03,812735104250417152
"Attente sous moy.journ.:Big Thunder Mountain(30m), Carrousel de Lancelot(Le)(5m), Dumbo the Flying Elephant(15m)[1/2]",2016-12-24 14:01:07,812734869537247232
JOEY THUNDER TWEETED ME Y'ALL IM IN LOVE,2016-12-24 14:00:45,812734778097090560
"I liked a @ YouTube video http://youtu.be/TFUsTmoDfbU?a Erstflugversuch.Thunder Tiger, Raptor E550 3 Blade !",2016-12-24 14:00:41,812734762691555328
@ Treyarch I shouldn't be kicked from the game because my team couldn't get out of the way of my rolling thunder on hardcore,2016-12-24 14:00:38,812734746547617792
THUNDER GUN YOUR THE BEST - 16 - Earth Defense Force 4.1 http://youtu.be/uxz4V6dXcv8?a,2016-12-24 14:00:28,812734704948543488
"Next week The ThunderFunk Revue""featuring members of Sexual Thunder!, are in town. Will you be there? http://ticketf.ly/2h5OWTk",2016-12-24 14:00:17,812734660601987072
"Raise your words, not voice. It is rain that grows flowers, not thunder. - Rumi # quote",2016-12-24 14:00:07,812734619900579840
Der Thunder Hammer - Let's Play Darksiders Warmastered [#13][HD][german][facecam]: http://youtu.be/-3FnC9vTp8k?a über @ YouTube,2016-12-24 14:00:07,812734618545909762
"TIME for a look back over our work week! Pictured: Thunder, Snickerdoodle, Baylee, Moose, and Caesar. http://fb.me/3uNeeLiCa",2016-12-24 14:00:02,812734595984658433
oomf got the brazy stupid thunder thighs...,2016-12-24 13:59:36,812734487318659072
"Raise your words, not your voice. It is rain that grows flowers, not thunder.",2016-12-24 13:59:28,812734452937830400
Millions of miles from home In the swirling swimming on When I'm rolling with the thunder But bleed from thorns... http://fb.me/624jeZkpE,2016-12-24 13:58:46,812734276533948416
Life hack: Thunder Bay doesn't have Uber but random people will drive you home if you give them money,2016-12-24 13:58:20,812734170699091973
Akh the sound of rain and thunder beats the best musical piece ever composed,2016-12-24 13:58:20,812734168949985280
war thunderのガレージもクリスマス仕様や pic.twitter.com/L03HwgqwM8,2016-12-24 13:58:15,812734150331334656
That was dumb. Now Thor has the angry face. ...Is that thunder I hear?,2016-12-24 13:58:02,812734094207578112
LAT'S PLAY ПО WAR THUNDER...ИГРАЮ ЛУЧШЕ ЧЕМ УМЕЮ...: http://youtu.be/FRCbSbWL-l0?a на @ YouTube,2016-12-24 13:58:02,812734093624569857
"Raise your words, not voice. It is rain that grows flowers, not thunder. - Rumi # quote",2016-12-24 13:56:44,812733766582071296
"Russell Westbrook 46 Pts Highlights | Hawks vs Thunder | December 19, 2016 | 2016-17 NBA Season https://youtu.be/tjxaWZcgcS8",2016-12-24 13:56:34,812733726224482304
Your favorite coach is a big thunder fan... just sayin https://twitter.com/lillymatthews18/status/812696083340070912 …,2016-12-24 13:56:19,812733660566814720
"Lets the thunder roll and shake the heavens, adding on to the HYPE. ""GOOD!"" @ CelestialSaiyan",2016-12-24 13:56:17,812733655072309248
"Pikachu 84.44% IV has appeared! A14/D15/S9, Thunder Shock/Discharge. Available until 20:24:43 (28m 45s). http://maps.google.com/maps?q=55.689354184295,13.210672050921373 …",2016-12-24 13:55:58,812733574508068864
Wow. Just set in that I could possibly have 1K views for this month on Ray Thunder! What a way to end 2016..!,2016-12-24 13:55:52,812733547882627073
A Five Star # review of Through Thunder and Light http://www.amazon.com/Through-Thunder-Light-Daniel-Maldonado/product-reviews/1511610263/ … # asmsg # ebooks # ibooks # audible,2016-12-24 13:55:30,812733456513830912
Thunder @Martes Do Kifangondo https://www.instagram.com/p/BOaSOjHluZh/,2016-12-24 13:55:20,812733414671601665
U12/U14 # Cheshire # Netball Classes. FREE TASTER 9th Jan @ WhitbyHigh http://ow.ly/RiCW3076mNfCoached … by Manchester Thunder's @sophieloumorgan pic.twitter.com/CeaebtAAIL,2016-12-24 13:55:11,812733377002487808
A Five Star # review of Through Thunder and Light http://www.amazon.com/Through-Thunder-Light-Daniel-Maldonado/product-reviews/1511610263/ … # asmsg # ebooks # ibooks # kindle,2016-12-24 13:55:02,812733338641256448
and it will comes up so fast like a thunder and I'll be lyk 'when tf you come dude?',2016-12-24 13:54:48,812733278515904512
A Five Star # review of Through Thunder and Light http://www.amazon.com/Through-Thunder-Light-Daniel-Maldonado/product-reviews/1511610263/ … # asmsg # ebooks # ibooks # kobo,2016-12-24 13:54:46,812733273461788672
"too bad,seems like they took the thunder outta the whole season huh? Haven't seen it yet. Ironically too busy with Titanfall",2016-12-24 13:54:44,812733262279876608
# NBA | Un inconmensurable Westbrook aplasta a los Celtics (117-112): http://dlvr.it/MyLvH2 pic.twitter.com/MI1wjq6v9K # Celtics # Thunder,2016-12-24 13:54:28,812733194973941760
A Five Star # review of Through Thunder and Light http://www.amazon.com/Through-Thunder-Light-Daniel-Maldonado/product-reviews/1511610263/ … # asmsg # ebooks # ibooks,2016-12-24 13:54:08,812733111637135360
A Five Star # review of Through Thunder and Light http://www.amazon.com/Through-Thunder-Light-Daniel-Maldonado/product-reviews/1511610263/ … # asmsg # ebooks # ibooks # nook,2016-12-24 13:53:58,812733069538906112
"Jolteon (55.56%-7/9/9,Thunder Shock/Thunder) Until 11:23:19 (29m 43s) http://maps.google.com/maps?q=33.899328460270084,-118.00740108520287 …",2016-12-24 13:53:35,812732973501952000
I look forward to seeing Ford GT’s thunder round @ SilverstoneUK in a few short months once again racing against Ferrari in @ FIAWEC # marshal,2016-12-24 13:53:30,812732954921336832
Hate is a train that thunders aimless through my head!,2016-12-24 13:52:07,812732603346419712
Thunder can typically be heard up to 16 km (10 miles) away. From 1Weather for Android. http://bit.ly/1Wtweet,2016-12-24 13:51:52,812732543120408576
I think the @ Ambitiouz_Ent team sole the thunder and murdered 2016 I solute and rate them 10 out of 10 for the performance # AmbitiouzTunes,2016-12-24 13:51:52,812732542663229441
"I liked a @ YouTube video http://youtu.be/OAJURvo_ZSs?a Isaiah Thomas Full Highlights vs Thunder (2016.12.23) - 34 Pts, 10 Ast",2016-12-24 13:51:35,812732469820739584
"[Sembawang] Wild Raichu spotted at 44 Senoko Dr!68%, Spark/Thunder Punch. Disappears 03:20:00 (29m 17s). http://maps.google.com/maps?q=1.46347206,103.80482683 …",2016-12-24 13:50:46,812732263666503680
Russ has led the Thunder to a 18-12 record ... once they get Cameron Payne back that's whole other dimension added to that team,2016-12-24 13:50:39,812732233933004800
"Мне понравилось видео ""War Thunder стиснув зубы |наземка + воздух | 18+""",2016-12-24 13:50:36,812732223401168896
If you hear thunder don't worry it's Owen's christmas thwaps across the sky but you WONT HEAR THEM BECAUSE HE ISNT COMING,2016-12-24 13:50:36,812732221492633600
"""Will they let me in if I don't buy stuff with their name on it?"" - Mom on buying Thunder gear",2016-12-24 13:50:15,812732136331612160
break up $50...Bet a few parley outcomes (20-1 payout) if you are on the fence on let's say wolves/thunder and Cavs/warriors,2016-12-24 13:50:13,812732124725772288
Πρόσθεσα ένα βίντεο σε ένα playlist @ YouTube http://youtu.be/nYop13nYRQ4?a AMV Eneru - Lord of the thunder,2016-12-24 13:50:08,812732106510110720
Μου άρεσε ένα βίντεο @ YouTube http://youtu.be/nYop13nYRQ4?a AMV Eneru - Lord of the thunder,2016-12-24 13:50:00,812732070518784000
# NowPlaying Thunder Kiss '65 de White Zombie ♫ http://spoti.fi/KmOQzy,2016-12-24 13:49:56,812732055758905344
Pokémon Go. Block me and thunders will congregate to strike you. https://twitter.com/ThatTallchic_/status/812731716943101953 …,2016-12-24 13:49:53,812732041422897152
Me too fasi huyi...ruko haaa neil armstrg n thunder thighs...n shona...dnt b naughty...b nice...santa s watchgggg,2016-12-24 13:49:34,812731962087669760
Sad news about Rick Parfitt RIP Rick I'm sure when we hear thunder we will think of you. To Rick's family please accept our condolences,2016-12-24 13:49:33,812731958660911106
そらそうよ． 今度，何か振る舞うよ．,2016-12-24 13:49:17,812731892772388865
"Raichu available until 13:49:24 (0m 11s). Thunder Shock / Brick Break (57.78% - 11/4/11) http://maps.google.com/maps?q=37.42040964194882,-77.63531116412598 …",2016-12-24 13:49:13,812731875349450753
Make it rain call me thunder man,2016-12-24 13:48:45,812731755883089920
I can feel the thunder that's breaking in your heart,2016-12-24 13:48:30,812731694247776256
Fatty scared of thunder pic.twitter.com/GSogIKP4rG,2016-12-24 13:48:18,812731646155726848
"you zap it with the thunder that's going on once he lifts his sword, then he splits and you take down the tails with fire",2016-12-24 13:48:10,812731612030967808
i don't even like tea fr but I do drink it when it's offered...,2016-12-24 13:47:51,812731531798151168
War Thunder-Crimbo Compilation: http://youtu.be/ufXKbht9sJs?a via @ YouTube,2016-12-24 13:47:47,812731513766903808
Had a bit of a cry earlier for obvious reasons...Just got off of Thunder Mountain and I'm feeling a good bit better,2016-12-24 13:47:26,812731424939929600
tropic thunder for two @Commissary https://www.instagram.com/p/BOaRTCNgaIk/,2016-12-24 13:47:10,812731360787988484
〔War thunder〕B 17で空母に着艦してみた成功編 https://www.youtube.com/watch?v=MLwhnhG_y2w … まさか成功するとは思っていませんでしたｗ,2016-12-24 13:47:02,812731324880424960
"Jolteon (73.33%-11/8/14,Thunder Shock/Discharge) Until 11:16:36 (29m 54s) http://maps.google.com/maps?q=33.90415216632324,-118.01911193213041 …",2016-12-24 13:46:41,812731237324374016
afro thunder!!!,2016-12-24 13:46:37,812731222761885696
Happy Voices Wake The Sky . wish tonight heaven would show earth the real voice of happy guns when thunder... http://fb.me/8x7t0Yv7T,2016-12-24 13:46:35,812731213723168768
thunder thunder thunder,2016-12-24 13:46:31,812731196782223361
I liked a @ YouTube video from @the_exiled_ http://youtu.be/K4nnDThU_vA?a 2CE Minitage For Thunder | By Panda,2016-12-24 13:46:02,812731072505147392
New @ MumfordAndSons video for - Believe (Performed on Live From South Africa: Dust And Thunder) http://buff.ly/2i2vCUq,2016-12-24 13:46:00,812731064682680320
文字コーガくん めっちゃうまかった．,2016-12-24 13:45:10,812730857593016320
NBA 2K17 Play Now 4K - Russell Westbrook Posters! Thunder PS4 Pro https://www.youtube.com/watch?v=KQWw19j7m6Q&feature=share …,2016-12-24 13:45:04,812730828790886400
@ SneakerReporter happy born day!! God bless and Merry Christmas! Go Pats and Thunder up!,2016-12-24 13:44:41,812730734943338498
