text,date,id
THUNDER の新曲、ツェッペリンの The Song Remains The Same にそっくりだったなーー・・,2016-12-24 13:00:57,812719727244025857
Thunder fire you there https://twitter.com/iam_NORIS/status/812715811081175040 …,2016-12-24 13:00:44,812719672088924160
Delicious Thunder - Rubro vuurwerk: http://youtu.be/K7z6FWyBX4E?a via @ YouTube,2016-12-24 13:00:24,812719588240592896
I added a video to a @ YouTube playlist http://youtu.be/K7z6FWyBX4E?a Delicious Thunder - Rubro vuurwerk,2016-12-24 13:00:23,812719587171045376
"Views from OKC: Thunder, aka Westbrook beat Celts http://thunderousintentions.com/2016/12/24/okc-thunder-news-westbrook-boston/ …",2016-12-24 13:00:12,812719538575798272
Rain & thunder in December???? y'all we need to pray.,2016-12-24 13:00:01,812719493898244096
not sure if that's thunder or big rigs driving on the freeway # perksoflivingoffthe57,2016-12-24 12:59:43,812719416748052480
"Dear # WhiskySanta, please may I have Thunder Toffee Vodka from @ MasterofMalt for Christmas. I've been good!https://www.masterofmalt.com/vodka/thunder-toffee-vodka/ …",2016-12-24 12:59:39,812719402907013120
yaahh stok kopi nji abis sih eon,2016-12-24 12:58:55,812719215106895872
Keep in mind: The Thunder are the third-youngest team in the league. What if Sabonis is a star in year three?,2016-12-24 12:58:53,812719209650208769
"Pikachu available until 13:25:49 (27m 0s). Thunder Shock / Thunderbolt (93.33% - 14/13/15) http://maps.google.com/maps?q=37.24514456860411,-79.95183978737337 …",2016-12-24 12:58:50,812719194437455872
"Thunder, 2 year old male, 48 lb, available for adoption or rescue 12/29 http://fb.me/5Er0n6KZ5",2016-12-24 12:58:43,812719168340496385
"Raise your words, not your voice. It is rain that grows flowers, not thunder.",2016-12-24 12:58:02,812718992754442240
thunder boltすらないです笑 完全に新規格ですねー,2016-12-24 12:57:55,812718963528437760
OI THUNDER BACK OFF HES MY DADDY NOW :3,2016-12-24 12:57:54,812718960554766336
Hallo thunder oppa '3')/ https://twitter.com/YLThunder90/status/812685963277127680 …,2016-12-24 12:57:49,812718939306233856
逆に減速したあとに落ちる(ノω｀)攻撃中にパイプに当たったり一気に引き離されたり,2016-12-24 12:57:47,812718930061979648
ok ngl I feel great about this meme and I can officially return to oblivion in peace. MERRY CHRISTMAS EVERYONE VANILLA THUNDER OUT,2016-12-24 12:57:20,812718817021399041
"Raise your words, not voice. It is rain that grows flowers, not thunder. - Rumi # quote",2016-12-24 12:57:06,812718760025001985
Gostei de um vídeo @ YouTube de @ pooldosk1 http://youtu.be/yYgM6uDVK-I?a HG - G0D OF THUNDER! MacroSkills!,2016-12-24 12:56:51,812718698054053888
"Pikachu (82.22%-14/12/11,Thunder Shock/Thunderbolt) Until 10:25:20 (29m 43s) http://maps.google.com/maps?q=33.933603197552976,-118.03347496215095 …",2016-12-24 12:55:37,812718384253022208
High-scoring Alvark end Brave Thunders’ 15-game winning streak http://asiasports.business/high-scoring-alvark-end-brave-thunders-15-game-winning-streak/ …,2016-12-24 12:55:32,812718366536400897
SAN ANTONIO SPURS HOST THE OKLAHOMA CITY THUNDER ON SATURDAY FOR... https://goo.gl/fb/V5W8ST # oklahomacitythunder,2016-12-24 12:55:27,812718343178240004
I liked a @ YouTube video http://youtu.be/t6DjI4Ut-PU?a Top 10 PK Thunders - Super Smash Bros for Wii U,2016-12-24 12:55:22,812718325184622592
It's so black and white he's stealin your thunder,2016-12-24 12:55:11,812718277923373060
I read Thunder Rolls by Dee Davis https://www.goodreads.com/review/show?id=1698425794 …,2016-12-24 12:55:06,812718257207738368
Basketball Dream NBA Oklahoma City Thunder: Steven Adams Trucks Isaiah Thomas While Setting Screen... http://fb.me/VVqhenRc,2016-12-24 12:55:03,812718243064516608
The thunder play tomorrow,2016-12-24 12:54:58,812718220520071169
"gosh, didn’t think the 15/16 thunder needed to be rebooted",2016-12-24 12:54:50,812718188571963392
Sleep Sleep tonight And may your dreams Be realized If the thunder cloud Passes rain So let it rain Rain down on him... # RickParfitt,2016-12-24 12:54:39,812718144791912448
"Jolteon (60.00%-15/5/7,Thunder Shock/Discharge) Until 10:24:22 (29m 44s) http://maps.google.com/maps?q=33.91257539181098,-117.99697046241923 …",2016-12-24 12:54:38,812718139733483520
@ Thunder_Ball_98 هاه الى الحين ما تثق في التقييمات ؟,2016-12-24 12:54:10,812718022804799488
He's stealing your thunder baby blue ain't your color,2016-12-24 12:53:50,812717938608177152
"quit trying to steal my thunder, LuLu...",2016-12-24 12:53:40,812717897512521729
War Thunder SB： Fw.190 Movie https://youtu.be/HcTmyqiPgDY @ YouTubeさんから,2016-12-24 12:53:31,812717857360314368
iya pake itu nji,2016-12-24 12:53:23,812717826087624705
tidur sono,2016-12-24 12:53:01,812717731556376576
Who knew Vanessa Hudgens was in the thunder birds,2016-12-24 12:52:24,812717577231368192
Thunder loves Posing https://shar.es/1DvidQ Guys for him! @ RoyalCanin @ petfedindia,2016-12-24 12:51:33,812717364278099976
"Pikachu has appeared! Expected despawn: 12:20:20pm(28m 52s) IV:91.11% (13/15/13) Moves:Quick Attack, Thunder http://maps.google.com/maps?q=29.673456921182407,-95.45914720711133 …",2016-12-24 12:51:28,812717340148178944
Nicknames are great There goes her thunder If only to remember a name,2016-12-24 12:51:27,812717338143453189
"Teigiamai įvertinau „ @ YouTube“ vaizdo įrašą http://youtu.be/35yoPuN3BsU?a „Atranką į Privatų serverį ""Thunder Bird"". Viskas",2016-12-24 12:50:50,812717182836621312
mempannya pake kopi yaa eon? Wkakaka,2016-12-24 12:50:30,812717098212302850
"Electabuzz available until 13:12:01 (21m 47s). Thunder Shock / Thunder Punch (91.11% - 15/11/15) http://maps.google.com/maps?q=37.52577683148597,-77.42075532761639 …",2016-12-24 12:50:17,812717045649383424
hahaha besok bangunnya siang yaa bang wkakak,2016-12-24 12:50:13,812717029169823744
"Gostei de um vídeo @ YouTube de @ dawkinsmta http://youtu.be/h6pF40vqqF0?a Isaiah Thomas Full Highlights 2016.12.23 vs Thunder - 34 Pts, 10",2016-12-24 12:50:05,812716994810085376
its raining from yesterday with non stop Lightning and thunder Merry Christmas to all ⚘ — feeling freezing,2016-12-24 12:49:30,812716847900590081
"A screw that holds Thunder Tower together. Even if 5 or 6 of them come loose, it's no big deal.",2016-12-24 12:49:13,812716777570324480
Ik vind een @ YouTube-video leuk: http://youtu.be/XhplltR0G-E?a Thunder 1 broekhof vuurwerk,2016-12-24 12:48:54,812716697253605376
"I haven't heard any thunder yet, but plenty of rain!",2016-12-24 12:48:52,812716686239526916
All those girls that will b stealing someone's bestfriend all the name of relationship.The thunder that will strike you is doin 3months I.t,2016-12-24 12:48:39,812716634628624384
Poolside today. Periodically thunder storming and high winds on the beach. This works pretty… https://www.instagram.com/p/BOaKj81B1Ca/,2016-12-24 12:48:20,812716553363804161
헐 썬더님이 부르신거예요!?!,2016-12-24 12:47:10,812716259737411584
If Kd was till at the thunder then Russ would not have the numbers that he does now,2016-12-24 12:46:52,812716183065657344
THUNDER ARE YOU PUTTING US UNDER?????????,2016-12-24 12:46:40,812716132461412352
kasih tau coba :3,2016-12-24 12:46:36,812716117324021761
Russell Westbrook’s latest triple-double lifts Oklahoma City Thunder over Celtics at the Garden http://dlvr.it/MyL9tz pic.twitter.com/vVknXvEmTo,2016-12-24 12:46:14,812716024504074240
boleh juga hehe belum tidur kamunya?,2016-12-24 12:46:12,812716018346835972
"Me: *Goes Sati-Savitri mode* I promise I'd NEVER use this info to get into her pants! *Random clips of thunder, lightning & hurricane in BG*",2016-12-24 12:45:27,812715825995993088
Lyft is partnering with you & giving you 10 free rides Special Lyft Code ZOOT >> Thunder Valley Casino Resort # california,2016-12-24 12:45:23,812715810728906752
It keeps thundering i love the fact that i can take snaps of it cuz like i catch it since thunder is so slow whwjajje,2016-12-24 12:45:20,812715798821212160
Check out the comic Ray Thunder :: Happy Holidays from Team Thunder https://tapastic.com/episode/544811 via @ tapas_app # ComicBookHour # Christmas,2016-12-24 12:45:09,812715752381968384
"Boston’s four-game winning streak was snapped by the Thunder Friday night, but B... # Celtics http://www.nba.com/celtics/video/postgame/report2-vsokc-122316 …pic.twitter.com/ZFns9CsdtT",2016-12-24 12:44:57,812715702553575424
"With 10-0 run, # Thunder top # Celtics 117-112 http://www.cbssports.com/nba/gametracker/recap/NBA_20161223_OKC@BOS …",2016-12-24 12:44:52,812715678830645248
"HammerFall - Crimson Thunder (Live at Lisebergshallen, Sweden, 2003) 108... http://ln.is/www.youtube.com/gwuxr … via @ YouTube",2016-12-24 12:44:50,812715671528292352
"Boston’s four-game winning streak was snapped by the Thunder Friday night, but B... # Celtics http://www.nba.com/celtics/video/postgame/report2-vsokc-122316 …pic.twitter.com/UuhLmkGtu7",2016-12-24 12:44:43,812715643023851520
"Boston’s four-game winning streak was snapped by the Thunder Friday night, but B... # Celtics http://www.nba.com/celtics/video/postgame/report2-vsokc-122316 …pic.twitter.com/p5uuDW7iK7",2016-12-24 12:44:35,812715608362127360
and thunder strike killing from 2 counties over,2016-12-24 12:44:27,812715574228701185
Tulsa b4 okla thunder moved in had very low crime... thunder came,2016-12-24 12:44:20,812715546722574340
merry christmas boi @ Thunder_SL,2016-12-24 12:44:20,812715545170558980
I think his best character was tropic thunder,2016-12-24 12:44:01,812715467244707841
wah salfok ya ke eunji,2016-12-24 12:43:48,812715413939240960
we're gonna steal their thunder,2016-12-24 12:43:45,812715400576253952
"Pikachu available until 13:13:22 (29m 46s). Thunder Shock / Thunderbolt (91.11% - 11/15/15) http://maps.google.com/maps?q=37.61714485990572,-77.51531722095676 …",2016-12-24 12:43:36,812715362613690368
# GiftIdeas 6 Oklahoma City Thunder Tickets 12/25 vs Minnesota Timberwolves $55 PER TICKET http://rover.ebay.com/rover/1/711-53200-19255-0/1?ff3=2&toolid=10039&campid=5337688761&item=302175906732&vectorid=229466&lgeo=1&utm_source=dlvr.it&utm_medium=twitter … # ChristmasPresents,2016-12-24 12:43:17,812715281655033856
# Tickets # Events 6 Oklahoma City Thunder Tickets 12/25 vs Minnesota Timberwolves $55 PER TICKET http://rover.ebay.com/rover/1/711-53200-19255-0/1?ff3=2&toolid=10039&campid=5337688761&item=302175906732&vectorid=229466&lgeo=1&utm_source=dlvr.it&utm_medium=twitter … # Christmas # Gifts,2016-12-24 12:43:17,812715280367382528
"Issued at 2016-12-24 12:30PM EST by Environment Canada: Winter storm watch continued for: City of Thunder Bay,... http://fb.me/7hwdsoXOC",2016-12-24 12:43:08,812715244158074880
"J'aime trop comment t'as Thunder et (insérer nom de monsieur que je connais pas), et au dessus y a Léna à 24 mentions de plus https://twitter.com/BaraconCarne/status/812713639094255616 …",2016-12-24 12:42:50,812715169298206720
ナイターでスノボをしましょう,2016-12-24 12:42:37,812715112570064897
"She didn't have to share. Their parents didn't teach they begging ass manners, esp lil future felony ass thunder thighs https://twitter.com/FameAdventura/status/812687659558719488 …",2016-12-24 12:42:26,812715068349677568
"Pikachu available until 13:10:20 (28m 22s). Thunder Shock / Discharge (93.33% - 15/15/12) http://maps.google.com/maps?q=37.250167991314676,-80.02550278817962 …",2016-12-24 12:41:58,812714951353761792
Bdw cat pack member - Thunder # brownstonecatpack # catsofinstagram # cat # brownstonedogwalkers # parkslope... http://fb.me/5Tyjrdyc7,2016-12-24 12:41:45,812714898006429697
please don't disrespect Days of Thunder.,2016-12-24 12:41:37,812714862317080576
意識高い系はバカにすればいいのよ。見てこのみんなオイラ世代の嬉しそうな顔。Ch-Masayoshi Takanaka - 天龍源一郎 引退 (THUNDER STORM)-2015 (高中正義) http://ln.is/www.youtube.com/y0vlc … @ YouTubeさんから,2016-12-24 12:41:30,812714835012153344
tropic thunder,2016-12-24 12:41:16,812714774882648065
"hanya beda beberapa bulan saja, Gayoon mei Cheondung oktober kan?",2016-12-24 12:41:13,812714763465568256
Motörhead - Thunder & Lightning https://youtu.be/4hNQxMqZLbM,2016-12-24 12:41:09,812714747007209473
Check out my broadcast from my PlayStation 4! # PS4live (War Thunder) live at https://www.twitch.tv/tweety6925,2016-12-24 12:41:06,812714731869970432
Serving the less fortunate on Christmas Eve with the Fam..... Thunder Baseball Group always in the 805.... pic.twitter.com/kG0vi2aQAN,2016-12-24 12:41:01,812714714044039168
"@ ThunderLogo has been a good friend to me,he deserves better than having http://hate.Read this Thunder ily",2016-12-24 12:41:01,812714713733824512
tropic thunder?,2016-12-24 12:40:58,812714699988955136
nuna tidak menyuruh mu tidur loh -_-,2016-12-24 12:40:30,812714580551954432
thankyou sanghyunssi!,2016-12-24 12:40:14,812714513451479040
ga ngerti cara mainnya bang :3,2016-12-24 12:40:03,812714467838464000
"Thunder trio is working today: Big bad Steve, Lightnin' L, & Kid Sunshine. Ready for your super last-minute shopping.",2016-12-24 12:40:00,812714457566679041
Only 5 hrs left on shift today Black Ice and OV flash sale until 2pm also Thunder cat alumni carrying pints to cars thnx boys @ DurhamTCats,2016-12-24 12:39:59,812714453636628480
Me? Caster Mage from Fairy Tail and the leader of Raijinshu (Thunder God Tribe) # ÉcritureBot,2016-12-24 12:39:58,812714448557178880
Thin Lizzy Thunder and Lightning Tour - The Last Filmed Performance https://youtu.be/IqQHbBPYeC0 via @ YouTube,2016-12-24 12:39:40,812714370631405568
They are too busy counting their money and crying about the Thunder inside where it's warm.,2016-12-24 12:39:26,812714315287564288
kaga adaaa petir oppa,2016-12-24 12:38:41,812714124626903040
Chronic thunder (f31) - http://ift.tt/2i378tY,2016-12-24 12:38:25,812714059749462016
the Goddess of thunder.,2016-12-24 12:38:16,812714018406178816
Hra War Thunder je vydána! http://tinyurl.com/jkhgq7u http://fb.me/1DLyd41wj,2016-12-24 12:37:32,812713837069635584
Thunder Agents comic books no.19 Tower Double Size Action Series Lot of 2 http://dlvr.it/MyL4ZT # forsalepic.twitter.com/To91MYx3B8,2016-12-24 12:37:25,812713805222264833
Kasih dia kopi nji biar tidur RT @WLK_eunji93: @WLK_Thunder tidur bang udh malem wkwkwk,2016-12-24 12:37:13,812713756895559680
Delicious Thunder - Rubro vuurwerk: http://youtu.be/y2kIZ117eWU?a via @ YouTube,2016-12-24 12:37:03,812713715283861504
So here's Russ dunking the star on top of a Christmas tree. It's as cool as it sounds. # Thunder https://instagram.com/p/BOZ6ft1Aopt/,2016-12-24 12:37:02,812713707822346241
Thunder cats http://fb.me/5nNxy9YwE,2016-12-24 12:36:54,812713674175561728
noona? i'm not older than you anyway :'D,2016-12-24 12:36:39,812713614041751552
@WLK_Thunder @WLK_Naryoung @ WLK_JM95 @WLK_RYU97 @WLK_Sally96 @ WLK_Heejin @WLK_Hyeju @WLK_DWoon91 @WLK_VBTS follback?,2016-12-24 12:35:37,812713353273430016
"I will hit every thunder, hydro pump even a fucking zap cannon. But god forgive me if I want ONE FUCKING ICICLE CRASH TO HIT",2016-12-24 12:35:12,812713250165051392
thanks for stealing my thunder for my tweet tomorrow,2016-12-24 12:35:00,812713197950173184
oldu çöp,2016-12-24 12:34:42,812713123345997825
Merry chrismukkah from Thunder Bay! A few days ago I went on a mission to find a menorah to be able to do... http://fb.me/4b3eealtB,2016-12-24 12:34:25,812713051552186368
Es normal que a mi edad siga gritando y cantando ♪♫Thunder... Thunder... thundeeeer.... caaaaattsssssss oooooooh!♪♫ # feliznavidadpic.twitter.com/VOguOEp0tT,2016-12-24 12:34:23,812713043226480642
Merry chrismukkah from Thunder Bay! A few days ago I went on a mission to find a menorah to be… https://www.instagram.com/p/BOaI90AA56C/,2016-12-24 12:34:22,812713039485091840
"Thunder's just a noise, boys lightnin' does the work",2016-12-24 12:34:12,812712994937380865
,2016-12-24 12:34:00,812712947621371904
"@ packers you got this. Cheering you guys on from Thunder Bay, Canada. # PackersRollCall # PackersVsVikings # ChristmasEveFootball",2016-12-24 12:33:57,812712934057119745
tidur bang udh malem wkwkwk,2016-12-24 12:33:48,812712894978629632
@ ofctimallen random question Tim but were you at the Celtics/Thunder game last night? (Dec. 23rd),2016-12-24 12:33:06,812712720860581888
"Electabuzz appeared! IV: 66.67% (9/7/14). Moves: Low Kick,Thunder Punch. At 98 N Ocean Blvd. 11m 58s left. http://maps.google.com/maps?q=33.818159633550444,-78.6718289818662 …",2016-12-24 12:33:06,812712718486605824
"Raise your words, not voice. It is rain that grows flowers, not thunder. - Rumi # quote # childcareexpert",2016-12-24 12:32:48,812712643047866369
らいめい 自称パルテナの神の サブアカウントです！ つぶやかれることはもうないだろう！！ @ RAIMEI_THUNDER,2016-12-24 12:32:43,812712622801887233
"Raichu (46.67%-2/7/12,Thunder Shock/Brick Break) Until 10:01:57 (29m 43s) http://maps.google.com/maps?q=33.90967355112539,-118.01755662975857 …",2016-12-24 12:32:14,812712502874120192
they still waiting for Ibra to come down from the clouds on a thunder bolt,2016-12-24 12:32:14,812712500324077568
"yang buat gamenya :( ,kalo gamenya itu doang mah cukup tpi kalo ada app lain kayaknya engga,liat aja di ram bg apa aja yg jalan",2016-12-24 12:32:10,812712484876349440
@ ImagenTVMex thunder thunder thunder thunder caaaaaaaats ..!,2016-12-24 12:32:07,812712472553472000
"Aşağıda ciğer nasıl yakılır yaşanmış örneklerle gösterdim, incelersiniz.",2016-12-24 12:31:54,812712418174533632
"Ik vind een @ YouTube-video leuk: http://youtu.be/rwE9H8Zt4WI?a Oklahoma City Thunder vs Boston Celtics - Full Game Highlights | Dec 23, 2016",2016-12-24 12:31:50,812712402496040960
Make it rain call me thunder man,2016-12-24 12:31:12,812712242215055363
"Wait below daily avg.:Big Thunder Mountain(30m), Disneyland Railroad Frontier Depot(15m), Dumbo the Flying Elephant(15m)[1/4]",2016-12-24 12:31:08,812712223839817729
Just posted a photo @Thunder Mtn. https://www.instagram.com/p/BOaIlyEBl40/,2016-12-24 12:31:07,812712219842490368
"engga, suka liatin temen main aja",2016-12-24 12:30:54,812712165983404032
when you give me that thunder you make my summer rain,2016-12-24 12:30:53,812712161910915072
"NBA 2K17 - Derrick Rose 30 Pts Highlights | Thunder vs Knicks | November 28, 2016 | 2016-17 NBA: http://youtu.be/6qyj16yujEk?a via @ YouTube",2016-12-24 12:30:48,812712142222729216
i like how calling tucker carlson a partisan hack is being treated as this boom shakalaka chocolate thunder dunk pic.twitter.com/A6WI3RJqRP,2016-12-24 12:30:38,812712099277250560
Rollin' Thunder # WrestlingMoveAFilmOrSong,2016-12-24 12:30:28,812712057195753472
Thunder Youth Basketball Winter Camp begins Dec. 27 in Edmond http://buff.ly/2ijBNSU pic.twitter.com/EjcrQ84tH9,2016-12-24 12:30:22,812712033842065413
"yaelaaa dikira apa, tergantung sih biasanya developernha gitu suka ada glitch makannya crash atau engga ram lu gacukupp",2016-12-24 12:30:16,812712005970710529
"Видео ""Не спеши (War Thunder)"" (http://youtu.be/4jUSY4dD8r0?a ) на @ YouTube добавлено в плейлист.",2016-12-24 12:30:12,812711989315178496
Me ha gustado un vídeo de @ YouTube (http://youtu.be/nm9NdTyntdw?a - -War Thunder- Navidad llena de quejas! (P-51D-30 Gameplay)).,2016-12-24 12:30:11,812711986706296832
NO THUNDER TODAY BUT MY PEOPLE ARE WAKING UP! CHRISTMAS IS THE CELEBRATION OF NIMROD BIRTHDAY HAS NOTHING TO DO... http://fb.me/6XBzxNkqD,2016-12-24 12:29:59,812711936509014020
mianhae Cheondungssi :D,2016-12-24 12:29:23,812711783286771713
"Raise your words, not voice. It is rain that grows flowers, not thunder. - Rumi # quote",2016-12-24 12:29:13,812711743541522432
Thunder And Lightning - Booster Shot (from the new album coming 2013!) https://youtu.be/mYUme-H9svQ vía @ YouTube,2016-12-24 12:29:08,812711721639014400
staying home this year. looks like we may be hit with a big rain storm and maybay thunder and lighting too,2016-12-24 12:28:49,812711642785976320
RELAX this Christmas Eve & check out the comic Ray Thunder https://tapastic.com/series/35360 via @ tapas_app @ tapastic # ChristmasEve # SaturdayReads,2016-12-24 12:28:28,812711553170599936
a Lil lighting a thunder like two times in my area lol,2016-12-24 12:28:18,812711513714589696
@ KO_Crowley legendary time at sgb' s house last week. Next country thunder?,2016-12-24 12:28:02,812711445985103874
"NBA 2K17 - Russell Westbrook 27 Pts Highlights | Thunder vs Knicks | November 28, 2016 | 2016-17: http://youtu.be/M3a9RCFP2y0?a via @ YouTube",2016-12-24 12:27:54,812711409079361536
Thunder in the mountains. # NothingCouldBeFiner https://www.instagram.com/p/BOaILMUFLYB/,2016-12-24 12:27:29,812711307275304960
"Raise your words, not voice. It is rain that grows flowers, not thunder. - Rumi # quote",2016-12-24 12:27:16,812711251704954881
yup.,2016-12-24 12:27:11,812711230162997249
The title of the article. The title of the article: 'Why trading Russell Westbrook is the Thunder's best move',2016-12-24 12:27:05,812711204233875456
Ik heb een video toegevoegd aan een @ YouTube-afspeellijst: http://youtu.be/y2kIZ117eWU?a Delicious Thunder - Rubro vuurwerk,2016-12-24 12:26:57,812711170268270593
"""Laura saison 2 : Thunder bolt Lp meaty +1/+2 en garde"" : http://youtu.be/BXUcJoctuIk?a via @ YouTube",2016-12-24 12:26:38,812711092031848448
"Raise your words, not voice. It is rain that grows flowers, not thunder. - Rumi # quote",2016-12-24 12:26:38,812711090379522052
"NBA 2K17 - Kristaps Porzingis 21 Pts Highlights | Thunder vs Knicks | November 28, 2016 | 2016-17: http://youtu.be/hNj7g0hTE_k?a via",2016-12-24 12:26:19,812711011090169857
force apaa? gapaham:( force down maksudnya?,2016-12-24 12:26:16,812711000952578048
Have a great Christmas everyone we have thunder lightning rain snow and a power cut oh no! I'm so scared haha pic.twitter.com/xykoIv5jAx,2016-12-24 12:25:51,812710893511393280
Thunders kasi hahahaha,2016-12-24 12:25:48,812710884459958272
"Have you guys heard of thunder spirits? probably not, but you should have. we are playing more snes games!! http://twitch.tv/ibums # twitch",2016-12-24 12:25:30,812710807880527872
Thunder scares the shit out of me,2016-12-24 12:25:30,812710805821128704
and I swear to dad if anyone brings Judas THE THUNDER OF MY VENGEANCE WILL ECHO THROUGH YOUR CORRIDORS LIKE THE GUST OF A THOUSAND WINDS!!,2016-12-24 12:25:29,812710804348960769
"Views from OKC: Thunder (Russell Westbrook) take down Boston Welcome to Views from OKC, Thunderous Intentions’ dai… http://ift.tt/eA8V8J",2016-12-24 12:25:22,812710774879752192
gomawo ^^,2016-12-24 12:25:20,812710764536479744
"Woooooowwwwwwwwwww, wow, eh eh eh the way thunder go fire their heads wow wow wow",2016-12-24 12:24:38,812710587176275968
Views from OKC: Thunder (Russell Westbrook) take down Boston http://dlvr.it/MyKvh3 # nbapic.twitter.com/bYvD5qMHrC,2016-12-24 12:24:32,812710564862443520
イベント: War Thunder「冬休み」 http://warthunder.dmm.com/news/detail/1509 … # WarThunder # WarThunder_JPpic.twitter.com/Y6X0yQDvpH,2016-12-24 12:24:26,812710538006306816
"MELBOURNE, AUSTRALIA - DECEMBER 22: Chris Green of the Thunder... https://goo.gl/fb/PmRpVZ # condergreen",2016-12-24 12:23:44,812710360687857668
@ thunder_ekmegi gel aartııııııııııkkkkkkkkk,2016-12-24 12:23:23,812710273815560192
"It’s so black and white He’s stealin’ your thunder Baby, blue ain’t your color . pic.twitter.com/pGyGn6qUDJ",2016-12-24 12:23:07,812710208975704064
"なんなんだ笑""",2016-12-24 12:22:54,812710152226762752
This is a good NBA season for me.. Westbrook will most likely win MVP and will get the thunder to the playoffs by himself,2016-12-24 12:22:23,812710024770416640
cuz Russ only one hoopin for thunder so he has to put up points harden 3rd in the west wit avg of 28 12 and 7,2016-12-24 12:22:07,812709956784885762
God of thunder god of rain crush the infidels in your way # AKingsTale # FFXV # PS4sharepic.twitter.com/byecKcvyp0,2016-12-24 12:21:38,812709834000736256
@WLK_Thunder followback,2016-12-24 12:21:29,812709796549754880
Marq got 5 autographs from these OKC Thunder players. Andre… https://www.instagram.com/p/BOaHfEfDmhJv9BH0s3v63OogIUZC7Yahcyik9M0/ …,2016-12-24 12:21:27,812709786143887360
Marty Friedman Triumph / thunder Match https://youtu.be/C0fEvVYDVEY via @ YouTube,2016-12-24 12:21:05,812709695651794944
Kamu mau ga temenin aku mtan @WLK_Thunder,2016-12-24 12:20:59,812709671031033856
"Raise your words, not voice. It is rain that grows flowers, not thunder. - Rumi # quote",2016-12-24 12:20:17,812709495004659715
"https://goo.gl/KSk4nU - Air Hogs, Thunder Trax RC Vehicle, 2.4 GHZ pic.twitter.com/KESoDjFnks",2016-12-24 12:20:13,812709479506739200
"Raise your words, not voice. It is rain that grows flowers, not thunder. - Rumi # quote",2016-12-24 12:20:11,812709470006607873
"Raise your words, not voice. It is rain that grows flowers, not thunder. - Rumi # quote",2016-12-24 12:20:06,812709447961374720
# np # nowplaying Trisha Hamilton 2015 @ Optimusprott - Thunder Roll http://bit.ly/RadioPC # Soca # IslandPop # WeekendVybe # Christmas,2016-12-24 12:20:05,812709443045617664
"Blushes. ""It is an honor to meet you, god of thunder. Thank you for the gift."" Smiles politely. ""I hope you will like mine+",2016-12-24 12:20:04,812709439543382017
"Raise your words, not voice. It is rain that grows flowers, not thunder. - Rumi # quote",2016-12-24 12:19:56,812709405967994880
"Raise your words, not voice. It is rain that grows flowers, not thunder. - Rumi # quote",2016-12-24 12:19:55,812709400091750400
