text,date,id
세상에 아버지 감사합니다pic.twitter.com/jUpDm2KaRV,2016-12-23 21:38:46,812487654050672640
自力で作るんだぁ！！ で…娘ちゃんは 3DS ね〜 ゲームもブロックも私、苦手 賑やかそ〜で 羨ましい〜♡ 大きくなると 家にいないし 楽なんだけどね…,2016-12-24 18:59:25,812809940934922240
Thunder!,2016-12-24 18:59:18,812809910434013185
THIN LIZZY Heart Attack (Thunder and Lighting) - YouTube Music http://fb.me/8nA985QSy,2016-12-24 18:59:00,812809835209228288
Girlfriend - nice to see you are on Twitter. Bring the thunder to your new business venture!,2016-12-24 18:58:23,812809679612977153
I'm like thunder with slight rainfall is coming ur way. Just chill https://twitter.com/Denock__/status/779771485405732865 …,2016-12-24 18:58:01,812809586088542209
so ah nah you.,2016-12-24 18:57:55,812809561027571712
"GiGi flew off the couch, then barked at the window because she heard thunder and lightning",2016-12-24 18:57:29,812809454492057600
I liked a @ YouTube video http://youtu.be/I0DDOA8YZ4I?a ROBLOX Elemental Wars - Thunder God Magic (NEW MAGIC),2016-12-24 18:57:11,812809376511750144
"""Fuck you thunder, you can suck my dick!""",2016-12-24 18:57:06,812809358107086848
catch a Pichu in route 2 so it'll have Nasty Plot. Don't evolve it till it evolves into Pikachu and it learns thunder bolt,2016-12-24 18:57:03,812809342550474752
"There came a slow soaking rain w/a single clap of thunder, it carried the clean smell of falling water, and w/it flowers from Japanese maple pic.twitter.com/CVyb9qLtIS",2016-12-24 18:56:46,812809273197658112
"De parte de todos (dos) los que hacemos @ OklahomaCityArg les deseamos una muy feliz navidad, esperamos que la pasen muy bien y thunder up!",2016-12-24 18:56:42,812809256143646720
Boston or the thunder or even the rockets,2016-12-24 18:56:42,812809254843404288
Celtics Cavs Spurs Thunder Lakers,2016-12-24 18:56:17,812809150250020864
# NowPlaying Thunder & Lightning by @ myMotorhead - http://alumniradio.net - Buy it https://goo.gl/Wt7xSj pic.twitter.com/VC8Tqgl7OA,2016-12-24 18:56:14,812809136614363136
Thunder Clatter by Wild Cub,2016-12-24 18:56:01,812809081916362753
Smh. Stole my thunder https://twitter.com/presidentcuddy/status/812807669375451136 …,2016-12-24 18:55:58,812809072013611008
# Para2017Prometo enamorar a la elfa q me gusta v': Ser mod en Thunder :v Conocer mas a fondo a @ 1HumanoNormal y a @ Sutsukichan hablar con+,2016-12-24 18:55:42,812809005320048643
Novo trailer legendado de War Thunder celebra o lançamento oficial do jogo https://is.gd/l4IR3u,2016-12-24 18:55:17,812808897366851584
. @ russwest44 & @ VicOladipo threw a Boston Dance Party last night. # Thunder pic.twitter.com/QN5b9PTLEK,2016-12-24 18:55:06,812808851896598528
Pink Floyd - A Delicate Sound of Thunder. NRK2 Nå. Jula starter godt.,2016-12-24 18:54:45,812808766198599681
"Pikachu available until 19:24:09 (29m 47s). Quick Attack / Thunder (93.33% - 14/14/14) http://maps.google.com/maps?q=37.63130134841851,-77.5083285891613 …",2016-12-24 18:54:22,812808669377265668
"Wind, rain, & thunder are only reflections of a temporary storm. Don't over react. Just hang on.",2016-12-24 18:54:18,812808650821660678
Recap: Thunder get revenge over Clippers # OklahomaCityThunder... http://dlvr.it/MyPqVk # OklahomaCityThunder,2016-12-24 18:54:05,812808598417833988
"# Oklahoma # City # Thunder NBA 11"" x 17"" Car Window Cling Decal OKC Wincraft 661364 http://www.sportsfantees.com/shop/oklahoma-city-thunder-nba-11-x-17-car-window-cling-decal-okc-wincraft-661364-23698-579561349#sportsfantees_twitter …pic.twitter.com/T2MK8UUK1E",2016-12-24 18:54:01,812808579581288448
Heir of Thunder by Karissa Laurel is out now! Check out the blog tour for a chance to # WIN a copy + Amazon GC! http://cbybookclub.blogspot.com/2016/12/blog-tour-promo-giveaway-heir-of.html?utm_source=feedburner&utm_medium=email&utm_campaign=Feed%3A+CBYBookClub+%28CBY+Book+Club%29 …,2016-12-24 18:53:42,812808501030486016
https://www.youtube.com/watch?v=XecDz-o-KnY&sns=tw … via @ youtube THUNDER,2016-12-24 18:53:31,812808453475344385
I liked a @ YouTube video http://youtu.be/ya-XJi3oDX8?a THE MOMENT YOU REALIZE RUSSEL'S THE BEST SHOOTER IN THE NBA...THUNDER vs CELTICS,2016-12-24 18:53:23,812808421569396736
"ELETTRONICA - I PRODOTTI DEL MOMENTO: #9: iTek Scorpion Thunder Gaming Mouse Pad, Materiale Antiscivolo, 287x244x3… http://ift.tt/2dgdpA4",2016-12-24 18:52:21,812808160499134464
Pretty clear that vegas saw themselves about to get roasted on the Twolves/thunder over Jumped from 204 to 210.... that's absurd,2016-12-24 18:52:19,812808151921819653
@WLK_Thunder tunder oppa pic.twitter.com/DZI17HRI6f,2016-12-24 18:51:42,812807999102144512
"Choro todas as vezes que ouço Thunder Road, pqp.",2016-12-24 18:51:40,812807988759109632
Don't act like a Bitch when I'm coming! Them Guns is Big as Andre Drummond! They sound like Thunder when they Thumping!,2016-12-24 18:51:37,812807977958854656
Delicious breakfast in Thunder Bay # Hoito # Finnish # breakfast # thunderbay # full # pancakes # naptime # yumyumpic.twitter.com/MZxQhb8rSv,2016-12-24 18:51:26,812807929237827584
,2016-12-24 18:51:25,812807927937368064
これって！ 良く見てなかったけど、レゴなんだね〜 なんか すご( º_º )！クオリティ高すぎる〜！！ 頑張って,2016-12-24 18:50:52,812807787629555712
lol. Thunder&lightning at this hour...,2016-12-24 18:50:49,812807775415889920
du coup j'ai passé la soirée a boire du blanc et a enfoncer le couteau ds la plaie des gens avec mon cynisme,2016-12-24 18:50:02,812807579084656640
Far out Santas busy up there making some ripper toys for next year already. Never heard thunder that loud before,2016-12-24 18:49:43,812807498402934784
Big Thunder Mountain Railroad (DLR) was reported closed at approximately 3:49 PM PT,2016-12-24 18:49:23,812807414223433728
Check out Rockin' Jelly Bean Thunder Sound Girl SILK SCREEN Poster 1st EROSTIKA New http://www.ebay.com/itm/Rockin-Jelly-Bean-Thunder-Sound-Girl-SILK-SCREEN-Poster-1st-EROSTIKA-New-/222322639280?roken=cUgayN&soutkn=VnPCVa … via @ eBay,2016-12-24 18:48:57,812807306979069952
Gostei de um vídeo do @ YouTubeGaming https://gaming.youtube.com/watch?v=qnnjhJ6Qmfo&feature=a … DEFENSE OF JAPAN (War Thunder Gameplay),2016-12-24 18:48:55,812807297764298752
"Jolteon (73.33%-12/7/14,Thunder Shock/Thunder) Until 16:18:30 (29m 43s) http://maps.google.com/maps?q=33.92653858753294,-117.99047388842996 …",2016-12-24 18:48:47,812807262074847232
00:45 Pink Floyd - Delicate Sound of Thunder http://ift.tt/2i5Y4XZ,2016-12-24 18:48:39,812807230642880512
"Raise your words, not voice. It is rain that grows flowers, not thunder. - Rumi # quote",2016-12-24 18:48:36,812807217086918656
kept walking as the thunder bolt kept balst I g everywhere,2016-12-24 18:48:23,812807161780830208
The thunder that will strike you ehn https://twitter.com/ogbeni_peter/status/812806674025246720 …,2016-12-24 18:48:19,812807144382885889
don't even know you,2016-12-24 18:48:14,812807124153757696
"knicks, warriors, bulls, thunder & lakers",2016-12-24 18:48:09,812807103697911808
# WeAreThunder # ThunderUp # OKCThunder # Signed KEVIN DURANT - OKLAHOMA THUNDER ADIDAS KIDS JERSEY Size M signed http://ow.ly/Vu4p507TA2O,2016-12-24 18:47:51,812807026850091008
Drinking a Moo Thunder Stout by @ ButternutsBeer at @ wunderbarbistro —http://untp.beer/s/c397793523,2016-12-24 18:47:47,812807010378989569
them dang Christians trying to steal thunder from everyone smh,2016-12-24 18:47:05,812806835271008256
"""Digi Thunder (Serangan kilat)"" -Tentomon",2016-12-24 18:46:44,812806748310380544
Thunder and lightning? This is definitely NOT the Christmas weather I have in my mind for christmas eve. oO,2016-12-24 18:46:44,812806748016885760
Dropping another Westbrook mix from last night. I think you'll like it... # Thunder,2016-12-24 18:46:30,812806687530844160
"Just broke down. Noooooooooo! (@Big Thunder Mountain Railroad - @ disneyland in Anaheim, CA)https://www.swarmapp.com/c/1BUFrYSOLsH",2016-12-24 18:46:29,812806683567198208
"Merry Christmas and a Happy New Year to all of the Thunder Family. Stay safe, be Merry and have fun this festive... http://fb.me/7q90AAnVt",2016-12-24 18:46:08,812806598292750340
http://ift.tt/2hnHiEa # shoes MEN'S NIKE AIR JORDAN RETRO 14 Retro Thunder B grade 487471-070 10,2016-12-24 18:46:06,812806589640044545
I liked a @ YouTube video http://youtu.be/ya-XJi3oDX8?a THE MOMENT YOU REALIZE RUSSEL'S THE BEST SHOOTER IN THE NBA...THUNDER vs CELTICS,2016-12-24 18:46:05,812806584686485505
@4ever_12__ @ lovelyvoice_21 @ BuchimDO_12 @My_juliet_0326 @DOvely__9312 @thunder_9_21 @_peach_flower @ BHpeach0506 @exovely_408 @ yeolmea_yapic.twitter.com/DtX6BaTeaY,2016-12-24 18:46:03,812806575790227456
I'm wide awake thunder rumbling castles crumbling I am trying to hold on,2016-12-24 18:45:59,812806557251448832
Christmas morning started with grey sky and thunder grumbling in the distance! A loud closer thunder clap since... http://fb.me/6lKYAHqso,2016-12-24 18:45:55,812806541568974848
A new favorite! C. Da Afro - Don't Stop Groovin (Disco Dub) by Thunder Jam Records https://soundcloud.com/thunder-jam-records/dont-stop-groovin-disco-dub … on # SoundCloud,2016-12-24 18:45:26,812806422425698304
@ chloe__harvey hope you've had a lovely day Susan and happily hand the thunder over to Big J tomorrow like the selfless sort you are x,2016-12-24 18:45:19,812806389936619520
Thor – The God of Thunder’s Best Games https://goo.gl/po0EjE,2016-12-24 18:45:10,812806353953628160
That's thunder? What it is happening?,2016-12-24 18:44:55,812806290359644160
War Thunderには3つのゲームモードがある。 一番難易度が低く人口も最多「アーケードバトル」 より操縦が難しく、弾薬・爆弾・魚雷が有限になる「リアリスティックバトル」 三人称視点がなく、ジョイスティックやコントローラーがないと操縦もままならない「シミュレーションバトル」,2016-12-24 18:44:53,812806281480155136
CHRISTMAS DAY # Thunder vs # Twolves # Tickets starting at $41 Find your tickets now http://tota.ly/2is6Uf3 # LastMinuteGiftspic.twitter.com/gT9nJUI197,2016-12-24 18:44:51,812806271862718464
Check out my broadcast from my PlayStation 4! # PS4live (War Thunder) live at http://dai.ly/x42kuik,2016-12-24 18:44:16,812806126886617088
Trust it to start thunder storming on my first Christmas in Australia,2016-12-24 18:44:10,812806100156174337
Big ASS donkey booty with Big juiCy thunder thighs! http://smq.tc/1UyEIon,2016-12-24 18:44:05,812806078870081536
"# OKCThunder # TeamOKC # GetUpGetLoud Westbrook, Thunder host Timberwolves on Christmas (The Associated Press) http://dld.bz/fpBzB",2016-12-24 18:44:03,812806074126495745
We have thunder and lightening and rain today. Hooray,2016-12-24 18:43:59,812806054937444352
http://ift.tt/2hnHiEa MEN'S NIKE AIR JORDAN RETRO 14 Retro Thunder B grade 487471-070 10,2016-12-24 18:43:21,812805896652947456
it's christmas but it's raining really hard and there's thunder and lightning too lol what the actual FUCK,2016-12-24 18:43:08,812805839929085953
The answer is always thunder.. # metvwwwest,2016-12-24 18:43:07,812805838595297281
"# SacramentoKings # Kings # SacKings Westbrook, Thunder host Timberwolves on Christmas (The Associated Press) http://dld.bz/fpBzy",2016-12-24 18:43:01,812805814067064836
thunder did not know i was recording him: http://youtu.be/YPO4ciZCi9o?a via @ YouTube,2016-12-24 18:42:23,812805652884111360
Woken up by thunder. Its pouring,2016-12-24 18:42:19,812805635163176960
Check out my broadcast from my PlayStation 4! # PS4live (War Thunder) live at https://www.twitch.tv/speedmachine002 http://fb.me/ZkJ5rRVg,2016-12-24 18:42:16,812805622966210561
when you give me that thunder you make my summer rain,2016-12-24 18:41:47,812805502518304768
"War Thunder: Release update 1.65 ""Way of the Samurai"" https://youtu.be/OaLM1qjR_jw @ YouTubeさんから",2016-12-24 18:41:42,812805482050154496
Jag gillade ett videoklipp på @ YouTube http://youtu.be/ya-XJi3oDX8?a THE MOMENT YOU REALIZE RUSSEL'S THE BEST SHOOTER IN THE NBA...THUNDER,2016-12-24 18:41:33,812805443131162625
u were the thunder to my lightning,2016-12-24 18:41:25,812805408213569537
Derek Carr trying to steal Mariota's thunder with an ankle injury of his own.,2016-12-24 18:41:19,812805384750645248
We're getting some proper rain and even thunder out this way.,2016-12-24 18:40:55,812805283827224581
おれがただの飛べない豚だとぉ？ ＿ ⋀⋀ / | ＿/(՞ةڼ◔ )／〇 | !/ .}￣￣￣ / i＼_}／￣|＿_／≡＝ `￣￣~ イャッッホォォォオオォオウ！ ほうらWar Thunderやってるだけあるだろwww,2016-12-24 18:40:24,812805152843309056
Rumble of thunder has been going on in Logan for the past 15 or so minutes. That's about all so far.,2016-12-24 18:40:09,812805090662699008
2016 Racing Post Novices' Chase tips Back 7/4 Identity Thief to steal Min's thunder in Grade One showdown >http://www.racingtips.com/category/tips/leoparstown-boxing-day-racing-post-novices-chase-tips-20161223-0003/ …<pic.twitter.com/Mw23Xo2Net,2016-12-24 18:40:05,812805072602140672
plough we pronounce; glozed themselves Thunder. - @ thePoeticRobot,2016-12-24 18:40:01,812805058534526976
"ICYMI Russell Does It Again, Thunder Outlast Celtics in Boston # Thunder # NBA http://thunderousintentions.com/2016/12/23/okc-thunder-russell-outlasts-boston/ …",2016-12-24 18:40:01,812805057280442368
"Member of Raijinshu (Thunder God Tribe) : Me, Laxus Dreyar, Bickslow, and Evergreen # ÉcritureBot",2016-12-24 18:40:00,812805055082479616
Christmas on the Thunder Arrow.... pic.twitter.com/3gZzrjiwK6,2016-12-24 18:39:00,812804800169594880
"[Tuas] Wild Jolteon spotted at 7 Tuas Link 1!73%, Thunder Shock/Thunderbolt. Disappears 08:08:05 (29m 21s). http://maps.google.com/maps?q=1.3343424,103.63740205 …",2016-12-24 18:38:46,812804744490192897
Those who ride like lightning crash like thunder,2016-12-24 18:38:05,812804570879508481
@ Nudah @ ThunderS7ruck I pic.twitter.com/N26Q7hxnpg,2016-12-24 18:37:58,812804542014296064
隣の人はひろあきさんですか？,2016-12-24 18:37:53,812804522225504257
"There are always those that get past somehow, and they hit me on the head on Thunder Mountain...",2016-12-24 18:37:28,812804414767501313
We're listening to a live version of Thunder Road by The Boss and weirdly NOW I feel truly Christmassy. # ChristmasEve,2016-12-24 18:37:22,812804389073260544
"And if it weren't for Russ's heroics, the Thunder are down double digits and Adams and the starters are sitting down the stretch. https://twitter.com/bballbreakdown/status/812764744251686912 …",2016-12-24 18:37:18,812804373906477056
"Pikachu available until 19:03:47 (26m 48s). Thunder Shock / Thunderbolt (91.11% - 15/13/13) http://maps.google.com/maps?q=37.23938778170054,-80.04096146878882 …",2016-12-24 18:36:59,812804293988327424
"Мне понравилось видео ""Топ 20 моментов из стримов Alconafter по War Thunder""",2016-12-24 18:36:46,812804238627766272
"""I'm supposed to be playing War Thunder but this one player keeps kicking my ass."" ""Is it theOrangeDoom27?""",2016-12-24 18:36:42,812804222597103620
"Raise your words, not voice. It is rain that grows flowers, not thunder. - Rumi # SuccessWithJS # quote # success",2016-12-24 18:36:33,812804184508682240
"My grandma bought me a Xavier Wulf sweatshirt, then she screamed ""thunder man yo!"" # hollowsquad",2016-12-24 18:36:30,812804173741834240
"Raise your words, not your voice. It is rain that grows flowers, not thunder.",2016-12-24 18:36:07,812804077809795080
# MexicanFoodFilms Tropical Thunder ceviche,2016-12-24 18:36:00,812804047195480065
Streets of Rage II Max Thunder 721500 points 436 KOs,2016-12-24 18:35:58,812804039431819264
I liked a @ YouTube video http://youtu.be/ya-XJi3oDX8?a THE MOMENT YOU REALIZE RUSSEL'S THE BEST SHOOTER IN THE NBA...THUNDER vs CELTICS,2016-12-24 18:35:41,812803966270664704
雷さん おはようございます♪ヽ(´▽｀)/ メリークリスマス(*^▽^)/★*☆♪ 今日１日が雷さんにとって ピカピカ痺れる１日になりますように！！,2016-12-24 18:35:36,812803944380448768
I liked a @ YouTube video from @ bballbreakdown http://youtu.be/yMZOZ_802hc?a Thunder at Celtics: Russ Explosion Down The Stretch,2016-12-24 18:35:04,812803812738158592
2015-16 Season game 40: Oklahoma City Thunder vs Dallas... http://dlvr.it/MyPgLf # OklahomaCityThunder,2016-12-24 18:35:03,812803807448952832
I think u mean Thunder fans?,2016-12-24 18:35:02,812803801740476416
Westbrook goes wild as Thunder rumble past Celtics - Read: http://bit.ly/2ieviRZ # BeFullyInformed,2016-12-24 18:35:00,812803795986116611
he doing that with the Thunder?,2016-12-24 18:34:53,812803763824107520
"Видео ""War Thunder | Chi-To"" (http://youtu.be/_7N7dLDkwXQ?a ) на @ YouTube добавлено в плейлист.",2016-12-24 18:34:52,812803761122975748
"Electabuzz appeared! IV: 62.22% (10/3/15). Moves: Low Kick,Thunder Punch. At 2405 Nixon St. 28m 8s left. http://maps.google.com/maps?q=33.829955830450004,-78.64213442573688 …",2016-12-24 18:34:41,812803714079748096
can you plz make more codes? the code i want to be for is thunder god! as always i love your game happy holidays!,2016-12-24 18:34:39,812803706383114240
# NowPlaying Alex Cole @ alexcolerocks - Thunder Guts on @ Metal365Radiohttp://365radionetwork.com,2016-12-24 18:34:33,812803682072858624
なら飛行機をチャーターしましょう,2016-12-24 18:34:15,812803606361444352
what is thunder doing in the drama pic.twitter.com/uUU4FLbwLF,2016-12-24 18:34:15,812803604365058048
Thunder shot exploding targets. http://usedfirearms.ca/ads/thunder-shot-exploding-targets/ …,2016-12-24 18:34:05,812803564263325696
i need a thunder buddy,2016-12-24 18:34:03,812803554297737216
I’ve got fingers crossed for LFC toxic thunder third kit or Juve pink kit (for aesthetics only),2016-12-24 18:33:57,812803531778428929
"I went to the first mall in downtown area yesterday afternoon. Pucha may nagjajakol sa cr. Laki titi, pero thunders na eh. # alter # Palawan.",2016-12-24 18:33:54,812803518633381888
Double fisting sleepytime and morning thunder.,2016-12-24 18:33:45,812803478976335872
私でなくて？,2016-12-24 18:33:37,812803445090447360
# NowPlaying Alex Cole @ alexcolerocks - Thunder Guts on @ HighwayRock365http://365radionetwork.com,2016-12-24 18:33:16,812803357370814465
Thunder and sleet from this winter storm in Oracle. # azwx @ NWSTucson @ jeffbeamish,2016-12-24 18:32:28,812803159017930752
# NowPlaying Alex Cole @ alexcolerocks - Thunder Guts on @ RockInvasion http://365radionetwork.com,2016-12-24 18:32:23,812803137580847104
おはようございます！Thunder-雷-nana民ネタい手さん♪,2016-12-24 18:32:10,812803080215367680
I'm up again yuhuuu~ # cheondung # thunder # parksanghyun # vlive # update https://www.instagram.com/p/BOax6OqjaCo/,2016-12-24 18:32:09,812803078542004224
"# OKCThunder # ThunderUp # WeAreThunder Westbrook, Thunder host Timberwolves on Christmas http://dld.bz/fpB5t",2016-12-24 18:32:04,812803057515892736
# Celtics # CelticsNation Five takeaways: Thunder show C's still have work to do defensively http://dld.bz/fpB5u,2016-12-24 18:32:03,812803054005325824
23만달러라고 하네요,2016-12-24 18:32:00,812803040591761408
Did anyone else wish for thunder and rain on Christmas day?,2016-12-24 18:31:54,812803015694352384
I liked a @ YouTube video http://youtu.be/ya-XJi3oDX8?a THE MOMENT YOU REALIZE RUSSEL'S THE BEST SHOOTER IN THE NBA...THUNDER vs CELTICS,2016-12-24 18:31:44,812802974300958721
친박에서 증거 깐거 아닐까 생각됩니다 대선은 물 건너 갔고 반기문이 흠집내야 탈당을 막을수 있으니까요 조사했던 인간이 우병우라니 그런 의심이가네요,2016-12-24 18:31:25,812802893484933120
thunder did not know i was recording him: http://youtu.be/R6ubQ52ZyJY?a via @ YouTube,2016-12-24 18:31:25,812802892541345792
"Happy Holiday from Berkshire East Canopy Tours, Berkshire East Ski Area, Thunder Mountain Bike Park and Berkshire... http://fb.me/a10ONtBQY",2016-12-24 18:31:13,812802843300233218
# NowPlaying Alex Cole @ alexcolerocks - Thunder Guts on @ HighwayRock365 http://365radionetwork.com,2016-12-24 18:30:59,812802783032262657
# NowPlaying Alex Cole @ alexcolerocks - Thunder Guts on @ SponsoredEEB http://365radionetwork.com,2016-12-24 18:30:58,812802778556928000
# NowPlaying Alex Cole @ alexcolerocks - Thunder Guts on @ Metal365Radiohttp://365radionetwork.com,2016-12-24 18:30:57,812802773968453632
# NowPlaying Alex Cole @ alexcolerocks - Thunder Guts on @ Elite365R http://365radionetwork.com,2016-12-24 18:30:57,812802773955858432
# NowPlaying Alex Cole @ alexcolerocks - Thunder Guts on @ Indie365Radio http://365radionetwork.com,2016-12-24 18:30:57,812802773947392000
# NowPlaying Alex Cole @ alexcolerocks - Thunder Guts on @ FullImpactRadio http://365radionetwork.com,2016-12-24 18:30:57,812802773922234370
# NowPlaying Alex Cole @ alexcolerocks - Thunder Guts on @ RockInvasion http://365radionetwork.com,2016-12-24 18:30:57,812802773918089216
# NowPlaying Alex Cole @ alexcolerocks - Thunder Guts on @ Ultimate365R http://365radionetwork.com,2016-12-24 18:30:56,812802769971277825
# NowPlaying Alex Cole @ alexcolerocks - Thunder Guts on @ Rock365Radio http://365radionetwork.com,2016-12-24 18:30:56,812802769967058944
# NowPlaying Alex Cole @ alexcolerocks - Thunder Guts on @ official365rn http://365radionetwork.com,2016-12-24 18:30:56,812802769904140288
# NowPlaying Alex Cole @ alexcolerocks - Thunder Guts on @ UnsignedHQ http://365radionetwork.com,2016-12-24 18:30:55,812802765571457024
# NowPlaying Alex Cole @ alexcolerocks - Thunder Guts on @ MidwestBG http://midwestbroadcastinggroup.com,2016-12-24 18:30:55,812802765491765248
"Raise your words, not voice. It is rain that grows flowers, not thunder. - Rumi # quote",2016-12-24 18:30:35,812802684063547392
@ BlizzardCS anyone else getting dc'ed in thunder totem?,2016-12-24 18:30:04,812802552362172416
Christmas Round Table Part 2 – OKC Thunder dinner companion and last minute shopping # Thunder http://thunderousintentions.com/2016/12/24/okc-thunder-round-table-p2-games-trades/ …,2016-12-24 18:30:01,812802541666922496
"""Laura saison 2 : Thunder bolt meaty +1 en garde vs reversal 3F"" : http://youtu.be/rz6JC9x09KE?a via @ YouTube",2016-12-24 18:29:35,812802429578252290
川崎ブレイブサンダース / KAWASAKI BRAVE THUNDERS / 川崎雷霆勇者 / 川崎雷霆勇者 / 도시바 브레이브 선더스 가나가와 https://kawasaki-bravethunders.com/ # バスケ # Bリーグ # BLeague # B聯賽,2016-12-24 18:29:31,812802414063456256
@ Daviskil shot a huge knockout and called it thunder Lol http://fb.me/x2rCp2gW,2016-12-24 18:29:27,812802399974916096
"NBA 2K17 - Russell Westbrook 17 Pts Highlights | Pistons vs Thunder | November 26, 2016 | 2016-17: http://youtu.be/AIwBek9rlCg?a via",2016-12-24 18:29:14,812802345008504833
,2016-12-24 18:29:12,812802333176430592
And the thunder rolls,2016-12-24 18:29:05,812802305041072132
Rolling Thunder. pic.twitter.com/4DGYuv86i6,2016-12-24 18:28:57,812802273957003265
Celtics>Knicks Warriors<Cavs Bulls>Spurs Wolves<Thunder https://twitter.com/tr33z_4_dayz/status/812798805720473600 …,2016-12-24 18:28:55,812802262636646401
"4. ""Alma de Fuego II"" - @ zenobiabanda 5. ""Popestar EP"" - @ GhostBcOfficial 6. ""Artic Thunder"" - # Darkthrone 7. ""Magma"" - @ GojiraMusic",2016-12-24 18:28:30,812802158735294464
Video de navidad en war thunder http://youtu.be/neoHO-HSLB8?a,2016-12-24 18:27:53,812802002006769664
"When you close your eyes, You can see the day rewind, All the laughs and stupid fights, You and I we roll like thunder in the skies.",2016-12-24 18:27:52,812802000354213888
"NRK kl 00 45 PinkFloyd Delicate Sound of Thunder E ha vøri der to gøngji ( ganger ) Har du opplevd Pink Floyd,... http://fb.me/5vCvOKUrS",2016-12-24 18:27:38,812801942992916480
Tropic thunder diamond chain next purchase,2016-12-24 18:27:22,812801872507478016
Rolling Thunder would be ok with me. https://twitter.com/Destry3535/status/812796417249071104 …,2016-12-24 18:27:07,812801809316253696
Gracias thunder! Feliz navidad @ Tondero pic.twitter.com/w8iXBxpylF,2016-12-24 18:27:01,812801786855690240
"Raise your words, not your voice. It is rain that grows flowers, not thunder.",2016-12-24 18:26:55,812801761694117888
Thunder Red by W.A.S.P. # NowPlaying http://open.spotify.com/track/2MsjYYnkhMd2HymaxOqCxB …,2016-12-24 18:26:46,812801724062859264
Blood and Thunder - MASTODON https://youtu.be/labytsb3gfI,2016-12-24 18:26:03,812801541367328768
# Thunder # thunderfamilyhttps://twitter.com/mvladythunder/status/812681994660216832 …,2016-12-24 18:25:58,812801521180020736
i know yeah. my nans sent a present down as well,2016-12-24 18:25:41,812801451047190529
mi pene es durro porque thunder,2016-12-24 18:25:32,812801411645837312
"I thought it was winter?! Thunder & Lightning for # christmas? Well, I wished for quite a lot this xmas but deffo not thunder & lightning!",2016-12-24 18:25:31,812801408076578817
"That thunder storm from last night didn't last until today; big sun now, all is quiet outside ...",2016-12-24 18:25:26,812801387599794176
"ADISCO: ""May thunder struck anyone who whishes Nigerian so... http://adiscobaba.blogspot.com/2016/12/may-thunder-struck-anyone-who-whishes.html?spref=tw …",2016-12-24 18:24:34,812801169772998656
"if they don't hear the whisper, speak up, if they still don't hear, yell, if all else fails THUNDER",2016-12-24 18:24:28,812801145995460608
