text,date,id
ARE THE LAKERS FOR REAL AFTER BEATING WESTBROOK & THUNDER ? http://ow.ly/VH91306wZUx,2016-11-25 16:58:39,802270300960358401
VERY NICE LEG MISTRESS THUNDER...CUTE LIL BOOT TOO:),2016-11-25 16:58:17,802270207922143233
Hope the Kings trap the pick and roll the way they did vs Thunder. Harden will have 20 assists,2016-11-25 16:58:16,802270200863199232
"I'm at Bruce Banner's Lab in Thunder Bay, ON https://www.swarmapp.com/c/4RscrmQPeIA",2016-11-25 16:58:06,802270159490707456
Elco PT-314 Game Play - Navy Forces - War Thunder - Pre-Beta Test: http://youtu.be/IY9ZKVeRsOg?a via @ YouTube,2016-11-25 16:57:40,802270052917444608
Bring On The Thunder https://www.youtube.com/shared?ci=Zo6dMz4ZMck …,2016-11-25 16:57:40,802270050296086528
I added a video to a @ YouTube playlist http://youtu.be/IY9ZKVeRsOg?a Elco PT-314 Game Play - Navy Forces - War Thunder - Pre-Beta Test,2016-11-25 16:57:39,802270049134407680
I added a video to a @ YouTube playlist http://youtu.be/Ac136Yuqg4Q?a PINK FLOYD - Delicate Sound Of Thunder - EXTENDIDO - MONTE PATRIA -,2016-11-25 16:57:19,802269963876765700
"¡Qué gran noche hoy! Cavs, Thunders, y Warriors... # AsíSí # NBA # dormiresdecobardes",2016-11-25 16:57:16,802269952107368449
AHAHA jk I just left my house,2016-11-25 16:57:15,802269948546400257
Waiting in line for Thunder Mountain!!! @Disney's Magic Kingdom https://www.instagram.com/p/BNP7_YhBLsytrXiJzn7j1AtFgY5ySDWZqyfUZo0/ …,2016-11-25 16:57:13,802269939050549248
Have proper thunder thighs fgs,2016-11-25 16:56:50,802269843689013248
"Just listened to Thunder's ""Don't Go"". Man how could I forget such a song?! It was my jam back in the day.",2016-11-25 16:56:40,802269800743534593
Some might say sunshine follows thunder,2016-11-25 16:56:40,802269799736889344
I'm a scientist who studies primates. Everything I do is nerdy. Of note: one of my study subjects is named THUNDER.,2016-11-25 16:56:23,802269727158661120
trying to steal his thunder https://twitter.com/xxl/status/802195163909160960 …,2016-11-25 16:56:21,802269719827009536
Thunder Dia yansh https://twitter.com/Chelsea_HQ/status/802112186202148865 …,2016-11-25 16:55:46,802269575614263296
"When shall we three Skype again? In thunder, lightning, or online?",2016-11-25 16:54:59,802269378003738624
"Lo, these are part of his ways; but how little a portion is heard of him? but the thunder of his power who can understanding.",2016-11-25 16:54:58,802269373784354817
Rain Sound and Thunder - 2 Hours Sleep Meditation Sound http://fb.me/5tmk5gP1p,2016-11-25 16:54:27,802269241693143040
Thunder gonna have to break their losing streak on your squad tonight @ TacoBellGawd,2016-11-25 16:54:17,802269201578786816
ok cool. Thanks!,2016-11-25 16:53:05,802268897273638916
Couldn't hear the thunder But I heard your heart race Couldn't see the rain,2016-11-25 16:53:00,802268879409950722
I liked a @ YouTube video from @ baronvongamez http://youtu.be/Vj-mnhSSeDw?a War Thunder Ships Gameplay - TORPEDOES AWAY!,2016-11-25 16:52:59,802268875220025344
Will Barton still experiencing discomfort in ankle and will not play tonight vs. Thunder (via ESPN),2016-11-25 16:52:51,802268841812357120
# NowPlaying Under The Thunder - Devilment — listening to Devilment,2016-11-25 16:52:41,802268796786540549
eh. Their defense is pretty good. Reminds me of watching the Thunder a tad with the lane being so packed,2016-11-25 16:51:29,802268494343438336
"I’m telling you you don’t need that guy it’s so black and white he’s stealing your thunder baby, blue ain’t your color",2016-11-25 16:51:21,802268463364325376
Heads up! Live stream of: Tulsa Oilers - Wichita Thunder https://goo.gl/5Cz2cW # icehockey,2016-11-25 16:50:32,802268255817728003
War Thunder Naval Forces Russian BMO & PC 1124 (1940): http://youtu.be/3UM8eNEnEEo?a via @ YouTube,2016-11-25 16:50:16,802268188679385088
Game is live: Denver Nuggets - Oklahoma City Thunder https://goo.gl/lOLQ7E # basketball # thunder # nba # nuggets,2016-11-25 16:50:10,802268164922994688
I liked a @ YouTube video http://youtu.be/sI3V9euaaSw?a Thunder Rolls: The Taco Bell Version,2016-11-25 16:50:05,802268145524293632
7D: 140 Splash: 75 Thunder: 60 SPC: 80,2016-11-25 16:50:02,802268130739253248
Eject Button Poli to set rain and Eject into Koko for 100% Thunder. Rain Dish Shiinotic for support and..,2016-11-25 16:49:27,802267985360482304
"""Thunder calms me down. Sometimes it's nice to know that even the sky needs to scream sometimes.""",2016-11-25 16:48:20,802267703323086848
.....298 - Do you think it's possible? Hope you're fit & well! We've missed 'The Thunder From Down Under'! Xxx,2016-11-25 16:47:45,802267554945368065
"Campbell:Jolteon 55.56% (15/3/7/Thunder Shock/Discharge) till 22:02:25 (14m 46s). http://maps.google.com/maps?q=37.290520802569326,-121.96592966910126 …",2016-11-25 16:47:29,802267488759123968
..a bit since 1995 when the team played at the Thunder Dome*,2016-11-25 16:47:23,802267463857696768
"http://ocduilaw.com - Sunny skies and warm temps could give way to rain and thunder through the weekend, th... http://ow.ly/2gUk506TBkl",2016-11-25 16:47:09,802267404591996928
Thoughts out to Z-Bo. Thunder family extends its condolences. Can't even imagine. Stay strong and let that Memphis fam love on you. https://twitter.com/br_nba/status/802257446127419392 …,2016-11-25 16:47:01,802267372132462592
Very nice on a long weekend! I really like everything I have had from Jack... (Thunder Ann) http://untp.beer/s/c387009888 # photo,2016-11-25 16:46:54,802267341799194625
"Project Rolling Thunder Part 12 - Fuel, Electical & Cooling Ducts! - http://www.powerblocktv.com/episode/TK2011-13/project-rolling-thunder-part-12-fuel-electical-cooling-ducts …",2016-11-25 16:46:12,802267166745751552
So # true! # results # realtalk # respect # dwyd # lovethis # life # thunder # storm # strongwoman… https://www.instagram.com/p/BNP6tyPjk5Z/,2016-11-25 16:46:03,802267129693216768
NBA: Nuggets v Thunder He subido un nuevo pick en @ EpickTips . Puedes seguirlo aqui >> http://www.epick.tips/tips/5838b0e0-9fb8-472e-b51d-0547bc5ffc3e …,2016-11-25 16:45:55,802267096201596928
Seniors in Thunder Bay....REFUSE to remove your sunglasses when challenged by LCBO staff. This challenge is harassment.....plain and simple.,2016-11-25 16:45:37,802267018040897536
Storms a brewing # storms # australia # summeriscoming # thunder # lightning # grey # windy # heavy… https://www.instagram.com/p/BNP6qaSjDkI/,2016-11-25 16:45:36,802267013427163136
umm weird. He's just a civilian who lost now. Why is he trying to steal Trump’s thunder?,2016-11-25 16:44:49,802266818106818560
[Fleet] Start of pre-beta test of the War Thunder Naval Forces http://warthunder.com/en/news/4327-fleet-start-of-pre-beta-test-of-the-war-thunder-naval-forces-en/ …,2016-11-25 16:44:18,802266689018527744
ｵﾊｱﾘﾃﾞｺﾞｻﾞｲﾏｽ(-.-)Zzz・・・・,2016-11-25 16:43:50,802266569740951552
OKC Thunder: Westbrook's Triple-Double Helps Oklahoma City Bounce Back # # OklahomaCityThunder https://goo.gl/fb/gQU7d5,2016-11-25 16:43:05,802266382708703232
# WeAreThunder My gorgeous daughter Sarah with her signed Victor Oladipo basketball she won during a Thunder game. # ThunderUp # ThunderNationpic.twitter.com/viyp4neIQ2,2016-11-25 16:43:02,802266368770998272
"""It's so black and white he's stealing your thunder, baby blue ain't your color""",2016-11-25 16:42:30,802266233601200128
Draymond Green: No way Kevin Durant signs with Warriors if Thunder beat them,2016-11-25 16:42:25,802266214026383360
Someone doesn't like thunder storms... so we've been sitting outside since 5am so her barks… https://www.instagram.com/p/BNP6SOUAdve/,2016-11-25 16:42:17,802266180945870848
"Raise your words, not voice. It is rain that grows flowers, not thunder. - Rumi # quote",2016-11-25 16:42:16,802266177812709381
Preview: Weary Thunder get opportunity at ravaged Nuggets - Welcome to Loud City http://dlvr.it/MlDjvq,2016-11-25 16:42:06,802266134678355968
"@ jasonturnbull @ bendyword Conned by ""This is That"" 1 day. On-air I read story re. freight train lost between Thunder Bay & Winnipeg. DOH!",2016-11-25 16:41:45,802266047495761920
the elite 4 pokemon have moves that counter their direct counters tho so like a rock type has thunder punch etc,2016-11-25 16:41:17,802265929274929152
I liked a @ YouTube video from @ baronvongamez http://youtu.be/Vj-mnhSSeDw?a War Thunder Ships Gameplay - TORPEDOES AWAY!,2016-11-25 16:40:23,802265701906087936
Legacy of residential schools apparent to @ OntarioAdvocate during Thunder Bay visit. http://www.chroniclejournal.com/news/local/legacy-of-residential-schools-remains/article_53cc34f2-b2c8-11e6-b3c3-3bfc1fc0e001.html … # tbay # onpoli,2016-11-25 16:40:06,802265630384726016
Revisiting Johnny Thunders and the Heartbreakers's 'L.A.M.F.' live at Bowery Electric http://bit.ly/2goXRdG pic.twitter.com/1RRtYiLHiR,2016-11-25 16:40:02,802265614509338628
"俺の獲物は""/thunder""だ。具現化し、槍のようにして使う。宙に何十本も浮かべて、そいつと一緒に特攻することもある。ま、最後のは片手で数えるほどしか使ったことはねえけどな。",2016-11-25 16:39:15,802265418765193218
Oklahoma City Thunder player’s brother killed in shooting... https://goo.gl/fb/wbUzNf # oklahomacitythunder,2016-11-25 16:39:02,802265363622797313
This trade for Rudy Gay to the thunder needs to happen Already,2016-11-25 16:38:56,802265337634947072
Tropic Thunder is such an underated film,2016-11-25 16:38:39,802265267870908416
"Lo, these are part of his ways; but how little a portion is heard of him? but the thunder of his power who can understanding.",2016-11-25 16:38:29,802265226066493444
There's like thunder and rain and I can think of no better weather to wake up too,2016-11-25 16:38:25,802265209071013888
University of Buffalo Thunder,2016-11-25 16:38:14,802265160329129984
"Yesterday, Thunder Storm has not been allowed to play. Rules are sames for everyones, no teams can be favorised",2016-11-25 16:38:13,802265156323377152
War Thunder - GAMEPLAY RÁPIDO P-51 MUSTANG (TUTORIAL E DICAS PT-BR 2016): http://youtu.be/HdMhfeq5fx4?a via @ YouTube,2016-11-25 16:38:10,802265146710179840
Adicionei um vídeo a uma playlist @ YouTube http://youtu.be/HdMhfeq5fx4?aWar … Thunder - GAMEPLAY RÁPIDO P-51 MUSTANG (TUTORIAL E DICAS PT-BR,2016-11-25 16:38:06,802265128125267969
Strike pass thunder https://twitter.com/iam_rqb/status/801898826453946368 …,2016-11-25 16:37:40,802265019463430145
GWH News and Notes: NAWA/NGWA Thanksgiving Thunder Report from Rome on... http://gwhnewsandnotes.blogspot.com/2016/11/nawangwa-thanksgiving-thunder-report.html?spref=tw …,2016-11-25 16:37:39,802265015696797696
If the thunder lose tonight I'm taking suicide pills word to @ RealAlexJones,2016-11-25 16:37:28,802264969626558465
# Thunder & # LeeJoon https://www.instagram.com/p/BNPVseHD_vb/ pic.twitter.com/PY6izzE7XF,2016-11-25 16:37:13,802264905567059969
Se thunder droppa nell'album qualcosa con changsun mi butto senza pensarci due volte,2016-11-25 16:37:11,802264897073647616
"""Thunder toughed it out so you wouldn't feel sad!"" IM CRYING",2016-11-25 16:37:07,802264880250241024
New Favourite: Relaxing Rain and Thunder von Nature Sounds http://www.deezer.com/album/3128211 @ DeezerDE,2016-11-25 16:36:55,802264827955712000
"Thunder Beach, A Merrick McKnight Mystery by Michael Lister, Now Available at a Special Price http://tinyurl.com/gl8k33x",2016-11-25 16:36:12,802264649865408512
raise your words not your voice it's rain that grows flowers not the thunder.,2016-11-25 16:35:50,802264559432192000
Tomorrow night in 9910 The Mothercraft // Black Thunder // Counterfeit Jeans... http://fb.me/3gWya6Mc4,2016-11-25 16:35:16,802264413986287616
Tomorrow night in 9910 The Mothercraft // Black Thunder // Counterfeit Jeans... http://fb.me/54GdyhOUZ,2016-11-25 16:35:14,802264405207552001
lol I think Packham stole my thunder X,2016-11-25 16:35:09,802264383774670848
Nuggets to have only 10 players available in game against Thunder http://growingdenver.com/colorado-news/news/nuggets-to-have-only-10-players-available-in-game-against-thunder/ …pic.twitter.com/DVk1FHVxPo,2016-11-25 16:34:52,802264312547069952
"He's stealing your thunder, baby blue ain't your color",2016-11-25 16:34:25,802264201729343489
"Range: Close Burst 3 Attack: Int vs. Reflex Hit: 5 + Con modifier thunder damage, and the target is deafened (Save Ends)",2016-11-25 16:34:12,802264145487740928
Best of luck Demigoddess & connections race 5 @ DelMarRacing @ murraystroud # FirstDude / La Chica Sensual (Lightnin N Thunder) # HorseRacing,2016-11-25 16:34:00,802264098025025536
I haven't heard thunder and experience the speed of lightning in a while ....its rare in kaaptad.,2016-11-25 16:33:36,802263993616363520
Thunder Birds USAF Air Show Turkey Türkiye Hava Gösterisi 2011 http://www.youtube.com/watch?v=3oWi5RSie5Y …,2016-11-25 16:32:55,802263822698364928
"""Cure the Thunder""! # концерт # лазарев # сергейлазарев # шоу # шоубест # лазаревшоубест # потрясающе… https://www.instagram.com/p/BNPwAYugNBp/",2016-11-25 16:32:19,802263670554292225
my phone is a thunder cunt most of the time.,2016-11-25 16:32:04,802263610961473536
Thunder bowl tonight .,2016-11-25 16:31:59,802263588622766080
"Nba 6 folds and 7 fold accas magic+2,hornets-1.5,hawks+3.5,raptors-3,thunder-2.5,timberwolves-2and rockets-3.5 good luck all",2016-11-25 16:31:55,802263569945522176
"http://ift.tt/2dJV5R6 Cardfight Vanguard TCG Resonance Of Thunder Dragon TD06 Trial Deck http://ift.tt/2dLzSdf # tweet # tradingcards, …",2016-11-25 16:31:53,802263565449117696
"NBA Trade Rumors: Washington Wizards to trade Otto Porter Jr., Marcin Gortat to Oklahoma City Thunder? - Headli... http://ow.ly/5CkW506TA1R",2016-11-25 16:31:27,802263453003976704
I'd post one too but why steal his thunder? Pass the gravy ... - Ron On Mix 97.7 http://fb.me/LPAScUAp,2016-11-25 16:30:41,802263263073406976
1u Denver Nuggets to beat Oklahoma City Thunder @2.3. # NBA # Betting,2016-11-25 16:30:03,802263104059047936
Joffrey Lauvergne prend du galon dans la rotation du Thunder https://goo.gl/kYg58B pic.twitter.com/5u6Fvc18R0,2016-11-25 16:29:12,802262887205048320
Yo pensando en reactivar el canal y adivinad que tengo en mis manos ya? la pre-beta de War Thunder Ships :),2016-11-25 16:28:18,802262662767898624
"I put the rage in river, roll in thunder, you saved me from going under when that current got too heavy.",2016-11-25 16:28:16,802262652420374528
"its thunder in di plaace, when you see she whine she waaaiiisstt",2016-11-25 16:28:07,802262617444282368
No.145 サンダー thunder(英語:雷),2016-11-25 16:28:05,802262606836690945
Oklahoma Thunder Inspired Pacifier Clip by morethanbearscrafts http://etsy.me/1sYAWvS via @ Etsy,2016-11-25 16:27:40,802262503090716672
"@ voteandstay @ i_am_Anomeli @ RadicalYouthMan @ mr_ochonogor thunder fire ur mouth, who told they are free.",2016-11-25 16:27:37,802262490939727873
Support Thunder Clap click on image and then click support button at bottom. Use your social media network https://www.thunderclap.it/projects/50549-national-pothole-day-2017 …,2016-11-25 16:27:12,802262382944735232
War Thunder Защити Москву или захвати Желающим поддержать стриммера: http://www.donationalerts.ru/r/crypto_pavlet - попадешь на TV с… http://dlvr.it/MlDXnC pic.twitter.com/vr495oGZ01,2016-11-25 16:27:09,802262373494947840
Joffrey Lauvergne se va haciendo sitio en los Thunder http://viid.me/qq3jJj pic.twitter.com/N0G2BoGaNU,2016-11-25 16:26:44,802262267978924032
gallinari yok. thunder galibiyete yakın taraf,2016-11-25 16:26:37,802262239612801024
Exo - thunder,2016-11-25 16:26:02,802262092090777600
Today Ezekiel Gee was so scared of the police.. He was lamenting about how thunder go fire buhari...with his tone... http://fb.me/6xE0BB7Yt,2016-11-25 16:25:54,802262057370456064
@ CorvusClan # hellocorvus oye puedes hacer un directo de war thunder ??,2016-11-25 16:25:42,802262007068037120
"Raise your words, not voice. It is rain that grows flowers, not thunder. - Rumi # quote",2016-11-25 16:25:30,802261958909104129
"Praying for Zach's family. Huge rival for the Thunder, but nothing but respect for the man! https://twitter.com/sportscenter/status/802261584856973313 …",2016-11-25 16:25:11,802261875736117248
"Raise your words, not voice. It is rain that grows flowers, not thunder. - Rumi # quote",2016-11-25 16:25:06,802261856660361216
"Sorcerer since can summon, nice ccs, thunder powers like the Star Wars Emperor Sith # FreeCodeFriday",2016-11-25 16:24:54,802261807658373120
THUNDER COMICS: Dinosaurs : NEWS -- DATA http://thunderstormsuperhero.blogspot.com/2016/11/dinosaurs-news-data.html?spref=tw …,2016-11-25 16:24:51,802261792768393217
Thunder vs Nuggets tonight. Here's Russ on the matchup. # ThunderUppic.twitter.com/ZJxDsGM5hJ,2016-11-25 16:24:34,802261723625320449
CONTESTS & PRIZES! http://bit.ly/2fhxCda A MIGHTY ROLLING THUNDER Book Release Party on Facebook 12/11 3-6 PM EST # mustreadbooks,2016-11-25 16:24:34,802261721696108544
je t'aime thunder,2016-11-25 16:24:06,802261606272897024
"Tie, tie, thunder https://twitter.com/akhilieus/status/742781319462158338 …",2016-11-25 16:24:04,802261594814062592
"I had one called ""dogfighting"" for a while. It wasn't about pit-fighting canines, I swear. Was for playing War Thunder to.",2016-11-25 16:23:59,802261574958321665
@ ninox_morpork Look what I made with Purple Thunder! pic.twitter.com/nUs6BQVxJm,2016-11-25 16:23:59,802261573817356288
Tetszett egy videó ( @ YouTube): http://youtu.be/D69g-lA_l2g?a – War Thunder HUN - Farmoljunk a Super Pershing megszerzéséért #2 - És,2016-11-25 16:23:51,802261540447600640
"Ash is always using Thunderbolt when he can always use Thunder,",2016-11-25 16:23:42,802261503407702016
Get a tattoo of a sun so my mum decided to draw a thunder cloud on my dad thinking they're jokes x funny one gals x pic.twitter.com/2dP0g6WWNi,2016-11-25 16:23:40,802261497082744833
"Los dos picks que llevo esta noche: OKC Thunder -2.5AH @ 1.90 2/5 SAC Kings +4AH @ 1.83 2/5 -> Para valientes, victoria de Kings @ 2.45",2016-11-25 16:23:24,802261429357334528
"Thunder need some confidence, beat some teams ass. But they play to their competitions level",2016-11-25 16:23:03,802261340312084480
That flag also carries an undertone of racism because of its ties to slavery. We only have 1 flag!,2016-11-25 16:22:07,802261106597199872
"RDJ's Kiss Kiss Bang Bang , Chaplin, Zodiac, Tropic Thunder , last party , singing detective , scanner darkly , less than zero.",2016-11-25 16:21:47,802261023164010496
"IM TELLING YOOOU, YOU DONT NEED THAT GUY. ITS SO BLACK AND WHITE, HES STEALING YOUR THUNDER.",2016-11-25 16:21:35,802260971607752704
Black Thunder Night ひたすらセッションする練習会でしたが、日頃の溜まったのものを全て解放して踊ってきました。 別にブラックサンダーもらえなかったけどMVD(most valuable debu)賞もらえました。これからも一人前のデブとして頑張ります。,2016-11-25 16:21:13,802260878150074369
One of my favorite ideas: Thunder Road to host speedskating! (© pending),2016-11-25 16:21:09,802260862756995072
NBA Wiz/Magic UN 51.5 1Q Cavs -5 1Q Grizzlies -2 1Q Thunder/Nuggets UN 55 1Q Rockets/Kings OV 111.5 1H BOL @ MadpicksCrew,2016-11-25 16:21:08,802260858977910784
If the Thunder lose to half of a Nuggets team,2016-11-25 16:20:46,802260766472617984
今日の腕試しタイピング（ローマ字）の結果は「Thunder」スコア「333」でした。 http://www.e-typing.ne.jp/ # etyping # et_r,2016-11-25 16:20:23,802260671282823168
@ okcthunder # WeAreThunder. My granddaughter Emerson Leigh. Loves her THUNDER. # ThunderNation # ThunderUppic.twitter.com/wx2MfvqXr7,2016-11-25 16:20:15,802260636415598592
She turned from respected to Megyn Kardashian! Her face doesn't even move anymore,2016-11-25 16:19:58,802260562356924416
All day we've been waiting to put our A* GCSE Latin to good use...and then you come along and steal our thunder.,2016-11-25 16:19:52,802260540567552000
But of the thunder and lightning of the thick cloud and the technicity.,2016-11-25 16:19:12,802260372380008449
"Confirmado: Thunder existe há 57 anos, e ganhou o bicampeonato mundial há 53!! pic.twitter.com/NjroHaTsQ6",2016-11-25 16:19:09,802260358723465216
"Now Playing: ""Did I Just Hear The Thunder (SOGR Radio Edit)"" By ""The Perrys"" is on SOGR Radio # NowPlayingOnSOGR",2016-11-25 16:18:30,802260196680761344
@ okcthunder # WeAreThunder. My granddaughter Addison Paige. Already a Thunder fan. # ThunderNation # LoveMyThunderpic.twitter.com/SgNpAZzxqZ,2016-11-25 16:18:30,802260195837640704
"Мне понравилось видео ""[WAR THUNDER]__Пятничные покатушки!__Вечерний стим!""",2016-11-25 16:17:32,802259950911164416
Team thunder cats have just experienced what a death in the party feels like.... and the stress of trying to ressurect them. # rollonmonday,2016-11-25 16:17:14,802259875988439042
"Me: ""Just die new phone!"" New phone: ""I don't want to die!"" Me: ""I WILL BRING YOU BACK! THIS I VOW!"" *flash of lighting and thunder* pic.twitter.com/duJMa3EY5H",2016-11-25 16:17:05,802259836859809792
Nuggets missing their best players? Calls for a Thunder loss since thats the trend. Teams are catching on https://twitter.com/chrisadempsey/status/802225729157087232 …,2016-11-25 16:17:04,802259834984726528
The Denver Post - Nuggets to have only 10 players available in game against Thunder http://ow.ly/K0r6506TyAm,2016-11-25 16:16:13,802259621427691521
LINEUP ANNOUNCED FOR STARS AND THUNDER – TIMMINS INTERNATIONAL FIREWORKS COMPETITION AND… https://goo.gl/fb/VnQ3kR,2016-11-25 16:15:56,802259549440933888
# NBAnews # basketball Draymond Green: No way Kevin Durant signs with Warriors if Thunder beat them http://ow.ly/wrJj506Tyal,2016-11-25 16:15:52,802259533032787968
::easily reverses the Crooked Thunder Metroplex::,2016-11-25 16:15:29,802259434827350017
"According to my father, Luka whom everyone thought was a dog is actually a cat, and Thunder who Id have sweared was a cat is actually a dog",2016-11-25 16:15:29,802259434315640832
I hear things are rough in the restaurant business. She looked like thunder when we walked in. It must be bad.,2016-11-25 16:15:20,802259396810182656
Thunder is now available for adoption! This male Basset Hound is 10yrs 1mth old. Learn more at http://petango.com/Adopt/Dog-Basset-Hound-33783843 …,2016-11-25 16:15:05,802259335346798592
"Nov 25 Game Score: AE - Minor Midget AE - 4, Halton Halton Hills Thunder - 7 http://tinyurl.com/znqokl3",2016-11-25 16:14:17,802259135878299648
Lakehead University's Business programs (Thunder Bay) are AACSB-accredited. Fewer than 5% of the world's business schools are. # exceptionalpic.twitter.com/noMOWViS7k,2016-11-25 16:14:11,802259107256430597
THUNDER - adebisi shank album 不明 http://youtu.be/a36LAo4YxfA 海外のマスロックインストバンド。変拍子と、特徴的なギター・ベースは要必見。,2016-11-25 16:13:33,802258947931455488
so are the St. Ignatius Falcons from Thunder Bay @ TBCDSB_Ignatius and the Kodiaks of @ CreekAthletics,2016-11-25 16:13:31,802258941581389824
Support # NationalPotholeDay via Thunder Clap https://www.thunderclap.it/projects/50549-national-pothole-day-2017 …,2016-11-25 16:13:01,802258813889806337
Go check out my buddy Paxy for some first impressions of War Thunder boats RIGHT NOW!!! https://www.twitch.tv/classypax,2016-11-25 16:12:55,802258788996775937
26 de Noviembre 03:00 # NBA Oklahoma City Thunder -2.5 @1.94 Stk 5 Marathonbet,2016-11-25 16:12:31,802258690266935296
"GOAL: Eastwood CFC 2-0 Selston FC, Jack Smith thunders a free kick into top corner from 30 yards after 70 minutes # SFC",2016-11-25 16:11:23,802258403632545793
"Dr. David Savage, family medicine resident from Northern Ontario School of Medicine West site in Thunder Bay,... http://fb.me/8fqApscrC",2016-11-25 16:11:17,802258379045367808
"Nov 25 Game Score: Atom AE - 3, Oro Thunder - 3 http://tinyurl.com/gpd8v64",2016-11-25 16:10:19,802258133905244161
Spent Black Friday on Thunder Chicken trails instead of roads. # getoutside # optoutside # everydaywild # bicycle # bikelife # mighthurttomorrowpic.twitter.com/tjyXvJWpA8,2016-11-25 16:10:07,802258087176536065
あなたとオマエがいたから、俺は強くなれた。感謝している。ありがとう。 by Ciera Thunders,2016-11-25 16:10:02,802258062815862784
Thunder look to get back on track in the Mile High City with @TheStaturbator http://thunderousintentions.com/2016/11/25/thunder-back-track-mile-high/ …,2016-11-25 16:10:01,802258058692808704
I liked a @ YouTube video http://youtu.be/tAvPH_8uOn4?a SHIPS ARE HERE! - American Elco PT-314 (War Thunder Ships Gameplay),2016-11-25 16:09:25,802257907408629760
Come join me tonight at midnight for ROLLING THUNDER at @ musicboxtheatre.,2016-11-25 16:09:24,802257904829087745
"@ blaruethezebra , @ AeroViro just stole your sneezing thunder on a stream. Clearly fight to the death is only solution.",2016-11-25 16:09:23,802257899812569088
"Yok yahu, demin linkini verdiğim torrent sitesinde thunder:... şeklinde linkler de vardı, nedir diye baktım öyle öğrendim :D",2016-11-25 16:09:11,802257851792158721
wait this is so cute lmao,2016-11-25 16:08:48,802257755167977472
Looks like some rain showers around kick off time. May even hear a rumble of thunder. Get those umbrellas ready ! pic.twitter.com/3Kti4Xq6EZ,2016-11-25 16:08:29,802257674448404480
