text,date,id
Denver Nuggets vs OKC Thunder: 2 Focal Game Keys - Nugg Love http://dlvr.it/MlBTKb,2016-11-25 13:44:05,802221337078996992
Adicionei um vídeo a uma playlist @ YouTube http://youtu.be/ui-r8oeIA6c?aBlack … Ops 2 Custom Emblem Creation - Oklahoma City Thunder Logo,2016-11-25 13:43:32,802221195894620160
L'intro de Heavy Metal Thunder de Saxin est plus que lourde,2016-11-25 13:43:26,802221171651579904
LMAO! I'm so tired of people saying I'm hearing thunder... like I don't know how gun shots sound like. Nx!,2016-11-25 13:43:25,802221166282833920
"Now that Pikachu learned thunder, it's time to do what Ash never did.",2016-11-25 13:43:14,802221121940635648
thunder? what in the world,2016-11-25 13:43:06,802221089321402369
"# GoLakers # LakerNation # Lakers Durant, Westbrook See Similarities To Young Thunder In Lakers http://dld.bz/fhftk",2016-11-25 13:43:03,802221074905702400
"thunder only happens when it's raining, players only love you when they're playing",2016-11-25 13:42:53,802221032878866432
"Como podemos te ajudar, Thi?",2016-11-25 13:42:51,802221025865990144
Jozi thunder storm....such power and awe!,2016-11-25 13:42:21,802220897730002948
"""Yes,Sango is the god of lightning and thunder,but all the sacrifices made to Sango has not generated 1KW of electric power ""~Tunde Fashola",2016-11-25 13:42:21,802220897428008960
うわー腹立つw ほら、ハグしに関西までおいで((,2016-11-25 13:41:58,802220801013358592
Thunder Ridge! * * * # hiking # nature # trailrunning # fitness # fitspo # ootd # uniqlo (jacket and… https://www.instagram.com/p/BNPll_pD3ND/,2016-11-25 13:41:29,802220682440568832
"http://ift.tt/2fwzie1 # shoes Air Jordan 14 Retro - 9 ""Thunder"" - 487471 070",2016-11-25 13:41:25,802220664505634817
"http://ift.tt/2fwzie1 Air Jordan 14 Retro - 9 ""Thunder"" - 487471 070",2016-11-25 13:41:22,802220653051084800
"Мне понравилось видео ""ПЕРВЫЙ СТРИМ ФЛОТА В WAR THUNDER! НАЧАЛО в 20:00 по МСК""",2016-11-25 13:41:17,802220631144153088
Check out my broadcast from my PlayStation 4! # PS4live (War Thunder) live at https://youtu.be/R8CilZjclzw,2016-11-25 13:41:12,802220608582979584
Catch a Preview of @ NCCUAthletics - @ Wheaton_Thunder @ NCAADIII # football Playoffs @ MinorLgeReport http://minorleaguesportsreport.com/index.php/ncaa-division-iii-playoffs-r-2-north-central-vs-wheaton/ …,2016-11-25 13:40:43,802220486084149248
couldn't have happened without your okc thunder blowing a 3-1 lead to the warriors :),2016-11-25 13:40:31,802220435819610113
Friday night bants With the chocolate thunder @ kazebleekpic.twitter.com/VVJ5xDKUD6,2016-11-25 13:40:28,802220424549560320
# np Fliptrix - Thunder Clouds,2016-11-25 13:40:06,802220334439079936
Shawty's catching the thunder pipe tonight,2016-11-25 13:39:41,802220228147089413
Once upon a time a used to have a thunder buddy,2016-11-25 13:39:27,802220170160799744
水 水 樹 音 天雷 - Heaven's Thunder,2016-11-25 13:39:09,802220092729618432
Thunder are 110-76-4 ATS off a SU loss since 2009. Get more winning NBA Systems and Trends for Friday at http://edthestatman.com/category/nba/nba-daily-data/ …,2016-11-25 13:38:56,802220038375768064
i listened to thunder when i was in the queue to calm me down,2016-11-25 13:38:36,802219955483721729
I liked a @ YouTube video http://youtu.be/6pGEHLbzWdg?a 12 Hours - Relaxing Rainstorm With Thunder - Mix #2 - Sleep Sounds / Ambient /,2016-11-25 13:38:22,802219896130113536
"Durant, Westbrook See Similarities To Young Thunder In Lakers: Kevin Durant and Russell Westbrook see some… http://dlvr.it/MlBP6W",2016-11-25 13:37:15,802219616684474368
Haiti’s Rainy-Day Presidential Elections Without Clinton Thunder http://www.dadychery.org/2016/11/19/haitis-rainy-day-presidential-elections-without-clinton-thunder/ … via @ DadyChery,2016-11-25 13:37:09,802219588222156801
It is 13:37 in Thunder Bay https://en.wikipedia.org/wiki/Thunder_Bay …,2016-11-25 13:37:01,802219558677475328
Haiti’s Rainy-Day Presidential Elections Without Clinton Thunder https://lnkd.in/eauCyGm,2016-11-25 13:37:01,802219555414245377
hell naw OTs & young thunder cats want those,2016-11-25 13:37:00,802219553912717312
Freedom Call - Thunder God (Live in Helvetia) https://www.youtube.com/watch?v=59BGRtSWXXU …,2016-11-25 13:36:51,802219513752207361
It's beginning to look a lot like a business @ thunder_seed # BOOMpic.twitter.com/1l7a8NNSEm,2016-11-25 13:36:46,802219495775289352
"Мне понравилось видео ""War Thunder. Эпичная нарезка. Бронетехника.""",2016-11-25 13:36:46,802219492071899140
Haiti’s Rainy-Day Presidential Elections Without Clinton Thunder | Haiti Chery http://www.dadychery.org/2016/11/19/haitis-rainy-day-presidential-elections-without-clinton-thunder/ … MUST read @ DadyChery,2016-11-25 13:36:28,802219418768048128
"Then she packed her shit and she ran Like a coward when the thunder struck. Things aren't always picture perfect, But picture us on. (+)",2016-11-25 13:36:16,802219369027764224
"Durant, Westbrook See Similarities To Young Thunder In Lakers http://dlvr.it/MlBNSk # NBA # NOSN",2016-11-25 13:36:12,802219350933417987
Thunder Bay police look for missing Ottawa man with epilepsy http://dlvr.it/MlBNC4 pic.twitter.com/8NAady9g35,2016-11-25 13:36:09,802219337461284864
それもうハグじゃないやろ！！,2016-11-25 13:36:06,802219325251690496
Snapchat: thunder_cunts Watch me suck a pint of milk out some girls ass,2016-11-25 13:35:59,802219294998351873
"What kind of magic spell to use? Slime and snails, or puppy dogs' tails? Thunder or lightning, something frightening?",2016-11-25 13:35:44,802219234092716032
which means they lose by 7,2016-11-25 13:35:40,802219216367710208
I Like: 05. Retro Thunder - Summer 82 by Retro Thunder https://soundcloud.com/retro-thunder/05-retro-thunder-summer-82 … on # SoundCloud,2016-11-25 13:35:24,802219148768112640
No space for 2 Thunder Megazords lol,2016-11-25 13:35:20,802219134998220800
War Thunder ЗБТ флотаc Tankonavterom 18+ !!!!!: http://youtu.be/B34joJ7pmyI?a на @ YouTube,2016-11-25 13:34:53,802219021428985858
Keep it? You could display the Tigerzord combo along side Red Dragon and the Thunder Megazord.,2016-11-25 13:34:22,802218890252132352
"Campbell:Jolteon 64.44% (1/14/14/Thunder Shock/Thunderbolt) till 18:49:05 (14m 47s). http://maps.google.com/maps?q=37.30212377759942,-121.93908939628031 …",2016-11-25 13:34:08,802218831393325056
Finding a coral cable means you will detect a far away thunder.,2016-11-25 13:34:04,802218814263980032
"Sieg Heil, mein Fuhrer! (Este...wala bang Duterte Seniors, para sa mga thunders naman hehe .) pic.twitter.com/ydtM0JdzWm",2016-11-25 13:34:03,802218811973726208
"Se vi siete persi la prima puntata di ""Heavy Metal Thunder"" con il nostro Fabio ""Flames"".. potete ascoltarla qui:... http://fb.me/1HjiVap44",2016-11-25 13:33:59,802218792357138432
"""... was that a thunder? Naah, it's flash from @ GoogleEarth taking photos."" Haha, this joke cranks me up. # Joke # Funny # LoL # Google # GPS",2016-11-25 13:33:57,802218786002796544
vc disse que ia mudar o neme do canal e que tal esse nome:Thunder Plays,2016-11-25 13:33:40,802218714183573504
I love thunder thighs https://twitter.com/maxmstein/status/800036199452655616 …,2016-11-25 13:33:37,802218699461689344
@rubenc_official Thunders of love me parece una buena canción pero hace falta un poco más de fuerza y garra. # Eurocasting,2016-11-25 13:33:15,802218608130723840
Now when it rain I'm always prepared for the thunder !,2016-11-25 13:32:54,802218521707085824
"Raise your words, not voice. It is rain that grows flowers, not thunder. - Rumi # quote",2016-11-25 13:32:45,802218482637086720
I liked a @ YouTube video from @ krispyflakes2k http://youtu.be/OMcvR0SAdgM?a Re-Doing the Oklahoma City Thunder Off-Season!,2016-11-25 13:32:38,802218452555628545
"# OMG see here huge thunder # Armpit, would like to smell and i'll lick madly. @ MissTylerXXX eyes seducing hot. Dick want to funck n cum https://twitter.com/luckysi159/status/802212106053435392 …",2016-11-25 13:32:32,802218428060737536
●とんだのワンマンDVD / THUNDER http://goo.gl/0XCbFV 2015年10月4日、大阪の港付近にある大型ライブハウスPARTITAで開催されたTHUNDER ONE MAN LIVEが映像化！ 熱く、そして暖かいTHUNDERのワンマンLIVE♪,2016-11-25 13:32:30,802218419588210689
"@SwingVector is the ""thunder"" person still bearish? he blocked me..",2016-11-25 13:32:19,802218374168252416
Some of our thunder wrestlers getting ready for the tough guy tournament! http://fb.me/8tVVVylB0,2016-11-25 13:32:09,802218330492833792
"He's stealing your thunder. Baby, blue ain't your color",2016-11-25 13:32:03,802218306857881600
I don't fear thunder it's the lightining that kills https://twitter.com/nii_marley/status/801891207475499010 …,2016-11-25 13:31:41,802218214444990464
"Oh sweet, just found a Thunder Stone, I can evolve Pikachu now... but I'm going to wait until I get Thunderbolt.",2016-11-25 13:31:33,802218179489624065
"Мне понравилось видео ""Обзор Me.163 ""РАКЕТА ПВО!"" War Thunder"" (http://youtu.be/3ilJwAx6g7k?a )",2016-11-25 13:31:26,802218151576502273
"@ RollingStone Really? 100 Greatest Drummers of All Time and the ""Thunder God"" Rick Allen doesn't make the list? Pathetic!",2016-11-25 13:31:19,802218120802893824
el teclado mecánico de Thunder 3X estaba a un precio de puta madre,2016-11-25 13:31:12,802218092671672320
"Download this whitepaper now, ""Harley-Davidson Thunders Toward Dynamic # CustomerEngagement"" http://bit.ly/2bE6gcL",2016-11-25 13:30:47,802217988673982464
That's not creepy at all ... at 3am during a thunder and lightning storm.,2016-11-25 13:30:40,802217960530059264
Now playing # Wasp - Thunder Red on http://zombie-radio.com,2016-11-25 13:30:14,802217847627902976
Now playing # Wasp - Thunder Red on http://zombie-radio.com,2016-11-25 13:30:13,802217846881320961
thunderはもっと捲れる(*´ω｀*),2016-11-25 13:30:12,802217841348907008
2008-09 UPPER DECK PREMIER RUSSELL WESTBROOK RC JSY AU 52/199 THUNDER BGS 8.5 10 http://www.sportsmemcards.info/US/landing-static/twitter07/?id=http://rover.ebay.com/rover/1/711-53200-19255-0/1?ff3=2&toolid=10039&campid=5337889870&item=351915873069&vectorid=229466&lgeo=1 …pic.twitter.com/lTQ8EudbZp,2016-11-25 13:29:55,802217770695925760
# Nuggets Danilo Gallinari (right thigh soreness) will not play Friday vs. the Thunder. http://bit.ly/PsMI9f,2016-11-25 13:29:37,802217695861096448
@ HalogenTalks what thunder Pokémon should I scoop for my team,2016-11-25 13:29:24,802217638088900610
サンダさんサンタさんだからプレゼント与える方でしょ！JCの中古下着くれるならまっきーをプレゼントしてあげましょう,2016-11-25 13:29:21,802217625770000384
Debating if I should even return the Legacy Thunder Megazord that I bought a few days ago or just sell it online.,2016-11-25 13:29:11,802217585563537408
I liked a @ YouTube video from @ raptorgamer http://youtu.be/_7w386KyQps?a SHIPS PRE-BETA | War Thunder Naval Forces Gameplay,2016-11-25 13:29:05,802217558283812864
. @ mosomondo さんの @ YouTube 動画を高く評価しました: http://youtu.be/Tv_RRksNxUo?a 【War Thunder配信,2016-11-25 13:29:00,802217537173913600
"I may just be old, but the sound of the rain is magical and soo soothing, with the gentle grumble of thunder, while snuggled in softness",2016-11-25 13:28:21,802217376645259264
# nowplaying # TranceFamily # IrishTranceFamily W&W - Thunder - Original Mix http://trancepulsefm.com,2016-11-25 13:27:54,802217263319437312
Danilo Gallinari (right thigh soreness) will not play Friday vs. the Thunder.,2016-11-25 13:27:21,802217125284892672
Celtic Thunder Hog Chapter just delivered Santa to Waterford http://fb.me/1G2zLzbxL,2016-11-25 13:27:19,802217115080126464
Fall in love this # BlackFriday with @ KatieMcGarry's awesome new Thunder Road series. # WalkTheEdge is now only 99p! http://buff.ly/2fBIKxL pic.twitter.com/FBzRwJJECY,2016-11-25 13:27:02,802217042472562688
Where lust will take you RT @ ThaYaw: @ Miss_Andero Thunder Thighs,2016-11-25 13:26:37,802216940127322116
Thunder up!,2016-11-25 13:26:29,802216904240889856
"Aaw :c Thunder is, well it doesn't really bother me tbh. What I love about thunderstorms is the beauty of lightning ♡",2016-11-25 13:26:04,802216799265812480
AMÉM THUNDER AMÉM,2016-11-25 13:26:01,802216787421102080
I liked a @ YouTube video from @ krispyflakes2k http://youtu.be/OMcvR0SAdgM?a Re-Doing the Oklahoma City Thunder Off-Season!,2016-11-25 13:25:54,802216758358798339
Me ha gustado un vídeo de @ YouTube de @ gusanohd (http://youtu.be/8wis_iiJVsk?a - War thunder - Directo en Español | Batallas Navales y,2016-11-25 13:25:32,802216668596490240
Very nice run from Lokie's Vengeance in the Thunder Rumble under a good ride from @ jose93_ortiz # Amyspick,2016-11-25 13:25:24,802216635067207680
"COME ON THUNDER, COME ON THUNDER... @ BBClamacqshow playing Lancaster's national anthem",2016-11-25 13:25:16,802216597775646721
# NBA Lakers Highlights vs Oklahoma City Thunder // 2016 - 2017 NBA Season // 11.22.2016 http://medianba.com/lakers-highlights-vs-oklahoma-city-thunder-2016-2017-nba-season-11-22-2016/ …pic.twitter.com/nIiDNH2zDd,2016-11-25 13:24:56,802216516049584128
Loki's Vengeance and Jose Ortiz win the Thunder Rumble division of the NYSS! pic.twitter.com/9Uu0DNoXaD,2016-11-25 13:24:47,802216476228714496
"De Johnny Thunders escuchas ""Personality crisis"" en # DéjaloSangrar.https://youtu.be/JkkLakO4eB0",2016-11-25 13:24:41,802216453890080768
[My Little Twitter] Начало предварительного тестирования флота в War Thunder! ФЛОТ War Thunder! ПЕРВЫЙ ГЕЙМПЛЕЙ! 20 http://video.t30p.ru/post.aspx?id=b46b8d0f-baeb-49c6-b014-3185d003fadc …,2016-11-25 13:24:32,802216415713513474
"If you ride like lightning, you're gonna crash like thunder. pic.twitter.com/Wn9MhjYqXb",2016-11-25 13:24:31,802216411485577216
@ thunder_67au Happy Birthday u dork! pic.twitter.com/8HGTznFpf1,2016-11-25 13:24:29,802216402060853248
The indigenous teen who escaped death in a Thunder Bay river https://www.thestar.com/news/canada/2016/11/24/the-indigenous-teen-who-escaped-death-in-a-thunder-bay-river.html …,2016-11-25 13:24:26,802216388651847682
The indigenous teen who escaped death in a Thunder Bay river https://www.thestar.com/news/canada/2016/11/24/the-indigenous-teen-who-escaped-death-in-a-thunder-bay-river.html …,2016-11-25 13:24:26,802216388244996096
Cuma Ki-84 yang dituduh OP di War Thunder karena flight model-nya persis dengan aslinya,2016-11-25 13:24:07,802216310360850432
"Durant, Westbrook See Similarities To Young Thunder In Lakers http://basketball.realgm.com/wiretap/244102/Durant-Westbrook-See-Similarities-To-Young-Thunder-In-Lakers …",2016-11-25 13:24:06,802216308184125441
Satisfaction! Loki's Vengeance rolls once again in the NYSS Thunder Rumble with @ jose93_ortiz! # TheBigApic.twitter.com/cU6fRjwpAO,2016-11-25 13:24:06,802216305235521536
Phenomenal PRO Hla tobar thunder storm. Music maker jam https://api.jam-community.com/song/detail/b3c6695b-8f4f-11e6-9f28-02fe9cf35e65 …,2016-11-25 13:23:56,802216264303263745
"Loki's Vengeance MUCH the best in winning Thunder Rumble division of NYSS for 2nd straight year, this time gate to wire under @ jose93_ortiz",2016-11-25 13:23:42,802216206832902144
Cousins scores 36 in Kings’ 115-101 win over Thunder http://rincon-sports.com/2016/11/25/cousins-scores-36-in-kings-115-101-win-over-thunder-22/?utm_campaign=twitter&utm_medium=twitter&utm_source=twitter …,2016-11-25 13:23:18,802216104181407744
"Raise your words, not voice. It is rain that grows flowers, not thunder. - Rumi # quote",2016-11-25 13:23:16,802216096849940481
"My own version of the thunder bolt @Ngozika Estate, Awka https://www.instagram.com/p/BNPjgOcFwnX/",2016-11-25 13:23:16,802216095847510016
まー、でもけっこう突貫で埋めただろうし、沈んでもしょうがない気も…。,2016-11-25 13:23:15,802216091409731585
The indigenous teen who escaped death in a Thunder Bay river,2016-11-25 13:23:14,802216088675254273
"Выбил миллион в War Thunder, ехуууу))",2016-11-25 13:22:44,802215961365454850
"If dreams were lightning and thunder was desire, this old house would have burnt down a long time ago.",2016-11-25 13:22:36,802215927429427201
"Damn it's cold! The weather recently has been abit weird. Storms, cold days, torrential rains, thunder,lightning etc.",2016-11-25 13:22:25,802215881518567425
"Durant, Westbrook See Similarities To Young Thunder In Lakers http://bit.ly/2gHF7dV # basketball # sports # NBA",2016-11-25 13:22:12,802215827407835136
I liked a @ YouTube video from @ krispyflakes2k http://youtu.be/OMcvR0SAdgM?a Re-Doing the Oklahoma City Thunder Off-Season!,2016-11-25 13:22:04,802215793417220096
Ride like lightning. Crash like thunder.,2016-11-25 13:21:43,802215708436201472
"Yeah @ NaomiWWE, that one is legit. You could even pull off an alternative personality in that one. Trinity Thunder God.",2016-11-25 13:21:40,802215691873112064
Re-Doing the Oklahoma City Thunder Off-Season!: http://youtu.be/OMcvR0SAdgM?a via @ YouTube,2016-11-25 13:21:22,802215619252854785
War thunder на русском #6: http://youtu.be/LnM2GlANQ2g?a на @ YouTube,2016-11-25 13:21:10,802215566643785728
"Thunder Force II 2 (Sega Genesis, 1989) Complete - Tested http://dlvr.it/MlB8Tp pic.twitter.com/6ZpiuOqXRB",2016-11-25 13:20:24,802215376410931200
Predict the Opening Day Thunder rotation,2016-11-25 13:20:23,802215370341765124
Line Update: Denver Nuggets are now +2 from +1.5 vs Oklahoma City Thunder recorded at 01:20 # SportsBetting # NBA # Basketball,2016-11-25 13:20:14,802215332106694656
KD the traitor. Broken hearts all across thunder nation https://twitter.com/laiken_tay/status/802203248446898176 …,2016-11-25 13:20:10,802215316600356864
"Tymber Dalton's Blog - Gun Review: Bersa .380 Thunder Duotone - December 09, 2013 15:24 http://fb.me/ZY0FYbGm",2016-11-25 13:20:03,802215285352787968
"Мне понравилось видео ""ФЛОТ War Thunder! ПЕРВЫЙ ГЕЙМПЛЕЙ! 20:00 МСК!""",2016-11-25 13:20:01,802215278365077504
http://www.smogon.com/forums/threads/xurkitree-discussion.3586507/ … Tail Glow Energy Ball Dazzling Gleam Thunder Wave Solar Beam Calm Mind Rain Dance,2016-11-25 13:19:56,802215255493513216
【War Thunder配信 #101】夜な夜な惑星ウォーサンダー！ http://youtu.be/Tv_RRksNxUo?a,2016-11-25 13:19:36,802215175046791168
Dear Dr Thunder...,2016-11-25 13:19:32,802215158944858113
NBA predictions- 11/25 Celtics Magic Bulls Cavs Knicks Clips Pacers Hawks Raps Grizzlies Suns Thunder Blazers Rockets Warriors,2016-11-25 13:19:05,802215044855529473
"Мне понравилось видео ""Ar.234C-3 ""БОБЁР - УБИЙЦА!"" War Thunder"" (http://youtu.be/uTemjzbHaIQ?a )",2016-11-25 13:18:39,802214932586569728
Aghh thunder https://twitter.com/bestofmblaq/status/802207981626597376 …,2016-11-25 13:18:33,802214909450788864
War thunder - Directo en Español | Batallas Navales y sorteo posible cód... https://youtu.be/8wis_iiJVsk vía @ YouTube barcos y putas esta noche,2016-11-25 13:18:30,802214896209395713
"It's so black and white, he's stealing your thunder",2016-11-25 13:18:29,802214893491486720
Kickbacks from whom? From China u mean? JF 17 thunder is a joint project of Pk and China as far as we know,2016-11-25 13:17:40,802214688431935488
thunder scares me... ;-;,2016-11-25 13:17:34,802214663387611136
"couldn't hear the thunder, but i heard you heart race",2016-11-25 13:17:12,802214570374942721
# iPhone # iPad # AppStore Pricedrop Heavy Metal Thunder - The Interactive SciFi Gamebook from $3.99 to $2.99 http://www.appticker.com/app/2565895,2016-11-25 13:16:48,802214467564146688
# iPhone # iPad # AppStore Preissenkung Heavy Metal Thunder - The Interactive SciFi Gamebook 2.99 € statt 3.99 € http://www.appticker.de/app/2565895,2016-11-25 13:16:47,802214465425014784
Participa en el sorteo CARENADOS GP REGALA UN CASCO MT THUNDER de @ carenadosgp en http://sorteamus.com/r/2mrih @ sorteamus,2016-11-25 13:16:16,802214333967204352
"Sacramento Kings disponibilizou Omri Casspi para trocas. Vi perfis gringos cogitando ele no Thunder, o que vocês acham? pic.twitter.com/tWX99iHpXX",2016-11-25 13:16:14,802214328174788608
"""Sango is the god of lightening and thunder, but all the sacrifices made to Sango has not generated 1KW of electric power"" - @ tundefashola",2016-11-25 13:16:04,802214286479257600
@rubenc_official - Thunders Of Love Candidatura online # Eurocasting https://www.youtube.com/watch?v=YWM8j2cHiGc …,2016-11-25 13:15:37,802214173136551936
日経の速報にも挙がってた〜。,2016-11-25 13:15:13,802214072359915521
"Lo considero bastante fiable, ya que la cobertura de The Oklahoman con Thunder siempre lo es.",2016-11-25 13:14:55,802213995914653696
"""Eh strike ju Thunder lo"" https://twitter.com/iam_rqb/status/801898826453946368 …",2016-11-25 13:14:45,802213954269409280
http://sorteamus.com/r/mp8hm CARENADOS GP REGALA UN CASCO MT THUNDER,2016-11-25 13:14:41,802213937009881092
Though On Thurs...legacy Thunder Megazord for $66.61 from Amazon. # TF2Pics # BlackFriday # LiveLunch (A2)pic.twitter.com/U3NQSeMThR,2016-11-25 13:14:13,802213817753206784
Anybody got Thunder tickets for sale for Saturday's game?,2016-11-25 13:13:58,802213754767347712
Couldn't hear the thunder but i heard your heart race,2016-11-25 13:13:25,802213616623624192
The thunder goddess bestows a chartreuse doll on you in the rubber harbor.,2016-11-25 13:12:44,802213443717779457
@ Teenage_Thunder ya era hora ya...,2016-11-25 13:12:37,802213415594917888
"most of the problems occur during thunder storm season. Usually the magnetometer works, but data transmission to servers fail...",2016-11-25 13:12:32,802213397228032000
Thunder Bay police look for missing Ottawa man with epilepsy http://ift.tt/2g095bC # ottnews # ottawapic.twitter.com/uVlFAdCZ4w,2016-11-25 13:12:22,802213351317192704
Riders up!!! The NYSS Thunder Rumble is next! # TheBigApic.twitter.com/QO3Llexeie,2016-11-25 13:12:11,802213305414811648
When you give that Thunder you make my summer rain,2016-11-25 13:11:57,802213249093660672
Not Red Bull. Aldi brand Dark THUNDER!!!!!,2016-11-25 13:11:29,802213130491326464
Juan Hernangomez-Denver Nuggets Hernangomez exited the previous game due to an ankle injury and will not play Friday against the Thunder. # N,2016-11-25 13:11:24,802213111700869120
Cameron Payne-Oklahoma City Thunder Payne sustained an acute fracture to the fifth metatarsal in his right foot and remains without an offic,2016-11-25 13:11:24,802213110606077953
eRa - Thunder Flash (Tchaikovski's Concerto for Violon N°1),2016-11-25 13:11:20,802213091941511168
マジ？,2016-11-25 13:11:19,802213089307344896
Leona Lewis - Thunder http://rdo.to/WMXO # mix1015fm,2016-11-25 13:10:53,802212981899751424
How do the Pistons get the Clips & Thunder on a back-to-back? BRUTAL.,2016-11-25 13:10:40,802212925255651328
"Black Friday at Thunder Road HD, we have gifts for the whole family! http://fb.me/2Lnbk1Tur",2016-11-25 13:10:27,802212871027494919
"Black Friday at Thunder Road HD, we have gifts for the whole family! pic.twitter.com/zeH956wqEz",2016-11-25 13:10:25,802212864396300288
I added a video to a @ YouTube playlist http://youtu.be/5fNLEPrNi2A?a Thunderstorm and Rain Sounds - Heavy Thunder & lightning Strike,2016-11-25 13:10:12,802212808301694976
A look at the Thunder happenings for this post-Thanksgiving Friday. # ThunderUp http://dailythunder.com/friday-bolts-11-25-16/ …,2016-11-25 13:10:09,802212794917593088
Washington DC,2016-11-25 13:10:07,802212786235383808
Thunder look to get back on track in the Mile High City http://thunderousintentions.com/2016/11/25/thunder-back-track-mile-high/ …,2016-11-25 13:10:00,802212759366725633
"2015 NYSS Thunder Rumble winner, Loki's Vengeance looks to repeat! pic.twitter.com/1Jb9m7MFLp",2016-11-25 13:09:14,802212564495167491
"""Yes, Sango is god of lightning & thunder, but all the sacrifices made to Sango have not generated 1 KW of electric power."" - @ tundefashola",2016-11-25 13:09:12,802212555947200512
*starts a Thunder Dance*,2016-11-25 13:09:07,802212536690950144
"Мне понравилось видео ""War Thunder - Непредвзятый взгляд на флот.""",2016-11-25 13:08:47,802212450712092672
一人っ子だと思ってたpic.twitter.com/343n7X0rSg,2016-11-25 13:08:11,802212299020738560
U14AA Stinger girls defeated Fredericton Thunder 5-1. # MiramichiTourneypic.twitter.com/d6hrENLyN9,2016-11-25 13:08:06,802212278040981505
OKC Thunder: Westbrook's Triple-Double Helps Oklahoma City Bounce Back # # OklahomaCityThunder https://goo.gl/fb/DtzIBU,2016-11-25 13:08:04,802212269463584768
Thunder Ducks capture fifth straight Butler County Parks & Recreation Flag Football League title. pic.twitter.com/x0oxh5W5BI,2016-11-25 13:08:01,802212257866326017
Thunder X Nuggets PPG: Westbrook 31.8 X 16.8 Gallinari RPG: Westbrook 9.6 X 9.3 Faried APG: Westbrook 10.5 X 3.9 Mudiay # ThunderUp,2016-11-25 13:07:57,802212241751810048
. @ colecubelic @ CubeShow You misspoke. Terry Bowden was not fired mid season from Auburn. He resigned. Heard thunder in distance and bailed.,2016-11-25 13:07:55,802212233551953921
「War Thunder」で，1.53アップデート「Firestorm」が実施 http://dlvr.it/Cg1dHl,2016-11-25 13:07:21,802212092786786304
Potential fit for Thunder at a low price. https://twitter.com/realgm/status/802211050229669888 …,2016-11-25 13:07:02,802212010373115904
