text,date,id
[Hajók] Kezdődik az elő-béta tesztje a War Thunder Haditengerészetnek... http://fb.me/87HuBzrR9,2016-11-25 15:07:49,802242407324598272
"Мураками ""Не спеши"" (War Thunder official) ПОБЕДА ЗА НАМИ! https://youtu.be/sn6OH4tjMjQ с помощью @ YouTube",2016-11-25 15:07:15,802242266270232576
"# NuggetsNation # ItsANewDay # GoNuggets Injury-riddled Nuggets host Thunder as Darrell Arthur, Alonzo Gee due fo.. http://dld.bz/fhfSq #…",2016-11-25 15:06:11,802241995645263873
Can't make tonight's # ocaambb game between the Thunder & the @FlemingAthletic? @ AlgonquinTVB has you covered! https://livestream.com/algonquinTV pic.twitter.com/JPDTZelZSr,2016-11-25 15:06:11,802241994215096320
"Jolteon (57.78% IV) (Thunder Shock/Discharge). Until 12:35:49 (29m 44s). http://maps.google.com/maps?q=33.91881352744112,-117.98663073315225 …",2016-11-25 15:06:05,802241969950855168
Thunder Lord - The Darknesss Breath http://BarbWiresRadio.Com # Premier # HardRock Radio,2016-11-25 15:05:34,802241842863624193
I added a video to a @ YouTube playlist http://youtu.be/OMcvR0SAdgM?a Re-Doing the Oklahoma City Thunder Off-Season!,2016-11-25 15:05:17,802241769790377984
the Thunder. Presti trading for 2 aging players doesn't make sense. Also same last name and that's too confusing,2016-11-25 15:04:51,802241659882897408
"# NuggetsNation # ItsANewDay # GoNuggets Injury-riddled Nuggets host Thunder as Darrell Arthur, Alonzo Gee due fo.. http://dld.bz/fhfSq",2016-11-25 15:04:10,802241489283661825
And the fact that Ness has the better PK Thunder,2016-11-25 15:04:09,802241482509819904
"Remember When: 15 Fast Facts About ""Days of Thunder"" Eric D. Snider and Mental_Floss pres http://www.craigzablo.com/?p=13065&utm_source=ReviveOldPost&utm_medium=social&utm_campaign=ReviveOldPost … # celebs # movies # trivia",2016-11-25 15:04:03,802241460380856320
"# HeyLarry the thunder tht will hit # TigaWana artist is stil in the gym...it wil come coz this cant be a gospel,",2016-11-25 15:03:39,802241360786964480
@ RafaMorenoValle Thunder's de Atlixco traen el campeonato ysubcampeonato de la copa nacional jarocha pic.twitter.com/lAxOe6U8Ag,2016-11-25 15:03:39,802241358006087680
# 2KMoment # russwest tonight this thunder is having 47 points 12 rebounds 14 assists mark it down,2016-11-25 15:03:29,802241316771893248
1988 – The Russian rocket Soyuz sends Pink Floyd’s Delicate Sound of Thunder album where it belongs. Into deep space.,2016-11-25 15:03:15,802241259511365632
"Come rain come Thunder,white City we still game.c u there..... # heyiwena",2016-11-25 15:02:53,802241165395271681
olivia really thought she could use thunder wave 3 times well Bitch comatose is a thing and is very real.,2016-11-25 15:02:37,802241098533965824
J'ai ajouté une vidéo à une playlist @ YouTube - Bill Clinton Steals Kobe Bryant's Thunder http://youtu.be/WlDlCXGNpk0?a,2016-11-25 15:02:31,802241074773295104
NBA Preview: Oklahoma City Thunder vs. Denver Nuggets - 11/25/2016 - 9:05 PM EST - READ HERE: https://www.cappertek.com/b.asp?b=nba-game-preview-oklahoma-city-thunder-vs-denver-nuggets-friday-november-25-2016 …,2016-11-25 15:02:29,802241066724454408
"It's so black and white, he's stealin your thunder",2016-11-25 15:02:26,802241052451241988
"Raise your words, not voice. It is rain that grows flowers, not thunder. - Rumi # quote",2016-11-25 15:02:11,802240989947658240
The Thunder and Nuggets,2016-11-25 15:01:56,802240927586729984
"Raise your words, not your voice. It is rain that grows flowers, not thunder... # rumi",2016-11-25 15:01:50,802240902857195521
"Raise your words, not voice. It is rain that grows flowers, not thunder. - Rumi # quote",2016-11-25 15:01:35,802240840403800065
They play the thunder? How much? https://twitter.com/seanenglish1125/status/802234634167795712 …,2016-11-25 15:01:29,802240812801064960
Fvck i hate thunder man,2016-11-25 15:01:27,802240804089516033
"Raise your words, not your voice. It is rain that grows flowers, not thunder.",2016-11-25 15:01:26,802240800998440960
is now playing ♫ : Wil Milton - Sweet Thunder,2016-11-25 15:01:21,802240778156130304
# WeAreThunder # ThunderUp # OKCThunder # ThunderBasketball Oklahoma City Thunder Onyx Stained Giant Wooden Tumble ... http://ow.ly/ZGCc506Tsdr,2016-11-25 15:01:14,802240751069491200
Revisiting Johnny Thunders and the Heartbreakers's 'L.A.M.F.' live at Bowery Electric http://bit.ly/2goXRdG pic.twitter.com/yyoDHOonxr,2016-11-25 15:00:48,802240642223132673
7D: 160 Splash: 85 Thunder: 55 SPC: 95,2016-11-25 15:00:43,802240619292872704
Violent Forces Radio: Now Playing Sodom - Rolling Thunder TuneIn Player @http://www.makeavoice.com/tunein/?id=5351,2016-11-25 15:00:40,802240608014311424
"Jolteon 48% (4/6/12/Thunder Shock/Discharge) till 12:15:26 (14m 57s). http://maps.google.com/maps?q=34.13407200944933,-117.61162417809109 …",2016-11-25 15:00:28,802240556617187328
Jamal Murray is expected to start for Will Barton (personal) on Friday against the Thunder. http://pline.co/r/Dy2VzPM # JamalMurray,2016-11-25 15:00:12,802240490917810176
This NBA player is essentially stealing money from the Oklahoma City Thunder. http://fb.me/1HGLAbBWY,2016-11-25 15:00:08,802240472160804865
"AFFINITY Colour pack Black Thunder (капюшон, накидка на ноги, накидка на ноги, накладка на... http://sportcity74.ru/catalog/colour_pack_dlya_kolyaski_affinity_black_thunder.html …pic.twitter.com/tPm9jRlFmH",2016-11-25 15:00:06,802240463688241153
"RESULT: PEEWEE - PEEWEE A - Fri 1:20: - ORO THUNDER (1), COLLINGWOOD AE3 BLA (3) http://tinyurl.com/hq3snmg http://fb.me/5jZHi4f1n",2016-11-25 14:59:51,802240401642033152
"RESULT: PEEWEE - PEEWEE A - Fri 1:20: - ORO THUNDER (1), COLLINGWOOD AE3 BLA (3) http://tinyurl.com/hq3snmg",2016-11-25 14:59:47,802240385309429761
"My friend swears up and down that Lucas has an advantage over Ness because Lucas has the ""better"" PK Thunder... pic.twitter.com/AkTWUV1QMA",2016-11-25 14:59:38,802240348915466240
"Jolteon 33% (6/2/7/Thunder Shock/Discharge) till 12:14:22 (14m 57s). http://maps.google.com/maps?q=34.10618285148283,-117.5991536987041 …",2016-11-25 14:59:24,802240288584388608
"Thunder Valley Casino: VP Removed: MIA: (4) 25¢ : 99.96% DDB, 99.66% BP, 99.11% DB ""Optimum… https://goo.gl/fb/cHzkz6",2016-11-25 14:58:34,802240079548846080
thunder. It's ok.,2016-11-25 14:58:15,802239998263250944
# NowPlaying Blood and Thunder de Mastodon ♫ http://spoti.fi/LU6PhY,2016-11-25 14:58:08,802239971948044288
# Nuggets Jamal Murray is expected to start for Will Barton (personal) on Friday against the Thunder. http://bit.ly/PsMI9f,2016-11-25 14:58:04,802239953451134976
# Nuggets Alonzo Gee is likely to start for Danilo Gallinari (thigh) against the Thunder on Friday. http://bit.ly/PsMI9f,2016-11-25 14:58:03,802239950850666496
Johnny Thunders - You Can't Put Your Arms Around A Memory https://youtu.be/QhHt5vx4CCE via @ YouTube,2016-11-25 14:57:43,802239866872283136
"Jolteon (26.67% IV) (Thunder Shock/Thunderbolt). Until 12:27:06 (29m 42s). http://maps.google.com/maps?q=33.94262727011202,-117.98772878597191 …",2016-11-25 14:57:23,802239782143172608
I added my Big Trouble In Little China Pop - Thunder to @ Boxes http://box.es/i/oayH5nEaOc # bigtroubleinlittlechinapic.twitter.com/5fdiAfzrBh,2016-11-25 14:56:57,802239672726548480
I voted 'Thunder' for the most underrated EXO song http://www.sbs.com.au/popasia/blog/2016/03/21/vote-which-most-underrated-exo-song … # ThunderEXOSBSPopAsia,2016-11-25 14:56:55,802239662932668416
Just work up to the worst crack of thunder I've ever heard in my life # bnestorm,2016-11-25 14:56:20,802239518069780481
War Thunder Ships Gameplay - TORPEDOES AWAY!: http://youtu.be/Vj-mnhSSeDw?a via @ YouTube,2016-11-25 14:56:13,802239489372524545
"It's GAMEDAY, your Kenosha Thunder takes on Stevens Point Pacelli!!! Game one of the tourney!! # allin",2016-11-25 14:55:52,802239401359278084
"Thunder need to be ready to play to competition, no matter who's in the lineup. Easier said than done. I'm patient for the process tho.",2016-11-25 14:55:24,802239280835919872
@ stoolpresidente look at Goodell trying to steal your thunder/join you in a one bedroom summer rental… https://twitter.com/NFL/status/802235449062342656 …,2016-11-25 14:55:03,802239196492627968
Tropic thunder. # comingsoon @ fivestoryny also SALE 40% off errryything in store and online. @… https://www.instagram.com/p/BNPt-DHjfMY/,2016-11-25 14:54:41,802239103383244800
did you click thunder that one turn,2016-11-25 14:54:15,802238992410443776
The new # RedScare. Cuz neolibs & their MSM puppets will do ANYTHING to keep Trump & Co from stealing their fascist thunder. @ washingtonposthttps://twitter.com/MaxBlumenthal/status/802013453095436288 …,2016-11-25 14:54:03,802238941785194498
I liked a @ YouTube video http://youtu.be/YTK8U93lGd4?a MY HARDEST TANK - The Butt TANK (War Thunder Tanks Gameplay),2016-11-25 14:53:31,802238808817168384
おはよーございます〜ヽ(´ー｀)ノ,2016-11-25 14:53:24,802238781151526912
マッドサンダー(MAD THUNDER) - mad(発狂した) + thunder(雷),2016-11-25 14:52:59,802238673215361024
7 am wake up call tomorrow for GameDay signs. Ohio State better bring the thunder. @ bustedcoverage,2016-11-25 14:52:41,802238597709447168
"TB Results Race #4: 1 (#6 Timberline), 2 (#5 Rhythm Blues), 3 (#1 Sleek Idea), 4 (#10 Thunder Point)",2016-11-25 14:52:33,802238565430140928
Just Thundara? You didn't summon a gigantic god of thunder to boot everyone of the way?,2016-11-25 14:51:55,802238406197579776
I always look forward to Country Thunder Arizona.,2016-11-25 14:51:27,802238287138017280
Days of thunder return to Peahi http://www.redbull.com/en/surfing/stories/1331830559085/peahi-jaws-free-surfing-highlights …,2016-11-25 14:51:26,802238285582106625
A Day in the Life of Ricky Skaggs & Kentucky Thunder - http://bit.ly/2gGGMRv pic.twitter.com/WX41ZsWj0H,2016-11-25 14:51:21,802238264224661504
NBA: hornets/knicks over 106.5 hawks/jazz under 94 heat/grizzlies over 95 thunder/nuggets over 111 rockets/kings over 110.5,2016-11-25 14:51:17,802238248474923010
"Damn it ""don't try to fight the storm you'll tumble overboard"" and there was a fuckin thunder damnnnn",2016-11-25 14:51:11,802238222176632832
"Thunder is good, thunder is impressive, but it is the lightning that does the work. -Mark Twain",2016-11-25 14:50:58,802238168426651649
Juancho Hernangomez et Danillo Gallinari sont out côté Denver donc là on va win come ooooon Thunder # ThunderUp,2016-11-25 14:50:49,802238127901409281
"Wake up, son of mine Momma got something to tell you Changes come .... Thunder blowing up your horizon",2016-11-25 14:50:26,802238032606740480
"We watched a Celtic Thunder Christmas DVD & ""Shakespeare In Love.""",2016-11-25 14:50:17,802237995638259712
football wife thunder will strike you so hard https://twitter.com/yazminAllday/status/802235892035448832 …,2016-11-25 14:50:10,802237963686080513
don't worry. The Thunder are experts at making it harder than it needs to be # ThunderUphttps://twitter.com/chrisadempsey/status/802225729157087232 …,2016-11-25 14:49:41,802237844286803969
"Young’s late 3-pointer pushes Lakers past Thunder, 111-109 http://rincon-sports.com/2016/11/23/youngs-late-3-pointer-pushes-lakers-past-thunder-111-109-12/?utm_campaign=twitter&utm_medium=twitter&utm_source=twitter …",2016-11-25 14:49:02,802237681480540160
Couldn't hear the thunder But I heard your heart race Couldn't see the rain We're too busy makin' hurricanes,2016-11-25 14:48:21,802237506997649408
"Campbell:Jolteon 42.22% (2/5/12/Thunder Shock/Thunderbolt) till 20:03:07 (14m 48s). http://maps.google.com/maps?q=37.295641081068794,-121.9601533433358 …",2016-11-25 14:48:09,802237459970990080
"Raise your words, not voice. It is rain that grows flowers, not thunder. - Rumi # quote",2016-11-25 14:47:38,802237329712758785
"Boston friends, get your tickets for next Thursday at Thunder Road Music Club & Rock n' Roll Bistro! It's our... http://fb.me/20opBRP8x",2016-11-25 14:47:31,802237298150621184
10UA Lakeville > Thunder Bay (3-2) pic.twitter.com/CZH6kXKVsV,2016-11-25 14:47:07,802237198271676416
"Raise your words, not voice. It is rain that grows flowers, not thunder. - Rumi # quote",2016-11-25 14:46:59,802237162498441217
"Where is James Harden.? Thunder are in the seventh position, and they lost 3 consecutive games.",2016-11-25 14:46:52,802237135906553856
NBA admits Lakers’ Nick Young travelled before game-winner against Thunder: http://ift.tt/2fzFyFa http://ift.tt/2gkEEdr submitted b…,2016-11-25 14:46:51,802237129237659648
Just heard some thunder nje here https://twitter.com/bheng_ladesh/status/802236163457187840 …,2016-11-25 14:46:48,802237119649480704
"Raise your words, not voice. It is rain that grows flowers, not thunder. - Rumi # quote",2016-11-25 14:46:47,802237112514912256
That's it. What I heard... Was not distant thunder.,2016-11-25 14:46:42,802237092751360000
Can't beat a bit of Days Of Thunder on a Friday night # victorylane # coletrickle # rubbingsracing # mellowyellow,2016-11-25 14:46:41,802237087554617344
"Raise your words, not voice. It is rain that grows flowers, not thunder. - Rumi # quote",2016-11-25 14:46:32,802237052490227712
@ chrisadempsey Thunder always plays worse when the other team is short handed.,2016-11-25 14:46:20,802237001395294208
"@ wargaming_netES pero esto es normal? no se puede hacer nada, esto lo único q hace es q me valla a jugar War Thunder pic.twitter.com/BbC1TOPk3N",2016-11-25 14:45:56,802236900014583808
The household is stirring as they're usually up at this time. I think my son-in-law is making sure all is battened down. Thunder now. # storm,2016-11-25 14:45:50,802236874001563649
Vem sim! A gente melhora tudo com um Chocolate Thunder!,2016-11-25 14:45:33,802236803637837824
"Raise your words, not voice. It is rain that grows flowers, not thunder. - Rumi # quote",2016-11-25 14:45:19,802236745203011585
Make it Thunder... Nigga OKC,2016-11-25 14:45:12,802236714966274049
"Working on the Friday Monster, it is one I made right when I got into GURPS, so I decided to redo it with what I've learned, THUNDER BOAR!",2016-11-25 14:45:06,802236691444563968
"Jolteon (68.89% IV) (Thunder Shock/Thunder). Until 12:03:45 (18m 53s). http://maps.google.com/maps?q=33.91011349446795,-118.03466420542178 …",2016-11-25 14:44:51,802236628903174144
"Enjoy this new post Thunder Marine, Arch Patton Adventure, Chapter 6 http://jamesstrauss.com/thunder-marine-arch-patton-adventure-chapter-6/ …",2016-11-25 14:44:37,802236568693919744
"Injury-riddled Nuggets host Thunder as Darrell Arthur, Alonzo Gee due for increased ... - http://bsndenver.com/injury-riddled-nuggets-host-thunder-as-darrell-arthur-alonzo-gee-due-for-increased-minutes/ …pic.twitter.com/hw8Z3dtkQ9",2016-11-25 14:44:36,802236563468021760
"Enjoy this new post Thunder Marine, Arch Patton Adventure,Chapter 5 http://jamesstrauss.com/thunder-marine-arch-patton-adventurechapter-5/ …",2016-11-25 14:44:29,802236534405500929
"Enjoy this new post Thunder Marine, Arch Patton Adventure, Chapter 4 http://jamesstrauss.com/thunder-marine-an-arch-patton-adventure-chapter-4/ …",2016-11-25 14:44:26,802236522174947328
"Enjoy this new post Thunder Marine, Arch Patton Adventure, Chapter 3 http://jamesstrauss.com/thunder-marine-arch-patton-adventure-chapter-3/ …",2016-11-25 14:44:25,802236518374903808
"Enjoy this new post Thunder Marine, Arch Patton Adventure, Chapter 2 http://jamesstrauss.com/thunder-marine-arch-patton-adventure-chapter-2/ …",2016-11-25 14:44:23,802236511064236032
"Enjoy this new post Thunder Marine, Arch Patton Adventure, Chapter 1 http://jamesstrauss.com/thunder-marine-arch-patton-adventure-chapter-1/ …",2016-11-25 14:44:16,802236482433916928
10UA Lakeville leads Thunder Bay 3-2 with under a minute to play pic.twitter.com/pqdIuoo3Vv,2016-11-25 14:44:11,802236458761338880
Kevin Durant takes blame as Thunder stunned by Timberwolves... http://dlvr.it/MlCHjm # OklahomaCityThunder,2016-11-25 14:43:40,802236328989446144
he's stealin your thunder... baby blue ain't your color,2016-11-25 14:42:43,802236089956188161
HAPPYBURFDAY to one of my best friends RIP to this haircut and the dynamic offense line duo of thunder and lighting pic.twitter.com/8jfdvTXxNR,2016-11-25 14:42:23,802236006795739137
"YOUTUBE!! HUH i gets ' the terrible, the best # TEEWIN oh its you might odi is thunder and then he lp p pls i guess BOY A:""is",2016-11-25 14:42:04,802235928156794880
Even when the thunder is loud I'm here with u now,2016-11-25 14:42:00,802235909412425728
RT @ NBAMemes: approves. # Thunder Nation # LakeShow http://www.ttnews.ga/rt-nbamemes-%f0%9f%90%8d-approves-thunder-nation-lakeshow-42/ …,2016-11-25 14:40:56,802235640838438912
"http://ift.tt/2guAW1Z Nike Air Jordan Retro 3 ""Thunder"" Yellow Size 12 DS NIB pic.twitter.com/1N27sxe9w0",2016-11-25 14:40:53,802235627362287616
Preview: Thunder at Nuggets http://www.nba.com/nuggets/news/thunder-preview-112516 …pic.twitter.com/kmp2XhNL9e,2016-11-25 14:40:50,802235615735648257
"He's stealing your thunder, baby blue ain't your color",2016-11-25 14:40:33,802235544214372352
"dude, thunder is cheondung :/",2016-11-25 14:40:31,802235536501047296
今日の腕試しタイピング（ローマ字）の結果は「Thunder」スコア「340」でした。 http://www.e-typing.ne.jp/ # etyping # et_r,2016-11-25 14:40:29,802235528766595072
"Cranks the volume up 2 clicks on a wifi connected, smartphone music app streaming to a Bluetooth speaker NP:Leo Sayer-Thunder in my heart",2016-11-25 14:40:22,802235499989516288
I liked a @ YouTube video http://youtu.be/tAvPH_8uOn4?a SHIPS ARE HERE! - American Elco PT-314 (War Thunder Ships Gameplay),2016-11-25 14:40:12,802235459413811201
Nuggets to be without five players in matchup with the Thunder # Nuggets https://serve.fans/r/240037f6d1 pic.twitter.com/kGAsyVC6OG,2016-11-25 14:40:10,802235447753768960
Drinking a Bourbon County Brand Stout (2016) 13.8% by @ GooseIsland @The Thunder Dome — http://untp.beer/s/c386899342,2016-11-25 14:40:00,802235405646999552
LOT 223 DAYS OF THUNDER bay colt Gimmethegreenlight (AUS) X Tafra SOLD R140 000 # CTS # JHBReadyToRunSale2016 # FarEnd,2016-11-25 14:39:48,802235356670283776
WAR THUNDER - KNIGHTS OF THE SEA - Pre Beta Test - Probando Barcos: http://youtu.be/vYHudwRoiZw?a a través de @ YouTube,2016-11-25 14:39:29,802235275585998848
"Jolteon (46.67% IV) (Thunder Shock/Thunderbolt). Until 12:33:14 (53m 45s). http://maps.google.com/maps?q=33.92169465852735,-118.01014588423688 …",2016-11-25 14:39:29,802235275225116672
"| Ya sé que lo era, no soy tan tonta xD Y debe ser duro sí uh",2016-11-25 14:39:24,802235254161416192
"266:618 Seem'd all one mutual cry: I never heard So musical a discord, such sweet thunder. # AMNDBots",2016-11-25 14:39:17,802235224889270273
Mi è piaciuto un video di @ YouTube: http://youtu.be/eI90KW_5Vso?a Motörhead - Thunder & Lightning Official Fan Video (40th Anniversary,2016-11-25 14:39:01,802235157600174080
Nuggets to be without five players in matchup with the Thunder # OKCThunder https://serve.fans/r/8e527a7213 pic.twitter.com/d01IKFBaYf,2016-11-25 14:38:49,802235110712033281
Trolls in Crazyland Anything Chester Cheetah Sakigake (NES) Thunder Blast Man Heisei Tensai Bakabon Mohawk & Headphone Jack,2016-11-25 14:38:39,802235067275673600
The thunder that is Niagara Falls pic.twitter.com/gP7KYKlbVV,2016-11-25 14:38:28,802235020983332864
Next stop for country footy journeyman Daniel Lewis will be @ cairnscitylions in '17. Won a flag with St Mary's this yr & played @NT Thunder,2016-11-25 14:38:15,802234964842418176
After the thunder Me and my friends: nawala lage ang wifi? Little did we know na may sunog sa kapitbahay huhuhuhu kulba jud,2016-11-25 14:38:06,802234930721755136
Fuck lighting and thunder! She was great and you were an asshole https://twitter.com/declothed/status/777642659645095937 …,2016-11-25 14:37:44,802234835909492736
"Campbell:Jolteon 42.22% (1/12/6/Thunder Shock/Thunderbolt) till 19:52:00 (14m 45s). http://maps.google.com/maps?q=37.281939594713016,-121.93544501264184 …",2016-11-25 14:37:03,802234666023469056
リアルだけど汚れたくないしやめて！,2016-11-25 14:36:42,802234576613478400
Lex Luger vs Bret Hart WCW Thunder 8.13.98 https://youtu.be/Sijy4wvqlk4,2016-11-25 14:36:20,802234482459873280
"His thunder on thy head, devouring fire.",2016-11-25 14:36:08,802234434506194945
I liked a @ YouTube video from @ lostnunbound http://youtu.be/mJne8wDyNW0?a THUNDER FAN REACTION TO RUSSELL WESTBROOK SIGNING WITH THE THUNDER,2016-11-25 14:36:07,802234428265295872
"Ha! more like ""Slow Thunder""! :)",2016-11-25 14:36:04,802234417301389313
Thunder currently sit in 6th with an 8-7-3 record and Green Bay holds 3rd at 11-7-1. Safe to say these next 2 are must-win?,2016-11-25 14:35:50,802234359130587136
Preview for tonight’s matchup with Thunder: Malone on Darrell Arthur & Alonzo Gee who could both play a big role -http://bsndenver.com/injury-riddled-nuggets-host-thunder-as-darrell-arthur-alonzo-gee-due-for-increased-minutes/ …pic.twitter.com/9RW3z2PNod,2016-11-25 14:35:42,802234326716805120
I liked a @ YouTube video from @ ode http://youtu.be/RsOSdmDQZpA?a Fantastic Beasts star Ezra Miller: 'Eddie Redmayne stole my thunder!',2016-11-25 14:35:07,802234179094126592
I realize now I made a mistake: we're flying into Seattle on the way home and I didn't pack a Thunder shirt,2016-11-25 14:35:00,802234148857335808
New # HighScore on Hydro Thunder: Nile Roventure # Arcade by ichigokurosaki1991 0:03:33.71 http://ift.tt/2g0pXzk pic.twitter.com/FDu6jvdCJT,2016-11-25 14:34:48,802234098953703425
目の保養になります！！最後のキュンってしてしまっただよ。,2016-11-25 14:34:46,802234088643915776
"Injury-riddled Nuggets host Thunder as Darrell Arthur, Alonzo Gee due for increased minutes - http://bsndenver.com/injury-riddled-nuggets-host-thunder-as-darrell-arthur-alonzo-gee-due-for-increased-minutes/ …pic.twitter.com/OH1SeuCSgx",2016-11-25 14:34:33,802234035380449280
I added a video to a @ YouTube playlist http://youtu.be/G2eo4j_8CD8?a Mighty Morphin Power Rangers - Thunder Megazord First Fight (The Mutiny,2016-11-25 14:34:28,802234013381341184
"Injury-riddled Nuggets host Thunder as Darrell Arthur, Alonzo Gee due for increase... http://www.chatsports.com/denver-nuggets/a/source/injury-riddled-nuggets-host-thunder-as-darrell-arthur-alonzo-gee-due-for-increased-minutes-13023463 … via @ chatsports # NuggetsNation",2016-11-25 14:34:27,802234011154161664
Just heard thunder. Never mind. One more night indoors won't kill me lol,2016-11-25 14:34:23,802233992040824836
| No te mueras :c,2016-11-25 14:34:11,802233944796172288
Oklahoma City Thunder assistant coach will not return to team... http://dlvr.it/MlC96H # OklahomaCityThunder,2016-11-25 14:34:11,802233943722311680
i wanna go to country thunder so bad,2016-11-25 14:33:44,802233827913404416
"bsndenver .com >> Injury-riddled Nuggets host Thunder as Darrell Arthur, Alonzo Gee due for increased http://buzztap.com/-60FiR6",2016-11-25 14:33:33,802233783273615360
"thunder Thunder THUNDERCATS, HOOOOOOOOO",2016-11-25 14:33:27,802233758074175488
I liked a @ YouTube video http://youtu.be/9XESJ9F0O9E?a Bring On The Thunder -- Ultimate Gaming Tribute,2016-11-25 14:33:00,802233646832910336
@ EASPORTSFIFA SBC thunder?,2016-11-25 14:32:43,802233574007062528
c'est ce que je disais à Jess faut que jvois si mes parents veulent faire un truc pour mon bday,2016-11-25 14:31:40,802233309703143424
にゃん！,2016-11-25 14:30:45,802233077959303169
"368:618 Seem'd all one mutual cry: I never heard So musical a discord, such sweet thunder. # AMNDBots",2016-11-25 14:30:42,802233067523829760
"Moving to Hope: Rolling Thunder Series, Book 2 @ pfiala Now only $2.99! https://goo.gl/L6swWf # steamy # romance # amreadingpic.twitter.com/6bi5OJ2hqI",2016-11-25 14:30:38,802233051224899584
"Michelle Cordy, you need to come to Thunder Bay and help us do some disrupting! # tllp2016pic.twitter.com/yAxCZ0dC1o",2016-11-25 14:30:15,802232953342464000
ねむれぬ……,2016-11-25 14:30:14,802232950133637120
quand ?,2016-11-25 14:29:57,802232877803040768
いつ寝るかわかんないのに……,2016-11-25 14:29:29,802232761763307520
"Thunder has played depleted teams (Pistons, Pacers) in last two weeks and lost. We shall see tonight. https://twitter.com/chrisadempsey/status/802225729157087232 …",2016-11-25 14:29:28,802232756243529728
@ ThunderS7ruck what happened to old CoD matchmaking?? pic.twitter.com/WZnw0UYgN2,2016-11-25 14:29:15,802232701566722049
,2016-11-25 14:29:02,802232649238675456
"163:618 Seem'd all one mutual cry: I never heard So musical a discord, such sweet thunder. # AMNDBots",2016-11-25 14:28:26,802232494095364096
へきにゃんねないの？,2016-11-25 14:28:17,802232460385755136
"Oof! Jake will have ter wait till later muk! ...Old Thunder Drawers jus got in frum work, Face like a Bulldog chewing a Wasp!",2016-11-25 14:28:16,802232453373030400
Participa en el sorteo CARENADOS GP REGALA UN CASCO MT THUNDER de @ carenadosgp en http://sorteamus.com/r/2mrih @ sorteamus,2016-11-25 14:27:46,802232327984349184
"Campbell:Jolteon 42.22% (2/5/12/Thunder Shock/Thunderbolt) till 19:42:41 (14m 54s). http://maps.google.com/maps?q=37.295641081068794,-121.9601533433358 …",2016-11-25 14:27:43,802232317586509824
The Rood Project - Thunder http://drumtrip.co.uk/tuneoftheday/the-rood-project-thunder/?utm_source=ReviveOldPost&utm_medium=social&utm_campaign=ReviveOldPost …,2016-11-25 14:27:20,802232217598627841
# LeeJoon and # thunder in one pic oh my MBLAQFEELS I wish they cooperate pic.twitter.com/7jZ6RARifU,2016-11-25 14:27:20,802232217292378112
にゃおん,2016-11-25 14:27:17,802232206340931584
