text,date,id
I woke last night to the sound of thunder How far off I sat and wondered Started hummin a song from 1962 Ain't it funny how the night moves,2016-11-25 18:59:54,802300812735221760
"Mick Mulvaney has spent $100,450 on this ""Mulvaney Rolling Thunder"" ad on veterans affairs issues # ncpolpic.twitter.com/149Q1frNqq",2016-11-25 18:59:43,802300765582802944
# FollowFriday @ DjD_Thunder @ HillaryNo1sPres @ bonartgl - top engaged members this week :) >> Want this ? https://commun.it/thank-you/?aid=thankyou111 …,2016-11-25 18:59:32,802300719709777920
"My legit favorite food is chips and dip. Eh, Thunder thighs to keep me warm I suppose.",2016-11-25 18:59:26,802300695626088449
Fleming Knights getting ready for the match against Algonquin Thunder. Live @http://livestream.com/algonquinTV pic.twitter.com/4aO0UUVnNR,2016-11-25 18:59:26,802300694216736768
I liked a @ YouTube video http://youtu.be/tAvPH_8uOn4?a SHIPS ARE HERE! - American Elco PT-314 (War Thunder Ships Gameplay),2016-11-25 18:59:19,802300665531756544
"It's Adoption Update Friday and we're catching up on KSC alums Thunder and Fendi (now Marmalade). Their mom,... http://fb.me/91rj7AvrJ",2016-11-25 18:59:04,802300604500639744
"Me explica os bagulho, Thunder! https://twitter.com/marco_eich/status/802298346668892161 …",2016-11-25 18:58:39,802300497340334080
I'm trying not to be that guy but.... I'm not sure how I'll react if the Thunder drop their game vs the Nuggets. You've been warned twitter!,2016-11-25 18:58:37,802300491136798721
waa thunder obba dari jauh avanya kirain myungsoo oppa,2016-11-25 18:58:17,802300407611412481
"LIVE on # Periscope: Stock Medium @GKK Thanksgiving Thunder in Carnesville, Ga. https://www.pscp.tv/w/awd2BjFQWEVka3BrZHdqZXZ8MWVhS2JsbmxQWG5KWDmnI3EBhAp5zOqdRcKQE-YKdnoUIjU8lKGU-LCfHts7 …",2016-11-25 18:57:58,802300328142131200
"I woke up in the middle of the night because of strong thunder and the furst thing I thought was ""what powerful nen""wtf enough hunterxhunter",2016-11-25 18:57:57,802300324039929856
Sa IG ra ni thunder nang,2016-11-25 18:57:07,802300110960881664
Kane Brown - Thunder in the Rain * * LISTEN LIVE~~> http://goo.gl/LF1oGV,2016-11-25 18:57:04,802300099023945728
Thunder Kiss '65 de White Zombie ♫ http://spoti.fi/KmOQzy,2016-11-25 18:56:48,802300031164235777
"Second the second monitor. It's not 1995 anymore. Thunder, did you get yours?",2016-11-25 18:56:33,802299969218613248
@ ThunderS7ruck https://youtu.be/gru-FRqxmvw check this crazy glitch out on BO3,2016-11-25 18:56:31,802299959668129792
Oklahoma City @ okcthunder vs Denver @ nuggets : Who covers point spread? over/under? # ThunderUp # thunder # MileHighBasketball # OKCvsDEN # NBA,2016-11-25 18:55:16,802299647008108544
I can feel the thunder that's breaking in your heart I can see through the scars inside you,2016-11-25 18:55:13,802299633338814465
war thunder boats!,2016-11-25 18:55:00,802299578229719040
# NowPlaying Jay Ferguson - Thunder Island :: Tune In: http://www.reality1radio.com,2016-11-25 18:54:44,802299512651816960
holy shoot country thunder is going to be so fun,2016-11-25 18:54:39,802299492238172160
Add : Thunder ML 2u*,2016-11-25 18:54:04,802299343315341312
http://ift.tt/2g5001N # shoes Air Jordan 4 Retro Thunder Tour Yellow 308497-008 size 10.5 Nike DB Bred IV,2016-11-25 18:54:00,802299326429089792
"Seriously. That Legacy Megazord, Dragonzord, and Thunder Megazord look amazing.",2016-11-25 18:53:52,802299296481542144
thunder mblaq/?,2016-11-25 18:53:49,802299283810631680
I used thunder shock instead of thunder wave on a feebas,2016-11-25 18:53:38,802299235257307136
"The Thunder, # nickcollison, is in Denver and I'm in Colorado Springs... # icanfeelhim # thunderup",2016-11-25 18:53:27,802299189111623680
Rain stops. I grab the bike. More thunder & lightning. Bike goes back in garage.,2016-11-25 18:53:25,802299179670204416
"Dark clouds, sunshine, lightning & thunder at 9:45am... quite a combination. Mother Nature undecided this morning # bnestorm # deepbreathing",2016-11-25 18:53:08,802299110048940032
Loki's Vengeance much the best in NYSS Thunder Rumble with @ jose93_ortiz! : http://bit.ly/2gvcGgg pic.twitter.com/uetjJ5zsa9,2016-11-25 18:53:06,802299102805495808
ayo sini oppa udah lama ga liat rp thunder /?,2016-11-25 18:52:33,802298961369317376
"Okc Thunder kazanir - Dal Mavericks (L: 202,5) ust - La Clippers (L: 201,5) ust bol sans inceden dene derim",2016-11-25 18:52:03,802298837390020609
Yesss it looks awesome!!,2016-11-25 18:52:01,802298827780800516
"Gostei de um vídeo @ YouTube http://youtu.be/KgbebQ62MsY?aMASTODON … ""BLOOD AND THUNDER"" - DRUM COVER | LUX DRUMMERETTE",2016-11-25 18:51:54,802298800647745536
"Campbell:Jolteon 93.33% (15/12/15/Thunder Shock/Discharge) till 00:06:51 (14m 55s). http://maps.google.com/maps?q=37.26914075015704,-121.95251035271852 …",2016-11-25 18:51:53,802298796038197253
雷さん おはようございますρ( ^ｏ^)b_♪♪ 今日１日が雷さんにとって 幸多き１日になりますように！！,2016-11-25 18:51:49,802298780791881728
BOB feels special - he was just presented with a puck following the Bloomington Thunder Hockey warm-ups! Let's... http://fb.me/1AY9SGIer,2016-11-25 18:51:38,802298731215261697
I liked a @ YouTube video from @ thundershot75 http://youtu.be/T3Qft1UpKBg?a Thunder Vs Yami Yugi Duels Round 5: No Not The Blue Eyes White,2016-11-25 18:51:36,802298722566574080
今日の腕試しタイピング（ローマ字）の結果は「Thunder」スコア「327」でした。 http://www.e-typing.ne.jp/ # etyping # et_r,2016-11-25 18:51:30,802298699426578433
learn how to walk Ricky.,2016-11-25 18:51:29,802298695794495488
aaa thunder oppa personil mblaq :),2016-11-25 18:51:25,802298679520464896
NBA Hot Picks! -Phoenix Suns +1.5 (-110) -Oklahoma City Thunder -2.5 (-110) Good Luck Guys! # InGambinoITrust # Handicapper # NBA,2016-11-25 18:51:21,802298662382694400
来週 の # エンパイア は 前回のゲスト と 同じく 尼の長老 こと THUNDER君 ⚡︎ 水曜はGHOSTで 目を覚ませRAGGAMUFFIN~⚡︎⚡︎ pic.twitter.com/2a7KH2ngCR,2016-11-25 18:51:03,802298584871747584
"2012 group were really great also, I'm always remember how we stunt Thunder group with Dragic&Lee",2016-11-25 18:50:17,802298392646942720
A faint clap of thunder/ Clouded skies/ Perhaps rain comes/ Will you stay here with me? # KotonohaNoNiWa,2016-11-25 18:50:14,802298382047965184
Stay Tuned ! Oklahoma City Thunder - Denver Nuggets https://goo.gl/t7oFqi # basketball # thunder # nba # nuggets,2016-11-25 18:50:01,802298327484112896
"# WhyWeFightTogether Because I'm ""Thunder"" & you're ""Lightning"". Cool team. I used to be teamed up w/ a guy named ""Thighs."" Not so good.",2016-11-25 18:49:58,802298314347659264
Was that thunder? Or are they now doing canon fire at the DKR for TCU taking a time out to momentarily stop bleeding.,2016-11-25 18:49:52,802298286971486208
# daytona to have tamed the sound of thunder. Shine your light on me. # randomlyrics # ChrisRea,2016-11-25 18:49:49,802298277395857408
病んでるときは何事もうまく行きませんよ。前向きに前向きに（なでなで,2016-11-25 18:49:40,802298236673212416
"Coyote Girls take an early lead over the Rushmore Thunder, the goal by Winstead with assists from Collins and Luther. # gocoyotes",2016-11-25 18:49:20,802298153752031233
Thunder will beat the Nuggets tonight 109-96,2016-11-25 18:49:16,802298135607263232
Jessie J - Thunder pic.twitter.com/8NICHNzkS8,2016-11-25 18:49:12,802298121472581632
Thunder Bay eateries not sweating public grades http://www.chroniclejournal.com/news/local/thunder-bay-eateries-not-sweating-public-grades/article_5e3b9c74-b1f2-11e6-8a7e-f38c0c924fa3.html#.WDjNuzPDQ8w.twitter … via @ CJ_ThunderBay,2016-11-25 18:48:55,802298050442133505
Me ha gustado un vídeo de @ YouTube (http://youtu.be/S3S-IaIgOkE?a - THUNDER PACK EL MEJOR PACK GFX PARA ANDROID!!! | ConcretGFX).,2016-11-25 18:48:45,802298006573707264
I don't want to steal your thunder but if I VENTURED to have a guess... # tweetfleet # amiright,2016-11-25 18:48:35,802297965838667776
thunder comes after by calciseptine - Yuri!!! on Ice (Anime) http://archiveofourown.org/works/8630695 via @ ao3org,2016-11-25 18:48:23,802297913686663168
"You don’t need that guy, It’s so black and white he’s stealin’ your thunder",2016-11-25 18:48:23,802297913594376192
"I can win one, maybe two matches with Drizzle Pelipper + Thunder Vikavolt, but then the Tree algorithmically fucks me over.",2016-11-25 18:48:22,802297910834577408
"Off we go into the wild blue yonder, Climbing high into the sun Here they come zooming to meet our thunder At 'em boys, Give 'er the gun!",2016-11-25 18:47:44,802297752856117248
**GAME TIME** Tomorrow 1:00pm D20 Stadium Join us at 11:30ish for a tailgate! BYO! See you all there! GO THUNDER! @ ThndrSports @ GoThndr,2016-11-25 18:47:24,802297665228783617
Steven Adams honing three-point shooting skills as friendly rivalry with Thunder 'Stache Brother' grows http://i.stuff.co.nz/sport/basketball/86902826/steven-adams-honing-threepoint-shooting-skills-as-friendly-rivalry-with-thunder-stache-brother-grows …,2016-11-25 18:46:57,802297555732271108
Denver Nuggets – Oklahoma City Thunder Maç Analizi! (26 Kasım) https://goo.gl/f7Xyax,2016-11-25 18:46:30,802297439977897984
I'd hear her heart beating loud as thunder ♫ ♫ http://spoti.fi/KtRyyZ,2016-11-25 18:46:25,802297419895447553
A Thunder Afternoon # OklahomaCityThunder http://dlvr.it/MlFjPX http://dlvr.it/MlG54p # OklahomaCityThunder,2016-11-25 18:46:11,802297360399245312
I liked a @ YouTube video http://youtu.be/in8pgvJfM28?a Bring On The Thunder,2016-11-25 18:46:00,802297316409372672
"Raise your words, not voice. It is rain that grows flowers, not thunder. - Rumi # quote",2016-11-25 18:45:37,802297218740862976
de hecho es la mejor waifu de todos los tiempos nominada por mi,2016-11-25 18:45:25,802297166383476736
SHIPS ARE HERE! - American Elco PT-314 (War Thunder Ships Gameplay) https://youtu.be/tAvPH_8uOn4 @魚雷まともに受けたくないよ,2016-11-25 18:44:51,802297023890239489
"Raise your words, not your voice. It is rain that grows flowers, not thunder. ~ Rumi",2016-11-25 18:44:38,802296971826339840
2015.... # thunder # thunderstorm # weather # clouds # storm # dslr # nature # naturephotography @… https://www.instagram.com/p/BNQIQ7zFTyl/,2016-11-25 18:44:29,802296933138112512
Feel the thunder! Support the @ BadassTeachersA Thunderclap on DeVos https://www.thunderclap.it/projects/50515-notmysoe … @ AnthonyCody @ DianeRavitch @ GetUpStandUp2,2016-11-25 18:44:16,802296877571973121
I liked a @ YouTube video from @ roomscapeplays http://youtu.be/O1bS1CqU21g?a Halo 3 Messing around on Forge With Jolteon Thunders,2016-11-25 18:43:43,802296739411722242
"Naruto Shippuden Ultimate Ninja Storm 4 - Story Mode Walkthrough Part 23 | Wind Rages, Thunder Races: http://youtu.be/YZ__XoEwIFo?a via",2016-11-25 18:43:39,802296722957488128
THUNDER https://twitter.com/athsunited/status/801316606928359425 …,2016-11-25 18:43:26,802296669257670656
@ raz_thunder 5分遅刻ー,2016-11-25 18:43:19,802296638383398912
Thunder fall ride http://fb.me/OEzNXAjs,2016-11-25 18:43:13,802296615578939392
Stars quit shining rain was dropping thunder n lightning,2016-11-25 18:42:47,802296507236057088
/thunder うん すっきりした♪（しっぽふりふり）,2016-11-25 18:42:35,802296456891625473
But of the thunder and lightning of the thick cloud and the end.,2016-11-25 18:42:23,802296405104726020
"Warriors, Clippers, Cavs, Thunders y Knicks pondría yo",2016-11-25 18:41:16,802296123520155648
# DraymondGreen: No way # KevinDurant signs with Warriors if Thunder beat them http://nba.nbcsports.com/2016/11/25/draymond-green-no-way-kevin-durant-signs-with-warriors-if-thunder-beat-them/ …pic.twitter.com/HaqNSmeQ3v,2016-11-25 18:40:52,802296021187461120
おれがただの飛べない豚だとぉ？ ＿ ⋀⋀ / | ＿/(՞ةڼ◔ )／★ | !/ .}￣￣￣ / i＼_}／￣|＿_／≡＝ `￣￣~ イャッッホォォォオオォオウ！ ほうらWar Thunderやってるだけあるだろwww,2016-11-25 18:40:44,802295987695800320
@ thehill @ JebBush Trying to steal Trump's thunder. No one cares about the Bush fam anymore. Bunch of traitors,2016-11-25 18:40:24,802295907328950274
@ 5ivetvseries I'm smiling. The thunder that will strike Nnena is cooking banga soup. How can she bring Kelvin to her house? Is she suicidal?,2016-11-25 18:40:24,802295904971669504
actually not to bad he put up 17.1 points during his time has a thunder so about what james harden was doing there has well,2016-11-25 18:40:14,802295863796203520
"Kevin Martin anunciou sua aposentadoria após 12 anos! Obrigado por tudo que fez defendendo as cores do Thunder, Kevin! pic.twitter.com/SxxQ4XDb0e",2016-11-25 18:39:50,802295762075942912
Dont threaten a garden with a flower ..The wind with thunder ..A snake with poison ..The poor with jail ..Stars with night ..Love with pain,2016-11-25 18:39:39,802295716311867394
"//*Deja ahí a su Patty @ LowellPatty y a su Trish @ Trish_Thunder , que están ahí guardadas en su tweetdeck*",2016-11-25 18:39:21,802295643138125825
if u ever feel like ur a dumbass remember that the Thunder traded James Harden for Jeremy Lamb and Kevin Martin,2016-11-25 18:39:06,802295578814091264
A Thunder Rats Derby Squad é uma equipe de Roller Derby praticante da modalidade “Woman Flat Track” (“Feminino em... http://fb.me/2ZFTeOTFi,2016-11-25 18:39:02,802295560564854784
Rolling Thunder?,2016-11-25 18:38:55,802295532647378944
SHIPS PRE-BETA | War Thunder Naval Forces Gameplay: http://youtu.be/_7w386KyQps?a via @ YouTube,2016-11-25 18:38:49,802295507808907266
"@ SydneyThunderGM Hey mate, have the Thunder confirmed their second international signing yet?",2016-11-25 18:38:39,802295467266609152
DK city Thunder https://twitter.com/__mountagaa/status/802294367125901312 …,2016-11-25 18:38:31,802295433317982209
↠ of thunder just returned to Asgard. Suddently the realization hits Eir. She places a hand onto the Lady Sif's stomach ] ↠,2016-11-25 18:38:24,802295403160961024
I liked a @ YouTube video from @ thundershot75 http://youtu.be/T3Qft1UpKBg?a Thunder Vs Yami Yugi Duels Round 5: No Not The Blue Eyes White,2016-11-25 18:38:13,802295357975756801
I might start playing War Thunder aviation again,2016-11-25 18:38:12,802295352896331776
Drinking a Rolling Thunder Imperial Stout by @ rogueales - http://untp.beer/s/c387113131,2016-11-25 18:38:05,802295323536355328
"Weather N(orth) E(ast) W(est) S(outh): Storm clouds on approach. Rain due in later tonight into Saturday, thunder possible as well. # CAwxpic.twitter.com/QenKVGxXPc",2016-11-25 18:37:36,802295202912223232
Thunder's https://twitter.com/__mountagaa/status/802294849345036288 …,2016-11-25 18:37:20,802295134079553536
Thunder only happens when it's raining Players only love you when they're playing Women they will come and they will go,2016-11-25 18:37:03,802295063694843904
"@ AlecLaGrega @ michellewxii12 I hear Alec is renowned for his work on the ""thunder bluff"" theory",2016-11-25 18:36:51,802295011203252225
But of the thunder and lightning of the thick cloud and the tin!,2016-11-25 18:36:33,802294935441457152
"GODS OF THUNDER - ACE, SLASH, ZOMBIE, TOMMY LEE Hallejua https://www.youtube.com/watch?v=JM4_QcUE-IA&feature=share …",2016-11-25 18:36:31,802294930391502849
saw Isaiah Thomas drop 30 against the thunder this year and then I saw Roy Halliday throw a no no into 8th,2016-11-25 18:36:22,802294890566733824
Directed them to storm kings thunder and thier DM is watching Matt's DMV tips.,2016-11-25 18:36:20,802294883901960192
Peace Thunder serious version,2016-11-25 18:35:56,802294781065859072
Tonitrophobia is the fear of thunder. # us # usa,2016-11-25 18:35:38,802294705614561280
Wallahi the thunder need to trade most of these bums,2016-11-25 18:35:32,802294680490680320
"Thunder Magick Dragon Athame - Special Edition Athame Series 6.5"" Embellished Athame - Grey Iridescent Luster... http://fb.me/KKRazzch",2016-11-25 18:35:22,802294636907810817
おはようございます！Thunder-雷-nana民ネタい手さん♪,2016-11-25 18:35:21,802294636739837953
@ 89x is the young thunder cat I use to be. I use to take them down !!! I was pulling Grade A cattle,2016-11-25 18:35:19,802294626136821761
"Thunder Force III ( # Sega # Genesis, 1990) # retrogaming # ebay https://deal.vg/j8wNRfb pic.twitter.com/4qXFsUHixN",2016-11-25 18:35:16,802294613860040704
There's thunder and in my head...,2016-11-25 18:35:04,802294562614022144
War Thunder Planes # playpic.twitter.com/n78f2PVxD6,2016-11-25 18:34:58,802294538383556608
"Tempted to RT the ""RT if you're the gay cousin"" posts but I don't want to steal my cousin's thunder. He's the Gay Cousin™, I'm the Bi Cousin",2016-11-25 18:34:54,802294521413439488
“Girls like her were born in a storm. They have lightning in their souls. Thunder in their hearts. And chaos in their bones.”,2016-11-25 18:34:37,802294448788946944
"""I honor the path each person is on. I believe that all of our prayer paths lead to the Great Mystery, or Spirit, or God."" - Mary Thunder",2016-11-25 18:34:36,802294445190348800
"Fell hard like rain, Move on like thunder. # goodmorning",2016-11-25 18:34:34,802294437284081664
@ sassyleggings thunder mountain porn https://twitter.com/DarianHardmon/status/801158293720662016 …,2016-11-25 18:34:27,802294406288183300
"Big booming thunder storm out on Dugi Otok, Croatia tonight. Toasty warm inside. # happiness # goodnight",2016-11-25 18:34:19,802294374545510400
welcome to the thunder dome...,2016-11-25 18:34:18,802294369101512706
Thunder and Lee Joon in a pic. OMG. Reunited,2016-11-25 18:33:40,802294211378720768
"""Thunderstruck"" Thunder Shot MK II with indipendent suspension system. # streetmini4wd # mini4wd # ミニ四駆 # ダッシュ四駆郎pic.twitter.com/uZ82Da2OOl",2016-11-25 18:33:03,802294053924704257
I'm sure @ StrayaObscura would be happy to see these :),2016-11-25 18:32:55,802294021049548800
Tomelo usted https://mega.nz/#!GhpSlZYD!rDnZU1bmPRk3DDONh45wgfm63ApOrYAiq29Aq4uyL4I …,2016-11-25 18:32:44,802293975591899136
Oklahoma City Thunder -2.5 PICK DATA: http://CappedIn.com/posts/102269/nba/oklahoma-city-thunder-vs-denver-nuggets-pick … @ atsstats On it? RETWEET # picks,2016-11-25 18:32:15,802293853248167936
Додао/ла сам видео http://youtu.be/7IyOWz1b8uM?a War Thunder gameplay HERuVIM #26 на плејлисту корисника,2016-11-25 18:32:07,802293820423540736
Black out at the thunder game tonight at 7 y'all better show up for some support against the wolves!!!!!,2016-11-25 18:31:57,802293778132402176
"Dicen que es cremita de la buena, yo lo quiero muy mucho",2016-11-25 18:31:06,802293564805943296
and HEISMAN!,2016-11-25 18:31:04,802293555385483265
"# NOVEMBERDELIVERANCENIGHT # SOFAKWARA # PROPHETSANMIMETIBOBA # PRAYERPOINT By fire, by thunder, whatever is hiding my star out in Jesus name!",2016-11-25 18:30:56,802293521873047552
Thunder Vs Yami Yugi Duels Round 5: No Not The Blue Eyes White Dragon!: http://youtu.be/T3Qft1UpKBg?a via @ YouTube,2016-11-25 18:30:40,802293456911667200
Holy Fast! (S3.R7) NASCAR Thunder 2004 Career Mode: http://youtu.be/3Mi1oZJUYdM?a via @ YouTube,2016-11-25 18:30:05,802293310954020864
1. fave food is crab 2. Fuck thunder 3. Fuck gender pic.twitter.com/k7T5BfEich,2016-11-25 18:29:49,802293242326876160
"I'm listening to ""Thunder In The Rain"" by Kane Brown on @ pandora_radio. # pandorahttp://pdora.co/2fhWC46",2016-11-25 18:29:23,802293131651796993
actually fuck lights and thunder im gonna beat the hardest demon in the game. pic.twitter.com/2toTf4NiaW,2016-11-25 18:29:03,802293049237864448
"Meeting John Corabi, Marco Mendoza and The Thunder from Down Under (mr. Lowy). The Dead Sausjes… https://www.instagram.com/p/BNQGepsAsd4/",2016-11-25 18:28:51,802292997207494656
行ってらっさ死なずにかえって来いよー,2016-11-25 18:28:44,802292969529188352
Checked in for the first game. Go Thunder. # thunderstruck @Joe Louis Arena https://www.instagram.com/p/BNQGdPqF5BE/,2016-11-25 18:28:41,802292959093866496
株式会社7th-floorの中古ドメイン付きThunder Linkは効果なし？内容暴露 http://www.houtou.info/post/%e6%a0%aa%e5%bc%8f%e4%bc%9a%e7%a4%be7th-floor%e3%81%ae%e4%b8%ad%e5%8f%a4%e3%83%89%e3%83%a1%e3%82%a4%e3%83%b3%e4%bb%98%e3%81%8dthunder-link%e3%81%af%e5%8a%b9%e6%9e%9c%e3%81%aa%e3%81%97%ef%bc%9f …,2016-11-25 18:28:35,802292933466722309
"Temps to rise well above avg. this weekend, rain holds off until Sun. evening then stays likely through Mon. Iso'd rumble thunder possible pic.twitter.com/mi3R6cBy8N",2016-11-25 18:28:35,802292933403627520
"Temps to rise well above avg. this weekend, rain holds off until Sun. evening then stays likely through Mon. Iso'd rumble thunder possible pic.twitter.com/VCblMjHeT7",2016-11-25 18:28:35,802292930899824642
"Temps to rise well above avg. this weekend, rain holds off until Sun. evening then stays likely through Mon. Iso'd rumble thunder possible pic.twitter.com/9sOV0Gc8Zt",2016-11-25 18:28:34,802292929184366592
we've got some here. # Thunder,2016-11-25 18:28:13,802292839421976576
When I am silent. I have thunder hidden inside.,2016-11-25 18:27:27,802292644768579584
Come play u thunder cunt @ Life2thaStyle,2016-11-25 18:26:51,802292495199666178
"Thunder seems to forget that part of fetching involves returning the toy to me so I can toss it again, he is... http://fb.me/5mdqZFE7u",2016-11-25 18:26:34,802292424383037440
I liked a @ YouTube video http://youtu.be/VFoO_GL7mMs?a Mark Bell & Filipino Thunder Critique My SKWAAT - ft. Silent Mike & Meg Squats,2016-11-25 18:26:17,802292354065567746
"Baseball teams remaining as Thunder, Storm, Lightening or Heat - the last day to order spirit gear is this Sunday. http://bit.ly/2gqY2cP pic.twitter.com/JaLy1rcg0h",2016-11-25 18:26:01,802292285236879360
i miss the thunder days@NathenKadhim0 @albuckets6 pic.twitter.com/XxTaTVi48m,2016-11-25 18:25:51,802292243214336000
With the thunder of industry men are gods,2016-11-25 18:24:59,802292025068371968
Big Thunder Mountain - mcDiscovery: http://youtu.be/Pb22AXEPfAs?a via @ YouTube,2016-11-25 18:24:55,802292007741886464
"Pika had thunder wave, just didn't knew the white herb combo would come out ;o;",2016-11-25 18:24:52,802291998430470145
"The thunder and lightning is sO cray cray my dog just got in bed w/ me and is now lying on my forehead,,, literally",2016-11-25 18:24:43,802291958756454400
THUNDER - MY PLACE (Acoustic version) 歌詞&MV http://s.ameblo.jp/miyu0728cbr/entry-11955550561.html …,2016-11-25 18:24:38,802291939638841344
"""You gotta hear thunder to know the storm is coming""",2016-11-25 18:24:25,802291882894233601
申し訳ありません。返事がなく断られたと思ってしまい、他の方と交換をしてしまいました。 本当に申し訳ありません。,2016-11-25 18:24:23,802291874924896256
"I might go to @ billycurrington at Country Thunder in Twin Lakes, WI - Jul 20 http://www.bandsintown.com/event/13040774?artist=Billy+Currington&came_from=15 …",2016-11-25 18:24:20,802291862090481664
Have a Great Weekend From Thunder Bay Ontario Canada Lake Superior MacKenzie Point pic.twitter.com/FuY8wdjQXP,2016-11-25 18:23:53,802291748588269573
Okc thunder need a win tonight. # westbrook # Westbeast # Bestpointguard,2016-11-25 18:23:26,802291633811230720
Steven Adams honing three-point shooting skills as friendly rivalry with Thunder 'Stache Brother' grows http://dlvr.it/MlFqkW pic.twitter.com/BS32XyEo5G,2016-11-25 18:22:35,802291419897438208
Coleman is the thunder to Gaskins' lightning.,2016-11-25 18:21:53,802291243891888128
hasn't helped the other three times. Thunder will lose by 15.,2016-11-25 18:21:49,802291229979537408
"Thunder King? I win, that's me!",2016-11-25 18:21:37,802291177676361732
The guy (Kevin Martin) the thunder traded james harden for is retired now.,2016-11-25 18:21:29,802291146114396160
Oklahoma City Thunder: Stephen Curry already predicting a win... https://goo.gl/fb/ut9PFo # oklahomacitythunder,2016-11-25 18:21:20,802291105991573504
Jump on 14 # NBA Games! # Raptors # Cavs # Thunder # Hawks # Warriors + More! Use Bonus Code WeTheNorth - 50% up to $100! https://ca.tonybet.com/betting-categories/nba …pic.twitter.com/QyXpnRaQhj,2016-11-25 18:21:00,802291025389690881
"hey guys, don't know if it's working right but I can't find it on the page it redirects to or either Thunder app. # okcthunder",2016-11-25 18:20:55,802291004019720192
hear the thunder see the rain. https://www.instagram.com/p/BNQFi2kj_dn/,2016-11-25 18:20:41,802290943391100928
@ ThunderS7ruck is a goat,2016-11-25 18:20:38,802290932225806336
"Wow, I love @ Listia! I just won this for free, Mark McGwire 1999 SkyBox Thunder http://www.batterz.com St. Lo https://www.listia.com/r22i5zd/DLGDPV",2016-11-25 18:20:37,802290925711953920
I just bought bubba Chicago Bulls vs OKC Thunder tickets. # BestBigSister,2016-11-25 18:20:29,802290891419484160
柏崎basscampお疲れでした！ 関わってくれた全ての人達、皆の力が無ければ成功はありえませんでした。 そして 行けなくて連絡をくれた人、 遠くから応援してくれた人、 SNSをシェアしてくれた人、 俺らTHUNDER SOUNDは幸せです。 respect,2016-11-25 18:20:27,802290884746170368
"Oklahoma City Thunder at Denver Nuggets on the way in the NBA! Betting tips, # NBA live streams and more!http://www.bettingpro.com/category/basketball/oklahoma-city-thunder-at-denver-nuggets-nba-2016-17-basketball-live-st-20161124-0017/ …",2016-11-25 18:20:15,802290836092260354
