text,date,id
Love Hydro Thunder on the 64. Played the arcade version of it whilst I was in Florida and enjoyed that too. pic.twitter.com/UVzCdIYbrc,2017-02-12 17:44:35,830910498916950017
"< things. It's the quieting of the wind and the softer grumbles of thunder that rouse me, I do believe. Maybe I hadn't even slipped into a >",2017-02-12 17:44:33,830910491966988291
Rushmore Thunder (2) at Varsity (2) - FINAL https://goo.gl/cF3Ayn,2017-02-12 17:44:31,830910483356073985
"The voice of a multitude roared like mighty waters & thunder, crying out: Hallelujah! The Lord our God Almighty reigns! (From Revelation 19)",2017-02-12 17:44:26,830910463768686592
"< building, joined with that of rain drops pelting against windows that rattle with each booming echo of thunder. I don't know how long >",2017-02-12 17:44:25,830910459901575169
Mi è piaciuto un video di @ YouTube: http://youtu.be/5fNLEPrNi2A?a Thunderstorm and Rain Sounds - Heavy Thunder & lightning Strike,2017-02-12 17:44:17,830910424866574336
Thunder # ALDUBxDTBYFTBukasNa https://twitter.com/LelenPeralta/status/830908048851939329 …,2017-02-12 17:44:14,830910413218869248
Was that thunder the Goddess was hearing? Or just the annoyance of a fly?,2017-02-12 17:43:56,830910335594819584
Channing Frye calls him White Thunder and Channing Frye' nickname is Black Lightning . Look at my pinned tweet,2017-02-12 17:43:52,830910321518854145
NBA Trade Rumors: Oklahoma City Thunder Open To Parting With Kevin Durant? New York Knicks Interested? # KevinDurant https://goo.gl/fb/l6Lg5J,2017-02-12 17:43:38,830910260361699329
All lined up in the battle of the Thunders! Liberty Thunder taking on the Kearney Thunder for the 12 U D3 Championship. pic.twitter.com/bsjdlaeBSC,2017-02-12 17:43:15,830910164295360513
Thunder when go fire this thief called Andrew still dey do press up for back of house. Am sorry for your children.,2017-02-12 17:43:12,830910154107449346
Vem pro Thunder @ carmeloanthony .Eu te amo,2017-02-12 17:43:10,830910142522781697
"Make it Thunder Nigga OKC 800whospaper @Monroeville, Pennsylvania https://www.instagram.com/p/BQYt7XSFMAa/",2017-02-12 17:43:05,830910121664450562
Thunder dome. – at Dundas Dome,2017-02-12 17:43:00,830910099824730113
we playing war thunder babe,2017-02-12 17:42:57,830910088131014656
Fair play to the BAFTA's for getting Tom Cruisr from Tropic Thunder to turn up to present this award,2017-02-12 17:42:18,830909927212404740
how tf am I a hater?? Only thunder fans would find away to defend their superstar getting double digit turn overs,2017-02-12 17:42:05,830909872887721984
Thunder fan Rich Taylor differs with Draymond Green’s account of their Saturday interaction: http://newsok.com/thunder-fan-denies-draymond-greens-description-of-taunts/article/5537828 …,2017-02-12 17:41:55,830909831229878274
Report: Warriors heavy favorites if Kevin Durant leaves Thunder # KevinDurant # KevinDurant https://goo.gl/fb/CTiFd9 # kevindurant,2017-02-12 17:41:47,830909796102586374
02-12 Golden State Warriors vs Oklahoma City Thunder: NBA live scores # KevinDurant http://dlvr.it/NMHY4Q,2017-02-12 17:41:45,830909787328049152
'No moral victories' for Thunder as they fall short against Warriors # KevinDurant http://dlvr.it/NMHY41 # KevinDurant,2017-02-12 17:41:45,830909786090647552
cocaine?,2017-02-12 17:41:44,830909784736071680
"Thunder-Clippers Trade Rumor: Blockbuster deal involving superstars Kevin Durant, Blake Griffin # KevinDurant http://dlvr.it/NMHXxF pic.twitter.com/FrEHrQHfsn",2017-02-12 17:41:38,830909756453720065
Cavaliers at Oklahoma City Thunder # OklahomaCityThunder... # OklahomaCityThunder https://goo.gl/fb/gjZXRZ # oklahomacitythunder,2017-02-12 17:41:16,830909666389553152
"Mas isso melhoraria o time, algo que o Thunder não gosta muito de fazer. https://twitter.com/PHnicacio13/status/830908924278628352 …",2017-02-12 17:41:00,830909598802518016
"Northern Ontario men's curling championship final: Brad Jacobs (Sault Ste. Marie) 6, Dylan Johnston Thunder Bay) 3.",2017-02-12 17:40:38,830909504783077381
# ytl cuddle yok -thunder,2017-02-12 17:40:27,830909461812412416
lmao. Na thunder go fire you for this picture,2017-02-12 17:40:16,830909415989661696
@ AshleyLolaRyan @ okcthunder Seattle fans need to get over worrying about Thunder fans. They have a team.,2017-02-12 17:40:07,830909375497658369
"More than anything, THIS is why I wish the Thunder could've pulled off a win. I'd love for them to shut this guy up. https://twitter.com/anthonyVslater/status/830617127207985153 …",2017-02-12 17:40:02,830909355616772096
"Now Playing The Call, It Thunders by Happy Diving",2017-02-12 17:40:01,830909351502237696
"@ LabrosseJanice There's small, medium, large......but no thunder size.",2017-02-12 17:39:58,830909340236337152
the only ones i know of are white noise and thunder https://twitter.com/pisbenakd/status/757354790108205061 …,2017-02-12 17:39:55,830909326923542528
"Y'know in hindsight, naming your product ""Thunder Leash"" probably isn't the smartest thing but hey you do you man",2017-02-12 17:39:49,830909300407148544
Fuck Golden State @ KDTrey5 Can't make it Thunder without Lightning I personally miss you over here,2017-02-12 17:39:38,830909253388996614
Playing around with some . I can see holylukeg or the homie @ lavangogh killing this # thunder… https://www.instagram.com/p/BQbbpNujavG/,2017-02-12 17:39:38,830909253259034624
@MiltonDoinWork worthing thunder r getting worse. Now 5-13 in league. They r so bad that Daniel hildreth is getting replaced next season,2017-02-12 17:39:32,830909228994981888
"Expect brief, heavy downpours, gusty winds, and even some isolated thunder on the Peninsulas & Eastern Shore this … https://twitter.com/i/web/status/830908969505931272 …",2017-02-12 17:39:18,830909168647286785
Russell Westbrook dice que entre los Thunders y Warriors no existe ninguna rivalidad. https://www.instagram.com/p/BQbbkt2B98u/,2017-02-12 17:39:03,830909109801082880
"С помощью двух карандашей (краска и лак)Thunder Paint, и полировки (3М 50417 + жёсткий… https://www.instagram.com/p/BQbajZUlnfc/",2017-02-12 17:38:45,830909030596018179
"Expect brief, heavy downpours, gusty winds, and even some isolated thunder on the Peninsulas & Eastern Shore this evening. Tune into @ WTKR3!pic.twitter.com/BRaZ1b8xRY",2017-02-12 17:38:30,830908969505931272
NBA Oklahoma City Thunder Victor Oladipo #5 Men's Replica Jersey - http://probasketballfanstore.com/nba-oklahoma-city-thunder-victor-oladipo-5-mens-replica-jersey/ … # nba # basketballpic.twitter.com/VzqP2uB7UM,2017-02-12 17:38:25,830908947439706115
[HE USED THUNDER YOU WOULD GET GRILLED FROM THAT TOO],2017-02-12 17:38:13,830908898202832896
Niggas really tryna turn the Warriors & Thunder into a Rivalry lmfao that shit one-sided as fuck,2017-02-12 17:38:11,830908889004535808
"Baltimore trends now: North Korea, N. Korea, Thunder, Durant, We Were Soldiers. http://toplocalnow.com/us/baltimore/topics …",2017-02-12 17:38:05,830908865491279872
last year when steph had to score 50 to beat a thunder team that had KD n Russ that was fun he could have went anywhere I don't,2017-02-12 17:38:00,830908844276666374
You gotta play the Wizards vs Thunder game with me in FireFan. Download the app and come play. It's a blast! http://www.firefan.com/player-invite/gamedayplay/usualsuspect/a08db0f84a502fc904aa66f49e1de191-2bbecb3c-2610-40e8-a8bc-fd467481904c …,2017-02-12 17:37:48,830908791206055936
Gostei de um vídeo @ YouTube http://youtu.be/-UpDfaoLBOk?aWar … Thunder - MOD DE CAÇÃS SUPER AVANÇADOS - X-SPIDER,2017-02-12 17:37:33,830908730912997376
that must be what my in laws ask themselves when I thunder down the stairs shouting “śnieg! Śnieg!”,2017-02-12 17:37:24,830908692505600000
na. They just like spoiling the news about upcoming releases and stealing Arrow's thunder.,2017-02-12 17:36:56,830908575849578496
Dakota Thunder and Frontier Village http://www.ghostsofnorthdakota.com/2012/06/03/dakota-thunder-and-frontier-village/ … via @ northdakotatroy # buffalo # tatanka # northdakota,2017-02-12 17:36:50,830908551019241473
You'll always be my thunder,2017-02-12 17:36:42,830908516693114880
year after year the thunder had the best talent and got bounced by the griZz or the spurs and we sat and blamed him.,2017-02-12 17:36:29,830908462531895296
Imma be the Thunder jack nickalson inna few years lol,2017-02-12 17:36:20,830908424217038848
"haha sorry guys, the thunder and lightning 'n shit is my fault.",2017-02-12 17:36:17,830908411130679296
"I swear if I'm hearing thunder, I'm about to be the happiest person alive.",2017-02-12 17:36:10,830908381808373760
"On page 48 of 320 of A Quiet Kind of Thunder, by Sara Barnard https://goodreads.com/user_status/show/121975417 …",2017-02-12 17:35:46,830908283527507968
De vuelta a la época del colegio....Boys Like Girls - Thunder https://youtu.be/ytLzxl4-mLw vía @ YouTube,2017-02-12 17:35:43,830908270063779840
What's going on OKC? Kevin Durant's Return to OKC Fuels Thunder Fans' Passion… http://dlvr.it/NMHSJ6 Get found -> http://goo.gl/GNn5iH,2017-02-12 17:35:38,830908249129971714
Been a Midway-themed evening: Hydro Thunder and Gauntlet Legends. Who else has played these arcade-style classics? pic.twitter.com/vBPB439HAk,2017-02-12 17:35:37,830908243270565888
4*4 Red Thunder Super Speed Wild Die-Cast Four Wheel Drive Power Off Road Die-cast metal with big rubber tyres... http://fb.me/8vJZU5Udt,2017-02-12 17:35:29,830908211473494016
Report: Warriors heavy favorites if Kevin Durant leaves Thunder # KevinDurant # KevinDurant http://dlvr.it/NMHS7d,2017-02-12 17:35:23,830908186609623040
Roberson e duas picks de primeira ronda e temos Carmelo nos Thunder ahahah deixem me sonhar # nbanasporttv,2017-02-12 17:35:13,830908144532471810
I liked a @ YouTube video http://youtu.be/w5amL13V9Jc?a Little KISS God of Thunder,2017-02-12 17:35:12,830908140841553921
"J'aime une vidéo @ YouTube : ""Thunder Teamtage 1"" à l'adresse http://youtu.be/KIY9w20xlRA?a .",2017-02-12 17:35:11,830908135103676416
"This day in 2006, Meck feat Leo Sayer was at No.1 on the UK singles chart with 'Thunder In My Heart (Again)'. DJ... http://fb.me/3lFXGk2NZ",2017-02-12 17:35:03,830908099301085186
"For your enjoyment, ""Such Sweet Thunder"" by Duke Ellington # np # Jazz",2017-02-12 17:34:34,830907980212215808
"PET PEEVE Dog & Cat CALMING MIST B4 Vet, Groom Thunder http://www.petitems2day.info/US/landing-static/twitter06/?id=http://rover.ebay.com/rover/1/711-53200-19255-0/1?ff3=2&toolid=10039&campid=5337889868&item=311801304029&vectorid=229466&lgeo=1 …pic.twitter.com/aKktORnweT",2017-02-12 17:34:31,830907968883421188
Thunder fans made ridiculous; t-shirts for Kevin Durant return (VIDEO) http://nba.nbcsports.com/2017/02/12/thunder-fans-koward-kevin-durant-t-shirt-warriors-video/ … Wasn't a KowarD when he donated time & money?,2017-02-12 17:34:24,830907937010880514
"Prospect goaltenders Anze Klatt, Herb Babych and Per-Age Penner have been moved to Thunder Bay.",2017-02-12 17:34:20,830907920485380096
@The_Mon5t3r who's a thunder fan tho,2017-02-12 17:34:18,830907910494359552
@ tato3104 @ thunder_pastel @ zqooqoo @ hiroyan1129 @ telezoh @ hama64kana @ hamugorou55 @ FT_86 そらうみクラスタの皆様、おはようございます( ´ ▽ ` )ﾉ 猫のシッポ187回配信しました。,2017-02-12 17:34:09,830907873353797632
"Yet for some reason the Thunder players and fans keep talking. Move on, he left. And rule no.1- don't talk smack when down 20 pic.twitter.com/ZKZ7QTBxhz",2017-02-12 17:34:07,830907866341056514
"Raise your words, not voice. It is rain that grows flowers, not thunder. - Rumi # quote",2017-02-12 17:34:04,830907851749093377
@ AmberSullins Thunder and lightning rolling thru Surprise right now. No rain yet...,2017-02-12 17:34:01,830907841867247617
I'm so happy that KD and Warriors have demolished the Thunder everything they've played this year.,2017-02-12 17:33:59,830907833931677697
"Prospects Ervins Hickey (RW), Orval Pirus (RW), Orest Jacobsen (F) & Kraig Tangradi (D) have been moved to Thunder Bay.",2017-02-12 17:33:47,830907784485040132
2 big wins for @ Cal_Thunder 7W to finish our CH session! Took down a good BC and FHE team! Tremendous team effort! # calpride,2017-02-12 17:33:39,830907748556611584
캴캴 지목 @sheudie 에게 받아써열 @cuddi0112 @ThundeR_21VoicE @ Heimish_JD 지목합니ㅑ아 # 엑소엘스밍인증챌린지pic.twitter.com/zicoXuXPyB,2017-02-12 17:33:20,830907669724745728
Cada día un poquito más de los Thunder. https://twitter.com/nbaplus/status/830724402312417281 …,2017-02-12 17:33:10,830907629119610882
"Left Wing prospects Konstantin Lupul, Reid Reise and Bjorn McIntosh have been assigned to Thunder Bay.",2017-02-12 17:32:57,830907573868101638
"Unelected Lords shouldn’t meddle with Brexit by amending EU bill, Tory MP thunders http://fb.me/1Rk10ayqA",2017-02-12 17:32:26,830907443479711744
The 'Dogs have moved center prospects Enrico Matte and Konstantin Klima to Thunder Bay.,2017-02-12 17:32:22,830907426140516352
that was a nice goal!,2017-02-12 17:32:18,830907408956407809
Thunder Fans Threw Shade at KD But the Warriors Destroyed the Thunder WATCH at: http://www.friendlydb.com/item/10778268/thunder-fans-threw-shade-at-kd-but-the-warriors-destroyed-the-thunder-watch-at …pic.twitter.com/1Bvg3Wb4wc,2017-02-12 17:32:13,830907389897347072
"hey Will, how's your Sunday so far?",2017-02-12 17:32:09,830907371308380161
"Catherine is not like thunder, and then get a bagful.’",2017-02-12 17:32:05,830907355130896384
PHOTOS: Trail Blazers Gather for Practice Inside Oklahoma City Thunder Arena # OklahomaCityThunderhttps://goo.gl/fb/mdjQlv,2017-02-12 17:31:57,830907321702297601
OKC Thunder: Golden State Holds Off Charge To Be Oklahoma City # KevinDurant https://goo.gl/fb/0Wk1MC # kevindurant,2017-02-12 17:31:54,830907309534625794
"@ maxWrottesley Thunder Cats, goooooooooooo!",2017-02-12 17:31:51,830907297052360707
"""Warriors' Twitter Promotes Game Versus Thunder with Kevin Durant, Andre Roberson | Blea…"" via @ BleacherReport App:http://bleacherreport.com/articles/2692506-warriors-twitter-promotes-game-vs-thunder-with-kevin-durant-andre-roberson?utm_campaign=tsiphone&utm_medium=referral&utm_source=twitter.com …",2017-02-12 17:31:29,830907202831601664
THIS THUNDER IS SCARING ME WTF,2017-02-12 17:31:11,830907129993187328
"@ cbarbosa35 os thunder são uma merda e tu também,TB qnd comeste o meu menino Filipe ahahahha adoro te",2017-02-12 17:30:46,830907023898320897
"Wait, you're drinking Dr. Who?!? Oh, And watch out for Dr. Thunder... keep some air freshener handy.",2017-02-12 17:30:14,830906888795586560
# GoldenStateWarriors vs Oklahoma City Thunder - Full Highli.. https://www.youtube.com/watch?v=9VMQjUMzztY … Follow @ sportofusa # NBA,2017-02-12 17:30:12,830906881153581057
Thunder fans repeatedly boo Durant as he returns as opponent http://bit.ly/2kIeR3M pic.twitter.com/zsxjZqeLIR,2017-02-12 17:30:09,830906867736072194
"Raichu has appeared! Expected despawn: 04:49:54pm(29m 47s) IV:64.44% (13/8/8) Moves:Spark, Thunder Punch http://maps.google.com/maps?q=29.27079643425569,-94.82067618946071 …",2017-02-12 17:30:07,830906857850015744
"É isso que eles não entendem, aí acabou com o Thunder",2017-02-12 17:30:02,830906839781011457
#2: Russell Westbrook Oklahoma City Thunder Adidas Orange Alternate Shirt: Russell Westbrook… https://goo.gl/fb/jhzSFm # Sports # Equipment,2017-02-12 17:29:11,830906626760704002
"The Captain, in his 300th Thunder game, hits 200 points in Thunder blue! # Milestone # ThunderNationpic.twitter.com/eGDFpWB2FF",2017-02-12 17:29:05,830906599237681154
"I jst lyk my phone wit d way it predicts text 4me.... imagine whenever I type ""thunder"" d nxt tin it will show is... http://fb.me/7Wc9REaM5",2017-02-12 17:28:56,830906560478113792
@ PATTI_THUNDER Defend Trump!,2017-02-12 17:28:40,830906493335719936
Immediately after thunder clapped the sis pulled out her phone and https://twitter.com/joicoreaa/status/830906081014489088 …,2017-02-12 17:28:25,830906429863124993
Not bad. been playing war thunder with a pal...what about yours?,2017-02-12 17:28:20,830906412087836672
"""You have an attack of opportunity"" ""I cast Thunder Wave"" ""I want to Flurry of Blows"" THAT IS NOT HOW ANYTHING WORKS",2017-02-12 17:28:19,830906405028786176
Where did this thunder come from,2017-02-12 17:28:06,830906350947360768
"Raise your words, not your voice. It is rain that grows flowers, not thunder. # goodnight",2017-02-12 17:28:01,830906329837469696
"Snow squalls, with thunder and lightning, moving SE towards Lake St. Clair. Wind gusts over 40MPH possible. # miwxpic.twitter.com/2xpS7bikMB",2017-02-12 17:27:55,830906305258872833
Where did this sudden thunder come from,2017-02-12 17:27:45,830906264146243584
Damn that was some loud ass thunder.,2017-02-12 17:27:38,830906236467941376
Is that thunder or my neighbors taking out their trash cans lmfao,2017-02-12 17:27:31,830906205828575232
"Belle River Pikachu 29m 45s 24.44 4 0 7 Thunder Shock Thunder http://maps.google.com/maps?q=42.290632651205186,-82.69327200333014 …",2017-02-12 17:27:24,830906175973638144
Buzzing KD got another one over Westbrook and the Thunder! # DubNation,2017-02-12 17:27:21,830906165412388869
alex rlly just told me that he thought the thunder was a bomb,2017-02-12 17:27:17,830906146646941696
That thunder is crazy,2017-02-12 17:27:07,830906105924431873
Raining and thunder in Surprise Arizona @ SchwartzTV # azwx,2017-02-12 17:27:04,830906092368515073
This thunder is wild,2017-02-12 17:27:03,830906088367157249
DESCRIPTION This group is to show why Thunder Bay is a beautiful community full of wonderful places and people.... http://fb.me/vizmRrzA,2017-02-12 17:26:35,830905969043439618
Thunder - passenger,2017-02-12 17:26:21,830905911128576000
Kevin Durant's Mom to Oklahoma City Thunder Fans: 'It Didn't Have to Be Like This' - Complex http://dlvr.it/NMHK9T,2017-02-12 17:26:05,830905844246073344
The last act needs to Slow The Fuck Down and the morals are ham handed BUT it's still fun.,2017-02-12 17:26:02,830905831910694917
# DogTraining: Does Your Dog Have a Fear of Thunder? https://goo.gl/xwVDlN,2017-02-12 17:25:50,830905780610011136
"""Yeah my Anal Thunder"" xd",2017-02-12 17:25:23,830905669415006210
Sunshine follows thunder,2017-02-12 17:24:49,830905524111675392
"From the lightning in the sky As it passed me flying by, From the thunder and the storm, And the cloud that took the form",2017-02-12 17:24:47,830905519145680897
Thunder cats is my favorite cartoon,2017-02-12 17:24:30,830905446416388096
Ricky Skaggs & Kentucky Thunder - Think of What Youve Done - Ricky Skaggs & Kentucky Thunder,2017-02-12 17:24:07,830905351008509952
"@kc1nyk which is more likely for thunder, Lou will or Wilson Chandler?",2017-02-12 17:23:49,830905275011960833
Ich habe ein Video zu einer @ YouTube-Playlist hinzugefügt: http://youtu.be/RzO8PLVwRV4?a Golden State Warriors vs Oklahoma City Thunder,2017-02-12 17:23:47,830905264685604864
"Thunder snow, pretty cool.",2017-02-12 17:23:34,830905210537144320
well played guys,2017-02-12 17:23:30,830905195311816704
E a parceria já têm resultados... ## # ANOTA AÍ NA AGENDA###MEGA-THUNDER-POWER surpresa… https://www.instagram.com/p/BQbZySbh9rY/,2017-02-12 17:23:25,830905173602029568
THANKS BLACK THUNDER!! MISS U SO MUCH,2017-02-12 17:23:05,830905088747139076
THUNDER AND WHITE NOISE SAY HI BUT YES THIS IS CORRET,2017-02-12 17:22:52,830905035517206528
You're petty enough to be a Thunder fan https://twitter.com/big__shit/status/830877332046962689 …,2017-02-12 17:22:17,830904888607461376
"Raise your words, not your voice. It is rain that grows flowers, not thunder.",2017-02-12 17:22:17,830904887554744320
if you steal his thunder,2017-02-12 17:22:15,830904880768368640
I guess the thunder picture before & after the number makes it 'truth' & believable(!) # alternatefactshttps://twitter.com/NathanDWilsonFL/status/830820230494568449 …,2017-02-12 17:22:07,830904846375088128
"@ abc15 thunder, lighting, and now heavy rain. It's like August!",2017-02-12 17:22:02,830904825038598145
"20% off baby travel online eg 3 way baby carrier now £12, travel cot now £21.60, Britax prince black thunder car… http://www.hotukdeals.com/deals/20-off-baby-travel-online-eg-3-way-baby-carrier-now-12-travel-cot-now-21-60-britax-2617216?utm_source=dlvr.it&utm_medium=twitter …",2017-02-12 17:22:00,830904818273185792
"20% off baby travel online eg 3 way baby carrier now £12, travel cot now £21.60, Britax prince black thunder car… http://dlvr.it/NMHGSh",2017-02-12 17:21:51,830904779098296320
"Running Man 2017 Live n BKK 2017年3月11日 (土) 18:00 Thunder Dome, Muang Thong Thani (サンダードーム、ムアントーンタニ) # SE7EN # RunningMan2017inBKKhttps://twitter.com/ysentbkk/status/830676737126068225 …",2017-02-12 17:21:48,830904765018103808
that thunder came out of nowhere,2017-02-12 17:21:43,830904745892028418
@ BoopOnTheFly is my best friend and Anal Thunder. And i love her! So back the fuck up. She is special and well i love her with all my heart!,2017-02-12 17:21:35,830904713294004224
"Мне понравилось видео ""Новая механика HULL BREAK ""Разрушение корпуса"" | War Thunder""",2017-02-12 17:21:34,830904707401019392
triple diamond,2017-02-12 17:21:30,830904689210191872
you're a piece of shit but you play war thunder,2017-02-12 17:21:22,830904656956096513
"Thunder faya all of them, including the so called archbishop https://twitter.com/chivaneze/status/830904031195316229 …",2017-02-12 17:21:00,830904566816309249
it was hot enough to wear shorts yesterday n now i just heard thunder. wlcm to az,2017-02-12 17:20:53,830904537447698432
thunder,2017-02-12 17:20:51,830904529432424448
Okay I know y'all heard that thunder too,2017-02-12 17:20:42,830904491511685120
Old boy Durant silences booing Thunder fans http://ebx.sh/2l8QfSe pic.twitter.com/gseLCQKlEp,2017-02-12 17:20:42,830904489259462659
Okay... so thunder and lightning. It's been since like September that I've seen that.,2017-02-12 17:20:40,830904482418470913
"Raise your words, not your voice. It is rain that grows flowers, not thunder.",2017-02-12 17:20:28,830904431600422913
let the rain fall down and wake my dreams let it wash away my sanity cause i wanna feel the thunder i wanna scream let the rain fall down,2017-02-12 17:20:28,830904431164137472
"Some nights I lose the feeling, Some nights I lose control, Some nights I just lose it all when I watch you dance and the thunder rolls",2017-02-12 17:20:25,830904419034206208
"Above the roaring thunders, you're the only voice that I could hear. And you choose not to speak a single word.",2017-02-12 17:20:24,830904412553908225
Golden State Warriors beat Thunder in Oklahoma City | http://abc7news.com .. Related Articles: http://bit.ly/2kI6LZ6,2017-02-12 17:20:18,830904388159938560
Thunder gives me heart attacks,2017-02-12 17:20:14,830904372729049088
Thunder,2017-02-12 17:20:10,830904356010594304
way to go thunder,2017-02-12 17:20:10,830904354525818882
And the thunder rolls,2017-02-12 17:20:05,830904335185764352
"Raise your words, not your voice. It is rain that grows flowers, not thunder.",2017-02-12 17:20:02,830904322217086976
"tabırdaw / табырдау 雷が鳴る(kaminariga naru, to thunder)、轟く(todoroku, to roar)、ゴロゴロという音を立てる(gorogoro toiu otowotateru, to rumble)",2017-02-12 17:20:02,830904321554292736
NowPlaying-On-Amplitude-PREMIERE:W&W - Thunder (Original Mix),2017-02-12 17:20:01,830904316395397120
THUNDER,2017-02-12 17:19:50,830904270409125889
"「この動画はご利用いただけません」と言われる ""The Japanese House"" なるバンドのライブが気になるのだが。 ""Face Like Thunder"" (Live at WFUV) https://www.youtube.com/watch?v=ZOnd-adB58U&feature=share …",2017-02-12 17:19:47,830904260791455745
the sound of thunder gives me chills,2017-02-12 17:19:40,830904229854269440
Damn that thunder,2017-02-12 17:19:38,830904223130718208
"In a chippy battle between Kevin Durant and the Thunder, KD scores 34 points to lead the Warriors... - via @ ESPN App http://es.pn/2lwHr9U",2017-02-12 17:19:24,830904163601117184
Steph Curry played volleyball with a basketball during timeout vs. Thunder http://dld.bz/fywe2,2017-02-12 17:19:23,830904158282727424
turns out Days of Thunder quotes don't help in such situations,2017-02-12 17:19:22,830904155770322944
I hear thunder...,2017-02-12 17:18:53,830904030721368064
Why do you want thunder to fire your enemies when God wants to set a table for you in the presence of your enemies? pic.twitter.com/T10VTra9b0,2017-02-12 17:18:52,830904027659563009
"Raise your words, not your voice. It is rain that grows flowers, not thunder.",2017-02-12 17:18:50,830904020126543876
Каково «летунам» из Star Conflict и War Thunder будет в Пиратах? http://dlvr.it/NMHCWm pic.twitter.com/lsaCFRXYgW,2017-02-12 17:18:44,830903993635213313
"(Lake Elsinore) Jolteon 96% (13/15/15) thunder shock fast/thunderbolt) till 14:47:39 (29m 39s) https://maps.google.com/maps?q=33.640225105321626,-117.34562602989682 …",2017-02-12 17:17:59,830903805684305920
"That's it. The final horn mercifully sounds, and the Thunder take this one, 10-4.",2017-02-12 17:17:45,830903745869385729
"Raise your words, not your voice. It is rain that grows flowers, not thunder.",2017-02-12 17:17:42,830903736562233345
Neither the Bulls nor the Thunder are trading those players.,2017-02-12 17:17:30,830903684691275776
wow @abby_love21 way to steal my thunder haha,2017-02-12 17:16:52,830903523927740416
"That's the game. Thunder beat Manchester 10-4, most goals scored in the team's short history.",2017-02-12 17:16:38,830903464817524737
