text,date,id
Send that man back to the thunder https://twitter.com/bleacherreport/status/830887246198829056 …,2017-02-12 16:16:59,830888455181737984
Greenville SC radar 4:10 pm. Thunder storms in WNC. # tnwx # ncwxpic.twitter.com/FyGIBQSohc,2017-02-12 16:16:59,830888454917615616
Of course I gotta play the # Warriors when I pick the # Thunder… https://www.instagram.com/p/BQbSLRcBHnM3gIXH-6msoSuLTrSUiDh1mGGAns0/ …,2017-02-12 16:16:54,830888433161695232
As for thunder thighs,2017-02-12 16:16:36,830888358947729410
I just want to be this bird. At Big Thunder Mountain. @Big Thunder Mountain Railroad https://www.instagram.com/p/BQbSIpzlg17/,2017-02-12 16:16:34,830888348302585857
OKC Thunder: Golden State Holds Off Charge To Be Oklahoma City... # KevinDurant http://dlvr.it/NMGPDH,2017-02-12 16:16:24,830888309459030016
You seem pretty happy about it too.,2017-02-12 16:16:23,830888302496587777
"""I see ya! Thunder time!"" - Kanji",2017-02-12 16:16:21,830888294552522752
"[Post Game Thread] The Golden State Warriors (46-8) put down the Oklahoma City Thunder (31-24), 130-114, in Kevin … http://ift.tt/2l2qTpP",2017-02-12 16:16:20,830888289993363456
"Wow. 15 seconds later, Falkovsky has another one (same spot) and Sam Brittain replaces Imoo in net for the Monarchs. Thunder lead 7-3",2017-02-12 16:16:03,830888219449372672
Then he needs to shut up about it. And the press needs to stop stirring the pot.,2017-02-12 16:15:56,830888189418143744
LOOK: Warriors wear cupcake t-shirts following blowout of Thunder - http://www.fanragsports.com/now/look-warriors-wear-cupcake-t-shirts-following-blowout-thunder/ …,2017-02-12 16:15:44,830888140793487360
but that thunder hoodie?,2017-02-12 16:15:43,830888135265497088
"Raise your words, not voice. It is rain that grows flowers, not thunder. - Rumi # quote",2017-02-12 16:15:41,830888128688844806
"Raise your words, not voice. It is rain that grows flowers, not thunder. - Rumi # quote",2017-02-12 16:15:28,830888073869348864
"Just like that, Falkovsky puts the Thunder up, 6-3...",2017-02-12 16:15:23,830888053409460224
KISS - God of Thunder,2017-02-12 16:15:12,830888007834140673
Kevin Durant aniquila a los Thunder de Westbrook en su regreso a Oklahoma City http://ver.as/vtqnf1 # NBApic.twitter.com/RBnIeyMVL3,2017-02-12 16:15:07,830887984740327425
"Raise your words, not voice. It is rain that grows flowers, not thunder. - Rumi # Qoute # ThinkBIGSundayWithMarsha",2017-02-12 16:15:05,830887977857511424
"""That's a lie, no one can do the THUNDER BOLT AND LIGHTNING VERY VERY FRIGHTENING part silently.""",2017-02-12 16:14:55,830887937038393344
I looked up chocolate thunder and this is who popped up pic.twitter.com/ws6P7XC2Ma,2017-02-12 16:14:50,830887913093214208
# WizKids # DCRising # WizardsTalk Scott Brooks reacts to Kevin Durant being booed by OKC Thunder fans http://dld.bz/fyvKA,2017-02-12 16:14:37,830887859448139780
"Sauve sits for a high stick and the Thunder have 1:09 of five-on-three, up 5-3 with 6:28 left in the second period.",2017-02-12 16:14:01,830887707530371072
"Yeah, perhaps Mrs. # Durant is out of touch with her son's feeling here. Kevin looked pretty happy torching the # Thunder.",2017-02-12 16:13:47,830887649804222465
Hear the Word roaring with thunder With a new future to tell For the dry season is over There is a cloud beginning to swell,2017-02-12 16:13:47,830887649481220099
Jeg kunne lide en video på @ YouTube http://youtu.be/0_AiYGxHHZc?a War Thunder - Air Realistic Battles Intro Part 1 - Know your plane,2017-02-12 16:13:46,830887643655307268
Loan: Maxime St-Cyr (F) | Pensacola Ice Flyers -> Wichita Thunder | http://eliteprospects.com/t.php?id=298680 # ECHL,2017-02-12 16:13:23,830887550961192962
"En el duelo más esperado por la # NBA, Durant le ganó a Westbrook. Warriors 130-114 Thunder. https://twitter.com/martineztomas24/status/830634005359886340/photo/1pic.twitter.com/ab9elJeHr2",2017-02-12 16:13:12,830887502881943554
It's Thunder! In an ad in Time Magazine 1980. # sheepdog # oldenglishsheepdog # vintage # magazine # ad https://www.instagram.com/p/BQbRu8RAmWC/,2017-02-12 16:13:02,830887460490076163
I liked a @ YouTube video from @ acblackj0ck http://youtu.be/pPmm2dBtB4o?a X-Play - Crazy Adam's Import Games: Heavy Metal Thunder,2017-02-12 16:13:02,830887459433152512
If you ride like lightning You'll crash like thunder .,2017-02-12 16:12:29,830887321415405568
Raichu till 01:41:56pm (29m 43s) IV:93.33% 15/15/12 Thunder Shock/Thunder Punch http://rightintheh.com/,2017-02-12 16:12:13,830887253429719046
Haha took my thunder cheers bud,2017-02-12 16:11:54,830887177596841984
you will always be my thunder,2017-02-12 16:11:53,830887172530057216
"Lynch sits for a slash and the Thunder have a power play, up 5-3 with 7:19 left in the second period.",2017-02-12 16:11:52,830887168474181632
NBA Daily Wrap: Kevin Durant leads Warriors past Thunder http://dlvr.it/NMGJgj pic.twitter.com/jNHeOsrise,2017-02-12 16:11:38,830887107065286656
"And the original (and better) version of 'Inheritance' can be found on 'Thunder And Consolation', without the wincing. # listeningclub",2017-02-12 16:11:34,830887092356055042
Cross County Basketball League: SS Suns 6th (35) at Unity Thunder 6th (28) - FINAL https://goo.gl/mgyexl,2017-02-12 16:11:31,830887078766444544
Can't wait till everything greens up and I can go chase some thunder chickens,2017-02-12 16:10:58,830886941860184065
WJNG - Arctic Thunder: http://youtu.be/8vaKOBtzrIo?a via @ YouTube,2017-02-12 16:10:58,830886941797314561
Follow the god of thunder into the viral world of ThorMailz.....http://thormailz.com/?rid=76,2017-02-12 16:10:45,830886888345042944
just a day of rest for the starters. Plus im a thunder fan,2017-02-12 16:10:42,830886872603836416
always THUNDER AND LIGHTNING @ SabrinaAnnLynn @ RowanBlanchard,2017-02-12 16:10:41,830886867499376640
"Hypothetically if the Thunder proposed a Jokić for Westbrook trade, the Nuggets should not accept it",2017-02-12 16:10:10,830886740546158593
# WizKids # DCRising # WizardsTalk Wizards' John Wall deals with sprained ankle with Thunder up next http://dld.bz/fyvKB,2017-02-12 16:10:06,830886724217757696
Books written by my Army Veteran Seelöwe Nord Thunder in May Crucible of Fate And Kingdoms Shall Fall All on http://Amazon.co.uk,2017-02-12 16:09:56,830886682895450114
Russell Westbrook shooting jumper vs # Warriors. You can see his intensity & all eyes focused on him. @ russwest44 earning # MVP. # Thunder # NBApic.twitter.com/iJ9q6peYjr,2017-02-12 16:09:47,830886643800346624
Steph Curry played volleyball with a basketball during timeout vs. Thunder - SB Nation http://dlvr.it/NMGHBV,2017-02-12 16:09:34,830886589660160000
@ WojVerticalNBA are you hearing anything about any potential Thunder activity before the deadline?,2017-02-12 16:09:22,830886537323741186
argument. The thunder were going to be the favorites to win the title this year if he had stayed,2017-02-12 16:09:13,830886500933832704
Knicks are on National Tv again on Wednesday...... Vs the Thunder...,2017-02-12 16:09:12,830886496592941056
Quiero asomarme por la ventana y gritar LET THE RAIN FALL DOWN AND WAKE MY DREAMS LET IT WASH AWAY MY SANITY CAUSE I WANNA FEEL THE THUNDER,2017-02-12 16:09:04,830886461197139972
"Class – ♫Broken by Thunder, from # SoundHoundhttp://soundhound.com/?t=100867101923096925 …",2017-02-12 16:08:23,830886288941281280
RT @PiletsoT: May thunder strike the person who selected Kemen instead of Jon. # BBNaijapic.twitter.com/ad64mK9mEv,2017-02-12 16:08:00,830886194145796097
Durant clashes with Westbrook on Thunder return http://www.ekowasmahsports.com/durant-clashes-with-westbrook-on-thunder-return/ …,2017-02-12 16:07:54,830886170561282048
"I really need to get rid of my thunder thighs, bingo wings and jelly belly! for the 10000th time, diet starts Monday",2017-02-12 16:07:43,830886123941588993
"Washington Wizards’ John Wall Sprains Ankle, Will Play Against Oklahoma City Thunder http://www.chatsports.com/washington-wizards/a/source/washington-wizards-john-wall-sprains-ankle-will-play-against-oklahoma-city-thunder-13256226 … via @ chatsports # Wizards",2017-02-12 16:07:43,830886121819275267
"Kevin Durant cake walks Russell Westbrook, Thunder in Oklahoma City return (by... http://ln.is/zGZRZ by # SInow via @ c0nvey",2017-02-12 16:07:37,830886099643928577
"Jolteon 40.00% (4-3-11) [Thunder Shock/Thunder] till 14:06:11 (59m 12s) http://maps.google.com/maps?q=36.82452858504404,-119.71812548515848 …",2017-02-12 16:06:58,830885933977214976
"Raise your words, not voice. It is rain that grows flowers, not thunder. - Rumi # quote # staypositive",2017-02-12 16:06:56,830885924900896772
"Electabuzz (68.9%) Thunder Shock/Thunder 10/10/11 (ATK/DEF/STA) Despawns at 13:36:00 https://maps.google.com/maps?saddr=My+Location&daddr=34.165845462549484,-118.52329817906332 …",2017-02-12 16:06:54,830885917409714176
"I liked a @ YouTube video http://youtu.be/m1e6egkuzjE?a Kevin Durant Deep Three on Westbrook's Face | Warriors vs Thunder | Feb 11, 2017 |",2017-02-12 16:06:52,830885909994336258
@ Asmongold you can also get T14 Bonusrolls from Isle of Thunder rares & golden chests while waiting for Nalak/after the kill.,2017-02-12 16:06:18,830885767379558400
"I liked a @ YouTube video from @ dawkinsmta http://youtu.be/hIVxXZJDSUI?a Stephen Curry Full Highlights 2017.02.11 at Thunder - 26 Pts, 9",2017-02-12 16:06:00,830885692129550338
thunder mountain broke down... pic.twitter.com/fGEFPxvwOC,2017-02-12 16:05:37,830885596465762304
"Somewhere, someplace,my future wife is discussing Valentine with one idiot. Father Lord please let ur thunder destroy their plans",2017-02-12 16:05:17,830885512168763392
@ LTP1350 bringing the thunder and lightning til 10:30pm over at http://Livewire1350.com pic.twitter.com/NsJpAJ3Q2y,2017-02-12 16:05:05,830885459068854272
If you just heard thunder in # BayCity or even in # Saginaw you are not hearing things. It really happened! A mix... http://fb.me/5JxXpWBRK,2017-02-12 16:04:59,830885434683224065
KD'S RETURN!! Golden State Warriors VS Oklahoma City Thunder 2/11/17 FULL HIGHLIGHTS AND REACTION!!!: http://youtu.be/ArnR10xW9D0?a via,2017-02-12 16:04:39,830885349190668288
"wizofawes .com >> Washington Wizards’ John Wall Sprains Ankle, Will Play Against Oklahoma City Thunder http://buzztap.com/-6j8Zk5",2017-02-12 16:04:38,830885345533243392
a ble,2017-02-12 16:04:30,830885313899794434
Nop me lo hizo @ Draw_Thunder,2017-02-12 16:04:17,830885257750671362
Oklahoma City Thunder and Charlotte Hornets bring up play-off victories # OklahomaCityThunder https://goo.gl/fb/od4Fjp # oklahomacitythunder,2017-02-12 16:04:16,830885255045345280
Morris gets one past Fielding and the Monarchs trail the Thunder 5-2 at 6:47 of the second period.,2017-02-12 16:04:10,830885229351022598
Ashton throwing the ball for Thunder # WonderDogThunder @Round Rock Dog Depot (Dog Park) https://www.instagram.com/p/BQbQs9XhXXg/,2017-02-12 16:04:02,830885194718642176
Russell Westbrook wore a Willie Beamen jersey from 'Any Given Sunday' before Warriors-Thunder http://www.sbnation.com/lookit/2017/2/11/14588100/russell-westbrook-wore-a-willie-beamen-jersey-any-given-sunday-before-warriors-thunder?utm_campaign=sbnation&utm_content=entry&utm_medium=social&utm_source=twitter … @ chrisspahn @ aspahn,2017-02-12 16:03:43,830885117841149952
Ricky Skaggs & Kentucky Thunder - Another Night - Ricky Skaggs & Kentucky Thunder,2017-02-12 16:03:39,830885099289800705
White Zombie - Thunder Kiss '65 http://rdo.to/IROCK # irockradio # listenlive,2017-02-12 16:03:37,830885092235079680
Miss the Thunder buddies https://twitter.com/yourgentieman/status/830884274077306885 …,2017-02-12 16:03:25,830885040850599936
THUNDER RETRIEVE TRAINING: http://youtu.be/EGN4VlkURX8?a via @ YouTube,2017-02-12 16:03:18,830885013159804931
Book Trailer Reveal: Nowhere But Here (Thunder Road #1) by Katie McGarry - http://www.totalbookgeek.com/2015/04/15/book-trailer-reveal-nowhere-but-here-thunder-road-1-by-katie-mcgarry/ …,2017-02-12 16:03:15,830884997859049473
Oklahoma City Thunder fall to Golden State Warriors in Durant’s return http://isportsweb.com/2017/02/12/oklahoma-city-thunder-fall-warriors-durants-return/ …pic.twitter.com/tuRFlNTaNn,2017-02-12 16:03:15,830884997208883200
¿Que escuchan los jugadores de el Thunder? El que tiene mejor gusto (lejos) es Collison https://twitter.com/okcthunder/status/830831476681953282 …,2017-02-12 16:03:07,830884964766011392
# Resultados # Durant lideró el triunfo contra su ex equipo los # Thunder http://bit.ly/2kgBxt8 pic.twitter.com/zq85AxA2Cq,2017-02-12 16:03:01,830884938316607488
SundayGlide w/ @ Juniorboys' (GLIDEgem!) 'Like A Child' ATM! @ Japanesehouse & 'Face Like Thunder' FOLLOWS! STREAM it out LOUD @ 993countyfm!pic.twitter.com/ux8Iym5W0X,2017-02-12 16:02:56,830884919874355200
Heat are interested in Ibaka? Dion & Serge back together? 2 of my favorite former Thunder players.,2017-02-12 16:02:54,830884910260944897
"Thunder why u gotta be extra, i'm trynna sleep // 12:11 am but clouds keep pouring the rain, i wouldn't mind virtual school LOOOOOOL",2017-02-12 16:02:51,830884898810556416
They really gave the Thunder a standing ovation after they lost by 20 just because they hate KD,2017-02-12 16:02:37,830884838567612416
Brady at the @ nsuwolves_mbb game last night. Took a selfie with @ NorthernStateU 's # Thunder # GoWolvespic.twitter.com/bqOpqcVarE,2017-02-12 16:02:22,830884778249437184
"nobody can stop him. It doesn't matter who he is facing, he is going to bring the thunder. He is unstoppable",2017-02-12 16:02:20,830884769567297536
MY CATS DO THIS MY DOG ONLY WHEN THERE IS THUNDER & LIGHTNING https://twitter.com/BarzFunnyJokes/status/830884304360243200 …,2017-02-12 16:01:57,830884671634411520
Thunder fans take heckling and trolling to new low versus Warriors http://www.goldenstateofmind.com/2017/2/12/14591082/nba-2017-oklahoma-city-thunder-fans-take-heckling-and-trolling-to-new-low-versus-warriors …pic.twitter.com/iNyFt0VwnA,2017-02-12 16:01:55,830884665145827328
"@ PATTI_THUNDER I don't know who you are, but I sure do agree with you!!!!!! Jon Wood",2017-02-12 16:01:49,830884640009441280
i'm so dumb but thunder is cute i love him pic.twitter.com/r9YlGbwrld,2017-02-12 16:01:32,830884566051209216
"Thunder Fans Threw Shade at KD, But the Warriors Destroyed the Thunder w/ @ jasonrubin91http://youtu.be/WBECXi-6420?a",2017-02-12 16:01:12,830884484782444544
¡Durant se exhibe ante el Thunder! # NBAenCOShttp://www.cableondasports.com/mas-deportes/durant-se-exhibe-ante-thunder-heat-cortan-racha-triunfal-celtics-brillan/?utm_content=sf55859673&utm_medium=spredfast&utm_source=twitter&utm_campaign=COS&sf55859673=1 …,2017-02-12 16:00:42,830884358068326404
"Hurricanes pick up two wins, Thunder down Homer Pelicans - Louisiana News http://rviv.ly/iBtTE",2017-02-12 16:00:41,830884354628915202
if you're a thunder fan it's real ironic that you say that,2017-02-12 16:00:07,830884208700649472
5:00pm Buffalo Thunder $30 NL Holdem Tournament $25 rebuy @ buffalothunder http://www.pokeratlas.com/poker-tournament/buffalo-thunder-santa-fe-30-500pm-nl-holdem-poker-tournament?topid=94906-2017-02-12 …,2017-02-12 16:00:04,830884196910460928
7D: 80 Splash: 45 Thunder: 40 SPC: 60,2017-02-12 16:00:03,830884195186667524
Have you played Thunder Cash this weekend to complete the puzzle? Hint: Complete the puzzle for bonus chips! pic.twitter.com/f8o3jAjXma,2017-02-12 16:00:02,830884189482393602
Kevin Durant Trolls Thunder Fans After Last Nights Win! http://www.12up.com/posts/4559048-video-kevin-durant-trolls-thunder-fans-after-warriors-win?a_aid=40726 …,2017-02-12 16:00:01,830884186886197253
Seems like every team making trades besides the thunders,2017-02-12 15:59:59,830884177868361728
Hoping that Warriors and thunder play in the playoffs,2017-02-12 15:59:53,830884151754620929
Rolling Thunder - A Marine's Vigil (Long Version) https://youtu.be/eefQSDrJ0x8 via @ YouTube,2017-02-12 15:59:39,830884091318956032
for no reason at all,2017-02-12 15:59:33,830884069005221891
She looks a little like Mr. Bluster in that pic. Can Thunder Cloud Warren be far behind?,2017-02-12 15:59:29,830884050621435904
"The four goal lead is back. James Henry puts the Thunder up, 5-1... No chance for Imoo there.",2017-02-12 15:59:18,830884006208139266
In the thunder and rain....,2017-02-12 15:59:16,830883995822985224
I liked a @ YouTube video from @nbareplaay http://youtu.be/bMQrVPLFIRA?a GSW vs Okc Thunder NBA Games Today 11.2.2017,2017-02-12 15:59:14,830883987396632581
The thunder caught the warriors during a bad stretch in the playoffs last season havin y'all think they were so able to beat them wit durant,2017-02-12 15:59:12,830883981063118848
I added a video to a @ YouTube playlist http://youtu.be/8vaKOBtzrIo?a WJNG - Arctic Thunder,2017-02-12 15:59:11,830883975359057922
Every single tweet from @ realDonaldTrump just reminds me of awesome @ RobertDowneyJr and Tropic Thunder # FullRetardpic.twitter.com/V47Ac8E28X,2017-02-12 15:59:06,830883955842883584
"Henry wrists one top shelf and the Thunder lead 5-1 at 4:19 of the second. Yes, the Thunder have five goals and we are not halfway into this",2017-02-12 15:58:49,830883882929098752
he's released some singles people need to be more pumped about the fact that it's GOING TO BE released,2017-02-12 15:58:13,830883732521439233
I liked a @ YouTube video from @ thunders7ruck http://youtu.be/s9YZhffpisQ?a Infinity Ward Bans Players From Dead Game?! Infinite Warfare,2017-02-12 15:58:09,830883717040050176
"""Be grateful for luck. Pay the thunder no mind—listen to the birds. And don't hate nobody."" Eubie Blake d 34y ago today",2017-02-12 15:58:09,830883714229891072
.. rolling thunder ..,2017-02-12 15:57:47,830883623117144064
# Resultados # Durant lideró el triunfo contra su ex equipo los # Thunder http://bit.ly/2kgBxt8 pic.twitter.com/ZUx1hc0C4w,2017-02-12 15:57:45,830883615882039297
Winning! # winning @ thunder_valley @Thunder Valley Casino Resort https://www.instagram.com/p/BQbP8ZyB2-T/,2017-02-12 15:57:24,830883524769046528
"Raise your words, not voice. It is rain that grows flowers, not thunder. - Rumi # quote",2017-02-12 15:57:19,830883507442434050
Thunderstorms likely to start the week in # WA and # NT. A few rumbles of thunder may make their way into the # Perth and # Darwin metros today.pic.twitter.com/ZUSLc3dW64,2017-02-12 15:57:04,830883444100050944
"You don't need that guy, it's so black and white. He's stealin' your thunder, baby, blue ain't your color",2017-02-12 15:56:56,830883411321614336
Kevin Durant takes blame as Thunder stunned by Timberwolves # OklahomaCityThunder https://goo.gl/fb/cMmqZq # oklahomacitythunder,2017-02-12 15:56:34,830883318229061632
PeeWee B: Rushmore Thunder PWB (5) at Yankton Miracle PWB (4) - FINAL https://goo.gl/zHx6nf,2017-02-12 15:56:19,830883253187907584
RT NBAWorldNewz: Russell Westbrook opens up about Kevin Durant's decision to leave the Thunder … pic.twitter.com/tWyuE2Ap8W,2017-02-12 15:56:14,830883233927725056
besides he's a nice guy I can't see him stealing thunder from Niall or Lou or Liam he loves the guys.,2017-02-12 15:55:36,830883075584303105
Best Service Control message in ages. No aggro - the gormless cretins could see I was marching down with a face like thunder and ran away. https://twitter.com/billyboii786/status/830871256278896641 …,2017-02-12 15:55:15,830882987260669953
Kevin Durants failed attempt last night to apologize to Westbrook and the Thunder has made things worse... @ okcthunder @ ESPNNBApic.twitter.com/eCoBRrTtpc,2017-02-12 15:55:00,830882921045118976
@ KDTrey5 now you gotta open a bakery and call Thunder Cakes!!,2017-02-12 15:54:50,830882879571759104
Bersa Thunder 380: Better Than PPK? http://snip.ly/54fmq,2017-02-12 15:54:21,830882761145671680
@ takeanotherpuff let's show them our fandom. We're def the snazziest Raptors/Thunder couple,2017-02-12 15:54:17,830882742242045953
hm wonder who took this photo p.s. the view was much better in person,2017-02-12 15:54:12,830882720117047296
The tiny human is sleeping. It sounds like there there's a lot of thunder in my house. # Naptime # snoringbaby,2017-02-12 15:54:05,830882692958998530
One Am Radio - Under Thunder And Gale (A Black And Blue Sky By Da http://dinamo.fm/ # nowplaying,2017-02-12 15:54:02,830882677402324992
"minivan, thunder dan and Giancarlo stan lets get it fish",2017-02-12 15:54:01,830882673216385024
So we gonna just forget the thunder blew a 3-1 lead come on people!,2017-02-12 15:53:34,830882562478317569
pic.twitter.com/d57SDaVugt,2017-02-12 15:53:31,830882547752132610
Police intervene to stop Thunder Fan (Big Rich) from heckling Draymond G... https://youtu.be/cSl4yZiuUTU via @ YouTube,2017-02-12 15:53:29,830882539791347714
"Celtics-Cavs, Thunder-Pacers, Lakers-Spurs will be made-up during the week. Dates and timesTBA",2017-02-12 15:53:24,830882518702444547
All of the hate from the OKC fans and the way the Thunder players acted just further vindicated Durant's decision to leave.,2017-02-12 15:53:22,830882511437852672
pic.twitter.com/fnMaIeng2d,2017-02-12 15:53:17,830882492018106368
If any politician later come talk sey Mr President don die I swear the kind thunder weu go strike am ehn... # pray4PMB,2017-02-12 15:53:14,830882477216522241
Aagaard centers to Wolfe in the high slot and he beats Imoo for the power-play goal. Thunder lead 4-0 at 1:10 of the second.,2017-02-12 15:53:08,830882453480939524
"Feb 10 Game Score: Novice House League - Blue Thunder Team 3 - 4, Novice House League - Penguins Team 4 - 5 http://tinyurl.com/jhpgan9",2017-02-12 15:52:45,830882354931650561
Now playing Konami - Thunder Cross - First Attack - [Rating: 0/5] http://www.spritelayerradio.com:8000,2017-02-12 15:52:26,830882276170989569
RT https://twitter.com/KissedByFate2/status/830880174208118784 … FIRE ALERT Rolling Thunder # Series @ pfiala It's BACK HOTTER Than Ever! # Bikers # Veter… http://ift.tt/1qfAcOS,2017-02-12 15:52:16,830882234198585346
"Feb 11 Game Score: Novice House League - Kings Team 2 - 4, Novice House League - Blue Thunder Team 3 - 2 http://tinyurl.com/hxykrbb",2017-02-12 15:52:15,830882228649476097
I need my Negan fix,2017-02-12 15:52:13,830882223477911554
Scott Brooks reacts to Kevin Durant being booed by OKC Thunder fans - CSN Mid-Atlantic (press release) (blog) http://dlvr.it/NMG2RR,2017-02-12 15:52:09,830882203756281861
Another first-minute penalty. Diamond sits for cross-checking and the Thunder have a power play 28 seconds into the period.,2017-02-12 15:51:50,830882126593654784
Me gusta mucho Thunder.,2017-02-12 15:51:37,830882071728029697
— babe you got a face like thunder pic.twitter.com/CLr79RnSL0,2017-02-12 15:51:37,830882069341421569
"– If you ride like lightning, you're gonna crash like thunder",2017-02-12 15:51:28,830882033886953473
"A combination of Saturday nights thunder storm, and Sundays day down by the Illovo river. Se maar niks van n LEKKER SUNTAN",2017-02-12 15:51:20,830882001850920960
Durant shoulda stayed on a thunder team that blew a 3-1 wcf lead? Thunder weren't guaranteed success if durant stayed,2017-02-12 15:51:19,830881994296815616
"Feb 12 Game Score: Novice House League - Rangers Team 1 - 3, Novice House League - Blue Thunder Team 3 - 2 http://tinyurl.com/he22xe6",2017-02-12 15:51:08,830881950244143104
I liked a @ YouTube video http://youtu.be/bxjiNuvMP98?a Krillin Plays: Outlast -14- Lighting and Thunder Thighs,2017-02-12 15:50:57,830881901632221185
I liked a @ YouTube video from @ phlydaily http://youtu.be/ANA2U9l89jA?a REVIVING TEAMMATES! - Medic in WAR THUNDER (War Thunder Tank,2017-02-12 15:50:44,830881850327445505
days of thunder is always a good movie choice,2017-02-12 15:50:44,830881847835971585
*jabbing @ Spanish_Wolf hard in the ribs* Seriously Luis your whisper is as loud as thunder. @ auroretrav2014 Marcel is going nowhere.pic.twitter.com/NWfxAYVd3Q,2017-02-12 15:50:34,830881807965048833
Thunder only happens when it's raining,2017-02-12 15:50:32,830881797898698752
Second period is underway. Thunder lead the Monarchs 3-0,2017-02-12 15:50:21,830881753338359808
@ Cam_ATL RUSSEL WESTBROOK scored 47 still not enough maybe thunder front OFFICE should trade cupcakes to the knicks LOL,2017-02-12 15:50:20,830881748510711812
Oklahoma City Thunder vs Golden State Warriors full 4th quarter (subs): http://youtu.be/U5Y4I4rdGXw?a via @ YouTube,2017-02-12 15:50:10,830881705728831488
pic.twitter.com/5LiCoZboRc,2017-02-12 15:50:07,830881692839768064
THUNDER GOD # MortalKombatpic.twitter.com/iol6fg6gNa,2017-02-12 15:49:57,830881649848152066
Lots of fun with our Storm King's Thunder # dnd game today. Call lightning FTW!pic.twitter.com/MfbOVn5bfP,2017-02-12 15:49:45,830881601655599105
Best Cinderella story : Thunder get the 8th seed and knock out the Warriors in the first round,2017-02-12 15:49:38,830881573733965824
Metallica - For Whom The Bell Tolls - 432Hz https://youtu.be/lIVgxFabzdE via @ YouTube for thunder and lighting,2017-02-12 15:49:38,830881570277978113
Thunder need to send the entire bench to pop for a day or two they'll play like superstars trust me,2017-02-12 15:49:26,830881522295058432
roger you still doing War Thunder today,2017-02-12 15:49:22,830881506755280901
Steph Curry played volleyball with a basketball during timeout vs. Thunder - SB Nation http://dlvr.it/NMG0Mt,2017-02-12 15:49:07,830881443861581824
Thunder,2017-02-12 15:49:06,830881437716934657
If any politician later come talk sey Mr President don die I swear the kind thunder weu go strike am ehn... # pray4PMB,2017-02-12 15:48:41,830881331479445505
stop feeding the trolls Evans,2017-02-12 15:48:35,830881307282518018
Scott Brooks reacts to Kevin Durant being booed by OKC Thunder fans # Wizards https://serve.fans/r/47ca746e2a pic.twitter.com/SdsfjtexAZ,2017-02-12 15:48:19,830881239758413824
