text,date,id
Section III Division II Wrestling Champions: Central Valley Academy Thunder! http://www.cnywrestling.com/iii/news/d2.pdf pic.twitter.com/JXOc5EQVgT,2017-02-12 01:42:02,830668267320725504
"(I've seen IRON GIANT a bunch, I've never seen ROLLING THUNDER.)",2017-02-12 18:59:52,830929444781117440
# joyvilla stole this girl ugly dress thunder. https://twitter.com/MdellW/status/830915558371495936 …,2017-02-12 18:59:39,830929392708808704
She got a smile like lightning and an ass like thunder,2017-02-12 18:59:34,830929371384922112
"dear God, can we please have Chocolate Thunder back, PLEASE!!! We will give you Fred Hoiberg in return.... # BullsNation",2017-02-12 18:59:33,830929367115190272
Russell Westbrook and Kevin Durant were seen at the same restaurant after the Warriors win over the Thunder.http://www.foxsports.com/nba/story/kevin-durant-russell-westbrook-reportedly-eat-at-same-okc-restaurant-after-game-021217 …,2017-02-12 18:58:58,830929220956151808
"""The Thunder would be a 30-win team without Westbrook. He's the MVP."" The Nets wouldn't have a win if not for Lopez. Doesn't make him MVP.",2017-02-12 18:58:55,830929205424713728
Everyone hates KD for leaving the thunder when Bron did the same thing to the Cavs and y'all will pretend like it never happened,2017-02-12 18:58:53,830929196964777985
Only thing I don't like abt McCarthy's Sean Spicer is that it steals thunder from my most magnificent tweet ever: https://twitter.com/jsundmanus/status/823000355793420288 …,2017-02-12 18:58:44,830929162353393665
Why is the thunder so loud at night. # latenightthoughts,2017-02-12 18:58:44,830929160826658818
Thunder losing to the wizards tomorrow too.,2017-02-12 18:58:36,830929125552640000
"A Hitmonchan appeared. It has: Rock Smash, Thunder Punch, and an IV of 35.6%. Despawn at 06:20:19pm (21m 51s). http://maps.google.com/maps?q=30.523584262708916,-97.6587529371889 …",2017-02-12 18:58:27,830929091465531392
'No moral victories' for Thunder as they fall short against Warriors # OKCThunder # KevinDurant # KevinDurant http://dlvr.it/NMJYhS,2017-02-12 18:58:26,830929084527960064
"silent like lightning, mind loud like thunder",2017-02-12 18:58:19,830929057885933569
我が名は Thunder 。 特徴 安定 https://twitter.com/weather_aruaru/status/320851714733375488/photo/1pic.twitter.com/L0EcGDXUjv,2017-02-12 18:58:12,830929028097810432
Thunder?,2017-02-12 18:58:11,830929023798697985
Damn I haven't heard thunder in a long ass time lol,2017-02-12 18:58:08,830929011442331648
Que incidente Pobresito pero ... que podria jacer para un dibujo me han encantado tus videos me volvere activo en tu canal,2017-02-12 18:58:06,830929002554654722
I love thunder,2017-02-12 18:58:03,830928988260487168
Olppp nvm just heard thunder lmao,2017-02-12 18:58:02,830928985433501696
ヤバい曲を三曲を一曲に閉じ込めました 当然なにも起こらないはずもなく・・・Sea Grapes×FutureCandy×Ma Chouchoute(3song Mashup) by Thunder_Pudding https://soundcloud.com/hunder_udding/sea-grapesfuturecandyma-chouchoute3song-mashup …,2017-02-12 18:57:51,830928939627319296
That is so messed up its hilarious # ERedCarpet # GRAMMYs Carrie loves to steal Faith's thunder! https://twitter.com/thejuanstar/status/830928110405181440 …,2017-02-12 18:57:23,830928821201358848
I liked a @ YouTube video http://youtu.be/jCel4E46vr8?a WESTBROOK DROPS 50 ON DURANT’S HEAD!!! THUNDER vs WARRIORS HIGHLIGHTS + POSTGAME,2017-02-12 18:57:21,830928811734745090
It's currently Light Rain with Thunder and 76F outside.,2017-02-12 18:57:11,830928771838521344
"@ russwest44 ""cupcake"" ain't want none of the problems you brought him last night! Keep fighting and putting in that work Brodie! Thunder Up!",2017-02-12 18:56:58,830928714187862017
What are the things that put the guy from Grise Fiord and Thunder Bay on the same team? People are risking their lives to join that team.,2017-02-12 18:56:51,830928686647955456
I liked a @ YouTube video http://youtu.be/jCel4E46vr8?a WESTBROOK DROPS 50 ON DURANT’S HEAD!!! THUNDER vs WARRIORS HIGHLIGHTS + POSTGAME,2017-02-12 18:56:29,830928594297839616
“Did it ever occur to you that maybe I can’t be saved?” - @ scarredheart (via thunder-storm) https://tmblr.co/Zx9apg2INvS7n,2017-02-12 18:56:24,830928573242470400
THUNDER LIGHTING,2017-02-12 18:56:15,830928534252244992
He añadido un vídeo a una lista de reproducción de @ YouTube (http://youtu.be/6XcSpkqm-yg?a - Jugando War Thunder - No dejemos que Berlín,2017-02-12 18:56:14,830928531165237248
Have you heard ‘With the thunder drum’ by Kelia Long Evans on # SoundCloud? # np https://soundcloud.com/kelia-long-evans/with-the-thunder-drum?utm_source=soundcloud&utm_campaign=share&utm_medium=twitter …,2017-02-12 18:56:03,830928483916333056
"Feb 11 Game Score: Regional - U14 - 6, Paris Thunder - 6 http://tinyurl.com/j86ensl",2017-02-12 18:56:02,830928480208564228
"Feb 12 Game Score: U14 Duncanson - 4, Paris Thunder - 8 http://tinyurl.com/hsjzfk2",2017-02-12 18:55:35,830928367037927424
"The tourney was in Melbourne FL. DB South Florida is essentially Boca Thunder and. ECU team was host/ is from Rockledge, FL",2017-02-12 18:55:22,830928312843268096
Drinking a Give Me Stout Or Give Me Death by @ StoneBrewingCo/ @ ardentcraftales @The Thunder Dome — http://untp.beer/s/c416937334,2017-02-12 18:55:21,830928308783153152
"Thunder, sleet, snow later? It's February?",2017-02-12 18:55:12,830928273152569345
"After all KD did for the Thunder, this is what he get from y'all fans, seriously? http://fb.me/7wCzrH1D2",2017-02-12 18:55:04,830928237794439169
http://ift.tt/2kQenZI # Shoes Pony Daryl Dawkins 76ers USA Basketball Shoe Choc Thunder #53 MB007WNR SZ 13,2017-02-12 18:55:00,830928222544072704
thunder is such a great song https://twitter.com/layshands/status/830858086273388547 …,2017-02-12 18:54:56,830928205326344192
Indeed but what makes it the best is the lightning and thunder https://twitter.com/pixeIposts/status/830576761884856321 …,2017-02-12 18:54:53,830928190893854721
"(we ARE quoting tropic thunder, right?)",2017-02-12 18:54:49,830928174473179136
"Pikachu 100% (15/15/15) thunder shock fast/thunderbolt) till 16:23:43 (29m 4s) https://maps.google.com/maps?q=33.89535781518898,-117.84547506428308 …",2017-02-12 18:54:39,830928133427650561
"Hitmonchan 60% (11/4/12) rock smash fast/thunder punch) till 17:55:21 (50s) https://maps.google.com/maps?q=32.754625,-97.331794 …",2017-02-12 18:54:31,830928098178846721
Week 3 scores Pasta Sauce 51 Logplitters 56 Dream Chasers 70 Blue Waffles 75 Tropic Thunder 49 The Brothers 71,2017-02-12 18:54:26,830928078755004416
Where do i go to apply to be a Thunder fan if we lose Jimmy,2017-02-12 18:54:23,830928065702268928
Tropic Thunder is a classic movie....this is not for debate,2017-02-12 18:54:21,830928056902619136
Best thing that has happened in sports this year is KD beating the Thunder in OKC! # FuckOKC,2017-02-12 18:54:07,830928000606576641
Me gustó un video de @ YouTube http://youtu.be/xFLUsGjDbic?a COMO DESCARGAR FREE SCREEN VIDEO RECORDER WINDOWS 10 Y OTRO BY THUNDER RECORDS,2017-02-12 18:53:36,830927868905549827
"Thunder Family, what a great opportunity to support the Bank that supports you and have a chance to win $1000!!!!... http://fb.me/51V8LX6tL",2017-02-12 18:53:28,830927834344353793
"welcome to OKC, we have the Thunder, and that's it.",2017-02-12 18:53:20,830927800676790272
2009-10 Panini #229 Desmond Mason Oklahoma City Thunder (2165) http://dlvr.it/NMJW8D pic.twitter.com/1YuUCWeJmU,2017-02-12 18:53:19,830927797077962752
"well, another alt-righter with fragile feelings. Was also a Thunder fan. Homophobe and hater of vets. Was pretty fun to troll pic.twitter.com/ZhpNhJaU5o",2017-02-12 18:53:02,830927728308203520
@ WRAL Hearing some thunder here in Siler City along with the rain.,2017-02-12 18:52:58,830927710868426753
my dog barks at the thunder thinking it is actually attacking our house.. ma baarif ma3 shou aayshe ana,2017-02-12 18:52:40,830927633307299840
Watching Superbrawl II. Kickoff match was Flyin' Brian Pillman vs Jushin Thunder Liger. Awesome match! # VintageWCW,2017-02-12 18:52:36,830927616353955846
Thunder set franchise record with 10 goals in win over Monarchs http://518sports.com/thunder-set-franchise-record-10-goals-in-win-over-monarchs/ …,2017-02-12 18:52:29,830927585844551683
Bchilll sof l car on a cliff rn w etfaraj 3l thunder going into the seee,2017-02-12 18:52:19,830927547990999046
# OKCThunder # ThunderUp # WeAreThunder Thunder fan denies Draymond Green's description o.. http://dld.bz/fywF4 pic.twitter.com/5qW3o2uWjV,2017-02-12 18:52:06,830927492445790208
Me ha gustado un vídeo de @ YouTube (http://youtu.be/qUAA-AiM2H8?a - 170212 EXO Sehun Thunder Playboy DIT DT Lucky TL GF Growl in Hong,2017-02-12 18:51:56,830927450737631233
# NowPlaying | Eskimeaux - The Thunder Answered Back ( tune in here -> http://95eh.ca/radio#mountain-town-radio … ),2017-02-12 18:51:53,830927437626228736
Golden State Warriors vs Oklahoma City Thunder: NBA live scores # KevinDurant https://goo.gl/fb/5d6iyj # kevindurant,2017-02-12 18:51:43,830927396819853313
"Thunder is impressive, but it is lightning that does the work. - Mark Twain # ALDUBxDTBYFTBukasNa",2017-02-12 18:51:36,830927366499098625
http://ift.tt/2kQenZI Pony Daryl Dawkins 76ers USA Basketball Shoe Choc Thunder #53 MB007WNR SZ 13,2017-02-12 18:51:36,830927365345800195
Chocolate Thunder # delicia # outback # brownie # cm # mô # ilmioamore # chocolatethunder… https://www.instagram.com/p/BQbj3jcASdx/,2017-02-12 18:51:31,830927345238339584
Thunder-Warriors draws big TV audience http://www.chatsports.com/oklahoma-city-thunder/a/source/thunder-warriors-draws-big-tv-audience-13256608 … via @ chatsports # ThunderUp,2017-02-12 18:51:28,830927331728437249
hmm I remember a v slippery 2009 rattlesnake point... had to wait out thunder and lighting in the car!,2017-02-12 18:51:04,830927232973565952
lead us to the promise land thunder God. # Metsfantillidie,2017-02-12 18:50:37,830927119702167552
I love rain and thunder.,2017-02-12 18:50:37,830927117055557632
REGGAE PARTY の出演者メンツで又やりたいな〜 かなり熱い夜やった THUNDERくんと @ TWO_STAGE0506pic.twitter.com/5xj91uz2Qt,2017-02-12 18:50:20,830927046180171776
02-12 Reports: Warriors Significant Favorites To Sign # KevinDurant If He Leaves Thunder # KevinDurant http://dlvr.it/NMJSdQ,2017-02-12 18:50:18,830927036654825472
Maybe thunder is scared of us,2017-02-12 18:50:09,830927001217355777
"San Jose trends now: Durant, Kevin Durant, Thunder, Gonzaga, Al Jarreau. http://toplocalnow.com/us/san-jose/topics …",2017-02-12 18:50:05,830926983378792448
"San Francisco trends now: Warriors, Durant, Thunder, Gonzaga, Chinese New Year. http://toplocalnow.com/us/san-francisco/topics …",2017-02-12 18:50:03,830926973748736000
Lakers Broadcaster Mychal Thompson Trolls Thunder Fans After Warriors Win... # Lakers https://serve.fans/r/91072dd5e3 pic.twitter.com/AAKtVvTf7e,2017-02-12 18:49:56,830926944208199680
"Thunder offered, he left for a mil. more. Wanted to be the man.. was never going to happen.",2017-02-12 18:49:50,830926922968358913
"#25 Pikachu (Quick Attack/Thunder 15/14/12 - 91.11%) 455 Templemead Dr L8W 3K6, 07:17:52pm (28m 11s left) http://maps.google.com/maps?q=43.19362902750177,-79.84398597712585 …",2017-02-12 18:49:43,830926889661390848
"imagine if KD, Westbrook, James Harden, and Ibaka all still played for the Thunder. if only they knew then what they know now.",2017-02-12 18:49:42,830926889300721664
"NBA GAME RECAP: WARRIORS 130, THUNDER 114 - http://NBA.com http://dlvr.it/NMJQqp",2017-02-12 18:49:18,830926787681067012
Más veces con ventaja de 20+ Pts al MT esta temporada en # nba 10 Warriors << 4 Rockets 4 Clippers 4 Wolves >>Lideran por 23 Pts vs Thunder,2017-02-12 18:49:13,830926764276850688
Thunder fans ready with salty anti-Durant shirts. http://rssfeeds.usatoday.com/~/269852572/0/usatodaycomnba-topstories~Thunder-fans-ready-with-salty-antiDurant-shirts/ …,2017-02-12 18:48:54,830926685449109506
Thunder always seems powerful until the hurricane hits,2017-02-12 18:48:40,830926628566003713
Lakers Broadcaster Mychal Thompson Trolls Thunder Fans After Warriors Win... # Lakers https://serve.fans/r/91072dd5e3 pic.twitter.com/5HTte2r0B0,2017-02-12 18:48:34,830926601311371264
elak de l'âge de thunder il a 14 jours,2017-02-12 18:48:29,830926581560385537
Thunder and lightning on February 12th? That's odd.,2017-02-12 18:48:27,830926574476201984
The thunder storm was so loud and scary for one minute pic.twitter.com/TrgwZVKdWd,2017-02-12 18:48:08,830926492695683072
Thunder RC Sunday Onroad 02-12-2017: http://youtu.be/0EVVEfrm3DA?a via @ YouTube,2017-02-12 18:48:05,830926480221822976
c'est vrai qu'il aurait jamais gagner de titre avec le Thunder et je suis d'accord que les américain sont super prétentieux lool,2017-02-12 18:48:03,830926470822244352
"but Durant is so good that the Thunder are still over .500, and the Warriors are doing worse than last season",2017-02-12 18:47:57,830926447174938625
#3: Russell Westbrook Oklahoma City Thunder Adidas Orange Alternate Shirt: Russell Westbrook… https://goo.gl/fb/u5irrt # Sports # Equipment,2017-02-12 18:47:53,830926429969854465
@ WPXIScott little bit of thunder and lightning in Ellwood,2017-02-12 18:47:30,830926334809481217
"don't let us steal your thunder. Be you, you've earned it in Twitter today and the team has as well!!!",2017-02-12 18:47:13,830926261031546880
@ Ray_WTAE just heard a big rumble of thunder in Ellwood city.,2017-02-12 18:47:11,830926255402938368
I think one of the coolest things I've watched is a thunder storm from above the clouds in a plane,2017-02-12 18:46:47,830926155150614528
Loud thunder heavy rain; thin line 'tween joy and pain.,2017-02-12 18:46:32,830926092424867840
Days or just a couple hours of Thunder. I'm not a meteorologist # MoviesWithOptions,2017-02-12 18:46:18,830926032282619905
This has been quite the come down after watching Steph and Durant drop 130 on the Thunder last night.,2017-02-12 18:46:10,830925999697195009
"Electabuzz 56% (11/14/0) low kick fast/thunder punch) till 16:41:33 (55m 29s) https://maps.google.com/maps?q=33.59876334029276,-117.88860241314727 …",2017-02-12 18:46:04,830925971301601280
# NEWS 'It's part of the game': Durant clashes with Westbrook on return to Thunder http://viid.me/qzhDoc # RTpic.twitter.com/9Yyn57o1x2,2017-02-12 18:45:56,830925938812604417
02-12 NBA Trade Rumors: Oklahoma City Thunder Open To Parting With Kevin Durant? New York Knicks Interested… https://goo.gl/fb/qRVbAh,2017-02-12 18:45:55,830925935713124352
LMFAO! A Tour of My Yard During a Fucking Thunder Storm https://youtu.be/MCiRMtl_GtU via @ YouTube,2017-02-12 18:45:50,830925916054364161
"Feb 12 Game Score: BTM - Lightning - 0, Caledonia Thunder 1 - 8 http://tinyurl.com/gldxz6d",2017-02-12 18:45:34,830925847599136769
Now. Let's try and build on this win as the # Knicks will play against the Thunder Wednesday night in Oklahoma City.,2017-02-12 18:45:24,830925805547040775
"I liked a @ YouTube video from @ icebohica http://youtu.be/pPSSVP_Nojo?a War Thunder - Type 3 Chi-Nu II ""Wait! You get Paid?""",2017-02-12 18:45:22,830925796076355584
"Thunder Bay DFC student check in, some are succeeding, others can’t get over being homesick | by @ WillowBlasizzohttp://aptnnews.ca/2017/02/10/thunder-bay-dfc-student-check-in-some-are-succeeding-others-cant-get-over-being-homesick/ …",2017-02-12 18:44:59,830925701503127553
She called el gzz chocolate thunder,2017-02-12 18:44:53,830925674508644352
when the thunder were elite,2017-02-12 18:44:52,830925670091988992
when the entire thunder hockey team comes in to your work and you look like complete trash >>>>>,2017-02-12 18:44:49,830925657085460480
Check out Funko Pop - Mega Man Thunder Beam 2016 Toy Tokyo NYCC Exclusive W Protector https://www.ebay.com/itm/192103735230 … @ eBay,2017-02-12 18:44:43,830925633962262534
We are going up! I just guided Thunder LFC to 2nd place in Non-League C http://www.football-chairman.com [Free Edition],2017-02-12 18:44:36,830925603440193536
Boos show unappreciation for Kevin Durant’s time in OKC # nba @ bluemanhoop: The Oklahoma City Thunder fans booing… http://dlvr.it/NMJPjg,2017-02-12 18:44:32,830925589301202944
a thunder fan but got mad respect for the spurs and kawhi is a beast,2017-02-12 18:44:30,830925577448202246
thanks,2017-02-12 18:44:14,830925510993727490
demek ki,2017-02-12 18:44:01,830925458267070465
"Neal and I were making jokes about my thighs earlier and calling them thunder thighs, guess what joke I made when I got these pants?",2017-02-12 18:43:58,830925444207636480
War on the Floor 12 U D3 Champions: Liberty Thunder pic.twitter.com/sCftZ888Hu,2017-02-12 18:43:56,830925434791538689
so true. KD was treated WELL under the circumstances. I have no ties to the Thunder and seeing KD in a GS uni was hard to watch.,2017-02-12 18:43:26,830925308354256898
Didn't tweet about it last night but that OKC vs Warriors game made for great theater but # thunder are severely overmatched,2017-02-12 18:43:20,830925283930816513
มีความลุ้นไปกับมันทุกวัน # Thunder Morning วันทำงาน,2017-02-12 18:43:18,830925275307216897
"# MoviesWithOptions Days of Thunder. Or the Locusts. Thunder should scare the locusts away, so, thunder it is.",2017-02-12 18:43:15,830925263064145920
It's so black and white he's stealing your thunder,2017-02-12 18:43:10,830925244613410820
"Everybody & they mom was in ratchet ass rolling thunder , never going there again",2017-02-12 18:43:04,830925216192856064
Thunder snow.... imagine that https://twitter.com/205mph/status/830923140951797760 …,2017-02-12 18:42:55,830925178959835137
# Resultados # Durant lideró el triunfo contra su ex equipo los # Thunder http://bit.ly/2kgBxt8 pic.twitter.com/ZUx1hc0C4w,2017-02-12 18:42:24,830925051725750272
Anjir hari senin... ♫ Got Some Rock & Roll Thunder by AC/DC — https://path.com/p/2i9ZjB,2017-02-12 18:42:19,830925028283736064
morning,2017-02-12 18:42:13,830925006087467008
Lakers Broadcaster Mychal Thompson Trolls Thunder Fans After Warriors Win In OKC http://dlvr.it/NMJNLC pic.twitter.com/T3AyZmKo7h,2017-02-12 18:42:08,830924983345901569
Lakers Broadcaster Mychal Thompson Trolls Thunder Fans After Warriors Win In OKC http://dlvr.it/NMJN7W pic.twitter.com/pjYt5iQid0,2017-02-12 18:42:05,830924970872098816
I liked a @ YouTube video http://youtu.be/GDOUjMEte2c?a [LIVE STREAM] - War Thunder #19 12/02/2017,2017-02-12 18:42:01,830924953063145475
The Warriors and Thunder Game Needs Come on again so I can watch it,2017-02-12 18:41:53,830924921308082178
KD’s return only makes it hurt more for Thunder (Yahoo Sports) http://beitrag.news4sport.de/?p=690929,2017-02-12 18:41:43,830924877666324480
You and @ jeremiepoplin still glazing each other over Thunder fans being passionate?,2017-02-12 18:41:39,830924860503257088
Thunderstorm and Rain Sounds - Heavy Thunder & lightning Strike Ambien... https://youtu.be/5fNLEPrNi2A via @ YouTube,2017-02-12 18:41:34,830924841624690688
why is it the okc thunder but they mascot is like a mf yak?,2017-02-12 18:41:21,830924785173532674
The rain and thunder in beirut rn,2017-02-12 18:41:20,830924780870258689
PKTAは分かるのにPKTって文字を見て「そういえばサンダーってThunderだったわ」って気づくのに10秒,2017-02-12 18:41:17,830924769834913792
Sings Ted's *thunder buddy song*,2017-02-12 18:40:33,830924583507226624
"vishhh, um truck thunder 149mm seria meu sonho",2017-02-12 18:40:27,830924559943622656
Ok dlm exordium ade thunder. Omg dpt tgk ni lgi yasssss,2017-02-12 18:39:56,830924428418510848
Found a pic I snapped back in 2014. Prophetic in retrospect. KD turns his back. Russ puts the Thunder on his back. pic.twitter.com/HHrEQHVDk7,2017-02-12 18:39:50,830924403177320450
@ TylerCalver we have thunder and lightning in Palmerston!,2017-02-12 18:39:46,830924387570348032
"s Y entertain someone's rage & sooo called thunder,i laugh @ that,silence has always been a ""Deadly Killer"" # Blinh",2017-02-12 18:39:35,830924342871650305
I will admit this. I played way too much War Thunder in life.,2017-02-12 18:39:27,830924306129444864
"Rain Sounds, Ocean Waves and Distant Thunders – 4k Ultra Hd – Relaxing S... https://youtu.be/cO_IFJaWmhA via @ YouTube",2017-02-12 18:39:08,830924227469574144
"Los Angeles trends now: Grammys, Chase Utley, Thunder, Valentine's Day, Prince. http://toplocalnow.com/us/los-angeles/topics …",2017-02-12 18:39:04,830924210629271552
Warriors Thunder Matchup # kd # westbrook # durant # cupcake # nbahttp://youtu.be/E-pY-vGnmsE?a,2017-02-12 18:39:01,830924198717571076
Update on the current weather situation: Blizzard with (I kid you not) thunder and lightning,2017-02-12 18:38:55,830924173065191426
Cry me a river Oklahoma City Thunder fans http://www.mylot.com/post/3032212/cry-me-a-river-oklahoma-city-thunder-fans … Cry me a Chagres River Oklahoma City Thunder fans.,2017-02-12 18:38:52,830924160377487360
The thunder that will strike this cameraman. Take the view to another HM # BBNaija,2017-02-12 18:38:50,830924151753945088
@ TheLoopyBlogger thunder next we coming # BullyUp,2017-02-12 18:38:25,830924046338514946
bulletsforever .com >> Wizards vs. Thunder preview: Washington seeks third straight win with OKC in town http://buzztap.com/-2EnOiD,2017-02-12 18:37:48,830923893573550081
"Downpours pushing over US-64 in Randolph Co shortly. Rain really coming down, could hear some thunder as well. # TriadWx # ncwxpic.twitter.com/WkojFdxgdE",2017-02-12 18:37:46,830923882471239680
# MoviesWithOptions Days or Nights of Thunder,2017-02-12 18:37:28,830923807640666112
OMG! Thunder AND the small of rain..... this is awesome!,2017-02-12 18:37:01,830923695942012928
@ JackSatzinger explained this to me. They call Kevin Durant a cupcake because he left the Thunder to join the Warriors so he's soft,2017-02-12 18:36:50,830923649053913088
# MoviesWithOptions Days of Thunder or Lightning,2017-02-12 18:36:49,830923646579384320
oooooo I didn't consider that mob might be scared of the thunder and lightning...Mogami getting mob to calm down enough...,2017-02-12 18:36:47,830923635477065734
I added a video to a @ YouTube playlist http://youtu.be/E-pY-vGnmsE?a Kd's return - Warriors - Thunder Highlights (2/11/17),2017-02-12 18:36:46,830923631043690498
お願い,2017-02-12 18:36:43,830923620637564928
Check out Dimensions Gold Collection THUNDER RIDGE Counted Cross Stitch Kit Running Horses http://www.ebay.com/itm/Dimensions-Gold-Collection-THUNDER-RIDGE-Counted-Cross-Stitch-Kit-Running-Horses-/192078386771?roken=cUgayN&soutkn=q0CTzb … via @ eBay,2017-02-12 18:36:36,830923591663419393
THUNDERS over her head back near dark mouth twitch up stamps mark e smith The car straws the helicopter sweeps across the,2017-02-12 18:36:36,830923589834637312
Thunder fans made ridiculous “KowarD” t-shirts for Kevin Durant’s return (VIDEO). These Folks Are Getting UNRULY!!! https://www.yahoo.com/sports/m/00d2084e-60a8-30fb-b4de-44c5cb6482f0/thunder-fans-made-ridiculous.html?.tsrc=fauxdal …,2017-02-12 18:36:19,830923518871207937
"""Lightning and thunder mightily call For the rains which immediately fall"" (two lines from one of my poems)",2017-02-12 18:36:16,830923507210915840
I was BBQ'in and I seen lightning in seaforth as well i ducked the thunder caught me off guard,2017-02-12 18:36:13,830923493944487936
* raindrops keeps hitting jokers face in thunder while hear kitty yelling * i guess even clowns get depress after everything +,2017-02-12 18:36:12,830923492023533570
# Tucson are you heading the thunder growling. More rain on the rain to nourish our Sonoran Desert,2017-02-12 18:35:55,830923417473806336
Rain...with a side order of thunder.,2017-02-12 18:35:32,830923322082762752
"02-12 Stephen Curry leads Warriors to victory over # KevinDurant, Russell Westbrook and Thunder, 116-108 # KevinDuranthttp://dlvr.it/NMJJKD",2017-02-12 18:35:17,830923260803981312
# WeLoveLA # Lakers Phoenix Suns Tickets Suns vs Los Angeles Lakers Hornets Thunder Celtic http://srhlink.com/NMJJ58 # SportsRoadhouse,2017-02-12 18:35:12,830923237227835393
@ KDTrey5 I may be a Thunder fan at heart but I still appreciate all you did for us in your time here and still have respect for you. # ThankU,2017-02-12 18:35:10,830923230101766145
"Oklahoma City trends now: Durant, Thunder, Kevin Durant, Warriors, Peake. http://toplocalnow.com/us/oklahoma-city/topics …",2017-02-12 18:35:03,830923200347283457
Thunder Hawk,2017-02-12 18:34:59,830923185348558848
i hear thunder pic.twitter.com/gRfsmHuvPp,2017-02-12 18:34:51,830923152267972608
"I liked a @ YouTube video from @ dawkinsmta http://youtu.be/hIVxXZJDSUI?a Stephen Curry Full Highlights 2017.02.11 at Thunder - 26 Pts, 9",2017-02-12 18:34:34,830923079719215104
I liked a @ YouTube video http://youtu.be/jCel4E46vr8?a WESTBROOK DROPS 50 ON DURANT’S HEAD!!! THUNDER vs WARRIORS HIGHLIGHTS + POSTGAME,2017-02-12 18:34:33,830923075654926337
@ M_May95 @ dannybattle @ Amish_Thunder @theantibyon I don't have words for this. https://twitter.com/ubercheiseafc/status/830918096483385348 …,2017-02-12 18:34:32,830923069090832384
"My mentions want thunder/lighting, I guess. https://twitter.com/omarmendez94/status/830920934269739008 …",2017-02-12 18:34:30,830923061893427201
Bro I just wanna drink a cold one at Country Thunder,2017-02-12 18:34:28,830923054113050630
Partido del morbo!-Golden State Warriors vs Oklahoma City Thunder - Full Highlights | Feb 1... https://youtu.be/9VMQjUMzztY vía @ YouTube,2017-02-12 18:34:21,830923024807370752
"We didn't know how thunder, lightning, tides, eclipses, earthquakes, volancoes happened either.",2017-02-12 18:33:54,830922910269214724
