text,date,id
"NBA maçları hangi kanalda? Golden State Warriors, Oklahoma City Thunder # beyazfutbolsorar # ŞuanKalbimdenSöylüyorum http://www.sporzone.com/nba-maclari-hangi-kanalda-31-ekim-2016.html …",2016-10-30 18:32:36,792856759165673478
"NBA maçları hangi kanalda? Golden State Warriors, Oklahoma City Thunder # beyazfutbolsorar # ŞuanKalbimdenSöylüyorum http://www.sporzone.com/nba-maclari-hangi-kanalda-31-ekim-2016.html …",2016-10-30 18:32:36,792856759115345920
"NBA maçları hangi kanalda? Golden State Warriors, Oklahoma City Thunder # beyazfutbolsorar # ŞuanKalbimdenSöylüyorum http://www.sporzone.com/nba-maclari-hangi-kanalda-31-ekim-2016.html …",2016-10-30 18:32:36,792856759102803968
"NBA maçları hangi kanalda? Golden State Warriors, Oklahoma City Thunder # beyazfutbolsorar # ŞuanKalbimdenSöylüyorum http://www.sporzone.com/nba-maclari-hangi-kanalda-31-ekim-2016.html …",2016-10-30 18:32:36,792856759098540032
"NBA maçları hangi kanalda? Golden State Warriors, Oklahoma City Thunder # beyazfutbolsorar # ŞuanKalbimdenSöylüyorum http://www.sporzone.com/nba-maclari-hangi-kanalda-31-ekim-2016.html …",2016-10-30 18:32:36,792856759094444032
"NBA maçları hangi kanalda? Golden State Warriors, Oklahoma City Thunder # beyazfutbolsorar # ŞuanKalbimdenSöylüyorum http://www.sporzone.com/nba-maclari-hangi-kanalda-31-ekim-2016.html …",2016-10-30 18:32:36,792856759094345729
"NBA maçları hangi kanalda? Golden State Warriors, Oklahoma City Thunder # beyazfutbolsorar # ŞuanKalbimdenSöylüyorum http://www.sporzone.com/nba-maclari-hangi-kanalda-31-ekim-2016.html …",2016-10-30 18:32:36,792856759085981696
"NBA maçları hangi kanalda? Golden State Warriors, Oklahoma City Thunder # beyazfutbolsorar # ŞuanKalbimdenSöylüyorum http://www.sporzone.com/nba-maclari-hangi-kanalda-31-ekim-2016.html …",2016-10-30 18:32:36,792856759081832449
"NBA maçları hangi kanalda? Golden State Warriors, Oklahoma City Thunder # beyazfutbolsorar # ŞuanKalbimdenSöylüyorum http://www.sporzone.com/nba-maclari-hangi-kanalda-31-ekim-2016.html …",2016-10-30 18:32:36,792856759081832448
"NBA maçları hangi kanalda? Golden State Warriors, Oklahoma City Thunder # beyazfutbolsorar # ŞuanKalbimdenSöylüyorum http://www.sporzone.com/nba-maclari-hangi-kanalda-31-ekim-2016.html …",2016-10-30 18:32:36,792856759077629954
"NBA maçları hangi kanalda? Golden State Warriors, Oklahoma City Thunder # beyazfutbolsorar # ŞuanKalbimdenSöylüyorum http://www.sporzone.com/nba-maclari-hangi-kanalda-31-ekim-2016.html …",2016-10-30 18:32:36,792856759073443840
"NBA maçları hangi kanalda? Golden State Warriors, Oklahoma City Thunder # beyazfutbolsorar # ŞuanKalbimdenSöylüyorum http://www.sporzone.com/nba-maclari-hangi-kanalda-31-ekim-2016.html …",2016-10-30 18:32:36,792856759064989696
"NBA maçları hangi kanalda? Golden State Warriors, Oklahoma City Thunder # beyazfutbolsorar # ŞuanKalbimdenSöylüyorum http://www.sporzone.com/nba-maclari-hangi-kanalda-31-ekim-2016.html …",2016-10-30 18:32:36,792856759060860932
"NBA maçları hangi kanalda? Golden State Warriors, Oklahoma City Thunder # beyazfutbolsorar # ŞuanKalbimdenSöylüyorum http://www.sporzone.com/nba-maclari-hangi-kanalda-31-ekim-2016.html …",2016-10-30 18:32:36,792856759052406788
"NBA maçları hangi kanalda? Golden State Warriors, Oklahoma City Thunder # beyazfutbolsorar # ŞuanKalbimdenSöylüyorum http://www.sporzone.com/nba-maclari-hangi-kanalda-31-ekim-2016.html …",2016-10-30 18:32:36,792856759048269824
"NBA maçları hangi kanalda? Golden State Warriors, Oklahoma City Thunder # beyazfutbolsorar # ŞuanKalbimdenSöylüyorum http://www.sporzone.com/nba-maclari-hangi-kanalda-31-ekim-2016.html …",2016-10-30 18:32:36,792856759048237056
"NBA maçları hangi kanalda? Golden State Warriors, Oklahoma City Thunder # beyazfutbolsorar # ŞuanKalbimdenSöylüyorum http://www.sporzone.com/nba-maclari-hangi-kanalda-31-ekim-2016.html …",2016-10-30 18:32:36,792856759035650048
"NBA maçları hangi kanalda? Golden State Warriors, Oklahoma City Thunder # beyazfutbolsorar # ŞuanKalbimdenSöylüyorum http://www.sporzone.com/nba-maclari-hangi-kanalda-31-ekim-2016.html …",2016-10-30 18:32:36,792856759031463938
"NBA maçları hangi kanalda? Golden State Warriors, Oklahoma City Thunder # beyazfutbolsorar # ŞuanKalbimdenSöylüyorum http://www.sporzone.com/nba-maclari-hangi-kanalda-31-ekim-2016.html …",2016-10-30 18:32:36,792856759027326977
"NBA maçları hangi kanalda? Golden State Warriors, Oklahoma City Thunder # beyazfutbolsorar # ŞuanKalbimdenSöylüyorum http://www.sporzone.com/nba-maclari-hangi-kanalda-31-ekim-2016.html …",2016-10-30 18:32:36,792856759018856448
"NBA maçları hangi kanalda? Golden State Warriors, Oklahoma City Thunder # beyazfutbolsorar # ŞuanKalbimdenSöylüyorum http://www.sporzone.com/nba-maclari-hangi-kanalda-31-ekim-2016.html …",2016-10-30 18:32:36,792856758960156672
Is this what citizens of Boston be living under? They need freedom's thunder!,2016-10-30 18:32:34,792856751762583552
Walks outside warm and clear... walks inside power flickers from thunder storm,2016-10-30 18:32:22,792856702039261184
Apparently rain lighting and thunder is new to some ppl.,2016-10-30 18:32:19,792856685547253760
Will Russ go for 60 tonight? — watching Oklahoma City Thunder at Chesapeake Energy Arena http://fb.me/1RBJ99z2q,2016-10-30 18:32:10,792856651707461632
Time for a little thunder @ D_Perryman52 and lightning @ Jajabrown2. # Chargers,2016-10-30 18:32:05,792856630257852416
Talk about stealing someones thunder # amirite,2016-10-30 18:31:58,792856597991219200
there was thunder? https://twitter.com/annalovesushi/status/792830201323552770 …,2016-10-30 18:31:49,792856561601372160
Family fun night with the Thunder! pic.twitter.com/HfzRY8jQOw,2016-10-30 18:31:49,792856561584640004
"Thunder up, OKC! # Rumblepic.twitter.com/fz3TQFA9oG",2016-10-30 18:31:33,792856494882562048
Manda um abraco p Theresina Thunders. Time de flagfootball de Teresina-PI # TudopelaNFL,2016-10-30 18:31:21,792856446136360960
i hate thunder,2016-10-30 18:31:11,792856400938532864
チョキ出しダイエット始めます,2016-10-30 18:31:02,792856365177774080
Ich mag das @ YouTube-Video von @ baronvongamez: http://youtu.be/Mq-c5tNdz9s?a Too OP Plez Nerf - War Thunder Top 5 Plays,2016-10-30 18:31:00,792856355342123008
"Good Evening OKC, and Thunder Fans Worldwide! Let's see if our First Quarter is better today. The Officials are next...",2016-10-30 18:30:38,792856265680494593
an hour ago I was enjoying an early dinner outside. Now the sound of thunder roars in. # thatwassudden,2016-10-30 18:30:32,792856237578723328
Your mcm hide under the covers when he hear thunder,2016-10-30 18:30:30,792856228833681408
Wind. Rain. Lightning. Thunder. Rain. Hail.... I blame the emails ... because its easier than preparing. # ImWithHer,2016-10-30 18:30:21,792856194301960192
Wham-O Air Thunder Black http://sport-good.ru/products/9164-wham-o-air-thunder-black …pic.twitter.com/zzgDXYknFW,2016-10-30 18:30:18,792856181572268032
Lakers have the second best PNR tandem in the league at this early juncture. It'll be interesting to see how Thunder defend Russell/Randle.,2016-10-30 18:30:17,792856174890659840
"Love this picture of my ""day 1's"" @ TylerZirpoli75 @ PeterMac22 @ WaukeshaWestFB @ NXLevel_1 # speedmafia # thunder # lightningpic.twitter.com/rYzo5W432e",2016-10-30 18:30:14,792856164341915648
@ thunder_blossom Olá Thunder Blossom tudo bem ? gosta de uns videos engraçados ? https://www.youtube.com/watch?v=3xRJdbbHzRc …,2016-10-30 18:30:12,792856155903123456
Gostei de um vídeo @ YouTube http://youtu.be/V3Vxkil_9mg?a[LIVE … STREAM] - War Thunder #9 30/10/2016,2016-10-30 18:30:04,792856119102218241
When I tweeted this I forgot that they were playing the Thunder,2016-10-30 18:30:02,792856114849206272
Yea - storms - thunder,2016-10-30 18:30:01,792856107282796546
The Mavericks have lost their opening 2 games this season. Thunder are looking to go 3-0 this season & should be too strong for the Lakers.,2016-10-30 18:30:00,792856106385154048
Thunder up. # still,2016-10-30 18:29:59,792856100542435328
Scary! So far not a lot of thunder & lightening here in the 08109! https://twitter.com/JoeHoldenCBS3/status/792851963926970368 …,2016-10-30 18:29:57,792856090551717888
I think Lakers and Thunder are equals so it should be a good game,2016-10-30 18:29:49,792856058490413058
thunder o que esta achando de Watashi Ga Motete Dousunda? esta sendo um ótimo anime na minha opinião,2016-10-30 18:29:41,792856022704459776
"Still 4 seats open for Storm King's Thunder starting Nov 19th, 6:30 PST! I look forward to a huge- a gargantuan- okay, here be Giants!",2016-10-30 18:29:39,792856017243557888
We're like thunder in the rain,2016-10-30 18:29:23,792855951128731649
Lakers vs OKC Thunder Preview: Can They Stop Westbrook? Westb... http://twib.in/l/p5RrAepMMnj5 # basketball # NBA # Sportspic.twitter.com/FGnGZY4pUg,2016-10-30 18:29:14,792855913203798016
"5-2 @ CanmoreEagles1, Thunder goals Braden Jakubowski from Cardinal and Salpeter, 2nd goal Marcus Walter from Salpeter and Krewusik",2016-10-30 18:29:05,792855875325194240
がぉ〜,2016-10-30 18:29:04,792855868148633600
I had this fuckin thunder i wish my mom was home ughh,2016-10-30 18:28:57,792855839908433929
foxsports .com >> Lakers vs OKC Thunder Preview: Can They Stop Westbrook? http://buzztap.com/-81ZF1I,2016-10-30 18:28:48,792855802419695616
# MOTD2 Yeah go on then! Toxic Thunder!!! # LFC # YNWA # LFCFamilypic.twitter.com/YfgMauWjXO,2016-10-30 18:28:46,792855792328159232
I love the sound of rain and thunder,2016-10-30 18:28:42,792855777140703232
About to thunder storm,2016-10-30 18:28:39,792855763941294080
I woke last night to the sound of thunder How far off I sat and wondered Started humming a song from nineteen sixty-two,2016-10-30 18:28:22,792855693032316928
"I'm tellin' you You don't need that guy It's so black and white He's stealin' your thunder Baby, blue ain't your color",2016-10-30 18:28:11,792855649277259776
i hate thunder so much i wish it would stop,2016-10-30 18:28:10,792855641425666049
"near Timmins, Ont. 8 hrs to Arnprior or GTA, 11 hrs to Thunder Bay. Maybe next tour @ thetrews will hit NE Ont?",2016-10-30 18:28:09,792855639085223941
# nba daqui a pouco # lakers X # thunder sem transmissão no # brasil https://www.instagram.com/p/BMNC2C-A942/,2016-10-30 18:27:58,792855593090449408
this storm is messing with me so much.. thunder and lightning (and rain) is okay..wind and other crap i dont mess with,2016-10-30 18:27:55,792855580952104962
"The Seymour Boys Soccer team is STATE BOUND! Good luck, Thunder! See you in Milwaukee! # wiaasoccer # roadtostate # wiaastatepic.twitter.com/evb9QF7x8q",2016-10-30 18:27:51,792855562354515968
@ KathyOrrFOX29 Great call KO...Rain Wind Thunder and Lightning. ..On Time...You are Good....,2016-10-30 18:27:42,792855524501024768
"WTH its raining , thunder & lightning likes its the middle of summer",2016-10-30 18:27:39,792855512807272450
"Apply first: Principal Distributed Systems Software Engineer - Thunder IoT Cloud in San Francisco, CA http://bull.hn/l/2TQQX/79 # job",2016-10-30 18:27:35,792855497137385473
"I'm at James and Marsha's No Frills in Thunder Bay, Ontario https://www.swarmapp.com/c/75zUm2FKBjV",2016-10-30 18:27:25,792855455479500801
"@ thunder_blossom eaee Thunder Blossom,curte videos no youtube de mine? da uma olhadinha no meu <3 https://goo.gl/aBhF6B",2016-10-30 18:27:14,792855407907725312
# NowPlaying Thunder Island by Jay Ferguson ♫ http://spoti.fi/M9nRF1,2016-10-30 18:27:10,792855392170549251
# OKCThunder # ThunderUp # WeAreThunder Live Coverage: Thunder vs. Lakers http://dld.bz/fc6Z4,2016-10-30 18:27:08,792855381202599936
Gostei de um vídeo @ YouTube http://youtu.be/w643_sIkG0w?aHitler … no War Thunder,2016-10-30 18:27:03,792855362667896832
My baby is so scared of the thunder and lightning,2016-10-30 18:26:58,792855339158863872
Ny getting randomly hot af and causing thunder smh,2016-10-30 18:26:47,792855295110287360
# NBA Double: Thunder -4.5 vs Lakers Rockets to beat Mavericks Odds at 5/4! £10 stake.,2016-10-30 18:26:43,792855277926289408
Me ha gustado un vídeo de @ YouTube (http://youtu.be/N2XufsNZx8k?a - SCHRÄGE MUSIK - Upward Facing CANNONS (War Thunder Plane Gameplay)).,2016-10-30 18:26:43,792855277301149696
Playoffs Mayor B Ave 5 (1) vs (8) Horses Gladiators (2) vs (7) Wachachara Thunders (3) vs (6) Longhorns Browns (4) vs (5) Zub Zero,2016-10-30 18:26:39,792855263397179397
It's thunder storming here. It felt like summer here today. Too hot! Can't wait for cooler weather. Hope ur weekend was great,2016-10-30 18:26:37,792855254677225472
Why is it thunder storming,2016-10-30 18:26:35,792855246389317633
I honestly fucking hate thunder and lighting,2016-10-30 18:26:22,792855191045410816
THUNDER!,2016-10-30 18:26:21,792855187689910273
RT RandyRenner: Starting lineups for # Thunder # Lakers pic.twitter.com/N7VBJf3SaO # DraftKings # FanDuel # NBA # DFS # ProBallMetrics,2016-10-30 18:26:17,792855170161995776
Pizza is my thunder buddy pic.twitter.com/PEq5G0vLq8,2016-10-30 18:26:16,792855166399737856
"""London Thunder"" von Foals zur Playlist http://open.spotify.com/user/hoiz3000/playlist/3jmKBQ3SdZPC3oss4fTlbv … hinzugefügt.",2016-10-30 18:26:15,792855162549334016
shoes と moon でやれば歌にもなりますね！カッケーです！,2016-10-30 18:26:13,792855154009657344
Lakers vs OKC Thunder Preview: Can They Stop Westbrook? # LAL http://app.fanly.me/article/eNmfCUGtsN …pic.twitter.com/OtPgIPfNso,2016-10-30 18:26:13,792855151618977792
A Thunder Afternoon in the Community # OklahomaCityThunder... http://dlvr.it/MYg7Bd # OklahomaCityThunder,2016-10-30 18:26:11,792855142513074176
For live updates throughout tonight's Thunder/Lakers game check out the Thunder Social Scene # News9Thunderhttp://www.news9.com/story/33517100/thunder-social-scene-okc-hosts-lakers-on-sunset-sunday …,2016-10-30 18:26:09,792855137576300544
For live updates throughout tonight's Thunder/Lakers game check out the Thunder Social Scene # News9Thunder http://www.news9.com/story/33517100/thunder-social-scene-okc-hosts-lakers-on-sunset-sunday …,2016-10-30 18:26:09,792855137525956609
"Heathen Transcend ( @ Heathen_Brewing) is on, replacing Peddler Mosaic Thunder ( @ peddlerbrewing)",2016-10-30 18:26:04,792855116479016960
Max REALLY hates thunder,2016-10-30 18:26:03,792855111525605377
London Thunder by Foals # Foals # Radio1 # NowOnR1,2016-10-30 18:26:02,792855105456439296
"Russell Westbrook entered Sunday as the NBA's leading scorer (41.5). He ranks in top 10 in scoring, assists and rebounds. # Thunder",2016-10-30 18:26:00,792855098716069888
"At thunder and tempest, at the world's coldheartedness, during times of heavy loss and when you're sad.",2016-10-30 18:25:58,792855090675585024
Before the sky turned black and the thunder and lightning began. http://ift.tt/2e2oKT9 pic.twitter.com/DMbrPFdrx6,2016-10-30 18:25:48,792855045549219844
I liked a @ YouTube video from @ thunders7ruck http://youtu.be/7cYYtQ-eg5o?a Infinite Warfare Rig Abilities Are Overpowered! COD Infinite,2016-10-30 18:25:41,792855018105741312
This thunder and lightning gotta go,2016-10-30 18:25:35,792854993430777856
Glad 2 b coaching Wdstk Thunder Mini Boys B Team. Spent a few years with @ drorlandodds coaching our daughters & now get to coach my son!,2016-10-30 18:25:26,792854955866587141
"Мне понравилось видео ""И-16 тип 28 ""НАГИБ, КАК в 2013!!!"" War Thunder"" (http://youtu.be/T2g47FNMV6g?a )",2016-10-30 18:25:25,792854952745902080
♫ London Thunder - by Foals # bbc # radio1 # np,2016-10-30 18:25:22,792854939550748672
@ okcthunder representing my fav Thunder player @ RealStevenAdams for Halloween in NYC # stachebros # thunderuppic.twitter.com/sQxujN3PBl,2016-10-30 18:25:18,792854920965816321
I'm doing the mid first bank free throw contest at the thunder game,2016-10-30 18:25:13,792854902200381440
Lakers vs OKC Thunder Preview: Can They Stop Westbrook? The Lakers will play their second game of their four game … http://ift.tt/eA8V8J,2016-10-30 18:25:12,792854898220077056
Now Playing Foals - London Thunder @ foalshttp://www.bbc.co.uk/music/artists/6a65d878-fcd0-42cf-aff9-ca1d636a8bcc …,2016-10-30 18:25:12,792854894348730368
I honestly love hard ass thunder storms,2016-10-30 18:25:07,792854876288086016
"Los Angeles Lakers Vs. Oklahoma City Thunder 4:00 P.M. PST, October 30, 2016 Chesapeake Energy Arena, Oklahoma... http://fb.me/QY0yo60z",2016-10-30 18:24:57,792854834789638144
Se os warriors e os Thunder ganharem ganho 70 €,2016-10-30 18:24:36,792854744490450944
@thunder storm where'd u come from???,2016-10-30 18:24:34,792854736705818624
That thunder had me shook,2016-10-30 18:24:32,792854729823023104
Sleeping on hunters thunder blanket :l pic.twitter.com/v9eo3VjcUo,2016-10-30 18:24:27,792854709623099392
Lakers head coach Luke Walton with high praise of Thunder big man Steven Adams https://twitter.com/SteveMcGehee/status/792853746891956224 …,2016-10-30 18:24:20,792854679034077184
Lakers head coach Luke Walton with high praise of Thunder big man Steven Adams https://twitter.com/SteveMcGehee/status/792853746891956224 …,2016-10-30 18:24:20,792854679013105664
It's been thunder storming for 2 hours and I'm confused,2016-10-30 18:24:16,792854660512116736
Patrice Roberts - Thunder Waist [now playing] | # CaribbeanSessions | http://www.caribbeansessions.co.uk | Soca 24/7 # PressPlay,2016-10-30 18:24:10,792854638265532416
WHO ELSE HEARD THAT THUNDER OH MY GOD,2016-10-30 18:24:05,792854614165118976
Lakers will tip off against the Thunder in a little less than an hour. My preview & what I'll be watching for: http://www.forumblueandgold.com/2016/10/30/preview-and-chat-lakers-vs-thunder-4/ …,2016-10-30 18:24:01,792854600155934721
Whoever wrote the @ NeverwinterGame Storm King's Thunder soundtrack deserves an Academy Award :) I'm playing it now and it's awesome !,2016-10-30 18:23:51,792854557881569280
Bruce Springsteen - Thunder Road [Live / Rock]:http://ift.tt/2f2fD7J pic.twitter.com/ODjyCbqoby,2016-10-30 18:23:34,792854486532390913
"Prefiro mandar Pelicans pra OKC, Thunder pra Seattle e suprimir Heat e Clippers pra liga ficar com 28 times. :) https://twitter.com/kaikegomes/status/792853673160404992 …",2016-10-30 18:23:28,792854460905185281
*In Iyanya's voice*After d lightning comes d thunder & more rain.,2016-10-30 18:23:27,792854456169852928
"Raise your words not your voice. It's rain that grows flowers, not thunder.",2016-10-30 18:23:12,792854394098311169
"Oklahoma City Thunder - L. A. Lakers betting tip. Read in full >> http://zpr.io/Pg269 # basketball. Nba season just started, tonight we h",2016-10-30 18:23:09,792854381725188096
Starting lineups for # Thunder # Lakerspic.twitter.com/3QMBeC9jHH,2016-10-30 18:23:08,792854375639068673
見てみたい（≧∇≦）,2016-10-30 18:23:06,792854369997684737
OKC Thunder looking to continue perfect start against LA Lakers http://thunderousintentions.com/2016/10/29/okc-thunder-perfect-start-lakers/ …,2016-10-30 18:23:03,792854357356056576
This what I don't do this thunder bms scared ash wdf,2016-10-30 18:23:02,792854350032990208
Boa noite galera! Logo mais tem Thunder,2016-10-30 18:22:46,792854284828286976
Snapped this before the storm and thunder / lightning hit. Shortly after this pic @ begeem sent a… https://www.instagram.com/p/BMNCPqUAmKd/,2016-10-30 18:22:44,792854274220916736
Ik vind een @ YouTube-video leuk: http://youtu.be/N2XufsNZx8k?a SCHRÄGE MUSIK - Upward Facing CANNONS (War Thunder Plane Gameplay),2016-10-30 18:22:41,792854261562351616
Random ass thunder,2016-10-30 18:22:40,792854260924940289
"There were only six unbeaten teams left in the NBA heading into the day -- Thunder, Bulls, Cavs, Hawks, Spurs and Clippers.",2016-10-30 18:22:40,792854257984688128
Enjoying our night! Ribs on grill # Thunder # NFL Cowboys vs. Eagles… https://www.instagram.com/p/BMNCNs4A7-39YxAMuP2IRa5AJ8FDk7Ev9Gq2GY0/ …,2016-10-30 18:22:28,792854207384678401
Ever saw Tropic Thunder? # holloween2K16 https://www.instagram.com/p/BMNCMNAj1tRunDelu-pC4ewYnrsWEAYLBSrpV40/ …,2016-10-30 18:22:16,792854156214231040
"Amon Amarth ""Twilight Of The Thunder God"" (OFFICIAL VIDEO) http://fb.me/3f2jtjyT4",2016-10-30 18:22:15,792854155882745856
I love rain and thunder,2016-10-30 18:21:59,792854085791838208
"YIKES! Lightning, thunder, rain ...out of nowhere. That shocked me. But I will live.",2016-10-30 18:21:53,792854061146071040
Los Thunder quieren hacer millonarios a Adams y Oladipo http://bit.ly/2ecnOz1,2016-10-30 18:21:51,792854053139066880
Clippers over Jazz.Warriors over Suns.Spurs over Heat.Pistons over Bucks.Lakers over Thunder. Wizards over Grizzlies. And Rockets over Mavs.,2016-10-30 18:21:51,792854051755008005
Los Thunder quieren hacer millonarios a Adams y Oladipo http://deportes.tusueldo.com/3J8t # baloncesto,2016-10-30 18:21:48,792854039465631744
My Lakers play the thunder tonight,2016-10-30 18:21:46,792854034054950913
Los Thunder quieren hacer millonarios a Adams y Oladipo http://bit.ly/2eclecc # deporte # baloncesto,2016-10-30 18:21:45,792854030292652032
"Según @ WojVerticalNBA, los Thunder estarían negociando las negociaciones de Steven Adams (sobre 100M) y Victor Oladipo (sobre 80M).",2016-10-30 18:21:45,792854028656967680
"Steven Adams Contract: Latest News, Rumors on Negotiations with Thunder https://www.mhb.io/e/2ef6i/hz # bigfun0163pic.twitter.com/OBqMDziyv8",2016-10-30 18:21:45,792854026136260608
Just ran in the rain while thunder was occurring...,2016-10-30 18:21:41,792854011699429377
Enjoying one of my favorite things ....a good thunder and lightening storm from my couch ...candles and the sound of rain all around me.,2016-10-30 18:21:37,792853995433914369
i hate thunder storms sm,2016-10-30 18:21:33,792853978753228800
Now Trending: Lakers Vs. Thunder Preview: Road Trip Continues Against OKC And Russell Westbrook http://www.chatsports.com/los-angeles-lakers/a/source/lakers-vs-thunder-preview-road-trip-continues-against-okc-and-russell-westbrook-12941636 … via @ chatlakers,2016-10-30 18:21:32,792853974500143105
Now Trending: Lakers Vs. Thunder Preview: Road Trip Continues Against OKC And Russell Westbrook http://www.chatsports.com/los-angeles-lakers/a/source/lakers-vs-thunder-preview-road-trip-continues-against-okc-and-russell-westbrook-12941636 … via @ chatlakers,2016-10-30 18:21:32,792853972172283905
Now Trending: Lakers Vs. Thunder Preview: Road Trip Continues Against OKC And Russell Westbrook http://www.chatsports.com/los-angeles-lakers/a/source/lakers-vs-thunder-preview-road-trip-continues-against-okc-and-russell-westbrook-12941636 … via @ chatlakers,2016-10-30 18:21:30,792853963829903362
Now Trending: Lakers Vs. Thunder Preview: Road Trip Continues Against OKC And Russell Westbrook http://www.chatsports.com/los-angeles-lakers/a/source/lakers-vs-thunder-preview-road-trip-continues-against-okc-and-russell-westbrook-12941636 … via @ chatlakers,2016-10-30 18:21:28,792853958385688576
Warriors Thunder on Thursday It's too lit,2016-10-30 18:21:28,792853956775084032
Now Trending: Lakers Vs. Thunder Preview: Road Trip Continues Against OKC And Russell Westbrook http://www.chatsports.com/los-angeles-lakers/a/source/lakers-vs-thunder-preview-road-trip-continues-against-okc-and-russell-westbrook-12941636 … via @ chatlakers,2016-10-30 18:21:28,792853955592196096
Now Trending: Lakers Vs. Thunder Preview: Road Trip Continues Against OKC And Russell Westbrook http://www.chatsports.com/los-angeles-lakers/a/source/lakers-vs-thunder-preview-road-trip-continues-against-okc-and-russell-westbrook-12941636 … via @ chatlakers,2016-10-30 18:21:27,792853952048066560
this rain and thunder was never the look,2016-10-30 18:21:26,792853950185824257
Now Trending: Lakers Vs. Thunder Preview: Road Trip Continues Against OKC And Russell Westbrook http://www.chatsports.com/los-angeles-lakers/a/source/lakers-vs-thunder-preview-road-trip-continues-against-okc-and-russell-westbrook-12941636 … via @ chatlakers,2016-10-30 18:21:26,792853949774753793
"@ Sam_murch working on tonight's ""Sam's Fans"" for @ InsideThunder # Thunder # Lakerspic.twitter.com/VnrUQqakTk",2016-10-30 18:21:25,792853944451993601
the Dino Thunder suits was pretty cool i can't lie,2016-10-30 18:21:20,792853923052785665
Bad storm here send help! Theres thunder and lightning! pic.twitter.com/bPLMLK3yNd,2016-10-30 18:21:16,792853906267209729
"-she wraps her hooves around you, holding you gently- ""mooo""",2016-10-30 18:21:15,792853902525812737
I added a video to a @ YouTube playlist http://youtu.be/7KKDmEm1WkM?a Grinding for DO 217 E-2 - War Thunder - Air Battles - Arcade - Live (2,2016-10-30 18:21:08,792853873870315520
"At 9pm Eastern, we'll continue Storm King's Thunder @ DnD_AdvLeague with the # FGCrew! http://www.twitch.tv/fantasygrounds @ The_Digital_DM",2016-10-30 18:21:07,792853870229778432
When I was young I heard gun shots every other night guess that explain why I was never scared of thunder,2016-10-30 18:21:07,792853866794672129
行ってらっしゃいだぜ！,2016-10-30 18:20:54,792853813157777409
"//Wow, I'm watching a person play a horror game then i heard thunder as i heard it, it shook my whole house xD",2016-10-30 18:20:43,792853766135549952
Its sooooo hot. I cant sleep....swating AF. The thunder sounds outside are annoying AF coz theres no rain to cool dis weather,2016-10-30 18:20:27,792853700796612608
"Thunder, lightning, wind, & rain but realizing it's almost November and not late May.",2016-10-30 18:20:23,792853683952295936
Thunder!,2016-10-30 18:20:17,792853657062486018
almost time to beat the Thunder to go 2-1!,2016-10-30 18:20:12,792853636636303361
