text,date,id
Warriors vs. Thunder final score: 3 things we learned from the Warriors&#39; 121… http://dlvr.it/MYgdlQ # WarriorsVsThunderWarriors,2016-10-30 19:17:14,792867989875859456
Hopefully lakers beat thunder,2016-10-30 19:17:12,792867980749045760
"@ Lakers vs Thunder, @ dallascowboys vs eagles, @ Westworld, and @ Shameless loving Sunday night lineup",2016-10-30 19:17:08,792867965393711104
I heard thunder before and I'm banning Auckland from doing anything with the weather until I am safely away on my plane.,2016-10-30 19:17:04,792867949770002432
Thunder fans watching KD like pic.twitter.com/52wi9OJCMf,2016-10-30 19:17:01,792867934683205632
"# ZoneInterdite t'as des gosses qui courent pr 1 photo & t'as les autres qui courent pour pas attendre 2h pr faire le ""Big Thunder Mountain""",2016-10-30 19:16:43,792867861995855872
"You can't steal our thunder Gregg!! As a Browns fan, you're way out of line here!!",2016-10-30 19:16:41,792867854739607552
"*thunder thunder* ...!! ... ... ...;;; Umm... Can I sleep with ya tonigh, please? ;w;",2016-10-30 19:16:41,792867853095481344
# Warriors vs. Thunder final score: 3 things we learned from the... https://goo.gl/fb/gQKBA9 # warriorsvsthunder,2016-10-30 19:16:40,792867850444607488
"Venga, va, Lakers-Thunder. A ver si Westbrook lanza hoy sus 40 tiros con mejor porcentaje.",2016-10-30 19:16:40,792867849274585089
At the @ okcthunder game. # Thunder # Lakers,2016-10-30 19:16:40,792867846871134208
"Randle had 7 points in the Jazz game, already has 8 points in the first quarter tonight against the thunder",2016-10-30 19:16:37,792867836234375168
Julius Randle with eight points so far in the first quarter. Lakers lead the Thunder 11-8.,2016-10-30 19:16:33,792867818710663168
Thunder up!!,2016-10-30 19:16:30,792867805913751552
Russ Adams pick n roll is pretty good # Thunder,2016-10-30 19:16:25,792867783881134084
NW: Lakers @Thunder,2016-10-30 19:16:18,792867755393290240
assistindo Los Angeles Lakers vs Oklahoma City Thunder,2016-10-30 19:16:12,792867730814828544
I'm waiting for the stand up desk and thunder background noises they need to add from your promotion.,2016-10-30 19:16:11,792867725785829376
1. Lakers at Thunder 2. Well it beats Kyogre as well if that means anything,2016-10-30 19:16:10,792867722249895937
LETS GO THUNDER!! — watching Los Angeles Lakers vs Oklahoma City Thunder,2016-10-30 19:16:06,792867704931815424
"Oct 29 Game Score: Atom LL - 0, Oro Thunder 2 - 7 http://tinyurl.com/jemz9mj",2016-10-30 19:16:02,792867690465591297
I see you randle !! Thunder WEAK !!! Let's et this W @ Lakers,2016-10-30 19:16:01,792867684450865152
"*facetimes ang* ang:""i hear thunder. I hear thunder. I HEAR THUNDER"" IM CRYINHSMSKK",2016-10-30 19:15:51,792867641178349568
Ugh... Thunder!,2016-10-30 19:15:47,792867625302843392
watching Los Angeles Lakers vs Oklahoma City Thunder,2016-10-30 19:15:42,792867606432657408
Zero to kiwi in 2.6 seconds. # thunder,2016-10-30 19:15:38,792867587650498561
Steven scores Thunder's first six! @ FoxSportsOKpic.twitter.com/Ahc09YwVbd,2016-10-30 19:15:35,792867576619511808
Thunder up,2016-10-30 19:15:33,792867568100921344
"I'm tellin' you You don't need that guy It's so black and white He's stealin' your thunder Baby, blue ain't your color",2016-10-30 19:15:31,792867557694967809
Power Rangers Dino Thunder Quadro Battlized Red Ranger Bandai Action Figure !http://www.bonanza.com/listings/339068186 …,2016-10-30 19:15:30,792867556499525634
Thunder-Lakers is a colorful game.,2016-10-30 19:15:29,792867550702952449
That thunder took like 16 seconds to finish,2016-10-30 19:15:29,792867549126004736
LAKERS vs. THUNDER — watching NBA,2016-10-30 19:15:29,792867549041926144
# Lakers will probably blow out # Thunder by 50 tonight.....,2016-10-30 19:15:26,792867539386859520
now it's thunder-storming and i'm on the verge of a melt down because i'm so scared. and i'm also by myself. so.,2016-10-30 19:15:25,792867535477673984
Bro how am I gonna watch the laker vs thunder game tf channel its on,2016-10-30 19:15:21,792867518108930048
nw: lakers vs thunder,2016-10-30 19:15:20,792867514174742528
Let go THUNDER UP # WESTBROOK # WhyNotpic.twitter.com/bW0YXlMtBf,2016-10-30 19:15:15,792867494025269248
Me ha gustado un vídeo de @ YouTube (http://youtu.be/5w06ll36FWM?a - A-10 IN WAR THUNDER? 75mm AUTO CANNON! War Thunder Gameplay).,2016-10-30 19:15:15,792867493773574145
I hate thunder,2016-10-30 19:15:15,792867492108627969
So the lightening AND the thunder scared you? # NostalgiaChat,2016-10-30 19:15:14,792867486391685120
Russell Westbrook and Steven Adams had their game faces on early. # Thunder pic.twitter.com/5UtYnBoqH7,2016-10-30 19:15:12,792867478619561984
I hate thunder and lightening,2016-10-30 19:15:07,792867459246292992
Pues hoy toca ver de nuevo a Don Russell. Vamos con el Thunder-Lakers! # NBALeaguePass # OKCLAL,2016-10-30 19:15:07,792867457748897792
Utah high school football playoffs: Who will win? # UTHSFB # 3AAPlayoffs # RT for Ridgeline RiverHawks # Like for Desert Hills Thunder pic.twitter.com/HvllvP5653,2016-10-30 19:15:03,792867442317860864
i loveee thunder storms,2016-10-30 19:14:52,792867395186614272
Clarkson is gonna put up 30 on the Thunder.,2016-10-30 19:14:50,792867386638467073
viendo Los Angeles Lakers vs Oklahoma City Thunder,2016-10-30 19:14:48,792867380103897089
"Let's Go LA , Westbrook bout to kill tho! — watching Los Angeles Lakers vs Oklahoma City Thunder",2016-10-30 19:14:46,792867369920200704
"Me gustó un video de @ YouTube de @ pistolasfritas http://youtu.be/UMLWUxscZlI?a Pistola Argentina Bersa Thunder .380, en Español",2016-10-30 19:14:43,792867358486384640
That thunder sounds game too,2016-10-30 19:14:41,792867348290166784
assistindo Los Angeles Lakers vs Oklahoma City Thunder,2016-10-30 19:14:34,792867319672438784
October thunder!!!,2016-10-30 19:14:33,792867317713600512
Those Thunder unis are horrid. My eyes are bleeding.,2016-10-30 19:14:33,792867316832743424
Assistindo Thunder x Lakers!!!! # GoLakers # LakeShow,2016-10-30 19:14:33,792867315952062464
"""Thunder in the Morning Calm"" http://amzn.to/2biYSG9 # ACFW http://bit.ly/CLCIFB pic.twitter.com/8o8m4UcRXX",2016-10-30 19:14:33,792867315817730048
Uri thunder is so talkative as days passed.,2016-10-30 19:14:33,792867314706231297
It's okay thunder will fire dem,2016-10-30 19:14:25,792867281680203777
That thunder pick and roll is too easy,2016-10-30 19:14:24,792867278345777152
watching Los Angeles Lakers vs Oklahoma City Thunder,2016-10-30 19:14:24,792867277687271424
Hot chat on Lakers vs OKC Thunder Preview: Can They Stop Westbrook? http://dlvr.it/MYgcMY http://hoopligans.com,2016-10-30 19:14:18,792867253951672320
The Lakers third regular season game starts tonight vs the Oklahoma City Thunder at Chesapeake Energy Arena! GO LAKERS!,2016-10-30 19:14:18,792867251892269056
Westbrook to Adams under the basket. Thunder will run that allllllll night if it keeps working,2016-10-30 19:14:17,792867248092229633
Hot chat on Lakers vs OKC Thunder Preview: Can They Stop Westbrook? http://dlvr.it/MYgcKv http://hoopligans.com,2016-10-30 19:14:16,792867246360047616
love thunder and lightning,2016-10-30 19:14:15,792867241310158849
@ Kenny_Kangaroo I've lost my Battle and seen a Phantom on the Thunder Bolt ... it's getting scarier as we approach Halloween pic.twitter.com/7L1zsXJx3O,2016-10-30 19:14:14,792867234280509441
watching Los Angeles Lakers vs Oklahoma City Thunder,2016-10-30 19:14:11,792867222624624645
Let's Go OKC # Killa Cam Payne # DWUKD — watching Los Angeles Lakers vs Oklahoma City Thunder,2016-10-30 19:14:07,792867205570494466
"Rain & thunder, ugh yes couldn't be happier",2016-10-30 19:14:06,792867202257018880
Buen enlace para ver el Lakers-Thunder... en YouTube!! https://www.youtube.com/channel/UCukYIk3p4mo-Tu7b0uof5Ww/live …,2016-10-30 19:14:00,792867179037327361
My honest personal opinion? DW is the best drum company PERIOD! @Thunder Valley Casino Resort https://www.instagram.com/p/BMNIGoGD6yM/,2016-10-30 19:13:57,792867162784489473
assistindo Los Angeles Lakers vs Oklahoma City Thunder,2016-10-30 19:13:49,792867129435578368
Thunder/Lakers game,2016-10-30 19:13:46,792867116579979266
I love thunder,2016-10-30 19:13:42,792867102076043264
Thunder,2016-10-30 19:13:39,792867087857360896
assistindo Los Angeles Lakers vs Oklahoma City Thunder,2016-10-30 19:13:32,792867060988702722
GO THUNDER! # ThunderUp,2016-10-30 19:13:30,792867053438840836
http://ift.tt/2eKd1ga Nike Air Jordan iv 4 Retro Black and Yellow Thunder size 13 Steelers 7day faya pic.twitter.com/i9tUIFj0aa,2016-10-30 19:13:30,792867049601167360
Uma pena sem transmissão. Mas estaremos juntos com o # Thunder # OKC # NBA,2016-10-30 19:13:27,792867037823524864
Warriors/Thunder Thursday night,2016-10-30 19:13:24,792867028331667457
I'm so afraid of thunder holy poo,2016-10-30 19:13:21,792867014381604864
"Selon The Vertical, Steven Adams et Oladipo parlent d'une prolongation de contrat avec le Thunder.",2016-10-30 19:13:21,792867011735027712
うん。しこりんに伝えるわね(๑˃̵ᴗ˂̵),2016-10-30 19:13:17,792866996916326401
"idk why but storms excite me. i like the thunder and lightening, as well as the rain. it gives me a sense of relaxation",2016-10-30 19:13:16,792866992994877440
Rain/Thunder tomorrow!,2016-10-30 19:13:16,792866991891767297
It's appropriately double double toil 'n trouble weather out here in Glen Eden. # halloween # thunder # rain,2016-10-30 19:13:15,792866987202404352
"NBA: Lakers 3 - 4 Thunder, 1er Cuarto. http://bit.ly/1SG2SNu",2016-10-30 19:13:12,792866974833311744
"NBA: Lakers 3 - 4 Thunder, 1er Cuarto. http://bit.ly/1SG2Sx9",2016-10-30 19:13:11,792866972761403392
"NBA: Lakers 3 - 4 Thunder, 1er Cuarto. http://bit.ly/236azAL",2016-10-30 19:13:11,792866970152558592
Lakers: 0 - Thunder: https://twitter.com/Thunder_Digest/status/792865007167868928 …,2016-10-30 19:13:08,792866960392413184
@ cp3024 Thunder Up! # WeAreThunder,2016-10-30 19:13:07,792866953228591104
Vamos de Lakers x Thunder! # nba,2016-10-30 19:12:44,792866859645370369
おはよー。しこりんだけかしら？,2016-10-30 19:12:39,792866839630008320
Power Rangers Dino Thunder Quadro Battlized Red Ranger Bandai Action Figure http://www.bonanza.com/listings/339068186 …,2016-10-30 19:12:39,792866835775586305
Ich mag das @ YouTube-Video: http://youtu.be/cp8OgAtDy-0?a LIVE HD: LOS ANGELES LAKERS vs OKLAHOMA CITY THUNDER,2016-10-30 19:12:38,792866834164830208
Lakers vs Thunders,2016-10-30 19:12:36,792866823431565312
Six passes in about eight seconds from the Thunder there.,2016-10-30 19:12:33,792866811096072192
Steven Adams marque les premiers points du Thunder avec un 2/2 sur la ligne des lancers.,2016-10-30 19:12:29,792866794528792577
doesn't count cuz it happened before I was born. And neither does the warriors last year cuz that was basketball. And thunder too.,2016-10-30 19:12:18,792866748647153664
I added a video to a @ YouTube playlist http://youtu.be/0RPkJeziNyI?a Bob Dylan - Thunder On The Mountain,2016-10-30 19:12:15,792866735254740992
It sounds like the thunder is bombing us rn,2016-10-30 19:12:13,792866728418181124
...the battle scenes in Tropic Thunder were wayyy better than the ones in Hacksaw Ridge.,2016-10-30 19:12:12,792866723967885313
Lakers vs Thunder,2016-10-30 19:12:11,792866720536989696
Eru Hótel Búðir líka hrollvekjandi?,2016-10-30 19:12:10,792866716527235072
Baafour ( @ iambaffour) - Thunder Fire You Feat. Shatta Rako & Luther (Prod. by 1Kwame) - via @ThinkGhanaMusic http://bit.ly/2aJXsCW,2016-10-30 19:12:10,792866714098642945
Thundering Up!!! — watching Los Angeles Lakers vs Oklahoma City Thunder at Chesapeake Energy Arena http://fb.me/52SPzevBn,2016-10-30 19:12:09,792866710844018690
This rain n thunder that was going on .I'm not with it and I'm by myself yeah ard,2016-10-30 19:12:06,792866699468996608
I liked a @ YouTube video http://youtu.be/0RPkJeziNyI?a Bob Dylan - Thunder On The Mountain,2016-10-30 19:12:00,792866675171270656
Thunder would not lemme watch the titanic at 5am this morning and instead made me watch a stupid movie ab weightlifters,2016-10-30 19:12:00,792866674403934213
Power Rangers Dino Thunder Quadro Black Ranger Wild Cycle Bandai Action Figure http://www.bonanza.com/listings/371806871 …,2016-10-30 19:11:56,792866658352259073
THUNDER UP,2016-10-30 19:11:54,792866650156507136
SPURS time dos vovôs vai ter q ter pulmão temporada passada não aguentou thunder embrassado,2016-10-30 19:11:54,792866649527287808
tha thunder game iZ blacked out but expected This nigga Puffy was on 10 last night lmao U see his snap,2016-10-30 19:11:53,792866643953102848
@ chesterlampkin @ MetService OK so my sunny days gone to this! # Thunder! # Aucklandpic.twitter.com/X4QHEb3Lfq,2016-10-30 19:11:49,792866626857148417
Início Season Oklahoma City Thunder L.A Lakers @ br_okc @ LakersNationBR,2016-10-30 19:11:48,792866622704943104
i'm so scared of thunder & lightning storms,2016-10-30 19:11:47,792866619248771073
got home just in time to catch that lakers/thunder game,2016-10-30 19:11:43,792866604757360641
Trying to concentrate on Lakers/Thunder but Cam Newton's new cosplay or whatever it is is distracting me.,2016-10-30 19:11:43,792866603222257666
# vwmartin and I running home from the thunder & rain. # vwlifestyle # vwporn # vwbus # vwriviera… https://www.instagram.com/p/BMNH2VmjL0u/,2016-10-30 19:11:42,792866599715864576
Şunuda Bırakayım :) NBA 12:00 Oklahoma City Thunder LA Lakers İlk Per : 54.5 ALT -- > 1.86 Bol Şans :),2016-10-30 19:11:36,792866574621351940
# thunder time,2016-10-30 19:11:34,792866564265566208
FSKC is broadcasting the Thunder game...from the Lakers feed. K.,2016-10-30 19:11:31,792866553171587073
Thunder win the tip and Steven Adams draws a foul on a lob attempt,2016-10-30 19:11:31,792866551082852353
Lighting Vermillion : with this purple thunder appear to the target one by using staff,2016-10-30 19:11:26,792866532078477313
Hossa's little girl stealing his thunder. # Blackhawks,2016-10-30 19:11:25,792866528261726208
THUNDER UUUUP!,2016-10-30 19:11:22,792866516651896832
Oklahoma City Thunder vs Los Angeles Lakers Live Stream | Sunday 30 October 2016 http://www.redstream.me/watch/basketball/29495/oklahoma_city_thunder-vs-los_angeles_lakers …,2016-10-30 19:11:21,792866511966859266
I'm confident my squad gon take care of the Thunder while I'm on this flight,2016-10-30 19:11:21,792866511866236928
BEAT THUNDER!!!!! DURUGIN SI WESTBROOOK!!!!! https://twitter.com/Lakers/status/792866323353116672 …,2016-10-30 19:11:21,792866511132033024
"Apologize all you want, Thunder can’t be un-shot, Fox.",2016-10-30 19:11:20,792866506379890688
los lakers juegan contra los thunders tengo miedo chau no pueden perder,2016-10-30 19:11:19,792866502118551552
Da dengar thunder mcm malas pulak nak gy skola,2016-10-30 19:11:18,792866495919366144
yes for the thunder and lightning,2016-10-30 19:11:17,792866495088955392
I want a really good thunder storm,2016-10-30 19:11:17,792866491628564480
|COMIENZA EL PARTIDO| Q1 |12:00| 00 | Oklahoma City Thunder 00 | Los Ángeles Lakers # ThunderUp,2016-10-30 19:11:04,792866438956670980
Thunder Up OKC!!! # okcthunder # thunderup # oklahomacity # oklahoma # okc # nba # basketball # fashion # clothing # apparelpic.twitter.com/uGNAd6zyBG,2016-10-30 19:11:00,792866424377049088
"# NowPlaying Love Walked In - Wembley Arena, London 20th January 1991 de Thunder ♪♫ onlys' heavens' / onlys' 16 to 1… http://spoti.fi/2fuvYEI",2016-10-30 19:10:57,792866411345354752
THUNDER UP!! pic.twitter.com/vz600Q8C4q,2016-10-30 19:10:52,792866387924353026
# NW Thunder vs Lakers # ThunderUp,2016-10-30 19:10:51,792866385756053504
Sunset Sunday!! Thunder Up!!,2016-10-30 19:10:50,792866380743794688
"Lakers vs the Thunder, I can dig it",2016-10-30 19:10:47,792866366948728832
Good thing it's time for a Thunder game! # ThunderUp # TheWestbrookWay # Believe,2016-10-30 19:10:47,792866366634110976
NW Lakers vs Thunder. # lakersforlife # lakeshow,2016-10-30 19:10:46,792866365153562624
Second time seeing the suuuper great @ Japanesehouse @ TheBullingdon. Face Like Thunder sounding enormous,2016-10-30 19:10:46,792866364809682945
Jogo do Thunder agora # ThunderUp,2016-10-30 19:10:39,792866335436988416
Thunder Lakers,2016-10-30 19:10:35,792866316872978433
Como mola la presentación de los Thunder...,2016-10-30 19:10:32,792866305556811780
assistindo Los Angeles Lakers vs Oklahoma City Thunder,2016-10-30 19:10:32,792866304411729920
Won't be pulling this shit at our house! Go # thunder # thunderuphttps://twitter.com/BenOsaze/status/791508229662478339 …,2016-10-30 19:10:30,792866295876235264
Lets LA. — watching Los Angeles Lakers vs Oklahoma City Thunder,2016-10-30 19:10:22,792866261202010112
viendo Los Angeles Lakers vs Oklahoma City Thunder,2016-10-30 19:10:20,792866255199956993
Vous écoutez Knaradio Martial arts riddim - fire - Capelton & Jah thunder http://karibieennewacoustik.com/playerkna ... http://fb.me/3wpy7j8Fv,2016-10-30 19:10:14,792866229497266177
"OKC Thunder: Oklahoma City, Dallas to battle for series lead # OklahomaCityThunder http://dlvr.it/MYgYqn # OklahomaCityThunder",2016-10-30 19:10:12,792866221645410304
LAkers/Thunder Cowboys/Eagles Walking Dead,2016-10-30 19:10:08,792866202448044032
Thunder vs lakers about to brack,2016-10-30 19:10:06,792866196215373824
Que bien suena ese Battle Sirens en la presentación de los Thunders!,2016-10-30 19:10:03,792866184807014400
Vamos de Lakers vs Thunder # NBA,2016-10-30 19:10:00,792866171699724288
Vous écoutez Knaradio Martial arts riddim - fire - Capelton & Jah thunder http://karibieennewacoustik.com/playerkna pic.twitter.com/507EP4ZRPh,2016-10-30 19:09:55,792866151747510272
Lakers vs Thunder # Lakeshow,2016-10-30 19:09:53,792866142582734848
A crane has arrived at Dreamworld and is parked near the Thunder River Rapids ride. @ TheTodayShow @ 9NewsBrisbanepic.twitter.com/H8cFQ4GfFE,2016-10-30 19:09:51,792866133032382465
lakers vs thunder # LakeShow,2016-10-30 19:09:51,792866132101242880
Algo me diz que esse uniforme vai zicar o Thunder.,2016-10-30 19:09:50,792866129219883008
Yo @ Dalton8Taylor # lakeshow finna whoop the thunder,2016-10-30 19:09:50,792866127328096256
@ okcthunder lets go thunder @ NBAcom,2016-10-30 19:09:47,792866116112642048
"""Thunder sofreu contra o Suns"" Suns 48-41 Warriors. Sei que é cedo (2ºQ) mas ta aí né, causar intriga.",2016-10-30 19:09:46,792866111205339136
always gonna steal your thunder watch me like a dark cloud pic.twitter.com/hBhy7dQefq,2016-10-30 19:09:44,792866104947408896
いやいや、リーダーは率先してやっていただかないと（ ´థ౪థ）,2016-10-30 19:09:39,792866084072198144
"Crack the Earth, Gods of Thunder Man and beast will be torn asunder Into the Fight I own the right To be the King of kings",2016-10-30 19:09:37,792866076002492416
Thunder over there? Man this rain doesn't wanna stop,2016-10-30 19:09:37,792866074513514496
Rain/Thunder tomorrow!,2016-10-30 19:09:32,792866051776282624
Ali just yelled at me because the thunder woke her up ... tf did I do,2016-10-30 19:09:28,792866034449612802
"Thunder, lightning, and pouring now",2016-10-30 19:09:26,792866026979557376
"shit y'all a massive storm is ab 2 strike my area like calling 4 hail, thunder, lightning. S.O.S pic.twitter.com/nPk1yLsgOH",2016-10-30 19:09:19,792865998164549633
Thunder game with my love. @Chesapeake Energy Arena https://www.instagram.com/p/BMNHkyRgEo9/,2016-10-30 19:09:18,792865995559936004
Thunder Snow lands the Criterium International for Bin Suroor http://ift.tt/2f6ZjRk # wotspic.twitter.com/Z5Nu0yJQyu,2016-10-30 19:09:17,792865991483162624
THUNDER UP OKC # InRussWeTrust # nowidowhatiwant,2016-10-30 19:09:15,792865980980396033
Pretty cool hype video when the court lights up as well. Well done Thunder game ops. pic.twitter.com/di6JNB0LYk – at Chesapeake Energy Arena,2016-10-30 19:09:13,792865974408007681
Game Time! — watching Oklahoma City Thunder vs Los Angeles Lakers,2016-10-30 19:09:11,792865966157725696
THUNDER FOR THE THUNDER GOD,2016-10-30 19:09:11,792865966011088896
Thunder continuing Sunset Sundays this season,2016-10-30 19:09:09,792865956594712576
viendo Los Angeles Lakers vs Oklahoma City Thunder,2016-10-30 19:09:05,792865939603677184
Thunder basketball then I get to watch my Boys take down the Eagles tonight # ThunderUp # CowboysNation,2016-10-30 19:09:04,792865935862358016
Thunder vs. Lakers 3/82 pic.twitter.com/IcpbVDBC11,2016-10-30 19:09:03,792865931659649024
“Don’t kiss me if you’re afraid of thunder. My life is a storm.”,2016-10-30 19:09:02,792865927339573248
the fucking luck i have i was almost there and it started pouring rain and there's fucking thunder,2016-10-30 19:09:02,792865925515120640
"Wow WARRIORS 1-1 but the THUNDER UNDEAFEATED""!!!!!",2016-10-30 19:09:00,792865918502174720
assistindo Los Angeles Lakers vs Oklahoma City Thunder,2016-10-30 19:08:58,792865912022044672
Thunder and lighting at JFK so may have to stay longer in the Virgin lounge – at John F. Kennedy International Airport (JFK),2016-10-30 19:08:56,792865902421217280
"Hey @ Broncos when Thunder runs south to north after we score, the logo on the flag is facing the wrong way. Please fix, thanks",2016-10-30 19:08:50,792865879138631680
Canmore Eagles 6 at Drayton Valley Thunder 2: http://bit.ly/2e2tmZN http://esportsdeskpro.com,2016-10-30 19:08:50,792865877628563456
Well I get to watch an hour of the Thunder game,2016-10-30 19:08:49,792865872511574016
"""What's up thunder thighs?!"" Flips me off** lol",2016-10-30 19:08:46,792865860692029440
yep. Near DE. It blew through here around 5:45. No thunder or lighting though,2016-10-30 19:08:45,792865857588326400
Let's Go Thunder https://twitter.com/OKCBR_/status/792865709902667782 …,2016-10-30 19:08:43,792865849237467136
Thunder usando laranja. Vou embora. Melhor ver o filme do Pelé.,2016-10-30 19:08:43,792865847656275968
Love watching the Thunder starting lineup # ThunderUp!!!!!!!,2016-10-30 19:08:43,792865847450537984
Thunder wearing the sunset orange jerseys for first time this season.,2016-10-30 19:08:43,792865847333097472
http://ift.tt/2epagxN Nike Air Jordan iv 4 Retro Black and Yellow Thunder size 13 Steelers 7day faya pic.twitter.com/KGk91G5D0v,2016-10-30 19:08:43,792865846095904769
Guess what time it is?? It's THUNDER UP TIME!! @ okcthunder,2016-10-30 19:08:41,792865839800160256
Los Angeles Lakers vs Oklahoma City Thunder - Watch Live Stream Online http://bit.ly/2f75dSs # LakeShow # Thunde…http://bit.ly/2f75dSs,2016-10-30 19:08:33,792865807072100352
えみりん、おはよーございます。ワタスにもその勇気は兼ね備えておりまへん(^_^;),2016-10-30 19:08:30,792865794841391104
Your Thunder should be pointed UPWARD.,2016-10-30 19:08:27,792865778802360320
Have we ever established why the Thunder have a wooly mammoth as their mascot?,2016-10-30 19:08:26,792865775769886720
Thunder up,2016-10-30 19:08:25,792865771164663808
That was the loudest thunder I've ever heard,2016-10-30 19:08:16,792865734766497793
LET'S GO THUNDER,2016-10-30 19:08:16,792865734682669056
いやぁ〜(●´艸`)面白いね！いいね やって私は見守るわ⚈้̤͡ ˌ̫̮ ⚈้̤͡,2016-10-30 19:08:10,792865707469918208
THUNDER STORM OUTTA NOWHERE!!!!,2016-10-30 19:08:08,792865701367275520
"JUST IN: Julian # Assange files protest with US Justice Dept over # Comey's action, claiming it stole his thunder. # TrumpComey16 # trumpolini",2016-10-30 19:08:06,792865693544964101
This thunder storm,2016-10-30 19:08:05,792865687681265665
Thunder gonna take that L against the Lakers tonight. Calling it.,2016-10-30 19:08:01,792865670513819648
Lakers vs Thunder # Lakeshow,2016-10-30 19:08:00,792865669092024321
Thunder wearing their Sunday bests today.,2016-10-30 19:07:57,792865655263375361
not sure it's the most reputable website but I've watched many a thunder game on it :),2016-10-30 19:07:55,792865645763276800
Bit of thunder out west and Wells is caught by Raval in the slips . Otago 270/5 # PlunketShieldpic.twitter.com/3rHncXvHBE,2016-10-30 19:07:53,792865636388962304
そんな～貴方に狙いを決めて…「white thunder」 https://twitter.com/azuma_gs/status/792863641255108608 …,2016-10-30 19:07:49,792865621520232448
go thunder # thunderuppic.twitter.com/CyCvIWDIfJ,2016-10-30 19:07:49,792865619419029504
APRESENTAÇÃO DO THUNDER EM OKLAHOMA CITY! # ThunderUp,2016-10-30 19:07:48,792865617648975876
Time to peep this Lakers-Thunder game. A lot of stuff coming on tv tonight lol,2016-10-30 19:07:37,792865571113086976
http://ift.tt/2eSfD9m # shoes Nike Air Jordan iv 4 Retro Black and Yellow Thunder size 13 Steelers 7day faya,2016-10-30 19:07:37,792865569531887616
Lakers vs Thunder live now in sports and action ch 23! -MiBE,2016-10-30 19:07:32,792865548560367616
Los Angeles Lakers vs Oklahoma City Thunder - Watch Live Stream Online http://bit.ly/2f75dSs # LakeShow # Thunde…http://bit.ly/2f75dSs,2016-10-30 19:07:25,792865518659244032
"It's pouring, thunder and lightening in Toms River... Drive carefully @",2016-10-30 19:07:24,792865517275152384
Go Thunder GO !,2016-10-30 19:07:22,792865509159145472
Los Angeles Lakers vs Oklahoma City Thunder - Watch Live Stream Online http://bit.ly/2f75dSs # LakeShow # ThunderUp,2016-10-30 19:07:18,792865491723386880
Beverley could return in time for a matchup with @ russwest44 and the Thunder on Nov. 16 https://twitter.com/MarkBermanFox26/status/792864749864099840 …,2016-10-30 19:07:18,792865489374416897
きのこりん、(*´ー｀)ﾉおはよう！丸坊主にする勇気をください(・∀・)（笑）,2016-10-30 19:07:16,792865480935485441
"Herr we're about an hour into it. Thunder, hail, wind and rain. It was a dark and stormy night ...",2016-10-30 19:07:14,792865474719670272
