text,date,id
|Time Out| Q2 |01:45| 54 | Oklahoma City Thunder 46 | Los Ángeles Lakers # ThunderUp,2016-10-30 19:59:58,792878745107492865
There is literally a thunder storm happening in NZ.,2016-10-30 19:59:57,792878740581654528
thunder/lakers....THUNDER UP! — watching Oklahoma City Thunder,2016-10-30 19:59:47,792878699595071489
I hear thunder.,2016-10-30 19:59:46,792878697015496704
Timeout. Thunder lead the Lakers 54-46 with 1:45 left until halftime.,2016-10-30 19:59:44,792878686982639616
this girl is really wearing a Kevin Durant okc shirt at the thunder game right now,2016-10-30 19:59:43,792878683505594369
what are you going to do if vine actually dies?,2016-10-30 19:59:37,792878657689808896
Loud thunder rain starting and the Sky's turning dark in Glenfield. At least it was a beautiful morning,2016-10-30 19:59:33,792878640920879105
Just casually sitting down outside on the grass for lunch as thunder rumbles in the background,2016-10-30 19:59:29,792878623225065473
It's ironic that the Thunder is now sharing the ball around and has better movement. That is the kind of game... http://fb.me/39NWLjfBZ,2016-10-30 19:59:23,792878597988052992
"Oct 30 Game Score: A - Minor Peewee A - 1, Halton Hills Thunder Red - 3 http://tinyurl.com/j27n82u",2016-10-30 19:59:21,792878589343588352
Thunder!!! @ greylynnweather @ PhilipDuncan thought it was brewing last hour,2016-10-30 19:59:11,792878549011083265
Thunder playing best half of the year so far. Great ball movement,2016-10-30 19:59:01,792878507487399936
Man Billy Donovan got thunder playin nice !,2016-10-30 19:58:59,792878497916006400
I'm loving this ball movement from the thunder,2016-10-30 19:58:58,792878495198175232
"@ Kingme901 $20 & 25k FUT on Cowboys -5, Cubs + Thunder & GSW ML @3.3 odds, GL",2016-10-30 19:58:50,792878461559959552
# Thunder Ball movement has been everything!!! Let's go!,2016-10-30 19:58:48,792878451065696256
# Lakers 42 # Thunder 50 | 2do Cto | # SomosLakersMX,2016-10-30 19:58:36,792878402608910336
"Raise your words, not voice. It is rain that grows flowers, not thunder. - Rumi # quote",2016-10-30 19:58:31,792878380853108736
# bersa thunder 380 http://pof-com-login.xyz/pof-com/amuter.html … # jobs in tri cities wa,2016-10-30 19:58:24,792878350008279040
"Mano essa internet tem que volta logo, quero muito ver o thunder sem o durant",2016-10-30 19:58:23,792878347042877440
!WeatherAlert -NOW in # AUCKLAND - Watch for heavy # hail storms & thunderstorms. Remain indoors if thunder near you.,2016-10-30 19:58:21,792878340159844352
Newest Country Thunder Saskatchewan fan found at @ TheSJHL Melfort Mustangs game ! @ countrythunder # CountryThunder http://fb.me/7vOhY7mbs,2016-10-30 19:58:14,792878310728486912
http://ift.tt/2fkWlh1 # sale Nike Jordan Retro 4 Thunder Yellow pic.twitter.com/TPfWSrUJrK,2016-10-30 19:58:13,792878305359847424
次の @ YouTube 再生リストに動画を追加しました: http://youtu.be/Mzq6cH4IaeM?a War thunder,2016-10-30 19:58:13,792878304323776512
Lakers - Thunder # DormirEsDeCobardes,2016-10-30 19:58:07,792878280219168768
It's impossible for me to do homework while the Thunder are playing,2016-10-30 19:57:59,792878244106121216
"Que absurdo esse time do # thunder , eles não cansam de correr ?",2016-10-30 19:57:58,792878243288317952
"-she returns the gentle kiss with a light chuckle, her hooves rubbing at your waist gently- ""want to join me for dinner?""",2016-10-30 19:57:57,792878239031042048
アップで抜かれるしこりん(笑),2016-10-30 19:57:57,792878238909333504
i love me some thunder basketball,2016-10-30 19:57:49,792878203501109248
I can't tell if I can hear thunder or my neighbour pulling his rubbish bin up his driveway,2016-10-30 19:57:40,792878165370691584
"Fun on the road competing with giant hailstones, now thunder is booming.",2016-10-30 19:57:37,792878153890881536
Only took them 3 games to get to Thunder level. That's pretty quick!,2016-10-30 19:57:26,792878107090821120
Lakers vs Thunder game,2016-10-30 19:57:20,792878082080272385
We gonna lose to the thunder tbh # Warriors,2016-10-30 19:57:16,792878067110871040
Só porque eu falei....hahaha O LA Lakers acertou 2 bolas de 3 e reagiu rapidamente. Diferença do Thunder cai para 5 pontos. # LakeShow,2016-10-30 19:57:06,792878023020347393
Want 10 free Lyft rides added to your new Lyft account? << LyftOfferCode MINX >> Thunder Valley Casino Resort,2016-10-30 19:57:03,792878011926384640
"Artist: White Zombie, Album: Nightcrawlers: The KMFDM Remixes, Track: Thunder Kiss '65",2016-10-30 19:57:02,792878006654083072
okc all the way. Thunder win by 7 behind a russ triple double,2016-10-30 19:56:38,792877904560525312
Los Angeles Lakers 42 - Oklahoma City Thunder 47,2016-10-30 19:56:34,792877890509602816
watching Los Angeles Lakers vs Oklahoma City Thunder,2016-10-30 19:56:33,792877884994183168
I can't wait till the Warriors play the Cavs on Christmas. But I'm more excited for the next week Thursday game against the Thunder.,2016-10-30 19:56:24,792877848738488321
＿人人人＿ ＞ 囚人 ＜ ￣Y^Y^Y^￣,2016-10-30 19:56:19,792877827347521536
someone straight up came dressed as deadpool to the thunder game...,2016-10-30 19:56:05,792877766471520256
Chyba po # WarriorsSuns wlącze # GrizzliesWizards...bo # Thunder rozjada # Lakers bez problemu na to wyglada,2016-10-30 19:56:01,792877751132909568
# thunder # okc — watching Los Angeles Lakers vs Oklahoma City Thunder,2016-10-30 19:56:01,792877750168281088
NBA maçları hangi kanalda? Oklahoma City Thunder maçı izle # ŞuAnKalbimdenSöylüyorum # BeklenenGerçek # BazenHayat http://www.sporzone.com/nba-maclari-hangi-kanalda-31-ekim-2016.html …,2016-10-30 19:55:51,792877709798014976
NBA maçları hangi kanalda? Oklahoma City Thunder maçı izle # ŞuAnKalbimdenSöylüyorum # BeklenenGerçek # BazenHayat http://www.sporzone.com/nba-maclari-hangi-kanalda-31-ekim-2016.html …,2016-10-30 19:55:51,792877709680607232
NBA maçları hangi kanalda? Oklahoma City Thunder maçı izle # ŞuAnKalbimdenSöylüyorum # BeklenenGerçek # BazenHayat http://www.sporzone.com/nba-maclari-hangi-kanalda-31-ekim-2016.html …,2016-10-30 19:55:51,792877709672284161
NBA maçları hangi kanalda? Oklahoma City Thunder maçı izle # ŞuAnKalbimdenSöylüyorum # BeklenenGerçek # BazenHayat http://www.sporzone.com/nba-maclari-hangi-kanalda-31-ekim-2016.html …,2016-10-30 19:55:51,792877709567356928
NBA maçları hangi kanalda? Oklahoma City Thunder maçı izle # ŞuAnKalbimdenSöylüyorum # BeklenenGerçek # BazenHayat http://www.sporzone.com/nba-maclari-hangi-kanalda-31-ekim-2016.html …,2016-10-30 19:55:51,792877709542162433
NBA maçları hangi kanalda? Oklahoma City Thunder maçı izle # ŞuAnKalbimdenSöylüyorum # BeklenenGerçek # BazenHayat http://www.sporzone.com/nba-maclari-hangi-kanalda-31-ekim-2016.html …,2016-10-30 19:55:51,792877709533798400
NBA maçları hangi kanalda? Oklahoma City Thunder maçı izle # ŞuAnKalbimdenSöylüyorum # BeklenenGerçek # BazenHayat http://www.sporzone.com/nba-maclari-hangi-kanalda-31-ekim-2016.html …,2016-10-30 19:55:51,792877709466689536
NBA maçları hangi kanalda? Oklahoma City Thunder maçı izle # ŞuAnKalbimdenSöylüyorum # BeklenenGerçek # BazenHayat http://www.sporzone.com/nba-maclari-hangi-kanalda-31-ekim-2016.html …,2016-10-30 19:55:51,792877709466673152
NBA maçları hangi kanalda? Oklahoma City Thunder maçı izle # ŞuAnKalbimdenSöylüyorum # BeklenenGerçek # BazenHayat http://www.sporzone.com/nba-maclari-hangi-kanalda-31-ekim-2016.html …,2016-10-30 19:55:51,792877709462568960
NBA maçları hangi kanalda? Oklahoma City Thunder maçı izle # ŞuAnKalbimdenSöylüyorum # BeklenenGerçek # BazenHayat http://www.sporzone.com/nba-maclari-hangi-kanalda-31-ekim-2016.html …,2016-10-30 19:55:51,792877709449949184
NBA maçları hangi kanalda? Oklahoma City Thunder maçı izle # ŞuAnKalbimdenSöylüyorum # BeklenenGerçek # BazenHayat http://www.sporzone.com/nba-maclari-hangi-kanalda-31-ekim-2016.html …,2016-10-30 19:55:51,792877709445693440
NBA maçları hangi kanalda? Oklahoma City Thunder maçı izle # ŞuAnKalbimdenSöylüyorum # BeklenenGerçek # BazenHayat http://www.sporzone.com/nba-maclari-hangi-kanalda-31-ekim-2016.html …,2016-10-30 19:55:51,792877709441589248
NBA maçları hangi kanalda? Oklahoma City Thunder maçı izle # ŞuAnKalbimdenSöylüyorum # BeklenenGerçek # BazenHayat http://www.sporzone.com/nba-maclari-hangi-kanalda-31-ekim-2016.html …,2016-10-30 19:55:51,792877709441523716
NBA maçları hangi kanalda? Oklahoma City Thunder maçı izle # ŞuAnKalbimdenSöylüyorum # BeklenenGerçek # BazenHayat http://www.sporzone.com/nba-maclari-hangi-kanalda-31-ekim-2016.html …,2016-10-30 19:55:51,792877709437374465
NBA maçları hangi kanalda? Oklahoma City Thunder maçı izle # ŞuAnKalbimdenSöylüyorum # BeklenenGerçek # BazenHayat http://www.sporzone.com/nba-maclari-hangi-kanalda-31-ekim-2016.html …,2016-10-30 19:55:51,792877709437337602
NBA maçları hangi kanalda? Oklahoma City Thunder maçı izle # ŞuAnKalbimdenSöylüyorum # BeklenenGerçek # BazenHayat http://www.sporzone.com/nba-maclari-hangi-kanalda-31-ekim-2016.html …,2016-10-30 19:55:51,792877709437333504
NBA maçları hangi kanalda? Oklahoma City Thunder maçı izle # ŞuAnKalbimdenSöylüyorum # BeklenenGerçek # BazenHayat http://www.sporzone.com/nba-maclari-hangi-kanalda-31-ekim-2016.html …,2016-10-30 19:55:51,792877709433180161
NBA maçları hangi kanalda? Oklahoma City Thunder maçı izle # ŞuAnKalbimdenSöylüyorum # BeklenenGerçek # BazenHayat http://www.sporzone.com/nba-maclari-hangi-kanalda-31-ekim-2016.html …,2016-10-30 19:55:51,792877709428940800
NBA maçları hangi kanalda? Oklahoma City Thunder maçı izle # ŞuAnKalbimdenSöylüyorum # BeklenenGerçek # BazenHayat http://www.sporzone.com/nba-maclari-hangi-kanalda-31-ekim-2016.html …,2016-10-30 19:55:51,792877709428924421
NBA maçları hangi kanalda? Oklahoma City Thunder maçı izle # ŞuAnKalbimdenSöylüyorum # BeklenenGerçek # BazenHayat http://www.sporzone.com/nba-maclari-hangi-kanalda-31-ekim-2016.html …,2016-10-30 19:55:51,792877709428916224
NBA maçları hangi kanalda? Oklahoma City Thunder maçı izle # ŞuAnKalbimdenSöylüyorum # BeklenenGerçek # BazenHayat http://www.sporzone.com/nba-maclari-hangi-kanalda-31-ekim-2016.html …,2016-10-30 19:55:51,792877709424820228
NBA maçları hangi kanalda? Oklahoma City Thunder maçı izle # ŞuAnKalbimdenSöylüyorum # BeklenenGerçek # BazenHayat http://www.sporzone.com/nba-maclari-hangi-kanalda-31-ekim-2016.html …,2016-10-30 19:55:51,792877709420625920
NBA maçları hangi kanalda? Oklahoma City Thunder maçı izle # ŞuAnKalbimdenSöylüyorum # BeklenenGerçek # BazenHayat http://www.sporzone.com/nba-maclari-hangi-kanalda-31-ekim-2016.html …,2016-10-30 19:55:51,792877709412208640
NBA maçları hangi kanalda? Oklahoma City Thunder maçı izle # ŞuAnKalbimdenSöylüyorum # BeklenenGerçek # BazenHayat http://www.sporzone.com/nba-maclari-hangi-kanalda-31-ekim-2016.html …,2016-10-30 19:55:51,792877709408014336
NBA maçları hangi kanalda? Oklahoma City Thunder maçı izle # ŞuAnKalbimdenSöylüyorum # BeklenenGerçek # BazenHayat http://www.sporzone.com/nba-maclari-hangi-kanalda-31-ekim-2016.html …,2016-10-30 19:55:51,792877709399588864
NBA maçları hangi kanalda? Oklahoma City Thunder maçı izle # ŞuAnKalbimdenSöylüyorum # BeklenenGerçek # BazenHayat http://www.sporzone.com/nba-maclari-hangi-kanalda-31-ekim-2016.html …,2016-10-30 19:55:51,792877709395394560
NBA maçları hangi kanalda? Oklahoma City Thunder maçı izle # ŞuAnKalbimdenSöylüyorum # BeklenenGerçek # BazenHayat http://www.sporzone.com/nba-maclari-hangi-kanalda-31-ekim-2016.html …,2016-10-30 19:55:51,792877709395361792
NBA maçları hangi kanalda? Oklahoma City Thunder maçı izle # ŞuAnKalbimdenSöylüyorum # BeklenenGerçek # BazenHayat http://www.sporzone.com/nba-maclari-hangi-kanalda-31-ekim-2016.html …,2016-10-30 19:55:51,792877709391175680
NBA maçları hangi kanalda? Oklahoma City Thunder maçı izle # ŞuAnKalbimdenSöylüyorum # BeklenenGerçek # BazenHayat http://www.sporzone.com/nba-maclari-hangi-kanalda-31-ekim-2016.html …,2016-10-30 19:55:51,792877709387005952
NBA maçları hangi kanalda? Oklahoma City Thunder maçı izle # ŞuAnKalbimdenSöylüyorum # BeklenenGerçek # BazenHayat http://www.sporzone.com/nba-maclari-hangi-kanalda-31-ekim-2016.html …,2016-10-30 19:55:51,792877709378654209
NBA maçları hangi kanalda? Oklahoma City Thunder maçı izle # ŞuAnKalbimdenSöylüyorum # BeklenenGerçek # BazenHayat http://www.sporzone.com/nba-maclari-hangi-kanalda-31-ekim-2016.html …,2016-10-30 19:55:51,792877709378609152
NBA maçları hangi kanalda? Oklahoma City Thunder maçı izle # ŞuAnKalbimdenSöylüyorum # BeklenenGerçek # BazenHayat http://www.sporzone.com/nba-maclari-hangi-kanalda-31-ekim-2016.html …,2016-10-30 19:55:51,792877709336641536
It wouldn't be a stretch to call Steven Adams the 2nd best player drafted in the 2013 # NBA draft behind the The Greek Freak. # Thunder,2016-10-30 19:55:49,792877701283454976
Good to see young gun @ LAKERS hanging tough with veteran star Westbrook & Thunder! # LakersNation # lakeshow,2016-10-30 19:55:48,792877698548834305
@ BreakfastSam Here in @ ILoveTakapuna I just heard a clap of Thunder.....,2016-10-30 19:55:46,792877689782743041
Nothing makes me more happy than watching the thunder play,2016-10-30 19:55:44,792877678973980673
I realize that but your goal as a team shouldn't be the OKC Thunder lol,2016-10-30 19:55:41,792877667393671168
Timeout! Lakers 42-47 Thunder.,2016-10-30 19:55:33,792877632551579649
This thunder is giving me the feels,2016-10-30 19:55:33,792877632324984832
"@ bmolleson82 @ ThunderVegas had an awesome night seeing Thunder from down under in Reno, it was awesome meeting the newbies of thunder!",2016-10-30 19:55:25,792877601815535618
|Time Out| Q2 |04:16| 47 | Oklahoma City Thunder 42 | Los Ángeles Lakers # ThunderUp,2016-10-30 19:55:24,792877594769260544
Holy was that thunder? No aye?,2016-10-30 19:55:17,792877564926713858
Randle's speed appears to be a problem for the Thunder's bigs,2016-10-30 19:55:16,792877560573100033
I have so many mixed emotions when the Lakers and Thunder play lol,2016-10-30 19:55:15,792877556600930304
"Thunder oh my, All Hallows Eve you are putting on a show.",2016-10-30 19:55:13,792877551722962944
Thunder taking that dub https://twitter.com/jhoops_7/status/792868836873609216 …,2016-10-30 19:55:12,792877545989345281
Defensive is no where to be found. Thunder ahead 47-42. # ThunderUP,2016-10-30 19:55:03,792877508148523012
Thunder timeout. 4:16 left in the quarter. OKC leads 47-42.,2016-10-30 19:54:56,792877477798420480
"@ Lakers are taking too many 3's, bailing out the Thunder defense. Work the ball inside. Try to limit Westbrook. # LakersNation # Lakers",2016-10-30 19:54:54,792877471179964416
Julius Randle has 3 and 1's in the first half...just a thing # Lakers # Thunder,2016-10-30 19:54:52,792877461969235969
"Hey guys Mario here talking about how much I hate the Cavs and the Thunder, wait Waiters is on the Heat? I LOVE HIM!",2016-10-30 19:54:51,792877458382991360
Timeout Thunder. Lakers cut it to 47-42 with 4:16 until half,2016-10-30 19:54:50,792877453324668928
"again, it's the third game. Kerr won't let this be thunder 2.0. I loved Billy D and Scotty B but Kerr will adjust.",2016-10-30 19:54:43,792877425961029632
"Randle having another really, really good game. He's annihilating his Thunder PF counterparts.",2016-10-30 19:54:42,792877419795447808
Thunder up 47-42 https://twitter.com/abscbnsports/status/792863892263149568 …,2016-10-30 19:54:41,792877414619553792
heavy thunder,2016-10-30 19:54:40,792877413466148864
But it looks like golden state has turned into the thunder the way durant is taking all the shots,2016-10-30 19:54:39,792877407405477889
Drinking a Tropical Thunder by @ dbbrewingco @BrewerShirts Studios — http://untp.beer/s/c377773272,2016-10-30 19:54:34,792877386505326593
"The thunder are 1 good shooter from being unstoppable, @ KlayThompson ?",2016-10-30 19:54:28,792877361284853761
おはようございますみなさま,2016-10-30 19:54:26,792877353827315712
watching Los Angeles Lakers vs Oklahoma City Thunder,2016-10-30 19:54:25,792877347959701504
Maluco ta na Chesapeake energy arena cm sua mina e vendo uma vitória do Thunder Esse venceu na vida,2016-10-30 19:54:24,792877345287856128
"End of the 1st: THUNDER 30 LAKERS 24. Westbrook 6p/5a/2reb, Adams 6p/4reb, Oladipo 5p.",2016-10-30 19:54:23,792877338304376834
Thunder looking good,2016-10-30 19:54:14,792877303856500736
Thunder and lightning= i get a good nights rest,2016-10-30 19:54:12,792877293962141696
Great win today by the 9/10 U American Division Berkeley Thunder! They are moving on to the District 18 CFBL... http://fb.me/7LokJmbZi,2016-10-30 19:54:12,792877291936292864
Happy streaming exists. Lakers-Thunder started at 4. Eagles-Cowboys at 5:20 and Game 5 of the World Series at 5.,2016-10-30 19:54:11,792877290178744320
watching Los Angeles Lakers vs Oklahoma City Thunder,2016-10-30 19:54:08,792877278594228225
Westbrook with the 50ft bounce pass to Oladipo for the bucket. # nba # thunder https://vine.co/v/5ppmV7jzlih,2016-10-30 19:54:06,792877268649541632
"Nessa brincadeira, o Thunder já abriu 11 pontos...",2016-10-30 19:54:05,792877266481152000
If Morrow Can Give The # THUNDER 15pts A NITE...... SmHhh That Would Be SWEET...,2016-10-30 19:54:05,792877262777581572
Premier vrai bon match d'Olapipo avec le Thunder là ce soir. Intéressant.,2016-10-30 19:54:00,792877244146446336
"Adams gets beat on the dribble, and he's called for his 2nd foul. Lakers cut the Thunder lead to 8.",2016-10-30 19:54:00,792877242397241344
Lakers +9 @Thunder Season 4-4-0,2016-10-30 19:54:00,792877242133032960
Me bleed purple and gold long time. the whole family say lakers — watching Los Angeles Lakers vs Oklahoma City Thunder,2016-10-30 19:53:59,792877238563790848
Rumbling thunder in the fading light.,2016-10-30 19:53:58,792877236009340929
Run de 15 à 3 pour le Thunder qui mène désormais 47 à 33 avec 5 minutes avant la mi-temps.,2016-10-30 19:53:57,792877230020001792
# Lakers 33 # Thunder 47 | 2do Cto | # SomosLakersMX,2016-10-30 19:53:56,792877228660883456
おはよう〜☀︎ 昨日は魔法祭ありがとぅございました！ さてさての今日は打ち上げがTHUNDERであるよ 入場無料でたこ焼き食べ放題とか最高じゃない？(いま知った) 行こう〜！！ https://twitter.com/thundertokyo/status/792848961434296320 …,2016-10-30 19:53:50,792877202698227712
Thunder Snow boost for Saeed Bin Suroor after colt lands the Criterium International http://dailym.ai/2fuwJ0u,2016-10-30 19:53:48,792877194301153280
"@ sportsman8811 $10 on GSW & Thunder to win 4Th Quarters @1.6 odds, GL",2016-10-30 19:53:43,792877171433938944
Thunder just took flight.,2016-10-30 19:53:43,792877170557345793
@ GabrielPri14 digita no YouTube Lakers x Thunder e usa filtro so pra ao vivo Aparece uns 3,2016-10-30 19:53:38,792877153398521856
Thunder buddy where you at????,2016-10-30 19:53:29,792877113774895104
"""thunder""ous you say?",2016-10-30 19:53:25,792877097031114753
Je suis vraiment trop cuit. Bonne nuit et force au Thunder.,2016-10-30 19:53:25,792877096586645504
"Lakers in completo blackout, i Thunder piazzano un parziale di 15-3 # NBA",2016-10-30 19:53:13,792877048054243329
Looking good so far. It's always good to beat Lakers — watching Oklahoma City Thunder,2016-10-30 19:53:08,792877026705338368
"Man, that was a tough game to lose. It's all good though. Time for the Thunder. # GoPackGo and # ThunderUp",2016-10-30 19:53:07,792877019436494848
Love seeing A-Mo getting minutes for the # Thunder.,2016-10-30 19:53:04,792877009642717184
watching Los Angeles Lakers vs Oklahoma City Thunder,2016-10-30 19:53:04,792877009286361088
"The Colts loss was tough today, but my goodness, the Thunder are making me smile right now. Best half of basketball they've played all year!",2016-10-30 19:53:02,792877001463902208
"As we all expected, the Thunder's best lineup so far includes Lauvergne and Morrow pic.twitter.com/cls7ZlZz0H",2016-10-30 19:52:52,792876960162525184
This game is about swinging momentum... The momentum is firmly with the Thunder # ThunderUp,2016-10-30 19:52:51,792876954894688257
"Permitimos uma infiltração de Morrow, o que é bem preocupante. Thunder disparou, 47-32.",2016-10-30 19:52:45,792876929942691840
# Lakers are getting good looks offensively but can't seem to put them in. They're being held to one shot and # Thunder getting out on run,2016-10-30 19:52:32,792876876104556544
# Thunder up 47-33 putting a lot of pressure on # Lakers now,2016-10-30 19:52:30,792876866080153600
Thunder lookin real nice man,2016-10-30 19:52:27,792876851899146240
うん…すでに写らないことは確定してる…,2016-10-30 19:52:23,792876837701419013
Umarangkada na ang Thunders # Thunderup # senpai,2016-10-30 19:52:21,792876826674593793
Timeout Lakers 33-47 Thunder,2016-10-30 19:52:17,792876813366267904
We need to get Randle some looks. It looks like the thunder have an unlimited amount of Ryan Anderson clones on their roster # lakers,2016-10-30 19:52:07,792876769464373249
"Thunder go on an 18-4 run with Calderon on the floor, coincidence? I don't think so.",2016-10-30 19:52:05,792876760681545728
Thunder are going to be so exciting # ThunderUp,2016-10-30 19:52:01,792876743132459008
Easily the best the # Thunder has looked so far in the young season. 48-33 2nd q.,2016-10-30 19:52:00,792876742360739840
what if the thunder end up with a better record than the warriors lol headlines going be crazy,2016-10-30 19:51:59,792876737751375873
Crazy concept: Anthony Morrow comes in the game ... scores 5 quick points. Needs to be in rotation nightly. # Thunder,2016-10-30 19:51:55,792876718096650240
"Alright, they're starting to bring the thunder # LoveBadJokes",2016-10-30 19:51:54,792876717119410176
"Que rápidos son estos nuevos Thunder, por favor. Westbrook y Oladipo te matan en la contra.",2016-10-30 19:51:54,792876714246504449
# Thunder chillin on these Lakers,2016-10-30 19:51:50,792876698488365056
Lakers down 15 to the Thunder,2016-10-30 19:51:50,792876697343389696
Timeout! Lakers 32-47 Thunder.,2016-10-30 19:51:50,792876697246892033
thunder are flying,2016-10-30 19:51:49,792876695342710784
regarde Los Angeles Lakers vs Oklahoma City Thunder,2016-10-30 19:51:45,792876677487587328
"Lakers kompletnie nie mogą się wstrzelić, Thunder demolują ich w kontrach, 48-33",2016-10-30 19:51:40,792876657770131456
"# thunder keeping Dion Waiters memory alive with all these ""AND ONE"" yells. Love it. # ThunderUp",2016-10-30 19:51:39,792876652594274304
|Time Out| Q2 |05:09| 48 | Oklahoma City Thunder 33 | Los Ángeles Lakers # ThunderUp,2016-10-30 19:51:38,792876646923632640
"I think I should put on my résumé that I came up with the great kickball team name of ""Jake's GPO Tenor Thunder"" We were awful btw",2016-10-30 19:51:37,792876645426364417
I added a video to a @ YouTube playlist http://youtu.be/UDAFCN9PQmA?a Veteransview4u- Talk and Tie live 10/30/2016 Thunder Creek Streamer,2016-10-30 19:51:31,792876618897240068
The OKLAHOMA CITY THUNDER will be in the Western conference finals once again ! Just watch,2016-10-30 19:51:30,792876613130186752
"I should've went to the Laker & Thunder Game , to see my dude Swaggy P. Lol",2016-10-30 19:51:30,792876612475691008
I always wondered why the Thunder didn't play Anthony Morrow. I know he's not great on defense but those teams have to honor him on offense,2016-10-30 19:51:28,792876606242992129
Thunder bout to buss our ass lol,2016-10-30 19:51:26,792876597988593664
And the thunder are kicking our ass why the hell am I not surprised..... Told yall these niggas always tease us,2016-10-30 19:51:23,792876586349522944
"Lavergne for the Oklahoma City Thunder is the updated, young version of Nick Collison.",2016-10-30 19:51:22,792876581060349952
"if you're happy then you're happy bro, don't let bitches steal your thunder",2016-10-30 19:51:22,792876579076444160
Thunder have established a rhythm and the Lakers can't buy a bucket. Morrow provided a nice little spark we all knew he could.,2016-10-30 19:51:21,792876577163849728
This is why the Lakers hate going to OKC. — watching Los Angeles Lakers vs Oklahoma City Thunder at Rancho... http://fb.me/66yc945WX,2016-10-30 19:51:21,792876577008877568
"Lakers muito mal nos arremessos, o que vai deixando o time pra trás dadas as transições do Thunder.",2016-10-30 19:51:16,792876556565831680
Tweets that confuse me during Thunder games https://twitter.com/akennedy41/status/792876271076151296 …,2016-10-30 19:51:13,792876543710068736
"Morrow is not disappointing, 5 pts in 3 minutes. Thunder up 47-32 in the 2nd quarter. # News9Thunder",2016-10-30 19:51:13,792876542493810688
thunder atropelando o lakers,2016-10-30 19:51:12,792876539599810560
Thunder on 15-3 # ThunderUp,2016-10-30 19:51:11,792876533698277376
Lets go lakers lets get a win vs thunder....,2016-10-30 19:51:09,792876526895177728
Thunder pulling away as the Lakers start missing open shots. Anthony Morrow with a three to give OKC a 15-point lead.,2016-10-30 19:51:09,792876526480003072
Timeout LA. Thunder lead 47-32 with 5:09 until halftime.,2016-10-30 19:51:08,792876524139450368
tferriss: Jamie Foxx Part 2 – Bringing the Thunder http://bitly.com/2ecvWzq,2016-10-30 19:51:08,792876520754802688
Damn warriors up by 4 against a trash team and thunder up by 12 against a good team. # Warriors are trashpic.twitter.com/pJqPuCwF62,2016-10-30 19:51:06,792876514672988160
Damn the Thunder caught fire,2016-10-30 19:51:03,792876502761209856
