text,date,id
Final de primeiro quarto! Lakers 24-30 Thunder pic.twitter.com/JnZarurd18,2016-10-30 19:36:42,792872888772751362
wallah il te ressemble,2016-10-30 19:36:40,792872880547692544
"There are few things more exciting than being at a Thunder game, you guys.",2016-10-30 19:36:34,792872856157728768
Wednesday circled this week as our wet weather day. May hear some early November thunder too as system approaches. # kswx # mowxpic.twitter.com/4tbhBIXddV,2016-10-30 19:36:30,792872840747900928
"End of 1st: Thunder 30, Lakers 24.",2016-10-30 19:36:23,792872809882005504
|FINAL Q1| Q1 |00:00| 30 | Oklahoma City Thunder 24 | Los Ángeles Lakers # ThunderUp,2016-10-30 19:36:23,792872809085173760
"End of first quarter: Thunder 30, Lakers 24. Enes Kanter 8 p, 5 mins. Russell Westbrook 6 p, 5 a. Steven Adams 6 p.",2016-10-30 19:36:22,792872805914161152
"""oh not much dear, you?"" -she replies, nuzzling your cheek gently-",2016-10-30 19:36:22,792872805104660480
"When the thunder gets too loud, just hide under a table. https://www.instagram.com/p/BMNKqP_hYhX/",2016-10-30 19:36:17,792872785999650816
"Thunder 30 Lakers 24 after 1st quarter, Russ-6pts, Adams-6pts, Kanter-8pts. # News9Thunder",2016-10-30 19:36:17,792872783441039360
"Vaya ""corre-calles"" el Lakers-Thunder. A ver si mejora...",2016-10-30 19:36:16,792872779083288576
End of 1st # Thunder up 30-24. Kanter leading the way with 8pts,2016-10-30 19:36:15,792872776419807232
"End of the first. 30-24, Thunder. Westbrook 6 points, 5 assists. Adams 6 points, 2 boards. Kanter 8 points in 5 minutes on 4-4 shooting.",2016-10-30 19:36:14,792872771919294464
# Nbagames end of 1st quarter Lakers 24 Thunders 30 # senpai,2016-10-30 19:36:13,792872770019299328
Lakers 24 Thunder 30 End of 1Q,2016-10-30 19:36:13,792872768886886400
The thunder big men gone give a lot of teams trouble,2016-10-30 19:36:13,792872767548948480
"End of 1: Thunder 30, Lakers 24, Lakers defense 0.",2016-10-30 19:36:12,792872765544026114
We LOVE Big Thunder Mountain at @ DisneylandToday! See?pic.twitter.com/2xuzTHJpoR,2016-10-30 19:36:10,792872757499273216
"Oct 30 Game Score: Cavalcade Bantam Rep - 7, Oro Thunder - 0 http://tinyurl.com/htgy93g",2016-10-30 19:36:09,792872751665123329
watching Oklahoma City Thunder vs Los Angeles Lakers,2016-10-30 19:36:09,792872749995692032
I liked a @ YouTube video http://youtu.be/cp8OgAtDy-0?a LIVE HD: LOS ANGELES LAKERS vs OKLAHOMA CITY THUNDER,2016-10-30 19:36:08,792872748586373120
"Enes Kanter is a Bonafide Top 5 Post Player in the @ NBA, but the Thunder just can't seem to start him!! # ThunderUp",2016-10-30 19:36:06,792872739295985665
"tonight's a good night because Falcons won, thunder is playing, and the World Series is on",2016-10-30 19:36:03,792872726176239616
"Haikyuu stole cbx's thunder last night, at least for me",2016-10-30 19:35:59,792872707704496128
Lakers-Thunder,2016-10-30 19:35:51,792872676452950016
좋은 아침 아 맞네 오늘 할로윈!! 오늘 진짜 춥대ㅠㅠㅠ 아카아시도 외출할 일 있으면 옷 따뜻하게 챙겨입고! 난 수면양말이랑 찜질팩이랑 담요 바리바리 싸들고 가..,2016-10-30 19:35:50,792872672296210432
OKC Thunder announcer just compared Enes Kanter to Hakeem...,2016-10-30 19:35:44,792872646127988737
E o Lakers que já ta perdendo pro Thunder,2016-10-30 19:35:43,792872641627643905
Kyle singler is probably the worst player in the NBA. I would rather the Thunder play with 4 players than with him on the floor,2016-10-30 19:35:42,792872640167997440
My lakers giving the thunder they first L tonight,2016-10-30 19:35:40,792872631871561728
Im a Thunder fan from now on! And a hard spectator of the T-wolves and Bulls,2016-10-30 19:35:34,792872606546350080
"Thunder season is back and so are @ Exhoopsmc's key phrases: ""tough call"", ""partner"", ""I'm gonna tell you something...""",2016-10-30 19:35:23,792872556990636032
"If you don't love the energy that @ russwest44 is bringing to the Thunder, I question your fanhood. # russistough # WeAreThunder # thunderup",2016-10-30 19:35:22,792872555799465984
thunder up,2016-10-30 19:35:19,792872543426273280
The Thunder have exercised their third-year rookie scale options on Josh Huestis and Cameron Payne. http://www.espn.com/espn/now?nowId=21-0584142612613566493-4 …,2016-10-30 19:35:13,792872517215977472
Thunder with the active hands on both ends. Love it,2016-10-30 19:35:12,792872511012610048
I wonder if Thunder fans look at Ingram and die a little bit inside.,2016-10-30 19:35:08,792872494608752640
Oklahoma City Thunder - LA Lakers http://www.eurosport.com/basketball/nba/2016-2017/live-oklahoma-city-thunder-l.a.-lakers_mtc899542/live.shtml …,2016-10-30 19:35:08,792872493740531712
That's what I'm talking about this is some great Thunder basketball so far # ThunderUp,2016-10-30 19:35:07,792872491819630596
We just had a Kanter/Olajuwon comp on this broadcast so it's really all happening for this Thunder team.,2016-10-30 19:35:05,792872485154877440
0-1. Let's see if the Thunder get the W tonight.,2016-10-30 19:35:05,792872483154264066
Aidan OBrien favourites beaten at Saint-Cloud as Thunder Snow shows his class https://www.yournews365.com/Aidan-O---Brien-favourites-beaten-at-Saint-Cloud-as-Thunder-Snow-shows-his-class?code=b73c2d22763d1ce2143a3755c1d0ad3a …,2016-10-30 19:35:04,792872479228366849
"Lakers rookie Brandon Ingram (sore right knee) will play against the Thunder, says Lakers coach Luke Walton. http://www.espn.com/espn/now?nowId=21-0584494352177306515-4 …",2016-10-30 19:35:03,792872474081845248
Boy these Thunder announcers working the game for Fox are not bearable,2016-10-30 19:34:56,792872443626958849
# Lakers 22 # Thunder 30 | 1er Cto | # SomosLakersMX,2016-10-30 19:34:48,792872411993632768
"#4: Legacy, Vol. 2: Legacy, Vol. 2 ~ Celtic Thunder (Artist) (59) Release Date: August 12, 2016 Buy… https://goo.gl/fb/OHO0Od # World # Music",2016-10-30 19:34:46,792872401650405376
Thunder are lucky the Lakers have the worst shot selection ever!,2016-10-30 19:34:42,792872385758191616
"Le Thunder sans Durant, c'est tellement nul à 3pt que j'lache une larme à chaque fois qu'ils en mettent un",2016-10-30 19:34:41,792872382100869120
Vamonos a ver al Thunder a ver si ellos si ganan,2016-10-30 19:34:38,792872371291983872
Pre-emptive covers as Otago 290/6 at lunch. Thunder & lightning out west! # PlunketShieldpic.twitter.com/I3Dw08hzFm,2016-10-30 19:34:37,792872365671624704
Run de 22 à 6 pour le Thunder bien emmené par les 8 points d'Enes Kanter.,2016-10-30 19:34:35,792872357266350080
Kanter with some nifty moves and a bucket to put # Thunder up 30-22 late 1st pic.twitter.com/XoUzMrfYsp,2016-10-30 19:34:25,792872316996689920
Thunder have suppressed the Lakers since that early run.,2016-10-30 19:34:24,792872310722088960
have we heard Thunder Road yet?,2016-10-30 19:34:23,792872307463229440
And the nation turns its attention to the Lakers Thunder game.,2016-10-30 19:34:23,792872307014242304
Thunder are playing some great basketball right now. And it's our second unit! # ThunderUp,2016-10-30 19:34:21,792872298432778240
regarde Los Angeles Lakers vs Oklahoma City Thunder,2016-10-30 19:34:16,792872275901120512
"Baita 1Q do Thunder, depois que o Kanter começou a contribuir o ataque fluiu. 22-30 Thunder",2016-10-30 19:34:15,792872273871069184
"Thunder game, World Series game 5, Cowboys on SNF, and the Walking Dead. I don't know how I'm gonna make it through the next 5 hours.",2016-10-30 19:34:13,792872264186245122
Thunder em uma run de 22-6!!!! # ThunderUp TIMEOUT LAKERS 1:23 OKC 30 X 22 Lakers # ThunderUp,2016-10-30 19:34:09,792872248596127744
Lakers 22-30 Thunder. Timeout.,2016-10-30 19:34:09,792872247476256769
Thunder lead 30-22 over the Lakers right now and have been the more aggressive team late this quarter,2016-10-30 19:34:05,792872229893615616
Thunder color guy just compared Kanter to Hakeem. Everyone who does this for any player (maybe except JoJo) needs to be struck by lightning.,2016-10-30 19:34:03,792872221211553792
oyoyoyoy Thunder up ako boyyyy.,2016-10-30 19:34:02,792872219340779520
THE THUNDER LEAD BY 8 LETS GO!,2016-10-30 19:33:59,792872205386481664
22-6 de parcial de los Thunder tras un buen inicio de Lakers; lo para Walton con 22-30 para # ThunderUp # LakeShow # NBASundays,2016-10-30 19:33:54,792872186205839360
Nouveau Time-Out et le Thunder prend 8 points d'avance. La line up ultra small ball prend l'eau face à Kanter.,2016-10-30 19:33:53,792872181831180289
Thts Thunder basketball,2016-10-30 19:33:53,792872179482230784
"Oct 30 Game Score: PeeWee AE - 6, Oro AE Thunder - 2 http://tinyurl.com/zhrvzvd",2016-10-30 19:33:52,792872175741104128
This thunder team bench s trash... come on we should be scoring,2016-10-30 19:33:39,792872121030610944
"Nance é o C e MWP o PF nessa lineup e os resultados não tem sido bons, com o Thunder criando mesmo sem Westbrook.",2016-10-30 19:33:33,792872095713820672
"22-6 Thunder run. Good guys lead 30-22, 1:23 in the 1st.",2016-10-30 19:33:32,792872093339836420
"The thunder is playing with balance, it's amazing",2016-10-30 19:33:32,792872092593033216
|Time Out| Q1 |01:23| 30 | Oklahoma City Thunder 22 | Los Ángeles Lakers # ThunderUp,2016-10-30 19:33:32,792872091246788608
God of Thunder meets Rock n Roll Part 2 meets Boris,2016-10-30 19:33:23,792872056488505344
Thunder are on a 22-6 run right now. They're up 30-22. Kanter taking the Lakers second unit to task right now.,2016-10-30 19:33:22,792872049731473408
the Turk-stache is taking people to school tonight!! You go BIg Enes!! Thunder Up!!,2016-10-30 19:33:20,792872041061883904
Fuck the thunder and Westbrook and that idiot kanter,2016-10-30 19:33:17,792872029754040320
Game time: # Thunder and # Lakers https://www.instagram.com/p/BMNKSewD06_/,2016-10-30 19:33:14,792872016223277057
deu uma cotovelada no Harden na época de Thunder!,2016-10-30 19:33:10,792872001144774656
That PK Thunder cape kill tho lol,2016-10-30 19:33:09,792871998544154625
Strong Thunder#storms & Shelf Cloud # Timelapse from New York City - 10/30/2016 http://dlvr.it/MYgq95 via @ StormwallVideos,2016-10-30 19:33:09,792871995813732352
Nganu gadungan jud ang dula sa warriors ug thunder nga hahaha # ThunderUp,2016-10-30 19:33:06,792871982035456000
BAET LA LETS GO THUNDER,2016-10-30 19:33:05,792871979241963520
Enes Kanter with his Kevin McHale impersonation for # Thunder,2016-10-30 19:33:04,792871975559438336
i don't mind the rain but this thunder & lightening has to go,2016-10-30 19:33:03,792871972581482496
lets go Show !! — watching Los Angeles Lakers vs Oklahoma City Thunder,2016-10-30 19:33:00,792871959746838528
20-6 run do Thunder... Parabéns aos envolvidos,2016-10-30 19:32:59,792871954676064260
"Kanter has 8 points, Thunder up 30-22, 22-6 OKC run. # News9Thunder",2016-10-30 19:32:56,792871940985729024
I keep having 2 remind myself that Kevin Durant doesn't play with the Thunder anymore,2016-10-30 19:32:53,792871928356868101
TIMEOUT LAKERS! Thunder's run has reach 22-6. Thunder lead 30-22 with 1:23 left in the first.,2016-10-30 19:32:52,792871923466194944
My dog is scared of the dumbest stuff but doesn't bat an eye for things that normally scare dogs like fireworks or thunder,2016-10-30 19:32:50,792871918059880448
Kanter with the fancy footwork. Thunder now on a 22-6 run since Billy Donovan's timeout earlier.,2016-10-30 19:32:41,792871879706935296
"@ ThunderS7ruck Hi, is TSG only for English language? :)",2016-10-30 19:32:40,792871875902857216
Run de 20-6 do Thunder....,2016-10-30 19:32:39,792871871599538176
@ NOTSCWill You should know that the Lakers were beating the Thunder at one point during the 1st quarter and that's like a win to me.,2016-10-30 19:32:38,792871865135923200
I am loving this thunder,2016-10-30 19:32:24,792871805845463044
timeout acordou o Thunder,2016-10-30 19:32:23,792871803387514880
the Thunder are still a very very fast team.,2016-10-30 19:32:23,792871802368200704
Thunder on a 20-6 run. This is not good.,2016-10-30 19:32:21,792871795216953344
Ared I'm tuned in! Let's go thunder!!!,2016-10-30 19:32:20,792871792977117184
FOLLOW FOR THUNDER NEWS AND LIVE TWEETS!,2016-10-30 19:32:19,792871787105312768
Thunder vs Lakers,2016-10-30 19:32:19,792871787079925761
Thunder time!!,2016-10-30 19:32:17,792871778154520576
Love the way okc is passing! Thats thunder basketball!,2016-10-30 19:32:14,792871767987466240
Shit send em to the Thunder bc we're lacking out here https://twitter.com/mikeheadiy/status/792869198414438401 …,2016-10-30 19:32:13,792871761901522944
# WeLoveLA # Lakers Oklahoma City Thunder v Los Angeles Lakers http://srhlink.com/MYgpnV # SportsRoadhouse,2016-10-30 19:32:08,792871739180986368
Let's go thunder,2016-10-30 19:32:07,792871736186441728
I'm hearing some mad thunder out there,2016-10-30 19:32:03,792871721326043136
"Thunder on the MOVE! 12-2 run, capped by Russ to Enes. # ThunderUPpic.twitter.com/ddXuB9v8tS",2016-10-30 19:32:02,792871716645064707
I gotta skip the thunder game cause 90 day fiance finna start in 30 minutes.,2016-10-30 19:31:57,792871696709541889
Vamos ganhar Thunder !!!!,2016-10-30 19:31:56,792871690653097984
There we go!!!!! Thunder!!!,2016-10-30 19:31:52,792871673007448064
Semaj Christon is not afraid to take an open shot for # Thunder,2016-10-30 19:31:49,792871661921972224
"I don't know what's worse, the Thunder's uniforms or their floor. # Lakers",2016-10-30 19:31:37,792871609581182976
KANTER +2 20-25 THUNDER,2016-10-30 19:31:36,792871606821457920
Thunder up yo.,2016-10-30 19:31:33,792871593496092672
"I try and keep my personal account free of Thunder ramblings, but Westbrook is the modern Oscar Robertson. Just so good.",2016-10-30 19:31:31,792871585203924992
"HEAVY METAL THUNDER FEST 2016. DIA 12 DE NOVEMBRO NO INVICTUS PUB(RUA VEIGA CABRAL 1124 ESQUINA COM A SÃO PEDRO,... http://fb.me/YxCNj3Xo",2016-10-30 19:31:28,792871574680510465
# Lakers 18 # Thunder 22 | 1er Cto | # SomosLakersMX,2016-10-30 19:31:28,792871573438894080
"Oct 30 Game Score: U16 - 2, Paris Thunder - 4 http://tinyurl.com/gqe4oof",2016-10-30 19:31:27,792871568019976192
Oklahoma City Thunder 28:22 LA Lakers in 3min on http://prospo.co/l http://prospo.co/mpLDcSXtD pic.twitter.com/Dn4L0jEbp2,2016-10-30 19:31:25,792871558897344516
At the Thunder game,2016-10-30 19:31:22,792871547761340416
Lakers forward Julius Randle nails a circus shot vs. the Thunder # LAL http://app.fanly.me/article/JtffHVPQbi …pic.twitter.com/EFoPvEvEf9,2016-10-30 19:31:17,792871525678518272
"HEAVY METAL THUNDER FEST 2016. DIA 12 DE NOVEMBRO NO INVICTUS PUB(RUA VEIGA CABRAL 1124 ESQUINA COM A SÃO PEDRO,... http://fb.me/8fVaZUt0O",2016-10-30 19:31:15,792871516467847168
thunder cunt is preferable,2016-10-30 19:31:13,792871508330831872
"Phoenix Suns kadar sahası güzel olan başka takım yok dünya üzerinde.. küçüklüğümde supersonics vardı, thunder oldu şimdi.onu da çok severdim",2016-10-30 19:31:12,792871506728615936
The thunder had a 3-1 lead on the warriors and tbh Okc had a GREAT chance to beat the Cavs. https://twitter.com/Jackb_32/status/792871274590515200 …,2016-10-30 19:31:11,792871501527646208
Oklahoma City Thunder - LA Lakers - http://Eurosport.com http://ow.ly/b68D505Ytdl,2016-10-30 19:31:09,792871492237361152
Lol I do like the Pacers though. Hometown team but I grew up with the Thunder.,2016-10-30 19:30:55,792871434536255489
I'm watching the OKC Thunder and Dallas so good luck lol,2016-10-30 19:30:48,792871406027493376
いえろさん、2日間お疲れ様でした！,2016-10-30 19:30:43,792871385777319936
Gostei de um vídeo @ YouTube http://youtu.be/V3Vxkil_9mg?a[LIVE … STREAM] - War Thunder #9 30/10/2016,2016-10-30 19:30:43,792871382791036929
"Thunder aren't a ""super team"" tho",2016-10-30 19:30:39,792871366001299456
Lakers vs Thunder,2016-10-30 19:30:36,792871353246322688
"It's so black and white, he's stealing your thunder",2016-10-30 19:30:30,792871330190356480
"""they're right and humans always maketh mistakes.""",2016-10-30 19:30:25,792871309827051520
Not when y'all playin the thunder. I think I smell another triple double.,2016-10-30 19:30:25,792871309633998848
watching Los Angeles Lakers vs Oklahoma City Thunder,2016-10-30 19:30:24,792871305012019201
Many famous friends joined @ bobdylan today in 1975 for a tour that would be dubbed the Rolling Thunder Revue: http://trib.al/VkI7gdU pic.twitter.com/Uj4wC7e5Ng,2016-10-30 19:30:17,792871276306112512
But kawhi couldn't even beat the thunder? https://twitter.com/privatetwwitter/status/792870928397000704 …,2016-10-30 19:30:17,792871274590515200
LET'S GO THUNDER!! # ThunderBasketball,2016-10-30 19:30:16,792871272204021760
Now that the thunderstorm is over which was so windy and all the thunder and lighthing wow now time for LETS GO EAGLES # FlyEaglesFly,2016-10-30 19:30:01,792871209830678528
THUNDER UP! Woot woot # ThunderBasketball,2016-10-30 19:29:56,792871185943896065
This thunder & rain? lol https://twitter.com/sartorian0/status/792859065672019968 …,2016-10-30 19:29:52,792871169938644992
"""Fuck you world peace"" is a thing i regularly yell when the thunder play the lakers",2016-10-30 19:29:51,792871164678930432
Thunder Op Baby! pic.twitter.com/ze1XxsgNFv,2016-10-30 19:29:49,792871157196140544
I love this Thunder team,2016-10-30 19:29:45,792871142151389185
Thunder & hosing down over West Auckland. Dry in New Lynn so far! # Weather @ PhilipDuncan,2016-10-30 19:29:43,792871132441346048
# Thunder crowd giving a quick boo to MettaWorldPeace,2016-10-30 19:29:42,792871129253675008
Wow that's a shoot at the Thunders from Golden state @ tytsportspic.twitter.com/k1ra9yliRu,2016-10-30 19:29:41,792871126192062465
viendo Los Angeles Lakers vs Oklahoma City Thunder,2016-10-30 19:29:38,792871110459002880
Thunder vs Lakers # LakeShow,2016-10-30 19:29:30,792871079551217664
Reminder: Thunder are still exciting guys,2016-10-30 19:29:30,792871079152844801
"Ah hell. Here come Lou ""Thunder Killer"" Williams. # ThunderUp",2016-10-30 19:29:30,792871078607466496
Golden state plays the thunder Thursday ... shit I'm ready that game now,2016-10-30 19:29:29,792871074514006024
Le Thunder en transition c'est brutal hein,2016-10-30 19:29:26,792871061008228352
This Thunder-Baby Lakers game is a hell Lota fun. Up and down with Russ and D'Angelo flying everywhere,2016-10-30 19:29:23,792871049700511744
Esse jogo de transição do Thunder é incrível.,2016-10-30 19:29:23,792871049243295745
"Oct 30 Game Score: PeeWee Rep - 3, Sturgeon Lake Thunder - 5 http://tinyurl.com/zkzn57w",2016-10-30 19:29:22,792871044084338688
Thunder and lightning in NYC in October...,2016-10-30 19:29:17,792871025277071360
Go sleeps like unknowable thunder,2016-10-30 19:29:06,792870978221117441
Watching the Thunder without KD is so entertaining even though they kinda suck https://twitter.com/dahoneybadger07/status/792870687778242560 …,2016-10-30 19:29:03,792870965176918016
# GAMETIME ! The Lakers take on the # OKC # THUNDER # RIGHT # NOW on spectrumsportsnet ! # KB20… https://www.instagram.com/p/BMNJ05KhTrf/,2016-10-30 19:29:00,792870950840651777
the thunder were also down by 4 points so calm down,2016-10-30 19:28:58,792870943920099329
Türkler uçurdu aq Thunder'ı,2016-10-30 19:28:54,792870928325701632
Contragolpes letales del @ okcthunder cortesía de @ Enes_Kanter y @ russwest44 # NBA # OKC # Thunder,2016-10-30 19:28:54,792870926647857152
Thunder on,2016-10-30 19:28:54,792870925985320960
Les Lakers vont se faire graille par le Thunder,2016-10-30 19:28:53,792870923800051716
Let's get it # thunder,2016-10-30 19:28:52,792870917500088320
Metta World Peace enters the game. Thunder fans boo.,2016-10-30 19:28:51,792870914887127040
war thunder思ってたより簡単,2016-10-30 19:28:50,792870908994039808
おはようございます！みなさま,2016-10-30 19:28:49,792870904099315712
assistindo Los Angeles Lakers vs Oklahoma City Thunder,2016-10-30 19:28:28,792870816413257730
"""You are the thunder, and I'm the lightning."" # BarryCade.http://purple-and-red-ribbons.tumblr.com/post/152422133661/when-we-collide-sparks-fly-when-you-look-in-my …",2016-10-30 19:28:26,792870807869480960
Lakers @thunder on league pass,2016-10-30 19:28:20,792870784519671809
wait to steal my thunder everyone,2016-10-30 19:28:15,792870764919881728
Now this is thunder basketball,2016-10-30 19:28:08,792870735500967936
Sonic Boom: „Tommy Thunder: Method Actor“ Episoden-Review: Sonic Boom: „Tommy Thunder: Method… http://dlvr.it/MYgmWc # anime # reviews,2016-10-30 19:28:05,792870720254582785
Relax Happy long weekend Go Lakers # clarkson06 — watching Oklahoma City Thunder vs Los Angeles Lakers at... http://fb.me/UfBTpS38,2016-10-30 19:28:05,792870719692627968
Just played: Drum Thunder Suite - Art Blakey and the Jazz Messengers - Moanin'(Blue Note),2016-10-30 19:28:04,792870715871506432
Lien OKC Thunder pls?,2016-10-30 19:28:03,792870714441433088
my dog is so scared of thunder its so funny,2016-10-30 19:28:02,792870707357188096
AUROAAAAAA THUNDEEERRRRR ATTAAAAAACCCKKKKKKK!!!!! Okay Hyoga dreh halt durch. Thunder Attack vom namen her erinnert mich an Thundercrack.,2016-10-30 19:27:54,792870676956901381
My dogs never gonna shut up with this thunder lol,2016-10-30 19:27:54,792870676617134080
Oklahoma City Thunder 22:18 LA Lakers in 4min on http://prospo.co/l http://prospo.co/mpLDcSXtD pic.twitter.com/vOeLhv5AkH,2016-10-30 19:27:54,792870674813648897
Thunder up!!! @Chesapeake Energy Arena https://www.instagram.com/p/BMNJspLhdlN/,2016-10-30 19:27:53,792870669390188544
"Acompanhando os jogos do Thunder com os perfis do Thunder parece que todo ponto deles é showtime hahahahah, é irado!",2016-10-30 19:27:51,792870661580525569
"Watching this Lakers vs. Thunder game and wow, Lakers offense needs work. Spacing on 1 set was so bad (four guys so close on same side).",2016-10-30 19:27:48,792870651862265857
"Final: Madison 4, # Thunder 1. # BLMvsMAD",2016-10-30 19:27:42,792870626922901504
"Desde o timeout de Billy Donovan, o Thunder vem numa run de 12 X 2! That's good! # ThunderUp",2016-10-30 19:27:29,792870570920640512
"My mistake. It was Deng, Nance and Russell who jogged back on transition D. Can’t do that against the Thunder.",2016-10-30 19:27:26,792870557591089152
when u miss thunder games & mel just wants to rub it in .... pic.twitter.com/OJTHC1p9ym,2016-10-30 19:27:25,792870553103306753
I liked a @ YouTube video http://youtu.be/cp8OgAtDy-0?a LIVE HD: LOS ANGELES LAKERS vs OKLAHOMA CITY THUNDER,2016-10-30 19:27:24,792870548124479488
Nice run by the # Thunder out of the time out to take the 2 points lead,2016-10-30 19:27:23,792870545482248193
watching Los Angeles Lakers vs Oklahoma City Thunder,2016-10-30 19:27:19,792870526691708929
Fast break Turkey Jam. Thunder up 2 with 4:30 remaining in the First Quarter. https://vine.co/v/5pd3IY9HWvY,2016-10-30 19:27:17,792870520920289280
It's so black and white he's stealing ur thunder baby blue ain't ur color,2016-10-30 19:27:16,792870517736894464
"I enjoy going to thunder games, but I really enjoy it because I get eat an absurd amount of peanuts :-)",2016-10-30 19:27:07,792870476590690304
FOLLOW FOR LIVE TWEETS AND THUNDER UPDATES!,2016-10-30 19:26:58,792870441362817025
更夜ちゃん、姐さん、おはよー！,2016-10-30 19:26:56,792870430335832065
WiFi again is horrific inside The Peake so tweets will be whenever I can keep things connected. # Thunder up 20-18 late 1st qtr,2016-10-30 19:26:55,792870429887123456
Thunder up,2016-10-30 19:26:51,792870411394424833
KANTERRR! THUNDER LEADDDD 20 @18! TimeOut,2016-10-30 19:26:50,792870406210412545
Game dayyyy earlyyy OKC Thunder in # NBAsaABSCBN,2016-10-30 19:26:49,792870403421171716
Grinding for DO 217 E-2 - War Thunder - Air Battles - Arcade - Live (2 of 2): http://youtu.be/7KKDmEm1WkM?a via @ YouTube,2016-10-30 19:26:49,792870402468962308
Thunder got the easiest schedule lol,2016-10-30 19:26:46,792870390691344384
Timeout Lakers 18-20 Thunder Randle 10 pontos em 7 minutos,2016-10-30 19:26:46,792870389554774017
I love my Thunder,2016-10-30 19:26:43,792870377479245824
Lakers 18 - 20 Thunder. Timeout.,2016-10-30 19:26:42,792870372492312576
viendo Los Angeles Lakers vs Oklahoma City Thunder,2016-10-30 19:26:41,792870370298716160
Thunder up!!,2016-10-30 19:26:39,792870362295840768
Lakers and Thunder might be fighting for the 8th spot this year in the loaded Western Conference.,2016-10-30 19:26:38,792870358466650116
I made the Thunder gun and the DG2 (All I need is to color) :D pic.twitter.com/T0OpCuVaJG,2016-10-30 19:26:35,792870343186743296
Hello Riley Dixon now that was thunder foot well done ! # Broncos,2016-10-30 19:26:29,792870317131575296
"Timeout Thunder, que lidera 20-18 em um jogo de pace absurdo.",2016-10-30 19:26:28,792870316074790912
Thunder...,2016-10-30 19:26:17,792870268314222592
|Time Out| Q1 |04:23| 20 | Oklahoma City Thunder 18 | Los Ángeles Lakers # ThunderUp,2016-10-30 19:26:16,792870265202024449
Oklahoma City Thunder and building their thunder buddies. Steven Adams and Victor Oladipo … http://ift.tt/2eKerHt pic.twitter.com/XudIPboFfI,2016-10-30 19:26:12,792870249309896705
Game Update: Thunder 16 Lakers 16 5:32 1st 1Q - Julius Randle makes a driving layup from 2 feet... # NBA: http://bit.ly/2ecxTMp,2016-10-30 19:26:12,792870248370147328
viendo Los Angeles Lakers vs Oklahoma City Thunder,2016-10-30 19:26:07,792870228623581185
West mais 2 18-20 THUNDER first lead in the night,2016-10-30 19:26:06,792870221992296448
Loving the way the thunder is playing right now! # ThunderUp,2016-10-30 19:26:04,792870215180615680
/sees the Thunder-Lakers game is 7 minutes in /checks the box score to see if Westbrook has a triple-double yet.,2016-10-30 19:26:02,792870204795711488
Thunder Basketball !!!!!!,2016-10-30 19:25:58,792870187901026305
