text,date,id
"sound of screams, echo of the walls, as thunder and lighting strikes! A figure rises amongest the dead and his",2017-03-28 17:04:19,846830332448034820
I love thunder storms:),2017-03-28 17:04:18,846830328891260928
That thunder was just legit scary,2017-03-28 17:04:14,846830313938522113
lol I was driving home and watched these two kids run for their lives after hearing the thunder and I'm dying rn lol I'm evil,2017-03-28 17:04:06,846830278333120515
"Coronado: Lanturn (11.1%IV 4/1/0 Charge Beam/Thunder 1.1m/17.3kg). TTH: 02:32:13pm [28m 9s] http://maps.google.com/maps?q=32.69783676182709,-117.1749559803086 …",2017-03-28 17:04:03,846830266316275713
Ocean City MD Tue Mar 28th PM Forecast: TONIGHT Thunder Storms Lo 49 WEDNESDAY Clearing Hi 59,2017-03-28 17:03:40,846830170422038529
"Aah ashe u ppl cudnt wait for Kante to have 1 single bad game, all man dn turn analysts?! Saying he is exposed, Thunder will fire all of u",2017-03-28 17:03:37,846830156555653120
"Oklahoma City Thunder vs Dallas Mavericks Full Game Highlights Mar 27, 2017 2016 17 NBA Season: http://youtu.be/kxd15SzqpQw?a via @ YouTube",2017-03-28 17:03:32,846830136611684352
. Thunder fire busquets . Over hyped nonsense Baba don cast https://twitter.com/Elpibo_F/status/846829599308877824 …,2017-03-28 17:03:31,846830133839302656
I liked a @ YouTube video from @ chris_smoove http://youtu.be/jPXFH8ZZL0Q?a Russell Westbrook Game Winner! Thunder Comeback Down 13!,2017-03-28 17:03:25,846830105385062400
New post on Screaming Thunder: The New Honda CBR 1000 RR http://ift.tt/2ovN7i0,2017-03-28 17:03:20,846830086120783876
Someone seriously stole my thunder,2017-03-28 17:03:14,846830061022056448
Pretty sure I'm not going to country thunder anymore Cuz my boss changed his mind about giving me the days off,2017-03-28 17:03:06,846830027274530816
3/28 5PM Update - Thunder NORTH practice on as scheduled pic.twitter.com/ZCID6IHoeO,2017-03-28 17:02:57,846829989840535552
WAR THUNDER WITH FRIENDS PLEASE CLICK ME: http://youtu.be/TCaGCWk6G9Q?a via @ YouTube,2017-03-28 17:02:54,846829975978229760
RT @ TomKierein: StormTeam4 tracking showers/thunder this Tuesday afternoon # NBC4DC (cont) http://tl.gd/nnjr85,2017-03-28 17:02:51,846829962585952256
"#171 Lanturn (Water Gun/Thunder 5/1/12 - 40.00%) 5 Thomas Ct L8E 5A7, 05:54:01pm (51m 21s left) http://maps.google.com/maps?q=43.23437931113386,-79.69962529340367 …",2017-03-28 17:02:48,846829950959341569
@ Disneyland your employee Steve at thunder mountain was a real dick. Very disappointed,2017-03-28 17:02:46,846829942784454656
"Utah Jazz: Clippers Handing Over 4th Seed On Silver Platter, Thunder the Real Threat? - https://utah-newspapers.com/2017/03/28/utah-jazz-clippers-handing-over-4th-seed-on-silver-platter-thunder-the-real-threat/ …pic.twitter.com/P3bkGepjHF",2017-03-28 17:02:38,846829911016800256
"Lanturn available until 03:30:49pm (28m 31s). Water Gun / Thunder (48.9% - 10/0/12) http://maps.google.com/maps?q=39.72631159849844,-105.20937945409032 …",2017-03-28 17:02:17,846829822475223046
"Lanturn - 56% (Charge Beam/Thunder) till 05:31:59pm (29m 46s). Found at 366 Oxford St W (West London) http://maps.google.com/maps?q=42.985423084603646,-81.2828097273929 …",2017-03-28 17:02:16,846829816649306113
Voice Like Thunder – Psalm 29:3-4 https://thebottomofabottle.wordpress.com/2017/03/28/voice-like-thunder-psalm-293-4 …pic.twitter.com/3TwbjkNuJy,2017-03-28 17:01:27,846829613187846144
"Raise your words, not voice. It is rain that grows flowers, not thunder. - Rumi # quote",2017-03-28 17:01:02,846829505595527170
"Lanturn (75.6% 13/14/7, Charge Beam / Thunder) until 14:28:29 (27m 29s). http://maps.google.com/maps?q=33.93876015983586,-117.39767980910943 …",2017-03-28 17:00:59,846829494312714240
"If you guessed Thunder and Potato, you are correct! # CampWeaverFeverpic.twitter.com/tpJXJdFz1s",2017-03-28 17:00:53,846829467989368832
"Lanturn available until 03:27:04pm (26m 14s). Charge Beam / Thunder (46.7% - 8/7/6) http://maps.google.com/maps?q=39.74869859102004,-105.21148194468358 …",2017-03-28 17:00:50,846829456790573060
5 great places to have a drink in Thunder Bay: http://ow.ly/kQEM30akKLh @ sleepgiantbrew,2017-03-28 17:00:36,846829397361528833
"633:618 Seem'd all one mutual cry: I never heard So musical a discord, such sweet thunder. # AMNDBots",2017-03-28 17:00:34,846829388419129344
stealing mommy's thunder https://youtu.be/3HZdsDAYfPA via @ YouTube,2017-03-28 17:00:24,846829346715160576
Thunder can clinch a playoff spot tonight with win over Orlando http://buff.ly/2nfy0sK pic.twitter.com/phitKAt25h,2017-03-28 17:00:20,846829331947118593
War Thunder Roleplay- The dandy pink Spitfire World of Tanks http://youtu.be/QY0b0HWtOmA,2017-03-28 17:00:15,846829310023385088
My projections for the # NBA Western Conference Playoffs: 1.Warriors 2.Spurs 3.Rockets 4.Clippers 5.Jazz 6.Thunder 7.Grizzlies 8.Nuggets,2017-03-28 17:00:15,846829309771812865
ion see how u can b scared of thunder.. it's just noise,2017-03-28 17:00:13,846829303652405248
"Lady thunder ""I slipped off my panties and examined my lady thunder. She was looking well manicured. And I swore ... http://a.co/honOgvZ",2017-03-28 17:00:07,846829275835748353
"À 17h, le 28 mars 2017 Il fait 72,2°S au Canada Extrêmes retranchés: min: -19,7°C à Iqaluit max: 9,5°C à Thunder Bay",2017-03-28 17:00:05,846829267795238912
Oklahoma City Thunder stars Enes Kanter and Steven Adams are at it again in support of NBA MVP candidate Russell... http://fb.me/2WnMVnqId,2017-03-28 17:00:03,846829261751242755
Oklahoma City Thunder stars Enes Kanter and Steven Adams are at it again in support of NBA MVP candidate Russell... http://fb.me/3EXdvhAQI,2017-03-28 17:00:03,846829260492935169
"A wild Electabuzz (80.0%,15/12/9) (Thunder Shock,Thunderbolt) has appeared! Available until 14:17:10 (17m 6s). http://maps.google.com/maps?q=33.64871204577935,-117.78575753565889 …",2017-03-28 17:00:03,846829259314249728
# chicsbeach You can hear the thunder far away pic.twitter.com/RyHzXmFoK9,2017-03-28 17:00:03,846829257636675584
War Thunder naval battles beginner's guide: tips and tricks for conquering the seas. https://www.pcgamesn.com/war-thunder/war-thunder-naval-battles-guide …pic.twitter.com/HfPiu8w3kQ,2017-03-28 17:00:00,846829247746359296
"La Costa: Mareep 84.4% (12/14/12 - Thunder Shock/Thunderbolt - s:large) til 14:14:14(14m 17s). http://maps.google.com/maps?q=33.109051200143504,-117.24000769852944 …",2017-03-28 16:59:52,846829211784400896
WATCH: Thunder Bay men recreate ‘Crashed Ice’ on frozen ditch http://glbn.ca/3TJ4wD,2017-03-28 16:59:51,846829209779666947
StormTeam4 tracking showers/thunder this Tuesday afternoon # NBC4DC http://NBCWashington.com & App # UmbrellaReadypic.twitter.com/wh00SNPunH,2017-03-28 16:59:35,846829142578548738
pic.twitter.com/PJzQFHmyIm,2017-03-28 16:59:23,846829092997677056
Thunder Dragon Breeder! I just bred a Thunder Dragon in DragonVale! Visit my park to check it out! http://bit.ly/A7Dtgj,2017-03-28 16:59:23,846829092464971783
"this is sad news, you may not be able to view any live Oklahoma City Thunder in ur location bcoz its nationally televised :(",2017-03-28 16:59:03,846829006158807040
The Thunder was brought back for a couple of seasons. Now we're witnessing the parting of the Gap.,2017-03-28 16:58:56,846828980191870976
"Electabuzz 84% (10/15/13) (Low Kick & Thunder) until 14:28:37 (29m 46s).http://maps.google.com/maps?q=32.535499883732456,-116.94021338511313 …",2017-03-28 16:58:53,846828966467911680
http://ift.tt/2mNDheG DS Jordan Retro 4's Thunder Size 8,2017-03-28 16:58:44,846828927670734849
Thunder,2017-03-28 16:58:44,846828926848634880
Awesome! Ur phone probably still have Ur old location. U just can't watch Thunders if Ur in OKC. Only available in the US :),2017-03-28 16:58:43,846828924990578690
So Dino did his own passing (padding) out on a Sunday! The thunder that will strike him is doing IT with Thor! @ Ayourbpic.twitter.com/GONl1hmzXO,2017-03-28 16:58:37,846828901007577090
# DC's Thunder Beast takes on a Monster # LegalDramahttps://twitter.com/washingtonian/status/846805098202370049 …,2017-03-28 16:58:35,846828889942974464
I almost did the other day but thunder and lightening (my thighs) saved it.,2017-03-28 16:58:25,846828848868057088
# NowPlaying on Retro Country 890: Garth Brooks - The Thunder Rolls # CountryMusic Tune in at http://listen.radionomy.com/retrocountry890,2017-03-28 16:57:59,846828738721579008
Thunder,2017-03-28 16:57:57,846828731444400128
Nice! Go Thunders! Oh... and Thx for the love <3,2017-03-28 16:57:47,846828687693623298
I need a thunder buddy for real. I hate storms.,2017-03-28 16:57:45,846828679728652289
sos scared of thunder sos,2017-03-28 16:57:32,846828628365201410
delete it fat,2017-03-28 16:57:26,846828602901585920
http://ift.tt/2nsjgrd # shoes New Supra Thunder Low Burgundy Satin Tuf Men size 12,2017-03-28 16:57:25,846828598912790530
Los Rockets aplastan a los Thunder en el duelo de MVPs http://www.basketamericano.com/los-rockets-aplastan-a-los-thunder-en-el-duelo-de-mvps/?utm_source=ReviveOldPost&utm_medium=social&utm_campaign=ReviveOldPost …,2017-03-28 16:57:22,846828582546608128
Thunder cat is fucking amazing,2017-03-28 16:57:20,846828577026924546
"In the words of my man Drake ""raining money Oklahoma City Thunder"" https://twitter.com/okcthunder/status/846815061414948864 …",2017-03-28 16:57:18,846828569393348608
The Thunder Eagle Wildlife event scheduled for 7:00 this evening has been cancelled at the Burrowsville Volunteer Fire Department.,2017-03-28 16:57:12,846828540813291521
sing the thunder buddy song,2017-03-28 16:57:10,846828534823727104
Amon Amarth - Twilight of the Thunder god 8-bit https://youtu.be/rwEXbZUXxcE via @ YouTube,2017-03-28 16:56:58,846828484253114368
NOBODY EXPECTS THE WAKEUP THUNDER KICK,2017-03-28 16:56:53,846828461419352066
Of course it thunders loud af when pat isn't here # canthisfastcruisebeovernow,2017-03-28 16:56:30,846828367907360768
This is some angry ass thunder out here,2017-03-28 16:56:28,846828357404758017
Afro thunder,2017-03-28 16:56:23,846828338392039424
i do not fuck with this thunder bro,2017-03-28 16:56:23,846828336311652353
"pssst, only little girls play War Thunder, pass it on..",2017-03-28 16:56:11,846828288060411904
pero todos sabemos qué el thunder se va en la primera ronda,2017-03-28 16:55:59,846828236738740224
I train with thunder bruv. I am currently having a storm in a tea cup for dinner @ cremechic11 # TO,2017-03-28 16:55:59,846828234314539009
This thunder has gtg,2017-03-28 16:55:54,846828214395830274
"@ sepinwall It's gotta be Braugher. This is the man that gave us ""Velvet Thunder!"" ""Paaaain!"" ""BOOOONE!""",2017-03-28 16:55:42,846828166257823744
"""Vicious Thunder"" # movie # soundtrack is currently available @ amazon , # actor # acting # actorslife https://www.instagram.com/p/BSMh5z_Axqq/?taken-by=tom.obrien_ …",2017-03-28 16:55:39,846828154501152768
"Random thought: I bet if OKC had kept Harden @PG & released Westbrook instead, I'd bet that Durant would still be in a Thunder uniform",2017-03-28 16:55:37,846828144300560387
【ラブピコヘルツ侵略作戦 ੈ✩】 4/2 milky wave vol.1＠高円寺THUNDER http://twipla.jp/events/248118,2017-03-28 16:55:31,846828119193354240
http://ift.tt/2mNDheG DS Jordan Retro 4's Thunder Size 8,2017-03-28 16:55:25,846828093834743809
Photography - some of the greatest storm photos of all time # lightning # storms # amazing # thunder # rainhttp://bit.ly/2dvhAcW,2017-03-28 16:55:15,846828051199672322
off to play War Thunder.,2017-03-28 16:55:12,846828041049423878
bed as the thunder rolled and lighting flashed. Finally in the bathroom I popped my meds gulping a huge drink of water before (18/21),2017-03-28 16:55:11,846828034942488576
Wow Greyson is not liking this thunder,2017-03-28 16:54:45,846827925764800513
I know but ive never been to country thunder. I wish I could do both,2017-03-28 16:54:36,846827888448065539
OKC Thunder # UNCFSU_RYS17,2017-03-28 16:54:30,846827864213393408
"@ FDuvana Pour le Pre Order c'est un fake , Avion de War Thunder ! La deuxieme a voir",2017-03-28 16:54:14,846827793979789312
"Leave am, the thunder wey go fire am still dey HeadBridge for Onitsha @ cremechic11 @ tareokoro",2017-03-28 16:54:10,846827779870113792
"Lakeside: Lanturn (53.3%IV 7/10/7 Charge Beam/Thunder 1.1m/13.4kg). TTH: 02:19:28pm [25m 32s] http://maps.google.com/maps?q=32.84011748715446,-116.91758039694602 …",2017-03-28 16:53:55,846827717668487169
"Coronado: Lanturn (20.0%IV 8/1/0 Water Gun/Thunder 1.5m/36.3kg). TTH: 02:19:25pm [25m 30s] http://maps.google.com/maps?q=32.688146818519826,-117.177988514306 …",2017-03-28 16:53:54,846827713826500608
"Lanturn (37.8% 5/5/7, Water Gun / Thunder). Available until 14:23:05 (29m 19s). http://maps.google.com/maps?q=37.22557908182589,-121.78431955167966 …",2017-03-28 16:53:45,846827675163377664
"Get Here! |Mareep |(33.3%)|(3/8/4) Thunder Shock/Thunderbolt til:(05:23:11pm)|(29m 46s) # SodaCityRareshttp://maps.google.com/maps?q=33.99927769299119,-81.04359390082278 …",2017-03-28 16:53:22,846827577180327936
i forgot how much i love the sound of thunder,2017-03-28 16:53:12,846827535119892482
@ PS_investigate I live in Oklahoma City but I am currently in Virginia and want to watch a Thunder game. It is not listed in my app. Jomo =),2017-03-28 16:53:09,846827523707211776
Who wore it best? Thunder rookies dress like Russell Westbrook in latest MVP promo video http://newsok.com/article/5543209?utm_source=NewsOK.com&utm_medium=Social&utm_campaign=ShareBar-Twitter …,2017-03-28 16:53:09,846827523136741376
Thunder and Pea sized hail (sleet?) for about 20 seconds. Summer is going to be loud.,2017-03-28 16:52:40,846827403662032896
"damn, @ teckid, I feel like this is stealing your crapstopper thunder.",2017-03-28 16:52:36,846827384657596416
Thunder again craters when Westbrook rests http://newsok.com/article/5543299?utm_source=NewsOK.com&utm_medium=Social&utm_campaign=ShareBar-Twitter …,2017-03-28 16:52:22,846827325375352835
It's currently Thunder in the Vicinity and 78F outside. # it's_raining,2017-03-28 16:52:18,846827308744949760
I liked a @ YouTube video from @ patthenespunk http://youtu.be/TxDb_3BarPU?a Quik the Thunder Rabbit SNES ROM Released - # CUPodcast,2017-03-28 16:52:08,846827266399076352
I liked a @ YouTube video from @ thunders7ruck http://youtu.be/B4lIsuDbz2E?a More New Weapons In Black Ops 3! Nadeshot Call Of Duty 2017,2017-03-28 16:52:00,846827233729642496
"@ EllaKnoxMusic https://www.facebook.com/michael.critelli/videos/1525314304155202/ … ""!//!""I Am SainT Michael Thunder CloudS""!//!"" HI and Hello I hope U like It??",2017-03-28 16:51:52,846827198518579202
"@ marielletengstr https://www.facebook.com/michael.critelli/videos/1525314304155202/ … ""!//!""I Am SainT Michael Thunder CloudS""!//!"" HI and Hello I hope U like It??",2017-03-28 16:51:38,846827143317336065
"A wild Lanturn (71.1%,10/13/9) (Charge Beam,Thunder) has appeared! Available until 14:05:35 (14m 18s). http://maps.google.com/maps?q=33.65107777709012,-117.85252630695227 …",2017-03-28 16:51:16,846827049935253504
I liked a @ YouTube video from @ piotrzarychta http://youtu.be/HA8o_lZ7Yps?a Nerlens Noel 15 pts 8 rebs 2 blks vs Thunder 27.03.2017,2017-03-28 16:50:54,846826955597000704
"my thanks my friend, with the Thunder Beings lingering all day it has been an intensely painful one on my joints. be back later https://twitter.com/TwilightLaPush/status/846817667503710208 …",2017-03-28 16:50:52,846826948978491393
Me when Thunder get 5th seed pic.twitter.com/7PzooweWni,2017-03-28 16:50:47,846826929357512706
Thunder Cunt is going to cut funding for homeless war veterans ...... http://www.independent.co.uk/news/world/americas/trump-budget-cuts-end-homelessness-war-veterans-va-military-us-interagency-council-on-us-president-a7654091.html …,2017-03-28 16:50:26,846826840765423616
I wanna watch the Thunder game. I'm in Virginia right now,2017-03-28 16:49:54,846826707227152384
DANCERS! Be on the lookout for an email tonight about details on how to pick up your THUNDER shirt & bag before Saturday! pic.twitter.com/4nq1xY6a0f,2017-03-28 16:49:53,846826701208403972
@Thunder_Digest alright here's a question for you. Semaj is currently a 65 overall in 2k. Too high or to loo low and why?,2017-03-28 16:49:52,846826697030807552
Just come to Phoenix Lifhts with us. Fuck Country Thunder https://twitter.com/briabeyta/status/846825033901228034 …,2017-03-28 16:49:48,846826682212245504
"Como no vivo en Argentina desde hace 14 Años te pregunto,sos de la nueva generación de los THUNDER CATS ?",2017-03-28 16:49:45,846826667771416579
"Opuni taking as much as 75,000 GHC a month less incentives... thunder come down!!!",2017-03-28 16:49:41,846826652114018305
May the thunder strike you in your bum bum,2017-03-28 16:49:40,846826645487042560
"#171 Lanturn (Charge Beam/Thunder 12/8/1 - 46.67%) 10 Legend Ct L9K 1J3, 05:18:35pm (29m 22s left) http://maps.google.com/maps?q=43.22728731194988,-79.94711903899815 …",2017-03-28 16:49:21,846826568290893828
# ebay Thunder # HelloKitty Black Metal # LunchBox Star Glasses School Supplies Sanrio # Sanrio http://cgi.ebay.com/ws/eBayISAPI.dll?ViewItem&item=152489216759&roken=cUgayN&soutkn=q0Ettx … via @ eBay,2017-03-28 16:49:18,846826554894233601
Anyone trying to go to country thunder this year?,2017-03-28 16:49:16,846826544643362816
I love this thunder but it makes me wanna cuddle up and watch movies... not go to class. Oh well,2017-03-28 16:48:57,846826467719827457
"Mareep despawn: 04:16:51pm(27m 56s) IV:37.78% (5/5/7) Moves:Thunder Shock, Discharge http://maps.google.com/maps?q=33.43377763508709,-94.09314655712402 …",2017-03-28 16:48:54,846826454604230658
Thunder is not my cup of tea,2017-03-28 16:48:35,846826373473820674
That thunder got to go,2017-03-28 16:48:28,846826342754762756
I just supported Pink Out to Protect Care at PP on @ ThunderclapIt // @ PPFA http://thndr.me/jKzKZX Come join the thunder!,2017-03-28 16:48:15,846826292238401537
"# WeLoveLA # LAC # Clippers Utah Jazz: Clippers Handing Over 4th Seed On Silver Platter, Thunder the… http://srhlink.com/NlJjTS # SportsRoadhouse",2017-03-28 16:48:13,846826283170349056
GRIZZ UP! Memphis Grizzlies and the OK City Thunder are ready to face each other again on April 5th! Will you be visiting us?,2017-03-28 16:48:06,846826254489829376
"KD with 19 pts, 6 rebs, 4 assists. Thunder lead Knicks 58-53.",2017-03-28 16:48:05,846826249087463424
Power Rangers Dino Thunder and Ninja Storm were the best!,2017-03-28 16:48:05,846826246436741120
You'll both be supporting White Rose Warriors or Trent Thunder # Franchise,2017-03-28 16:48:03,846826238601842690
"same, get me out of here",2017-03-28 16:47:40,846826143038738433
"Electabuzz 47% (3/10/8) Thunder Shock/Thunder Punch until 04:16:29pm (28m 50s) Firewheel [2] http://maps.google.com/maps?q=32.95369150750241,-96.61150445140545 …",2017-03-28 16:47:38,846826136302600192
"This still cracks me up, THUNDER! http://www.independent.co.uk/news/world/americas/ashley-madison-hackers-made-staffs-laptops-play-acdcs-thunderstruck-10469671.html …",2017-03-28 16:47:38,846826136193650689
Thunder,2017-03-28 16:47:28,846826094888128512
Check out The Chance by Robyn Carr (2014 Paperback) A THUNDER POINT NOVEL http://www.ebay.com/itm/Chance-Robyn-Carr-2014-Paperback-THUNDER-POINT-NOVEL-/142294027970?roken=cUgayN&soutkn=j4uD4c … via @ eBay,2017-03-28 16:47:27,846826087871135746
http://izipho.net presents: migrating salmon Thunder_Cove purple Leggings https://goo.gl/fb/UUgmqb,2017-03-28 16:47:10,846826017259868160
"When you hear that thunder, lights out.",2017-03-28 16:46:53,846825945495470080
"Just turned on the heater. Coincidentally,the skies just opened up outside. Hearing thunder here along Gibson. # nmwx",2017-03-28 16:46:44,846825909298565121
Come on with the thunder man,2017-03-28 16:46:29,846825844689571841
"Alexandria Mareep available until 05:13:57pm (27m 35s). Thunder Shock / Body Slam (71.1% - 9/12/11) http://maps.google.com/maps?q=38.82280086160152,-77.13579800234733 …",2017-03-28 16:46:22,846825815870521344
The thunder earlier was actually pretty nice,2017-03-28 16:46:11,846825770014183425
"@ Kelly88938 https://www.facebook.com/michael.critelli/videos/1525314304155202/ … ""!//!""I Am SainT Michael Thunder CloudS""!//!""",2017-03-28 16:46:09,846825760732172289
"@ TAWK_SHOW https://www.facebook.com/michael.critelli/videos/1525314304155202/ … ""!//!""I Am SainT Michael Thunder CloudS""!//!""",2017-03-28 16:45:47,846825667522121729
Sudden Death Update: Athens Street: Thunder Bay – NEWS – There are few details to share in… https://goo.gl/fb/3VDq5p,2017-03-28 16:45:38,846825629777510400
"Awesome! oh, another question, will I be able to watch NBA on the app? I wanted to watch the Thunders tom.",2017-03-28 16:45:37,846825625809768452
Sonz Of Thunder UK Remix WSTRN | Sample Track 'For The City' | @ sonzofthunderuk # MusicNewshttp://dld.bz/f8rcj,2017-03-28 16:45:18,846825549301469185
SEVERE THUNDER#STORM WATCH FOR PORTIONS OF : WEST AND NORTHWEST TX http://www.chasing-live.net/en/?id_pays=25 pic.twitter.com/sapcuTl0ux,2017-03-28 16:45:12,846825523707817984
SEVERE THUNDER#STORM WATCH FOR PORTIONS OF : WEST-CENTRAL AND SOUTHWEST TX http://www.chasing-live.net/en/?id_pays=25 pic.twitter.com/kQs1G9t6kn,2017-03-28 16:45:08,846825505148076032
"Thunder Swamp Soap w/Hemp Seeds for Acne, Skin Abrasions, Psoriasis, Eczema, Dryness http://goo.gl/j8xYpt pic.twitter.com/hMxDumGItj",2017-03-28 16:45:02,846825481517350914
» Pedigree Insights: Thunder Snow http://www.thoroughbreddailynews.com/pedigree-insights-thunder-snow/#.WNrLOdvQDYM.twitter …,2017-03-28 16:44:44,846825404774187009
"Lanturn available until 05:07:09pm (22m 28s). Charge Beam / Thunder (66.7% - 8/14/8) http://maps.google.com/maps?q=37.49124760363189,-77.59171615116222 …",2017-03-28 16:44:40,846825389360078848
# feedB Thunder Will Fire You--Actress Queen Nwokoye Slam People With Fake Accent: I know… https://goo.gl/fb/m5Mv9M,2017-03-28 16:44:37,846825377641070592
Thunder only happens when it's raining and players only love you when they're playing.,2017-03-28 16:44:17,846825292400377857
whatever thunder thighs,2017-03-28 16:44:12,846825271550529536
A year ago today: RT @ spurlox A Thunder Burger (cheeseburger w/ bologna) &amp; COOP Native Amber! # OK # DrinkLochttp://brewv.us/8236,2017-03-28 16:44:02,846825227770322946
Sm'n wey una suppose turn to banter una go bring thunder and fire. Na wa o https://twitter.com/madeinlagos/status/846824825490427904 …,2017-03-28 16:43:56,846825203267256320
Lightning and thunder!! Aaaahhhh! 8D,2017-03-28 16:43:46,846825162511187969
SAB GOBLIN 700 BLACK THUNDER AEROBATICS / Euroflugtag Rheidt 2016 https://goo.gl/34Wzpb,2017-03-28 16:43:42,846825143733227520
Russ is the greatest and is the heart of thunder.,2017-03-28 16:43:22,846825059515879424
# Jersey Oklahoma City Thunder # NBA Basketball Cornhole Game Set Triangle Weathered Version http://dlvr.it/NlJcyM # sportspic.twitter.com/RJGZk3mKGZ,2017-03-28 16:43:03,846824980927066112
team Westbrook! # thunder,2017-03-28 16:42:51,846824931891523584
"This isn't like a journey to Earth, where you summon a little lightning and thunder and the mortals worship you as a god. This is Jotunheim.",2017-03-28 16:42:46,846824910408208385
I love how everyone says we have a better team now yet everyone said Thunder would do better than us,2017-03-28 16:42:44,846824901772238848
I love when it thunder storms when it's warm out,2017-03-28 16:42:31,846824846604582912
"She had a need to feel the thunder, chase the lightning from the sky, watch a storm with all its wonder",2017-03-28 16:42:19,846824798651080704
People checking out my writers page on FB Thunder Rose,2017-03-28 16:42:17,846824787385225216
"Pikachu 75.6% (13/13/8) Thunder Shock/Discharge [Morningside] 1704 S Palmetto St 51106 04:11:03pm (28m 58s) http://maps.google.com/maps?q=42.47339426887664,-96.34549909256506 …",2017-03-28 16:42:04,846824732456554496
that was the strangest sounding thunder i've ever heard,2017-03-28 16:42:02,846824726395867136
Thunder is so relaxing I hope it storms a lot in the coming months :-),2017-03-28 16:41:59,846824713469001729
89 mins: @ HoddesdonTownFC thunder a header onto the crossbar from a corner,2017-03-28 16:41:56,846824702014304256
i can hear the thunder already..Nunez saw something really bad and he's scrambling to scuttle the investigation,2017-03-28 16:41:56,846824700525326337
# NowPlaying Thunder Kiss '65 - JDevil Number Of The Beast Remix by Rob Zombie ♫ http://spoti.fi/Noc6KI,2017-03-28 16:41:53,846824686877134849
Y'all heard that thunder,2017-03-28 16:41:42,846824640249053184
"@ Harry_Styles if you want to release something on April 29th (my bday), I won't be mad at you for stealing my thunder",2017-03-28 16:41:40,846824631529037824
"thunder storms forecast for the area later, one of those hits and it's good night Lewis",2017-03-28 16:41:27,846824578232074240
I live in Oklahoma City but I am currently in Virginia and want to watch a Thunder game. It is not listed in my app. Major JOMO = (,2017-03-28 16:41:17,846824537274662913
Iranian spectators perform Iceland's 'Viking-Thunder-Clap' at World Cup qualifier in Tehran. Iran beat China 1-0. pic.twitter.com/sPglKkYg3F,2017-03-28 16:41:12,846824514306629633
"Mareep 35.6% (4/4/8/Thunder Shock/Thunderbolt) till 14:10:24 (29m 13s). lvl30+ CP:144 (L7) http://maps.google.com/maps?q=37.35170079441764,-121.98485611167789 …",2017-03-28 16:41:10,846824506668662784
My stomach sounding like this thunder,2017-03-28 16:40:45,846824404009017344
