text,date,id
"(Holland)Mareep 80% (13/9/14 Thunder Shock/Thunderbolt) appeared! Available until 17:24:23 (29m 36s). http://maps.google.com/maps?q=41.61183047913988,-83.69803392610235 …",2017-03-16 16:55:21,842479423655989249
I did my most successful tree pose ever this last weekend whilst drunk & on antibiotics (aka thunder-drunk),2017-03-16 16:55:17,842479406115246081
"(Holland)Mareep 80% (13/9/14 Thunder Shock/Thunderbolt) appeared! Available until 17:24:23 (29m 36s). http://maps.google.com/maps?q=41.61183047913988,-83.69803392610235 …",2017-03-16 16:55:12,842479382723809281
"A wild Mareep has appeared! IV: 42.2% (A:9/D:4/S:6) Thunder Shock Body Slam Available until 17:22:35 (27m 30s). http://maps.google.com/maps?q=33.9190521739947,-80.35390201772616 …",2017-03-16 16:55:03,842479348645052416
Thunder game saturday,2017-03-16 16:55:01,842479340365389824
"(Holland)Mareep 80% (13/9/14 Thunder Shock/Thunderbolt) appeared! Available until 17:24:23 (29m 36s). http://maps.google.com/maps?q=41.61183047913988,-83.69803392610235 …",2017-03-16 16:54:44,842479268823285760
"WATCH: Thunder’s Steven Adams, Enes Kanter star in insane Russell Westbrook for MVP video http://www.cbssports.com/nba/news/watch-steven-adams-enes-kanter-star-in-comical-russell-westbrook-for-mvp-video/ …pic.twitter.com/LjNBlPgeFe",2017-03-16 16:54:37,842479236673945600
"[Midtown] Mareep (67% 4/11/15 Thunder Shock / Body Slam) at unkn unkn 'til 05:23:45pm https://maps.google.com/maps?daddr=40.7605423766,-73.9813959669 …",2017-03-16 16:54:16,842479148610260994
1st anime: Thunder Cats (German dub) in Germany in the late 80s. Sailor Moon in the 90s once we got stationed in TX.,2017-03-16 16:54:08,842479115047505920
thunder cat,2017-03-16 16:53:42,842479008164012038
Oklahoma City Thunder Visit Toronto Raptors Thursday READ MORE: http://www.eog.com/uncategorized/okc-visits-toronto-thursday-nba/ … # betting # picks # odds # sportsbettingpic.twitter.com/swlwMqjkyo,2017-03-16 16:53:10,842478871723294720
Can't wait for the thunder. http://fb.me/13w6F4Rfa,2017-03-16 16:53:02,842478840219885568
YASSSSSS but I love Thunder https://twitter.com/ApplesFree/status/841302580181495808 …,2017-03-16 16:52:44,842478765913657345
WAR THUNDER AIR ASSAULT! FIRST EVER PvE War Thunder PS4 He 219 Gameplay: http://youtu.be/yiRPYu37blI?a via @ YouTube,2017-03-16 16:52:42,842478753934663680
Wild Force> Ninja Storm> Dino Thunder,2017-03-16 16:52:34,842478722234175492
【連載マンガ】「鳥葬のバベル #001 Thunder bird(1)」を読みました！|人気マンガが無料で読める！LINEマンガ|今スグ読む→ https://lin.ee/hIkkpcA/pnjo/twitter … # LINEマンガ,2017-03-16 16:52:23,842478674188283904
"If you're a Thunder fan, this video is funny :) https://twitter.com/JordannLucero/status/842467842813497346 …",2017-03-16 16:52:14,842478639358918656
TTT say thunder fire Marvis,2017-03-16 16:52:10,842478621482717188
War Thunder стрим http://youtu.be/X0YSF5rymU8?a,2017-03-16 16:52:05,842478599248777216
It's alright. Dino Thunder >>> though,2017-03-16 16:52:00,842478577627160576
jungle fury>>>wild force>>>dino thunder,2017-03-16 16:51:34,842478472136212481
"Мне понравилось видео ""ЛЮТАЯ ЖЕСТЬ! ИС-6 ИМЕЕТ РАНДОМ War Thunder!""",2017-03-16 16:51:27,842478439848468480
Streaming War Thunder: http://youtu.be/y7h1yF3o7Tg?a via @ YouTube,2017-03-16 16:51:13,842478382893977601
thunder only happens when it's rainin' pic.twitter.com/KFE1PKyxBz,2017-03-16 16:50:50,842478285074382851
"Get Here! |Mareep |(62.2%)|(10/8/10) Thunder Shock/Discharge til:(05:11:09pm)|(20m 20s) # AugustaRares http://maps.google.com/maps?q=33.48612421867955,-81.97406386088615 …",2017-03-16 16:50:47,842478275175825408
like when I was at Walmart and heard someone say Lightning is God's Cum and thunder is him screaming,2017-03-16 16:50:32,842478208566153216
Long Beach! Toyota Grand Prix of Long Beach Thunder Thursday evening April 6th Now on shoreline drive # lbgp... http://fb.me/8MKL3aHfe,2017-03-16 16:50:30,842478202979270656
Wild Force>>>> Dino Thunder,2017-03-16 16:50:30,842478202043994113
Are we going to deny the fact that EXO's Thunder exists? GREAT LOVEDOING MUSIC I FUND THIS,2017-03-16 16:50:29,842478199321706496
New post on Screaming Thunder: B.U.D.’S Foundation Appreciation and Safety Day at Select Cycle Greensboro NC http://ift.tt/2mzr5Kp,2017-03-16 16:50:13,842478130539483138
very sad day in wrestling. Hope they put Thunder on the network,2017-03-16 16:50:07,842478104773910528
"a hoodie boy can produce thunder by touching ground. a very chill girl can create clouds with her mouth. then, there's ghost everywhere.",2017-03-16 16:50:04,842478092165627904
Watching Dino Thunder>>>,2017-03-16 16:50:03,842478090592944129
"unknown: Raichu 66.7% (9/13/8 - 36.2kg/0.8m - Spark/Thunder Punch) til 14:19:51 (29m 46s). http://maps.google.com/maps?q=32.985633612579576,-117.2237467249657 …",2017-03-16 16:50:03,842478088315256832
【連載マンガ】「鳥葬のバベル #001 Thunder bird(1)」を読みました！|人気マンガが無料で読める！LINEマンガ|今スグ読む→ https://lin.ee/hIkkpcA/pnjo/twitter … # LINEマンガ,2017-03-16 16:49:49,842478030467428353
bash formats like musical thunder,2017-03-16 16:49:41,842477994555916288
"# BBNaija I see you biggy,tryna distract my voting period for Efe ''Thunder fire you;;.........VOTE Efe....teamEfe",2017-03-16 16:49:30,842477951673339905
FOLLOW THE SIGNS OF THE CRIMSON THUNDER,2017-03-16 16:49:22,842477917821177856
http://DMM.com オンラインゲーム 「War Thunder」 君よ、戦場のイカヅチとなれ ◆War Thunderとは 第二次世界大戦前後の航空機で対戦する... http://bit.ly/2e4LRzm # ゲーム・玩具pic.twitter.com/DFBMD0VvTH,2017-03-16 16:49:18,842477899143819265
Ang lakas ng ulan kanina isama na din ang kulog (thunder—tama ba?).,2017-03-16 16:49:05,842477845716729857
When you're averaging a triple-double and the NBA still playing like you not the MVP # nba # okc # thunder # Westbrookpic.twitter.com/5aO3Dmv4mq,2017-03-16 16:49:01,842477827966586881
I know but I can't think of a diaster that matches here.... A thunder storm..??,2017-03-16 16:48:59,842477821758980096
# bbnaija # thunder fire u#hahahahahahhaahahhahahahaha.cant stop laughing,2017-03-16 16:48:40,842477740070764544
sluggy ranks - lightning & thunder Who? https://youtu.be/qur7ebaUryw,2017-03-16 16:48:24,842477674824196096
"TN parents! Apply to join in Strolling Thunder on May 2, 2017. http://www.thinkbabies.org/strollingthunder/ …",2017-03-16 16:48:13,842477625918607360
"unknown: Mareep 82.2% (13/10/14 - 4.7kg/0.5m - Thunder Shock/Thunderbolt) til 14:15:13 (27m 4s). http://maps.google.com/maps?q=32.97213234563251,-117.17128012114405 …",2017-03-16 16:48:07,842477604133257216
The guys r sending thunder to d girls ooo # BBNaija,2017-03-16 16:47:43,842477503163879424
@ HulkHogan show was life every Sunday 'Thunder in Paradise' # Tbt # BeforeTheInternetExisted # tsaon3pic.twitter.com/255jn3jLTj,2017-03-16 16:47:38,842477478568443904
"I mean yeah. But could things like the fire, ice and thunder rod been permanent items? :O",2017-03-16 16:47:29,842477442774241280
Thunder Over Louisville is on My Birthday.,2017-03-16 16:47:26,842477431617474560
"Thunder, thunder, thunder cats...yooo https://twitter.com/MrEnclave/status/495481928389509120 …",2017-03-16 16:47:22,842477413451911168
"@ BBNaija Lol...these guys keep saying ""thunder fire u"" to the judges...kkkkk # BBNaija",2017-03-16 16:47:20,842477405491085313
"Mareep 51.1% (1/12/10/Thunder Shock/Body Slam) till 14:05:21 (18m 15s). lvl30+ CP:501 (L23) http://maps.google.com/maps?q=37.34751861224112,-121.98103554396657 …",2017-03-16 16:47:04,842477340013678592
Get your votes in - Thunderous Thoughts Best Thunder Song Sweet 16 Tournament # ThunderUp # NCAATournamenthttps://twitter.com/jeremylambert88/status/842226755343683584 …,2017-03-16 16:46:59,842477317414961153
Check out mighty morphin power rangers Thunder Megazord Missing Battery Cover Doesn't Work https://www.ebay.com/itm/232272606765 … @ eBay,2017-03-16 16:46:56,842477302680371200
I liked a @ YouTube video from @ robo_thunder http://youtu.be/5gcqfQ_mfIU?a Pokemon Ruby/Sapphire Randomized Soul Link! = Ep1: Re-adventuring,2017-03-16 16:46:42,842477247416229888
They are silently saying thunder fire you # BBNaija,2017-03-16 16:46:35,842477214323134474
# BBNaija They keep on mumbling Thunder fire you,2017-03-16 16:46:31,842477199534030848
Get your votes in - Thunderous Thoughts Best Thunder Song Sweet 16 Tournament # ThunderUp # NCAATournamenthttps://twitter.com/jeremylambert88/status/842226568088952836 …,2017-03-16 16:46:19,842477149294657537
# BBNaija thunder fire you,2017-03-16 16:46:12,842477121339580416
Get your votes in - Thunderous Thoughts Best Thunder Song Sweet 16 Tournament # ThunderUp # NCAATournamenthttps://twitter.com/jeremylambert88/status/842226334956978177 …,2017-03-16 16:45:56,842477051189874689
"Mareep 62.2% [Thunder Shock , Discharge](25m 59s) Available until 05:11:48pm. http://maps.google.com/maps?q=27.373359552662627,-80.30638140759643 …",2017-03-16 16:45:48,842477020953088000
"If Thor is the God of Thunder, why do they only show him using lightning?",2017-03-16 16:45:48,842477017174011905
That's the time I go to bed! Have fun in New York.,2017-03-16 16:45:45,842477008345022465
"Thunder Swamp Soap w/Hemp Seeds for Acne, Skin Abrasions, Psoriasis, Eczema, Dryness http://goo.gl/j8xYpt pic.twitter.com/hMxDumGItj",2017-03-16 16:45:03,842476830867222528
Big thunder mountain http://fb.me/NRMT4gkI,2017-03-16 16:44:58,842476808750661634
Mike Del Vecchio Wins 2017 World Poker Tour Rolling Thunder https://goo.gl/13xsgi,2017-03-16 16:44:37,842476720552869888
"The thunders these legend men have been sending towards the ladies, I fear for the ladies. Good stuff big brother # bbnaija",2017-03-16 16:44:36,842476718296354816
"Lanturn available until 05:13:48pm (29m 34s). Water Gun / Thunder (86.7% - 13/11/15) http://maps.google.com/maps?q=37.557778676056586,-77.4636987827281 …",2017-03-16 16:44:19,842476645726470145
on veut un Thunder/Warriors au 1er tour,2017-03-16 16:44:16,842476634917769218
the Dairanger suits could've been a high-tension transformation when they used the Thunder Zords.,2017-03-16 16:44:05,842476588142870530
lmao,2017-03-16 16:44:05,842476587606036480
"I felt so warm like the sun at it's best days, selfconciousness rises from zero to a hundred in the pace of a thunder crashing down on me",2017-03-16 16:43:37,842476468185776128
Making her supercard debut!!! One of the most dangerous women in wrestling history @ gailkimITSME joins the Thunder tier! # WWESuperCardpic.twitter.com/e9Cf5fXXOX,2017-03-16 16:43:22,842476406881705984
So excited for Chocolate Thunder,2017-03-16 16:43:19,842476392390574080
"I was about to cry when im in the kitchen alone, suddenly the thunder struck n cause blackout",2017-03-16 16:43:17,842476385646002176
"They are saying ""thunder fire you"" under their breath. That's y. Lol # BBNaijahttps://twitter.com/itz_eyetea/status/842475975803846657 …",2017-03-16 16:43:06,842476341131894785
"Marvis - Hey Mr Bally, You Arrogant Piece Of Shit `The Men' - Thunder Fire You Der # BBNaijapic.twitter.com/Y9QPFC0JMz",2017-03-16 16:42:59,842476310102437890
You stealing my thunder? I'm always 5pm brah,2017-03-16 16:42:26,842476173896609792
This is so funny and interesting Marvis :Arrogant piece of sh**t Guy: Thunder fire u # BBNaija,2017-03-16 16:42:15,842476125905383427
[Sportsplex] Tuesday Men's Flag Football : Thunder (27) at Badluck (14) - FINAL https://goo.gl/pzurzj,2017-03-16 16:41:47,842476006770380801
"Nike Zoom Modairna Thunder Blue release on Mar 18, 2017 for $175 via @ kicksonfire # KoFapphttp://kickson.fr/0Jtnl",2017-03-16 16:41:36,842475960297508864
"Well, tonight is round THREE!!!!! Join us for TNT - Thursday Night Thunder Special Guest: Pastor… https://www.instagram.com/p/BRtnj9zBcrG/",2017-03-16 16:41:30,842475937019047939
Police take Break and Enter Suspect into Custody: THUNDER BAY – NEWS – Thunder Bay Police… https://goo.gl/fb/zgdXWe,2017-03-16 16:41:27,842475923765100545
Lwkmd! Arrognt piece of shit!!! Marvis dey use dis platform yab bally! Thunder fire u dere # BBNaija,2017-03-16 16:41:20,842475896523096064
"Видео ""Сложные прЕколы в War Thunder #70."" (http://youtu.be/ebzfIs91Daw?a ) на @ YouTube добавлено в",2017-03-16 16:41:18,842475887207567362
Big game against the thunder today. Gotta get a W with the wizards having a tough stretch coming up,2017-03-16 16:41:17,842475883088683008
LmaooooooooooooThunder fire you # BBNaija,2017-03-16 16:41:06,842475834720018433
"When you don't know whether to watch Cavs-Jazz or Raps-Thunder at 11, or flick between them both at time outs pic.twitter.com/3yq2Mrz3Ty",2017-03-16 16:40:58,842475804797857792
What a thunder cunt of a strike from Ibra oh my,2017-03-16 16:40:48,842475759142862848
The Thunder at the Raptors isn't gonna be on national tv? Why?,2017-03-16 16:40:30,842475686912749568
http://abc7.com/news/lasd-pending-$300k-to-change-belt-buckle-colors-on-deputy-uniforms/1801221/ … Black and Red characteristics for defensive appearance PLEASE!!! Plus it'll look kool;) -Veyron Thunder SS;),2017-03-16 16:40:27,842475671859429376
dino thunder was better,2017-03-16 16:40:21,842475648492965888
@ BBNaija efe lol thunder fire debie rise lol 'the thunder don fire her. # bbnaija,2017-03-16 16:39:49,842475514304557056
"Pikachu in NE Morningside until 16:07:16(29m 45s). IV:91% Thunder Shock/Discharge. http://maps.google.com/maps?q=42.47420449837874,-96.34466802568892 …",2017-03-16 16:39:47,842475506150842369
"ROYAL THUNDER ""Floor"" Acoustic Live Performance http://ift.tt/2mzwl0y",2017-03-16 16:39:28,842475427377606657
"Tucson: Mareep 80.0% (11/13/12 - Thunder Shock/Body Slam - 10.65kg/0.70m) til 13:49:53 (10m 26s). http://maps.google.com/maps?q=32.27510208066762,-110.94810224741839 …",2017-03-16 16:39:28,842475426576384000
"# BBNaija Efe is really funny when Marvis asks him what he w'd do after forgett'g a 5th Marriage Anniversay he goes ""Thunder destroy U""",2017-03-16 16:39:23,842475402715099137
[Sportsplex] Tuesday Men's Flag Football : Thunder (6) at Houston Storm (26) - FINAL https://goo.gl/gNsfmr,2017-03-16 16:39:18,842475383060590592
"[Washington Homes] 51% Lanturn (4/12/7, Water Gun/Thunder) 'til 05:06:54pm (27m 19s). http://maps.google.com/maps?q=35.66201826140933,-78.74066859753808 …",2017-03-16 16:39:04,842475326525587456
Me ha gustado un vídeo de @ YouTube de @ poker988hd (http://youtu.be/0F00sdeMCEI?a - Regalo de un SUB! Speed Art THUNDER GUN By TheJaviBarry,2017-03-16 16:38:29,842475177023836160
"Mareep 62.2% [Thunder Shock , Discharge](29m 44s) Available until 05:08:04pm. http://maps.google.com/maps?q=27.224661522721178,-80.20951679812912 …",2017-03-16 16:38:20,842475140290084864
يارب,2017-03-16 16:38:17,842475126285340677
ROYAL THUNDER “Floor” Acoustic Live Performance https://terrieallison510.wordpress.com/2017/03/16/royal-thunder-floor-acoustic-live-performance …,2017-03-16 16:38:01,842475059818160128
ЛЮТАЯ ЖЕСТЬ! ИС-6 ИМЕЕТ РАНДОМ War Thunder! Обзор танка ИС-6 в War Thunder! Новая имба за БАБОСИКИ! Лайконафтим! РЕ http://video.t30p.ru/post.aspx?id=bd7beb51-2bad-4869-b6f5-2330e8fd9905 …,2017-03-16 16:37:57,842475043275915265
I wish it was thunder-storming. Makes me feel more relaxed.,2017-03-16 16:37:50,842475012762161152
"Mission Hills: Mareep 80.0% (14/10/12 - Thunder Shock/Thunderbolt - 6.19kg/0.55m) til 14:06:01 (28m 10s). http://maps.google.com/maps?q=32.751629244862436,-117.18056153811878 …",2017-03-16 16:37:48,842475007888433152
Thunder draw four walks to force in a run and tie things up 1-1 with No. 6 Messiah in the 2nd. # TrineNation,2017-03-16 16:37:48,842475004344340481
thunder,2017-03-16 16:37:40,842474972719267841
Efe said thunder don fire Debbie # BBNaija,2017-03-16 16:37:38,842474965970624513
"Pikachu - 91.1% (12/14/15) Thunder Shock / Discharge [Morningside] 1601 S Cedar St 51106 till 04:07:16pm (29m 46s) http://maps.google.com/maps?q=42.47420449837874,-96.34466802568892 …",2017-03-16 16:37:29,842474924916764676
"Raise your words, not voice. It is rain which grows flowers, not thunder.",2017-03-16 16:37:25,842474908940660736
Ready to get back at it at the thunder bowl this weekend! pic.twitter.com/1ts1OsP06X,2017-03-16 16:37:06,842474828841992193
Efe:thunder fire u pls leave thunder outta dis # BBNaija,2017-03-16 16:36:50,842474761695465472
Efe say d thunder don fire debie # BBNaija,2017-03-16 16:36:48,842474755823484930
LMAO you will block or unfollow me cus I didn't reply your DM? Really? Thunder fire your yansh,2017-03-16 16:36:41,842474723699224576
Batallas aéreas en directo // WAR THUNDER - Con MrFely80: http://youtu.be/mf5ZUy_6Xhc?a vía @ YouTube,2017-03-16 16:36:39,842474717764321281
Efe: *speaking English* Debie: you can speak the language you are comfortable with Marvis: we accept all languages Efe: thunder destroy una,2017-03-16 16:36:35,842474698487275520
Did Efe just say.. 'Thunder will destroy you?' Lmao # BBNaija,2017-03-16 16:36:33,842474691965157378
"Uthi "" thunder destroy me""",2017-03-16 16:36:25,842474659316744192
"Thunder Bay, ON last night..Winnipeg tonight. Who's ready to bring it? Only a few shows left on… https://www.instagram.com/p/BRtm-PtAgW5/",2017-03-16 16:36:21,842474639796391942
# BBNaija efe say thunder destroy you! e don pass fire!,2017-03-16 16:36:09,842474589913550848
E say thunder destroy u # BBNaija,2017-03-16 16:36:03,842474567352344576
He añadido un vídeo a una lista de reproducción de @ YouTube (http://youtu.be/t9AJgnW45uI?a - War Thunder / Stugpendo por fin lo,2017-03-16 16:35:32,842474433587605504
"lately, you’ve had thunder in your heartbeat & tide-heavy eyelids, but i promise you, things will get better.",2017-03-16 16:35:22,842474391980146694
# NBA Road & Home Full Game # Thunder 13-19 ATS 9-21 Overs/Unders # Raptors 18-14 ATS 19-14 Overs/Unders http://ow.ly/VppT309YDUH,2017-03-16 16:35:07,842474328646160384
Storming her way into the Thunder tier is The Boss herself @ SashaBanksWWEpic.twitter.com/WDyG34bqbJ,2017-03-16 16:35:04,842474316981665792
He añadido un vídeo a una lista de reproducción de @ YouTube (http://youtu.be/Wmg4SacYg-c?a - War Thunder // Jugando con los mayores / Pz,2017-03-16 16:34:56,842474285365100544
Hey guys! Help support Thunder Media & yearbook and enjoy some amazing food @ Chipotle!pic.twitter.com/YEA8zwZWaY,2017-03-16 16:34:52,842474266394165249
Thunder has fired debbie-rise # BBNaija,2017-03-16 16:34:51,842474264691376129
"Hoje as 20H tem Oklahoma city Thunder x Toronto Raptors fora de casa, jogo importantíssimo se queremos ainda... http://fb.me/3DWppYINo",2017-03-16 16:34:41,842474220307288064
"Ha, ha. I will donate 100% if I ever win. I think Fugazi stole my thunder and did it already. I wanted to set the precedent. Dang.",2017-03-16 16:34:34,842474193400799233
"Efe takes things too personal what's ""the thunder don fire am""?? # BBNaija",2017-03-16 16:34:30,842474174278959105
"#171 Lanturn (Water Gun/Thunder 7/7/9 - 51.11%) None Princess Point Trail L8S 3W9, 04:51:28pm (17m 1s left) http://maps.google.com/maps?q=43.27465081892538,-79.89648612273072 …",2017-03-16 16:34:26,842474160517468165
Efe say the thunder don fire Debbie because she was rude to the boys...I love this task! # BBNAIJA,2017-03-16 16:34:20,842474132432384000
Delays on NJ 29 southbound approaching Thunder Rd/Cass St (Trenton) delays due to http://www.511nj.org/IncidentList.aspx?listType=All&885 …,2017-03-16 16:34:15,842474112379453441
Efe say the thunder don hit Debbie my chest oooo#BBNaija,2017-03-16 16:34:14,842474108457783297
"Mareep IV: 33.3% (8/6/1). Thunder Shock/Discharge. Expires: 17:04:02 (29m 50s). http://maps.google.com/maps?q=26.42827809483527,-80.07239433774548 …",2017-03-16 16:34:11,842474093874049024
Russ don't care. (via @ SNFaizalKhamisa) Warriors vs. Thunder - Monday at 8pm ET on TNT pic.twitter.com/4XDJcgAmyf,2017-03-16 16:34:09,842474088308314118
# bbnaija thunder Don fire Debbie,2017-03-16 16:34:08,842474084130803713
"The guys are amusing by telling the ladies under their noses ""Thunder fire you""",2017-03-16 16:34:06,842474073905065985
"Efe just said "" the thunder don fire am"" # BBNaija",2017-03-16 16:33:54,842474023372054529
"You gotta keep smiling, through the thunder and lightning",2017-03-16 16:33:53,842474018787803137
Thunder done fire Debie-Rise # BBNaija,2017-03-16 16:33:45,842473984646168578
Efe say na the thunder don fire am,2017-03-16 16:33:42,842473973615149057
The guys whispering that thunder don't fire Debie-Rise... Lmao,2017-03-16 16:33:40,842473967654965252
"Mareep until 04:49:41pm (16m 5s). 78% (12/14/9 A/D/S), Thunder Shock / Body Slam. 3.0km E of downtown. http://maps.google.com/maps?q=42.28483857031273,-83.71588696598894 …",2017-03-16 16:33:36,842473947761373184
# BBNaija efe that thunder no fire am,2017-03-16 16:33:36,842473946914119681
Efe said 'thunder don fire am'... Lol. Mofoka,2017-03-16 16:33:31,842473929507762178
Efe to Bassey: that thunder don fire am. # BBNaija,2017-03-16 16:33:28,842473915381383168
Nuevo Post (Thunder vs. Raptors Pick - March 16th) publicado en Apuesta Online - http://www.apuestaonline.cl/thunder-vs-raptors-pick-march-16th/ …,2017-03-16 16:33:17,842473869541838848
yeah? That's not what the rest of the Thunder Run campsite said! (You crack me up!),2017-03-16 16:32:26,842473655313534977
TTT just said thunder fire U to Marvis underneath that hand chaaiii Yeye-man efulefu LOL mtheeewww # BBNaija,2017-03-16 16:32:26,842473654185279491
"Ampharos available until 03:01:44pm (29m 25s). Volt Switch / Thunder (64.4% - 10/11/8) http://maps.google.com/maps?q=40.545173305033394,-105.09305273492042 …",2017-03-16 16:32:25,842473651026948097
@ ThunderS7ruck This must be a Fake Tweet https://twitter.com/CallofDuty/status/842452057483165696 …,2017-03-16 16:32:23,842473642596438017
"Мне понравилось видео ""War Thunder: T14 Gameplay"" (http://youtu.be/h7KuwhyVwEM?a ) пользователя @dusan2288",2017-03-16 16:32:11,842473592701042688
Dark Fortress Radio: Now Playing Amon Amarth - Twilight Of The Thunder God TuneIn Player @http://www.makeavoice.com/tunein/?id=6590,2017-03-16 16:32:06,842473571490365441
# Marchmadness and # NBA are going crazy. # utahjazz for the win over # Cavs. # raptors over # thunder. # grizzlies http://Bit.ly/FF_NBA pic.twitter.com/U9CYU8f5ZW,2017-03-16 16:32:05,842473566759211008
"Un PM vient de demander des idées de shows à Vegas pour des /vieilles/ anglaises et, direct avec ma collègue:""THUNDER FROM DOWN UNDER!"" bye.",2017-03-16 16:32:03,842473560467628033
Who's going to Country Thunder?(:,2017-03-16 16:31:50,842473503253184512
I heard bassey saying thunder fire you to d ladies # bbnaija,2017-03-16 16:31:09,842473334122156038
It was Thunder In My Heart by Leo Sayer sweetie xx,2017-03-16 16:30:45,842473232578027521
"The thunder that will fire these girls enh, it is doing press up! Lmaoooo # BBNaija",2017-03-16 16:30:42,842473221123379202
"Raise your words, not voice. It is rain that grows flowers, not thunder. - Rumi # quote",2017-03-16 16:30:37,842473200063766528
TTT said thunder go fire you . Lol.,2017-03-16 16:30:21,842473130828390401
"Marvis: Mr. Tony, you thought you were bill Gates? Do you know how much you have? Bassey: thunder, big thunder naim go fire you # BBNaija",2017-03-16 16:30:18,842473118862049280
"Uma série entre Warriors e Thunder, meu amigo https://twitter.com/BleacherReport/status/842472065173192705 …",2017-03-16 16:30:16,842473111534632960
"After six years, Assad now secure but his country carved up as war thunders on http://crwd.fr/2nsAdEP pic.twitter.com/nkdS6WP1YR",2017-03-16 16:30:11,842473088809943045
# BBNaija tony just said thunder fire them,2017-03-16 16:29:56,842473026620952576
the child is a missing case and is alive and probably not frm kashmir,2017-03-16 16:29:47,842472987018330112
holy fuck stop it thunders,2017-03-16 16:29:45,842472981637009411
"If the Thunder are able to move up in the standings like 4th or 5th seed, Russell Westbrook will win the MVP",2017-03-16 16:29:35,842472936686653447
I 100% say people don't drop off power rangers seasons like ninja storm Dino thunder and ninja storm are my two favs way more then the OG!,2017-03-16 16:29:28,842472909889196032
someone in St Michael is named Rose Thunder?....,2017-03-16 16:28:53,842472761855496193
Introducing the Thunder tier starting with @ BeckyLynchWWE # WWESuperCardpic.twitter.com/FuTafJAg2S,2017-03-16 16:28:48,842472741953396737
Mumu leave my @before thunder strikes you https://twitter.com/tipseebone/status/842472346271268866 …,2017-03-16 16:28:29,842472660344934400
War Thunder реалистичные бои realistic battles Невозмутимый Тигр 2 и его пять фрагов:,2017-03-16 16:28:00,842472540127825921
The thunder have some weapons bro .. Harden is better to me cuz he carries his team better ... Thats all,2017-03-16 16:27:51,842472500042821633
omg i love u thank u,2017-03-16 16:27:50,842472496897048576
My thunder thighs get bigger by the day,2017-03-16 16:27:38,842472445760147456
@ MAGA_Thunder @ WhiteHouse You done ripped all the fake news reporters. It was miraculous,2017-03-16 16:27:14,842472344710860800
ma guilde est classer 1ere du ladder dathura no fake !!! Blood thunder forever !!! pic.twitter.com/akH8uwBaV3,2017-03-16 16:26:47,842472232878252033
@ ThunderS7ruck Quick question why does your wife follow DJ Vahn :D,2017-03-16 16:26:36,842472185839132676
Goddess of Thunder Asuka!,2017-03-16 16:26:04,842472054989316096
