text,date,id
"Pikachu (91.1% 14/12/15, Thunder Shock / Thunderbolt) until 17:26:24 (26m 44s). http://maps.google.com/maps?q=33.927488468771564,-117.39832236239404 …",2017-03-28 19:59:38,846874455066357762
That V8 tho.. Big switch up from the Thunder Bunny # ThunderBunnyRacing… https://www.instagram.com/p/BSM3vKmj6V-/,2017-03-28 19:59:21,846874380332384256
The second period is underway. Solar Bears lead the Thunder 2-0,2017-03-28 19:58:51,846874257812545536
How was everyone this rainy Tuesday? Did you know Ceraunophile (n.) - a person who loves lightning and thunder?,2017-03-28 19:57:53,846874013850877952
ううん..大丈夫！(でるよ)pic.twitter.com/dmVfnMnMTS,2017-03-28 19:57:52,846874006883975168
"Pikachu available until 08:27:36pm (29m 47s). Thunder Shock / Wild Charge (75.6% - 13/6/15) http://maps.google.com/maps?q=37.24326252937047,-77.41932061413662 …",2017-03-28 19:57:49,846873994963947520
Thunder to enter period 2. Have work to do but will secure playoff spot w/win. pic.twitter.com/3dXtYWDpkv,2017-03-28 19:57:46,846873985199624192
My World Record attempt at pulling C-17 at Thunder over Dover in Aug to support police mental health # thereisnostigma @AFPmedia @ JoeHockeypic.twitter.com/4w6Pvi7thF,2017-03-28 19:57:41,846873961921220608
"New artwork for sale! - ""A Female Mallard in Thunder Bay"" - https://fineartamerica.com/featured/a-female-mallard-in-thunder-bay-michael-peychich.html … @ fineartamericapic.twitter.com/ilSrebkscd",2017-03-28 19:57:39,846873952404299776
Watching those clouds in the distance;waiting for that crack of thunder and the rain to pour down and wash clean.,2017-03-28 19:57:35,846873937766219778
Finding out Fulgore was Chief Thunders older brother was quite the plot twist.,2017-03-28 19:57:29,846873914017923072
,2017-03-28 19:56:08,846873570680590336
Thunder Bay Stars under new ownership! http://www.theljhl.com/teams/default.asp?u=TBJRHOCKEY&s=hockey&p=newsstory&newsID=39794 … # LJHL,2017-03-28 19:55:50,846873498903547904
"yup thats another, tropic thunder still kills me too",2017-03-28 19:55:22,846873378346565632
Thunder snow يتصدر قائمة الجياد المشاركة في سباق كنتاكي داربي 100 نقطة pic.twitter.com/1cw1A1ZZYz,2017-03-28 19:55:21,846873375813308416
"In addition, the Thunder Bay Police have yet to call this a hate crime yet theres an eye witness and all facts point to a hate crime.",2017-03-28 19:55:04,846873304396902400
"I thought I was slick saving a dollar by getting great value Dr thunder instead of Dr pepper. Slick, not smart",2017-03-28 19:55:00,846873288060162048
"people talking about people they love is such a nice thing, it always cheers me up some ^o^",2017-03-28 19:54:38,846873193105231872
... When you get photo bombed by Thunder at the @ sfskyforce have!!… https://www.instagram.com/p/BSM3K_mFlc41pJGs1M-ZJmd93ESFEfYbNNq5tM0/ …,2017-03-28 19:54:22,846873129574191106
"first set goes to the thunder birds 25-19, up by 2 points in second set now",2017-03-28 19:53:56,846873019209310208
plan to eat into food coma and taking some melatonin gummiies in hopes i sleep thru these thunder storms,2017-03-28 19:53:54,846873011416416256
"“When I am silent, I have thunder hidden inside.” — Rumi # ALDUBxDTBYPagkikita",2017-03-28 19:53:51,846872999970037760
じゅりであっちょる？！,2017-03-28 19:53:46,846872974896513024
I was in the middle of a nap when i heard the thunder and seen the flash of lighting.,2017-03-28 19:53:40,846872951655944195
サンダーカノン(THUNDERCANNON) - thunder(雷) + cannon(砲),2017-03-28 19:53:23,846872878385512448
THE THUNDERS TEAM RECORD DOES NOT FUCKING MATTER IN THE MVP DEBATE WESTBROOK IS THEMVP,2017-03-28 19:53:11,846872830985883648
And the thunder rolls,2017-03-28 19:53:08,846872817878683648
@ OprahSideNigga watch the thunder vs mavs it was a lit game,2017-03-28 19:53:07,846872814569340928
"428:618 Seem'd all one mutual cry: I never heard So musical a discord, such sweet thunder. # AMNDBots",2017-03-28 19:52:59,846872780498886656
thunder up,2017-03-28 19:52:58,846872776111804416
Greg Anthony talking about the Thunder is,2017-03-28 19:52:52,846872751537340416
Drums of Thunder was great. I had a blast in 5th grade https://twitter.com/seanmspiller/status/846867121892155393 …,2017-03-28 19:52:44,846872718523936768
Thunder favored by 6 over Orlando for tomorrow night.,2017-03-28 19:52:26,846872640816123905
im trying to block out the sound of the thunder with music but it just isnt working and seeing the flash of lighting go-,2017-03-28 19:52:19,846872610449297408
# OKCThunder # ThunderUp # WeAreThunder Oklahoma City Thunder: Westbrook proving he is elite in crunch time http://dld.bz/f8sPZ,2017-03-28 19:52:17,846872603155484676
"Pikachu (9/8/10, Thunder Shock / Discharge) has appeared! Available until 17:20:38 (28m 42s)(7th/MainSt/Iave). http://maps.google.com/maps?q=34.419665921014335,-117.28262910842061 …",2017-03-28 19:52:11,846872577226158080
"Princess Lemon Mockingbird of the line of Tully, heir to the Thunder throne. Hmm. At least the throne sounds pretty cool. https://twitter.com/writer_carrie/status/846814733420417024 …",2017-03-28 19:52:07,846872560339947520
"I just submitted ""The Thunder Feast"" to @ Raindance via http://FilmFreeway.com ! ¡Nos vemos en Londres!",2017-03-28 19:51:59,846872528844996609
"Lanturn, Agawam, MA/42.2%/unknown/Thunder/08:21:44pm (29m 46s). 42.0798763393 -72.6226472833 http://maps.google.com/maps?q=42.079876339308676,-72.62264728326033 …",2017-03-28 19:51:58,846872524487053316
"Wind down your evening with today's Ray Thunder page :: Chapter 2, Page 2 https://tapastic.com/episode/637972 via @ tapas_app # TuesdayReads # webcomics",2017-03-28 19:51:52,846872499719737344
"Mareep (6.7%) Thunder Shock/Thunderbolt 2/1/0 (ATK/DEF/STA) Despawns at 17:21:29 https://maps.google.com/maps?saddr=My+Location&daddr=34.1846626517535,-118.59716825423672 …",2017-03-28 19:51:43,846872459345301504
"Mareep - 46.7% - 12/1/8 (Thunder Shock - 5,Thunderbolt - 80). Until 17:17:30 (25m 53s). North Lacey - Johnson Point http://maps.google.com/maps?q=47.07617660106186,-122.79031010448382 …",2017-03-28 19:51:36,846872431507615745
雷さん おはようございます(o^O^o) 今日１日が雷さんにとって 充実した１日になりますように！！,2017-03-28 19:51:16,846872346740719616
cry if you need to when little thunder was only a month old I felt shell shocked all the time and should have vented more,2017-03-28 19:51:09,846872317674237952
I saw a post from one page that the @ APCNG @ Apc are 'BEGGING' Buhare to continue in 2019?? The thunder wey go fire them still be Virgin.,2017-03-28 19:51:09,846872316713861124
that thunder literally just sounded like someone set a bomb off,2017-03-28 19:51:00,846872282698010626
Im glad its raining but im so scared of the thunder and lighting i think i might cry,2017-03-28 19:50:44,846872214100213760
THERE WAS THUNDER LIKE THIS STUPID THING CALLED UNREQUITED LOVE,2017-03-28 19:50:31,846872159528128512
*Pouts* But I want to know too,2017-03-28 19:50:22,846872119543717888
It's official. We are all being monitored by a service provider. How this will pan out may be the real coming thunder. https://twitter.com/TwitterMoments/status/846850227508133888 …,2017-03-28 19:50:10,846872069400801280
超にくにくしてたよ〜(^^)中年にはちょっと厳しかったけどね(^O^)旨かった。,2017-03-28 19:49:49,846871982633246720
Thunder is rumblin' in the near distance.Looks like tonite is the nite for thunderstorms. I've done all I can to be safe.Rock n' roll time,2017-03-28 19:49:26,846871887401668608
"Lanturn available until 06:18:54pm (29m 47s). Water Gun / Thunder (82.2% - 8/14/15) http://maps.google.com/maps?q=39.75785780962382,-105.16998551917281 …",2017-03-28 19:49:06,846871804228632577
By to be by Baby way wintherney thunder raze,2017-03-28 19:49:04,846871795525472256
"Pikachu 60.0% (7/15/5) Thunder Shock/Wild Charge [Westside] 100-198 S Colon St 51103 07:18:50pm (29m 46s) http://maps.google.com/maps?q=42.496286410008175,-96.44588984941987 …",2017-03-28 19:49:02,846871786306326529
"Mareep available until 08:18:35pm (29m 46s). Thunder Shock / Discharge (75.6% - 14/15/5) http://maps.google.com/maps?q=37.6292888099968,-77.52624729856508 …",2017-03-28 19:48:49,846871732485017600
"A 55.6% 7|5|13 Mareep with Thunder Shock and Discharge has appeared! Available until 20:18:27 (29m 58s). http://maps.google.com/maps?q=35.16145033930829,-79.47702398024269 …",2017-03-28 19:48:33,846871663262289920
"Eastlake Woods: Mareep 80.0% (11/11/14 - Thunder Shock/Thunderbolt - s:large) til 17:17:08(28m 41s). http://maps.google.com/maps?q=32.64252509454795,-116.94637723826314 …",2017-03-28 19:48:23,846871623856631809
Swats her hands away NO! Causes thunder and lightning,2017-03-28 19:48:17,846871598925856768
"Oklahoma City # Thunder vs Dallas # Mavericks # NBA Full Game # Replay Mar 27, 2017https://fullmatch.net/oklahoma-city-thunder-vs-dallas-mavericks-nba-full-game-replay-mar-27-2017/ …",2017-03-28 19:48:15,846871586561019904
왜왴ㅋㅋㅋㅋㄱㄱㄱㅋ 언니 같이웃잨ㅋㅋㅋㅋㅋㄱ,2017-03-28 19:48:05,846871546832478209
大丈夫！きっと大丈夫☆ (8体出ると)信じようよpic.twitter.com/oLvAQr6RsX,2017-03-28 19:48:01,846871530797645825
You can even see his finger nails. How is that for enhancement in thunder storm from 100 feet away inside a truck at night. pic.twitter.com/NVkwnWDO95,2017-03-28 19:47:37,846871427278090240
"Chula Vista: Mareep (80.0%IV 11/11/14 Thunder Shock/Thunderbolt 0.7m/9.6kg). TTH: 05:17:08pm [29m 41s] http://maps.google.com/maps?q=32.64252509454795,-116.94637723826314 …",2017-03-28 19:47:26,846871383401381888
"Brook Lopez hits two free throws for his first points since Dec. 20, 2013. Nets lead Thunder 52-31 late in second quarter.",2017-03-28 19:47:26,846871381685944320
i cant sleep without the sound of the rain/thunder/wind outside or the sound of the air conditioner but it's too cold to turn it on,2017-03-28 19:47:08,846871306809282560
"right? my mom said theres gonna be a ""big storm"" but just rain & a lil thunder is not a big storm",2017-03-28 19:47:05,846871295849586688
I liked a @ YouTube video from @ phlydaily http://youtu.be/oz3XzjqBbXg?a BEST TANK IN THE GAME - M551 Sheridan ATGM (War Thunder Tank,2017-03-28 19:47:04,846871292443836417
"A wild Lanturn (66.7%,9/9/12) (Charge Beam,Thunder) has appeared! Available until 17:16:46 (29m 45s). http://maps.google.com/maps?q=33.66217614363371,-117.79171184279369 …",2017-03-28 19:47:00,846871273170878464
"""A nigga chillin to the day he's six feet under , a Nigga chillin through hell any storm fuck the thunder""",2017-03-28 19:46:55,846871254732718080
"""What?"" She knows she didn't do anything particularly fire worthy",2017-03-28 19:46:55,846871254040743941
I told my neighbor same thing earlier lmao.Went off vs thunder LOU will DROPPED 30 now he gonna go 2/12 and a lot of bench TOS,2017-03-28 19:46:52,846871240950329345
"Electabuzz 76% (13/13/8) Low Kick/Thunder until 07:16:29pm (29m 41s) Firewheel [2] http://maps.google.com/maps?q=32.95369150750241,-96.61150445140545 …",2017-03-28 19:46:47,846871219878092800
Hey @ darkskyapp will you support thunder and wind gust data at some point??,2017-03-28 19:46:38,846871183265951745
"Westbrook, Thunder top Mavs 92-91 with 14-0 finishing run - DALLAS (AP) — Russell Westbrook hit a pull-up jumpe... http://ow.ly/Sdrf50auv59",2017-03-28 19:46:04,846871037291716609
This was me and @ B_Abbott15 when a Lapras came up but we were already in line for Thunder Mountain # PokemonGopic.twitter.com/nshHmpxAe5,2017-03-28 19:45:34,846870912628502528
igual el amor de mi vida sigue siendo Bonnie Thunders,2017-03-28 19:45:28,846870890159788033
"Lanturn - 64% (Charge Beam/Thunder) till 08:13:04pm (27m 54s). Found at 166 Forward Ave (West London) http://maps.google.com/maps?q=42.97902478894664,-81.27704690964372 …",2017-03-28 19:45:13,846870824351154179
雷ちゃん、きをつけて。,2017-03-28 19:45:05,846870789810937857
"2013 Chevrolet Silverado 1500 Red Dirt Road Thunder 20x12 -44 Federal Couragia MT 33""x12.5"" Leveling Kit... http://fb.me/1X39ilE2I",2017-03-28 19:45:02,846870780432564224
"You can still see Keystone's mining heritage, including the Holy Terror Mine and the Big Thunder Gold Mine, which you can tour. pic.twitter.com/FXNC5Wnfpc",2017-03-28 19:45:01,846870774652776448
"Temecula: Mareep 82.2% (14/8/15 - Thunder Shock/Discharge - s:large) til 17:04:30(19m 32s). http://maps.google.com/maps?q=33.47551062399861,-117.12707274762725 …",2017-03-28 19:44:58,846870763009273861
"""I'm worried about our lack of thunder.""",2017-03-28 19:44:20,846870602166218754
"As soon as I saw ""fantastic dad dancing"", Danny Bowes was the first name to pop into my head without knowing it was Thunder!",2017-03-28 19:44:14,846870577960931328
honestly i feel like hell but...! i hope you're ok,2017-03-28 19:44:08,846870552237264896
Hinderliter Commits to Trine University Jr. Flyers Defenseman Set to Join Thunder this Fall - http://bit.ly/2ngPkgY # EasternHockeypic.twitter.com/AL5r67eOLs,2017-03-28 19:43:54,846870491931512832
"Diego Verdaguer & Paquita la del Barrio en Thunder Valley Casino Resort, Lincoln, CA 7/8 Now on sale!!!! http://goo.gl/I1qkpg pic.twitter.com/huwGK79TID",2017-03-28 19:43:22,846870361727631360
Thunder Snow's name came from the Name Your Derby Horse Auto Name Generator Game?,2017-03-28 19:43:19,846870347274207232
RT ThePressofAC: Watch: Thunder Storms Form over Cape May County http://videos.pressofatlanticcity.com/Thunder-Storms-Form-over-Cape-May-County-32184826?vcid=32184826&freewheel=91757&sitesection=pressofac …,2017-03-28 19:43:06,846870294153302016
charles up that manjoume thunder,2017-03-28 19:43:05,846870287903703040
"Carmel Mt: Lanturn (48.9%IV 9/3/10 Charge Beam/Thunder 1.3m/22.5kg). TTH: 05:12:49pm [29m 46s] http://maps.google.com/maps?q=32.97819283568995,-117.0795461330037 …",2017-03-28 19:43:02,846870277896093696
Well I thank New Orleans if they hadn't let the hornets come to okc we would have never gotten the thunder https://twitter.com/lrnrose/status/846863430980128768 …,2017-03-28 19:42:43,846870196119851008
you are my favorite. So sad to see you killed. BTW: still love you in Tropic Thunder!,2017-03-28 19:42:36,846870167720148993
I just played thunder by myself to prepare for spring break... smh,2017-03-28 19:42:28,846870131787620353
100% PROOF WHY WESTBROOK IS MVP! RUSSELL WESTBROOK GAME WINNER REACTION! Thunder vs Mavs HIGHLIGHTS https://youtu.be/7S2ctsI_kec @ OprahSideNiggapic.twitter.com/e3HCojOcRi,2017-03-28 19:42:08,846870049369604100
Watch: Thunder Storms Form over Cape May County http://videos.pressofatlanticcity.com/Thunder-Storms-Form-over-Cape-May-County-32184826?vcid=32184826&freewheel=91757&sitesection=pressofac …,2017-03-28 19:42:00,846870016129732609
list of new RPG classes: porn druid thunder chunker my wife wickerman night hulk barnyard shitterz Sword Fuck sewer slurper,2017-03-28 19:41:21,846869852874854400
Songbird Cafe Radio Now playing Waitin' On Thunder by Brad Puckett!,2017-03-28 19:41:09,846869801456742401
What! Two trains on Thunder Run? Will there be transfer track now! https://twitter.com/KentuckyKingdom/status/846776092618842114 …,2017-03-28 19:40:57,846869750831566849
"Lanturn - 38% (Charge Beam/Thunder) till 08:09:27pm (28m 45s). Found at 1947 Wavell St (Argyle) http://maps.google.com/maps?q=42.99953750532376,-81.17040017795172 …",2017-03-28 19:40:51,846869726143942656
"A wild Lanturn (35.6%,3/4/9) (Charge Beam,Thunder) has appeared! Available until 17:06:01 (25m 20s). http://maps.google.com/maps?q=33.801853797750894,-117.95972632940962 …",2017-03-28 19:40:41,846869682447527936
I liked a @ YouTube video from @ chris_smoove http://youtu.be/jPXFH8ZZL0Q?a Russell Westbrook Game Winner! Thunder Comeback Down 13!,2017-03-28 19:40:30,846869636817702913
Best of luck to @ prostocktuck at the @ 400Thunder Santo's Super Thunder # 400thunder # ihra # dragracing # ihraaushttps://twitter.com/dragnewsaus/status/846863041975087104 …,2017-03-28 19:40:27,846869625975418884
"não vai ser hahahahha e pede o chocolate thunder from down under,vulgo brownie com sorvete",2017-03-28 19:40:26,846869621819015168
Thunder on the Horizon: 4 Security Threats for the Cloud https://www.tripwire.com/state-of-security/risk-based-security-for-executives/connecting-security-to-the-business/thunder-horizon-4-security-threats-cloud/?utm_source=The+State+of+Security+Newsletter&utm_campaign=c58e800fd5-EMAIL_CAMPAIGN_2017_03_27&utm_medium=email&utm_term=0_a2892d69fb-c58e800fd5-271323845 …,2017-03-28 19:40:26,846869620317290498
like the thunder,2017-03-28 19:40:20,846869598087528448
"Ampharos (F) (IV: 31%, TTL: 23m 47s) (Charge Beam/Thunder): 32.265881,-111.003335 https://maps.google.com/?q=32.265881,-111.003335 …",2017-03-28 19:40:14,846869572967895040
"North Tucson: Ampharos 31.1% (6/8/0 - Charge Beam/Thunder/normal til 17:04:02(23m 47s). http://maps.google.com/maps?q=32.26588133017712,-111.0033345961265 …",2017-03-28 19:40:14,846869570702868480
"West Tucson: Ampharos 31.1% (6/8/0 - Charge Beam/Thunder/normal til 17:04:02(23m 47s). http://maps.google.com/maps?q=32.26588133017712,-111.0033345961265 …",2017-03-28 19:40:14,846869570698686464
"That's the end of the first period. Solar Bears lead the Thunder 2-0. (Shots: Adk 15, Orl 8)",2017-03-28 19:39:52,846869479325913089
A1. Thunder and lightening! Worst storm I'd ever seen. I thought we were goners! # WeGetOutside ⛆https://twitter.com/Some_Eventful/status/846868863249776640 …,2017-03-28 19:39:51,846869475152596994
"Lanturn - 31% (Water Gun/Thunder) till 08:37:50pm (58m 21s). Found at 1460 Oxford St E (Huron Heights) http://maps.google.com/maps?q=43.01257483000376,-81.19864703154103 …",2017-03-28 19:39:32,846869395209097216
TRILL ZILLA ft Chasing Thunder - Letters (OFFICIAL MUSIC VIDEO) [OUT TODAY]... http://fb.me/1qfbgdCf9,2017-03-28 19:39:31,846869390276550657
Rain isn't much fun without thunder and lightning.,2017-03-28 19:39:20,846869343178821633
"did it just thunder, or am I just hopeful ? ? ?",2017-03-28 19:39:14,846869320672067584
@ FredKatz 1/2 TQ - At the start of the season you said that the Thunder could have a top 10 defence (which they are).,2017-03-28 19:39:02,846869269061120000
Days of Thunder is still the greatest movie of all time.,2017-03-28 19:38:49,846869216661852163
its set a while past whatever canon books are being published like a decade or a bit less. the main clans are thunder and shadow,2017-03-28 19:38:44,846869191630184448
What does that have to do with the Thunders/Russell's clutch play? Nothing.,2017-03-28 19:38:43,846869187624484864
"Lanturn - 69% (Charge Beam/Thunder) till 08:08:02pm (29m 31s). Found at 229 Oakland Ave (East London) http://maps.google.com/maps?q=42.99294076760094,-81.20303814899144 …",2017-03-28 19:38:36,846869161884225537
"C Strand: Lanturn 93.3% (15/13/14 - Water Gun/Thunder - s:small) til 17:08:11(29m 47s). http://maps.google.com/maps?q=32.64737747365989,-117.143341433291 …",2017-03-28 19:38:21,846869095387611137
"freak yeah , u felt the lighting bolt across my head. I like thunder tho",2017-03-28 19:38:18,846869084222472192
White Zombie - Thunder Kiss '65 https://youtu.be/yPNFVj-pISU?list=RDH8gHMU-pDbU … vía @ YouTube,2017-03-28 19:38:14,846869069710151681
I wee email thunder to you soon. And a sprinkle of lightning,2017-03-28 19:38:02,846869017293934592
Oklahoma City Thunder vs. Orlando Magic - 3/29/2017 Free Pick; NBA Betting Prediction - # Thunder # Magichttp://cappe.rs/f141a,2017-03-28 19:37:15,846868820526600193
Deportes>OKC Thunder gana dram�ticamente http://soydemexico.com/news/77003/okc-thunder-gana-dram …疸icamente,2017-03-28 19:37:02,846868767841898497
Or Kylie. Or Madonna. Or Siouxsie. Or Thunder.,2017-03-28 19:36:55,846868738414653440
Fantastic flight from Toronto to Thunder Bay and the attendants were just fantastic - thanks WestJet # westjet,2017-03-28 19:36:54,846868731716349952
Would you rather enter a thunder or propel a page?,2017-03-28 19:36:50,846868713626353664
thunder won't strike twice...it will strike x3 times,2017-03-28 19:36:47,846868702574383105
AND THEN TELLIUS COMES IN AND ADDS ANOTHER TRIANGLE WITHIN ANIMA WIND > THUNDER > FIRE > WIND,2017-03-28 19:36:42,846868680160022528
@Air_St33vo .ogaaa lockup!.am nt an okc fan bt u gotta respect RW n d thunder mhn.!comon!...have respect for numbers bruh!,2017-03-28 19:36:37,846868662174797824
DC's Thunder Beast takes on a Monster http://dlvr.it/NlMHcH # reddit # dcpic.twitter.com/CZPzitp1uW,2017-03-28 19:36:35,846868653039542273
Just gettin to @ INTRUSTarena to watch a little @ Wichita_Thunder hockey,2017-03-28 19:36:33,846868642721648640
"Lanturn available until 08:02:08pm (25m 47s). Water Gun / Thunder (40.0% - 2/10/6) http://maps.google.com/maps?q=37.603440787697885,-77.5503435143279 …",2017-03-28 19:36:20,846868591765078016
"aaah I've not seen you yet mate, I'm on Thunder Mountain. You staying for the fireworks?",2017-03-28 19:36:07,846868533392879617
http://ift.tt/2o8vwjP La Sportiva Thunder GTX mens 7.5 Brown Gore tex,2017-03-28 19:35:16,846868319928012800
# サンダースあるある 後援会の特典で、『ノーマル』なのに意外と出てこない、ブレイビー、荒木社長、北ＨＣ、などのスタッフのトレーディングカード。確率的に『レア』が出る方が高いかも。 @ brave_thunders,2017-03-28 19:35:11,846868300453691394
"Hast thou not spoke like thunder on my side, # shakespeare",2017-03-28 19:35:02,846868260586995712
いろいろと展開してた(笑)五万…,2017-03-28 19:34:46,846868196925718528
I don't think theres a thunder game today https://twitter.com/_Njay3/status/846866451436883970 …,2017-03-28 19:34:19,846868080307392512
NE1fm 102.5 is playing : Thunder by Prince And The New Power Generation # NowPlaying,2017-03-28 19:34:10,846868042831331329
Doctors tell Thunder Bay woman hit by trailer hitch that she has just weeks to live - APTN NewsAPTN News http://ln.is/aptnnews.ca/2017/03/82fKm …,2017-03-28 19:34:09,846868040063078400
# MilwaukeeBucks # Bucks # FearTheDeer Thunder Buddies podcast: Can Russell Westbrook catch the Big O? http://dld.bz/f8tub,2017-03-28 19:34:04,846868019167023104
6:32 The Japanese House - Face Like Thunder,2017-03-28 19:34:01,846868007385268225
Russ > Harden Rockets > Thunder,2017-03-28 19:33:41,846867923696181248
lol you play too much! Should I try for the first black female or should I let you have your thunder?,2017-03-28 19:33:35,846867896819236866
(all)舞子パで闇完封闘技場やりまそ(๐^╰╯^๐),2017-03-28 19:33:33,846867887620947968
"Raise your words, not your voice. It is rain that grows flowers, not thunder. # ALDUBxDTBYPagkikita",2017-03-28 19:33:28,846867869988089856
"Splash Mountain, Big Thunder Mountain Railroad isn't as fast but it's cool too https://twitter.com/galwaygai/status/820507425044213760 …",2017-03-28 19:33:23,846867849046044672
Let you be the lightning to your enemies thunder,2017-03-28 19:33:16,846867815906848773
"Lanturn (93.3% 14/13/15, Charge Beam / Thunder) until 16:55:43 (22m 35s). http://maps.google.com/maps?q=34.043209734721664,-117.19949064322269 …",2017-03-28 19:33:07,846867778640367616
"I sing of zeus: oak trees, eagles, thunder, open sky.",2017-03-28 19:32:52,846867717005168640
This gets funnier every time loooool - Warriors vs Thunder | Enes Kanter Postgame Interview | G... https://youtu.be/5_Muq9dczao via @ YouTube,2017-03-28 19:32:48,846867699884023811
can't believe I'll be at country thunder on my birthday,2017-03-28 19:31:23,846867342185263104
I liked a @ YouTube video http://youtu.be/vvlMZ5XD5DI?a Frank Carter & The Rattlesnakes - Thunder (Official Audio),2017-03-28 19:31:21,846867333796683776
"look at the good drafts of yours they are as stunning as Thunder Wave (Pokemon) detail,anatomy,its all good",2017-03-28 19:30:54,846867221397811200
"A wild Lanturn has appeared! IV: 51.1% (A:12/D:3/S:8) Charge Beam Thunder Available until 20:00:20 (29m 31s). http://maps.google.com/maps?q=34.17531392899574,-79.7672797256235 …",2017-03-28 19:30:43,846867175566553089
War Thunder - Duelo de Clans - ROTA vs FnxSq: http://youtu.be/L6WJBw_HHL4?a via @ YouTube,2017-03-28 19:30:32,846867129961857024
"Raise your words, not your voice. It is rain that grows flowers, not thunder. – Rumi # gemstonejewelry # Rumi # yoga # mala # malabeadspic.twitter.com/BdPONZNMU0",2017-03-28 19:30:28,846867114606690304
Have you read today's Blog Article: Like Thunder & Lightning They Strike http://gloriahass.weebly.com/glorias-blog/like-thunder-lightning-they-strike …,2017-03-28 19:30:23,846867092280430593
"Heads up @ HFXMooseheads music guy: Thunderstruck is always played in Rouyn-Norando to get Huskies fans going.They chant Huskies, not thunder",2017-03-28 19:30:08,846867030615752706
oh no no no thunder,2017-03-28 19:30:02,846867004120350722
"La Jolla: Lanturn (42.2%IV 4/0/15 Water Gun/Thunder 0.9m/17.8kg). TTH: 04:59:27pm [29m 47s] http://maps.google.com/maps?q=32.844605351736774,-117.27555678461553 …",2017-03-28 19:29:39,846866909165338624
was nice . Wish we had some severe stuff...Thunder...But I'll take the rain.,2017-03-28 19:29:39,846866908989272064
but i can make it this week!,2017-03-28 19:29:35,846866892337922048
"# ElFierroteDelMetal en ""Born to be wild"" en una parte dice ""Heavy metal thunder"" ¿Tendrá que ver algo pero con el término?",2017-03-28 19:29:34,846866887732596740
I hate thunder,2017-03-28 19:29:15,846866805381582849
I got put on antibiotics for 10 days and part of those 10 days is Thursday Friday of Country Thunder and you can't consume alcohol,2017-03-28 19:29:10,846866784833691648
