text,date,id
"Electabuzz available until 08:18:53pm (19m 4s). Thunder Shock / Thunderbolt (46.7% - 13/5/3) http://maps.google.com/maps?q=37.294046642137,-78.3963539564384 …",2017-03-16 19:59:54,842525866861232129
Q1 done in Toronto. Thunder leads Raptors 29-24. -Oladipo 7p -Kanter/Gibson 6p each - -Westbrook 5a,2017-03-16 19:39:10,842520648731844612
Thunder subnormal tiene canal de yt XDD,2017-03-16 19:59:35,842525787123339265
Tonight's Thursday Night Thunder Lineup only on Periscope! Real N uncut! @ JsScope @ joeygiggles @ Genevivie @ QuynhfortheWiiN @ periscopetvpic.twitter.com/pD7FQQbDDh,2017-03-16 19:59:30,842525764205645824
"Thunder vs. Raptors - Game Preview - March 16, 2017 - ESPN # ChainFeedsDotCom http://espn.go.com/nba/preview?gameId=400900410 …",2017-03-16 19:59:30,842525763987542018
"Electabuzz (55.6%-0/13/12,Thunder Shock/Thunderbolt) until 17:27:39 (29m 24s)http://maps.google.com/maps?q=33.89490741206189,-118.02697972334174 …",2017-03-16 19:59:19,842525721193013250
I am afraid of the dark behind my eyes and the thunder within my heart # MadVerse # inkslingers,2017-03-16 19:59:15,842525701525950466
Thursday thunder at up & unders. Except I'm leaving soon. Ish,2017-03-16 19:59:08,842525672581087232
New sad poem on the way Finna be about @sleeepybabe stealing my thunder,2017-03-16 19:59:04,842525657083138048
I've had two people today tell me that Power Rangers Dino Thunder was a shit series,2017-03-16 19:58:43,842525568667172864
watching Oklahoma City Thunder vs Toronto Raptors,2017-03-16 19:58:35,842525533329997824
It's raining and storming and thunder by exo came on bless this coincidence,2017-03-16 19:58:29,842525509011496960
Rec in the @ aldebaranmusic @thunder_family_clothes con @seo2elguerrero @ cronel @ emeese @azer_ovejanegra # plo http://fb.me/84LPoC1bQ,2017-03-16 19:58:24,842525489424031745
"Electabuzz (55.6%-0/13/12,Thunder Shock/Thunderbolt) until 17:27:39 (29m 24s)http://maps.google.com/maps?q=33.89490741206189,-118.02697972334174 …",2017-03-16 19:58:15,842525449368420352
"Thunders out a laugh. ""I live for the sound of her squeal when My teeth sink in."" https://twitter.com/VonDominant/status/842525275569229826 …",2017-03-16 19:58:11,842525435326095360
TIL,2017-03-16 19:58:08,842525419626741760
@ Boones_Goons stealing thunder https://twitter.com/flapantherspr/status/842525122447708160 …,2017-03-16 19:57:54,842525364719050752
"First it was James Harden, then Reggie Jackson, now Dion Waiters and KD. All great players who improved after leaving Thunder.",2017-03-16 19:57:42,842525310910418946
watching Oklahoma City Thunder vs Toronto Raptors,2017-03-16 19:57:39,842525301129338881
Raptors have been slow from the jump and simply cannot catch up to the pace of the Thunder in the 2nd. Their struggles continue. # RTZ,2017-03-16 19:57:30,842525262696931328
"Adams with the layup, causing raptors to call a timeout. thunder have gotten the lead back to 7, 43-36 with 5:19 left till half.",2017-03-16 19:57:25,842525242673319940
TimeOut! 2°Q 5:19 Thunder 43 @36 Raptors # NBA,2017-03-16 19:57:20,842525220674158594
"TIMEOUT Raptors 36 - 43 Thunder. Raptors não consegue passar no placar, errando muitos arremessos fáceis. # WeTheNorth",2017-03-16 19:57:19,842525217218072576
Thunder fans getting loud at our Tulsa watch party! # ThunderUppic.twitter.com/FtOskW52lw,2017-03-16 19:57:15,842525199274786817
I added a video to a @ YouTube playlist http://youtu.be/RTxm48j1Kxg?a WHEN BIAS PREVAILS! - War Thunder RB Gameplay,2017-03-16 19:57:09,842525174759133186
sighhhhhhhhhhhh. Im still not dropping a dime even tho I went back to playing Black ops 3.,2017-03-16 19:57:07,842525165795721217
"Mareep 64.4% [Thunder Shock , Discharge](27m 46s) Available until 08:24:38pm. http://maps.google.com/maps?q=27.353826298516896,-80.37982684486664 …",2017-03-16 19:56:52,842525102017339396
My first half Thunder-Raptors recap so far. pic.twitter.com/R7l7xDKX5j,2017-03-16 19:56:32,842525017267195904
Foto @thunder__fly - Pra animar essa noite quente de verão... # indaiatuba # parqueecologicodeindaiatuba ... http://fb.me/2Rsmd8S90,2017-03-16 19:56:26,842524991749079041
"Lanturn available until 08:26:05pm (29m 46s). Charge Beam / Thunder (60.0% - 5/9/13) http://maps.google.com/maps?q=39.19519241773784,-76.87727572161347 …",2017-03-16 19:56:25,842524988750073859
Good games tonight — watching Oklahoma City Thunder,2017-03-16 19:56:19,842524964301557760
still haven't seen a movie funnier than tropic thunder since tropic thunder,2017-03-16 19:56:02,842524894910803969
Rodeo Houston | @ rodeohouston The thunder is rolling in 2018! @ garthbrooks is coming to # RODEOHOUSTON.pic.twitter.com/QhNiSU8qq3,2017-03-16 19:55:58,842524877001318400
Rodeo Houston | @ rodeohouston The thunder is rolling in 2018! @ garthbrooks is coming to # RODEOHOUSTON.pic.twitter.com/6x5DGHMXtR,2017-03-16 19:55:58,842524876116299778
"phcn i swear y'all better eat this light cos if you even mistakenly restore it this night, thunder will fire your heads",2017-03-16 19:55:58,842524875814293505
"1. Because volcanoes, tornadoes, floods, meteor showers, thunder/lightning, seasons = terrifying 2. lessons/laws/control",2017-03-16 19:55:57,842524871129206784
I'm not seeing Big Thunder Mountain Railroad on this list.,2017-03-16 19:55:51,842524846114459648
"Thunder is good, thunder is impressive, but it is the lightning that does the work. -Mark Twain",2017-03-16 19:55:34,842524773628502017
"アメリカン チョッパーハーレーダビッドソン Harley DavidsonAmerican Thunder X Harleyアメリカ買付 USA直輸入 通販 JPY 6,500,000 アメリカン チョッパー、ハーレーダビッ… http://ift.tt/2ntcm7W",2017-03-16 19:55:21,842524721526820864
"yes, little baby Jebus will be upset if you start too early. And when he gets upset it thunders",2017-03-16 19:55:18,842524709040373761
@ HayesTSN you see what the thunder do for Westbrook on missed free throws by the raptors?,2017-03-16 19:55:14,842524693668098048
"The Thunder haven't played well since Russ first subbed out, but the refs are calling a horrific game",2017-03-16 19:55:12,842524685317431298
笑った(≧∀≦) ガハハハ あっ おは蜜,2017-03-16 19:54:51,842524593210310656
Cannot wait for the Dubs to play the thunder again - bitch ass Westflake will get to meet Curry,2017-03-16 19:54:39,842524543948267520
"A set i played for Paratoumpa Radio . ""Sweet thunder"" # Cyprus # Mixcloudhttps://www.mixcloud.com/616selexionz/sweet-thunder/ …",2017-03-16 19:54:38,842524541360521217
"and Take Russell off the Thunder , where would the Thunder be? I'll wait.",2017-03-16 19:54:30,842524508607123457
"I am so stoked, I got my country thunder wrist band in the mail!! 2 years in a row!! # CTAZ2017",2017-03-16 19:54:28,842524498666516481
soery i hacked it imm just pissed in thunder im really really sorr,2017-03-16 19:54:18,842524458422222849
"Watching the Nets game, turned off the Thunder game. I've already watched the Thunder and the raptors play, never the Nets.",2017-03-16 19:54:16,842524448980979712
"My fav, really, for sure but, without thunder and joon sunbae :(",2017-03-16 19:54:05,842524402340184064
How did I not know there was a Thunder watch party in Tulsa?!?! https://twitter.com/okcthunder/status/842524079940915200 …,2017-03-16 19:53:49,842524336263172096
Its pretty odd though that we're playing a former Thunder player on two different teams in one season.,2017-03-16 19:53:47,842524326943473665
Things don't always go Purrrrfect! Turn up the Thunder Struck and take it to Tampa! # TMLtalk,2017-03-16 19:53:46,842524322161987584
Lmao Look at Thunder bigs cleared out after freethrow so Russ can get the rebound.,2017-03-16 19:53:30,842524255132811265
mmmm that would freak freaking awesome - the TotW engine is so freaking perfect for Metroid,2017-03-16 19:53:22,842524223239159808
"Mareep available until 08:22:52pm (29m 52s). Thunder Shock / Body Slam (35.6% - 11/0/5) http://maps.google.com/maps?q=37.14961041665301,-80.40548278428474 …",2017-03-16 19:53:05,842524152452014080
"# OKCThunder # ThunderUp # WeAreThunder Thunder Notes: Gibson, Bench, Rotation, Roberson http://dld.bz/f6jNS",2017-03-16 19:53:03,842524142498930688
Thunder has committed 11 fouls in the half. Toronto 15-18 from the FT line.,2017-03-16 19:53:01,842524135909703680
Thunder fans getting loud at our Tulsa watch party! # ThunderUppic.twitter.com/PzkgxzwsyZ,2017-03-16 19:52:48,842524079940915200
War Thunder IS-6: http://youtu.be/S_HpotssLvA?a vía @ YouTube,2017-03-16 19:52:35,842524024940957698
Segunda feira tem Warriors vs thunder,2017-03-16 19:52:35,842524024790040576
can't wait for camping season! I've got a tent in my basement and I play thunder music and chill out there sometimes. Good times,2017-03-16 19:52:29,842523998546223105
"N SDSU Campus: Ampharos 68.9% (14/12/5 - Volt Switch/Thunder - 56.83kg/1.34m) til 17:18:27 (25m 55s). http://maps.google.com/maps?q=32.77730326495544,-117.07219094406375 …",2017-03-16 19:52:29,842523997963141121
"Mareep 46.7% (6/10/5/Thunder Shock/Body Slam) till 17:18:28 (26m 2s). lvl30+ CP:638 (L29) http://maps.google.com/maps?q=37.341068747354875,-121.98698846358594 …",2017-03-16 19:52:24,842523980720365568
"OKC Thunder broadcast just said, ""99% of success is showing up."" Umm. The quote is 80. If it were 99%, you'd have to really be lazy to fail.",2017-03-16 19:52:16,842523944242626561
really wish I was going to Thunder Bay or Winnipeg this weekend. I really wanna see Beauty & The Beast,2017-03-16 19:51:58,842523871085563906
I liked a @ YouTube video http://youtu.be/f3K5KU5V_FA?a Elvis Presley-The Thunder Rolls,2017-03-16 19:51:55,842523858464849921
"Thunder led 25-15 when Westbrook went to the bench with 2:47 to play 1Q. When he came back at 8:36 2Q, lead was 35-30.",2017-03-16 19:51:54,842523854694236160
@ okcthunder @ russwest44 is just Russ-lentless! MVP Caliber Season fosho! # okcthunder # thunder # westbrook # ThunderUp # nba # MVPpic.twitter.com/uv6B94jK6D,2017-03-16 19:51:42,842523800587591680
VJA # thunder,2017-03-16 19:51:25,842523730895159296
Be the thunder ☇☇ https://www.instagram.com/p/BRt9SZHD-MQUOR3KudS4RbaDDPwvzZwxY5-5Kw0/ …,2017-03-16 19:51:20,842523710934466561
【連載マンガ】「鳥葬のバベル #001 Thunder bird(1)」を読みました！|人気マンガが無料で読める！LINEマンガ|今スグ読む→ https://lin.ee/hIkkpcA/pnjo/twitter … # LINEマンガ,2017-03-16 19:51:16,842523691871232001
Thunder in May by Andy Johnson https://www.amazon.co.uk/dp/B005OZ71OE/ref=cm_sw_r_tw_dp_x_NtYYybYVQGEZV … via @ AmazonUK,2017-03-16 19:51:15,842523688926961665
"Russ back in, as Thunder are now only up 4.",2017-03-16 19:51:12,842523678579613696
a 2 v7 Warriors-thunder series under that circumstance would be the most fun.,2017-03-16 19:51:09,842523662410383360
This @ okcthunder game is good. Thunder Game + 1/2 price apps? Even better. # ThunderUppic.twitter.com/GXcDJdYKpy,2017-03-16 19:51:06,842523650322546689
Must Watch: Robbers Struck By Thunder After Stealing from Church: http://youtu.be/qJImHmMAfyk?a via @ YouTube,2017-03-16 19:51:06,842523649995427841
Come On Raptors...! — watching Oklahoma City Thunder vs Toronto Raptors,2017-03-16 19:51:03,842523639849279489
if he don't average the triple double it's over. thunder suck,2017-03-16 19:50:47,842523573201911809
"Mawile aprende Thunder Punch, Ice Punch pero solo Fire Fang. Sus puños no pueden ponerse de fuego o algo!",2017-03-16 19:50:41,842523546869993472
"he probs won't end up winning, thunders record isn't great. Either bron or harden",2017-03-16 19:50:35,842523523260137472
what's the +/- for Semaj?,2017-03-16 19:50:29,842523494483218433
"Electabuzz (37.8%) Thunder Shock/Thunderbolt 8/6/3 (ATK/DEF/STA) Despawns at 17:44:19 https://maps.google.com/maps?saddr=My+Location&daddr=34.2381516324123,-118.52922725355796 …",2017-03-16 19:50:23,842523470768623616
Thu Mar 16 16:50:20 PM 2017 TACKMA THUNDER T DAD HAT http://shopnicekicks.com/products/tackma-thunder-t-dad-hat-mens-orange … Price : 45.00 Inventory : 2,2017-03-16 19:50:19,842523454293364736
"Thunder lead the Raptors 29-24 at the end of the 1st. OKC: V Oladipo 7pts, 2reb, 1ast TOR: D DeRozan 6pts, 1reb, 2ast (ESPN) | # NBA # Raptor…",2017-03-16 19:50:11,842523418851508225
"Murrieta: Mareep 82.2% (15/13/9 - 6.9kg/0.5m - Thunder Shock/Body Slam) til 17:19:36 (29m 33s). http://maps.google.com/maps?q=33.57062327031388,-117.14839641231521 …",2017-03-16 19:50:04,842523391869370368
7D: 180 Splash: 35 Thunder: 80 SPC: 105,2017-03-16 19:50:03,842523387331330048
"Westbrook has 33rd triple-double, Thunder beat Nets 122-104 http://rincon-sports.com/2017/03/15/westbrook-has-33rd-triple-double-thunder-beat-nets-122-104-4/?utm_campaign=twitter&utm_medium=twitter&utm_source=twitter …",2017-03-16 19:50:00,842523374156832768
Celtic Thunder counter 1,2017-03-16 19:49:42,842523298617573378
Está a dar os okc thunder contra os raptors na nba tv,2017-03-16 19:49:37,842523279328002048
Me gustó un video de @ YouTube de @ mgbonyoutube http://youtu.be/AssyVxddZZg?a The Jumbo's Little Brother | ✪T14 AB & RB | War Thunder 1.67,2017-03-16 19:49:24,842523222058962944
New post (Oklahoma City Thunder vs Toronto Raptors LIVE STREAM 16/03/2017) has been published on News Live Today - https://newslive.today/live-streams/live-sports-streams/oklahoma-city-thunder-vs-toronto-raptors-live-stream-16032017-2/ …pic.twitter.com/wX2RM1HXQa,2017-03-16 19:49:23,842523221530304512
"Jolteon (20.0%-2/1/6,Thunder Shock/Thunder) until 17:14:54 (25m 58s)http://maps.google.com/maps?q=33.91205648220064,-117.99385945655534 …",2017-03-16 19:49:16,842523190026997760
I liked a @ YouTube video http://youtu.be/mzY0_ObhZes?a tanya tucker the thunder rolls.,2017-03-16 19:48:57,842523109441912832
"Jolteon (20.0%-2/1/6,Thunder Shock/Thunder) until 17:14:54 (25m 58s)http://maps.google.com/maps?q=33.91205648220064,-117.99385945655534 …",2017-03-16 19:48:56,842523104668602368
Come on Thunder get this win and hopefully the Clippers lose tonight and we are tied in the loss column with the tiebreaker in our favor,2017-03-16 19:48:51,842523083986497536
"Look, the thunder is probably coming throughout the 2nd half....but wouldn't it be fun if Mt St Mary's could keep this going?",2017-03-16 19:48:42,842523048351879168
Eu só queria essa camisa do Thunder,2017-03-16 19:48:39,842523035424964609
if it is gonna come out in 2018 why is it coming out in 2017,2017-03-16 19:48:20,842522953967374336
Hiii what's ur fav EXO song? — thunder k ver https://curiouscat.me/solobyun/post/121190796?t=1489708093 …,2017-03-16 19:48:13,842522927874555904
"@ BLMThunder That's right, Bloomington, these amazing players wore Thunder jerseys! Come watch a game # AllAboard # HometownHockey # HometownFanhttps://twitter.com/BLMThunder/status/842516016794140672 …",2017-03-16 19:48:13,842522925072879616
RaptorsHQ: OKC calls timeout after some furious up and down action. 34-28 for the Thunder. Raps showing some life here. Jak with 6 points.,2017-03-16 19:48:10,842522914415149057
أشاهد Oklahoma City Thunder vs Toronto Raptors,2017-03-16 19:48:08,842522905342808064
Post Edited: War Thunder: Update 1.67 ‘Assault!’ Now Available! https://www.gaminginstincts.com/war-thunder-update-1-67-assault-now-available/ …,2017-03-16 19:48:08,842522903623225344
Dino Thunder was the fucking GOAT,2017-03-16 19:48:02,842522879929475072
"a lot of people I know who have issues with War Thunder have problems with like, the balance or its damage models",2017-03-16 19:47:57,842522859947900930
"i watch the thunder also to witness him average a triple double, and steph not just a shooter either",2017-03-16 19:47:44,842522805245689856
will Donovan ever play Cole?,2017-03-16 19:47:29,842522740489965569
Mas tá rolando no League Pass: 2Q: Jazz @Cavs Thunder @Raptors 1Q: Nets @Knicks # NBA,2017-03-16 19:47:25,842522725386215424
To the thunder Of this Tartar I knocked under Like a martyr; When intently as he writhes.,2017-03-16 19:47:17,842522692972691456
The thunder and lightning is a little too intense I'd say. Maybe a more subtle flash would still get the effect across,2017-03-16 19:47:16,842522688191119360
I am now live with war thunder http://twitch.tv/Bnsf9075,2017-03-16 19:47:06,842522645681913856
RT okcthunder: Q1 done in Toronto. Thunder leads Raptors 29-24. -Oladipo 7p -Kanter/Gibson 6p each - -Westbrook 5a,2017-03-16 19:47:06,842522645312798721
"I find it fascinating that War Thunder will forever a 7/10-ish score kinda game, despite being the most ambitious & enduring WW2 combat sim.",2017-03-16 19:46:50,842522577654464514
"thunder bay weather has been too good, so you already know there's about to be a whole blizzard soon times",2017-03-16 19:46:49,842522573401395201
do u know why norris is benched?,2017-03-16 19:46:49,842522572579332096
"Toronto 117-116 Oklahoma Jsui Toronto , reste 1min balle Thunders",2017-03-16 19:46:47,842522565876899840
"Fun fact: every raps game I attended where OKC played, Thunder won. Can the 3rd time break the curse for the raps?",2017-03-16 19:46:38,842522527310188545
"My sleep is more like coma, thunder and lightening don't even wake me. I have the eating & sleeping parts down.",2017-03-16 19:46:37,842522523891843072
TimeOut! 2°Q 9:29 Thunder 34 @28 Raptors # NBA Os dois times com muitos erros,2017-03-16 19:46:27,842522482653515781
"INTEGRIS Game Day Report: Thunder at Toronto Raptors – March 16, 2017 - http://OKCThunder.com http://dlvr.it/Nf9BBz # WeTheNorthpic.twitter.com/wsYS1yP3fi",2017-03-16 19:46:09,842522406505725952
Timeout OKC after some sloppy play from both teams. Thunder lead 34-28 with 9:29 left till halftime,2017-03-16 19:46:07,842522396712226816
C'mon OKC! Thunder Up! — watching Oklahoma City Thunder vs Toronto Raptors,2017-03-16 19:45:50,842522324742164481
New post: War Thunder: Update 1.67 ‘Assault!’ Now Available! https://www.gaminginstincts.com/war-thunder-update-1-67-assault-now-available/ … # Assault # Gameplay # News,2017-03-16 19:45:49,842522323722878978
"he's a solid thunder to McKinnons lightening. Good hands, can block and scores TD's. Vikings will draft a RB of the future also.",2017-03-16 19:45:49,842522320883343361
DINO THUNDER WAS AMAZING,2017-03-16 19:45:45,842522305616101376
Born For A Purpose - Sons Of Thunder - DOCTOR ALIMANTADO https://www.blakamixshop.co.uk/cds-cd-born-for-purpose-sons-of-thunder-doctor-alimantado-p-33177.html#.WMsjkHVcA5g.twitter …pic.twitter.com/OPyfdr1T7A,2017-03-16 19:45:38,842522275861741569
DINO THUNDER IS FUCKING GAWD. But my fav is RPM,2017-03-16 19:45:36,842522269012447233
I'm sorry if Westbrook doesn't get the MVP award then the system is watered down. Take him off the thunder that team won't win 15 games.,2017-03-16 19:45:25,842522221759336449
Much needed timeout for OKC. Thunder in the lead 34-28 with 9:29 to go in the first half.,2017-03-16 19:45:22,842522208983564288
RT okcthunder: Q1 done in Toronto. Thunder leads Raptors 29-24. -Oladipo 7p -Kanter/Gibson 6p each - -Westbrook 5a,2017-03-16 19:45:18,842522193183604736
Thunder are so weird and different when russ sits,2017-03-16 19:45:15,842522181263331330
"Upcoming Event: Irwindale - NHRA Thursday Night Thunder March 16, 2017 at 05:00PM Irwindale Speedway, 500 Speedway Drive, Irwindale, CA 917…",2017-03-16 19:45:13,842522170165268480
watching Oklahoma City Thunder vs Toronto Raptors,2017-03-16 19:45:11,842522164163198976
OKC calls timeout after some furious up and down action. 34-28 for the Thunder. Raps showing some life here. Jak with 6 points.,2017-03-16 19:45:05,842522137630052357
# NowPlaying EXO-K - Thunder - Listen at http://kpopway.com # kpop # internetRadio,2017-03-16 19:45:04,842522131451842562
Le banc du Thunder on en parle pas trop mais c'est très sérieux hein,2017-03-16 19:45:01,842522120127242242
【連載マンガ】「鳥葬のバベル #001 Thunder bird(1)」を読みました！|人気マンガが無料で読める！LINEマンガ|今スグ読む→ https://lin.ee/hIkkpcA/pnjo/twitter … # LINEマンガ,2017-03-16 19:45:00,842522114863194112
viendo Oklahoma City Thunder vs Toronto Raptors,2017-03-16 19:44:59,842522112980140032
"Mostly handguns, a few shotguns, but most notably that Remington 700. Everyday carry is a Bersa Thunder 380 Plus",2017-03-16 19:44:55,842522096794324992
"I'm starting to get a muffin top and some thunder thighs going. Eh, just a thought at the moment, I'll most likely stay as is.",2017-03-16 19:44:54,842522091069083649
"IN A third of the shaft of his SEXY SON OF DIVINE DADDY DOM and DIVINE DADDY DOM Almighty, the words of the seven thunders",2017-03-16 19:44:38,842522025101053952
"I agree, ive read everything up to thunder rising, im not gonna lie though, at the end of every volume of books ive cried lol",2017-03-16 19:44:35,842522012564316160
"""Thunder!""",2017-03-16 19:44:28,842521980217696257
I want to see twitch react to Dino Thunder but I'm worried it'll happen when i'm not paying attention so marathon is always on in background,2017-03-16 19:44:26,842521974329040898
NBA: RT okcthunder: Q1 done in Toronto. Thunder leads Raptors 29-24. -Oladipo 7p -Kanter/Gibson 6p each - -Westbrook 5a,2017-03-16 19:44:05,842521885325889536
"lol I refuse to believe u ACTUALLY think the Thunder can beat the Cavs in a series. I'm sorry, I just can't lol https://twitter.com/swishbanks/status/842521595771928576 …",2017-03-16 19:44:02,842521873866936320
do I look like a country thunder gal to u,2017-03-16 19:43:42,842521788697333760
watching Oklahoma City Thunder vs Toronto Raptors,2017-03-16 19:43:36,842521763036651520
Watching the # Thunder play via the Raptors broadcast. They're praising Russ for not missing games. Damn right! # ThunderUp,2017-03-16 19:43:31,842521743218561024
"Mareep available until 08:10:19pm (26m 54s). Thunder Shock / Discharge (68.9% - 6/15/10) http://maps.google.com/maps?q=39.20378102786875,-76.82880383975115 …",2017-03-16 19:43:31,842521741419335683
"Thunder bolts and lightning very, very frightening them # TMLTalk",2017-03-16 19:43:28,842521728454705153
"Pikachu available until 08:10:43pm (27m 29s). Thunder Shock / Wild Charge (68.9% - 11/12/8) http://maps.google.com/maps?q=37.63186401433695,-77.31265369924787 …",2017-03-16 19:43:20,842521695407824896
"Thunder Nerds 46 – Music, Atomic Design &#038; Sharing Your Knowledge with Brad Frost - http://feedproxy.google.com/~r/brad-frosts-blog/~3/LkCjBEcf55Y/ …",2017-03-16 19:43:17,842521683206594560
RT okcthunder: Q1 done in Toronto. Thunder leads Raptors 29-24. -Oladipo 7p -Kanter/Gibson 6p each - -Westbrook 5a # NBA,2017-03-16 19:43:11,842521657596174338
just In time to go to country thunder this year,2017-03-16 19:42:49,842521566747353088
Russ type hype for this @ Raptors x Thunder game,2017-03-16 19:42:42,842521536598867969
Thunder and the Ocarina.,2017-03-16 19:42:36,842521511663747072
The moon went hiding Stars quit shining Rain was dropping Thunder 'n lightning,2017-03-16 19:42:28,842521480109981697
RT okcthunder: Q1 done in Toronto. Thunder leads Raptors 29-24. -Oladipo 7p -Kanter/Gibson 6p each - -Westbrook 5a,2017-03-16 19:42:27,842521476616151041
sometimes I really wonder why they even bring the thunder.,2017-03-16 19:42:23,842521456797990912
I liked a @ YouTube video http://youtu.be/Xcnr-mX9x2E?a 100% PROOF WHY WESTBROOK IS MVP! THUNDER vs NETS HIGHLIGHTS REACTION!,2017-03-16 19:42:10,842521402318163968
Q1 done in Toronto. Thunder leads Raptors 29-24. -Oladipo 7p -Kanter/Gibson 6p each - -Westbrook 5a,2017-03-16 19:42:07,842521390054080513
# MafiaSdvSeguro Confira Thunder aqui no @ FlagTicket http://flagticket.com/ingresso/69058,2017-03-16 19:41:58,842521354494709760
this why i'm glad i'm a thunder fan cause in the west ain't shit guaranteed https://twitter.com/spikereeds/status/842520888935301120 …,2017-03-16 19:41:57,842521350594072582
watching Oklahoma City Thunder vs Toronto Raptors,2017-03-16 19:41:56,842521343463772161
Boom Boom That's the sound of my town Gun shots ringing all around Hunters and Thunder… https://www.instagram.com/p/BRt8Lr6Awoi/,2017-03-16 19:41:42,842521287700439041
And quiver with three-bolted thunder stored;,2017-03-16 19:41:31,842521239474266113
Cavs e Thunder,2017-03-16 19:41:29,842521230225920001
RT okcthunder: Q1 done in Toronto. Thunder leads Raptors 29-24. -Oladipo 7p -Kanter/Gibson 6p each - -Westbrook 5a,2017-03-16 19:41:18,842521185418133507
watching Oklahoma City Thunder vs Toronto Raptors,2017-03-16 19:41:17,842521181022576642
"[TOR] Thunder lead the Raptors 29-24 at the end of the 1st. OKC: V Oladipo 7pts, 2reb, 1ast TOR: D DeRozan 6pts, 1… http://ift.tt/1hl8NHR",2017-03-16 19:41:11,842521154371883008
"[OKC] Thunder lead the Raptors 29-24 at the end of the 1st. OKC: V Oladipo 7pts, 2reb, 1ast TOR: D DeRozan 6pts, 1… http://ift.tt/1i7kfoz",2017-03-16 19:41:09,842521148508291072
This is what thunder clouds look like up close. From the balcony on the 48th floor. # nofilter… https://www.instagram.com/p/BRt8Hi7DxbZ/,2017-03-16 19:41:07,842521141084413954
Thunder!,2017-03-16 19:40:53,842521081474924545
Thunder defense leading into transition offense has been beautiful.,2017-03-16 19:40:48,842521060595712000
I liked a @ YouTube video http://youtu.be/WldWTsFLxE8?a Rain + Distant Thunder | Thunderstorm Sounds for Sleep or Studying | 10 Hours White,2017-03-16 19:40:47,842521053641478144
Thunder vs Heat finals,2017-03-16 19:40:42,842521034679091200
thunder only happens when it's rainin players only love u when they're playin,2017-03-16 19:40:34,842520999606206464
"Jolteon (11.1%) Volt Switch/Thunder 4/1/0 (ATK/DEF/STA) Despawns at 17:07:31 https://maps.google.com/maps?saddr=My+Location&daddr=34.18737928474425,-118.53314944685044 …",2017-03-16 19:40:30,842520985047912449
