text,date,id
My sister is a great person. She just bought me Thunder/Spurs tickets for this Friday to cheer me up.,2017-03-28 16:11:45,846817105416765441
"$50,000 grant to DFC will be used for new team jerseys and new basketball hoops for the gym. Go Thunder Hawks! @ dgcfox @ gcfiddlerpic.twitter.com/Xv0UstYP8P",2017-03-28 16:11:44,846817099821518848
"of the league. The times he has guarded the point guard, they have a huge game. I wasn't saying the thunder can't catch or it's thei",2017-03-28 16:11:35,846817063159189505
I almost killed my boys @ minishcapking and @JordonDavis70 today during lunch but God is good and it's raining money Oklahoma City Thunder,2017-03-28 16:11:18,846816992757628928
"[Young] Steven Adams on the Thunder's comeback building momentum: ""Pretty good mate. Puts a bit of lead in the pen… http://ift.tt/2ocSOSE pic.twitter.com/nzHc7u4hj2",2017-03-28 16:11:17,846816987271565314
I liked a @ YouTube video from @ pakistanaffairz http://youtu.be/U_husjulImc?a Pakistan Day JF 17 Thunder Amazing Airshow on 23 March 2017,2017-03-28 16:11:16,846816982578085888
# classy -- Thanks Prof. @ ekinsky @ WTAMU # PR students for the letter (complete w/ Thunder the Buffalo). Let's talk again sometime! # gobuffspic.twitter.com/MTKKj7IpAQ,2017-03-28 16:11:04,846816931042619392
War Thunder Free Golden Eagles Promo Codes https://shar.es/1QgeUJ,2017-03-28 16:10:52,846816882925748224
thunder wide pressure : i can make ligthing ball with my color i choose,2017-03-28 16:10:50,846816872959950848
Son of bitches got my office bugged. I bet that god damned Stu is behind it. He wants to steal my thunder. I run ED not him!,2017-03-28 16:10:43,846816845718044674
Joel 2:11 The LORD thunders at the head of his army; his forces are beyond number. http://youtu.be/FfYC6HgiQ-c via @ YouTube,2017-03-28 16:10:38,846816825061007360
"""Even if you fall down and tumble, do not give up."" - Thunder",2017-03-28 16:10:34,846816808405393409
Une vieille dispute territoriale entre Thunder Bay et Fort William resurgit http://ici.radio-canada.ca/nouvelle/1024848/dispute-territoire-thunder-bay-fort-william-taxes-ottawa-gouvernement …,2017-03-28 16:10:08,846816699655565317
"Jolteon (66.7% 5/14/11, Volt Switch / Thunder). Available until 13:33:03 (23m 24s). http://maps.google.com/maps?q=37.24472756660168,-121.81804930941031 …",2017-03-28 16:09:38,846816573385949184
Pie Island outside Thunder Bay has gotta be disappointing.,2017-03-28 16:08:50,846816371195437057
Un comité indépendant révisera le salaire des élus à Thunder Bay http://ici.radio-canada.ca/nouvelle/1024811/un-comite-independant-revisera-le-salaire-des-elus-a-thunder-bay …,2017-03-28 16:08:36,846816312324210694
lord of thunder please be my guide... cuántas horas perdidas en esa wuea.,2017-03-28 16:08:25,846816267277340672
All you people complaining about the storm last night and I really can't relate cuz my ass was SHLEEP! What thunder?,2017-03-28 16:07:56,846816144409481217
"Pikachu - 96% (Thunder Shock/Wild Charge) till 04:53:50pm (46m 4s). Found at 101 Brookside St (Glen Cairn) http://maps.google.com/maps?q=42.96910667114353,-81.22447355968067 …",2017-03-28 16:07:48,846816111391846400
I'm done for shopping in Thunder Bay Ontario Canada and I'm going home tomorrow Dryden Ontario Canada,2017-03-28 16:07:45,846816096002945024
The Nigerian footballer who killed his brother: The Legend of Thunder Balogun http://ln.is/naijafootball247.com/syoIH …,2017-03-28 16:07:43,846816088176386052
thunder is such a relaxing sound,2017-03-28 16:07:35,846816058140975104
"ahhhhh stealing my thunder Robert,",2017-03-28 16:07:27,846816023655333888
War Thunder Free Golden Eagles Promo Codes: War Thunder Free Golden Eagles Promo Codes: …http://war-thunder-golden-eagles-bonus-code.blogspot.com/2015/12/war-thunder-free-golden-eagles-promo.html …,2017-03-28 16:07:17,846815980915474434
I literally thought we were having an earthquake. It was just thunder. I hope...,2017-03-28 16:07:13,846815963081330689
rolling thunder never fails. . . to entertain the crowd,2017-03-28 16:06:34,846815801860657154
The Thunder Bay Kings are hitting the ice at the Fort William Gardens this afternoon. http://fb.me/1QauE472e,2017-03-28 16:06:34,846815799927062530
"Jolteon (28.9%) Thunder Shock/Discharge 2/9/2 (ATK/DEF/STA) Despawns at 13:32:19 https://maps.google.com/maps?saddr=My+Location&daddr=34.20853289277017,-118.59078573873515 …",2017-03-28 16:06:32,846815792234729473
HAPPENING NOW: Hail and thunder in the South Valley! WOW! pic.twitter.com/TpWYhicrvb,2017-03-28 16:06:27,846815770579365888
This rain and thunder are making me sleepy.,2017-03-28 16:06:26,846815764577472517
"We need more sleeves, more K signs, more hands signaling a K, more thunder sticks, and more standing up! @ the7linehttps://twitter.com/ReadTheApple/status/846812880636923904 …",2017-03-28 16:06:11,846815704225648641
"haha sorry guys, the thunder and lightning 'n shit is my fault.",2017-03-28 16:06:10,846815701012668417
Thunder and rain shafts @ UNM # ABQ # nmwxrpic.twitter.com/RM9ndAJBPW,2017-03-28 16:06:04,846815672986361856
"Orlando Magic vs. Oklahoma City Thunder - 3/29/17 NBA Pick, Odds, and Prediction - Sports Chat Place (blog) http://dlvr.it/NlHzJq",2017-03-28 16:06:04,846815672894029824
Westone Thunder 1A Fret job close up. The active circuit maybe old tech but it still really kicks \m/ pic.twitter.com/hUbIepz68n,2017-03-28 16:06:00,846815656993603585
i just heard thunder for the first time in probably about a year...you would think i just won the lotto by how excited i am,2017-03-28 16:05:58,846815650517540866
That thunder is crazy loud,2017-03-28 16:05:56,846815642590294017
Thunder...ThunderTHUNDERCATS...HOOOOO,2017-03-28 16:05:48,846815608280956932
A well deserved draw in our second boy's football league match today as we drew 1-1 with @ GreenMeadowNews in the pouring rain and thunder,2017-03-28 16:05:43,846815586696990721
a failed rolling thunder haha love it!,2017-03-28 16:05:43,846815585157701637
"So here I am taking a bath when there's a roll of thunder, and I wish I'd gotten a pic of Xita's face as she peeked around the door",2017-03-28 16:05:15,846815468996431872
Meet the man with a million hits on YouTube: Thunder Bay Muslim singer Siedd http://www.cbc.ca/news/canada/thunder-bay/thunder-bay-muslim-singer-has-a-million-hits-on-youtube-1.4043030 … @ Racialized @ sieddofficial,2017-03-28 16:05:14,846815464647000065
"Up close and personal with Thunder in London tonight. Great band, great gig pic.twitter.com/MjuCjaEfSn",2017-03-28 16:04:36,846815306320416768
Check out my broadcast from my PlayStation 4! # PS4live (War Thunder) live at https://www.twitch.tv/pistolbill97,2017-03-28 16:04:31,846815282987335681
But Xita definitely finds thunder alarming and needs to be near people during storms.,2017-03-28 16:04:26,846815262036905984
"2:00pm MDT: Strengthening line of t-storms slowly tracking east over # ABQ Metro. When Thunder Roars, Go Indoors! # nmwxpic.twitter.com/wUCHYmAWdx",2017-03-28 16:04:17,846815223600349185
"Lol, after being traumatized on Sunday. I'm freaking out over here about a possible thunder storm",2017-03-28 16:04:16,846815220584648708
Thunder again craters when Westbrook rests http://dlvr.it/NlHxdL pic.twitter.com/Io4ZtUMGnj,2017-03-28 16:04:14,846815213143842816
Hard As A Brick! You will find none Greater! Than the Sons of Blood and Thunder… https://www.instagram.com/p/BSMc1SThOzn/,2017-03-28 16:04:12,846815203278802944
Is coach seriously going to make us practice in rain/thunder......,2017-03-28 16:04:08,846815189735493632
"Mareep 51.1% IV (11/12/0) with Thunder Shock & Body Slam has spawned til: 04:27:09pm (23m 11s). http://maps.google.com/maps?q=33.609106590602295,-78.97694403078042 …",2017-03-28 16:04:02,846815162862637056
"Also both dogs who were alive for the 2011 earthquake down here are nervous about thunder. Well, Tink is kinda deaf so she's better now.",2017-03-28 16:03:51,846815117190877185
"Lanturn available until 04:17:28pm (13m 37s). Water Gun / Thunder (64.4% - 13/12/4) http://maps.google.com/maps?q=37.494736688512695,-77.572822731669 …",2017-03-28 16:03:51,846815116662390785
# NowPlaying Thunder Clatter by Wild Cub ♫ http://spoti.fi/1h6ucSe,2017-03-28 16:03:44,846815088065626114
WHO IS GOING TO COUNTRY THUNDER,2017-03-28 16:03:31,846815032033763328
"Fun Facts: Several # NJ teams made it into # Byways Bk3—Nets, Devils, Thunder, Knights, Riversharks, Bears, Lightning, Pros, Bullies, Pride.",2017-03-28 16:03:18,846814979982589956
I liked a @ YouTube video http://youtu.be/3Qh2TSUSkb8?a Oklahoma City Thunder Defeat Dallas Mavericks (92-91),2017-03-28 16:03:13,846814956234289152
"Pikachu - 93% (Thunder Shock/Wild Charge) till 04:26:24pm (23m 33s). Found at 1357 Adelaide St N (Stoneybrook) http://maps.google.com/maps?q=43.025475730458446,-81.25072169078453 …",2017-03-28 16:02:54,846814875808681984
"#171 Lanturn (Charge Beam/Thunder 13/10/6 - 64.44%) None King St E L8K, 04:12:20pm (10m 4s left) http://maps.google.com/maps?q=43.2273059002648,-79.79285584710439 …",2017-03-28 16:02:24,846814752143757317
"J'ai ajouté une vidéo à une playlist @ YouTube - Berlin - A War Thunder Multiplayer Cinematic, 60fps - (Machinima)",2017-03-28 16:02:24,846814750570790912
Delays on NJ 29 southbound approaching Thunder Rd/Cass St (Trenton) delays due to http://www.511nj.org/IncidentList.aspx?listType=All&993 …,2017-03-28 16:02:14,846814710595010560
Video: Woman hit by trailer hitch thrown from vehicle not an isolated incident in Thunder Bay | by @ WillowBlasizzohttp://aptnnews.ca/2017/02/03/woman-hit-by-trailer-hitch-thrown-from-vehicle-not-an-isolated-incident-in-thunder-bay/ …,2017-03-28 16:02:14,846814708006961152
You can buy Through Thunder and Light for your # Nook http://tinyurl.com/h3cwlkc # romance # ASMSG # kindle # audible # author # ibooks # ebooks,2017-03-28 16:02:12,846814700822130688
"Raise your words, not voice. It is rain that grows flowers, not thunder. - Rumi # quote",2017-03-28 16:02:06,846814674633084928
You can buy Through Thunder and Light for your # Nook http://tinyurl.com/h3cwlkc # romance # ASMSG # kindle # audible # author # ebooks,2017-03-28 16:01:55,846814630315884545
why is superfood dead . Circa waves stole their thunder .,2017-03-28 16:01:54,846814626708901890
You can buy Through Thunder and Light for your # Nook http://tinyurl.com/h3cwlkc # romance # ASMSG # kindle # audible # author,2017-03-28 16:01:43,846814581540306944
So right now there is a terrible thunder storm outside my house. I'm hoping it passed in about an hour or 2. Then we salt the earth XD,2017-03-28 16:01:42,846814577530716160
"Sunset Cliffs: Mareep 84.4% (12/12/14 - Thunder Shock/Thunderbolt - s:normal) til 13:30:43(28m 58s). http://maps.google.com/maps?q=32.73396920595938,-117.25185809151435 …",2017-03-28 16:01:42,846814574040907776
You can buy Through Thunder and Light for your # Nook http://tinyurl.com/h3cwlkc # romance # ASMSG # kindle # audible # author # ibooks,2017-03-28 16:01:35,846814546123665408
The vibe was nowhere near this much fun last time I was at the Apollo. Thunder are putting on a… https://www.instagram.com/p/BSMcgklgHvt/,2017-03-28 16:01:22,846814490675085312
You can buy Through Thunder and Light for your # Nook http://tinyurl.com/h3cwlkc # romance # ASMSG # kindle # audible # author # ibooks # kobo,2017-03-28 16:01:18,846814473667014656
We are pleased to announce @ toursec will return as sponsor of the Thunder and Lightning classes for the 30th season. http://ow.ly/fhfS30alrVM,2017-03-28 16:01:11,846814446760681472
Remember these? Westone Thunder 1A: refret & setup + Iron Gear pickups installed. # vintageguitarspic.twitter.com/s5liuWA9ej,2017-03-28 16:00:54,846814372240482304
"33.3% Mareep-Thunder Shock/Thunderbolt. Expires 15:28:28 (27m 53s). http://maps.google.com/maps?q=41.45835609475636,-96.50668445262173 …",2017-03-28 16:00:28,846814263780020226
D'OH!,2017-03-28 16:00:24,846814249481572352
# Thunder ranked 10th here Which NBA teams have the best management? Worst? http://www.espn.com/nba/story/_/id/19017640 …,2017-03-28 16:00:19,846814227176280064
WAR THUNDER | « M8: PEQUEÑO DIABLILLO » | EN ESPAÑOL: http://youtu.be/lUpLw3Q1Bo8?a vía @ YouTube,2017-03-28 16:00:18,846814224634462208
Thunder are 30-7 this season when Russell Westbrook has a triple-double.,2017-03-28 16:00:16,846814216514408455
Is your dog scared or nervous when its starts to thunder? Here are some helpful tips in calming them. Stop by... http://fb.me/8A8tM018z,2017-03-28 16:00:13,846814202199248896
"@ Wichita_Thunder, @ WichitaBrew,pic.twitter.com/YkmWKHBAvg",2017-03-28 16:00:11,846814191994519552
"Lanturn available until 04:25:47pm (25m 37s). Charge Beam / Thunder (64.4% - 15/6/8) http://maps.google.com/maps?q=37.624376182138306,-77.36353231822662 …",2017-03-28 16:00:10,846814189654102016
"Raise your words, not voice. It is rain that grows flowers, not thunder. - Rumi # quote",2017-03-28 16:00:09,846814186768359424
"We're talking about rocket cars with special guest, Bill Braak ( @ JetCarPilot), of Smoke-n-Thunder Jet Shows! Watch: http://bit.ly/2o4k5GJ pic.twitter.com/oyri9cqcsY",2017-03-28 16:00:06,846814171593396226
"À 16h, le 28 mars 2017 Il fait 67,0°S au Canada Extrêmes retranchés: min: -20,2°C à Iqaluit max: 9,9°C à Thunder Bay",2017-03-28 16:00:05,846814169970196480
7D: 120 Splash: 80 Thunder: 50 SPC: 70,2017-03-28 16:00:05,846814169483632644
March 28 - Sedona # weather -Cooler today-lack of cloud cover last night. Sun-Clouds-Thunder yesterday but no rain! http://Sedona-Weather.com pic.twitter.com/ZUX4I7jrAa,2017-03-28 15:59:50,846814104186634240
Another round of # rain & # thunder heading into # ABQ from the southwest pushing to the northeast. # NMwx # NewMexico @ krqepic.twitter.com/PtRJikYbax,2017-03-28 15:59:39,846814061454999552
"BISHOP Fires Thunder As He Releases Prophecy About President Buhari’s Health, Angry Nigerians Did This Crazy Thing… http://dlvr.it/NlHshc pic.twitter.com/nmT3WFbrCK",2017-03-28 15:59:27,846814009407942656
The thunder is shaking my whole office,2017-03-28 15:59:27,846814009043116033
The thunder freaked me out!,2017-03-28 15:59:23,846813990412042244
"Pikachu 93.3% IV (14/13/15) with Thunder Shock & Wild Charge has spawned until: 04:26:17pm (27m 8s). http://maps.google.com/maps?q=33.846912780281286,-79.06251944314361 …",2017-03-28 15:59:13,846813952042586113
Oklahoma City Thunder: Where NBA National Scribes Power Rank OKC in Week 22 with @ Cole_Hixon # ThunderUp # NBAhttp://thunderousintentions.com/2017/03/28/oklahoma-city-thunder-power-rank-week-22/ …,2017-03-28 15:59:00,846813896283373568
=(W)= vs. Team154 | 2x2 Gladiators SB - War Thunder https://youtu.be/9ujl47TFZMc @ YouTubeさんから 強い！！,2017-03-28 15:58:47,846813840616546304
The @ BenUSoftball DH vs @ Wheaton_Thunder scheduled for Thursday March 30 has been moved to Wednesday March 29 at 3:00 pm at the Complex,2017-03-28 15:58:23,846813739164819458
"Mareep 51.1% IV (11/12/0) with Thunder Shock & Body Slam has spawned til: 04:27:09pm (28m 54s). http://maps.google.com/maps?q=33.609106590602295,-78.97694403078042 …",2017-03-28 15:58:19,846813724883275776
this made me LOL I appreciate the honesty,2017-03-28 15:58:18,846813718864416769
"Ampharos 44% (1/9/10) Volt Switch/Thunder until 03:10:08pm (11m 57s) Central Garland [4] http://maps.google.com/maps?q=32.88236283724941,-96.6373815437574 …",2017-03-28 15:58:10,846813688048709632
"Raise your words, not voice. It is rain that grows flowers, not thunder. - Rumi # quote",2017-03-28 15:58:08,846813678758449152
I love thunder,2017-03-28 15:57:58,846813637159370754
I liked a @ YouTube video from @ htcorvette http://youtu.be/H1Y_EX6G03c?a The Thunder Road Show - March 28,2017-03-28 15:57:52,846813608742871040
"Thunder were down 10 at the 2 minute mark last night, so their game doesn't meet the L2M criteria. https://twitter.com/nbaofficial/status/846807547814301696 …",2017-03-28 15:57:31,846813523888033792
"Lanturn 31.1% IV(2/11/1) with Water Gun & Thunder til: 04:24:25pm (27m 20s). http://maps.google.com/maps?q=33.75050296391426,-78.95829988450421 …",2017-03-28 15:57:09,846813430527000576
So excited to finally start reading a quiet kind of thunder after a long break of not reading... eeeek @ saramegan,2017-03-28 15:57:08,846813425871327232
"44% done with A Quiet Kind of Thunder, by Sara Barnard https://goodreads.com/user_status/show/126762761 …",2017-03-28 15:56:57,846813381130629120
Thunder really does freak me out,2017-03-28 15:56:55,846813373211852800
4/22(土) 【BURST THUNDER HEADROCK Vol.18】 Vespera(東京) H.K.(静岡） 8000(静岡） AUTOROLL(東京) BURSTWIRE 6/6:30pm MC 1500(adv) 2000(door) +D pic.twitter.com/dqYNSF6fUq,2017-03-28 15:56:52,846813357919223808
"A 68.89% IV wild Hitmonchan has appeared! Moveset: unknown / Thunder Punch. Available until 22:26:33 (29m 47s). http://maps.google.com/maps?q=46.22168801186437,6.153041132851275 …",2017-03-28 15:56:45,846813330807410688
"it is, plus Thunder have only lost 6 games this season when he records a triple double i believe",2017-03-28 15:56:43,846813323442212864
"BISHOP Fires Thunder As He Releases Prophecy About President Buhari’s Health, Angry Nigerians Did… http://dlvr.it/NlHqRq Via @ owelafrikpic.twitter.com/lKlpgHOVLf",2017-03-28 15:56:42,846813316919902208
The sound of rain and rolling thunder just relieves so much stress,2017-03-28 15:56:33,846813281062924288
what happened to Dynamo of Thunder Agents? http://plurk.com/p/m5o4xf,2017-03-28 15:56:27,846813254940852228
num sabe nem diferenciar MMPR do Dino Thunder r,2017-03-28 15:56:14,846813201652219904
or Borgore or Oliver or Steve Aoki or Troyboi. I can't decide if I want a party boy or music God,2017-03-28 15:56:09,846813179233669120
Hate thunder,2017-03-28 15:55:47,846813086690500613
Thunder buddies by @ dannydeurbel # welovefreestyle # ransom # ransomnia # ransommusicnl # fistpumpin # freestyle # hardstyle # harddance # d…pic.twitter.com/NnI00Wckl3,2017-03-28 15:55:31,846813019522940928
"""We finally figured out what Pickles was barking at last night: thunder"" # noises # LastNightSheSaidScreaming # OraBird # orThunder # barkingdog",2017-03-28 15:55:30,846813017102802944
"""Would you like me to page Mr Mayfield? And let him steal my thunder? That's the spirit, Dr Copeland!"" Love Mr Hanssen # HolbyCity",2017-03-28 15:55:04,846812906226421760
UConn's basketball dominance is a thunder clap heard around the college basketball world http://trib.in/2neBtHM pic.twitter.com/aBNmNnvajw,2017-03-28 15:55:01,846812892485881857
@ Wichita_Thunder GAMEDAY! Cheer on the Thunder as they take on Quad City. Game starts at 7:05 p.m. pic.twitter.com/Um6Dc1KK57,2017-03-28 15:54:57,846812874723000321
@ cyplo DRONES FOR THE DRONE GOD! CRACKLING THUNDER FOR THE CRACKLING THUNDER THRONE,2017-03-28 15:54:45,846812826811453440
"Utah Jazz: Clippers Handing Over 4th Seed On Silver Platter, Thunder the Real Threat? http://dlvr.it/NlHnlh # TakeNote",2017-03-28 15:54:36,846812786856411136
"watch me piss off Ryuga folks ""hey look, it's the Red Dino Thunder Ranger""",2017-03-28 15:54:16,846812705801539584
"Jolteon 66.7% (4/12/14) Thunder Shock/Thunder [Northside] 2200-2300 Indian Hills Dr 51104 03:20:29pm (26m 14s) http://maps.google.com/maps?q=42.533561909932445,-96.38016440914124 …",2017-03-28 15:54:13,846812692476284928
The rain may fall The thunder roar Yet I believe.,2017-03-28 15:54:12,846812687870939138
I don't fw thunder,2017-03-28 15:54:05,846812657915236354
Ok thunder can you stop?,2017-03-28 15:54:04,846812653179719680
All this thunder >>>>,2017-03-28 15:53:49,846812590525304836
"""What happened to us?"" She was lightning and I was thunder, the timing was always slightly off.",2017-03-28 15:53:39,846812550209593344
[Post Game Thread] The Oklahoma City Thunder (42-31) overcome a double-digit fourth quarter deficit to defeat the … https://www.reddit.com/r/nba/comments/61wus8/post_game_thread_the_oklahoma_city_thunder_4231/?utm_source=ifttt …,2017-03-28 15:53:22,846812479703449604
va weather is wild. it was thunder and lightning 7 minutes ago and now the sun's out,2017-03-28 15:53:10,846812429241782272
Oklahoma City Thunder Follow Westbrook to road victory http://thunderousintentions.com/2017/03/28/oklahoma-city-thunder-beat-mavs/ …pic.twitter.com/v1HgrVQFSd,2017-03-28 15:53:10,846812428876820480
We're like thunder in the rain,2017-03-28 15:53:01,846812388921917441
Was that thunder????? Wtf,2017-03-28 15:52:55,846812363495915520
"it's live, it's live! *screaming thunders in the background*",2017-03-28 15:52:42,846812309771182081
Scared of storms but I can't explain how much I loooove the sound of rain and thunder.,2017-03-28 15:52:12,846812186601291777
"Struggling to remove the smell of GT85 following tonight's rain, hail and thunder & lightening affected ride # cycling",2017-03-28 15:52:07,846812165474598912
"# Pikachu 97.8% (15/15/14) Moves: [Thunder Shock | Thunderbolt] City: [Wheaton] Timer: [03:21:05pm]-(29m 7s) http://maps.google.com/maps?q=41.85111885235493,-88.08996166580496 …",2017-03-28 15:51:57,846812121862197250
"E Clairemont Park: Lanturn 84.4% (15/15/8 - Water Gun/Thunder - s:normal) til 13:21:20(29m 21s). http://maps.google.com/maps?q=32.80340002576564,-117.18212371531465 …",2017-03-28 15:51:54,846812107479760897
loving this thunder.,2017-03-28 15:51:48,846812082133778433
jsuis en train de relire l'arc Blood ans Thunder voila à quoi ressemble Thor pic.twitter.com/rl2Fi6VlGi,2017-03-28 15:51:25,846811986696585216
"I just watched Marvel's Iron Fist 1x03 ""Rolling Thunder Cannon Punch"" https://trakt.tv/shows/marvel-s-iron-fist/seasons/1/episodes/3 … # trakt",2017-03-28 15:50:46,846811824557375488
Thunder,2017-03-28 15:50:30,846811754935967744
"Tauros EX DS Mosquera earned ""The Gates Service Ribbon I (1 of 5)"" in Thunder Run http://fb.me/7J5HQm8oC",2017-03-28 15:50:01,846811633469063168
Seriously loving all this thunder!!,2017-03-28 15:49:59,846811626267402240
Currently enjoying a frontman masterclass off Mr Danny fucking Bowes thunder # RipItUp,2017-03-28 15:49:57,846811617874661376
When steph hit that game winning 3 against the thunder in OT last year https://twitter.com/_gaspo/status/846806973073047553 …,2017-03-28 15:49:56,846811612711399424
"Lanturn available until 02:15:06pm (25m 12s). Charge Beam / Thunder (93.3% - 13/15/14) http://maps.google.com/maps?q=40.39593216508234,-105.08464896051242 …",2017-03-28 15:49:53,846811602422841344
Williams leads Rockets to easy 137-125 win over Thunder http://rincon-sports.com/2017/03/26/williams-leads-rockets-to-easy-137-125-win-over-thunder-4/?utm_campaign=twitter&utm_medium=twitter&utm_source=twitter …,2017-03-28 15:49:50,846811587423887360
"Lanturn available until 04:12:14pm (22m 54s). Charge Beam / Thunder (60.0% - 6/12/9) http://maps.google.com/maps?q=37.64065701971231,-77.35213815812556 …",2017-03-28 15:49:20,846811463293505536
Thunder Back In Action Against Magic On Wednesday Night # News9Thunderhttp://www.news9.com/story/35015689/thunder-back-in-action-against-magic-on-wednesday-night …,2017-03-28 15:48:58,846811371501244417
"Spring Valley: Lanturn (55.6%IV 4/9/12 Water Gun/Thunder 1.1m/16.7kg). TTH: 01:12:37pm [23m 47s] http://maps.google.com/maps?q=32.748630241233265,-116.98390848468084 …",2017-03-28 15:48:49,846811333337133056
Im tryin to nap but this thunder is extra loud,2017-03-28 15:48:43,846811307198369792
what happened to the dismount bubbles from Isle of Thunder,2017-03-28 15:48:40,846811295785504768
"REMINDER - When lightning is seen, thunder is heard or a severe thunderstorm or tornado warning is issued the Aquatic Center will close.",2017-03-28 15:48:38,846811287061442560
"Thunder, Wiz, Bucks, Hawks, and Jazz. All 14 other wins have been against BAD teams. Wolves, suns, Lakers, Knicks Bad.",2017-03-28 15:48:28,846811243142758400
[Post Game Thread] The Oklahoma City Thunder (42-31) overcome a double-digit fourth quarter deficit to defeat the … http://ift.tt/2osrTl4,2017-03-28 15:48:20,846811212285427712
I done trolled the whole Hawks and Thunder fanbase lmaooo,2017-03-28 15:48:02,846811137559683072
My sound was bad I couldn't watch thik it was the thunder n lightning here,2017-03-28 15:47:54,846811103086686208
not fw this thunder,2017-03-28 15:47:41,846811050142060545
Also I see MCU are once again stealing the thunder from the DCU by releasing their trailer so close to the JL one. Keep it up folks!,2017-03-28 15:47:30,846811002025005057
Provavelmente na próxima temporada será bem mais utilizado. Já que o Thunder fará o time em volta do Westbrook.,2017-03-28 15:47:21,846810962703400960
There were some thunders by me today. It was so loud that I thought a building fell down. When the sky is this dark the sun is still shining pic.twitter.com/mmMHRrqD7v,2017-03-28 15:47:18,846810952641232896
"""Would you like me to page Issacc?"" ""And let him steal my thunder???"" # HolbyCity",2017-03-28 15:47:00,846810876703363072
Estou live com War Thunder!! https://www.twitch.tv/rottingalien,2017-03-28 15:46:41,846810794612477953
"Character #7 Sailor Soldier of Thunder & Courage, Makoto Kino from @ christinaneno pic.twitter.com/H6lHODMakV",2017-03-28 15:46:31,846810755232157698
I liked a @ YouTube video from @ chris_smoove http://youtu.be/jPXFH8ZZL0Q?a Russell Westbrook Game Winner! Thunder Comeback Down 13!,2017-03-28 15:45:56,846810607705739264
So this happened . @ Thunder @ mca_retweetspic.twitter.com/KIhFXmlzJ2,2017-03-28 15:45:36,846810523526201347
Due to Lighting and Thunder in the Area the Pool is closed until further notice,2017-03-28 15:45:28,846810489208426496
RT @ NWS: When Thunder Roars Go Indoors! http://weather.gov/lightning # LightningSafetypic.twitter.com/WVEwhZ1zZ3,2017-03-28 15:45:21,846810459181342720
