text,date,id
Memorial Avenue Road Repairs – March 29 2017: THUNDER BAY – ROADS – Traffic access to a… https://goo.gl/fb/bgLn9d,2017-03-28 18:21:27,846849746257899520
pains me to go against my Thunder Bay homie but I will,2017-03-28 18:20:14,846849438542938114
"Lanturn available until 06:49:27pm (29m 17s). Water Gun / Thunder (62.2% - 7/8/13) http://maps.google.com/maps?q=37.54316989126731,-77.44523237305013 …",2017-03-28 18:20:10,846849421086261248
Line Update: Orlando Magic are now +6 from +5.5 vs Oklahoma City Thunder recorded at 06:20 # SportsBetting # NBA # Basketball,2017-03-28 18:20:10,846849420398399489
War Thunder -6 День. Выполняем ежедневные задания 28.03.2017г. Хочешь увидеть себя на стриме подпишись на канал и… http://dlvr.it/NlL9PY pic.twitter.com/OehEBAwnd3,2017-03-28 18:20:04,846849396725579776
"Electabuzz 42.2% (3/13/3) Thunder Shock/Thunderbolt [Dakota Dunes SD] 148 Levee Trail 57049 05:49:18pm (29m 22s) http://maps.google.com/maps?q=42.49828397621859,-96.49435424788736 …",2017-03-28 18:19:55,846849357345382403
it was trying to steal away mortal kombat's thunder. The arcade game at least was slightly more playable lol,2017-03-28 18:19:53,846849352421269504
The moon went hiding stars quit shining rain was dropping thunder 'n lightning you wrecked my whole world when you left,2017-03-28 18:19:37,846849284012195840
if the thunder woulda payed him,2017-03-28 18:19:27,846849240202665986
"PH: Lanturn (73.3%IV 15/15/3 Water Gun/Thunder 1.1m/19.3kg). TTH: 03:46:03pm [27m 2s] http://maps.google.com/maps?q=32.659413503296925,-117.0613415657378 …",2017-03-28 18:19:00,846849129363881984
"Thunder and lightning an hour ago, now it's clear blue skies. If you don't like the weather in # Albuquerque, just wait 15 minutes!",2017-03-28 18:18:39,846849040255893505
"Thanks back at you - I enjoyed the discussion. Thunder has taken up residence atop the router, w/ a clear view of my desk.",2017-03-28 18:18:09,846848915412443140
"Few conclusions I've come to after this Power Rangers marathon on Twitch... Best Song: SPD, Dino Charge, Dino Thunder Best Morph: SPD",2017-03-28 18:17:58,846848868364922880
"Anyways, just a quick catch up on what I've been doing: I've been making art, working at NBC and playing War Thunder, that's about it.",2017-03-28 18:17:53,846848846495993857
The sound of rain and thunder will always be music to my ears,2017-03-28 18:17:40,846848794343997440
This is probably an old picture but Nayeon is triggering me by wearing KD's Thunder jersey. :( pic.twitter.com/0320KAok9A,2017-03-28 18:17:29,846848747413950464
"Lakeside: Lanturn (75.6%IV 11/9/14 Water Gun/Thunder 1.4m/26.9kg). TTH: 03:22:23pm [4m 58s] http://maps.google.com/maps?q=32.85286863739317,-116.9312892819067 …",2017-03-28 18:17:25,846848729919324160
The moon went hiding Stars quit shining Rain was droppin Thunder lightnin you wrecked my whole world when you came & hit me like a hurricane,2017-03-28 18:16:33,846848510758670336
Bout time Thunder Bay got an Uber!!!!!!!!!!!!!!,2017-03-28 18:16:29,846848493289422849
"yall the thunder today was Soooo bad my cat was not having it,, i woke up bc of it and he like tucked himself behind my knees",2017-03-28 18:16:09,846848409344655363
dia da defesa nacional,2017-03-28 18:15:41,846848295112724480
Live Video From NBC 5’s Thunder Truck https://goo.gl/MRdkRV,2017-03-28 18:15:22,846848215777509378
"Spring storm to bring rain, thunder and overnight snow to Denver area. http://dpo.st/2ovlaGZ pic.twitter.com/HNUakyJful",2017-03-28 18:15:14,846848181833023489
no no this thunder must enter your bum because of the statement you just said. Abeg I don't play when it comes to Bacon,2017-03-28 18:15:02,846848129441959936
"when it thunders,my favorite saying is""god bowling with the angel's.When it rains, angels r crying,god kicking there butt.",2017-03-28 18:14:58,846848112744448000
then it's a nightmare,2017-03-28 18:14:47,846848066716127232
@ ThunderS7ruck pic.twitter.com/CllCfhSIWW,2017-03-28 18:14:41,846848041629995008
he def carries in his ass and magical thighs. like. literal thunder thighs. imagine tho.,2017-03-28 18:14:13,846847925292584960
"Lanturn 57.8% IV (4/11/11) with Water Gun & Thunder has spawned til: 06:35:14pm (21m 6s). http://maps.google.com/maps?q=33.58770554121083,-78.98966593299323 …",2017-03-28 18:14:12,846847922079764481
Feel the thunder http://fb.me/1RrwMy7Sw,2017-03-28 18:13:43,846847800184750080
"Vry soon mtn ll be Lyk Do you know there are people in your village that don't wnt u to succeed? Quickly text ""thunder fire them ""to 335057",2017-03-28 18:13:16,846847684044636160
loved it when Ruth Donaldson told Sturgeon to sit down - the look of thunder,2017-03-28 18:13:10,846847659868610562
Powered up the Marshall and the Les Paul.Let loose the nuclear thunder for 30 min. Bricks were cracked. @ leftyguitar1pic.twitter.com/IQyNpHqJ1B,2017-03-28 18:12:56,846847599810367488
"The end game, revealed: Lee Germon appointed General Manager of Sydney Thunder http://fw.to/O3suscN",2017-03-28 18:12:17,846847437557805056
Oklahoma City Thunder: Westbrook proving he is elite in crunch time http://isportsweb.com/2017/03/28/oklahoma-city-thunder-westbrook-proving-elite-crunch-time/ …pic.twitter.com/0gKBRIYx86,2017-03-28 18:12:11,846847411595235330
"Lakeside: Lanturn (37.8%IV 13/1/3 Charge Beam/Thunder 1.2m/24.3kg). TTH: 03:37:04pm [25m 16s] http://maps.google.com/maps?q=32.85238182196148,-116.94150136916733 …",2017-03-28 18:11:48,846847314782126080
"that jersey stuff can matter. The Thunder were so good wearing non-sleeved, non-alternate jerseys last Playoffs.",2017-03-28 18:11:44,846847299783475203
KSN News at 5 tracking rain & thunder across KS & into Wichita metro. Threat severe weather low. Away from TV free http://ksn.com/storm-tracker-3-weather-app/ …,2017-03-28 18:11:21,846847203310219265
KSN News at 5 tracking rain & thunder across KS & into Wichita metro. Threat severe weather low. Away from TV free http://ksn.com/storm-tracker-3-weather-app/ …,2017-03-28 18:11:19,846847193365561345
Can't wait till Thunder,2017-03-28 18:11:13,846847169428684800
"Peacock: Mareep 80.0% (13/10/13 - Thunder Shock/Discharge - s:large) til 15:28:23(17m 11s). http://maps.google.com/maps?q=33.21125471791896,-117.27555678461553 …",2017-03-28 18:11:10,846847158162644993
THUNDER YOUTH BASKETBALL SUMMER CAMPS TO BEGIN IN JUNE - http://OKCThunder.com http://dlvr.it/NlL0gm,2017-03-28 18:11:05,846847135647653888
That would cause a riot in OKC,2017-03-28 18:11:02,846847122184003585
おるかさんだ(thunder)! sorry (Konpaku Sariel),2017-03-28 18:10:57,846847104005787648
Thunder Mesa Mining Co. ~ On30 Complete Plan Revised 4/9/16 Here is the most up to date plan for http://pinterest.com/pin/61994932351486014/ …,2017-03-28 18:10:46,846847056543125505
"y'all blew a 3-1 lead, the thunder are the 6th seed",2017-03-28 18:10:38,846847024033136640
"Raichu until 06:40:23pm (29m 47s). 89% (12/15/13 A/D/S), Volt Switch / Thunder Punch. 6.2km SE of downtown. http://maps.google.com/maps?q=42.2548559471914,-83.68823333833267 …",2017-03-28 18:10:35,846847012016476160
"Raichu until 06:40:23pm (29m 47s). 89% (12/15/13 A/D/S), Volt Switch / Thunder Punch. 6.2km SE of downtown. http://maps.google.com/maps?q=42.2548559471914,-83.68823333833267 …",2017-03-28 18:10:35,846847011617955840
"Thunder or lightning. Hmm, hard choice.",2017-03-28 18:10:18,846846937894670336
"A 51.11% IV wild Hitmonchan has appeared! Moveset: unknown / Thunder Punch. Available until 00:37:06 (26m 50s). http://maps.google.com/maps?q=46.185579655389986,6.122897287457912 …",2017-03-28 18:10:15,846846926079320064
"Lanturn available until 06:39:38pm (29m 48s). Charge Beam / Thunder (35.6% - 1/11/4) http://maps.google.com/maps?q=37.503259527781424,-77.58043420452711 …",2017-03-28 18:09:50,846846821766975490
Today I'd naught to do besides sit full astride the thunder of my wonder. Made me strong & weak. How do I look inside? Take a peek. pic.twitter.com/IAuqHJ4Df6,2017-03-28 18:09:43,846846790263590912
Lil’ Darty was born! http://scarly.berters.net/?p=130 # brothers # events # family # fun # thunder,2017-03-28 18:09:20,846846697128939520
Check out Kevin Durant 35 Oklahoma City Thunder adidas NBA 4her Girls Blue Jersey 2XL # adidas http://cgi.ebay.com/ws/eBayISAPI.dll?ViewItem&item=192142746328&roken=cUgayN&soutkn=1qoA42 … via @ eBay,2017-03-28 18:09:18,846846689109557250
that sounds more like a nightmare!,2017-03-28 18:09:06,846846637829996546
Barbara Kenter returns home to die after a violent hate crime. Loved ones in Thunder Bay are asking for support. https://www.gofundme.com/final-expenses-of-barbara-kenter …,2017-03-28 18:08:58,846846601737973764
WHY ZE EVEN BRINGS THE THUNDER! # HigherEdLive @ DrDLStewarthttps://twitter.com/danidominiquep/status/846846058651160576 …,2017-03-28 18:08:38,846846521211539456
"Lanturn available until 06:38:18pm (29m 44s). Water Gun / Thunder (57.8% - 14/8/4) http://maps.google.com/maps?q=39.47120240370091,-76.66956101541768 …",2017-03-28 18:08:33,846846500361703425
"Feeling his breath suddenly on her made her stomach flip ""I was just thinking we should have a garden"" she said shakily.",2017-03-28 18:08:22,846846453939163136
@ Rubiu5 rubius cuando juegas a war thunder,2017-03-28 18:08:21,846846447068831746
my favorite is probably dino thunder's because its so uplifting and makes you stronger,2017-03-28 18:08:17,846846429276635136
in other news i found a cover of cyber thunder cider by meiko,2017-03-28 18:08:02,846846366345318401
or how about that good old fashioned Dr. Thunder! pic.twitter.com/AUxpvG7AkR,2017-03-28 18:08:00,846846358917189635
Sonz Of Thunder UK Remix WSTRN | Sample Track 'For The City' | @ sonzofthunderuk # MusicNewshttp://dld.bz/f8rcj,2017-03-28 18:07:30,846846234241515521
"SLM:Mareep 62.22% (10/10/8/Thunder Shock/Body Slam) till 15:35:13 (28m 2s). CP for lvl30+: 60 http://maps.google.com/maps?q=37.6880112789822,-122.17677795711509 …",2017-03-28 18:07:10,846846148333617155
Thunder vs Magic game tomorrow,2017-03-28 18:07:10,846846148098899972
"guys, I was gonna use ""which side are you on?"" as my intro/outro this week. ya stealin my thunder here!",2017-03-28 18:07:06,846846133053767680
Só queria comer esse novo thunder do outback,2017-03-28 18:06:51,846846071565373442
"Hold on It's # BrexitEve. Surely, thunder & lightning with # Article50 signing? Well, maybe drizzle moving in from Europe # Brexitpic.twitter.com/MGPXbKvLaU",2017-03-28 18:06:51,846846070751739904
sometimes makes me wonder why ze even brings the thunder,2017-03-28 18:06:48,846846058651160576
Thanks a lot Farage you Hitler spunk gargling thunder cunt.,2017-03-28 18:06:36,846846005886771205
Man fuck this 14th queen stealing Nina Mo'nina's thunder # rpdr,2017-03-28 18:06:33,846845995963047936
Nova adição às Mais queridas: a-ha / Rolling Thunder http://www.deezer.com/track/6463622 @DeezerBrasil,2017-03-28 18:06:19,846845935963586560
I always love 2 listen to the thunder. I new we were getting a good storm! We do get huge storm all summer.,2017-03-28 18:05:58,846845847891574786
Thunder got his new halter on today. He was a good boy about getting it put on and the old one taken off.,2017-03-28 18:05:58,846845847673475072
Here's to hoping that it rains all night so I can fall asleep to thunder,2017-03-28 18:05:51,846845817977745412
"Lanturn 48.9% IV (12/9/1) with Charge Beam & Thunder has spawned til: 06:28:07pm (22m 27s). http://maps.google.com/maps?q=33.5951060871834,-78.99417120456766 …",2017-03-28 18:05:44,846845791507562496
"North Tucson: Mareep 80.0% (15/10/11 - Thunder Shock/Thunderbolt/normal til 15:34:26(28m 51s). http://maps.google.com/maps?q=32.268966193136336,-110.96253886044518 …",2017-03-28 18:05:34,846845748352172033
Thunder got his new halter on today. He was a good boy about getting it put on and the old one taken off.,2017-03-28 18:05:29,846845728521666560
"Lanturn 57.8% IV (4/11/11) with Water Gun & Thunder has spawned til: 06:35:14pm (29m 58s). http://maps.google.com/maps?q=33.58770554121083,-78.98966593299323 …",2017-03-28 18:05:20,846845690454179840
"Mareep (15/1/14, Thunder Shock / Body Slam) has appeared! Available until 15:33:09 (28m 7s)(7th/MainSt/Iave). http://maps.google.com/maps?q=34.41624510868586,-117.27684268022784 …",2017-03-28 18:05:16,846845673764925440
Black Thunder sounds like a place @ mikeybfunnyh2o & @ ALPHAGRIZ1 would hang out in.,2017-03-28 18:05:12,846845657176432640
"Dry time gives way to showers & embedded thunder to close the week. Timing is our friend, however, as dry weather returns this wknd! # Indypic.twitter.com/HFjPDqbhSQ",2017-03-28 18:04:55,846845584350830592
"I'm not going to steal her thunder, but my daughter, @ maryknews, is awesome! She works hard, has talent, and it's beginning to pay off!",2017-03-28 18:04:53,846845576700354561
Sugar Land TX Tue Mar 28th PM Forecast: TONIGHT Chance Of T-Storm Lo 71 WEDNESDAY Thunder Storms Hi 81,2017-03-28 18:04:51,846845568483766272
Sharpstown TX Tue Mar 28th PM Forecast: TONIGHT Chance Of T-Storm Lo 71 WEDNESDAY Thunder Storms Hi 81,2017-03-28 18:04:49,846845559054983168
Date night with my Daddio # thunder # london # belatedxmaspic.twitter.com/zc5809KSVm,2017-03-28 18:04:42,846845530986725377
Canterbury Cricket CEO Lee Germon has been appointed General Manager of the Sydney Thunder. Story: http://sydthu.de/2mNCf2h # ThunderNationpic.twitter.com/pQJO5uIDDw,2017-03-28 18:04:41,846845526746157056
I wasn't bandwagonning though. I was legit joking. I root for da thunder tho. I like em but I'm a Hawks fan,2017-03-28 18:04:40,846845520249323520
NEW: 2017 ShrinersFest will run June 22nd to June 25th. Theme this year is for Veterans. Shriners working with Rolling Thunder closely. pic.twitter.com/prhmWz2UlV,2017-03-28 18:04:36,846845505963462656
"Mareep available until 06:57:40pm (53m 5s). Thunder Shock / Body Slam (22.2% - 3/0/7) http://maps.google.com/maps?q=39.20127387245233,-76.85223128309514 …",2017-03-28 18:04:34,846845497566474241
Houston TX Tue Mar 28th PM Forecast: TONIGHT Chance Of T-Storm Lo 71 WEDNESDAY Thunder Storms Hi 81,2017-03-28 18:04:33,846845492235505666
"Just stop the debate, DL has already won. Ze brought the thunder. # HigherEdLive # acpa17",2017-03-28 18:04:21,846845441312468992
Addicks Barker TX Tue Mar 28th PM Forecast: TONIGHT Chance Of T-Storm Lo 71 WEDNESDAY Thunder Storms Hi 81,2017-03-28 18:04:14,846845412443074565
LOVE the sound of thunder,2017-03-28 18:04:03,846845367928934403
Tulsa OK Tue Mar 28th PM Forecast: TONIGHT Thunder Storms Lo 60 WEDNESDAY Chance Of T-Storm Hi 75,2017-03-28 18:04:02,846845362019188736
Stillwater OK Tue Mar 28th PM Forecast: TONIGHT Thunder Storms Lo 59 WEDNESDAY Chance Of T-Storm Hi 75,2017-03-28 18:04:01,846845358403661824
Lawton OK Tue Mar 28th PM Forecast: TONIGHT Thunder Storms Lo 55 WEDNESDAY Chance Of T-Storm Hi 75,2017-03-28 18:03:59,846845350321274884
where's the thunder https://twitter.com/__triiinn/status/846839662324912129 …,2017-03-28 18:03:57,846845339546107905
"It's a tidal wave, it's a thunder dome",2017-03-28 18:03:19,846845183077433345
"Lanturn - 36% (Charge Beam/Thunder) till 06:32:35pm (29m 35s). Found at 65 Base Line Rd W (Southcrest) http://maps.google.com/maps?q=42.95993458583534,-81.26612217538052 …",2017-03-28 18:03:03,846845115922595840
Wichita KS Tue Mar 28th PM Forecast: TONIGHT Thunder Storms Lo 51 WEDNESDAY Thunder Storms Hi 59,2017-03-28 18:02:50,846845059765059585
Topeka KS Tue Mar 28th PM Forecast: TONIGHT Chance Of T-Storm Lo 49 WEDNESDAY Thunder Storms Hi 55,2017-03-28 18:02:49,846845055830773760
Salina KS Tue Mar 28th PM Forecast: TONIGHT Thunder Storms Lo 49 WEDNESDAY Thunder Storms Hi 49,2017-03-28 18:02:48,846845052014006272
Manhattan KS Tue Mar 28th PM Forecast: TONIGHT Thunder Storms Lo 49 WEDNESDAY T-storms Hi 49,2017-03-28 18:02:46,846845042543247360
Lawrence KS Tue Mar 28th PM Forecast: TONIGHT Chance Of T-Storm Lo 49 WEDNESDAY Thunder Storms Hi 59,2017-03-28 18:02:44,846845033395425280
When Capcom tells you they're nerfing Thunder Kick # ELEAGUESFVpic.twitter.com/0R1hJdpFoi,2017-03-28 18:02:38,846845010502930433
"Mareep (75.6%) Thunder Shock/Body Slam 11/8/15 (ATK/DEF/STA) Despawns at 15:32:14 https://maps.google.com/maps?saddr=My+Location&daddr=34.18864999463031,-118.58394705179973 …",2017-03-28 18:02:36,846845002093334530
Man I can't talk to your fruitcake ass if you dislike thick thunder thigh women.....,2017-03-28 18:02:30,846844976122126336
welcome to our city! Glad the thunder storm cleared out for you,2017-03-28 18:02:29,846844973349830656
"Lanturn available until 06:26:13pm (23m 49s). Water Gun / Thunder (80.0% - 10/14/12) http://maps.google.com/maps?q=37.6694596111997,-77.56583763563967 …",2017-03-28 18:02:24,846844949333266432
But I'm ready for the rain and thunder,2017-03-28 18:02:18,846844923924152325
La secrétaire parlementaire du ministre des Finances sera à Thunder Bay… # Budget2017 http://ow.ly/ZUM130alJIu pic.twitter.com/TCClCJGYiz,2017-03-28 18:02:15,846844911819411456
U.S. Customs to recruit at Country Thunder Arizona http://azc.cc/2oucH73 via @ azcentral Sure to find 'quality' deplorableTrumpets there.,2017-03-28 18:01:58,846844843259191298
I schedule my dentist appointments so that no matter what I always have to be home for thunder. Bout that time of year again! pic.twitter.com/GmUNNI7lJX,2017-03-28 18:01:47,846844797084221440
"Stole Chelsea Clinton's thunder, didn't they?",2017-03-28 18:01:46,846844792378179585
Fayetteville AR Tue Mar 28th PM Forecast: TONIGHT Chance Of T-Storm Lo 55 WEDNESDAY Thunder Storms Hi 70,2017-03-28 18:01:14,846844656256270337
"Well done to the @ evesham_badders ladies but not to steal your thunder, well done also to the vets team who have also won their division",2017-03-28 18:01:08,846844629949415424
"Raise your words, not voice. It is rain that grows flowers, not thunder. - Rumi # quote",2017-03-28 18:01:04,846844614778798081
Parliamentary Secretary to the Minister of Finance to Visit Thunder Bay… # Budget2017 http://ow.ly/hbMi30alJxN pic.twitter.com/B0XKts9r6t,2017-03-28 18:00:48,846844549737693184
thunder triggered ya eh,2017-03-28 18:00:34,846844488702197760
COME and TRY this Sunday 2nd April. More details to come about the Bendigo Thunder games happening afterwards! http://fb.me/Z2g7D3ZO,2017-03-28 18:00:23,846844442866724864
Storm King's Thunder (D&D) - E97S24: Jarral Lives! http://youtu.be/9xt8xQlDe3Q?a,2017-03-28 18:00:14,846844403285028867
7D: 50 Splash: 70 Thunder: 35 SPC: 70,2017-03-28 18:00:08,846844381596438529
there has to be a 30 on 30 on the thunder talking about what could have been,2017-03-28 18:00:07,846844375422439424
Amidst in thunder uttered thus his voice.,2017-03-28 18:00:04,846844362797400064
Já jogou Lethal Thunder? # lethal-thunder # playlib # games http://www.playlib.com.br/detalhes-do-jogo/lethal-thunder-arcade …,2017-03-28 18:00:03,846844361203703810
Thunder Buddies podcast: Can Russell Westbrook catch the Big O? http://newsok.com/article/5543400?utm_source=NewsOK.com&utm_medium=Social&utm_campaign=ShareBar-Twitter …,2017-03-28 17:59:59,846844342752940032
"# BlackWomenAtWork not to steal your thunder, but the same applies to latinas. # latinawomenatwork i'll start, ""u don't have an accent.",2017-03-28 17:59:10,846844137693310976
"Mareep:: IV:60.0%(15/8/4) Move Set: Thunder Shock/Thunderbolt Available until 18:21:12 (22m 26s) http://maps.google.com/maps?q=35.073936248226985,-78.92506729374982 …",2017-03-28 17:58:45,846844032449961985
"Today's matches are: Helga VS Libby Thunder VS Taffy Results at 5, or 5:30PM PST, dependin' on how beat up I am!",2017-03-28 17:58:38,846844001533620224
"Raise your words, not voice. It is rain that grows flowers, not thunder. - Rumi # quote",2017-03-28 17:58:13,846843896835555328
"With these overhyped bunch of fools in the Argentine NT, if you ever say Argentina > Portugal again, Thunder Fire You. Nonsense!",2017-03-28 17:58:00,846843841533612032
"Μπήκαμε στη ΟΝΕ με το σπαθί μας. Thunder, thunder, Thundercats Ooooh # Σημιτης # ιστοριες",2017-03-28 17:57:44,846843774147940354
"Lanturn - 84% (Charge Beam/Thunder) till 06:26:13pm (28m 42s). Found at 1-29 N Centre Rd (Masonville) http://maps.google.com/maps?q=43.02448634899599,-81.27713292502193 …",2017-03-28 17:57:34,846843733685551105
The One with Monica's Thunder - # CelebrateMegaNadineLustre,2017-03-28 17:57:34,846843733152841729
The One with Monica's Thunder - # CelebrateMegaNadineLustre,2017-03-28 17:57:34,846843733106708481
The One with Monica's Thunder - # CelebrateMegaNadineLustre,2017-03-28 17:57:34,846843733085597697
The One with Monica's Thunder - # CelebrateMegaNadineLustre,2017-03-28 17:57:34,846843733073186817
The One with Monica's Thunder - # CelebrateMegaNadineLustre,2017-03-28 17:57:34,846843733043752961
The One with Monica's Thunder - # CelebrateMegaNadineLustre,2017-03-28 17:57:34,846843732997656577
The One with Monica's Thunder - # CelebrateMegaNadineLustre,2017-03-28 17:57:34,846843732972519429
The One with Monica's Thunder - # CelebrateMegaNadineLustre,2017-03-28 17:57:34,846843732955725824
The One with Monica's Thunder - # CelebrateMegaNadineLustre,2017-03-28 17:57:34,846843732909588480
The One with Monica's Thunder - # CelebrateMegaNadineLustre,2017-03-28 17:57:34,846843732842438656
The One with Monica's Thunder - # CelebrateMegaNadineLustre,2017-03-28 17:57:34,846843732825690112
The One with Monica's Thunder - # CelebrateMegaNadineLustre,2017-03-28 17:57:34,846843732750221312
The One with Monica's Thunder - # CelebrateMegaNadineLustre,2017-03-28 17:57:34,846843732746010624
The One with Monica's Thunder - # CelebrateMegaNadineLustre,2017-03-28 17:57:34,846843732737642498
The One with Monica's Thunder - # CelebrateMegaNadineLustre,2017-03-28 17:57:34,846843732716654592
The One with Monica's Thunder - # CelebrateMegaNadineLustre,2017-03-28 17:57:34,846843732645285894
The One with Monica's Thunder - # CelebrateMegaNadineLustre,2017-03-28 17:57:34,846843732641091584
The One with Monica's Thunder - # CelebrateMegaNadineLustre,2017-03-28 17:57:34,846843732586643456
The One with Monica's Thunder - # CelebrateMegaNadineLustre,2017-03-28 17:57:34,846843732527890432
The One with Monica's Thunder - # CelebrateMegaNadineLustre,2017-03-28 17:57:34,846843732481769476
The One with Monica's Thunder - # CelebrateMegaNadineLustre,2017-03-28 17:57:34,846843732469145600
The One with Monica's Thunder - # CelebrateMegaNadineLustre,2017-03-28 17:57:34,846843732456587264
The One with Monica's Thunder - # CelebrateMegaNadineLustre,2017-03-28 17:57:34,846843732448153600
The One with Monica's Thunder - # CelebrateMegaNadineLustre,2017-03-28 17:57:34,846843732431458305
The One with Monica's Thunder - # CelebrateMegaNadineLustre,2017-03-28 17:57:34,846843732326518785
The One with Monica's Thunder - # CelebrateMegaNadineLustre,2017-03-28 17:57:34,846843732301430784
The One with Monica's Thunder - # CelebrateMegaNadineLustre,2017-03-28 17:57:34,846843732280401924
The One with Monica's Thunder - # CelebrateMegaNadineLustre,2017-03-28 17:57:34,846843732267814914
The One with Monica's Thunder - # CelebrateMegaNadineLustre,2017-03-28 17:57:34,846843732234321920
The One with Monica's Thunder - # CelebrateMegaNadineLustre,2017-03-28 17:57:34,846843732234293248
The One with Monica's Thunder - # CelebrateMegaNadineLustre,2017-03-28 17:57:33,846843732146163713
The One with Monica's Thunder - # CelebrateMegaNadineLustre,2017-03-28 17:57:33,846843732100091904
The One with Monica's Thunder - # CelebrateMegaNadineLustre,2017-03-28 17:57:33,846843732079116289
The One with Monica's Thunder - # CelebrateMegaNadineLustre,2017-03-28 17:57:33,846843732028772352
The One with Monica's Thunder - # CelebrateMegaNadineLustre,2017-03-28 17:57:33,846843732007813121
The One with Monica's Thunder - # CelebrateMegaNadineLustre,2017-03-28 17:57:33,846843731986841605
The One with Monica's Thunder - # CelebrateMegaNadineLustre,2017-03-28 17:57:33,846843731932303360
The One with Monica's Thunder - # CelebrateMegaNadineLustre,2017-03-28 17:57:33,846843731915497475
The One with Monica's Thunder - # CelebrateMegaNadineLustre,2017-03-28 17:57:33,846843731793862658
The One with Monica's Thunder - # CelebrateMegaNadineLustre,2017-03-28 17:57:33,846843731785535489
The One with Monica's Thunder - # CelebrateMegaNadineLustre,2017-03-28 17:57:33,846843731777142784
The One with Monica's Thunder - # CelebrateMegaNadineLustre,2017-03-28 17:57:33,846843731756138497
The One with Monica's Thunder - # CelebrateMegaNadineLustre,2017-03-28 17:57:33,846843731663896576
The One with Monica's Thunder - # CelebrateMegaNadineLustre,2017-03-28 17:57:33,846843731655479296
The One with Monica's Thunder - # CelebrateMegaNadineLustre,2017-03-28 17:57:33,846843731567366144
The One with Monica's Thunder - # CelebrateMegaNadineLustre,2017-03-28 17:57:33,846843731533811714
The One with Monica's Thunder - # CelebrateMegaNadineLustre,2017-03-28 17:57:33,846843731475156993
The One with Monica's Thunder - # CelebrateMegaNadineLustre,2017-03-28 17:57:33,846843731475120129
The One with Monica's Thunder - # CelebrateMegaNadineLustre,2017-03-28 17:57:33,846843731475091457
The One with Monica's Thunder - # CelebrateMegaNadineLustre,2017-03-28 17:57:33,846843731458342912
The One with Monica's Thunder - # CelebrateMegaNadineLustre,2017-03-28 17:57:33,846843731445735425
The One with Monica's Thunder - # CelebrateMegaNadineLustre,2017-03-28 17:57:33,846843731441569792
The One with Monica's Thunder - # CelebrateMegaNadineLustre,2017-03-28 17:57:33,846843731265437696
The One with Monica's Thunder - # CelebrateMegaNadineLustre,2017-03-28 17:57:33,846843731248644101
