text,date,id
"Von said the Broncos NASCAR package with he, Shane and DeMarcus is like when the Thunder had Durant, Westbrook and Harden.",2016-12-22 16:42:44,812050764864618497
War Thunder moves out of it´s open beta phase ;) http://thegg.net/press-releases/war-thunder-enters-release-of-main-game-moves-out-of-open-beta/ … # Warthunder # gamers # WWII # Nippon # Japonia # Gamerpic.twitter.com/6DS64Z0S0i,2016-12-22 16:42:29,812050702017200134
そうそう坊主バーでした（≧∇≦）,2016-12-22 16:42:13,812050634593554432
敗者復活（≧∇≦）,2016-12-22 16:41:36,812050481182699520
"@ Greg651 Guys, you're really stealing @ FirstMondaysFM's thunder here.",2016-12-22 16:41:29,812050450916798466
Just heard thunder bang ... gonna be cold morning here,2016-12-22 16:41:22,812050424278593536
Merry Christmas from your 2016/2017 Pee Wee AAA TriCom Thunder! @ BassProShops # BassProShops # ThunderFamilypic.twitter.com/nyfAepKp8t,2016-12-22 16:41:19,812050411234410497
Reminds me of Thunder Valley MX in Lakewood. https://twitter.com/CinnamonGFE/status/811238480151867392 …,2016-12-22 16:41:10,812050372256825345
"Electabuzz available until 17:10:26 (29m 22s). Thunder Shock/Thunderbolt (28.89% - 4/6/3) http://maps.google.com/maps?q=37.42214102149109,-77.63692215520679 …",2016-12-22 16:41:05,812050351390068736
おはようございます(^_^) やっと終わった（≧∇≦）,2016-12-22 16:41:03,812050343890534401
# NowPlaying on AOR Then and Now: Thin Lizzy - Thunder and Lightning/Baby Please Don't Go http://www.aorthen-now.com,2016-12-22 16:41:02,812050338018684928
Then spoke the thunder,2016-12-22 16:40:58,812050322420011008
"""Aurora Thunder Attack!!!!""",2016-12-22 16:40:44,812050263590793216
Thunder SMP bois,2016-12-22 16:40:40,812050244099653632
Me ha gustado un vídeo de @ YouTube de @ gusanohd (http://youtu.be/EPLu8EG6jDs?a - War Thunder - Directo en Español | Los Japos a,2016-12-22 16:40:39,812050243307114497
"Weekly Prices Dec 19 - 23: Britco $129.72/58.84, Thunder Creek $132.99/60.32.",2016-12-22 16:40:27,812050191436181504
merry early christmas @ o_KC_thunder https://twitter.com/chancetherapper/status/811978771804942336 …,2016-12-22 16:40:23,812050175933972480
"Jolteon (57.78%-7/12/7,Thunder Shock/Discharge) Until 14:09:59 (29m 42s) http://maps.google.com/maps?q=33.938660518128785,-118.02533300523758 …",2016-12-22 16:40:16,812050145919414272
No Retreat No Surrender 2 Raging Thunder > A martial arts mix of Rambo and Kickboxer # LorenAvedon # MatthiasHues # CynthiaRothrock # 80spic.twitter.com/ngBWT7GS8E,2016-12-22 16:40:09,812050117737975812
Fanfare Thunder - 早稲田大学応援部 校歌・応援歌紹介 http://www.w-ouen.com/ouenka/fanfare.php …,2016-12-22 16:40:03,812050089493426176
ICYMI - # NBA: Russell Westbrook had 42 points and 10 rebounds as the Thunder blitz the Pelicans. http://bit.ly/2htsPlZ,2016-12-22 16:40:01,812050081159397376
Éstas son las noticias de... Thunder... ¡Thunder! ¡THUNDER NEWS! ¡OMG! https://youtu.be/fdjEBbWaeYY,2016-12-22 16:39:20,812049911059361792
Von Miller compares DEN's NASCAR package -- Miller/Ray/Ware/Barrett together -- to the OKC Thunder when it had Durant & Harden w/ Westbrook.,2016-12-22 16:39:10,812049869946978304
Aaron Finch led from the front with 63 as the Renegades handed the Thunder their second straight loss. # 9WWOS # BBL06http://wwos.nine.com.au/2016/12/23/05/02/finch-hits-form-as-renegades-down-thunder?/ocid=wwostw …,2016-12-22 16:39:00,812049827731279877
im watching a thunder sehun focus and baekhyun appeared the I am Interested Now pic.twitter.com/wig0YjMgix,2016-12-22 16:38:47,812049773435977729
Death is the sound of distant thunder at a picnic. - http://hugot.com/death-is-the-sound-of-distant-thunder-at-a-picnic/ … # hugot # hugots # quote # quotes,2016-12-22 16:38:24,812049674093797376
"Pikachu has appeared! Expected despawn:04:07:21pm(29m 21s) IV:84.44% (14/11/13) Moves:Thunder Shock, Discharge http://maps.google.com/maps?q=29.747333889299572,-95.3667623158252 …",2016-12-22 16:37:59,812049572293971969
I wish it was thunder-storming. Makes me feel more relaxed.,2016-12-22 16:37:47,812049520632610817
A5. Everyone seemed to be going to New York this year. Totally stole my thunder. # TNIpic.twitter.com/PJgZS6i0FY,2016-12-22 16:37:43,812049504715309058
I miss in the summer when it would thunder we would listen to thunderstruck at work. every single time,2016-12-22 16:37:42,812049501598941185
"Мне понравилось видео ""WAR THUNDER - СДЕЛАНО В ЯПОНИИ! - ВЕЧЕРНИЙ СТРИМ!""",2016-12-22 16:37:00,812049322955198464
Her hair reminds me of a warm safe place where as a child I'd hide and pray for the thunder and the rain to quietly pass me by ...,2016-12-22 16:36:47,812049267095457792
"HAILSTORM EPIC VARIANT ""THUNDER"" - CHECK OUT IT'S KILL RANGE!! SUPPRESSOR, HOLLOW POINT AND MORE!!: http://youtu.be/0USxQ48EQ6c?a via",2016-12-22 16:36:26,812049181057622016
"Raichu (57.78%-5/15/6,Spark/Thunder) Until 14:06:14 (29m 54s) http://maps.google.com/maps?q=33.923293116984794,-118.00072189718092 …",2016-12-22 16:36:19,812049153421230081
"Russell Westbrook has more 40-point, 10-rebound games than every point guard from the last 31 years combined. (via Elias) # NBA # Thunder",2016-12-22 16:36:01,812049074845315072
*thunder in his soul* I just love any of the various poetic twists on the soul; creativity at its best.,2016-12-22 16:35:41,812048992129449984
"thunder fireeeee y'all , bassts",2016-12-22 16:35:38,812048981228396544
"""Microsoft Studios Reimagines Chief Thunder’s Look with the Help of the Nez Perce Tribe"" http://shoryuken.com/2016/12/22/microsoft-studios-reimagines-chief-thunders-look-with-the-help-of-the-nez-perce-tribe/ …",2016-12-22 16:35:05,812048840039759872
# NBA Westbrook sumó 42 puntos y el Thunder doblegó a Pelicans http://ow.ly/Mv5E307n71Z pic.twitter.com/9l0prVWnDp,2016-12-22 16:35:02,812048828555739137
Sr Girls win Vaughan tourney over Holy Trinity! Way to go Thunder! pic.twitter.com/UyaS9BTzmW,2016-12-22 16:34:46,812048761350393856
# russellwestbrook # uclabasketball # okcthunder # okc # oklahomacity # brodie # thunderup # thunder… https://www.instagram.com/p/BOVa38ABvqC/,2016-12-22 16:34:40,812048735706304512
"Pikachu 84.44% IV has appeared! A15/D11/S12, Thunder Shock/Discharge. Available until 23:04:03 (29m 40s). http://maps.google.com/maps?q=55.70320300876126,13.184963755977414 …",2016-12-22 16:34:23,812048666257162241
el thunder,2016-12-22 16:33:57,812048554994843648
The thunder that will fire you https://twitter.com/mz_kamsy/status/812028103862128641 …,2016-12-22 16:33:37,812048470777466880
I liked a @ YouTube video http://youtu.be/w0s0E8eTLNM?a CAT GOT CANNONS - F6F-5N (War Thunder Plane Gameplay),2016-12-22 16:33:28,812048432185671681
@ Asgards_Thunder pic.twitter.com/5LzlwhNz5w,2016-12-22 16:33:16,812048382072094720
And just think of the SCENES.Thundersnuggles while Bill tells him trad. stories about the creation of thunder,2016-12-22 16:32:47,812048262626766848
ice punch and thunder punch are moves that buzzwole just.. knows.,2016-12-22 16:32:35,812048213263777792
"Raichu (71.11%-10/12/10,Thunder Shock/Thunder Punch) Until 13:52:31 (20m 17s) http://maps.google.com/maps?q=33.91862816576378,-117.99880044047444 …",2016-12-22 16:32:13,812048120980721664
"Thanks @ YouTube @ Google for the @ socolachocs & Happy Holidays to YouToo, your team ! I'll share with all the folks here at @ Thunder_Incpic.twitter.com/rClnYROowa",2016-12-22 16:31:24,812047914415460352
Live : # Sonz Of Thunder UK - Frontline Testimony - http://goo.gl/LN0dCo 24/7 TV # nowplayingpic.twitter.com/SofLUFdQXr,2016-12-22 16:31:18,812047889065267200
"Raise your words, not voice. It is rain that grows flowers, not thunder. - Rumi # quote",2016-12-22 16:30:51,812047774485282818
"Kids like them, they were born in a storm. They have lightning in their souls, thunder in their hearts & chaos in their bones .",2016-12-22 16:30:33,812047698715025408
# PS4 War Thunder enters release of main game - Moves out of open beta http://newconsolegames.net/?upshrt=Blg47DAd …,2016-12-22 16:30:12,812047613759516673
"Raise your words, not voice. It is rain that grows flowers, not thunder. - Rumi # quote",2016-12-22 16:30:12,812047613683961856
Special weather statement in effect for Thunder Bay. http://www.weather.gc.ca/warnings/report_e.html?on59 … # Tbay,2016-12-22 16:30:09,812047601218572289
"Everyone has an opinion, but who does Russell Westbrook think he is? with @ soakedinblue # Thunder # NBAhttp://thunderousintentions.com/2016/12/22/russell-westbrook-self-opinion/ …",2016-12-22 16:30:02,812047570776170497
"Drought expanding in Oklahoma! At 5, 6 & 10pm, rain & thunder for holiday weekend. Forecast on @ KJRH2HD # okwx # kswxpic.twitter.com/w6nd1Dxr07",2016-12-22 16:29:41,812047482632839168
It's that time Troopers some War thunder then more Witcher 3 Blood and wine it's been my favorite area next to Skellige. # Twitch # Streaming,2016-12-22 16:29:21,812047400147763200
"""Unless Russ is prepared to leave an extraordinary sum of $$ on the table, he will be a Thunder for the foreseeable future"" - @ WindhorstESPN",2016-12-22 16:28:23,812047156538384386
"""fvery search has a story. Find it.f -Chris Thunder",2016-12-22 16:27:50,812047018537418752
"Rio de Janeiro (Brazil) Moderate or heavy rain in area with thunder 27C/81F, Wind: 14mph/22kph from N pic.twitter.com/PhAT0I2fJl",2016-12-22 16:27:38,812046964766318592
I might go to Jimmy Bez Blues Band at Thunder Road in S... http://www.bandsintown.com/event/13256819?artist=Jimmy+Bez+Blues+Band&came_from=15 …,2016-12-22 16:27:24,812046906868334592
I liked a @ YouTube video from @ thunders7ruck http://youtu.be/FHdMcjcHS0E?a No Shame In Their Game | Youtube 2016 (COD BO3 BRM Gameplay),2016-12-22 16:27:15,812046868406534145
Hidden birds of thunder and secret little stick men... Adding the last touches and a final… https://www.instagram.com/p/BOVZ_IJgDUN/,2016-12-22 16:26:54,812046780980465665
I love a bit of Show Me Heaven. Days of Thunder was a shit film tho.,2016-12-22 16:26:49,812046761141354497
"@ ThunderLogo Its been so weird lately,me and Thunder haven't talked for a lonnnnggg time..At least I'm saying hi now XD",2016-12-22 16:26:48,812046755755937793
@ThundeR_21VoicE 알티잡으러왔습니당*'ㅅ'*,2016-12-22 16:26:46,812046749057499136
I liked a @ YouTube video http://youtu.be/XmD6IV136fE?a [Thunder - Sign] KPOP TV Show | M COUNTDOWN 161222 EP.504,2016-12-22 16:26:38,812046716442734592
"O Lakers tem um elenco repleto de novilhos, mas fora do seu template. Dê uma olhada no Jazz, Nuggets, Suns e Thunder.",2016-12-22 16:26:12,812046606568722432
sonics or thunder?,2016-12-22 16:26:11,812046603251019777
"i'm telling you, you don't need that guy, it's so black and white, he's stealin your thunder, baby blue ain't your color",2016-12-22 16:25:51,812046517666189312
the dirtbombs - thunder in the sky -ax and ~PM~ https://tmblr.co/Zkc1mm2GC0tKq,2016-12-22 16:25:34,812046447940141056
"I liked a @ YouTube video http://youtu.be/tjYA10Lr3DE?a Oklahoma City Thunder vs New Orleans Pelicans - Full Highlights | Dec 21, 2016 |",2016-12-22 16:25:16,812046371696115714
# Claremorris Shopping Vouchers available from St. Colman's Credit Union. An ideal gift for all occasions can be used in Blue Thunder pic.twitter.com/ZWdVGwhO1I,2016-12-22 16:25:13,812046358219751424
I'm literally next to a guy right now who is wearing an OKC Thunder shirt and a Golden State Warriors hat.,2016-12-22 16:25:02,812046313760157696
Can't you hear can't you hear the thunder?,2016-12-22 16:24:57,812046292541173760
"You held me down, but I got up, already brushing off the dust; you hear my voice, you hear that sound, like thunder gon' shake the ground…",2016-12-22 16:24:54,812046279345893376
And get the thunder rolling!,2016-12-22 16:24:51,812046266859487233
"the hole got bigger. I'd like to thank the thunder, # elgordo and beer # wherewegoinnext",2016-12-22 16:23:59,812046047241347072
I used to love watching Dynamite Blaster as a kid! Probably because it reminded me of Big Thunder Mountain. pic.twitter.com/txLetu5KmK,2016-12-22 16:23:54,812046027591217152
"""Thunder is good, thunder is impressive, but it is the lightning that does the work.""-- Mark Twain # quotepic.twitter.com/fm7VSh04QP",2016-12-22 16:23:46,812045991717335040
The thunder storm might be brewing here.,2016-12-22 16:23:43,812045980518481921
Get Anthony Davis to the Thunder,2016-12-22 16:23:34,812045943252123652
"""Cease your constant rambling!"" His voice bellows like a crack of thunder. ""You are not ordered to prattle on like a fool.""",2016-12-22 16:23:22,812045891402141700
"Massive Blizzard to Hit Thunder Bay Ontario on Sunday December 25, 2016 https://youtu.be/K_z5tJA0Vi8 via @ YouTube",2016-12-22 16:23:16,812045869226848256
"[Toa Payoh] Wild Jolteon spotted at 154 Lor 2 Toa Payoh!46%, Thunder Shock/Thunder. Disappears 05:50:08 (26m 59s). http://maps.google.com/maps?q=1.3331536,103.84630804 …",2016-12-22 16:23:11,812045845969436672
"As part of its Holiday Assist tradition, the Oklahoma City Thunder will hold its 9th annual Holiday Blood Drive... http://fb.me/12WzKZUfK",2016-12-22 16:23:03,812045811974602752
"Pikachu (86.67%-14/13/12,Thunder Shock/Thunder) Until 14:09:36 (46m 38s) http://maps.google.com/maps?q=33.92268055056994,-118.0344812454387 …",2016-12-22 16:22:57,812045789497212928
hi Thunder we haven't for a long time :(,2016-12-22 16:22:53,812045771201802245
# Jamiat_FoundationDay Or # BlackDay Thunder squad Foundation day,2016-12-22 16:22:32,812045683096190977
I liked a @ YouTube video http://youtu.be/5fNLEPrNi2A?a Thunderstorm and Rain Sounds - Heavy Thunder & lightning Strike Ambience For,2016-12-22 16:22:27,812045663148064768
Make it rain thunder man,2016-12-22 16:22:10,812045590297067520
"All the big performers will be busy stealing # Trump's thunder at the ""We The People"" concert http://www.politico.com/tipsheets/playbook/2016/12/trump-pence-invited-to-gop-retreat-dems-plan-miami-inaugural-bash-scoop-clinton-aides-kept-tabs-on-anti-trump-effort-inside-rahms-emails-bday-jamie-kirchick-217990 …",2016-12-22 16:22:04,812045563701010432
Kā stealing thunder definē latviešu valodā?,2016-12-22 16:21:57,812045534999486465
go ride the thunder river rapids ride at dreamworld,2016-12-22 16:21:51,812045508990484480
Thunder nos agradece con esta foto en la que se ve taaaaan bien https://instagram.com/p/BOUpEf0D5x5/ http://fb.me/135Rouuf3,2016-12-22 16:21:42,812045471803969536
I yelled back when I heard thunder But I'm down to one last breath And with it let me say Let me say,2016-12-22 16:21:38,812045454473068546
The Side Part: Joffrey - Daily Thunder http://aggbot.com/Oklahoma-City-Thunber-News/article/29475039 …,2016-12-22 16:21:35,812045443202949121
With their voices soft as thunder,2016-12-22 16:21:17,812045366778589184
Delays on NJ 29 southbound approaching Thunder Rd/Cass St (Trenton) delays due to http://www.511nj.org/IncidentList.aspx?listType=All&605 …,2016-12-22 16:21:16,812045362097782784
SUPER MEGA HYPER ULTRA EPIC!!!!This should have been inserted in Danger and Thunder as opening song!,2016-12-22 16:20:31,812045174134214657
Whispering World (CHORDS) by Royal Thunder http://dlvr.it/Mxh8RP,2016-12-22 16:20:03,812045056643211264
"Resumen del Thunder-Pelicans de ayer, adictos. https://youtu.be/tjYA10Lr3DE",2016-12-22 16:19:55,812045024301088769
STAR GAZER final # book in the Blue Thunder series # romance # asmsg # ian1 # kindle # ibook # spub http://spangaloo.com/books.php?bid=7 pic.twitter.com/gsbzHQ9u3O,2016-12-22 16:19:07,812044822987030528
"Now that's a serious thunder, rain AND hail storm. L.A never had that. Bienvenido Bogota! Ah, how I've missed thee. # ThunderStorm # Love",2016-12-22 16:18:54,812044767571873793
"@ PHCNnigeria The thunder wey go fire you still dey load Light in my area has gone from epileptic to ""dead"" I go swear 4 u wit my holy anger",2016-12-22 16:18:51,812044754854801409
"Savannah's sister told me she fears the sound of thunder, semi-trucks, and pogo sticks",2016-12-22 16:18:47,812044738744479744
Feb 9th I will be there when the Thunder play the Cavs and I'm super happy about it,2016-12-22 16:17:47,812044488734633984
Gillius Thunderhead and the power of thunder: Golden Axe # Sega # Genesis # retrogaming # pixelart # ThrowbackThursday pic.twitter.com/5uiTPUcBP4,2016-12-22 16:17:47,812044486956216320
Thunder in his arms https://twitter.com/canelo/status/800877780258811908 …,2016-12-22 16:17:17,812044362251141122
introducing thunder thursday!!! pic.twitter.com/dfcZl5UyvC,2016-12-22 16:17:14,812044347441115140
Will the Oklahoma City Thunder shooting guard play versus the Boston Celtics? http://fb.me/7pLfRjjkc,2016-12-22 16:17:08,812044323676192769
"I'm at The @ HomeDepot in Thunder Bay, Ontario https://www.swarmapp.com/c/7xom2mUEtOC",2016-12-22 16:16:44,812044225181270016
I liked a @ YouTube video from @ thunders7ruck http://youtu.be/FHdMcjcHS0E?a No Shame In Their Game | Youtube 2016 (COD BO3 BRM Gameplay),2016-12-22 16:16:31,812044169162133504
Cummins's Quick 37 Melbourne Renegades vs Sydney Thunder Highlights: http://youtu.be/LmzExkJi8FE?a via @ YouTube,2016-12-22 16:16:31,812044168541470720
Big Bash League 2016 17 Melbourne Renegades vs Sydney Thunder 22 12 2016 Match 3: http://youtu.be/hVPXZBLFGgE?a via @ YouTube,2016-12-22 16:16:31,812044166712659968
Finch's 63 Melbourne Renegades vs Sydney Thunder Highlights: http://youtu.be/ISbl9ep6VQQ?a via @ YouTube,2016-12-22 16:16:30,812044164548481028
Melbourne Renegades vs Sydney Thunder 2016 3rd Match Big Bash League 2016: http://youtu.be/rB7IzSMyJVA?a via @ YouTube,2016-12-22 16:16:30,812044163076280324
He looks like simple jack from tropic thunder https://twitter.com/Seinfeld2000/status/812033056412307456 …,2016-12-22 16:16:01,812044044457168903
i hear thunder dont bloody rain now,2016-12-22 16:15:59,812044034000588800
"When you hear a bit of thunder and think a storm is coming, but it just fades away .",2016-12-22 16:15:54,812044013608062976
so did I! We'll have to try them. Most of his still fit if they aren't skinny jeans. He's starting to get thunder thighs. Lol,2016-12-22 16:15:11,812043834649694208
Thunders' Victor Oladipo Update. # Thunderuphttp://wp.me/p7YXD0-2pa,2016-12-22 16:15:05,812043808728875012
Heir of Thunder by Karissa Laurel is out now! Check out the blog tour for a chance to # WIN a copy + Amazon GC! http://magicandmachines.jessicaandgracie.com/heir-thunder-karissa-laurel/ …,2016-12-22 16:14:54,812043760607592450
@ AaronFinch5 on fire as Renegades steamroll Thunder @ BBLhttp://www.theage.com.au/sport/cricket/big-bash/melbourne-renegades-score-huge-big-bash-league-win-over-sydney-thunder-20161222-gtgwdg.html …,2016-12-22 16:14:45,812043725358518272
"Thunder Bay Transit and Lift+ will operate on its Sunday/Holiday schedule on December 25-26, and January 1.... http://fb.me/11tppN0n8",2016-12-22 16:14:18,812043611693023232
Live Big Bash League cricket: Melbourne Renegades v Sydney Thunder... http://twib.in/l/9Ekz5jxeRbGE via @ billballentinepic.twitter.com/feKrWPTX1G,2016-12-22 16:14:18,812043609784614913
# headies2016 change this mumu camera for us before thunder fire u pple,2016-12-22 16:14:17,812043607129681920
ONLY 99¢ thru 12/25! A MIGHTY ROLLING THUNDER http://amzn.to/2foLaPi # BOOKSPECIALS # goodreads # mustread # postapocalyptic # endoftheworldhttps://twitter.com/barb_ed/status/810869814512254976 …,2016-12-22 16:14:13,812043589916233733
"Koolit says Hyaku means ""Thunder"", though I'm sure it more commonly means ""Hundred"".",2016-12-22 16:13:54,812043509116981248
GAME ON RAIN OR SHINE. (Unless there is thunder or lightning) Make sure to bring your umbrellas ! Game starts 5PM,2016-12-22 16:13:53,812043507942572032
was @ RobertDowneyJr racist cos of Tropic Thunder?? Grow up..sad morons!,2016-12-22 16:13:08,812043318607642624
"Please do. Had one behind me at Big Thunder. Said. ""This is ridiculous"" at least 20 times for people leaving an inch in front of them https://twitter.com/MattEPannell/status/812040354170077184 …",2016-12-22 16:12:04,812043049090117632
THUNDER by http://LuizSantos.com http://reverbnation.com/luizsantosmusic/song/16309849-thunder-by-luiz-santos … # jazz # percussion # art # instrumental # composer # ny # Nyc # classical,2016-12-22 16:12:01,812043035563282436
I liked a @ YouTube video from @ thunders7ruck http://youtu.be/FHdMcjcHS0E?a No Shame In Their Game | Youtube 2016 (COD BO3 BRM Gameplay),2016-12-22 16:11:48,812042979900878849
http://ift.tt/2i00hnz TACKMA Thunder T Varsity Jacket in Off White,2016-12-22 16:11:28,812042897445056512
Me ha gustado un vídeo de @ YouTube (http://youtu.be/gg0o6V-M6pg?a - War Thunder Universe: Game Released!).,2016-12-22 16:11:25,812042886783127552
it's good. It has SW goodness that doesn't steal the thunder of a SW film. If that makes sense.,2016-12-22 16:11:20,812042864528068609
"Magneton till 01:39:53pm (28m 36s) IV:60.00% A:15 D:5 S:7 M1:Thunder Shock M2:Flash Cannon http://maps.google.com/maps?q=37.307105439723934,-121.93126715602355 …",2016-12-22 16:11:15,812042841945870336
Killer Instinct - Reimagining Thunder (Official) - http://gamesitereviews.com/killer-instinct-reimagining-thunder-official/ … Gaming Videos # games # gamingpic.twitter.com/nkji650FqI,2016-12-22 16:10:04,812042544980889601
"Couldn't hear the thunder, but I could hear your heart race",2016-12-22 16:09:52,812042494858838016
"the Celtics when they had Ray Allen, KG, Paul Pierce, and Rondo would destroy the Thunder now",2016-12-22 16:09:14,812042333810266119
Wandering around Thunder Totem like you do. # warcraftpic.twitter.com/ZaoXlBMWgr,2016-12-22 16:09:05,812042298754236416
Bersa Thunder 380: The Dirty Argentinian - Tactiholics™ http://fb.me/8fhj1iGJJ,2016-12-22 16:09:02,812042285785477121
http://ift.tt/2igQkCW # shoes Supra Thunder Thriller Edition Black **THE ONLY PAIR ON THE INTERNET **!!!,2016-12-22 16:08:30,812042149160189953
Big Thunder Mountain Railroad (DLR) has reopened at approximately 1:08 PM PT,2016-12-22 16:08:21,812042112170594304
A Sound Of Thunder - Queen of Hell(featuring Veronica Freeman) https://youtu.be/L6MagBcSYD8 @ YouTubeさんから,2016-12-22 16:08:18,812042100699078656
Lol if I catch you .... thunder will backfire and strike you double lol just kidding https://twitter.com/anthem_annie/status/812021625700892672 …,2016-12-22 16:08:11,812042069745299457
bon courage,2016-12-22 16:08:05,812042047477710853
"Documentary Note: ""WALKING THUNDER"" http://fb.me/4SsnpOSXg",2016-12-22 16:07:26,812041884553990145
Oklahoma City Thunder # # OklahomaCityThunder http://dlvr.it/Mxgcxm https://goo.gl/fb/H2gbrc,2016-12-22 16:07:25,812041877130190848
Almost Top Secret! Gallery and new vendor's booth opening up in Thunder Bay. Here are the books! http://duncanbooks.blogspot.ca pic.twitter.com/tfuCeHMoQz,2016-12-22 16:07:05,812041794082996226
Thunder y Lighting https://twitter.com/kervin_durantt/status/812041572363763712 …,2016-12-22 16:06:56,812041755570880512
Supra Thunder Thriller Edition Black **THE ONLY PAIR ON THE INTERNET **!!! http://ift.tt/2igQkCW,2016-12-22 16:06:37,812041675224838144
I liked a @ YouTube video from @ machinegunbenji http://youtu.be/OF8-iYqTQM0?a War thunder | Reaction to Gaijin,2016-12-22 16:05:45,812041460052795392
Attraction Big Thunder Mountain is now closed after being temporarily closed. # BTM # Disneyland # DLP,2016-12-22 16:05:43,812041451223793664
ビリーは今やってないけど、カーレッジくんは最近やってるのみたよ！ティーンタイタンズとベン10まだやってるw,2016-12-22 16:05:38,812041431627878400
Whiskey Review: Thunder Road Distillery Butcher's Bourbon - The Whiskey Wash http://ow.ly/qdWm307m6dg,2016-12-22 16:05:18,812041346714370048
~bueno ya sabes como es con sus pertenencias y eso,2016-12-22 16:05:10,812041313831059456
"~molestia o tomarte como mensajero, pero ¿Podrías darle esto a Loki? Olvide entregárselo y esta muy nervioso por no tenerlo,~",2016-12-22 16:05:09,812041307862499328
"~de sus palabras, la rubia respondió para luego alzar hacia el joven aquel cuaderno que tenia entre manos* No quiero ser una~",2016-12-22 16:05:08,812041301852094464
"~la cabeza ante la pregunta ajena* El fuego fue hoy por la mañana, en clase de historia ¿No te enteraste? *Siguiendo el juego~",2016-12-22 16:05:06,812041294323314688
*Al llegar hasta donde el joven rubio se encontraba no pudo evitar esbozar una gran sonrisa al oírle y de inmediato negó con~,2016-12-22 16:05:04,812041287188807682
fuck thunder fang and sucker Punch are breeding only,2016-12-22 16:04:58,812041262832484352
"ah c'est cool ! :) Non pas moi, j'essaye d'avancer dans ma thèse avant le stage",2016-12-22 16:04:29,812041140396556290
The smiling assassin Brad Hogg fires as the . @ RenegadesBBL smash the Thunder. # BBL06pic.twitter.com/XpDgXfkbZt,2016-12-22 16:03:54,812040991813210112
WAR THUNDER | REALISTA | « CHI-NU - TANQUES JAPONESES » | EN ESPAÑOL: http://youtu.be/Cuahe4EK5Nw?a vía @ YouTube,2016-12-22 16:03:53,812040988822765568
Now playing # WildCub - Thunder Clatter on three clock hours FM,2016-12-22 16:03:45,812040957017358337
oooooooooo THUNDER!,2016-12-22 16:03:30,812040894580920321
# Birchbark bench project with Evain and Ziggy @Thunder Bay Beach https://www.instagram.com/p/BOVXSXnhyDn/,2016-12-22 16:03:20,812040850196742144
@ HipTv # TheHeadies2016 change this mumu camera for us before thunder fire u pple,2016-12-22 16:03:16,812040832207507459
Brand Thunder Announces Media Packages for their New Tab Page Partners - http://bit.ly/2fsn0HA pic.twitter.com/U0YTwIEuYG,2016-12-22 16:02:54,812040741459554305
