text,date,id
"Electabuzz available until 15:30:03 (29m 45s). Thunder Shock/Thunderbolt (57.78% - 12/6/8) http://maps.google.com/maps?q=37.4529044856938,-77.63656415918523 …",2016-12-22 15:00:19,812024992263270400
"This Weekend: Thunder Bay, Canada - Dec 23 at NV http://www.bandsintown.com/event/13151586?artist=Sydney+Blu&came_from=117 …",2016-12-22 15:00:18,812024988001824770
"Cash Game $25/50 NLH | Phil Hellmuth, Maria Ho | Thunder Valley |- Part 1 -| Livestream 2016-01-29 http://youtu.be/UCUoM9vpnq8?a",2016-12-22 15:00:09,812024948550156288
"уже который день не могу оторваться, ужас",2016-12-22 15:00:06,812024936227307521
7D: 100 Splash: 35 Thunder: 40 SPC: 110,2016-12-22 15:00:05,812024933387800576
Couldn't hear the thunder but I heard your heart race,2016-12-22 15:00:01,812024918481190912
@ MAGA_Thunder @ KellyannePolls kellyann makes me sick to my stomach. I wouldn't trust her with my dogs! Her poor kids. ..,2016-12-22 14:59:28,812024776931889152
"Microsoft Didn't Get Thunder's Look Just Right in Killer Instinct, New DLC Fixes That. http://bit.ly/2hMaiEl pic.twitter.com/QrJRTvNIzJ",2016-12-22 14:58:42,812024584367116288
"Raegen- ""I'm not happy. When I'm not happy, there's thunder all over the place."" # takesafterheraunt",2016-12-22 14:58:18,812024485691949056
I caved. Playing # PokemonBlue because I wanna get my Zapdos to level 51 so he can learn Thunder.,2016-12-22 14:58:16,812024474912620544
hero thunder,2016-12-22 14:58:13,812024462820380673
"Fun fact: Donder means Thunder in dutch. And dag is day, so its Thunderday!",2016-12-22 14:57:52,812024375679582213
"Hoy reparto amor y alegría a todos. Menos a los que se llaman Thunder. Esos me caen mal.(?)(Perdón,pero toy' to' emociona')",2016-12-22 14:57:19,812024236336353285
Killer Instinct: Reimagining Thunder https://www.reddit.com/r/Games/comments/5jmpor/killer_instinct_reimagining_thunder/?utm_source=ifttt …,2016-12-22 14:56:33,812024046057619456
Big ASS donkey booty with big juicy thunder thighs! http://bit.ly/1UyEIon,2016-12-22 14:56:30,812024030198829056
Heir of Thunder by Karissa Laurel is out now! Check out the blog tour for a chance to # WIN a copy + Amazon GC! http://uptildawnbookblog.blogspot.com/,2016-12-22 14:56:24,812024008292057088
"War Thunder: Полигон | Эпизод 24 В эфире “Полигон” – еженедельная передача для командиров кораблей, танкистов и пил http://video.t30p.ru/post.aspx?id=919affe1-f404-4919-a9d4-cbf74669fa13 …",2016-12-22 14:56:12,812023954802167810
@ NICKIMINAJ do you mind if I rename your p***y thunder clap? # notsorry,2016-12-22 14:55:41,812023825185509376
I liked a @ YouTube video http://youtu.be/HxHB5G6dwO4?a THUNDER BiRDS ARE GO !サンダーバードガム食べたよ♪,2016-12-22 14:55:30,812023780839194624
*our thunder https://twitter.com/lovelele_/status/812020215005462528 …,2016-12-22 14:55:30,812023778016378880
War Thunder - Getting Started! Again...: http://youtu.be/DdC7ZIJO-r4?a via @ YouTube,2016-12-22 14:55:17,812023724123766784
"The Go! Team - Panther Dash (Thunder, Lightning, Strike)",2016-12-22 14:54:58,812023647187640320
@ Thunder_Valley for 2017 booking consideration: http://www.motley2tribute.com pic.twitter.com/WR6D5Eyqw0,2016-12-22 14:54:30,812023529503748096
"Pikachu (80.00%-8/14/14,Thunder Shock/Thunder) Until 12:24:05 (29m 52s) http://maps.google.com/maps?q=33.90998690397192,-117.97812059460624 …",2016-12-22 14:54:12,812023453297455104
Killer Instinct: Reimagining Thunder http://ift.tt/2hWBxwG,2016-12-22 14:54:10,812023443734597632
"remember, there is always a circle of Irish after Zeus gives you thousand thunders in a million droplets of rain",2016-12-22 14:54:07,812023430937739264
"# OKCThunder # ThunderUp # WeAreThunder Westbrook scores 42, Thunder beat Pelicans http://dld.bz/fpgFp",2016-12-22 14:53:53,812023374234972162
Mira como favea el cabron de @ WhoIsMrMadman . Un puto Mega Slowbro y un Rotom frigorifico que me colo 4 Thunders seguidos de risa,2016-12-22 14:53:50,812023361115189248
the reason the thunder have no players is bec no one wants to play with Russ..he was such a bad teammate that KD had to dip lol,2016-12-22 14:53:25,812023254319845377
Big Thunder Mountain Railroad (DLR) was reported closed at approximately 11:53 AM PT,2016-12-22 14:53:02,812023159104868352
"going to eat fave comfort food/black beans,rice, mac n cheese/curl up in a ball, wait for the thunder from skies https://twitter.com/igorvolsky/status/812021918404591616 …",2016-12-22 14:52:35,812023044172632064
"Heart is beating faster, feels like thunder, magic, static, call me a fanatic",2016-12-22 14:52:17,812022970520571904
NBA REGIONAL REPORTS: Thunder bolt to 11-point win - Examiner Enterprise http://dlvr.it/Mxfs42,2016-12-22 14:52:10,812022940426350592
War Thunder: Conflicts небольшой обзор http://igamer.biz/obzor-igry-war-thunder-conflicts/ …,2016-12-22 14:52:00,812022900744224768
"Thunder Thursday coming up at 2 p.m., talking Russell Westbrook, Alex Abrines and more. Join us at http://newsok.com/live !",2016-12-22 14:51:49,812022852354510848
Always on the prowl for girls about to enter the single world. Or as I like to call it. The THUNDER DOME,2016-12-22 14:51:36,812022798453473280
WHAATS WITH THE THUNDER pic.twitter.com/hkho6DdJjU,2016-12-22 14:50:58,812022639376023552
A look at the Thunder happenings for this Thursday. # ThunderUp http://dailythunder.com/thursday-bolts-12-22-16/ …,2016-12-22 14:50:49,812022602365595649
16 The Japanese House - Face Like Thunder # NiceShitForYourEars16 https://www.youtube.com/watch?v=_peMDiN6f14 …,2016-12-22 14:50:25,812022501215584257
THUNDER ALBUM COMING SOON. 2017. @ NextTuesdayRM @ GlenGallianopic.twitter.com/MbDSDYCCPa,2016-12-22 14:49:55,812022375302778880
"# Thunder # Jackals Ref: Tufts #6 Lines: Carissimo #38, Fusani #41 # ADKvsELM # ECHLhttp://scoutingtherefs.com/2016/12/16472/todays-echl-officials-122216/ …",2016-12-22 14:49:06,812022169869971456
ICYMI OKC Thunder gain road victory over Pelicans behind solid shooting # Thunder # NBAhttp://thunderousintentions.com/2016/12/21/okc-thunder-top-pelicans-road-victory/ …,2016-12-22 14:49:01,812022148713869312
This top is perfect for Thunder games! Grab it today at our Christmas sale! pic.twitter.com/ywS1rR1opz,2016-12-22 14:48:59,812022139658371073
"@ michellemalkin between you and @ AnnCoulter , That's like having thunder & lightning on ""We the People's"" side....You gals rock https://twitter.com/michellemalkin/status/812020338938834944 …",2016-12-22 14:48:48,812022095047720961
Initial 2020 Overall Rankings Released http://www.prepbaseballreport.com/news/PBR/Initial-2020-Overall-Rankings-Released-9754032168 … @ quezadalucas1 @ thunder_academypic.twitter.com/6d55K5hUwa,2016-12-22 14:48:28,812022008238243840
Take some time for self care Thunder Bay! # tbay # HappyHolidays # MassageTherapy # wellness # health # selfcarepic.twitter.com/BGQ1u5FaX5,2016-12-22 14:47:38,812021801270185984
Need some entertainment for family and friends in town this holiday season? Tom night = Rockets. Next Thurs = Thunder. # DontMiss # GrindCity,2016-12-22 14:47:23,812021739467182082
"I don't think there's seeding, otherwise we'd avoidthe ""Thunder Island"" vs ""What a Fool..."" 2nd rd slugfest",2016-12-22 14:47:18,812021714603352064
thunder fire your mouth,2016-12-22 14:46:56,812021625700892672
I added a video to a @ YouTube playlist http://youtu.be/DdC7ZIJO-r4?a War Thunder - Getting Started! Again...,2016-12-22 14:46:47,812021588195418112
Celtic Thunder's 'Hallelujah' Will Give You Chills http://dlvr.it/MxfmzQ,2016-12-22 14:46:13,812021443454111745
12/21/16 bucks at cavs OVER 208 thunder at pelicans OVER 209 BLAZERS WIN -6 vs mavs 2 of 3,2016-12-22 14:45:31,812021268845211648
Melbourne Renegade v Sydney Thunder {AI vs AI} 3rd Match Big Bash League 22 Dec 2016: http://youtu.be/9-_OBV-tZNg?a via @ YouTube,2016-12-22 14:45:30,812021261798932480
"да я просто ещё влоги смотрела у Джарахова они по 45-50 минут, поэтому вот ахах",2016-12-22 14:45:23,812021234728894466
Tinubu is a hero. Abacha was a hero. Buhari is a hero. Obasanjo is a hero. But IBORI is a thief abi ? Thunder fire all of you,2016-12-22 14:45:20,812021221994983424
Nothing but fucking tryhards on blackop3 for them triple play contract smfh sad @ ThunderS7ruck @ Treyarch,2016-12-22 14:44:45,812021074858823680
War Thunderには3つのゲームモードがある。 一番難易度が低く人口も最多「アーケードバトル」 より操縦が難しく、弾薬・爆弾・魚雷が有限になる「リアリスティックバトル」 三人称視点がなく、ジョイスティックやコントローラーがないと操縦もままならない「シミュレーションバトル」,2016-12-22 14:44:34,812021028436131844
# OKCThunder # ThunderUp # WeAreThunder Thunder journal: Donovan takes no comfort in NBA's late rulings on fouls http://dld.bz/fpnuw,2016-12-22 14:43:59,812020882558382081
2day near Mt. Hope Thunder Gem fought sum muggers. The fight was destructive & sum fluffy cats r cleaning up,2016-12-22 14:43:20,812020716266778625
Состоялся официальный выход War Thunder http://www.3dnews.ru/944824#.WFws0Z4zajU.twitter …,2016-12-22 14:43:14,812020694875852800
21 Thunder would be my first guess. http://www.cbc.ca/news/canada/montreal/21-thunder-cbc-soccer-drama-1.3837861 …,2016-12-22 14:43:11,812020681101737989
Gus is not thrilled about his Thunder Shirt. I am extremely pleased.,2016-12-22 14:42:51,812020596204851201
Little Thunder has stolen my heart. https://www.instagram.com/p/BOVOB47gI0FqvcxLveb59leDWu7MB8Q0BMrNVQ0/ …,2016-12-22 14:42:45,812020572754444288
Gostei de um vídeo @ YouTube http://youtu.be/WqetAqNBv5E?aLive … #51 War Thunder Tiger Japonês # Furia-PS4,2016-12-22 14:42:37,812020536498913285
Gostei de um vídeo @ YouTube http://youtu.be/vX30c-A_rts?aFLYING … AIRCRAFT CARRIERS! - Epic User Map! (War Thunder Gameplay),2016-12-22 14:42:35,812020531289616385
Rolling into 2018! Thank you Betsy Tait for another adorable gift. # Thunder # realizewithflo # theone https://www.instagram.com/p/BOVOB51g8mt/,2016-12-22 14:42:25,812020488000204800
Gostei de um vídeo @ YouTube http://youtu.be/KF_pF3uEZu4?a150MM … JAPANESE DERP TANK - Ho-Ro (War Thunder 1.65 Tank Gameplay),2016-12-22 14:41:59,812020378751107072
Gostei de um vídeo @ YouTube http://youtu.be/TbSw-Ng7WqI?aOBJECT … 906 - RIVER MONSTER (War Thunder 1.65 Tanks Gameplay),2016-12-22 14:41:46,812020323298213888
"ахахах, спасибо я просто снова засиделась чуть-чуть ...",2016-12-22 14:41:40,812020299285884929
http://lft.to/2hFW2gR *Want 10 free Lyft rides added to your new Lyft account? << LyftOfferCode MINX >> Thunder Valley Casino Resort,2016-12-22 14:41:29,812020251604951040
The peoples voice. hear their thunder # Tonight2016pic.twitter.com/YwTVtucOwv,2016-12-22 14:41:21,812020217463373826
don't steal my thunder,2016-12-22 14:41:20,812020215005462528
A few lightning strikes south of Whakatane. Front will clear to the east. Still a risk of thunder further south. http://bit.ly/TSOutlook ^JRpic.twitter.com/czacYFrRd1,2016-12-22 14:40:20,812019964462833664
"Regarde, ds fois il fait ds bêtes de match ms les Thunders gagnent pas.Si KD était resté mon pote il serait dans ltop 3 dleur conf",2016-12-22 14:40:14,812019938567352320
"RT: Raise your words, not voice. It is rain that grows flowers, not thunder. - Rumi # quote via @ NOTLcottagerent",2016-12-22 14:39:36,812019777006923777
"Incidentally, ""Thursday"" comes from Old English for ""Thor's Day,"" so it's for the god of thunder bitches",2016-12-22 14:39:25,812019732014632960
happy birthday to my bestie and the one and only scottish thunder love u soso much!! pic.twitter.com/ydRxnGjs2j,2016-12-22 14:38:56,812019611889762304
Just Like a Rollin' Thunder From The Blue Sky 信用のない君と 打算の冥利に尽きて！［蒼い霹靂］,2016-12-22 14:38:53,812019599411593216
"# OKCThunder # ThunderUp # WeAreThunder Westbrook scores 42, Thunder beat Pelicans 121-110 http://dld.bz/fpgx6",2016-12-22 14:38:50,812019587512406020
Have you seen Peachy and Thunder?,2016-12-22 14:38:49,812019582596628481
Thunder only happens when it's raining,2016-12-22 14:38:36,812019525285806080
toxic can't miss when used by a poison type so why can thunder wave miss when used by an electric type,2016-12-22 14:38:12,812019427633819648
KISS - God Of Thunder - Symphony Alive Ⅳ (HD) # FreeTube http://www.youtube.com/watch?v=PxWzMLDPBmU&feature=youtube_gdata_player …,2016-12-22 14:38:03,812019390069796864
boo try flying over a freakin thunder storm. It's literally one of the scariest things EVER!,2016-12-22 14:37:43,812019305428684800
"Pikachu has appeared! Expected despawn:02:35:23pm(57m 54s) IV:71.11% (12/10/10) Moves:Thunder Shock, Thunder http://maps.google.com/maps?q=29.74497425897828,-95.36488178212457 …",2016-12-22 14:37:29,812019244477120512
"Johansen, Iris & Johansen, Roy / Silent Thunder / http://www.shareasale.com/m-pr.cfm?merchantID=58084&userID=181835&productID=616776833 …",2016-12-22 14:37:03,812019135857258496
I liked a @ YouTube video from @ thunders7ruck http://youtu.be/FHdMcjcHS0E?a No Shame In Their Game | Youtube 2016 (COD BO3 BRM Gameplay),2016-12-22 14:36:55,812019103665889280
"Warning:22 Dec 21h00 to 23h00 Sev Thunder Storm obsevered over uMzinyathi, southern Zululand, uThungulu with possible strong damaging winds. pic.twitter.com/8jHwdDUyAn",2016-12-22 14:36:32,812019006320295936
@ Beaumontxx hey beau its me thunder,2016-12-22 14:36:14,812018932097945600
"Patch's Thunderclap has tonight surpassed the 500 target!!! Christmas Day at 12pm over 600,000 people will hear the Thunder # FindPatch",2016-12-22 14:36:10,812018914876133377
Ricky Skaggs & Kentucky Thunder - Amanda Jewell - Ricky Skaggs & Kentucky Thunder,2016-12-22 14:35:34,812018762828300288
あんらまぁwwww まじで???言うてまう？？ あぁ...やばそう,2016-12-22 14:35:34,812018762572402688
"a mí una vez uno me lloro porque le maté un avión al que estaba persiguiendo en el War Thunder, que es por equipos...",2016-12-22 14:35:29,812018743865909248
last year was the anomaly. This is the real thunder,2016-12-22 14:35:17,812018691130830848
I added a video to a @ YouTube playlist http://youtu.be/HX0gZokmG-4?a War Thunder Tank Killing Spree pt. 2,2016-12-22 14:34:54,812018596570427393
Me ha gustado un vídeo de @ YouTube de @rexweiller (http://youtu.be/J4Af5oTtwfY?a - CHI-NU JAPON TIER 2 | War Thunder).,2016-12-22 14:34:52,812018585656758272
I added a video to a @ YouTube playlist http://youtu.be/_c19kk3Se-M?a War Thunder Tank Killing Spree,2016-12-22 14:34:50,812018579784822789
"SNUS Odens, thunders and siberian left POSTING TOMORROW or pick up Coventry or can deliver to certain places pic.twitter.com/C5AaHmBjxO",2016-12-22 14:34:43,812018550772736001
Blue Thunder first in Fargo http://trib.al/LOmRuys pic.twitter.com/oThsUcglbC,2016-12-22 14:34:24,812018471668187136
"# OKCThunder # ThunderUp # WeAreThunder Westbrook scores 42, Thunder beats Pelicans 121-110 http://dld.bz/fpfUQ",2016-12-22 14:33:58,812018361722925056
"Raise your words, not your voice. It is rain that grows flowers, not thunder.",2016-12-22 14:32:54,812018094537375744
@ ThunderS7ruck does it all the time,2016-12-22 14:32:54,812018092289171456
らいめい 自称パルテナの神のサブアカウントです！つぶやかれることはもうないだろう！！ @ RAIMEI_THUNDER,2016-12-22 14:32:41,812018038052532224
Mofvker. Na thunder go fire you https://twitter.com/uncensoredIII/status/812017375138762752 …,2016-12-22 14:32:11,812017911766327296
"Views from OKC: Thunder win, Alex Abrines shines # Thunder # NBAhttp://thunderousintentions.com/2016/12/22/okc-thunder-news-abrines-shines/ …",2016-12-22 14:32:01,812017868573290496
Canadian fireworks won't be part of Stars and Thunder competition http://dlvr.it/MxfZyD # timminspic.twitter.com/rHZ0ZFO4lR,2016-12-22 14:31:39,812017778651643905
"Electabuzz available until 15:01:13 (29m 46s). Thunder Shock/Thunder (82.22% - 12/15/10) http://maps.google.com/maps?q=37.451960167813375,-77.6354006642365 …",2016-12-22 14:31:28,812017731163869185
great rain in surround sound lol at least no thunder or lightning.,2016-12-22 14:31:22,812017706861854720
thank you thunder,2016-12-22 14:31:19,812017692760739842
"Wait below daily avg.:Autopia(10m), Big Thunder Mountain(45m), Buzz Lightyear Laser Blast(20m), Carrousel de Lancelot(Le)(5m)[1/4]",2016-12-22 14:31:05,812017633935626241
"Мне понравилось видео ""Ту-14Т ""ЛУЧШЕ Ил-28?!"" War Thunder НОВИНКА!"" (http://youtu.be/qr0pWU2As3o?a )",2016-12-22 14:30:53,812017584455450624
Waiting times in # DLP: Big Thunder Mountain - 45 min Peter Pan's Flight - 35 min Disneyland Railroad Frontierland Depot - 25 min,2016-12-22 14:30:29,812017483112742912
Thunder on the Plains http://fb.me/11hHWTtVw,2016-12-22 14:30:28,812017480956858368
"Non solo Russell Westbrook, diamo i voti agli OKC Thunder http://dlvr.it/MxfZ45 pic.twitter.com/PxSV6Mvt3b",2016-12-22 14:30:21,812017451915309056
"Non solo Russell Westbrook, diamo i voti agli OKC Thunder http://dlvr.it/MxfYmf pic.twitter.com/y7uDL0rqyg",2016-12-22 14:30:16,812017429933006848
"Non solo Russell Westbrook, diamo i voti agli OKC Thunder http://dlvr.it/MxfYnb",2016-12-22 14:30:12,812017414388879360
Solstice Music Video of The Month: Heavy Metal Thunder by @ youngtongueatxhttps://www.youtube.com/watch?list=PLMF17Ca8nDQZ1cYGFBdhNJrdoU7Of3NCq&v=AGpqsa9zC6I …,2016-12-22 14:30:02,812017372173213696
Llega un nuevo traje para Thunder en Killer Instinct http://pixelania.com/videos/llega-un-nuevo-traje-para-thunder-en-killer-instinct/42806 … El equipo trabaja con la comunidad Nezpic.twitter.com/rWXcgg23Ti,2016-12-22 14:30:02,812017369916706816
Cloudless skies thunder.. stead fast.,2016-12-22 14:29:38,812017271271026689
the replacements - dose of thunder -ax and ~PM~ https://tmblr.co/Zkc1mm2GBn26D,2016-12-22 14:29:35,812017256934899712
"Non solo Russell Westbrook, diamo i voti agli OKC Thunder https://goo.gl/fb/0pwLGd # approfondimenti # nba",2016-12-22 14:29:20,812017192963346432
Thunder and lightning when last. I didn't miss this.,2016-12-22 14:29:00,812017111035998208
I liked a @ YouTube video from @ thunders7ruck http://youtu.be/FHdMcjcHS0E?a No Shame In Their Game | Youtube 2016 (COD BO3 BRM Gameplay),2016-12-22 14:28:26,812016967397834752
I've flown through thunder lightning and a snow storm probs even a hurricane why is LAX canceling flights over a little rain,2016-12-22 14:28:25,812016964465889280
Heir of Thunder by Karissa Laurel is out now! Check out the blog tour for a chance to # WIN a copy + Amazon GC! http://magicandmachines.jessicaandgracie.com/heir-thunder-karissa-laurel/ …,2016-12-22 14:28:22,812016950620590081
Finch punished Thunder when they fractionally over-pitched & bowled slightly too straight. More analysis: http://bit.ly/2i5RMEH . # BBL06pic.twitter.com/rGvOniod00,2016-12-22 14:28:15,812016920941699072
次の @ YouTube 動画を高く評価しました: http://youtu.be/OuPx4XXmIPQ?a Thunder Blade Medley~Drums Solo - Blind Spot,2016-12-22 14:27:59,812016856164945920
Big Bash: Evergreen Brad Hogg bamboozles Sydney Thunder on debut for Melbourne Renegades… https://goo.gl/fb/bYmKYG,2016-12-22 14:27:45,812016797201399808
"MELBOURNE, AUSTRALIA - DECEMBER 22: Ryan Gibson of the Thunder... http://dlvr.it/MxfWxG pic.twitter.com/Rb7uOAI5Dk",2016-12-22 14:27:13,812016661544828928
"Hussein Mohammed asks the questions, Raila responds - si patron. Hussein is raining thunder ☇☇ # Events2016",2016-12-22 14:27:06,812016632855986176
gotta get my fill of Tropic Thunder before it runs out. Dayum that's a tasty beer,2016-12-22 14:26:51,812016571967275008
still so early tho. Spurs won 67 games then playoffs come and thunder get to another level,2016-12-22 14:26:49,812016563083689984
"Led by two superstars, the Thunder cruise past the Mavs in five... https://goo.gl/fb/vjpCca # oklahomacitythunder",2016-12-22 14:26:47,812016551247355904
Je lance un live sur War Thunder ! https://www.twitch.tv/ieyasa/p/425618191482434796 …,2016-12-22 14:26:37,812016509908238336
"I don't wanna know the future, but I'm like rolling thunder",2016-12-22 14:26:35,812016501876256768
90年のライブとアレンジは違うけどよろしくお願いしますとセガ！は欠かせないのかw Thunder Blade Medley~Drums Solo - Blind Spot (ほぼhttp://S.S.T.Band )https://youtu.be/OuPx4XXmIPQ,2016-12-22 14:26:17,812016427280412673
I liked a @ YouTube video from @ thunders7ruck http://youtu.be/FHdMcjcHS0E?a No Shame In Their Game | Youtube 2016 (COD BO3 BRM Gameplay),2016-12-22 14:25:57,812016342555561984
(loses my battle tree streak bc thunder wave can miss now) ok,2016-12-22 14:25:23,812016200817475586
"It's so black and white, he's stealing your thunder",2016-12-22 14:25:12,812016153849724929
no sonics or thunder or mariners. Just two teams at the top of there game. You understand why I say fair weather now?,2016-12-22 14:25:04,812016119397502976
This man MVP even if the thunder not winning https://twitter.com/SportsCenter/status/811960842795237376 …,2016-12-22 14:24:51,812016066486566916
"time @Thunder Bay, Ontario https://www.instagram.com/p/BOVL9qqgMqZ/",2016-12-22 14:24:23,812015947649318913
Haven't even heard thunder in so long!,2016-12-22 14:24:18,812015927520858116
...... Heh... Heh heh heh... Mwah ha ha ha ha ha! BLOOD AND THUNDER!,2016-12-22 14:24:09,812015889939767296
Me ha gustado un vídeo de @ YouTube de @ rodri2897 (http://youtu.be/ErptHDyMZBk?a - War Thunder en español - ¡¡ Type 4 Chi-To a la batalla,2016-12-22 14:23:55,812015831345401860
"the earthbound boys struggle against disjoints. Pk fire/thunder gets chopped up, Ike can counter Pk thunder, run off fair zair",2016-12-22 14:23:45,812015789301698560
THUNDER ALBUM COMING SOON. 2017. @ NextTuesdayRM @ GlenGallianopic.twitter.com/Jwu19cBYD6,2016-12-22 14:23:36,812015750126911489
I liked a @ YouTube video from @ baronvongamez http://youtu.be/2_QnthI4ZDE?a Bomber Cockpits are AMAZING - War Thunder 1.65,2016-12-22 14:23:26,812015709727457280
"Ninja Storm and Dino Thunder are my personal favorites, but RPM is objectively the best.",2016-12-22 14:23:23,812015696909635585
okay but im a thunder fan so imma continue to talk and say facts,2016-12-22 14:23:12,812015651586011136
I liked a @ YouTube video from @ thunders7ruck http://youtu.be/FHdMcjcHS0E?a No Shame In Their Game | Youtube 2016 (COD BO3 BRM Gameplay),2016-12-22 14:22:44,812015532107071488
I have thunder thighs rn,2016-12-22 14:22:37,812015503505956864
☊ Thunder and Lightning - Lost and Gone слушайте и скачивайте на http://umuzon.com/luchshaya-muzyka/Lost-and-Gone/Thunder-and-Lightning/ …,2016-12-22 14:22:07,812015378205437957
USE THUNDER PUNCH,2016-12-22 14:21:40,812015265819099137
"As I added Gold Bond to my already chafed loins, I thanked my dads side of the family for the thunder thighs.",2016-12-22 14:21:35,812015245346619392
calling for big thunder boomers here xmas day,2016-12-22 14:20:48,812015046016561152
When you gimme that thunder you make my summer rain,2016-12-22 14:20:29,812014968023515140
"Melbourne Renegades vs Sydney Thunder highlights: Big Bash League cricket scores, blog http://dlvr.it/MxfQ3q",2016-12-22 14:20:03,812014859915141120
Joel 3:16 GNT—The Lord roars from Mount Zion; his voice thunders from Jerusalem; earth and sky… https://www.biblegateway.com/passage/?search=Joel.3.16&version=GNT …,2016-12-22 14:19:49,812014801178230784
nope. Just thinking which team is the biggest threat to a Spurs WCF. Clips or rockets? Last ye was thunder obv,2016-12-22 14:19:39,812014757863686149
Killer Instinct - Reimagining Thunder: The Legend of Thunder costume is a 100% authentic to… https://goo.gl/fb/1QjHg1,2016-12-22 14:19:32,812014730646843396
Madonna suffers from garophobia which is the fear of thunder. # TMYK,2016-12-22 14:19:18,812014668491395072
New Track: just click play... Thunder Thighs https://soundcloud.com/mike-dizzle-beatz/thunder-thighs … on # SoundCloud,2016-12-22 14:18:48,812014543782215680
С помощью Shazam я только что нашел After The Thunder - Ari Hest. https://shz.am/t119141397,2016-12-22 14:18:35,812014488178356225
"Oui ! Nouveautés pour le Space Mountain, Big Thunder Mountain, Star Tours, parades, Disney Dreams et autres",2016-12-22 14:18:31,812014471824769028
"# IndieComicThursday continues! Check this week's Ray Thunder page :: Chapter 1, Page 30 https://tapastic.com/episode/534846 via @ tapas_app @ tapastic",2016-12-22 14:18:22,812014434990358528
THOR GOD OF THUNDER #14 Ltd 1 for 20 retro Variant Cover by Dave Johnson! NM http://www.ebay.com/itm/-/291979792942?roken=cUgayN&soutkn=MoS6Cj …,2016-12-22 14:18:18,812014417210535936
"Мне понравилось видео ""Ту-14Т ""ЛУЧШЕ Ил-28?!"" War Thunder НОВИНКА!"" (http://youtu.be/qr0pWU2As3o?a )",2016-12-22 14:18:00,812014343390982144
[Thunder - Sign] KPOP TV Show | M COUNTDOWN 161222 EP.504 http://ln.is/www.youtube.com/MAzlb …,2016-12-22 14:17:50,812014301955424256
"Westbrook scores 42, Thunder beat Pelicans 121-110 http://dld.bz/fpnCp",2016-12-22 14:17:46,812014283999576064
Lanzan nuevo traje para Thunder de Killer Instinct http://dlvr.it/MxfP7r # videogamespic.twitter.com/X9SCQEzat4,2016-12-22 14:17:40,812014258489696260
New Record: Saxon - Heavy Metal Thunder / Fly On The Wall [Carrere] [1981] https://goo.gl/LYppX4,2016-12-22 14:17:40,812014258053644288
