text,date,id
island of thunder confirmed for worst raid. my hands hurt. my eyes sting. im never trying to do that again ever.,2016-12-22 18:59:30,812085186749820928
In the mid 80s Dick & Bubba were a package deal. Blue Thunder (84) & Half Nelson (85) pic.twitter.com/YgyvlQySFZ,2016-12-22 18:59:27,812085170799046656
"Getting ready for a ROCKIN' X-MAS - enjoy, everyone # christmas # rock # acdc # xmas # thunder… https://www.instagram.com/p/BOVrYxxAhvV/",2016-12-22 18:58:57,812085044919603200
Thunder for fire this girl but the thunder is busy with # headies2016https://twitter.com/LifeOfBmax/status/811621474473676800 …,2016-12-22 18:58:15,812084871162040320
The loan to fund Aso Rock's shit?....thunder shall fire those asking for the loan and anyone that grants it.... https://twitter.com/NigeriaNewsdesk/status/812082193564659712 …,2016-12-22 18:58:15,812084869572468736
"Thunder Thursday features New Orleans classics with Dapper Dandies, NOW! Soul Company @8p, and funk grooves of WaterSeed @11p, only @BMC! pic.twitter.com/YYWHOwHz2u",2016-12-22 18:58:09,812084843873857541
Gostei de um vídeo @ YouTube http://youtu.be/YUo9_qz30D0?aBeth … Thunder - This Christmas won't be the same without you,2016-12-22 18:58:04,812084822063583232
I liked a @ YouTube video http://youtu.be/3KZ3xstslwk?a WESTBROOK TAKES AD TO IN-N-OUT! OKLAHOMA CITY THUNDER vs NEW ORLEANS PELICANS,2016-12-22 18:57:58,812084797862477824
"Obviously listen regardless but lots of Thunder talk in this one. Still on the fence? ""In 2011 the league screwed Oklahoma City."" Push play. https://twitter.com/zachlowe_nba/status/812042341666136064 …",2016-12-22 18:57:26,812084666685648896
"She hanged, she lingered until I dropped my gaze. Her roar, what thunder to haunt my every dream",2016-12-22 18:57:20,812084639548506112
ブッブー 惜しいな 濁点はあってる,2016-12-22 18:56:39,812084468726890496
i was there for that one i miss PRESEASON THUNDER @ DISupdates,2016-12-22 18:56:37,812084459298164736
ICYMI: Melbourne Renegades defeated Sydney Thunder in their first match of the BBL season by a margin of 49 runs! # BBL06pic.twitter.com/vtbjC9nC6F,2016-12-22 18:56:33,812084440436379648
I liked a @ YouTube video http://youtu.be/3KZ3xstslwk?a WESTBROOK TAKES AD TO IN-N-OUT! OKLAHOMA CITY THUNDER vs NEW ORLEANS PELICANS,2016-12-22 18:56:04,812084320806600705
[iCHART] 161223 8:30KST Merry Christmas In Advance feat Thunder # 아이유 # IUpic.twitter.com/4t5vNrEq53,2016-12-22 18:55:40,812084221892169728
Gun Shot Buss Like Thunder Little Girl Stares In Wonder,2016-12-22 18:55:30,812084178917457920
Tropic Thunder so funny man lmao,2016-12-22 18:55:27,812084165529272320
"Thunder strike, we are your 18 yard area.",2016-12-22 18:55:15,812084115893850112
IT 'S THE SAME THING BEING ASSAULTED OVER AND OVER AGAIN BY THUNDER BAY POLICE BUT THEY SEE NOTHING WRONG WITH... http://fb.me/17PtCrSQy,2016-12-22 18:55:11,812084097774419968
@ bristerking omg,2016-12-22 18:55:07,812084080263266305
Aaron Finch and Brad Hogg guide Melbourne Renegades to big win over Sydney Thunder http://www.foxsports.com.au/cricket/domestic-cricket/big-bash/big-bash-2016-follow-all-the-action-as-the-renegades-host-the-thunder-at-etihad-stadium/news-story/d3bda18971418ca8f6f41ae002d46063 … via @ skinnergj,2016-12-22 18:54:45,812083988420382720
Déjà Thunder éliminé 1er ou 2eme tour,2016-12-22 18:54:39,812083965767090177
"if he/she doesn't show up, THUNDER GO STRIKE THE PERSON DEAD https://twitter.com/soji_surge/status/812083029170671616 …",2016-12-22 18:54:11,812083846975877120
Big Bash: Renegades’ Brad Hogg rolls back the years to extinguish Thunder’s hopes of victory http://www.foxsports.com.au/cricket/big-bash-renegades-brad-hogg-rolls-back-the-years-to-extinguish-thunders-hopes-of-victory/news-story/dcf5a2500483669d3a5693d1bd449ba0 … via @ skinnergj,2016-12-22 18:54:06,812083827359125505
Ahhh.. HipTv if I say thunder will fire yhu plpp it will b as Someborri is wicked abi.. Wic one is This Stream... http://fb.me/11Ht3P53z,2016-12-22 18:53:58,812083793729384448
"it's really not as bad as it sounds, like Cinnabon mixed with the fountain lmao",2016-12-22 18:53:54,812083776423608320
Big Bash: Evergreen Brad Hogg bamboozles Sydney Thunder on debut for Melbourne Renegades http://www.foxsports.com.au/cricket/domestic-cricket/big-bash/big-bash-evergreen-brad-hogg-bamboozles-sydney-thunder-on-debut-for-melbourne-renegades/news-story/553a7ac45beb919bb965fba27c8aa248 … via @ skinnergj,2016-12-22 18:53:54,812083774573854720
わたしの◯スノートは消しといた,2016-12-22 18:53:52,812083765623144448
SPLIT YOUR LUNGS WITH BLOOD AND THUNDER pic.twitter.com/gstlQQUKXA,2016-12-22 18:53:18,812083622861828097
"""this storm... i wonder how much longer it will continue."" (thunder crashes)",2016-12-22 18:53:06,812083575600267264
Thunder！,2016-12-22 18:52:41,812083468242800641
"# Celtics # BostonCeltics # CelticsTalk Westbrook scores 42, Thunder beat Pelicans 121-110 http://dld.bz/fpqH7",2016-12-22 18:52:26,812083407605956608
Face Like Thunder is pretty awesome :),2016-12-22 18:52:22,812083387661885440
"♪ And if the clouds burst, thunder in your ears you shout and noone seems to hear and if the band you're in... http://fb.me/1Xm401lPu",2016-12-22 18:52:19,812083378870751232
bueno dale !!,2016-12-22 18:52:12,812083347358945281
Game Preview: OKLAHOMA CITY THUNDER VS. BOSTON CELTICS http://newsok.com/game-preview-oklahoma-city-thunder-vs.-boston-celtics/article/5531880 …,2016-12-22 18:52:11,812083341952425988
"Raise your words, not voice. It is rain that grows flowers, not thunder. - Rumi # quote # WhoAreTheJonesesAnyway? # dailyquote",2016-12-22 18:52:04,812083312005103616
ICYMI Thunder player grades from 121-110 win in New Orleans # Thunder # NBAhttp://thunderousintentions.com/2016/12/22/okc-thunder-player-grades-win/ …,2016-12-22 18:52:01,812083299975729152
NOOO AMIGO TE RE ZARPASTE !,2016-12-22 18:51:41,812083216358187008
I liked a @ YouTube video from @ thunders7ruck http://youtu.be/FHdMcjcHS0E?a No Shame In Their Game | Youtube 2016 (COD BO3 BRM Gameplay),2016-12-22 18:51:27,812083159496032256
Thunder only happens when it's raining Players only love you when they're playingg,2016-12-22 18:51:25,812083148678828032
The child of Big Thunder RR and Expedition Everest.,2016-12-22 18:50:15,812082858638487554
Game Preview: OKLAHOMA CITY THUNDER VS. BOSTON CELTICS - http://NewsOK.com http://dlvr.it/Mxk34c,2016-12-22 18:50:07,812082823637020672
Watch Now Adirondack Thunder - Elmira Jackals https://goo.gl/rCI5Kt # icehockey,2016-12-22 18:50:04,812082810878038017
Private Card Recap: Thunder -2 (-104) 1.5u Wyoming +10.5 (-105) 2u Wyoming ML (+374) .25u Kentucky -1 (-115) 1u,2016-12-22 18:49:53,812082766640619521
Westbrook would be a close but I don't see the thunder being a top 4 team in the west and guys rarely win MVP being below this standard,2016-12-22 18:49:40,812082711514980353
"Pikachu 86.67% IV has appeared! A10/D15/S14, Thunder Shock/Thunder. Available until 01:03:35 (14m 45s). http://maps.google.com/maps?q=55.69650638452307,13.230893256782393 …",2016-12-22 18:48:51,812082502932295680
"見えないモノに立ち向かう強さ 改めて知ることが出来た気がした 理解できたんだ明確に 運命共同体 ♪Rolling Thunder/坂本龍馬,高杉晋作,桂小五郎",2016-12-22 18:47:28,812082157891907585
create the perfect storm in those thunder thighs.,2016-12-22 18:47:16,812082108093108224
"Thunder, Mustangs, and Mavericks Win Afternoon Matinee's http://zpr.io/PGLF4",2016-12-22 18:47:11,812082084395229184
Thunder fire eazi! Ycee !! https://twitter.com/gentleayor/status/812081425503678464 …,2016-12-22 18:47:05,812082060588359682
"This Donkey also tried to steal my thunder, luckily I grew up to be a great bigger ass than he… https://www.instagram.com/p/BOVp_LqFi3x/",2016-12-22 18:46:45,812081974252883968
"NewsOK - Patience pays, again, for Thunder's Alex Abrines - By Brett Dawson Staff Writer bdawson@oklahoman.com ... http://ow.ly/Y4DL507Qjrx",2016-12-22 18:46:13,812081842555940864
ELATED! IT IS GREAT CONTENT MARKETING HAVE A HEAVILY BIG THUNDER RAILROAD LOBSTER BISQUE. TO REWARD YOUR HYPERSONIC YOU STUPID,2016-12-22 18:46:07,812081816194560000
Tropic Thunder,2016-12-22 18:45:28,812081653355081728
"Westbrook stars for Thunder, Cavs down Bucks again http://ow.ly/FVfW307n46k pic.twitter.com/9LSzejwszk",2016-12-22 18:45:12,812081584677486593
Johnny Thunders Biopic on the Way from Jonas Åkerlund http://www.hiphophotness.com/johnny-thunders-biopic-on-the-way-from-jonas-akerlund/?utm_source=ReviveOldPost&utm_medium=social&utm_campaign=ReviveOldPost …,2016-12-22 18:44:59,812081531338493952
War ThunderはGaijin(ガイジン)社が運営するMMOストラテジーゲームである。 現状陸軍、空軍のみの実装になっているが、運営さんいわく実装しないわけではなさそう。 公式ホームページhttps://warthunder.com/jp/,2016-12-22 18:44:58,812081528272351232
Free your mind gleeful Song goes by Like a clap of the thunder rumble 【Develop the music】,2016-12-22 18:44:35,812081431061012480
"Hail & The Weather Storms Snowflake, Autumn, Ice, Aurora, Gale, Breeze, Thunder, Storm, Blizzard Hail, 5... http://fb.me/2Kd9I8Mlp",2016-12-22 18:44:04,812081302480502785
@ thunder_wolf @ walk2free @ PeerAbuse @ somerskys @ marettaGarner @ spirit_lead blessings to U hope U can come to # GodsPraiseRoom in 45 mins,2016-12-22 18:44:01,812081286462509056
War_Thunder_in_the_Nutshell.mp4: http://youtu.be/Le44nsAMvcE?a przez @ YouTube,2016-12-22 18:43:48,812081234809647105
Thunder https://twitter.com/remixgomez/status/811011257847480321 …,2016-12-22 18:43:44,812081218686578688
Jackals hit the ice for warmups. Jackals and Thunder underway at 7:05. # JackalsHockeypic.twitter.com/MS1K6K5HXK,2016-12-22 18:43:27,812081146846650368
しっかりと、振り切ってからゴール！,2016-12-22 18:43:22,812081124729982977
Melbourne Renegades vs Sydney Thunder Highlights http://www.sportsworld365.com/2016/12/melbourne-renegades-vs-sydney-thunder-highlights-big-bash-league-cricket-highlights.html …,2016-12-22 18:43:15,812081094539546624
The thunder that will fire this # headies2016 is doing mannequin challenge I for just sleep my thing,2016-12-22 18:43:01,812081037899661313
買いましょうー！,2016-12-22 18:42:43,812080961424793600
The Thunder! https://twitter.com/kingucheodoh/status/812080009418604544 …,2016-12-22 18:42:27,812080893657579520
"Patience pays, again, for Thunder's Alex Abrines http://www.chatsports.com/oklahoma-city-thunder/a/source/patience-pays-again-for-thunders-alex-abrines-13103933 … via @ chatsports # ThunderUp",2016-12-22 18:42:01,812080785511612416
"They blew the infamous 3-1 lead. W/ that, they're in such company as Thunder, Warriors. They almost slaughtered the Rockets",2016-12-22 18:41:35,812080677839585280
I shoulda played for the Thunder,2016-12-22 18:41:27,812080641630158848
"Мне понравилось видео ""WAR THUNDER - СДЕЛАНО В ЯПОНИИ! - ВЕЧЕРНИЙ СТРИМ!""",2016-12-22 18:40:54,812080505734762497
Я смотрела насквозь и мне не было больно. Почти... *Like Thunder pic.twitter.com/89bB3Zwsp6,2016-12-22 18:40:53,812080499074224129
"Pikachu 86.67% IV has appeared! A13/D15/S11, Thunder Shock/Discharge. Available until 01:06:59 (26m 15s). http://maps.google.com/maps?q=55.718492107682124,13.236681457481787 …",2016-12-22 18:40:45,812080464240476160
"• if you ride the lightning, you're gonna crash like thunder • # ridethelightning # metallica… https://www.instagram.com/p/BOVpOjtBgxP/",2016-12-22 18:40:06,812080300813479936
Wolves/Thunder in prime time is an embarrassment,2016-12-22 18:40:04,812080294886916097
"Member of Raijinshu (Thunder God Tribe) : Me, Laxus Dreyar, Bickslow, and Evergreen # ÉcritureBot",2016-12-22 18:40:03,812080291216965633
Make it rain call me thunder man,2016-12-22 18:39:57,812080266306940928
"""Thunder in the Morning Calm"" http://amzn.to/2biYSG9 # ACFW http://bit.ly/CLCIFB pic.twitter.com/kf0NrpgL8p",2016-12-22 18:39:52,812080244303630336
"Man, I wish I lived near this place. That Yakuza/Rolling Thunder double feature would be amazing. https://twitter.com/newbeverly/status/812062842794840065 …",2016-12-22 18:39:45,812080215400681472
Hanging out with the Thunder and the little at the BBBS Christmas Party # bbbsokc # bbbsoklahoma… https://www.instagram.com/p/BOVpKuJj5uq/,2016-12-22 18:39:34,812080167766130688
CONSTIPATION NAUSEOUS PEE-NUTS GANG DUMMY THUNDER MEASURED MAKING FRIENDS A BANANA CURSORY PICKING IT BACK UP GO SOMEPLACE YOU'VE PLAYPEN,2016-12-22 18:39:25,812080130797355008
Trying to decide what pose I'm gonna do for christmas photos this year and I'm thinking of going with Jupiter's Supreme Thunder pose.,2016-12-22 18:39:21,812080114477371392
Thursday Thunder cardio drumming. # holiday # exercise # fitness # cardio # drumming # mindset # legs… https://www.instagram.com/p/BOVpHZtD0wm/,2016-12-22 18:39:06,812080052179533824
AC/DC Thunder please! # senssong,2016-12-22 18:38:48,812079977009188864
thunder only happens when it's raining,2016-12-22 18:38:33,812079911146033152
that's a lie: the thunder dragon is probably the easiest it just involves soooo much travel and the water dragon happens all in one spot,2016-12-22 18:37:53,812079744816549888
I liked a @ YouTube video from @ thunders7ruck http://youtu.be/FHdMcjcHS0E?a No Shame In Their Game | Youtube 2016 (COD BO3 BRM Gameplay),2016-12-22 18:37:47,812079720456192006
Enjoying the weather at Thunder Alley at the @ TBLightning game! # HondaFanSalute # Tampa # WTSPpic.twitter.com/HBpYiTvB83,2016-12-22 18:37:43,812079701434974208
Rob Zombie - Thunder kiss '65 http://rdo.to/EDGE # TakeControl,2016-12-22 18:37:42,812079699295928320
グッジョブ乁( ˙ω˙ 乁)ｳｪｰｲ 心外３を取り消す,2016-12-22 18:37:30,812079648280494080
haha bruh did you see the thunder cats one,2016-12-22 18:37:18,812079599295135744
Just arrived n Thunder Bay stopped @ Walmart to buy nephew $ TOY.TO products for Xmas. Its true they dont take VISA # Hilarious Only n Country?pic.twitter.com/A0PyHdQOWX,2016-12-22 18:37:00,812079523831365632
"War Thunder is so fucking immature, can't handle being around an ex and not flip shit when the talk shit about me lol",2016-12-22 18:36:56,812079503790862337
"@peregrines2016 https://www.youtube.com/watch?v=UObcNlm0Nuc … ... was awake, actually heard lots of loud metallic clicks/pings/scrapes no thunder though",2016-12-22 18:36:34,812079413521223680
カトちゃん,2016-12-22 18:36:20,812079355618725888
This nigga really tried to rob me when I was walking home and caught the hands of Thunder lmfao,2016-12-22 18:36:14,812079329198870528
At least they have local beerskis! This is my favorite Lake Tribe - Drinking a Tropic Thunder @Beef O'Brady's - http://untp.beer/s/c396658365,2016-12-22 18:36:05,812079292112928768
I liked a @ YouTube video http://youtu.be/3KZ3xstslwk?a WESTBROOK TAKES AD TO IN-N-OUT! OKLAHOMA CITY THUNDER vs NEW ORLEANS PELICANS,2016-12-22 18:35:46,812079212366589952
Haha shit slides. But Jamaican thunder cats is better https://twitter.com/muminuh/status/810828130034339841 …,2016-12-22 18:33:58,812078759683575808
RT @ sportstoons: Muy bueno game for @ alexabrines # thunderpelicans # thunder pic.twitter.com/4x6bTK3IsF,2016-12-22 18:33:55,812078745397952512
"However, her thunder attacks can be used in a sombrero, the lanky one, and then the beardy one.",2016-12-22 18:33:54,812078741480411161
Looks like I might be on pace to match/surpass November's total views on Ray Thunder. 64 is the number needed to match; 65 to surpass.,2016-12-22 18:33:51,812078730835271681
Ta-Se AB Ps4 - War Thunder - Episode 29 - AA Derping: http://youtu.be/0HU28vXBLjc?a via @ YouTube,2016-12-22 18:33:31,812078647762948096
War Thunder | Type 60 SPRG на хешах и комулях: http://youtu.be/WWYGNNSfBRk?a на @ YouTube,2016-12-22 18:33:25,812078618813861888
"Видео ""War Thunder I flew like that in Tahiti,overview,video,gameplay,games,(KiborG GameS)"" (http://youtu.be/l1vutW7i_Hg?a ) на",2016-12-22 18:33:04,812078532201512965
"Видео ""War Thunder a test flight of the,overview,video,gameplay,games,(KiborG GameS)"" (http://youtu.be/SnX_F6-kwwo?a ) на @ YouTube",2016-12-22 18:33:04,812078532201480192
"Видео ""War Thunder,overview,video,gameplay,games,(KiborG GameS)"" (http://youtu.be/8Ik-r6OGHiM?a ) на @ YouTube добавлено в",2016-12-22 18:33:02,812078523427024897
Warmups are a go in Elmira as Andy Iles leads the Jackals to the ice. He'll face Mason McDonald & the Thunder. Pregame at 6:50 on 1410 WELM pic.twitter.com/g66zLSdD2J,2016-12-22 18:32:58,812078509065695232
Thank you Chuck! RT @ Minerjo: Just heard thunder. Zaragoza/ rich beem area. RT @ NWSElPaso: 346pm (cont) http://tl.gd/nn9g3e,2016-12-22 18:32:54,812078491390779392
I liked a @ YouTube video http://youtu.be/zEKOxO9Gn7E?a War Thunder: The Shooting Range | Episode 24,2016-12-22 18:32:04,812078281369460736
Killer Instinct Reimagining Thunder https://youtu.be/GTg3y6czI44 via @ YouTube,2016-12-22 18:31:43,812078191506497536
"Jolteon (91.11%-12/14/15,Thunder Shock/Thunder) Until 16:01:25 (29m 43s) http://maps.google.com/maps?q=33.91823078690031,-117.99715346107138 …",2016-12-22 18:31:41,812078184871116801
そうだよ(そうだよ) だからマーリン持ってるのに今寝ちゃってる人はほんと勿体無いね！バルバトスくん死んじゃう><><><,2016-12-22 18:31:09,812078048744853504
Valentine's Day always steals my thunder so it can die,2016-12-22 18:30:57,812078001924042752
Get social with Thunder 102 on @ facebook @ instagram @ YouTube @ Snapchat # RadioBOLDpic.twitter.com/kbBwUYvhtb,2016-12-22 18:30:26,812077868918407168
War Thunder - Flyin' Dirty! World of Tanks http://youtu.be/zzBIsptv-og,2016-12-22 18:30:07,812077788098269186
Thunder dash way through snow and traffic tie-ups http://buff.ly/2ihuCOY,2016-12-22 18:29:57,812077747904409601
YAAASS! NOTICIÓN: Thunder Bitch reparte botellas ¡Participa! http://p.dry.lt/l7imIWPOE6TZ,2016-12-22 18:29:33,812077647220142081
"Just make yourself right at home there, Thunder! # rescue # dog # dogs # dogsofinstagram # dogsofig… https://www.instagram.com/p/BOVoA7jBWmg/",2016-12-22 18:29:29,812077632372109312
Villager il a pocket mon coeur comme il pocket mes Pk Thunder,2016-12-22 18:27:59,812077251604975617
"Jolteon Available until 05:16:27 (19m 6s). http://maps.google.com/maps?q=28.459985003011596,77.08131402116992 … Moves: Thunder Shock / Thunderbolt **IVs:** 40.00% (15/2/1)",2016-12-22 18:27:24,812077104439377920
心臓と羽車とページ、スキル上げで全部マーリンが食べる そして今はマーリンピックアップ中 いいね？,2016-12-22 18:26:53,812076976374587392
•¿Que haces thunder? -Aca pujando y vos • pic.twitter.com/1hEVAbeVBc,2016-12-22 18:26:35,812076901170839552
Lady JV Thunder defeat Carleton North Lady JV Stars 95-39 in Bristol. Big girls play next. @ lily_2002_12,2016-12-22 18:26:26,812076864412020736
"Raichu till 03:43:25pm (16m 59s) IV:75.56% A:7 D:15 S:12 M1:Thunder Shock M2:Brick Break http://maps.google.com/maps?q=37.269462651933544,-121.85790665732414 …",2016-12-22 18:26:24,812076853766651904
"Pikachu (88.89%-13/12/15,Thunder Shock/Discharge) Until 15:56:17 (29m 54s) http://maps.google.com/maps?q=33.941730486428916,-117.99495746483127 …",2016-12-22 18:26:23,812076848884502528
"Electabuzz available until 18:53:23 (27m 23s). Thunder Shock/Thunder Punch (35.56% - 10/4/2) http://maps.google.com/maps?q=36.965954940703064,-76.28895691944223 …",2016-12-22 18:26:00,812076753946558464
OKC VS TULSA BEEF ! BEEF AND THUNDER Movie Trailer 4 - Official Site : HOOD BOX OFFICE https://goo.gl/Kw6noA,2016-12-22 18:25:33,812076640641622018
Thunder,2016-12-22 18:25:19,812076580805562368
@ NicoleBlades ordered my copy of The Thunder Beneath Us today!,2016-12-22 18:24:42,812076425624821760
There is no reason the thunder should be winning right now,2016-12-22 18:24:06,812076273904287748
Thunder Bay police officer back at work while investigation continues into Facebook comm... http://upflow.co/l/eTKP pic.twitter.com/dUj2KOgCxW,2016-12-22 18:23:55,812076229205622784
YA MC with a 5 star rating. Good girl meets bad boy. Nowhere but Here (Thunder Road) by Katie McGarry for $1.99 http://amzn.to/2hhT8Q3 pic.twitter.com/LTcDx5xxzJ,2016-12-22 18:23:29,812076122582188033
So sick of these thunder thighs of mine wearing my jeans out making them rip,2016-12-22 18:23:02,812076005850542080
"that or ""thunder-snow""--tough to say",2016-12-22 18:22:58,812075989903802368
"I'm gna ma forget about this student portal and go sleep to this lovely thunder, lighting and rain rather",2016-12-22 18:22:40,812075915501064196
Heading to Walmart with the girls when sudden thunder storm,2016-12-22 18:22:35,812075893833289728
"@ sweettemmy Pls direct me to the battlefield, I will join you there. Thunder fire any 2Baba haters!",2016-12-22 18:22:09,812075786001907712
# 80sMetal # NP: Saxon - Heavy Metal Thunder (80) LISTEN NOW http://www.radionomy.com/metalshop,2016-12-22 18:22:01,812075751277293573
The vanilla Dino Thunder megazord is so sick.,2016-12-22 18:21:49,812075700417077249
http://ift.tt/2hNeAM1 Nike Air Jordan Retro 4 Thunder size 10.5 pic.twitter.com/ecSf4dAeXS,2016-12-22 18:21:48,812075698454233088
"I think, u shouldn't use thunder to fire any one, people are different, https://twitter.com/mhagayr/status/812072813934903296 …",2016-12-22 18:21:47,812075694318567424
かわいそうな孔明先生,2016-12-22 18:21:33,812075633467531264
"「ら」・・・Thunder and dry winds, a deep sense of civic duty and humanity, characterize Gunma. 【Jomo Karuta English Version】",2016-12-22 18:21:27,812075610939920384
Thunder fire voting. https://twitter.com/MrSangotoki/status/812074622506139648 …,2016-12-22 18:20:43,812075422578081792
Argento all-nighter! Rolling Thunder! The Searchers! And way more awesomeness. @ newbeverly knows the way to my hearthttps://twitter.com/newbeverly/status/812062842794840065 …,2016-12-22 18:20:35,812075391951241216
Westbrook’s 42 points pace Thunder http://bit.ly/2hhLVzo,2016-12-22 18:20:00,812075243833585664
"The real Pokémon Theme with kandie.16. @Thunder Bay, Ontario https://www.instagram.com/p/BOVm5AIBa8_/",2016-12-22 18:19:58,812075237210660864
https://ghoulpowder.bandcamp.com/track/battle-with-a-legend-boss-theme … do u like Thunder Force soundtracks... maybe you should check out the joylancer ost,2016-12-22 18:19:52,812075212728451072
But he would look great in Thunder green and lightning yellow!! Go Ducks,2016-12-22 18:19:23,812075087004217344
-- heavy rain drops began to fall from the vortex while lightning could be seen and thunder could be heard; almost--,2016-12-22 18:19:19,812075071657410560
oh man cheers. You're a true wizard,2016-12-22 18:19:06,812075016376451072
It's raining money Oklahoma City Thunder,2016-12-22 18:18:41,812074914438119424
"black and white, he's stealin your thunder",2016-12-22 18:18:14,812074801430827009
"Wangsa Maju - Electabuzz (IV: 42.22%, Low Kick / Thunder Punch) has appeared! Time 07:47:42 (29m 34s). http://maps.google.com/maps?q=3.2009863188983156,101.73463223914175 …",2016-12-22 18:18:13,812074797341388800
remember when you were a thunder fan then started rooting for the warriors this yr?,2016-12-22 18:17:47,812074687496933376
"""Kobra took Cap's advice then interrogation of the Thunder Bolt started and he tries to deny his Villain partners""",2016-12-22 18:17:32,812074621352734724
"Check out ""Thunder"" on # Smule: http://www.smule.com/p/433308104_876247991 … @ leonalewis # SingKaraoke",2016-12-22 18:17:31,812074617934385152
"I'll bet your sister wouldn't let you do this: @Thunder Bay, Ontario https://www.instagram.com/p/BOVmnu7hSXv/",2016-12-22 18:17:24,812074589710712832
Sydney Thunder back out-of-form Big Bash League star Andre Russell http://trib.al/a8cHoFd,2016-12-22 18:17:03,812074503366963200
am watching # Deadies 2016 instead of # headies with my hard end money thunder must fire some people ooo..,2016-12-22 18:15:59,812074234700763136
Dino Thunder was sort of like the movie's setup.,2016-12-22 18:15:49,812074190216069124
心外さが伝わったらいいが,2016-12-22 18:15:47,812074183668604929
Oklahoma City Thunder - SLOB Double Ballscreen Fade - http://ow.ly/4n8puj by @ CoachGregUC # XsOs # NBAXsOspic.twitter.com/AMyimGogDq,2016-12-22 18:15:27,812074100919271424
[News] Neverwinter's Storm King’s Thunder Launch Date for Consoles - Read more @http://mmoc.io/2hNhQqL @ NeverwinterGame # MMOpic.twitter.com/0v2I54pHVP,2016-12-22 18:15:00,812073986012028928
"Raichu till 03:44:32pm (29m 42s) IV:88.89% A:14 D:14 S:12 M1:Thunder Shock M2:Thunder http://maps.google.com/maps?q=37.2921829399835,-121.88352167529273 …",2016-12-22 18:14:58,812073977002663942
(;´༎ຶД༎ຶ`)心外だ,2016-12-22 18:14:55,812073964088344576
"Tão lindinho o thunder em fansing agora,lembro dos mblaq",2016-12-22 18:14:53,812073957486718976
=͟͟͞͞ ( ꒪౪꒪)ฅ 心外だ,2016-12-22 18:14:12,812073786337964032
"kandie.16's not impressed. @Thunder Bay, Ontario https://www.instagram.com/p/BOVmOxRBpZz/",2016-12-22 18:14:10,812073777378914304
(´༎ຶོρ༎ຶོ`)心外だ,2016-12-22 18:13:48,812073681883045892
Sadly Lenny change means even less reason to try out mah. Brewmaster change only impacts ten thunders. Lots of changes made sense though.,2016-12-22 18:13:31,812073612291244032
BBL: Renegades down Thunder by 48 runs http://thenewdaily.com.au/sport/cricket/big-bash/2016/12/23/bbl-renegades-thunder/ … via @ skinnergj,2016-12-22 18:13:26,812073590497476608
