text,date,id
"Coming soon: M.O.T.O., Thunder Vest, Torn Apart Hearts, Mystic See @ ThunderVest # punk # rock Adv tix athttps://embed.showclix.com/event/moto-thunder-vest-torn-apart-hearts-mystic-see …",2017-02-24 16:30:30,835240509467688962
Agregué un video a una lista de reproducción de @ YouTube http://youtu.be/g8uYGC5wy8k?a [MV] Thunder(천둥) _ Sign (Feat. KOO HA,2017-02-24 16:30:25,835240489381216256
Thunder Game Day #58: vs. Los Angeles Lakers http://thunderdigest.com/2017/02/24/thunder-game-day-58-vs-los-angeles-lakers/ …pic.twitter.com/8vkbyh7Gn5,2017-02-24 16:30:24,835240485853794307
Thunder Fans Very Excited By Arrival of Actual NBA Players Taj Gibson and Doug McDermott http://wp.me/p3LRnW-2mEk,2017-02-24 16:30:17,835240455801614341
Thunder Game Day #58: vs. Los Angeles Lakers http://thunderdigest.com/2017/02/24/thunder-game-day-58-vs-los-angeles-lakers/ …pic.twitter.com/BXySS5V5E8,2017-02-24 16:30:14,835240444401418240
Who won a # NBATradeDeadline # TradeDeadline # DeadlineDay # TradeDeal b/t # okcthunder/ # Bulls- # TajGibson & # DougMcDermott? # Thunder # NBA,2017-02-24 16:30:09,835240424939847685
4:30 PM Temp: 72 overcast - thunder in the vicinity; light rain; mist; Lightning observed http://goo.gl/rBuo4M # fbpic.twitter.com/nX5DB9yVMs,2017-02-24 16:30:09,835240424671436800
あずにゃん以外興味ない,2017-02-24 16:30:06,835240411421536256
"South Bend 16:30; overcast - thunder in the vicinity; Lightning observed; 62F, 86% hum, wind 3.7 mph SW gust to 10.0 mph",2017-02-24 16:30:00,835240383831486464
THUNDER # CMLL TRIBUTE # Luchahttps://youtu.be/jdgI_PR6gmM,2017-02-24 16:29:55,835240363971473409
なにこれ,2017-02-24 16:29:41,835240303653076992
ahhhh i hate thunder,2017-02-24 16:29:27,835240245977366531
The speed of OKC's off-brand Thunder t-shirt market is something to behold.,2017-02-24 16:29:24,835240234698833921
pic.twitter.com/C9qMkGtjl5,2017-02-24 16:29:22,835240227753033728
I'm such a pluviophile. # rain # lightning # thunder # petrichor https://www.instagram.com/p/BQ6NI1XjMJk5ebR3TJpvCQymwmDixuhRlswjc40/ …,2017-02-24 16:29:20,835240216180981763
Whoever stole my bag of chips last night is a thunder cunt & I hope you choke on one,2017-02-24 16:29:02,835240140729643009
i don't mess with thunder and lightening,2017-02-24 16:29:01,835240139781726208
Thunder game tonight,2017-02-24 16:29:00,835240133410631681
"Clint ""Red Thunder"" Frazier has a little Jeff Bagwell in his swing. http://m.mlb.com/nyy/video/topic/26650342/v1225428883/phinyy-frazier-drives-in-a-pair-on-triple-to-right/?c_id=nyy …",2017-02-24 16:28:52,835240099969380352
Je rêve d'alaskan thunder fuck ou bien encore d'isla og,2017-02-24 16:28:47,835240077001392129
didn't even know the thunder at album dropped today good looking out,2017-02-24 16:28:37,835240038388621313
We are having a Thunder Storm in Detroit. This is wrong. If fruit trees bud more and we get a hard freeze for a week...bad news.,2017-02-24 16:28:30,835240007753420801
"[Cary Oaks] 69% Jolteon (15/12/4, Volt Switch/Thunder) 'til 04:57:41pm (29m 22s). http://maps.google.com/maps?q=35.69003772959991,-78.78131203671452 …",2017-02-24 16:28:19,835239961565745152
全然違う まず顔が違う あずにゃんはもっと幼い 目の色も違う あとツインテールの長さ前髪の形が違う 髪の毛に鈴ついてないし。 作者がかきふらい先生じゃない。,2017-02-24 16:28:17,835239953470644224
The absolute irony of my crippling fear of thunder and lightning but my want to go storm chasing,2017-02-24 16:28:12,835239933912760321
WAR THUNDER | LA ESTRATEGIA ALEMANA | GUÍA DE DESBLOQUEO AVIONES: http://youtu.be/2fcOoFnrdZQ?a vía @ YouTube,2017-02-24 16:28:09,835239919119368197
whats going on in his head? some straight thunder i say,2017-02-24 16:28:05,835239902652424193
Villager il a pocket mon coeur comme il pocket mes Pk Thunder,2017-02-24 16:28:03,835239893051768832
I like the Thunder getting Taj Gibson,2017-02-24 16:27:54,835239857429499904
I've just unlocked Thunder in Heaven achievement in Paradise Island 2! http://tinyurl.com/q3qf2ej # ParadiseIsland2 # GameInsight,2017-02-24 16:27:48,835239833215844353
"Ride like lightning , crash like thunder",2017-02-24 16:27:45,835239820259655680
Tonight a combination of snow and freezing rain will keep roads icy in the U.P. And in the Lower rain and thunder will be an issue.,2017-02-24 16:27:30,835239757529645056
02-24 OKC Thunder: Trade deadline did not budge NBA's hierarchy # NBATradeDeadline https://goo.gl/fb/zNo3ZT # nbatradedeadline,2017-02-24 16:27:30,835239757022179334
Me ha gustado un vídeo de @ YouTube de @ phlydaily (http://youtu.be/QJg1H9ByFIA?a - FLAK 88 VS HUGE B-17 BOMBER FORMATION (War Thunder Epic,2017-02-24 16:27:30,835239754367188997
"Mareep (82.2%) Thunder Shock/Body Slam 10/12/15 (ATK/DEF/STA) Despawns at 13:56:48 https://maps.google.com/maps?saddr=My+Location&daddr=34.18117808237027,-118.52010551196462 …",2017-02-24 16:27:16,835239699031674887
"HECK YES, creator of the rad Ray Thunder mention! Thank you so much for the shout-out, mega respect to you and the others here!",2017-02-24 16:27:05,835239651254362112
"Mareep 73.3% (10/8/15) Thunder Shock/Discharge Until: 03:50:22pm (23m 36s) http://maps.google.com/maps?q=38.92159555583895,-95.2659542715659 …",2017-02-24 16:26:42,835239553573191680
Seth MacFarlane And Mark Wahlberg Sing The Thunder Buddy Song - The Grah... https://youtu.be/4HeLLiJ5CAE via @ YouTube,2017-02-24 16:26:25,835239485319352321
"Mareep until 05:21:08pm (54m 51s). 73.3% (4/15/14 A/D/S), Thunder Shock / Discharge. 1.3km S of downtown. http://maps.google.com/maps?q=42.26906781161021,-83.74734566393396 …",2017-02-24 16:26:16,835239447121833984
Now playing: THUNDER / BETTER MAN,2017-02-24 16:26:15,835239440972922882
The Thunders's Warrior,2017-02-24 16:26:04,835239393556316161
# sausageporn sizzlin and cracklin!! Thunder outside but fireworks on the skillet!! # pork… https://www.instagram.com/p/BQ6MwkQgbZC/,2017-02-24 16:26:01,835239382659518465
i got chick fil a and it's thunder storming ??? today is my day,2017-02-24 16:25:53,835239348551434246
Me ha gustado un vídeo de @ YouTube de @ phlydaily (http://youtu.be/fM6Nk-xypYI?a - NEW KV-2 1940 - AKA MAUS TANK KILLER (War Thunder Tanks,2017-02-24 16:25:45,835239315684929536
I slept through the rain and the thunder it was so soothing,2017-02-24 16:25:40,835239296693067776
I've just unlocked Thunder in Heaven achievement in Paradise Island 2! http://tinyurl.com/q3qf2ej # GameInsight # ParadiseIsland2,2017-02-24 16:25:35,835239274773688320
Her head was thunder ugh !,2017-02-24 16:25:25,835239230540562432
I got some maaaaddd thunder thighs bruh,2017-02-24 16:25:06,835239151360425984
"4:24 Feb,24. I""ve herd at 4:30 a thunder storm would hit. Umm where you at thunder storm. It just stop raining. Was this a joke?",2017-02-24 16:24:48,835239077553270784
"There was some rain, not much wind, some thunder/lightning, worst of it stayed on the Detroit Metro side.",2017-02-24 16:24:41,835239049057210368
は？ブロック,2017-02-24 16:24:38,835239035710791680
"""Severe thunder storm warning"" Idk what drugs MI is on but I'm pretty sure it's winter not summer",2017-02-24 16:24:12,835238923790127104
気分でやるわ笑笑,2017-02-24 16:24:07,835238904353546240
"not saying that at all but usually when series go to 7 games the teams are pretty even, and the thunder played fantastic",2017-02-24 16:24:04,835238891233898496
IF I COULD FLY ON VINYL PLUS THUNDER AMD RAIN IN THE BACKGROUND. IM EMOTIONAL,2017-02-24 16:24:00,835238874804809730
I've just unlocked Thunder in Heaven achievement in Paradise Island 2! http://tinyurl.com/q3qf2ej # ParadiseIsland2 # GameInsight,2017-02-24 16:23:57,835238861919948804
don't ferget tropic thunder,2017-02-24 16:23:52,835238841984299008
not my thunder baby anymore https://twitter.com/mike_stunson/status/835238546407571460 …,2017-02-24 16:23:20,835238705946378241
@ RealMichaelKay # Knicks fans should blame Thunder for Phil. If they didn't leave Seattle he would have been their President.,2017-02-24 16:22:59,835238619237474306
Thought that sound was thunder! https://twitter.com/WTL/status/835194119853125632 …,2017-02-24 16:22:53,835238595107651584
"lol that would be an unworthy offense, but I trust Aaron he has been bringing the Thunder",2017-02-24 16:22:52,835238592028925953
Ballymacash blood and thunder night.,2017-02-24 16:22:26,835238480049504256
I hear thunder,2017-02-24 16:22:16,835238437447946240
this thunder has got to stop today is not the day,2017-02-24 16:22:15,835238435237552130
"Thunder snow and lightning caught on camera in Grand Chute, Wisconsin: http://ift.tt/2mm1EMD",2017-02-24 16:22:15,835238433912205312
"Get Here! |Mareep!|(55.6%)|(14/4/7) Thunder Shock/Body Slam til:(04:52:01pm)|(29m 47s) # SodaCityRareshttp://maps.google.com/maps?q=33.984559169579825,-81.01831157558279 …",2017-02-24 16:22:13,835238427431960576
Lady Thunder take the win 5-2 series tied 1-1,2017-02-24 16:22:06,835238398034079746
"I hear thunder, pitter-patter.",2017-02-24 16:21:53,835238343491321857
"Ever since the tornado, my entire family comes downstairs when they hear even the slightest rumble of thunder.",2017-02-24 16:21:46,835238311698518016
あんないい奴がなんで なあ神様教えてなんで いつもと変わらないone day 出来るわけないまだ受け入れるなんて THUNDER / REGAL 親友へ,2017-02-24 16:21:43,835238298758983680
"# GoLakers # LakerNation # Lakers Lakers vs. Thunder Game Preview: Finally, basketball is BACK ... in Oklahoma http://dld.bz/f23YS",2017-02-24 16:21:40,835238288554397697
Thunder by Boys Like Girls still puts me in my feelings,2017-02-24 16:21:38,835238279964475392
Let's try another double/treble since last one paid 10X the stakes: Panthers -1.5 goals @ 2.85 OKC Thunder -17.5p @ 3.50 Denver -17.5p @ 3.50,2017-02-24 16:21:36,835238271454162944
was that the same cow?,2017-02-24 16:21:28,835238239409680384
"RIDE LIKE LIGHTNING, CRASH LIKE THUNDER",2017-02-24 16:21:18,835238196506062848
Yikes! Bad thunder storms in February?! Sirens have been going off too!,2017-02-24 16:21:17,835238191275868160
The thunder is amazing sounding!,2017-02-24 16:21:13,835238175924715522
Lakers @Thunder tonight in LA. # lakers # thunder # nba # basketball @Chesapeake Energy Arena https://www.instagram.com/p/BQ6MNOqg6cx/,2017-02-24 16:21:12,835238168773414919
Controlla le trasmissioni dalla mia PlayStation 4! # PS4live (War Thunder) live at https://youtu.be/JY8k6uYGfHY,2017-02-24 16:21:07,835238151341879297
Life comes full circle for the Bulls/Thunder. Bulls initially drafted Taj Gibson with the pick they got from OKC for Thabo Sefolosha.,2017-02-24 16:21:07,835238148695216128
Découvrez Twilight Of The Thunder God par Amon Amarth sur # deezer http://www.deezer.com/track/70876820?utm_source=twitter&utm_content=track-70876820&utm_term=17571407_1487971226&utm_medium=tweet …,2017-02-24 16:20:32,835238003278766081
"Guess what? We got tickets to Emit Cahill of Celtic Thunder for March 4th (next Saturday ). Cindy Robins, wish u... http://fb.me/7ySbfi8Rc",2017-02-24 16:20:23,835237963806175232
"# WeLoveLA # Lakers INTEGRIS Game Day Report: Thunder vs. Los Angeles Lakers – Feb. 24, 2017 http://srhlink.com/NT0ZXB # SportsRoadhouse",2017-02-24 16:20:13,835237922760605696
February and thunder storming. I'm so confused with life.,2017-02-24 16:20:06,835237891911598080
"Storms developing across Mid-Michigan are producing frequent lightning, including in Mt. Morris township. ""When thunder roars, go indoors."" https://twitter.com/NBC_25/status/835237258512986113 …",2017-02-24 16:20:04,835237887201378304
"This is where I found my dog # Kazper today, he's not a fan of rain or thunder. pic.twitter.com/88f5Tfojcw",2017-02-24 16:19:58,835237860399808514
I hear thunder,2017-02-24 16:19:57,835237857824485381
SO MUCH THUNDER,2017-02-24 16:19:31,835237748931964928
It's all go here at Base Ohakea with the air displays kicking off with the Kiwi Thunder # NZAirTattoopic.twitter.com/B08o92uS5z,2017-02-24 16:19:31,835237745840697344
This thunder reminds me of summer,2017-02-24 16:19:28,835237734260346880
Kiwi Thunder break # NZAirTattoohttps://flic.kr/p/R8PpiE,2017-02-24 16:19:17,835237687539957760
It's warm and snow is coming so poof.... Thunder,2017-02-24 16:19:15,835237681307271168
Here comes the thunder,2017-02-24 16:19:02,835237624436645888
I love thunder storms so much,2017-02-24 16:18:30,835237492924231680
"good good good week for new music. Thunder kitty and king gizzard review coming soon, Animal… https://www.instagram.com/p/BQ6L5CWjv93/",2017-02-24 16:18:26,835237474859376642
"Raise your words, not your voice. It is rain that grows flowers, not thunder. # sad # poetry # quotes",2017-02-24 16:18:14,835237425270165506
whaaat? Oh dear! That's intense! Also when the thunder comes as the bolt does because it's so near.,2017-02-24 16:18:13,835237417967828993
Make it rain! Call me thunder man,2017-02-24 16:18:12,835237414100697088
"Gostei de um vídeo do @ YouTube http://youtu.be/4hizzKn0RAw?a Thunder Show: Too much, too little",2017-02-24 16:18:11,835237409898004480
"Partidos de Warriors en marzo en @ nbaplus: 2 vs Bulls,5 vs Knicks,6 vs Hawks,10 vs Wolves,11 vs Spurs,14 vs 76ers,20 vs Thunder,29 vs Spurs. pic.twitter.com/0LLMBmRLhk",2017-02-24 16:17:54,835237340759089152
...herh. ..Their thunder is still gymin. .lol https://twitter.com/Mr_JuicyJuice/status/835233664195837952 …,2017-02-24 16:17:54,835237339467235328
In Oklahoma City for the # Lakers v # Thunder game tonight. In # OKC they love Russpic.twitter.com/YeXnDnShY7,2017-02-24 16:17:41,835237286094729218
Pakistan Still Eying JF-17 Thunder Fighter Sale to Sri Lanka http://srilankaoneislandtwonations.tumblr.com/post/157651815721/pakistan-still-eying-jf-17-thunder-fighter-sale-to …pic.twitter.com/0yp4xdnxKT,2017-02-24 16:17:37,835237266826084353
Anyone else hear thunder just now? http://nbc25news.com/weather # LiveOn25 # miwx,2017-02-24 16:17:35,835237258512986113
Thunder that shakes my house is the kind that terrifies me,2017-02-24 16:17:33,835237253895098374
Love thunder storms,2017-02-24 16:17:22,835237204742000643
PARLAY NBA:RunLine-Toronto Raptors RunLine-Washington Wizards RunLine-San Antonio Spurs RunLine- Oklahoma City Thunder Suerte... pic.twitter.com/Xob2EfLSpH,2017-02-24 16:17:22,835237204536475649
"Uriel checking out her thunder bum in d mirror Ese's body tho,how old is she again? 23? No way !!!! # BBNAIJA",2017-02-24 16:17:16,835237182398939136
oooooops.. sorry to steal your kittie thunder.. it's a sweet one,2017-02-24 16:17:16,835237178737324033
I don't know about y'all But I be sleeping good asf When it Rains/Thunder,2017-02-24 16:17:14,835237173045694466
Discordant Fleeting Happiness Thunder booms And ripples A split second Of light I find my way One falling footstep At a time # FP # vsp,2017-02-24 16:17:05,835237136567840769
1)Major League 2)Youngblood 3) Days of Thunder 4) For the Love of The Game 5) The Program,2017-02-24 16:16:58,835237104233955328
I've just unlocked Thunder in Heaven achievement in Paradise Island 2! http://tinyurl.com/q3qf2ej # ParadiseIsland2 # GameInsight,2017-02-24 16:16:57,835237101646069760
i need a thunder buddy,2017-02-24 16:16:57,835237099896979460
There will be THUNDER! THUNDER! THUNDER! ALL NIGHT LOOONGGG!!!,2017-02-24 16:16:55,835237092892368896
this lightning and thunder needs to go,2017-02-24 16:16:41,835237034801442822
"It rained last night, with snow, laced with thunder. Today, it was drizzles and wind. Its coffee, letters, procrastinate kinda day",2017-02-24 16:16:33,835237000093515776
NBA 2/24 Grizzlies -1 Jazz -3 Thunder -10 Heat +3.5 Spurs -3,2017-02-24 16:16:30,835236986952826880
thunder scares me so much,2017-02-24 16:16:28,835236979612712964
Dawg this thunder SO loud,2017-02-24 16:16:26,835236971299635200
Thunder,2017-02-24 16:16:26,835236971060551685
Initial Chi-Ri II | War Thunder: http://youtu.be/SyGiVu7oxa8?a via @ YouTube,2017-02-24 16:16:22,835236952655990784
Thunder storm in February. Fun?,2017-02-24 16:16:21,835236949728321537
Oh no I'm sick and alone and the thunder is starting!!,2017-02-24 16:16:20,835236947601805312
1. Days of Thunder. That's all.,2017-02-24 16:16:19,835236942363099136
The rain and thunder is really nice pic.twitter.com/JsqEQHeobc,2017-02-24 16:16:12,835236911757344768
"TY! Lightning and thunder was over very soon. Rain and Storm until morning, but all in all not too bad in my area.",2017-02-24 16:16:12,835236910289272832
It's the calm before the storm Before the lightening strikes The thunder starts its yell My only hope That I can make it through this night pic.twitter.com/6vXwDzOQpW,2017-02-24 16:16:08,835236897362493440
おれもわからん,2017-02-24 16:15:54,835236837551656960
Basketball people what do you think of the Taj Gibson trade? Me personally I think it was bad for the Thunder,2017-02-24 16:15:37,835236765078327298
,2017-02-24 16:15:26,835236718399782912
i'm literally camping out in front of my window so i can watch the lightning and hear the thunder,2017-02-24 16:15:03,835236621477883904
OKC Thunder Acquire @ TajGibson22 & @ dougmcdermott – Twitter Reacts by @ Ringsmackie # ThunderUp # NBATradeDeadlinehttp://thunderousintentions.com/2017/02/24/twitter-react-okc-thunder-trade/ …,2017-02-24 16:15:01,835236613118636032
"(Sylv.)Pikachu 29% (8/1/4 Thunder Shock/Discharge) appeared! Available until 16:44:47 (29m 47s). http://maps.google.com/maps?q=41.70933797900082,-83.70035926306393 …",2017-02-24 16:14:58,835236600598646789
thunder by boys like girls just came on shuffle I'm fuckin EMO,2017-02-24 16:14:36,835236511222202368
"響け、雷鳴の雄叫びを ♪Rolling Thunder/坂本龍馬,高杉晋作,桂小五郎",2017-02-24 16:14:27,835236471963447300
"4:12 Feb,24. It just started raining over here. I've herd tornado warings,thunder warnings. I'll be safe i know it, I hope....",2017-02-24 16:14:20,835236443018653697
“Don’t kiss me if you’re afraid of thunder. My life is a storm.”,2017-02-24 16:14:18,835236433329782786
# YouAreNotBlackEnoughIf yo gran never covered the mirror with a blanket when thers a thunder storm,2017-02-24 16:14:13,835236414304419841
the thunder cornered the market on the immediate gut reaction of “wow great trade!” trades that we side eye 24-48 hours later.,2017-02-24 16:13:56,835236342967721984
@ dougmcdermott good luck with the Thunder young cat,2017-02-24 16:13:55,835236339083800576
FACTS Bruh DJ thunder snapped imma find that man info,2017-02-24 16:13:48,835236308096331778
I've just unlocked Thunder in Heaven achievement in Paradise Island 2! http://tinyurl.com/q3qf2ej # ParadiseIsland2 # GameInsight,2017-02-24 16:13:42,835236283366584320
I've just unlocked Thunder in Heaven achievement in Paradise Island 2! http://tinyurl.com/q3qf2ej # ParadiseIsland2 # GameInsight,2017-02-24 16:13:37,835236262839791617
December Rain and Thunder: Everybody was freaking out. They were asking when the last time we had thunder in… https://goo.gl/fb/Hlg3mW,2017-02-24 16:13:35,835236254849581056
おならよりは好き,2017-02-24 16:13:34,835236251582115841
"There was already thunder here a while ago, but the worst isn't supposed to happen until later tonight.",2017-02-24 16:13:20,835236189070311424
"Thunder Notes: Perkins, 15th Man, Roberson https://www.hoopsrumors.com/2017/02/thunder-notes-perkins-15th-man-roberson.html …pic.twitter.com/hvw05TwK8l",2017-02-24 16:13:15,835236169839435776
I wish James Harden was still on the thunder,2017-02-24 16:12:56,835236088180518914
10 Things to Know: Lakers at Thunder (2/24/17).Here is what you need to know before the Lakers start the.. http://fantasticoh.com/beep?id=762ef76f0cb343a2 …,2017-02-24 16:12:48,835236056068997120
I've just unlocked Thunder in Heaven achievement in Paradise Island 2! http://tinyurl.com/q3qf2ej # ParadiseIsland2 # GameInsight,2017-02-24 16:12:47,835236054433030144
"Kicking off the weekend with PATH in River, Chalk, and Thunder. Which PATH will you choose? info@brookperdigontextikes.com for samples pic.twitter.com/THJHv2bUt4",2017-02-24 16:12:44,835236038725402624
"Mareep (51.1%) Thunder Shock/Discharge 10/12/1 (ATK/DEF/STA) Despawns at 13:42:26 https://maps.google.com/maps?saddr=My+Location&daddr=34.17580280002281,-118.54737801278844 …",2017-02-24 16:12:40,835236021520465920
December Rain and Thunder: Everybody was freaking out. They were asking when the last time we had thunder in… https://goo.gl/fb/WUgSYg,2017-02-24 16:12:17,835235926972452865
Will the # Thunder cover the spread tonight as a double-digit home favorite when they host the # Lakers at 8:00PM ET? http://ht.ly/Elwn309kXBh,2017-02-24 16:12:15,835235916927143936
Getting ready to head to Chesapeake Energy Arena in a few for the Lakers vs Thunder....I hope we get to see TG and McBuckets tonight,2017-02-24 16:12:15,835235916360876032
# NZAirTattoo Thunder flypast pic.twitter.com/qvBP5nheG1,2017-02-24 16:12:12,835235905971499008
"Raise your words, not voice. It is rain that grows flowers, not thunder. - Rumi # quote",2017-02-24 16:12:05,835235875248353280
I hear her heart beating loud as thunder @ ReflexLondonpic.twitter.com/9eo31wsXXf,2017-02-24 16:12:01,835235859389644802
"yep, we had rain, thunder, hail, sleet, clumps of snow, thunder snow and now more snow. Day before it was 75.",2017-02-24 16:11:59,835235850208350210
"Mareep (24.4%) Thunder Shock/Thunderbolt 6/2/3 (ATK/DEF/STA) Despawns at 13:38:48 https://maps.google.com/maps?saddr=My+Location&daddr=34.1716914957057,-118.51563567398368 …",2017-02-24 16:11:44,835235787222499328
i'm waiting to get my haircut and my mom just fucking YELPED because the thunder was so loud,2017-02-24 16:11:39,835235766687129601
Cash ya girls at the thunder game tonight,2017-02-24 16:11:36,835235756486586369
the thunder somehow have cornered the market on “oh great trade!” instant reactions from everyone.,2017-02-24 16:11:29,835235727059349504
thunder + rain = soothing,2017-02-24 16:11:27,835235718658162689
The Environmentally friendly Thunder waterslide onboard the Carnival Spirit cruise ship… http://cruise2click.com/index.php/2017/02/24/the-environmentally-friendly-thunder-waterslide-onboard-the-carnival-spirit-cruise-ship-cruise-news/ …pic.twitter.com/D6idCigdSb,2017-02-24 16:11:20,835235687091867649
"Lakers vs. Thunder Game Preview: Finally, basketball is BACK ... in Oklahoma http://dlvr.it/NT0PXn pic.twitter.com/1XB4uneCxi",2017-02-24 16:11:11,835235650160885761
Yfip: me A fuckign baby that still gets scared by thunder,2017-02-24 16:11:07,835235631932538885
"Lakers vs. Thunder Game Preview: Finally, basketball is BACK ... in Oklahoma. http://www.silverscreenandroll.com/2017/2/24/14729718/la-lakers-game-preview-oklahoma-city-thunder …",2017-02-24 16:11:06,835235629374001152
I've had a couple of experiences where the thunder was so loud I had to put my fingers in my ears because it hurt,2017-02-24 16:10:55,835235583404425217
"Near 70 in February, thunder storms, hail, lighting in Detroit! I'm glad king Trump has proven climate change was made up by the Chinese.",2017-02-24 16:10:54,835235577096253440
thunder scares me,2017-02-24 16:10:20,835235433940414464
"Ah, winter-spring in Michigan: thunder and lightning today; and great discounts on ice melt at the hardware store. # prespring",2017-02-24 16:10:07,835235382279172100
ケツから出るうんこじゃない方のやつ,2017-02-24 16:10:01,835235354420531200
"Me: tonight I am finally going to try the hot tub. WX 2hrs later: thunder, lightening w chance of tornado. # ImAJinx",2017-02-24 16:09:43,835235280361775109
If I see the grave-worms crawling in the fire that burst from the thunder ceased; but by hope.,2017-02-24 16:09:41,835235271054618624
Thanks!,2017-02-24 16:09:38,835235260476465152
Oooo..... this is nice. Thunder. Rain. Lightning. Nice kind of weather to stay in and just relax.,2017-02-24 16:09:26,835235208781770753
play battlefield dammit,2017-02-24 16:09:25,835235204268703745
Opened my window so that I can listen to the thunder,2017-02-24 16:09:22,835235193392869377
"Mareep 37.8% (5/6/6) (Thunder Shock/Body Slam) Available until 03:38:51pm (29m 35s) http://maps.google.com/maps?q=42.0531471751452,-88.09721223589551 …",2017-02-24 16:09:14,835235160647942144
"No me extrañen, estoy en War Thunder practicando con el B-29 por si me necesitan.",2017-02-24 16:09:00,835235102263230465
"THUNDER BOLT AND LIGHTNING, VERY VERY FRIGHTENING, ME",2017-02-24 16:09:00,835235100761608192
Thunder plays a significant role in Sitka's life. But I can't decide to name the Mareep after Lorcan's nerdiness or his love for Sitka GDI,2017-02-24 16:08:59,835235095787126784
"Jolteon (55.6%) Thunder Shock/Discharge 5/6/14 (ATK/DEF/STA) Despawns at 13:38:38 https://maps.google.com/maps?saddr=My+Location&daddr=34.19706944748863,-118.52037917157166 …",2017-02-24 16:08:56,835235083107860480
i don't like thunder but the rest is gold,2017-02-24 16:08:55,835235078573805568
"A thunderstorm in February with this kind of lightning, thunder, wind, & rain?!?!? Welcome to Northwest Ohio everyone",2017-02-24 16:08:50,835235058667634689
Walker Lukens ( @ walkerlukens) Streams “Where Is Thunder Road?” https://hifinoise.com/2017/02/24/walter-lukens-stream-where-is-thunder-road/ …,2017-02-24 16:08:36,835235000614166528
"RT declothed: ""what happened to us?"" she was lightning and i was thunder, the timing was always slightly off.",2017-02-24 16:08:25,835234953902309378
"Lakers vs. Thunder Game Preview: Finally, basketball is BACK ... in Oklahoma http://dlvr.it/NT0LbQ pic.twitter.com/BTdHGl9GOW",2017-02-24 16:08:11,835234896142458880
Amidst in thunder uttered thus his voice.,2017-02-24 16:08:01,835234851267592192
