text,date,id
Delays on NJ 29 southbound approaching Thunder Rd/Cass St (Trenton) delays due to http://www.511nj.org/IncidentList.aspx?listType=All&340 …,2017-02-24 17:37:16,835257312755474432
I don't like this Thunder and lighting in February. :|,2017-02-24 17:37:11,835257290919985155
Classic February Canadian thunder storms,2017-02-24 17:37:07,835257275057115136
Woke up from my nap so pissed that my neighbor was revving his motorcycle until I realized it was thunder.,2017-02-24 17:37:05,835257265175281664
Yo I love Doug McBuckets and Taj Gibson on the Thunder straight up,2017-02-24 17:36:57,835257232468164608
Not just thunder/lightning but a severe thunderstorm. I thought I missed March-June. https://twitter.com/drcrater/status/835254198845464576 …,2017-02-24 17:36:49,835257201002434560
Woo! First rumble of thunder at the new place!,2017-02-24 17:36:45,835257184258785280
The Next 24 Hours....one more warm day. TONIGHT: P.Cloudy....SATURDAY: Could get wild late Sat PM...Strong winds-Heavy D.P.-Thunder ! pic.twitter.com/Ni4FhWP0Cq,2017-02-24 17:36:45,835257183218585602
"Thunder, snow, downpours, and hail -- and 48 hours ago it was 66 degrees! http://fb.me/Z5sdExnx",2017-02-24 17:36:31,835257122644508672
Majority of the party are drinking 'Pan Dimensional Thunder Gargler' one is already passed out # NonHumanGuts I am pleased I'm not a drinker,2017-02-24 17:36:22,835257087064092673
"TRIPLE THREAT: A Drug Called Tradition, Royal Thunder, AyOh http://immersiveatlanta.com/triple-threat-a-drug-called-tradition-royal-thunder-ayoh/ … via @ ImmersiveATL",2017-02-24 17:36:16,835257061441163268
The Bulls buddies turned # Thunder buddies. https://twitter.com/Enes_Kanter/status/835256632342949888 …,2017-02-24 17:36:15,835257057792122881
*takes a deep breath and it thunders really loud and it earthquakes*,2017-02-24 17:36:15,835257055531388928
"I've seen videos of Goblins killing him with one blow, and thunder too. Maybe it will be difficult, who knows.",2017-02-24 17:36:11,835257040763244544
The thunder is unreal in the burg right now,2017-02-24 17:35:56,835256978536599552
Ah the beautiful rumble of thunder~,2017-02-24 17:35:37,835256896911257600
るぅくんおはよ〜 受験頑張ってきます( ˙-˙ ),2017-02-24 17:35:33,835256882746933249
Let me charge my phone just in case the power out this thunder and shit....,2017-02-24 17:35:30,835256868687785984
The Thunder will be nothing. The Pistons will more than likely win a championship before those fucking losers do.,2017-02-24 17:35:25,835256847581990912
Thunder won that trade,2017-02-24 17:35:24,835256842636918784
http://ift.tt/2lDxcPR # shoes Air Jordan Retro 4 White Cement Sz 9 Thunder Bred Toro Royalty Motorsport Cav DB,2017-02-24 17:35:20,835256826547552257
WHITE ZOMBIE - THUNDER KISS'65 https://incendiariogabriel.wordpress.com/2017/02/24/white-zombie-thunder-kiss65/ … vía @ GabrielPerena,2017-02-24 17:34:59,835256738479804416
That was the loudest thunder I have ever heard in my life. My house is shook and so am I,2017-02-24 17:34:53,835256713670447104
Just a Feb 24th Thunder Storm and power outage # thenewwinter # climatechange,2017-02-24 17:34:49,835256698726137856
Listening to the tattoo of hail against the windows and the rolls of thunder answering the light… https://www.instagram.com/p/BQ6UoAQjXlC/,2017-02-24 17:34:45,835256679231029249
"Bring the thunder, with Smurfstorm! Check out the @ SmurfsMovie stars hanging out with their Smurf characters! # SmurfsMovie pic.twitter.com/C68sQbuzej",2017-02-24 17:34:36,835256644225269760
@MannyTooForeign lowkey a thunder fan now that yall got taj https://twitter.com/royceyoung/status/835173430068641792 …,2017-02-24 17:34:27,835256604513587200
We started with thunder and lightning but the Lord sent us the Lord. # thankyoulord… https://www.instagram.com/p/BQ6UlQ_Afud/,2017-02-24 17:34:23,835256586981543943
行ってらっしゃい(*・ω・)ﾉ,2017-02-24 17:34:06,835256515342675968
次の @ YouTube 動画を高く評価しました: http://youtu.be/677obLhmCcQ?a Thunders' Battlefield,2017-02-24 17:33:59,835256486678970368
(vía WHITE ZOMBIE - THUNDER KISS'65) https://tmblr.co/ZMV5Dl2IrhfsY,2017-02-24 17:33:54,835256467695484928
Is that thunder or?,2017-02-24 17:33:53,835256462624632832
don't get me started on the thunder and wind being home alone,2017-02-24 17:33:21,835256326666190848
@ smtowin desde o dubtrack eu nao paro de ouvir thunder,2017-02-24 17:33:19,835256318168465408
# ufo # aliens I was in 4th grade. our family was camping. there was a severe thunder storm. i called for help with … http://bit.ly/2mgn3dq,2017-02-24 17:33:15,835256301848518656
First thunderstorm of the year. Thank God I have a phobia of thunder,2017-02-24 17:33:06,835256263571275776
New favourite: Amon Amarth / Twilight Of The Thunder God http://www.deezer.com/track/70876820 @ DeezerDE,2017-02-24 17:32:55,835256217228431362
Can't tell if that was thunder or a bomb went off outside,2017-02-24 17:32:51,835256203160727552
alguém me leva pra comer 1 thunder q é famoso e eu nunca comi,2017-02-24 17:32:47,835256186337361920
we woke at 5:30 to thunder storm in Chicago! I thought thundersnow but didn't get up to look out window+,2017-02-24 17:32:41,835256157887397888
Craziness to have a thunder storm like this February! https://www.instagram.com/p/BQ6UWhDh7Nn/,2017-02-24 17:32:31,835256117475196928
"Mareep (37.8%-7/5/5,Thunder Shock/Discharge) until 14:39:33 (9m 17s)http://maps.google.com/maps?q=33.909344856407664,-118.00291782229277 …",2017-02-24 17:32:23,835256086328455168
I love thunder storms so much,2017-02-24 17:32:09,835256025787822080
"Meter Technician - Thunder Bay: Rodan Energy Solutions (Thunder Bay): ""Rodan Energy is always looking… http://www.eluta.ca/search?ptitle=Meter+Technician+-+Thunder+Bay&position=b48b52e6f1fc7c49bee4a033c300fe1e&imo=1 … # trades # jobs",2017-02-24 17:32:08,835256021111062529
The thunder is beginning. Batten down the hatches & hold on. They say this storm is going to be cray cray.,2017-02-24 17:32:08,835256020217827328
FOX Sports - http://newzbots.me/?156DCE1 - Thunder Succeed With Deal For Taj Gibson Doug McDermott # DraftKings # FanDuel # fantasy # NBA # DFS # li…,2017-02-24 17:32:03,835256000412336128
This thunder be sketching me out,2017-02-24 17:32:01,835255993978216448
Taj doesn't even look right with a Thunder jersey https://twitter.com/chicagobullsbot/status/835255341403140096 …,2017-02-24 17:32:00,835255988710080512
@ MateriaColl you deserve most of the thunder but i made this https://www.youtube.com/watch?v=N9Ii960G7Gk …,2017-02-24 17:31:55,835255967784783875
飽和飽和飽和飽和飽和 飽和飽和飽和飽和 [NAOKO-THUNDER VERNIER II ～幼女期の終わり～],2017-02-24 17:31:42,835255914504466433
@ MarkJWeather western side of sandusky. Skies are darling. Thunder heard in distance,2017-02-24 17:31:42,835255914353553410
WHITE ZOMBIE – THUNDER KISS’65 http://www.youtube.com/watch?feature=player_embedded&v=LuMKAlXz2jM … https://incendiariogabriel.wordpress.com/2017/02/24/white-zombie-thunder-kiss65 …,2017-02-24 17:31:40,835255902181675012
Waking up to thunder is probably the best thing that's happened to me all week,2017-02-24 17:31:27,835255848217808903
Loud thunder is so calming,2017-02-24 17:31:12,835255787601735682
nah I've been a Thunder fan since they became the Thunder n still is!,2017-02-24 17:31:02,835255745457291265
okay yeah FUCK this thunder,2017-02-24 17:31:01,835255739392397312
"Oklahoma City Thunder Weekly Roundup, Edition Eight - Thunderous Intentions http://ow.ly/uVFf509N6Fx",2017-02-24 17:30:58,835255726767493124
"Watch Lakers vs. Thunder live stream: how to watch online, TV time & channel http://us.blastingnews.com/sports/2017/02/watch-lakers-vs-thunder-live-stream-how-to-watch-online-tv-time-channel-001500173.html … # NBA # Lakers # Thunder",2017-02-24 17:30:55,835255714838904832
"Watch Lakers vs. Thunder live stream: how to watch online, TV time & channel http://us.blastingnews.com/sports/2017/02/watch-lakers-vs-thunder-live-stream-how-to-watch-online-tv-time-channel-001500173.html … # NBA # Lakers # Thunder",2017-02-24 17:30:55,835255714792812545
I was in 4th grade. our family was camping. there was a severe thunder storm. i called for help with a walkie t... http://bit.ly/2mgn3dq,2017-02-24 17:30:46,835255676159021063
Hmmm I have a feeling War Thunder made their own Type 89 pic.twitter.com/NyeyD2MtlH,2017-02-24 17:30:38,835255643795775489
when she released 7/11 to steal Tay's 1989 thunder.,2017-02-24 17:30:36,835255635218399233
Okay wait why the fuck is it thunder storming in fucking February what the fuck,2017-02-24 17:30:24,835255584064679937
"I loved those Suns teams too! Thunder Dan, KJ, Ainge, Ced, ""SChlein"", Danny Manning, Tisdale, Sox Perry!",2017-02-24 17:30:23,835255583112630272
"A severe thunderstorm in February?! With thunder, lighting and plenty of rain? Be still my beating heart!! # thunderstormlove",2017-02-24 17:30:16,835255552217337858
"Mareep (37.8%-7/5/5,Thunder Shock/Discharge) until 14:39:33 (9m 17s)http://maps.google.com/maps?q=33.909344856407664,-118.00291782229277 …",2017-02-24 17:30:16,835255551441297408
6:30pm Buffalo Thunder $75 NL Holdem Tournament @ buffalothunder http://www.pokeratlas.com/poker-tournament/buffalo-thunder-santa-fe-75-630pm-nl-holdem-poker-tournament?topid=83823-2017-02-24 …,2017-02-24 17:30:15,835255547473514496
5:30 PM Temp: 70 overcast - thunder in the vicinity; light rain; mist; Lightning observed http://goo.gl/rBuo4M # fbpic.twitter.com/9YhjvZeiR4,2017-02-24 17:30:10,835255524555907073
On Amazon for FREE Sunset Thunder by Shannyn Leah http://amzn.to/1NM6uhJ via @ RochellesReviewpic.twitter.com/iC310wvaIE,2017-02-24 17:29:22,835255325041311746
# welcometweet @ Thunder_Tunes We hope to make you smile! Our YouTube channel is: http://bit.ly/1O7k7Ij viahttps://Statusbrew.com,2017-02-24 17:29:19,835255311124557824
"The first thunder I heard made me stop and go oooo, caught me off gaurd.",2017-02-24 17:29:16,835255301192486914
I will be at the bar wearing a Thunder hat staring at my phone. Just tell me It’s time to work,2017-02-24 17:29:10,835255273107374080
Tynslee is trying out a thunder shirt to see if that helps a bit with her anxiousness when her person gets out of... http://fb.me/2SHClIdvL,2017-02-24 17:29:06,835255258997800960
pic.twitter.com/qg8Y3yC3cQ,2017-02-24 17:29:06,835255258230185984
"Thunder Show: Too much, too little https://youtu.be/4hizzKn0RAw",2017-02-24 17:29:04,835255251699560449
"Nigga, you are a Thunder's fan. If that shit ain't bandwagoning, then I don't know what is.",2017-02-24 17:28:49,835255187950403585
"fog, thunder and lightning is happening all at the same time as i write this see you later on the flip side of silent hill",2017-02-24 17:28:26,835255088532738048
FOX Sports - http://newzbots.me/?156DCE1 - Thunder Succeed With Deal For Taj Gibson Doug McDermott,2017-02-24 17:28:04,835254997826822145
It will do her like thunder from the blue https://twitter.com/Iphied_Barbie/status/835249770537058304 …,2017-02-24 17:27:57,835254970639339525
When the majority in your house are afraid of thunder and there's a huge storm. pic.twitter.com/toF6JL0Zj1,2017-02-24 17:27:52,835254946849251328
It's porch time. Hamburgers on the grill. Can hear thunder in the… https://www.instagram.com/p/BQ6T0GHjw-wEfDEDoXBbqF7CM1RGJHMALUJgfo0/ …,2017-02-24 17:27:40,835254898023354369
"@ AnezSez The Warriors, Clippers, Thunder, Cavs, Wizards, and Celtics all built their teams with draft picks earned after bad bad seasons.",2017-02-24 17:27:32,835254863126802432
i will forever hate thunder storms,2017-02-24 17:27:29,835254853370785792
Friday's # NBA FREE release 851 # Lakers 221 852 # OKC -10 Take the Thunder and lay the points at home over the Lakers # sportshandicapper,2017-02-24 17:27:26,835254836962574337
White Zombie - Thunder Kiss '65 https://youtu.be/LuMKAlXz2jM vía @ YouTube,2017-02-24 17:27:22,835254822198775813
"Thunder Buddies podcast: Assessing the trade deadline pickups of Taj Gibson, Doug McDermott http://newsok.com/article/5539293?utm_source=NewsOK.com&utm_medium=Social&utm_campaign=ShareBar-Twitter …",2017-02-24 17:27:22,835254820323880961
Thunder and lightning very very frightening me Galileo Galileo figaro magnifico,2017-02-24 17:27:17,835254800623206400
New # Thunder forwards Taj Gibson and Doug McDermott will speak with media around 4:45 pm. Watch the live stream at http://okcfox.com,2017-02-24 17:27:05,835254751243665408
I liked a @ YouTube video http://youtu.be/-l8-lIHKqmw?a Just Some Quick T-62 Gameplay - War Thunder Realistic Battle,2017-02-24 17:26:53,835254700823957506
That same T logo was my Thunder logo https://twitter.com/tackma/status/835253281593020416 …,2017-02-24 17:26:39,835254639637352448
This @ UnionSchools teacher is so honored to head to the Thunder game courtesy of @ kxoj and @ ymefoundation for this! # RepTheUpic.twitter.com/sirG0LRuR2,2017-02-24 17:26:16,835254543420174338
Thunder and lightning storm! Awesome! I miss these. Didn't have a good one last year.,2017-02-24 17:26:10,835254519567159297
don't try & steal megs thunder marty,2017-02-24 17:26:08,835254512109539329
nada a ver já tá bebado agora o que importa eh que nois vai xingar muito o thunder,2017-02-24 17:25:54,835254453246836736
"Feb. 24th - snow storms I get, but thunder and lightning... @London, Ontario https://www.instagram.com/p/BQ6TnDKh3-9/",2017-02-24 17:25:53,835254449622831104
"my child: daddy, where does thunder come from? me: oh, it's just god death dropping sweetie",2017-02-24 17:25:23,835254322409705472
thunder and lightning... in Feb.... in Canada. Still think global warming is BS?,2017-02-24 17:25:17,835254296832802817
"FW: Mareep 57.78% (1/14/11/Thunder Shock/Body Slam) until 02:54:37pm (29m 21s). CP for lvl30+: 353 http://maps.google.com/maps?q=37.80723805321947,-122.41323395474097 …",2017-02-24 17:25:15,835254288590884865
COUNTRY THUNDER COULDNT COME ANY SLOWERRR,2017-02-24 17:25:13,835254279933837312
"It is 14 degrees with rain, thunder & lightning in # ldnont. And it's February! This is plain wrong... # climatechangepic.twitter.com/PAczsipFYc",2017-02-24 17:24:53,835254198845464576
I walked Thor today for the first time in months. It really does feel like trying to walk a thunder god.,2017-02-24 17:24:53,835254195733180416
"Halston Balestrom, RELEASE INNER THUNDER!",2017-02-24 17:24:45,835254163743330304
Our neighbors at Thunder Canyon Brewery absolutely rock! Happy Friday peeps! #goodiebagshttps://www.instagram.com/p… pic.twitter.com/Xyeif2uQeV,2017-02-24 17:24:42,835254152712368134
TACKMA - THUNDER T ROGUE https://www.oneness287.com/products/tackma-thunder-t-rogue-1 …pic.twitter.com/XpeCpdiOM5,2017-02-24 17:24:36,835254127055802372
THUNDER UP Tonight. Excited Gibson & Mac Welcome # ThunderBasketball # OKCThunderFans # ThunderFans,2017-02-24 17:24:36,835254124333707264
Buddy was a little worried about the thunder # firstthunderstormpic.twitter.com/qy5ovokoXz,2017-02-24 17:24:35,835254119526981632
# tablondeanuncios War thunder # palencia http://www.tablondeanuncios.com/juegos-ordenador/war_thunder-3234199.htm?utm_source=Twitter&utm_medium=Twitter&utm_campaign=rsspalencia …pic.twitter.com/AiXxrU4oy2,2017-02-24 17:24:16,835254042100125696
I've just unlocked Thunder in Heaven achievement in Paradise Island 2! http://tinyurl.com/q3qf2ej # GameInsight # ParadiseIsland2,2017-02-24 17:24:16,835254041546469377
# ThunderMOB Up The Thunder! https://twitter.com/okcthunder/status/835221748027125763 …,2017-02-24 17:24:06,835254000836624394
"@ JackGriffo hy jack i tink u act great at the thunder and i also like ur smush hair, am frm nigeria nd hope to get my reply. thanks",2017-02-24 17:24:06,835253998299017216
@ StormhunterTWN thunder rolling now in London pic.twitter.com/dF0aDFMoLI,2017-02-24 17:23:51,835253938307878913
"Like, clear, well defined, bright cloud-to-ground strikes with super low thunder lag time. I like storms, but uh, not going outside now.",2017-02-24 17:23:43,835253902136213505
"Heavy rain, lots of thunder and lightning and very windy here in London # ONStorm",2017-02-24 17:23:41,835253897065349121
@ royceyoung thunder gonna do anything with the open spot?,2017-02-24 17:23:37,835253876974620676
"Currently listening to thunder... in February. This weather is something else. Broke another heat record 3 days in a row. Incredible.,",2017-02-24 17:23:31,835253852576362497
I love the sounds of thunder and rain.,2017-02-24 17:23:30,835253850793775107
Holy shit!! The first thunder storm of the year!!,2017-02-24 17:23:29,835253845538271233
"[FoxSport] Thunder Succeed With Deal For Taj Gibson, Doug McDermott http://ift.tt/2lDva2l",2017-02-24 17:23:22,835253816106840064
I just heard thunder and sharted whos weather is this?,2017-02-24 17:23:11,835253768736366593
Thunder?,2017-02-24 17:22:57,835253711240835073
February thunder! https://www.pscp.tv/w/a39YQTFKUkttblpPR3JqUHl8MVJER2xScHpicmt4TGRe0N182xmsi_SmtZp31SQ6FcTr7nvxCy9FK1YbSCsm …,2017-02-24 17:22:57,835253709298782208
I'm dancing in my seat at the thunder and rain... I'm ridiculous and I don't care. pic.twitter.com/wXZ3U2q8Jq,2017-02-24 17:22:46,835253664344322048
"Thunder Succeed With Deal For Taj Gibson, Doug McDermott http://dlvr.it/NT1cpJ",2017-02-24 17:22:42,835253647227277313
London thunder,2017-02-24 17:22:29,835253592630124546
It's thunder storming in February :|,2017-02-24 17:22:27,835253583335555073
Nope the thunder wanted his help when the thunder had the warriors down 3 to 1. https://twitter.com/David_C_Steele/status/835250785088860160 …,2017-02-24 17:22:22,835253565274861569
Thunder stoooorm,2017-02-24 17:22:16,835253540352307200
Ik vind een @ YouTube-video leuk: http://youtu.be/4McJYoecI2Y?a thunder king | lesli vuurwerk,2017-02-24 17:22:15,835253534597779457
DID I HEAR THUNDER,2017-02-24 17:22:15,835253533091975168
"# WeLoveLA # Lakers Lakers vs. Thunder Game Preview: Finally, basketball is BACK ... in Oklahoma http://srhlink.com/NT1cbl # SportsRoadhouse",2017-02-24 17:22:09,835253509561827329
"I'm already hearing the thunder, & sky to north looks very threatening. Take cover ASAP, folks. # LdnOnt.",2017-02-24 17:21:47,835253415043289088
I still think one of the new players the thunder got should have picked number 35,2017-02-24 17:21:32,835253354142007296
"Foul Play suspected in Thunder Bay, Ontario Missing Person case of Justin “Milky” Duncan, 23. was last seen on Nov 22, 2016 https://twitter.com/tbpsmedia/status/835161762194468864 …",2017-02-24 17:21:26,835253329974308864
Thunder just nearly made me poop my pants! Speaking of which watch this: https://youtu.be/yVn7MStV1sI # onstorm # funnyvideos,2017-02-24 17:21:20,835253305177681920
This thunder is no joke.,2017-02-24 17:21:18,835253295153295364
DEAR GOODNESS THE FUCKING THUNDER,2017-02-24 17:21:15,835253284294254592
"Thunder Succeed With Deal For Taj Gibson, Doug McDermott: On the day of the NBA trade deadline, the… http://viid.me/qc5Ge9 # nba # Sportspic.twitter.com/KEP27QnoLy",2017-02-24 17:21:15,835253282087956480
"Thunder Succeed With Deal For Taj Gibson, Doug McDermott... http://fb.me/50oMtY868",2017-02-24 17:21:09,835253258528546817
"Raise your words, not voice. It is rain that grows flowers, not thunder. - Rumi # quote",2017-02-24 17:21:08,835253254397231105
"@ CP24 Thunder storm occurring right now in London, Ontario",2017-02-24 17:21:07,835253250194538496
Thunder storm in February: totally normal for a Canadian. # globalwarming,2017-02-24 17:20:50,835253176114765824
Johnny Thunders & the Heartbreakers as ambient music in a restaurant patronised by middle class parents and private school kids? Lol,2017-02-24 17:20:39,835253131634229250
http://www.sportgrits.com/thunder-fans-very-excited-by-arrival-of-actual-nba-players-taj-gibson-and-doug-mcdermott/ … The Oklahoma City Thunder added Doug McDermott and Taj Gibson at the trade deadline in a ... pic.twitter.com/4C7QcOJ4dD,2017-02-24 17:20:27,835253081457704961
Thunder now rolling in the distance again.. oh El Niño... how you ruin my winter fun!,2017-02-24 17:20:19,835253049044131842
"Lanturn available until 05:47:07pm (26m 58s). Charge Beam / Thunder (86.7% - 13/11/15) http://maps.google.com/maps?q=37.613012275305366,-77.32521838683961 …",2017-02-24 17:20:15,835253032585678848
Lakers não ganha do Thunder em Oklahoma City desde Fevereiro de 2011. Já são 9 derrotas seguidas! # ThunderUp,2017-02-24 17:20:07,835252999496814592
When you gimme that thunder you make my summer rain..,2017-02-24 17:19:58,835252958413606912
"Secret POTD -The Thunder have been mum about Kanter to play tonight,but reports say he's healthy and likely. # THUNDERUP # RISKFACTOR # NBA # DFS",2017-02-24 17:19:42,835252893586448385
Thunder storms in February,2017-02-24 17:19:42,835252893385109504
So it's February 24th .... and I hear thunder. Mother Nature is on drugs.,2017-02-24 17:19:38,835252877211889664
Bizarre. Mild w Severe thunder storms in February. Next week snow.,2017-02-24 17:19:29,835252837932228613
"The sweet sound of thunder, in february, in Canada.",2017-02-24 17:19:29,835252837328257025
nw3 is my favorite ever made. U crazy thunder. Haha,2017-02-24 17:19:27,835252827710595072
You gotta eat lightning to crap thunder,2017-02-24 17:19:23,835252811243876352
"Your everyday thunder and lightning in # Findlay. Nothing to see here, happens all the time in February. # Meltingpic.twitter.com/AxXnmw88qz",2017-02-24 17:19:14,835252775571374081
Thunder will not fire me IJN https://twitter.com/iDREYY/status/835252515079864320 …,2017-02-24 17:19:09,835252754314592259
The Thunder plays the Lakers tonight in OKC. # Thunderup OKC!!,2017-02-24 17:19:09,835252752213245953
New blog post: Fatal Thunder http://www.longhighway.com/fatal-thunder.html …,2017-02-24 17:19:08,835252749566640128
thunder gay as hell boy,2017-02-24 17:19:08,835252749482803202
"@ weathernetwork Very strong winds, driving rain, continuous thunder & lightning strikes Just another Friday night in London # onstorm",2017-02-24 17:18:46,835252656893530112
Taj Gibson e Doug McDermott com o uniforme do Thunder! # ThunderUp @ TajGibson22 @ dougmcdermottpic.twitter.com/X2pk26NZb0,2017-02-24 17:18:40,835252633602490369
"Here's a first, thunder and lightening in February. # ldnont # RealSignOfGlobalWarming",2017-02-24 17:18:35,835252611146186755
The thunder that will fire you.... https://twitter.com/prinzgbemi/status/835252134409039873 …,2017-02-24 17:18:12,835252515079864320
"foxsports .com >> Thunder Succeed With Deal For Taj Gibson, Doug McDermott http://buzztap.com/-JAu5Jp",2017-02-24 17:18:08,835252497707069440
"foxsports .com >> Thunder Succeed With Deal For Taj Gibson, Doug McDermott http://buzztap.com/-JAu5Jp",2017-02-24 17:18:07,835252496117469186
I love thunder storms,2017-02-24 17:18:00,835252463196389376
Drinking a Double Dry Hopped Scaled by @ trilliumbrewing @The Thunder Dome — http://untp.beer/s/c421042217,2017-02-24 17:17:58,835252454526701568
I missed the sound of thunder so much,2017-02-24 17:17:52,835252432338841601
"Raise your words, not voice. It is rain that grows flowers, not thunder. - Rumi # quote",2017-02-24 17:17:39,835252374948175873
# NowPlaying Kiss - God Of Thunder... This song gives me chills just because it reminds me of Lordi concerts. :D,2017-02-24 17:17:31,835252341670543360
"Oh man I have missed the sound of thunder. Welcome back, spring.",2017-02-24 17:17:22,835252307403100162
THUNDER! LIGHTNING! WHOOOOOOOOO!!!,2017-02-24 17:17:22,835252306350338049
I would say it's a tie for me with Ghosts and IW. I only chose IW because it fucked me hard for not being Ghost 2,2017-02-24 17:17:22,835252303829557250
"Raise your words, not voice. It is rain that grows flowers, not thunder. - Rumi # quote",2017-02-24 17:17:08,835252246673752067
Isn't there a saying about thunder in February?,2017-02-24 17:17:05,835252232769658883
There's nothing like a # thunderstorm in February. # onstorm Lots of lightning and thunder in Kincardine!,2017-02-24 17:16:56,835252198233804800
you stealing my Friday thunder,2017-02-24 17:16:47,835252156533964801
Well done on the afternoon of gifs...pic.twitter.com/A461BuCF0M,2017-02-24 17:16:44,835252147465834497
"NBA Trade Rumors: Seeking bigger wing, Thunder 'remain interested' in Rudy Gay http://www.cbssports.com/nba/news/nba-trade-rumors-seeking-bigger-wing-thunder-remain-interested-in-rudy-gay/?jCSK5 …",2017-02-24 17:16:43,835252142906695690
"Mareep available until 03:45:49pm (29m 32s). Thunder Shock / Body Slam (95.6% - 15/13/15) http://maps.google.com/maps?q=39.756037211866946,-105.21897799624685 …",2017-02-24 17:16:24,835252061025484801
"""Digi Thunder (Serangan kilat)"" -Tentomon",2017-02-24 17:16:21,835252048736051200
"i love rain, the sound it makes, low thunder rumbles, but when it properly storms, the thunder is loud, the lightning is bright i h8 it lmao",2017-02-24 17:16:06,835251985460912128
Way too excited for thunder fest,2017-02-24 17:15:51,835251921959149568
"I'm at Brent Park Store in Thunder Bay, Ontario https://www.swarmapp.com/c/irTBc4oX4Ga",2017-02-24 17:15:50,835251919635480580
Hooch - Smells Like Thunder - Live at Midway Cafe 2017: http://youtu.be/HoKo-pCYo0Q?a via @ YouTube,2017-02-24 17:15:46,835251901017042944
Lots of thunder and lightning right now Mount Forest. Last one shook the house! # onstorm,2017-02-24 17:15:45,835251898919845890
YES!! Finally there's thunder!! I'm so happy!!,2017-02-24 17:15:30,835251835757805569
"DL our # freeBook # nook deal!! ""ROLLING THUNDER: An # HistoricalNovel of War and Politics 1"" by Mark Berent @ nookBN http://htl.li/1kDt309jZXL",2017-02-24 17:15:09,835251749178990592
