text,date,id
빛과 그림자pic.twitter.com/voqJN2QsUi,2017-02-24 13:16:11,835191608031113217
FC Richmond U15 Mystx v Arizona AZSC Thunder begins NOW! # weareFCR,2017-02-24 18:59:46,835278075633909761
"Deadlift & Chill ... by myself, probably watching Tropic Thunder or Sausage Party. That… https://www.instagram.com/p/BQ6eWNDD-b3/",2017-02-24 18:59:44,835278068151422976
Storms make me want to cuddle up in bed and watch movies and listen to the rain and thunder,2017-02-24 18:59:42,835278059133620224
Felt like being a little basic on my way to the Thunder game with… https://www.instagram.com/p/BQ6eTY4garbpMg-IHNmmxaroAB9ntBN7-Q_fWw0/ …,2017-02-24 18:59:19,835277961808969728
I liked a @ YouTube video from @ lost_pause_ http://youtu.be/vCW8xBTBytI?a THAT B*TCH STOLE MY THUNDER - Noble Reacts to Noble YTP/Crack,2017-02-24 18:59:10,835277925456957442
Some minor thunder storms occurring. http://fb.me/3apTrRiZm,2017-02-24 18:59:04,835277898479251456
We only have creepy fog again. No thunder. So far...,2017-02-24 18:58:58,835277873573429248
Lightning and Thunder in February when I'm all alone. Of course. # Ineedathunderbuddypic.twitter.com/8J6hX08J1t,2017-02-24 18:58:47,835277829310939136
Players have no heart nowadays. Should have made it work with the thunder. They were one game away from the championship and he choked !!!,2017-02-24 18:58:42,835277808632905728
"MBB: With 3:08 remaining, the Knights lead the Thunder 66-55 # d3h",2017-02-24 18:58:23,835277725153832960
我が名は Thunder 。 特徴 安定 https://twitter.com/weather_aruaru/status/320851714733375488/photo/1pic.twitter.com/L0EcGDXUjv,2017-02-24 18:58:13,835277683219038209
[Thunder] Game 52 live blog: Thunder vs Royals http://bit.ly/2mugGiK,2017-02-24 18:58:01,835277633671811072
Rookie in the Thunder Cup Series @ JoshuaGambler25 swept the day with the pole and race win! # TCSeriespic.twitter.com/8O9d2vnCXM,2017-02-24 18:57:58,835277623584518146
Gotta love thunder in February,2017-02-24 18:57:52,835277598737510400
La mía de War Thunder pesa 210GB. Yo gano.,2017-02-24 18:57:49,835277584904617985
if no be one thing I for say thunder fire you. But isoky,2017-02-24 18:57:38,835277536657608705
Lol does everyone remember when thunder buddies were a thing,2017-02-24 18:57:23,835277475005485056
The thunder is so scary!,2017-02-24 18:57:15,835277440872251392
Domantas Sabonis earns at least one more start for Thunder http://bit.ly/2lOFGUZ,2017-02-24 18:57:07,835277407279964160
Thunder making Victor Oladipo (back) a game-time decision http://bit.ly/2lOJ5Dl,2017-02-24 18:57:05,835277401256927233
i hate thunder i hate thunder i hate thunder i hate thunder i hate thunder i hate thunder i hate thunder i hate thunder i hate thunder i hat,2017-02-24 18:56:56,835277361050488832
THUNDER,2017-02-24 18:56:36,835277277269106688
Perfect splosh Recipe: 3 gallons of custard 5 jars of lemon curd 10 jars of nutella 2 thunder thighs 2 buns of steel,2017-02-24 18:56:28,835277243425435649
I've just unlocked Thunder in Heaven achievement in Paradise Island 2! http://tinyurl.com/q3qf2ej # ParadiseIsland2 # GameInsight,2017-02-24 18:56:16,835277193605492736
"thunder, lightning, wind... scary",2017-02-24 18:56:03,835277141923221504
Cami really face timed me to see Thunder Hahahaha pic.twitter.com/Qly7J22tiv,2017-02-24 18:56:02,835277136608927744
てことになるね！？ さやで良き？,2017-02-24 18:56:01,835277131491893248
Game 52 live blog: Thunder vs Royals http://bit.ly/2mugGiK,2017-02-24 18:56:01,835277130435022848
Scary Thunder,2017-02-24 18:56:01,835277129948495872
"Mareep available until 05:00:32pm (4m 38s). Thunder Shock / Discharge (84.4% - 12/14/12) http://maps.google.com/maps?q=40.57889772795009,-105.06199746150936 …",2017-02-24 18:56:00,835277128576925696
# Thunder - Victor Oladipo game-time decision Friday vs. Lakers # FANation http://bit.ly/2lOyxnv pic.twitter.com/DXP2k3DDmp,2017-02-24 18:55:58,835277119286624258
I'm almost 23 and still scared of thunder...,2017-02-24 18:55:58,835277119240474625
You gotta play the Thunder vs Lakers game with me in FireFan. Download the app and come play. It's a blast! http://www.firefan.com/player-invite/beastmode26/bayoubeastmode26/d37867b85eb2dd1fc8e3b23cad668307-3c2573a5-8ea0-4551-b5e6-35f8587baefa …pic.twitter.com/z8xzY8PpIX,2017-02-24 18:55:58,835277118246371328
# Thunder - Victor Oladipo game-time decision Friday vs. Lakers # FANation http://bit.ly/2lOyxnv # NBApic.twitter.com/qRUtNs0fIp,2017-02-24 18:55:57,835277113175519232
# Thunder - Victor Oladipo game-time decision Friday vs. Lakers # FANation http://bit.ly/2lOyxnv # FantasyAlarmpic.twitter.com/dWfBy0DrB4,2017-02-24 18:55:55,835277107676737536
I HEAR THUNDER IN FRANKENMUTH!!!,2017-02-24 18:55:40,835277041683542016
Laura = st.hp->ex thunder clap->HP elbow 1 million dmg/stun Balrog = CC -> cr.hp->screw upper->dash straight 2 million dmg/stun,2017-02-24 18:55:39,835277040173506564
"I enjoyed thunder cat and oddissee albums the most out of all the music that came out today, but just seen this... http://fb.me/1eFZQj5T9",2017-02-24 18:55:23,835276970028064769
miss u be my thunder buddy,2017-02-24 18:55:13,835276930240892929
SMLXLXXLXXXL Promocode GAMEDAY2017 33% off # Thunder # OKCThunder # Basketball @Goldie Marie's… https://www.instagram.com/p/BQ6d0tmlUMr/,2017-02-24 18:55:09,835276912801038336
Milos has a lightning thunder serve,2017-02-24 18:55:05,835276896594075648
"Listen @Reverbnation ""THUNDER by Luiz Santos""http://www.reverbnation.com/luizsantosmusic/song/16309849-thunder-by-luiz-santos … # jazz # art # # classical",2017-02-24 18:55:02,835276883726118912
I JUST SAW LIGHTNING N HEARD THUNDER I LOVE STORMS,2017-02-24 18:54:56,835276858954498048
"Made it to Disneyland! Bianca went on Thunder Mountain and Star Tours for the first time, had… https://www.instagram.com/p/BQ6dye9gB3Q/",2017-02-24 18:54:50,835276834845650944
Brother Wind is pushing the Thunder Beings out of the area as Ya ai struggles to peek out one last time before slipping below the horizon pic.twitter.com/Mm9DHM8N1T,2017-02-24 18:54:41,835276795402407937
# Breaking # Top10 # Hot # News # Tech Thunder: Taj Gibson and Doug McDermott available to play Friday vs. Lakers (ESPN) http://top10app.com/thunder-taj-gibson-and-doug-mcdermott-available-to-play-friday-vs-lakers-espn/ …,2017-02-24 18:54:24,835276725898575872
Big thunder storm in # Muskoka is this really # February? # crazyweather,2017-02-24 18:54:16,835276692323201024
"@ MaggieMaggie57 i love storms, big clap of thunder is just beautiful",2017-02-24 18:54:13,835276680147038208
Get your Shek Republic t-shirt and/or other nifty options (like the full Daves of Thunder set) at: http://www.backpagepress.com/product/daves-of-thunder-complete-set …pic.twitter.com/6SwTzELRBo,2017-02-24 18:54:05,835276643547504641
They say marriages are made in Heaven. But so is thunder and lightning. Clint Eastwood # Quotes,2017-02-24 18:54:03,835276636157329408
can't even deal with being home alone right now with this thunder & lightening,2017-02-24 18:54:03,835276634802511872
Doug McDermott warms up for the 1st time as a member of the # Thunder pic.twitter.com/B254rtpPTO – at Chesapeake Energy Arena,2017-02-24 18:54:02,835276633045106689
"Warm temps, thunder and lightning in February?? # onstorm # mississauga",2017-02-24 18:54:02,835276630876643329
Game 52 live blog: Thunder vs Royals http://bit.ly/2mguCAQ,2017-02-24 18:54:01,835276627160477696
Did you see the article about our Rush Thunder Director's trip to England?? READ: http://ow.ly/U2Du309lbcI # RUIDpic.twitter.com/pZ03uJhcJ7,2017-02-24 18:53:59,835276620818677761
# Thunder - Enes Kanter will play Friday vs. Lakers # FANation http://bit.ly/2lOAQqw pic.twitter.com/gEyh3ICvbJ,2017-02-24 18:53:55,835276602833530880
# Thunder - Enes Kanter will play Friday vs. Lakers # FANation http://bit.ly/2lOAQqw # NBApic.twitter.com/NitVBRs0rO,2017-02-24 18:53:54,835276597410287616
# Thunder - Enes Kanter will play Friday vs. Lakers # FANation http://bit.ly/2lOAQqw # FantasyAlarmpic.twitter.com/pNk1RokNRS,2017-02-24 18:53:52,835276591450185729
"We have another # winner! $6,350.00 was won on Thunder Cash on February 24, 2017! # BigWinner # FunWinsEveryTime",2017-02-24 18:53:48,835276572986834947
Gotta love when your power goes out from a thunder storm in February..,2017-02-24 18:53:43,835276552048893952
I'm practicing for Bball and I hear thunder.,2017-02-24 18:53:38,835276529928142848
"Thunder lightnin n rain,thats all you gon hear see n feel bullets to the brain maybe its because my mind r maybe im just insane # rap # HipHop",2017-02-24 18:53:34,835276515076149250
# Lakers Corey Brewer is available to play against the Thunder on Friday. http://nbastartingfive.com/playerProfile.jsp?player=Corey%20Brewer …,2017-02-24 18:53:26,835276482150809600
@ Robo_Thunder,2017-02-24 18:53:17,835276444574023683
@ BullyWasHere my nigga thunder use to be the best part of the warriors game lol,2017-02-24 18:53:15,835276434306301952
Wish I was in Toronto for # sousatzkamusical last dress rehearsal. In a theatre in Thunder Bay for Q2Q on another show tonight # theatre,2017-02-24 18:53:12,835276422876971008
# OKCThunder # ThunderUp # WeAreThunder Live Coverage: Thunder vs. Lakers http://dld.bz/f25sM pic.twitter.com/ePe7XlBXct,2017-02-24 18:53:06,835276398822625281
Thunder fans: Billy Donovan is aware Taj is better than Domas. i promise you. relax.,2017-02-24 18:53:06,835276396356374532
Lakers vs thunder,2017-02-24 18:52:55,835276350625755136
"I'm liking the move the Thunder made adding a couple quality ""bulls"" to bolster some young Thunder cats # ThunderUp # NBAtrades",2017-02-24 18:52:53,835276341855596544
It's supposed thunder real bad tonight,2017-02-24 18:52:41,835276290936680449
Should have stayed at work. Thunder storm and 2 scared dogs,2017-02-24 18:52:39,835276285119238144
Thunder in February... I'll take it! Love it,2017-02-24 18:52:28,835276236674969600
"Jolteon (57.8%-15/8/3,Thunder Shock/Discharge) until 16:17:58 (28m 17s)http://maps.google.com/maps?q=33.93468385225978,-118.03137089679211 …",2017-02-24 18:52:27,835276233990672385
Thunder ███ ]▄▄▄▄▄▃ ..▂▄▅█████▅▄▃▂ [███████████████] ◥⊙▲⊙▲⊙▲⊙▲⊙▲⊙◤,2017-02-24 18:52:20,835276205557485568
Sunset + Thunder show. # sun7loverspic.twitter.com/4BZ3XJCjHj,2017-02-24 18:52:18,835276196703264768
you do know the thunder blew a 3-1 lead right? Lmao,2017-02-24 18:52:15,835276184434900992
All 3 of these thunder cats can score looks like good value for 1 Taj & Doug,2017-02-24 18:52:11,835276166583971840
"Happy to saw Taj & McDermott in a better situation. Not sure what the Bulls were thinking, but this should only help the Thunder",2017-02-24 18:52:10,835276162721005568
Thunder game anyone?,2017-02-24 18:51:57,835276108685848576
"Wow, major lightning - and now there's thunder!",2017-02-24 18:51:52,835276087781380100
Plus the rain and damn thunder doesnt help,2017-02-24 18:51:50,835276078801432578
"should probably just be a @ FeralOhms /comets on fire/ @ HeronOblivion /Howlin Rain mega tour, a la the Rolling Thunder Revue",2017-02-24 18:51:48,835276070660235266
Here comes the thunder # stormsmakeme.....,2017-02-24 18:51:39,835276031267377152
Lakers Vs. Thunder Preview: L.A. Begins Revamped Outlook Following All-Star... # Lakers https://fanly.link/1b2ac8f838 pic.twitter.com/47pnY19weM,2017-02-24 18:51:37,835276025521188871
I love thunder storms so much,2017-02-24 18:51:34,835276011860291584
War Thunderしてたらなんか寝てた,2017-02-24 18:51:28,835275985842925568
"Tonight's Thunder starters: Falkovsky, Riley, Henry, Pollack, Kravchenko with McCollum in net. # ECHL",2017-02-24 18:51:18,835275946273943552
Billy Thunder and the Night Gate http://dlvr.it/NT2yll,2017-02-24 18:51:12,835275920596332544
Billy Thunder and the Night Gate http://dlvr.it/NT2yg8,2017-02-24 18:51:10,835275909640790016
Billy Thunder and the Night Gate http://dlvr.it/NT2yg5,2017-02-24 18:51:10,835275909313650688
Marc Johnson's Thunder Trucks Jamboree http://dlvr.it/NT2yS8 pic.twitter.com/9bR6Qwkn6l,2017-02-24 18:51:09,835275905547173888
Marc Johnson's Thunder Trucks Jamboree http://dlvr.it/NT2yVq pic.twitter.com/xcRlBOIIca,2017-02-24 18:51:08,835275901273174016
Today's NBA Picks: 8:08 PM EST - Los Angeles Lakers vs. Oklahoma City Thunder - 19 PICKS AVAILABLE (1 FREE) - https://www.cappertek.com/todaysPicks.asp?d=nba-basketball-betting-predictions-los-angeles-lakers-vs-oklahoma-city-thunder-friday-february-24-2017&gameID=88788 …,2017-02-24 18:51:04,835275886110765056
"There's a huge thunderstorm where I am right now, and I love it. Something about the roar of thunder and torrential rain is just sublime.",2017-02-24 18:51:04,835275885871771648
This thunder >>>,2017-02-24 18:51:03,835275883581562880
"Gosh, i love the sound of rain and thunder",2017-02-24 18:50:56,835275852212482050
NBA Picks For Tonight: Wizards Grizzlies Raptors Bulls Jazz Thunder Timberwolves Hawks Nuggets Spurs Overall so far: 554-302,2017-02-24 18:50:55,835275848676741120
# NBA Traspaso Bulls-Thunder: ¿Qué gana/pierde cada equipo? http://www.capitaldeporte.com/nba-traspaso-bulls-thunder/ …,2017-02-24 18:50:53,835275840363630592
"Rain/wind/thunder as cold front moves through early Sat. am with temps falling all day & snowflakes possible by eve; dry, cold Sunday. pic.twitter.com/yiL16d1Z6e",2017-02-24 18:50:50,835275828602802177
# EveryPlayCounts in tonight's @ okcthunder game! Grab @ TheDriveApp & pledge $1 to @ ServeMoreOK for every Thunder 3: http://buff.ly/2lDPTmI pic.twitter.com/wqvLVQUSSu,2017-02-24 18:50:48,835275819979255808
ThundercatのThunderちゃん,2017-02-24 18:50:47,835275815067660288
Live Coverage: Thunder vs. Lakers http://www.oklahoman.com/article/5539296?access=c470d1b89352f7f03bce3acd9e830c91&utm_medium=social&utm_source=twitter_theoklahoman …pic.twitter.com/8ClCLPC4fD,2017-02-24 18:50:47,835275814522486784
I heard thunder and I can hear the rain falling. # Brampton @ adamstiles # onstorm,2017-02-24 18:50:43,835275798340907008
Los Lakers jugarán con las camisetas alternativas Hollywood Night esta noche contra OKC Thunder. ¿No son acaso... http://fb.me/66DtKAQtK,2017-02-24 18:50:43,835275795887173632
why don't the thunder send him to the D league?,2017-02-24 18:50:40,835275785456009217
Thunder and lightning in February... is this real life?,2017-02-24 18:50:33,835275756469121024
A severe thunderstorm watch is in effect til 2 am for the western two-thirds of Ohio. Rumbles of thunder possible around here after midnight pic.twitter.com/S7mAuPaZfT,2017-02-24 18:50:29,835275739561922560
Thunder storms are dope af,2017-02-24 18:50:24,835275718774910976
Looking for something to do tonight? Then stop by FatCats and experience Thunder Alley! pic.twitter.com/96WXtkAva4,2017-02-24 18:50:10,835275661241683968
It's a dang good day to # BeatLA! Let's GO # Thunder! # WeAreThunder # ThunderUp # OKCvsLAL # Lakers @ okcthunder @ Lakerspic.twitter.com/7AZw5r5fcs,2017-02-24 18:49:52,835275585802940416
"Semua member exo k, wooyoung, thunder, rome, boywill, siwon, top, kth dsb https://twitter.com/IndoKoreaRP/status/835197352155607040 …",2017-02-24 18:49:46,835275558015492097
"Jolteon (57.8%-15/8/3,Thunder Shock/Discharge) until 16:17:58 (28m 17s)http://maps.google.com/maps?q=33.93468385225978,-118.03137089679211 …",2017-02-24 18:49:41,835275537270505472
HOY EN LA # NBA me gustan ThundER RL BULLS ML MEMPHIS ML,2017-02-24 18:49:30,835275491192016897
Thunder: Taj Gibson and Doug McDermott available to play Friday vs. Lakers (ESPN) http://ift.tt/1i7kfoz,2017-02-24 18:49:25,835275468639199232
I liked a @ YouTube video from @ jengartv http://youtu.be/lwNHvtsB9Xw?a War Thunder Lucky Jengar Ep 1: Beaufighter Mk VIc [luckster],2017-02-24 18:49:22,835275458518347784
McBuckets. # Thunder pic.twitter.com/Oxu4YV6QH8,2017-02-24 18:49:20,835275451325104128
Thunder: Taj Gibson and Doug McDermott available to play Friday vs. Lakers (ESPN) http://espn.go.com/nba/,2017-02-24 18:49:12,835275417519079424
it is legit thunder storming in February wth,2017-02-24 18:49:05,835275386749595648
thunder that will fire him is still busy on push up,2017-02-24 18:48:59,835275363165040640
Is thunder pup making it rain on you Kristin?,2017-02-24 18:48:56,835275350909210625
"A Hitmonchan has appeared! IV: 62.2%(8/8/12) Moves:(Bullet Punch/Thunder Punch)Time left: (29m 11s).http://maps.google.com/maps?q=30.60987596226015,-96.34724436895664 …",2017-02-24 18:48:40,835275281766178816
and I got a surefire feelin country thunder is right around the corner pic.twitter.com/ZIwhmT6TSA,2017-02-24 18:48:27,835275225734447104
"Thunder and lightning still happening near Georgian Bay, ONTARO, Canada. @ontario_storm",2017-02-24 18:48:24,835275212694384640
The Thunder broke up the NBA's best dance team at the trade deadline - For The Win http://news.google.com/news/url?sa=t&fd=R&ct2=us&usg=AFQjCNGoAL9YByaVdhuzJBycLbqoH1sqEg&clid=c3a7d30bb8a4878e06b80cf16b898331&ei=o8WwWICvGpWX6QSw07zwBw&url=http://ftw.usatoday.com/2017/02/nba-trade-deadline-2017-oklahoma-city-thunder-cameron-payne-russell-westbrook-pregame-dancing-videos …pic.twitter.com/i0m8QarKWl,2017-02-24 18:48:21,835275203076841475
NBA free money... Oklahoma City Thunder -10.,2017-02-24 18:48:20,835275196827385856
# radioNBA Thunder: Taj Gibson and Doug McDermott available to play Friday vs. Lakers (ESPN) Ecouter la radio des F… http://ift.tt/2lDOqNh,2017-02-24 18:48:18,835275189105672192
The Thunder broke up the NBA's best dance team at the trade deadline - For The Win http://news.google.com/news/url?sa=t&fd=R&ct2=us&usg=AFQjCNGoAL9YByaVdhuzJBycLbqoH1sqEg&clid=c3a7d30bb8a4878e06b80cf16b898331&ei=o8WwWICvGpWX6QSw07zwBw&url=http://ftw.usatoday.com/2017/02/nba-trade-deadline-2017-oklahoma-city-thunder-cameron-payne-russell-westbrook-pregame-dancing-videos …pic.twitter.com/XRP3X90oZV,2017-02-24 18:48:17,835275185053827073
oh yea bring on the snow thunder babby https://twitter.com/karlbohnaktv6/status/835274702868385792 …,2017-02-24 18:48:15,835275175750926337
Thunder: Taj Gibson and Doug McDermott available to play Friday vs. Lakers (ESPN) It's unbelievable! pic.twitter.com/RNwTzuZ0Ku,2017-02-24 18:48:13,835275168188596226
I've just unlocked Thunder in Heaven achievement in Paradise Island 2! http://tinyurl.com/q3qf2ej # GameInsight # ParadiseIsland2,2017-02-24 18:48:09,835275150664794113
【最新ゲーム】War Thunder スペシャルエディション（オンライン専用） http://game-site.net/?p=27275 # ゲーム # game,2017-02-24 18:48:05,835275136899014656
"i cried like thunder ""i hate you September""",2017-02-24 18:47:59,835275110579908610
Doug McDermott warms up for the # Thunder. pic.twitter.com/iguYb7ub9g,2017-02-24 18:47:45,835275051440160769
rain and thunder what a great end to a week,2017-02-24 18:47:40,835275030028247040
"Mareep (53.3%-15/8/1,Thunder Shock/Discharge) until 16:09:50 (26m 16s)http://maps.google.com/maps?q=33.92543474973971,-118.02396072846317 …",2017-02-24 18:47:38,835275019907448832
Love thunder storms,2017-02-24 18:47:25,835274968237768705
Let the Thunder Roll!!!! https://twitter.com/royceyoung/status/835264547418157056 …,2017-02-24 18:47:18,835274938579881984
Panthers warming up for tonight's playoff game with the Tapestry Thunder Hawks. Game time 7:00PM. # PrepTalkLive @ centercourt42pic.twitter.com/t5ER57rH8i,2017-02-24 18:47:18,835274937854214145
"Raise your words, not voice. It is rain that grows flowers, not thunder. - Rumi # quote",2017-02-24 18:47:09,835274900029980677
"Tonight, lots of lightning but no thunder. Odd.",2017-02-24 18:47:08,835274896439656448
yet Gibson and McDermott will play for the thunder. Does this organization do anything right at all??,2017-02-24 18:46:53,835274831432151040
Headin to the Thunder game with Kylee Bee,2017-02-24 18:46:51,835274823035195392
Uh ohhhhh... THUNDER,2017-02-24 18:46:47,835274808933888000
Hosting finals @ PLougheedCBE! First up - Thunder Jr. Girls playing Ernest Morrow # gothunderpic.twitter.com/sc7JBZ6bOB,2017-02-24 18:46:41,835274781956026368
I've just unlocked Thunder in Heaven achievement in Paradise Island 2! http://tinyurl.com/q3qf2ej # GameInsight # ParadiseIsland2,2017-02-24 18:46:41,835274780819402753
not a fan of February thunder... so weird,2017-02-24 18:46:29,835274730370387969
dude winter thunder and lightning feels like Armageddon,2017-02-24 18:46:22,835274705053442048
A report of just before 6 eastern time of freezing rain and THUNDER at Newberry!,2017-02-24 18:46:22,835274702868385792
Me ha gustado un vídeo de @ YouTube de @ phlydaily (http://youtu.be/c38kajvfn2M?a - Why would you do this to me? (War Thunder Tanks Ebola,2017-02-24 18:46:21,835274697080258560
"First flash of lightning, first rumble of thunder. Tri-state stay safe!!!",2017-02-24 18:46:19,835274692135092224
I liked a @ YouTube video http://youtu.be/Z-4YRKrA1vk?a Thunder Bear Plays Overwatch,2017-02-24 18:46:18,835274687458512896
I liked a @ YouTube video from @ phlydaily http://youtu.be/c38kajvfn2M?a Why would you do this to me? (War Thunder Tanks Ebola Gameplay),2017-02-24 18:46:13,835274666998640640
"Yep, I'm in south Cambridge and it's raining hard with thunder and lightning",2017-02-24 18:46:12,835274662326202369
"girmîn 雷鳴(raimei, thunder)",2017-02-24 18:46:05,835274631812546563
"""When the thunder rolls....and the lightning strikes...."" # WeatherManBeast",2017-02-24 18:46:01,835274613630234624
Anyone who is under a severe thunder storm.. stay safeeee! <3,2017-02-24 18:45:58,835274601118773248
"Turkey, Taj, McBuckets all playing tonight for the Thunder # ThunderUp",2017-02-24 18:45:53,835274579438366720
I'm really hearing thunder rn,2017-02-24 18:45:46,835274552661921792
Nothing like thunder and lightning while running a mile away from home!,2017-02-24 18:45:45,835274549340090369
Hiding from the storm outside with my Thunder Buddy. # selfie # blackandwhite # tgif # chinchilla… https://www.instagram.com/p/BQ6cu-PlM3p/,2017-02-24 18:45:38,835274519908659204
Pretty stoked about this first thunderstorm of the year. It's been almost 5 years since I've witnessed thunder... http://fb.me/6clQn9iql,2017-02-24 18:45:38,835274518063112193
Dougie McBuckets warming up. Says he and Taj Gibson planning to play tonight for # Thunder pic.twitter.com/NMbN1HZxVn,2017-02-24 18:45:34,835274501931876353
The grace of God got them a ring. Didn't have to play the Spurs or thunder and played a cavs team without kyrie and love,2017-02-24 18:45:19,835274436999856129
Sound of the drums Beating in my heart The thunder of guns Tore me apart You've been Thunderstruck # lyrictweetthroughwinter,2017-02-24 18:45:13,835274412240809984
Lakers Vs. Thunder Preview: L.A. Begins Revamped Outlook Following All-Star Break # nba @ LakersNation: The entire… http://dlvr.it/NT2tWL pic.twitter.com/Ze3Kb4u1w3,2017-02-24 18:45:08,835274394687545344
Line Update: Oklahoma City Thunder are now -10.5 from - vs Los Angeles Lakers recorded at 06:45 # SportsBetting # NBA # Basketball,2017-02-24 18:45:08,835274392254951424
Girls 14U Tier 2 Buffalo Bisons vs RSL Thunder live @6:45 # HCCup http://ow.ly/yIer309kG7B pic.twitter.com/UpTLhdqVra,2017-02-24 18:45:08,835274392158502914
Some nice thunder and lightning happening here in # MiltonON right now. In February ¯\_(ツ)_/¯,2017-02-24 18:45:08,835274390954704897
My Mom grew up in Ontario & she's terrified of thunder now cuz of all the storms omg,2017-02-24 18:45:07,835274387158773760
The Thunder have hit the ice! pic.twitter.com/q1xO7Frxzn,2017-02-24 18:45:02,835274367152050181
Let's play a game called how many shows will it take for Hensley to notice that I keep turning up the volume on my distant thunder :),2017-02-24 18:44:50,835274316484861952
LOVE BY DAWN # book 2 in the Blue Thunder series # asmsg # kindle # ibook # ian1 http://spangaloo.com/books.php?bid=6 pic.twitter.com/HZkJRb2K2N,2017-02-24 18:44:30,835274233068597250
Thunder storm is rolling in. <3,2017-02-24 18:44:30,835274231151804416
"Raise your words, not your voice. It is rain that grows flowers, not thunder. ~ Rumi",2017-02-24 18:44:16,835274176495747073
Thunder and lightning in February never thought I'd see the day # Canadian,2017-02-24 18:44:13,835274161614385152
"Mareep #179 has appeared! Available until 07:13:12pm (28m 58s). http://maps.google.com/maps?q=40.54469309569471,-74.14092458646617 … Thunder Shock / Body Slam 37.78% (6/10/1)",2017-02-24 18:44:07,835274138239578112
"Stand by for the reveal of our 2017 robot ""Jimothy Thunder"". Catch it live tomorrow on @ FirstUpdatesNow !! # omgrobotspic.twitter.com/fDBwt4js8y",2017-02-24 18:43:55,835274088310521856
"Did you get thunder, lightening and downpour in your area? This was mild compared to some of what hit in Sarawak. http://fb.me/1JPqCFuBW",2017-02-24 18:43:40,835274022678118404
"# onstorm @ Lyndsay_CTV # Stormhour video shows the thunder storm going through the Kitchener-Waterloo tonight, taken west side of Kitchener pic.twitter.com/SJ44jreyi9",2017-02-24 18:43:39,835274019343577088
Here we come Toronto. Now if only this February thunder storm would let up so we can see the road.,2017-02-24 18:43:37,835274010401329152
"Mareep (53.3%-15/8/1,Thunder Shock/Discharge) until 16:09:50 (26m 16s)http://maps.google.com/maps?q=33.92543474973971,-118.02396072846317 …",2017-02-24 18:43:34,835273997117894656
"not only did i just nap and wake up thinking it was mornin, i napped through a thunder and hail storm",2017-02-24 18:43:31,835273987596894210
Random rumble of thunder,2017-02-24 18:43:23,835273953581105155
Lightning and reason in February with thunder... umm okay Canada. Sure.,2017-02-24 18:43:19,835273935121960960
"Thunder scares me, I need a hug",2017-02-24 18:43:15,835273917082251264
