text,date,id
"Pikachu (93.3% 15/13/14, Thunder Shock / Discharge) has appeared! Available until 16:24:25 (9m 11s). http://maps.google.com/maps?q=34.0341869013964,-117.7540590636244 …",2017-04-10 19:15:14,851574322783059968
[4/10]: Jushin Thunder Liger def. Missile Assault Man via submission after a sharpshooter. The crowd came unglued for this match. (13:04),2017-04-10 19:15:02,851574270690045953
Literally I couldnt sleep last night and the thunder kept waking me up I don't know how JAMES Could sleep so peacefully,2017-04-10 19:15:00,851574263714897920
"if it's been a day, just watch this video of me being attacked by the thunder pic.twitter.com/eteB2RuDr0",2017-04-10 19:14:57,851574252079861760
"Topic Thunder Tropic Thunder? I forget what it's called already, but we're watching it.",2017-04-10 19:14:54,851574237206908929
He did break a record..... Most triple doubles in a season.... He did give the thunder a chance to win a title.... https://twitter.com/osielgarza73/status/851568534907957248 …,2017-04-10 19:14:48,851574212661739520
"New fragrance ""Thunder & Lightning"" is now available!! https://www.etsy.com/listing/509820276/thunder-lightning-inspired-by-lightning …",2017-04-10 19:14:48,851574211307069440
Just think KD is a former mvp the two best players this year are Westbrook and Harden. The thunder fucked up trading Harden,2017-04-10 19:14:38,851574172807516161
"So since I didn't go out last night bc country thunder kicked my ass, come to dos tonight plz & thx",2017-04-10 19:14:38,851574169762279424
Happy # Monday evening to all! Beautiful day&then after lunch there was a very dramatic downpour with lightning&amp;thunder! Enjoy the night! pic.twitter.com/oVoiuae7pf,2017-04-10 19:14:37,851574167770148866
Bersa Thunder 9 Ultra Compact PRO + Catlaser @ bersaucantrust @ BERSAUSA_EAGLE @ condicionpablo @ fullaventura @ catlaser @ clubdearmas @ NRApic.twitter.com/9qQgMT77aq,2017-04-10 19:14:30,851574138225516544
"I'm at Value Village in Thunder Bay, Ontario https://www.swarmapp.com/c/9R7eiK4CblK",2017-04-10 19:14:26,851574122513653762
every time i hear really loud thunder pic.twitter.com/WwPk7MfL2K,2017-04-10 19:14:20,851574096324382721
Watching the Spring Game again. Havent felt this good at RB since @ CyrusGray32 and @ Cmike33 were runnin the rock together # Thunder&Lightning,2017-04-10 19:14:17,851574081338183681
"Mareep 53.3% (12/7/5/Thunder Shock/Thunderbolt) till 16:43:11 (29m 16s). lvl30+ CP:682 (L30) http://maps.google.com/maps?q=37.34431854414607,-121.9781922442729 …",2017-04-10 19:13:54,851573986655731712
THUNDER. NA NA NA NA NA THUNDER. https://twitter.com/PavlovicNBCS/status/851573746540269568 …,2017-04-10 19:13:48,851573962697973764
Cantera TW Lider: @ ManuGX_YT Co Owner: @ jojaypor Reclutador:Gabrielo Unete a Thunder whol @ TW_clanpvp,2017-04-10 19:13:40,851573928720035841
oh he'll nah I hate thunder,2017-04-10 19:13:27,851573874957398017
Coming down after some crazy thunder claps.. # wussdog.pic.twitter.com/A6VnEvcy69,2017-04-10 19:13:13,851573814693699589
because the thunder are beholden to Westbrook being selfish,2017-04-10 19:13:00,851573761119633408
Country Thunder-4 Kelli & Jasmine-0 https://www.instagram.com/p/BSuQv1kgIpd/,2017-04-10 19:12:46,851573701137113088
Vá hvað það er hámark lágkúrunar.,2017-04-10 19:12:44,851573692492546048
thunder scares tf out of me :(,2017-04-10 19:12:37,851573665472839680
"Just pulled a crazy good EX card of a Pokémon I've never heard of for my ""Blue Thunder"" Pokémon TCGO deck. CRAZY GOOD! Stay tuned...",2017-04-10 19:12:37,851573665263046657
Country thunder was good to us cant wait for next year ! pic.twitter.com/hYhvDvdeTM,2017-04-10 19:12:31,851573638239182849
That lightening was something else. The never ending thunder was one of the craziest things Ma Nature has invented!,2017-04-10 19:12:25,851573613639737344
"MVP this season, again SEASON, is Russell. Whatever happens between Thunder-Rockets in playoffs shouldn't impact it.",2017-04-10 19:12:14,851573565635874818
Fingers crossed! We didn't get any earlier during the short period of thunder. Hoping it isn't delayed for later.,2017-04-10 19:12:14,851573565182881792
Finally hearing # thunder at the @ wzzm13 studios! # wmiwx,2017-04-10 19:12:00,851573509503545344
can't decide if what i just heard was thunder or a meteorite the size of the sun crashing into campus,2017-04-10 19:11:51,851573471624691713
Not really. Guy guy it's surprisingly similar. Houston gonna beat their over under by 12-14 wins. Thunder by 1-3. But sure. https://twitter.com/mike_dyer13/status/851463063379292160 …,2017-04-10 19:11:51,851573471243096064
Help Thunder get # sponsored by @ USCellular on Pear-it’s free & easy! https://www.pearup.com/groups/thunder42820 … via @ Pear_says,2017-04-10 19:11:38,851573415593078785
but you know what comes after thunder......,2017-04-10 19:11:35,851573403186278400
Is... Is that thunder? In April? In Alberta?,2017-04-10 19:11:29,851573378297114625
I literally just felt thunder whip past my ear. It's fine.,2017-04-10 19:11:14,851573316234215424
"Raichu (37.8% 10/5/2, Volt Switch / Thunder Punch) until 16:35:36 (24m 24s). http://maps.google.com/maps?q=34.119627749696996,-117.18533992479813 …",2017-04-10 19:11:06,851573283665215493
ok first of all THIS THUNDER CAN HOP OFF REAL QUICK THANKS,2017-04-10 19:11:00,851573258507911170
"Love sleeping to the sound of rain, but the thunder be fucking me up lol",2017-04-10 19:10:59,851573250907918337
"Hitmonchan (48.9% 1/13/8) w/ Bullet Punch/Thunder Punch has appeared! Available until 06:40:04pm (29m 19s) http://maps.google.com/maps?q=43.56733602522518,-96.71407239131429 …",2017-04-10 19:10:43,851573185489326081
This thunder and rain is gonna put me smooth ass asleep,2017-04-10 19:10:35,851573150919913472
"honestly ""Let's attack aggressively"" and ""Let's smooch aggressively"" are interchangeable.",2017-04-10 19:10:28,851573124382416896
"My mom went with ""thunder ponies"" because I loved My Little Ponies. They played sports on top of the clouds.",2017-04-10 19:10:25,851573107886346240
I like you so much I can hardly breathe. I like you so much I feel like I got a thunder and lightning inside of me.,2017-04-10 19:10:21,851573091058819073
"Always gonna steal your thunder Watch me like a dark cloud On the move, collecting numbers Imma take your girl out...",2017-04-10 19:10:19,851573082787655681
The sound of thunder,2017-04-10 19:10:10,851573046368514048
I hear thunder Oh Yes I love a good thunderstorm,2017-04-10 19:10:06,851573031285776391
this thunder,2017-04-10 19:10:05,851573025472487424
oui thunder,2017-04-10 19:09:54,851572978626199553
"Mission Beach: Ampharos 15.6% (0/0/7 - Volt Switch/Thunder - s:big) til 16:36:00(26m 16s). http://maps.google.com/maps?q=32.76471930956241,-117.25222553442359 …",2017-04-10 19:09:42,851572929053696000
I will just as soon as the Rockets sweep the Thunder in round 1!,2017-04-10 19:09:41,851572926239342592
【Next Kanato's hint…】The god of thunder stupid…,2017-04-10 19:09:39,851572917926100992
Thunder up,2017-04-10 19:09:35,851572900511584257
"Mareep 73.3% (15/15/3) Thunder Shock/Discharge [Northside] 1215 25th St 51104 06:38:05pm (28m 35s) http://maps.google.com/maps?q=42.51584421084578,-96.3939693686625 …",2017-04-10 19:09:28,851572872464224257
thatgirlygirl27 : Bring on the thunder and the rain. (via Twitter https://twitter.com/thatgirlygirl27/status/851572794831892482 …) # Prepzilla,2017-04-10 19:09:26,851572861701586944
Thunder Super Fans Follow Russ On The Road http://bit.ly/2okFxaR # News9pic.twitter.com/PaEwLH2sye,2017-04-10 19:09:15,851572814444322817
That thunder just scared me so bad,2017-04-10 19:09:11,851572800741666819
Thor: Ragnarok trailer: Cate Blanchett breaks the God of Thunder http://a.msn.com/0C/en-us/BBzEMhE?ocid=st …,2017-04-10 19:09:10,851572796056588290
Bring on the thunder and the rain.,2017-04-10 19:09:10,851572794831892482
Thunder Super Fans Follow Russ On The Road http://dlvr.it/Ns36rB,2017-04-10 19:09:09,851572790805147648
I really hope the thunder beat the rockets in the first round just cause of hardens douchey comments,2017-04-10 19:09:09,851572790717296643
It's currently Light Rain with Thunder and 54F outside. pic.twitter.com/UJ1sZlLb9a,2017-04-10 19:09:08,851572785486995457
"[PKMN] Hitmonchan (Bullet Punch/Thunder Punch) [A1/D14/S2] until 16:36:58 https://www.google.com/maps?q=37.130863913716205,-121.64867505068938 …",2017-04-10 19:09:05,851572775961583617
"Fog after the storm. Previewing in rain, hail, thunder, lightening & high winds! Love this place # Muskoka # everyseason # anyseason friendspic.twitter.com/psSOAddSpd",2017-04-10 19:09:05,851572773982011393
"Mareep (42.2% 9/2/8) w/ Thunder Shock/Thunderbolt has appeared! Available until 06:37:57pm (28m 50s) http://maps.google.com/maps?q=43.53053441006201,-96.79010133770744 …",2017-04-10 19:09:04,851572771729661958
Thunder Pile!,2017-04-10 19:08:56,851572737361313792
"Heck of a weekend of new experiences: 5-hr long timeshare meeting, thunder from the down under, the hypnotized comedy show, the flower drink",2017-04-10 19:08:43,851572682772500480
Fuck. Where's my thunder buddy?,2017-04-10 19:08:32,851572634806628358
First 'Thor: Ragnarok' Trailer Debuts: Cate Blanchett Breaks the God of Thunder http://ew.com/movies/2017/04/10/thor-ragnarok-trailer-cate-blanchett/ … vía @ ew,2017-04-10 19:08:29,851572621292564480
"With two outs in the seventh and LSA up 9-2, we're called for thunder. I ...",2017-04-10 19:08:28,851572618826264576
Push through thunder,2017-04-10 19:08:25,851572605509402624
"""What you see is a man who resembles the Thunder God."" https://twitter.com/UnhingedBarbie/status/851572210317885442 …",2017-04-10 19:08:23,851572598513250304
that thunder,2017-04-10 19:08:21,851572590716100608
"Jolteon (26.7%) Volt Switch/Thunder 0/10/2 (ATK/DEF/STA) Despawns at 16:36:45 https://maps.google.com/maps?saddr=My+Location&daddr=34.20079521232621,-118.55266780586646 …",2017-04-10 19:08:15,851572566221303810
"Dear booms, go aways! Big ears mean listen for thunder booms. Hate u booms. # dogs # rescuedogpic.twitter.com/Jy8DlhSDTN",2017-04-10 19:08:10,851572545073684480
"Get Here! Mareep |(8.9%)|(0/4/0) Thunder Shock/Discharge til:(07:35:49pm)|(27m 49s) # BRiverUpTownRareshttp://maps.google.com/maps?q=34.01458597574602,-81.07706106085787 …",2017-04-10 19:07:59,851572496839172096
Thunder thunder thunder,2017-04-10 19:07:58,851572492925841408
Royal Thunder Guitarist Josh Weaver on The MetalSucks Podcast #183 http://moviesandcomics.com/index.php/2017/04/10/royal-thunder-guitarist-josh-weaver-on-the-metalsucks-podcast-183/ …pic.twitter.com/VCU2fsDSfn,2017-04-10 19:07:48,851572450559238145
Here comes more thunder storms here in HOLLAND,2017-04-10 19:07:48,851572449934290945
"Mareep 57.8% (11/0/15/Thunder Shock/Body Slam) till 16:37:06 (29m 21s). lvl30+ CP:248 (L11) http://maps.google.com/maps?q=37.36615725092304,-121.97650400015782 …",2017-04-10 19:07:44,851572434960433152
Thunder up,2017-04-10 19:07:31,851572381319647232
"48.9% Mareep! (8,1,13) Move1: Thunder Shock Move2: Discharge Available until 04:36:46pm (29m 14s). http://maps.google.com/maps?q=48.46620064135354,-123.35785910662514 …",2017-04-10 19:07:31,851572379486625792
WE BELONG TO THE LIGHT WE BELONG TO THE THUNDER WE BELONG TO THE SOUND OF THE WORDS WE'VE BOTH FALLEN UNDER pic.twitter.com/Jx6SfOg4F4,2017-04-10 19:07:30,851572376714321921
holy shit lightning just struck by so close to my house and the thunder was so loud ahhhhh,2017-04-10 19:07:27,851572364399845376
"Literal thunder thighs, i wanna go deaf when you walk~",2017-04-10 19:07:23,851572346985099267
"and the Thunder were projected to win maybe 35 games. What's you point, cause that one is moot",2017-04-10 19:07:09,851572289611087872
"I wished if exo had an mv for ""thunder"", I bet it would had been a big hit",2017-04-10 19:06:55,851572228491804676
| Raiden | # Raiden # Thunder # MK # MortalKombat https://www.instagram.com/p/BSuQEDaggok/,2017-04-10 19:06:48,851572198838030337
This thunder,2017-04-10 19:06:48,851572197609046023
Holy thunder,2017-04-10 19:06:31,851572130248577024
Has anyone heard any thunder today? pic.twitter.com/Ahs4tQ9NjH,2017-04-10 19:06:13,851572054914736130
Country thunder 2018 already in the works w/ @ Lauren_RoseH,2017-04-10 19:06:12,851572049927585792
"Mareep IV:84.4%(15/14/9) Move Set: Thunder Shock/Discharge Available until 19:27:12 (21m 3s). http://maps.google.com/maps?q=27.91182817687361,-82.52479855831274 …",2017-04-10 19:06:08,851572032399691776
Fast Arrest in Robbery Attempt: THUNDER BAY – CRIME – Thunder Bay Police uniformed officers… https://goo.gl/fb/gMUNq7,2017-04-10 19:06:08,851572029828587523
"Thunder rolling in the distance, rain hitting the window,and the heavenly scent of spring rain hitting my senses. # writerslife # amwriting",2017-04-10 19:06:03,851572010752802818
"When the rise and thunders roar I will soar with You above the storm Father you are King over the flood I will be still, know You are God.",2017-04-10 19:05:58,851571991102599170
GTA V FUNNY MOMENTS WITH FRIENDS! - Drag Races and Pink Thunder! (Grand Theft Auto V Funny Moments): http://youtu.be/0x54TLxqz1k?a via,2017-04-10 19:05:58,851571988711837697
This run should fall already enough of the lightening nd Thunder,2017-04-10 19:05:54,851571974748991488
Kayden just had a real heart attack from the thunder,2017-04-10 19:05:45,851571936819900416
"Its not hard to understand that minus Harden and Westbrook, the Rockets are clearly a better team than the Thunder. # Westbrook4MVP",2017-04-10 19:05:43,851571925918855168
Our bats are expected to bring the thunder. https://twitter.com/brianwilkes59wx/status/851562751080222721 …,2017-04-10 19:05:34,851571888040148992
Tropic Thunder underrated,2017-04-10 19:05:28,851571865529323520
Help Thunder get # sponsored by @ USCellular on Pear-it’s free & easy! https://www.pearup.com/groups/thunder42820 … via @ Pear_says,2017-04-10 19:05:21,851571836068536320
When it's hot asf I be wishing for a thunder storm to happen,2017-04-10 19:05:18,851571820482449408
Mi è piaciuto un video di @ YouTube: http://youtu.be/ysvTfgmP-_0?a Rocksmith 2014 Kiss - God of Thunder DLC (Bass) 100%,2017-04-10 19:05:06,851571773770477568
"as in, 27yo LeBron with these Thunder racks up crazy usage but can afford to slack on D. 27yo LeBron on these Rockets gets TONS of assists.",2017-04-10 19:05:03,851571757542760451
That thunder was wicked,2017-04-10 19:05:02,851571753780477957
"“Raise your words, not voice. It is rain that grows flowers, not thunder.”",2017-04-10 19:05:01,851571752153079808
"Raichu (51.1% 1/7/15, Spark / Thunder Punch) has appeared! Available until 16:34:15 (29m 18s). http://maps.google.com/maps?q=34.03856364589535,-117.66388120796722 …",2017-04-10 19:04:57,851571732087398400
Watching @ Noahsyndergaard stealing the @ Phillies quad for a joyride during warmups just made my day! # thor # thunder # lgm,2017-04-10 19:04:46,851571689121034240
No obviously I was talking about the Thunder you know had best record of all time then blows a 3-1 then goes out and buys another MVP.,2017-04-10 19:04:45,851571683907469312
"Electabuzz 55.6% IV (13/8/4) with Thunder Shock & Thunder Punch in Lake City til: 07:32:18pm (27m 50s). http://maps.google.com/maps?q=33.85809929845229,-79.75186042940366 …",2017-04-10 19:04:33,851571634423164929
WHERE'S MY THUNDER BUDDY,2017-04-10 19:04:33,851571633114550272
OKL starters Alex Caruso Reggie Williams Josh Huestis (Thunder) Daniel Hamilton (Thunder draft rights) Dakari Johnson (Thunder draft rights),2017-04-10 19:04:23,851571589862785024
That thunder scared me,2017-04-10 19:04:21,851571581327462402
I'm so scared of thunder,2017-04-10 19:04:20,851571579632975873
"LeBron probably won't win MVP but consider this: the Rockets, Thunder, Spurs would trade Harden, Westbrook, Leonard for him in a NY minute.",2017-04-10 19:04:20,851571578102050818
omg I love thunder,2017-04-10 19:04:07,851571523370582018
"Thunder Creek adds Altorfer to dealer network covering Illinois, Iowa, Missouri http://buff.ly/2orgqp0 pic.twitter.com/ZP3YYSf2ad",2017-04-10 19:04:05,851571514730262528
YAS LAY THAT THUNDER ON MEEEE,2017-04-10 19:03:59,851571491334496256
WITH A CRIT THUNDER AND THE LAST TWO WEEDS :-:,2017-04-10 19:03:58,851571484564877313
after thunder and rain the sun is shining so bright rn,2017-04-10 19:03:56,851571479850479617
Rain and thunder plus good music,2017-04-10 19:03:53,851571465061380099
"""I'm the real MVP. Cash me outside"" -Westbrooks entire MVP Speech. # MVP # Thunder",2017-04-10 19:03:49,851571447411683328
country thunder 2017 could not have been any better pic.twitter.com/PwQRWOarQ3,2017-04-10 19:03:31,851571371750473728
My thunder https://twitter.com/hoopmixonly/status/851215249831276544 …,2017-04-10 19:03:25,851571348673622017
"""That's me...The Mighty Thor. The God of Thunder! Or at least I used to be. Hold up. Let me rewind for a minute...""",2017-04-10 19:03:22,851571335583199232
i know its crazy! Thunder and lightning too!,2017-04-10 19:03:20,851571326796083201
@ EBraeden ...thanks for the Thunder Bay shout out today on Y&R,2017-04-10 19:03:19,851571324124311553
I hear the thunder rumbling... I'm out!,2017-04-10 19:03:19,851571324082208768
"I'm low key geeked af that I'm gonna see Keith Urban, Florida Georgia Line, and so many other good singers at country thunder this summer",2017-04-10 19:03:17,851571313680494592
THUNDER - SYSTEM 歌詞 http://s.ameblo.jp/miyu0728cbr/entry-11981807782.html …,2017-04-10 19:02:57,851571232155738113
"@ lauramarano Okay, I'm afraid of thunder. There was one while I was writing to you TE AMOOO!",2017-04-10 19:02:48,851571190946824192
Thunder >>>>>>>>,2017-04-10 19:02:41,851571164707205122
Hulk Hogan Thunder Mixer http://www.poprewind.com/hulk-hogan-thunder-mixer/?utm_source=ReviveOldPost&utm_medium=social&utm_campaign=ReviveOldPost …,2017-04-10 19:02:40,851571161058099200
Nothing is more calming than laying in bed listening to the thunder,2017-04-10 19:02:40,851571157727891456
"Raise your words, not voice. It is rain that grows flowers, not thunder. - Rumi # quote",2017-04-10 19:02:27,851571105236226048
"I'm at Esso in Thunder Bay District, ON https://www.swarmapp.com/c/ltEt40F39aA",2017-04-10 19:02:24,851571092305195008
"You know you're in the PNW when there is wind, hail, rain, thunder & lightning, and sunshine all within one hour",2017-04-10 19:02:17,851571062982590464
Reaction 2: 2017 WCF warriors vs thunder...thunder win in 6 and go on to win finals with a sweep of Washington????,2017-04-10 19:02:16,851571057811173381
can't wait for thunder,2017-04-10 19:02:15,851571056305467392
"Humor is the way to my heart. Amongst a laundry list of other things, but let's not steal humor's thunder here.",2017-04-10 19:01:55,851570970582294529
A little Elvira action from Saturday night from the VIP SRP tent at Country Thunder!… https://www.instagram.com/p/BSuPf-ZB5LX/,2017-04-10 19:01:53,851570960696082432
"It's going to be Rain/Thunder tomorrow! High 21°C, low 18°C. # fb",2017-04-10 19:01:48,851570942153240577
TROPIC THUNDER IS ON NETFLIX!!!!!!,2017-04-10 19:01:46,851570932195893250
hola mayor yo siempre estoy en tus directos ye acuerdas de dovhaking en War Thunder soy yo,2017-04-10 19:01:36,851570889279799297
I liked a @ YouTube video http://youtu.be/98uU5sNRDFc?a WeatherSTAR XL - Sleet & Thunder,2017-04-10 19:01:15,851570801484734465
If yoouever wanted something on Oklahoma Sooners or OKC Thunder i could try lol,2017-04-10 19:01:14,851570800469704705
"Take Westbrook off the thunder and they are a lottery team, he single handily led them to a playoff berth",2017-04-10 19:01:02,851570746681954304
I need those thunder thighs plus size,2017-04-10 19:01:01,851570744664485889
"By the time you hear thunder or see lightning, you’re already in danger. http://weather.gov/lightning # LightningSafetypic.twitter.com/SvnFPdbT7I",2017-04-10 19:01:01,851570743993356289
"Mareep available until 05:13:36pm (12m 45s). Thunder Shock / Body Slam (77.8% - 8/13/14) http://maps.google.com/maps?q=40.53144346260769,-105.11561717534268 …",2017-04-10 19:00:52,851570708182421505
Thunder see rise in attendance http://buff.ly/2p0kKtl,2017-04-10 19:00:50,851570698413854724
JUST IN! Thunder From Down Under | Hu Ke Lau | Chicopee MA http://bit.ly/2o1fdnI pic.twitter.com/wDQMG0tZuG,2017-04-10 19:00:48,851570690687991808
Mi è piaciuto un video di @ YouTube: http://youtu.be/hBvDBhb0ORU?a Kiss God of Thunder Bass Cover with Notes and Tablature,2017-04-10 19:00:46,851570681867317248
昨日の衣装はズルくないですか…あんなパツンパツンで……たまにたわわで………ズルくないですか………,2017-04-10 19:00:41,851570659989663744
"He headlined Country Thunder, and now he's making his way back to Phoenix. Dierks Bentley to bring tour in August http://azc.cc/2nVkQka pic.twitter.com/dcBSMgBY6X",2017-04-10 19:00:24,851570590783873024
Y'all hold it Down in the H I'll be knocking thunder fans out here in Oklahoma,2017-04-10 19:00:22,851570581245919233
@ ImAllexx i was watching one of ur videos and thunder happened outside my house but for like a minute i just thought it was a sound effect,2017-04-10 19:00:11,851570535427432448
BY FIRE BY THUNDER 2 – LATEST NOLLYWOOD FULL MOVIE http://ghtube.com/by-fire-by-thunder-2-latest-nollywood-full-movie/ … http://fb.me/5a3Zsyou2,2017-04-10 19:00:05,851570507896016898
7D: 140 Splash: 110 Thunder: 75 SPC: 120,2017-04-10 19:00:03,851570499746443266
There was a dog who was surrendered because she's scared of thunder and fireworks,2017-04-10 19:00:02,851570495212331009
BY FIRE BY THUNDER 2 – LATEST NOLLYWOOD FULL MOVIE http://ghtube.com/by-fire-by-thunder-2-latest-nollywood-full-movie/ …,2017-04-10 19:00:00,851570487109070849
Thunder Thighs,2017-04-10 18:59:59,851570485468987392
BY FIRE BY THUNDER 2 – LATEST NOLLYWOOD FULL MOVIE http://ghtube.com/by-fire-by-thunder-2-latest-nollywood-full-movie/ …,2017-04-10 18:59:59,851570485448126466
Omg @ YandR_CBS...Chloe landed in Thunder Bay Ontario ...thanks for the hometown shout out 🖒,2017-04-10 18:59:57,851570474287075330
We really should just do winner takes MVP when the rockets and thunder play,2017-04-10 18:59:42,851570413364805632
"G.O, Seungho, Mir, Thunder (ex integrante e irmão da Dara), e o Lee Joon (ex tbm)",2017-04-10 18:59:13,851570290861780996
"Ampharos 49.743660,6.683878 IV62 CP2204 L30 [Charge Beam/Thunder]",2017-04-10 18:59:12,851570285224636416
"Young Thunder Cat Gets Just What He Was Looking For, Disrespecting an Elder: http://youtu.be/O2Rc57WvNE4?a via @ YouTube",2017-04-10 18:59:07,851570266354446336
"A wild 69% Mareep [Thunder Shock/Thunderbolt] has appeared! Despawns at 04:28:01pm! Time left: 29m 17s. http://maps.google.com/maps?q=44.037345197023214,-123.10312044344792 …",2017-04-10 18:58:58,851570226990731264
War Thunder tanques arcade /Entre la espada y la pared # ps4 #PS4share#WarThunderhttps://www.youtube.com/watch?v=0aMB7fMwXOQ&feature=share …,2017-04-10 18:58:53,851570208594513921
Listening to Thunder like: pic.twitter.com/tnmtjO10sB,2017-04-10 18:58:51,851570198624821249
"At the end of the day, between the Rockets & Thunder... only one team has an actual chance of winning a championship this season. So..",2017-04-10 18:58:43,851570167247065088
Love the sound of thunder! # FinallySpring,2017-04-10 18:58:38,851570144136613888
"[Disney/Celebration] Mareep (73.3%) [Thunder Shock , Body Slam](29m 33s) Until 07:28:11pm. http://maps.google.com/maps?q=28.360838577857095,-81.51168041585468 …",2017-04-10 18:58:37,851570139464163330
"Pikachu (84.4% 12/12/14, Thunder Shock / Discharge) until 16:26:08 (27m 35s). http://maps.google.com/maps?q=34.126518163048225,-117.19728540118099 …",2017-04-10 18:58:27,851570099421011968
Just imagine if the Jazz had the same injury luck as the Rockets or Thunder. Mid 50 win team in my opinion.,2017-04-10 18:58:15,851570048850251776
Ahh! I wish it was thunder storming here....,2017-04-10 18:58:15,851570048154075136
Mike Ford. Dinger time. Thunder take a 1-0 lead in Quackron,2017-04-10 18:58:12,851570035365695490
lol actually a pelicans fan but take Russ off the thunder and they the worst ranked offense in the league,2017-04-10 18:58:09,851570021193191424
"on the plus side, every time I hear thunder I remember to save.",2017-04-10 18:57:50,851569941056716800
The girls varsity lacrosse game is currently under a weather delay due to distant thunder. We will update you with more here at Bob Perry.,2017-04-10 18:57:46,851569925974052864
"Carlsbad: Lanturn (62.2%IV 13/8/7 Water Gun/Thunder 1.3m/24.3kg). TTH: 04:26:57pm [29m 12s] http://maps.google.com/maps?q=33.12925934395153,-117.31247707156396 …",2017-04-10 18:57:45,851569920567529472
"Kid you not, I saw this pic, read your comment and heard thunder out my own window. It looks rather similar here lol. Good timing.",2017-04-10 18:57:33,851569871133519874
"Sitting on my condo balcony in Dorval watching a huge storm develop with lots of rain,thunder & lightning. pic.twitter.com/VqusAekJMJ",2017-04-10 18:57:25,851569839382687744
One more line of showers and thunder to plow through. Possible delay at start of Cubs game. The watch as I... http://fb.me/1yJyUXCEE,2017-04-10 18:57:15,851569795564785664
According to everyone the whole Thunder team are D League players this year.. lol,2017-04-10 18:57:10,851569775977406464
THUNDER ONLY HAPPENS WHEN ITS RAIIININGGGG,2017-04-10 18:57:05,851569753395277824
Oh boy it's raining... oh boy there's thunder and lightning... hnnnnnnngh... so good...,2017-04-10 18:57:04,851569752187314176
Having a dog with anxiety is so stressful and sad all it takes is a little thunder and she's donezo,2017-04-10 18:57:01,851569738467729413
