text,date,id
But there's no thunder just a hail storm,2017-04-10 17:26:40,851546999904194560
Taylor MI Mon Apr 10th PM Forecast: TONIGHT Thunder Storms Lo 55 TUESDAY Partly Cloudy Hi 61,2017-04-10 17:26:39,851546994136973312
YIKES! there's so much thunder!!!!!!,2017-04-10 17:26:31,851546962642042880
"Electabuzz - 96% (Thunder Shock/Thunder Punch) till 05:54:31pm (28m 4s). Found at 50 Four Oaks Crescent (Westmount) http://maps.google.com/maps?q=42.948315511213025,-81.27893922575522 …",2017-04-10 17:26:27,851546944572968960
Roseville MI Mon Apr 10th PM Forecast: TONIGHT Thunder Storms Lo 55 TUESDAY Partly Cloudy Hi 60,2017-04-10 17:26:18,851546908833320961
"Lol his team isn't way better, they're all role players that are slightly better than the Thunders. Both teams would b complete trash w/o em",2017-04-10 17:26:15,851546894199394304
Rawsonville MI Mon Apr 10th PM Forecast: TONIGHT Thunder Storms Lo 51 TUESDAY Partly Cloudy Hi 59,2017-04-10 17:26:07,851546863325110273
"Raining outside, stimming inside. # Autism # rainraingoaway # Thunder # Keeponrolling",2017-04-10 17:26:04,851546847785230338
Port Huron MI Mon Apr 10th PM Forecast: TONIGHT Thunder Storms Lo 51 TUESDAY Partly Cloudy Hi 59,2017-04-10 17:26:00,851546834115973120
"Hard rain,thunder and 16 degree temp. Drop in 20 min. .... Noblesville.",2017-04-10 17:26:00,851546833839165440
@Thunder_Digest are playoff games on FS OK? or are they just on like TNT,2017-04-10 17:25:45,851546771222257664
"@ AlexGold @ JoeyESPNBoise when Russ doesn't have a triple double, the thunder have the 3rd worst record in the NBA. 80% wins when he does",2017-04-10 17:25:43,851546760249921536
The storm luckily passed by without thunder or anything so now I can go to sleep in peace qwq,2017-04-10 17:25:40,851546750330470400
same friends who wouldn't go la la with u?! GET NEW FRIENDS 2.0! did u do big thunder?,2017-04-10 17:25:39,851546744412409856
Monroe MI Mon Apr 10th PM Forecast: TONIGHT Thunder Storms Lo 59 TUESDAY Partly Cloudy Hi 61,2017-04-10 17:25:37,851546737743454217
"The warriors are a huge market team, okc isn't. Warriors can afford to keep their stars, thunder can't as much",2017-04-10 17:25:35,851546727064711170
Did yall hear that thunder too or,2017-04-10 17:25:26,851546690070904833
it's thunder storming,2017-04-10 17:25:08,851546616305680384
"Raichu 20.0% IV (0/9/0) with Spark & Thunder Punch has spawned around Broadway until: 05:54:50pm (29m 47s). http://maps.google.com/maps?q=33.715911519065585,-78.87714286447944 …",2017-04-10 17:25:08,851546614980378628
"No help, no problem: Thunder's Westbrook makes NBA triple-double history http://ift.tt/2nW9YT1 # abcnetau # abc # news",2017-04-10 17:25:08,851546614095335424
"unknown: Mareep 91.1% (13/15/13 - Thunder Shock/Body Slam - s:tiny) til 14:53:51(28m 41s). http://maps.google.com/maps?q=33.185953290822944,-117.23339322306272 …",2017-04-10 17:25:06,851546607979970560
"Mareep IV:71.1%(15/13/4) Move Set: Thunder Shock/Discharge Available until 17:50:04 (25m 0s). http://maps.google.com/maps?q=27.92695727701998,-82.51685023186585 …",2017-04-10 17:25:03,851546593983479808
"Magnemite 31.1% (4/10/0) Thunder Shock/Magnet Bomb Available until 16:54:05 (29m 7s). http://maps.google.com/maps?q=41.900442024836266,-87.8982697939561 …",2017-04-10 17:24:59,851546576216567808
"Country Thunder peaked this year with the addition of an RV,… https://www.instagram.com/p/BSuEZL6gEZrqEFf_mI8iHtEqZzr_vPtWpawyXw0/ …",2017-04-10 17:24:49,851546535619940352
Seeing the Thunder tomorrow and hoping Russ doesn't rest.,2017-04-10 17:24:39,851546490824773634
". When I was afraid of thunder as a child, my sister told me the Man in the Moon had taken his… https://www.instagram.com/p/BSWYeeyD5Fm/",2017-04-10 17:24:36,851546480276099072
Grosse Pointe Park MI Mon Apr 10th PM Forecast: TONIGHT Thunder Storms Lo 55 TUESDAY Partly Cloudy Hi 61,2017-04-10 17:24:22,851546421652332544
So is pembroke and renfrew. Very loud thunder,2017-04-10 17:24:17,851546400450064385
Grosse Pointe MI Mon Apr 10th PM Forecast: TONIGHT Thunder Storms Lo 55 TUESDAY Partly Cloudy Hi 61,2017-04-10 17:24:15,851546391021223936
"[Thunder Bay Wthr] Current Weather Conditions In Thunder Bay, ON, Canada http://dlvr.it/Ns1bYx",2017-04-10 17:24:11,851546376928247808
Thunder may sit Russell Westbrook for back-to-back set http://bit.ly/2ospuKv,2017-04-10 17:24:07,851546357068292096
Ochapowace steals thunder at 3rd annual Senator's Cup http://ow.ly/Xd1n30aKc9A,2017-04-10 17:23:51,851546293516292096
i like the way they are looking at each other,2017-04-10 17:23:50,851546288478969860
"Listening to the thunder, Like damn Mother Nature why are you so mad",2017-04-10 17:23:48,851546279272382464
Detroit MI Mon Apr 10th PM Forecast: TONIGHT Thunder Storms Lo 55 TUESDAY Partly Cloudy Hi 61,2017-04-10 17:23:38,851546237862109184
Rain is falling in the Indianapolis area with lightening/thunder # inwxpic.twitter.com/bAvsY3b6cT,2017-04-10 17:23:35,851546224494866432
Y'all hear that thunder,2017-04-10 17:23:27,851546191800279040
# Thunder Spring is here!,2017-04-10 17:23:11,851546125173755904
So you'd give russ the MVP if the thunder are 20-62 ? I think not https://twitter.com/freshprince_md/status/851251749348405250 …,2017-04-10 17:23:10,851546119922429952
"@ ESPNBoise you guys are missing on what MVP means. Most VALUABLE. Take Russ off the thunder, and they are lottery bound!",2017-04-10 17:23:10,851546119247020032
'' Her hair reminds me of a warm safe place Where as a child I'd hide And pray for the thunder And the rain To... http://fb.me/8fzmudK1j,2017-04-10 17:23:04,851546095318597634
@ MrLukeonYT will you be continuing the Newcastle Thunder career mode?,2017-04-10 17:23:04,851546092617564160
W Thunder to akurat najbardziej przepłacony Kanter się wydaje.,2017-04-10 17:23:03,851546088435843072
"Don't chicken out. Write the Public Pulse before Easter or that infernal bunny steal your thunder, pulse@owh.com or http://www.omaha.com/opinion/public_pulse/submit/ …pic.twitter.com/88V8fFRtq4",2017-04-10 17:23:00,851546078897815552
I love the thunder,2017-04-10 17:22:52,851546042650722305
"Por lejos, la mejor serie es la de Thunder vs Rockets!! Los dos mejores jugadores de la temporada regular!! https://twitter.com/NBALatam/status/851501243067400192 …",2017-04-10 17:22:50,851546037630193665
"I FUCKING LOVE lightning & thunder, the brighter & louder the better",2017-04-10 17:22:50,851546033662427142
Ann Arbor MI Mon Apr 10th PM Forecast: TONIGHT Thunder Storms Lo 51 TUESDAY Partly Cloudy Hi 59,2017-04-10 17:22:48,851546027601649665
@ AZFerrer77 If the thunder don't get you then the lightning will.,2017-04-10 17:22:44,851546011520700416
Love thunder and lightning! As long as I'm safe.,2017-04-10 17:22:44,851546010069250049
War Thunder Авиа РБ И-185 м71 Всем привет.Рад видеть вас на стриме по тундре. На оборудование для стрима… http://dlvr.it/Ns1Zg5 pic.twitter.com/E6zhwi0FSP,2017-04-10 17:22:40,851545994080641025
I added a video to a @ YouTube playlist http://youtu.be/DAhHttbWgRo?a Take/Five Thunder,2017-04-10 17:22:32,851545959804829698
And loud thunder also,2017-04-10 17:22:24,851545925541605376
How eerie that I predicted today's thunderstorm all because I saw two dogs called Thunder and Storm playing together outside yesterday.,2017-04-10 17:22:23,851545920823013376
"ARNRPRIOR: IT'S RAININ'. Thunder n Lightning too, it seems. # WeatherWatch",2017-04-10 17:22:23,851545920281903104
"ARNRPRIOR: IT'S RAININ'. Thunder n Lightning too, it seems. # WeatherWatch",2017-04-10 17:22:22,851545920034484230
"Thunder! We heard Thunder! I bet it makes the news, and it definitely will if there is a lightning strike within 30 miles..",2017-04-10 17:22:12,851545876199649280
wow it would start to thunder when i try to take a nap,2017-04-10 17:22:02,851545834386636800
Thunder gonna surprise some ppl. https://twitter.com/MommaThatsQuis/status/851543441074991104 …,2017-04-10 17:21:49,851545780523544576
My dog keeps barking at the thunder,2017-04-10 17:21:44,851545760000770048
I honestly looked this up ahead of time knowing this EXACT thing would happen. My sincere apologies to @ _tkparker and thunder nation. https://twitter.com/_tkparker/status/851544121168846848 …,2017-04-10 17:21:40,851545743299096577
And thunder!,2017-04-10 17:21:30,851545702039552000
"Raise your words, not voice. It is rain that grows flowers, not thunder. - Rumi # quote",2017-04-10 17:21:28,851545689649811456
The thunder is very very scary !!!,2017-04-10 17:21:26,851545682137817089
Tropic Thunder is on Netflix ayyyye,2017-04-10 17:21:18,851545650907029504
Anyone else think the government invented thunder and lighting in an attempt to cover up space battles?,2017-04-10 17:21:16,851545640903495680
"[Longwood] Mareep (48.9%) [Thunder Shock , Body Slam](19m 47s) Until 05:40:53pm. http://maps.google.com/maps?q=28.687807108755475,-81.3320770692716 …",2017-04-10 17:21:06,851545597723201537
Cuz if Harden was on the Thunder you could argue he doesn't have near the stats. Russ is getting his on either team.,2017-04-10 17:21:02,851545583638781953
All pretence of productivity has gone out the window because I haven't been able to put down A Quiet Kind of Thunder all evening,2017-04-10 17:20:59,851545570493771776
"Electabuzz 42.2% (11/1/7) Thunder Shock/Thunder Punch Available until 16:50:27 (29m 31s). http://maps.google.com/maps?q=41.90520153206238,-87.97356109173776 …",2017-04-10 17:20:56,851545558405742593
Same thing with harden yea he has better players around him but that team is fighting for the place thunder are in without him https://twitter.com/dom_carrol/status/851540693877112832 …,2017-04-10 17:20:53,851545546422497280
"""The Gang goes to Country Thunder"" @howardzinser_ https://twitter.com/iasipmeme/status/851226675333476352 …",2017-04-10 17:20:42,851545500033572864
The thunder is scaring Carri,2017-04-10 17:20:41,851545494354636800
acting like Westbrook ain't getting the thunder wins,2017-04-10 17:20:21,851545412666314752
Nah there's no thunder. I actually would have preferred lightning over this wind and hail though,2017-04-10 17:20:21,851545408807501825
What's your favourite part of thunderstorms? Or do you wait for them to pass with your thunder buddy? http://fb.me/2KP7bbTdJ,2017-04-10 17:20:17,851545393393528833
Two Steps From Hell - Victory ( War Thunder - 'Victory is ours!' ) https://youtu.be/1QkFyATH6po с помощью @ YouTube,2017-04-10 17:20:16,851545389232771076
"Clever Eagles of Thunder, a pagan black metal band",2017-04-10 17:20:16,851545388632952832
Thunder Trucks presents : Gage Boyle – Thunder Trucks: Source: Thunder Trucks http://dlvr.it/Ns1XQq # skatevideo # skateboard # sk8,2017-04-10 17:20:11,851545368823070720
The kind thunder wey go fire Wenger eh! Then e go cm fire Buhari,2017-04-10 17:20:05,851545343485509632
"My Thunder Liger post in my old ""One like = One favorite wrestler"" thread is getting a lot of likes and retweets all of a sudden. Woaaaaah",2017-04-10 17:20:02,851545332769067008
this rainy thunder weather,2017-04-10 17:19:59,851545317237542912
The Thunder could easily beat the Bucks in a 7-game series,2017-04-10 17:19:58,851545313248776192
Thunder are 33-9 when Westbrook has a triple double. Goes to show how much they depend on him,2017-04-10 17:19:55,851545302607835136
Thunder and lightning in Ashton,2017-04-10 17:19:55,851545301634752512
"Magnemite - 96% (Thunder Shock/Magnet Bomb) till 05:49:10pm (29m 24s). Found at 433 Wilkins St (Highland) http://maps.google.com/maps?q=42.949531759142786,-81.23282229317653 …",2017-04-10 17:19:45,851545258743779329
Um Bucks maja wieksze szanse na mistrza niz Thunder?. Rockets takie same jak Celtics? wut. Dobre value: Rockets - 26.00 Spurs - 9.50 pic.twitter.com/DGgOWU0ya3,2017-04-10 17:19:38,851545229756903426
Talking in hypotheticals. So you are saying the Thunder would be better and have more wins with Harden over Westbrook?,2017-04-10 17:19:37,851545224509837312
"Hey man, it's all good though. The thunder are fine and facing the rockets first round. As long as Beverly doesn't injure Westbrook again,",2017-04-10 17:19:33,851545209943072770
Distant Thunder in Northern Kanata. @ KylesWeather,2017-04-10 17:19:32,851545204238798848
"Beaver Valley Nitehawks beat the Storm, win the Cyclone: Beaver Valley stole the Storm's thunder… http://dlvr.it/Ns1WLS (Free 24hr link)pic.twitter.com/txs6M1EhXm",2017-04-10 17:19:16,851545136924246016
I think no way Rockets make it without Harden. And Overall Rockets are 3 seed and Thunder are 10. Thunder not good enough for Westbrook MVP,2017-04-10 17:19:09,851545110676258818
"SUNDAY NITE Mantra Melodies and Sound Meditation with Lynda Arnold and Shane Thunder Sunday, April 16th at... http://fb.me/8jIucMi2T",2017-04-10 17:19:04,851545089730113536
Me: Sounds like thunder outside. Also me: Maybe that's Russell Westbrook and the Oklahoma City Thunder making all that noise on the court.,2017-04-10 17:19:03,851545082658508801
"""A thank you would be nice.""",2017-04-10 17:18:50,851545029978054657
"was there any backfire when Robert Downey Jr. played blackface on Tropic Thunder, i was too young to remember ?",2017-04-10 17:18:47,851545015654416385
Gardening gear .. All day .. Here comes the thunder !,2017-04-10 17:18:41,851544992606810112
"Mareep 62.2% [Thunder Shock , Thunderbolt](14m 47s) Available until 05:33:14pm. http://maps.google.com/maps?q=27.31735646069096,-80.37573856217766 …",2017-04-10 17:18:31,851544947736051717
Most accurate war movie: Tropic Thunder. Dont @me,2017-04-10 17:18:20,851544901602889728
Here comes the thunder..next the rain and my professor will end class cause she has some phobia with rainy weather.,2017-04-10 17:18:19,851544899820310528
When did # Thunder gets these jerseys? pic.twitter.com/EcgRWKbdVe,2017-04-10 17:18:02,851544828848599040
Jamaica is sooo frikkin beautiful!!!! Love esp when thunder clouds take over the mountains,2017-04-10 17:17:58,851544812130062338
Hell naw...I can do thunder & lighting when I'm in a safe place or whatever but not in this little ass snow cone stand fuck this,2017-04-10 17:17:58,851544809026277377
"I would like it very much please, if it could rain steadily for 4 days. Thunder. Lightening. Grey skies and solitude.",2017-04-10 17:17:53,851544788646207488
Look @ ACali4 and @ megreilly360 - it's Dr. Thunder! https://twitter.com/xeni/status/851508847525208064 …,2017-04-10 17:17:52,851544787119480832
DAWG that Thunder/Rockets series is gonna be amazing.,2017-04-10 17:17:45,851544757138489344
Because country thunder was rad af and easily the most fun I've ever had pic.twitter.com/yBFBqCfJsF,2017-04-10 17:17:40,851544737060462596
"[unknown] 31% Mareep (6/2/6, Thunder Shock/Thunderbolt) 'til 05:45:43pm (27m 58s). http://maps.google.com/maps?q=35.92221013557278,-78.59087954666303 …",2017-04-10 17:17:40,851544736620064768
"My kitten is scared of thunder, so he came and cuddled with me.",2017-04-10 17:17:40,851544734615130112
I'm just thunder too it all and you are my lightning,2017-04-10 17:17:28,851544686770573312
I ain't messing with this thunder,2017-04-10 17:17:28,851544685285957632
I spent 8 months of my life in Thunder Bay and learned English there from scratch-excellent little town!! Not enough sheep though...,2017-04-10 17:17:05,851544588183638022
Because I'm lowkey scared of thunder,2017-04-10 17:16:53,851544537310924800
Absolutely hate the sound of thunder.,2017-04-10 17:16:50,851544524677632001
I need to go back to Country Thunder like right now.,2017-04-10 17:16:38,851544473641172992
Had a crush on Chama... But thunder cats were https://twitter.com/_Miims88/status/851532717825171457 …,2017-04-10 17:16:34,851544456503447553
This thunder can really chill tf out.,2017-04-10 17:16:27,851544430448439296
"Lets watch ""Tropic Thunder"" via # showgoers https://sync.showgoers.tv/party/EE0IeX5",2017-04-10 17:16:15,851544378526937088
"This shit so stupid bruh. Its fuckin thunder storming, but warm af outside. The sky is all grey n shit. Smh I can NOT do this lol.",2017-04-10 17:16:14,851544372646727682
"I know the thunder aren't average, but with Russ the thunder aren't title contenders. With Harden the Rockets have a much better chance.",2017-04-10 17:16:11,851544364023255040
"At McHenry for CL South vs. McHenry softball. Players are warming up but there's some ominous clouds, Thunder heading out way pic.twitter.com/9RXNNwia3b",2017-04-10 17:16:09,851544352371482624
When U R trying to get errands done before it starts storming & 5 minutes after U make it home U hear thunder Thankful we beat the storm!,2017-04-10 17:16:06,851544339775979520
Had to steal April's thunder! Guess I was checking the wrong webcam. Congratulations! https://twitter.com/zoosocietymke/status/851474486494978050 …,2017-04-10 17:16:01,851544318179495936
would it change if the Rockets 4-0 the thunders in the playoffs?,2017-04-10 17:15:57,851544303289683969
"You’ve probably already heard the distant thunder and you can “eyewitness weather” the clouds, but here it comes: https://twitter.com/ArborWX/status/851541415016452096 …",2017-04-10 17:15:39,851544226441646080
"Jolteon IV:57.8%(10/9/7) Move Set: Thunder Shock/Thunder Available until 17:19:05 (3m 26s). http://maps.google.com/maps?q=27.966004932234448,-82.45551585996647 …",2017-04-10 17:15:39,851544226408128513
The smell of the rain... The thunder in the distance...,2017-04-10 17:15:35,851544209211445248
"Freak thunder storm on Tim's run, then safely home and the sun comes out # pardon",2017-04-10 17:15:32,851544198625013765
when did they put Tropic Thunder on Netflix oh my God I'm watching it again,2017-04-10 17:15:30,851544191184318465
"""welcome to united ... also the thunder dome... we over book.. one man leaves... EMBARGO!!!"" # united @ united",2017-04-10 17:15:28,851544180581167104
thE THUNDER IS STARTING TO ROAR THANK YOU YES,2017-04-10 17:15:21,851544152932306944
I read Goddess of Thunder. Am currently on the 90's Spider-man Clone Saga and have some Daredevil lined up. Hitting Comixology hard,2017-04-10 17:15:03,851544077820624896
My thunder gonna make it to the second round to get bumped pic.twitter.com/P5Xf6g4byW,2017-04-10 17:15:03,851544077594185733
"Thor: Ragnarok trailer pits the thunder god against his ""friend from work"" the Hulk http://www.radiotimes.com/news/2017-04-10/thor-ragnarok-trailer-pits-the-thunder-god-against-his-friend-from-work-the-hulk …pic.twitter.com/YIYAMhR8MJ",2017-04-10 17:15:00,851544065367724033
Without Russ the thunder would be the Brooklyn nets,2017-04-10 17:14:49,851544016957124615
pic.twitter.com/S9yGpLudCx,2017-04-10 17:14:44,851543999022333952
"Mareep available until 03:41:34pm (26m 56s). Thunder Shock / Thunderbolt (66.7% - 14/14/2) http://maps.google.com/maps?q=39.700116003340014,-105.07295747152644 …",2017-04-10 17:14:39,851543976867966976
Is that thunder I hear ?,2017-04-10 17:14:35,851543959054819332
Off and on Thunder Rain Hail Good weather Shit crazy,2017-04-10 17:14:28,851543931342946304
The god thunder vs. The Incredible Hulk https://twitter.com/marvel/status/851420088498630660 …,2017-04-10 17:14:23,851543909281009671
"I'd love to have a job working for the Thunder, making videos like this. I'd never get tired of it. https://twitter.com/okcthunder/status/851540763062226944 …",2017-04-10 17:14:20,851543895120936960
Know I'm about to sleep really good this thunder and the rain hitting this window,2017-04-10 17:14:17,851543885503508483
dogs dont like thunder,2017-04-10 17:14:10,851543855778451456
"As of now, based on data available, Thunder forecast would include storm chance & warm temps, but a lot can change. pic.twitter.com/67LtaN7xhc",2017-04-10 17:14:04,851543829220118528
He promised eternity to those who believed in his name. I'm gonna believe in him regardless of the thunder that may come my way. # HeIsGod,2017-04-10 17:14:02,851543821586485252
There's hail and thunder where I'm at right now and I DO NOT LIKE IT.,2017-04-10 17:13:56,851543797095858176
"@ SPORTSHSE Lightning, thunder, pouring rain, and you haven't called practices???",2017-04-10 17:13:52,851543777810501632
We got to tour the Howie's Activity Center today! Exciting to see the future of Thunder… https://www.instagram.com/p/BSuDIvYhem6/,2017-04-10 17:13:50,851543772265496576
I wish I had a thunder buddy to cuddle up next to me and finish Friday night lights with me,2017-04-10 17:13:41,851543733120233472
"I'm at Canal Park - @ akronrubberduck for Trenton Thunder at Akron RubberDucks in Akron, OH https://www.swarmapp.com/c/iXwdKyEXu2W",2017-04-10 17:13:38,851543721418133504
2 days of sunshine just fi get thunder storm Wednesday? Kmft.,2017-04-10 17:13:37,851543716863115264
Thunder bolt (Magun) ? https://twitter.com/iamteeweird/status/851543338599755780 …,2017-04-10 17:13:35,851543705697779713
Country thunder took a W on me this year,2017-04-10 17:13:27,851543674382983168
TrueHoop Pod: # NBAsidecast - Bucks vs. Thunder http://www.chatsports.com/nba/a/source/truehoop-pod-nbasidecast-bucks-vs-thunder-13434327 … via @ chatsports,2017-04-10 17:13:27,851543672629977088
Here comes the THUNDER,2017-04-10 17:13:25,851543667030536194
STAR GAZER final # book in the Blue Thunder series # romance # asmsg # ian1 # kindle # ibook # spub http://spangaloo.com/books.php?bid=7 pic.twitter.com/mfTdergKbZ,2017-04-10 17:13:09,851543599087058944
"A wild Pikachu (95.6% 15/15/13, Thunder Shock / Thunderbolt) has appeared! Available until 14:42:15 (29m 6s). http://maps.google.com/maps?q=34.114455574349954,-117.40869471716819 …",2017-04-10 17:13:08,851543593911058432
Finally got to see @ aaron_watson at country thunder and I'm very happy about it!,2017-04-10 17:12:48,851543509597167616
Game 1 is delayed due to thunder and lightning in the bottom of the 4th. We will keep you updated as we have more information.,2017-04-10 17:12:41,851543482208571393
Westbrook could be rested on back-to-back? - Russell Westbrook (G) Oklahoma City Thunder http://dlvr.it/Ns1PfF,2017-04-10 17:12:36,851543460263772160
i hear thunder,2017-04-10 17:12:34,851543449849536516
"hey, i love you and i'm your biggest fan just so u know @Furious_Thunder pic.twitter.com/NaNdoLwjrH",2017-04-10 17:12:26,851543419268804608
I'm parked across campus and it is raining thunder and lightening like the dickens,2017-04-10 17:12:13,851543364600299523
"Physician: Go home, and close your eyes in a quiet room Booming Thunder: YEET!",2017-04-10 17:12:13,851543364533178368
"# Pikachu 97.8% (15/14/15) Moves: [Thunder Shock | Thunderbolt] City: [Plainfield] Timer: [04:41:51pm]-(29m 39s) http://maps.google.com/maps?q=41.626735544927065,-88.1627947158951 …",2017-04-10 17:12:11,851543356547248129
"Rockets are only 3 spots ahead of the Thunder in Playoff seeding so that ""Winning"" argument isn't so valid.",2017-04-10 17:12:03,851543320648187904
Bad Bloods: July Thunder by Bestselling Author @ AuthorSAT & @ CleanTeenPub # YA # Fantasy http://goo.gl/fZLe6w via @ NNP_W_Light,2017-04-10 17:12:02,851543316294402048
"Raichu 46.7% 13/0/8 Volt Switch & Thunder Punch! Until 04:41:37pm (29m 47s). MID Travis St Uptown http://maps.google.com/maps?q=32.80797020589752,-96.79930781520227 …",2017-04-10 17:11:53,851543278315032576
"Electabuzz 97.8% (15/14/15/Thunder Shock/Thunderbolt) until 02:38:00pm (26m 10s). lvl30+ CP:938 (L15) http://maps.google.com/maps?q=37.98265275647944,-122.5449195161312 …",2017-04-10 17:11:50,851543265643909122
"Magnemite ⚲ (82.2% 15/7/15, Thunder Shock / Magnet Bomb) until 14:40:25 (28m 33s). http://maps.google.com/maps?q=34.06320132446963,-117.19875556519953 …",2017-04-10 17:11:47,851543254377963520
IDK about this New Bomber... :: War Thunder Gameplay :: Part #1 https://youtu.be/3VLuCaQFkNs via @ YouTube,2017-04-10 17:11:46,851543251089797120
"love the rain, hate the thunder",2017-04-10 17:11:43,851543239828045824
"Country thunder was a blast with my best friend, oh and happy one year anniversary pic.twitter.com/0d9RMoGDim",2017-04-10 17:11:34,851543202125430784
@ HectorBellerin @ MesutOzil1088 @ Alexis_Sanchez @ MustafiOfficial You guys should not just post rubbish o... Make thunder no fire una,2017-04-10 17:11:08,851543093061054464
"Avis aux fan de sentai, ya un robot plus craqué que le Thunder Ultra Zord / Heavy Armor Chi Palace ?",2017-04-10 17:11:06,851543081807695874
Crimson spiral and black thunder,2017-04-10 17:11:04,851543076451569664
I hate the way the thunder echoes in between pride and phase,2017-04-10 17:10:58,851543047578017793
Imma need this thunder to chill.,2017-04-10 17:10:50,851543014715650050
Thunder fire Gary Neville https://twitter.com/yungpalizawa/status/851531278021275648 …,2017-04-10 17:10:45,851542996470431744
i'm praying for a thunder storm tonight,2017-04-10 17:10:45,851542996432629760
People want to argue about wins. You look at the Rockets' supporting cast & compare them to the Thunder's supporting cast. No comparison,2017-04-10 17:10:44,851542990908776449
Exactly the Thor movie I want too! My blood is pumping with heavy metal thunder. # ThorRagnarokhttps://twitter.com/JonSchnepp/status/851458654435803136 …,2017-04-10 17:10:25,851542909103091712
Damn thunder bout made me shit myself,2017-04-10 17:10:11,851542853159456769
True. Thunder had better preseason prediction. Rockets have greatest W-L increase based off preseason predictions.,2017-04-10 17:10:08,851542841214070787
Not yet...coming within 1/2 hour I think! @ ShannsView just heard thunder. Hope it moves through quickly here also!,2017-04-10 17:10:07,851542834637406208
Thunder Trucks Presents: Gage Boyle http://dlvr.it/Ns1McF,2017-04-10 17:10:05,851542827729170432
"Considered going to Country Thunder, didn't, figured it would be more fun chewing glass...",2017-04-10 17:10:04,851542821412655104
