text,date,id
Training Montage Mickey: You're gonna eat lightnin' and you're gonna crap thunder. Rocky: United!!!!!!!!!!!,2017-04-10 19:59:59,851585584682459136
My dog be crying when it thunder,2017-04-10 19:59:44,851585518857068545
"Mareep #179 has appeared! Available until 08:27:44pm (27m 53s). http://maps.google.com/maps?q=40.53606974282777,-74.21999606146478 … Thunder Shock / Discharge 66.67% (12/7/11)",2017-04-10 19:59:38,851585495356370952
country thunder definitely destroyed me,2017-04-10 19:59:37,851585492768313345
"Me: THUNDER CATS ARE GOOOOOOOO! Jon: Wanna really piss of somebody from the 90's, say ""Go, go, Ninja Turtles!""",2017-04-10 19:59:28,851585452150853634
And a little thunder and rain to bring cozy factor to perfect 10...,2017-04-10 19:59:24,851585437277855744
Mine That Bird is one. Thunder Gulch?,2017-04-10 19:59:22,851585428700499968
"Magnemite 40.0% (3/12/3) Thunder Shock/Discharge Available until 19:28:36 (29m 19s). http://maps.google.com/maps?q=41.9248469025421,-87.94944800187073 …",2017-04-10 19:59:18,851585411046617089
Yeah but the songs isn't out,2017-04-10 19:59:13,851585392159621120
I can never tell the difference between thunder and the boys beating the shit out of eachother upstairs,2017-04-10 19:59:01,851585340775301120
"It's a 15 minute thunder/lightning storm. Still raining a little, but the nasty stuff seems to have passed. Be safe Cub fans.",2017-04-10 19:58:54,851585311545151488
tô vendo o color code de thunder e chorando pq eles eram tão pequenininhos,2017-04-10 19:58:52,851585301831180288
Westbrook rompe récord de triple-dobles en victoria de Thunder http://www.moreloshabla.com/deportes/basquetbol/westbrook-rompe-record-de-triple-dobles-en-victoria-de-thunder/?utm_source=ReviveOldPost&utm_medium=social&utm_campaign=ReviveOldPost …,2017-04-10 19:58:33,851585221917061120
Time for you all to put your boots away until next country thunder.,2017-04-10 19:58:32,851585220675387392
Imma get a ole thunder chicken down this weekend,2017-04-10 19:58:19,851585163066839042
毎朝お腹がなりそうだね(*＾艸＾)ｸｽｸｽｗ,2017-04-10 19:58:17,851585156783644673
UCLA's Josh Rosen was the darling QB of 2015. USC's Dam Darnold stole his thunder in '16. Who rules LA this fall? http://foxs.pt/2oZcMR4,2017-04-10 19:58:00,851585085392289792
I liked a @ YouTube video http://youtu.be/-g-bbdIcs1U?a War Thunder Montage | PRO100 Squadron,2017-04-10 19:57:57,851585070682996739
Honestly a folk cover of Thunder would be incredible. I don't think the subject matter is as cheery as the accordion would make it tho,2017-04-10 19:57:47,851585030610534400
"Mareep available until 08:27:29pm (29m 46s). Thunder Shock / Thunderbolt (46.7% - 12/3/6) http://maps.google.com/maps?q=37.12771983662494,-80.54032908405594 …",2017-04-10 19:57:44,851585018392653824
あ、おは美興奮して朝のあいさつ忘れてーる(^^;,2017-04-10 19:57:38,851584990584254464
thunder that cracks across the sky instead of the usual rumbling is my favorite thunder.,2017-04-10 19:57:19,851584914323648512
it always breaks my heart when I have to leave Thunder at home without me after he's had a seizure,2017-04-10 19:57:05,851584855871594496
"Pikachu (80.0% 8/15/13, Thunder Shock / Discharge) until 17:26:45 (29m 36s). http://maps.google.com/maps?q=34.06210330802784,-117.19930687396604 …",2017-04-10 19:57:03,851584845138452480
あるある！もくら？はないけどジャストポップアップある！ezは岡村ちゃん録画してたぞ多分ベストテンのジャストワンモアもある！,2017-04-10 19:56:46,851584772941807617
"Mareep (86.7% 15/14/10, Thunder Shock / Body Slam) until 17:26:20 (29m 46s). http://maps.google.com/maps?q=34.05999819867101,-117.1350693810668 …",2017-04-10 19:56:34,851584724237668352
"The Garden District: Mareep 80.0% (14/12/10 - Thunder Shock/Thunderbolt/small til 17:23:56(27m 28s). http://maps.google.com/maps?q=32.24632821582729,-110.89650405325406 …",2017-04-10 19:56:31,851584710312472577
THE WEATHER CHANNEL SAYS IT IS GOING TO BE THUNDER TODAY.. BUT I DONT HEAR NONE!!!!!!!!!!!!! # ANGRY,2017-04-10 19:56:17,851584653886726145
Valley couple gets engaged on main stage at Country Thunder http://zpr.io/P8hAX,2017-04-10 19:56:15,851584644923494402
"Lanturn - 58% (Charge Beam/Thunder) till 08:12:41pm (16m 30s). Found at 1041 Gainsborough Rd (Hyde Park) http://maps.google.com/maps?q=42.99903774930001,-81.33181920748177 …",2017-04-10 19:56:11,851584627466801153
No because the Thunder would not have as many wins without Westbrook and Harden would not be in the discussion,2017-04-10 19:56:10,851584624308477956
"Electabuzz (37.8%) Thunder Shock/Thunder Punch 0/8/9 (ATK/DEF/STA) Despawns at 17:18:33 https://maps.google.com/maps?saddr=My+Location&daddr=34.217156073615946,-118.60364169288717 …",2017-04-10 19:56:06,851584608156123140
Wow I think I just heard thunder,2017-04-10 19:56:03,851584595120324609
"well today there was hail, thunder & lightning, pouring rain, wind, sunshine, and bright blue skies all at the same time illinois is high",2017-04-10 19:56:02,851584588245807105
Half of port Clinton just jumped so high from that thunder,2017-04-10 19:56:02,851584588086484995
i have thunder thighs,2017-04-10 19:56:01,851584587440566273
"A wild Mareep (84.4% 11/14/13, Thunder Shock / Discharge) has appeared! Available until 17:09:49 (13m 54s). http://maps.google.com/maps?q=34.12387447604781,-117.41365122391515 …",2017-04-10 19:55:54,851584557967069184
Mumma say there's thunders coming. I cans smells it. # electricityintheair # springshowers… https://www.instagram.com/p/BSuVqlYhmy5/,2017-04-10 19:55:44,851584515151609856
okay that thunder just scared me so hard i have actual tears omg,2017-04-10 19:55:33,851584468695625728
I have a weird mix of Bear McCreary's version of The Parson's Farewell and Thunder by Frank Carter and the Rattlesnakes stuck in my head,2017-04-10 19:55:31,851584457542860800
I think I just heard the loudest thunder ever o_O,2017-04-10 19:55:30,851584455949115393
"# SunsNation # GoSuns # Forum Suns/NBA • Re: Game Day: Thunder (45-33) @Suns (22-57), Fri 4/7/17 http://dld.bz/fAFSW",2017-04-10 19:55:28,851584449036910592
"You right but I believe the thunder will end up beating the Rockets , we'll just have to wait and see",2017-04-10 19:55:15,851584392422141952
Photos: Best of Country Thunder Arizona 2017 http://azc.cc/2pnbhvc # ctaz2017pic.twitter.com/NHoM12Z8aU,2017-04-10 19:55:04,851584347345965058
Photos: Best of Country Thunder Arizona 2017 http://azc.cc/2orX0Ak pic.twitter.com/WY8bBYNWap,2017-04-10 19:55:04,851584347320844288
Nothing better than thunder storms,2017-04-10 19:54:47,851584273056505856
Thunder thighs,2017-04-10 19:54:43,851584256329515008
bitch DID YOU HEAR THAT THUNDER LMAO I JUMPED SO HIGH,2017-04-10 19:54:37,851584234607214592
We've had all of the weather this week. Below freezing. Over 70. Snow. Sun. Rain. Thunder. Lightning. And now...hail.,2017-04-10 19:54:30,851584205498830848
"@ daldridgetnt FYI, Thunder have better record when Westbrook gets a trip dub because it's easier to get a trip dub when you're winning",2017-04-10 19:54:20,851584162691600384
"wonderful evening! Nice rain, a little thunder earlier. NO storms! And you?",2017-04-10 19:54:11,851584125203091456
"Imagine being a Thunder player, your own fans don't rate you.",2017-04-10 19:54:09,851584114151096321
@ RobertDowneyJr tropic thunder is killing me!!! Hahaha,2017-04-10 19:54:02,851584087114502144
pic.twitter.com/eR6rrELJag,2017-04-10 19:53:50,851584036598304768
Not even a little. The rockets will decimate the thunder and show why wins are more important than stats.,2017-04-10 19:53:50,851584035830853634
Check out NBA Oklahoma City Thunder Charcoal Fast Break Fleece Sweatpants Pants Jersey # Majestic http://www.ebay.com/itm/NBA-Oklahoma-City-Thunder-Charcoal-Fast-Break-Fleece-Sweatpants-Pants-Jersey-/122362687759?roken=cUgayN&soutkn=mwqr45 … via @ eBay,2017-04-10 19:53:46,851584019263344641
ドラえもん、誰かください((̵̵́ ̆́̑͟˚̩̮ ̆̀̑)̵̵̀),2017-04-10 19:53:35,851583971909554178
"Ampharos (IV: 47%, TTL: 27m 1s) (Volt Switch/Thunder): https://pogoapi.co/x/#39.88977,-105.02675 …",2017-04-10 19:53:30,851583950199934977
Ryan Zinke Teams with &#8220;Rolling Thunder&#8221; Vets To Wash Vietnam Memorial Wall http://conservativetribune.com/rolling-thunder-team-trump-wall/?utm_source=Twitter&utm_medium=PostTopSharingButtons&utm_content=2017-04-10&utm_campaign=websitesharingbuttons …,2017-04-10 19:53:28,851583944139079684
Crazy thunder and lightening going on out here.,2017-04-10 19:53:23,851583924031688704
Terrific perspectives (2015) from current @ Thunder_BBL & @ DelhiDaredevils coach @ PaddyUpton1. This awareness of the nature of luck is rarehttps://twitter.com/PaddyUpton1/status/576038182556434434 …,2017-04-10 19:53:16,851583891307503616
Fact: 42 triple doubles. Fact: he's carrying the thunder basically by himself. Fact: he deserves it more than anyone,2017-04-10 19:53:00,851583827302547456
Muggy evening cool breeze gentle rain distant rumbles of thunder the smell of cut grass birdsong I could get used to this # MidwestPoetry,2017-04-10 19:53:00,851583826077904898
and another loud crash of thunder and lightning... ...and for a second...it feels like the world is crying with me...crying for me...,2017-04-10 19:52:58,851583819346063360
Country thunder with the love of my lifeee pic.twitter.com/hWkBloXiHK,2017-04-10 19:52:23,851583672490762240
Please let this thunder go on all night,2017-04-10 19:52:22,851583668846022656
AHHHHHH THUNDER,2017-04-10 19:52:21,851583662554578944
as The World's Foremost OKC Thunder/Arsenal Fan™ I viscerally and emotionally disagree with this but concede it's factually correct. https://twitter.com/knickthoughts/status/851519823003701248 …,2017-04-10 19:51:58,851583566970572801
"Mareep (57.8%) Thunder Shock/Body Slam 11/6/9 (ATK/DEF/STA) Despawns at 17:21:44 https://maps.google.com/maps?saddr=My+Location&daddr=34.169994183823974,-118.53278459561002 …",2017-04-10 19:51:53,851583546162638848
I love thunder.,2017-04-10 19:51:43,851583504605483008
"Hitmonchan #107 has appeared! Available until 08:18:44pm (26m 54s). http://maps.google.com/maps?q=40.62700166567311,-74.07916680692018 … Bullet Punch / Thunder Punch 46.67% (6/2/13)",2017-04-10 19:51:37,851583476432347137
"Outdoor sports season has already started. Thunderstorms are in the forecast. When thunder roars, go indoors! pic.twitter.com/7KMe8EYkzo",2017-04-10 19:51:33,851583461160865792
Ahhh dam summo thunder,2017-04-10 19:51:29,851583445813932032
I really don't like the thunder,2017-04-10 19:51:29,851583445155360770
Tropic Thunder is a cinematic masterpiece if you disagree feel free to not say anything,2017-04-10 19:51:26,851583432069193728
I love the sound of thunder.,2017-04-10 19:51:24,851583425245061120
Yes!! Now we're talkin. A full blown thunder storm pic.twitter.com/Kps3MhrHsS,2017-04-10 19:51:24,851583422250274816
I wanna get crispy for Easter but it say it's gone thunder storm all day,2017-04-10 19:51:10,851583364184330241
Jord is passed tf out on my bed and I am watching Tropic Thunder and am v bored,2017-04-10 19:51:01,851583327912034305
The thunder is rocking my house,2017-04-10 19:50:56,851583306722357248
"# thunder @Far North Side, Chicago, Illinois https://www.instagram.com/p/BSuVF3BAP77/",2017-04-10 19:50:44,851583254721425410
It's thunder and lightning. @ maximusthejack is hiding. Nap time for me.,2017-04-10 19:50:36,851583221204758529
"also, wanted to go to the grocery store but that thunder made me say nope",2017-04-10 19:50:26,851583182352912384
"unknown: Mareep 84.4% (15/15/8 - Thunder Shock/Discharge/normal til 17:18:47(28m 32s). http://maps.google.com/maps?q=32.199824797060096,-111.09713095494344 …",2017-04-10 19:50:18,851583146772398084
So the power just went off from this thunder great,2017-04-10 19:50:10,851583114950447105
"Lembrei da minha época de Dara e bateu uma saudade do meu Thunder, ai.",2017-04-10 19:50:02,851583078216736768
Thumb through this story and look back at each of Russell Westbrook’s 42 triple-doubles this season: https://www.fanragsports.com/nba/thunder/looking-back-russell-westbrooks-42-triple-doubles/ … # Thunder,2017-04-10 19:50:00,851583073246466048
Thumb through this story and look back at each of Russell Westbrook’s 42 triple-doubles this season: https://www.fanragsports.com/nba/thunder/looking-back-russell-westbrooks-42-triple-doubles/ … # Thunder,2017-04-10 19:50:00,851583071610560512
# thunder at # OSNW3 # Oshkosh # wiwx,2017-04-10 19:49:56,851583056448245760
株式会社7th-floorのThunder Link 怪しい噂！実践者のリアルな口コミ http://top4.xsrv.jp/kensawa1/2017/04/11/%e6%a0%aa%e5%bc%8f%e4%bc%9a%e7%a4%be7th-floor%e3%81%aethunder-link%e3%80%80%e6%80%aa%e3%81%97%e3%81%84%e5%99%82%ef%bc%81%e5%ae%9f%e8%b7%b5%e8%80%85%e3%81%ae%e3%83%aa%e3%82%a2%e3%83%ab%e3%81%aa/ …,2017-04-10 19:49:40,851582989310013440
This thunder storm is,2017-04-10 19:49:37,851582976764899333
"'Thunder, Lightning, Strikes' totally has a lot of those carnival sounds that fit Kyary's world",2017-04-10 19:49:35,851582965079433217
"Mareep 53.3% (5/5/14/Thunder Shock/Thunderbolt) till 17:18:32 (29m 9s). lvl30+ CP:330 (L15) http://maps.google.com/maps?q=37.339424509331025,-121.98396761945634 …",2017-04-10 19:49:22,851582911321001984
"Wow I'm french Canadian, and that guy is an ahold, by the way, I'm a little pudgy, and am happy to be a Habs fan from Thunder Bay",2017-04-10 19:49:15,851582882120388608
The thunder rolled through this afternoon like an orgasm the just doesn't end... both leaving me exhausted but content.,2017-04-10 19:49:08,851582852617601024
First we gotta teach thunder and now you? LUL. jk its actually quite complicated are you playing on global or JP?,2017-04-10 19:48:47,851582763308380160
‘Baby act’ Jackson Michelson makes Country Thunder debut | Arts and Theater | http://tucson.com http://tucson.com/entertainment/arts-and-theatre/baby-act-jackson-michelson-makes-country-thunder-debut/article_ee52bb6c-009f-5773-9ad0-207ffed84e27.html …,2017-04-10 19:48:45,851582756379176961
"rolling like thunder under the covers, and i guess that's why they call it the blues",2017-04-10 19:48:39,851582733310709760
VIDEO: Is Thomas Rhett even country? And does that even matter? A Country Thunder Arizona review pic.twitter.com/h1yFgphwbp,2017-04-10 19:48:34,851582712641183744
I am so afraid of Thunder,2017-04-10 19:48:15,851582629077975040
"I feel like if you put williams, Gordon, or ariza on the thunder we would have the better team",2017-04-10 19:48:10,851582609393991681
"""Digi Thunder (Serangan kilat)"" -Tentomon",2017-04-10 19:48:05,851582588422467584
this game is perfect for your channel it will NEVER get a restriction # woodletree2 http://store.steampowered.com/app/495350/,2017-04-10 19:47:54,851582544168591360
Westbrook has best individual stats and if you take him off the Thunder idk if they'd make 10 wins,2017-04-10 19:47:42,851582493933350921
"In love with this thunder, rain, lightning, and my small town in Ohio",2017-04-10 19:47:35,851582462610288641
GO AWAY THUNDER!,2017-04-10 19:47:29,851582436777619456
There is about to be a thunder storm,2017-04-10 19:47:21,851582405702021121
Might skirt you to the north but man oh man. Flashbang lightning. Nothing between the flash and the thunder. Shit is close.,2017-04-10 19:47:20,851582398668185601
EXO THUNDER # FOREXO,2017-04-10 19:47:17,851582388408733696
War Thunder Stream (Germ) zur späten Stunde: http://youtu.be/NngIRgsvCBw?a über @ YouTube,2017-04-10 19:47:12,851582367819063296
The good days at Big Thunder Ranch pic.twitter.com/a5t0utyvLK,2017-04-10 19:47:07,851582345316507648
"Country thunder, we miss you pic.twitter.com/VrXsxuff1n",2017-04-10 19:46:54,851582289150525440
Late to no stream on account of thunder storm. Will update if the clouds clear.,2017-04-10 19:46:30,851582189351391233
Laying in bed listening to the thunder and rain. Soothing when I feel like crap,2017-04-10 19:46:30,851582188579688448
I love thunder,2017-04-10 19:46:21,851582152433127424
this rain and thunder is everything,2017-04-10 19:46:19,851582143876804608
Oh avec Thunder on a exactement le même nombre de Replays Watched by Others,2017-04-10 19:46:02,851582074494517248
"Magnemite 33.3% (1/3/11) Thunder Shock/Magnet Bomb Available until 19:15:01 (29m 17s). http://maps.google.com/maps?q=41.928387333767475,-87.92218068262956 …",2017-04-10 19:45:45,851582001048170497
Look at # Thunder. Without Westbrook the Thunder aren't even close to a playoff spot. https://twitter.com/SportsCenter/status/851489549696028674 …,2017-04-10 19:45:30,851581938951372800
I have to say there are a couple maps I'd love to see.. Just don't know how well they'd work.. Thunder Bay and PTBO.,2017-04-10 19:45:27,851581926582493184
Thunder the best team on 2k don't @me,2017-04-10 19:45:17,851581883506987012
"the fact that thor considers protecting earth his day job is so cute, i know he's the god of thunder but please protect him at all costs",2017-04-10 19:45:11,851581859666563072
high key love the long hair. It's my money maker,2017-04-10 19:45:06,851581836115537921
"The perfect storm with rain, rumbling thunder, and wind http://whitenoisemarket.com/sound/rain-storm?id=695A7994-F66A-483F-A9E0-169AB40D686A …",2017-04-10 19:45:00,851581814976237572
"Squall line of rain, snow, thunder, and hail is moving through Montana. # MTwx # KTVH Here's my forecast: http://www.ktvh.com/2017/04/easter-sunday-is-coming-so-is-more-snow-and-thunder …pic.twitter.com/WLUSR1FLWe",2017-04-10 19:44:43,851581739906383872
Thunder Storm!,2017-04-10 19:44:33,851581701180448768
I just went with thunder shock,2017-04-10 19:44:28,851581678506188801
Look at what came in the mail today. # nascar # nascarthunder2004 # thunder # heat # nascarheat… https://www.instagram.com/p/BSuUXeVFJol/,2017-04-10 19:44:25,851581664312664066
"They got a better chance then the thunder do , and yeah they'd probably be a 7th seed the best W/o him",2017-04-10 19:44:23,851581656532221952
"Bressi Ranch: Mareep 88.9% (15/13/12 - Thunder Shock/Thunderbolt - s:normal) til 17:11:31(27m 13s). http://maps.google.com/maps?q=33.1224218681213,-117.23881343426467 …",2017-04-10 19:44:15,851581622528884736
This might be my first year missing thunder... I think I might cry,2017-04-10 19:43:56,851581545748062208
I love the sound of thunder,2017-04-10 19:43:55,851581541369208832
"We've got a Lot of lightning but of as much thunder:/ still, it's better than nothing right now",2017-04-10 19:43:43,851581490806870016
Oklahoma City Thunder vs Denver Nuggets - Full Game Highlights | April 9... https://www.youtube.com/watch?v=MQtEcQMfVTA&feature=share …,2017-04-10 19:43:40,851581477431148544
,2017-04-10 19:43:28,851581425484738561
WATCH: Westbrook reacts to record-setting 42nd triple-double # thunder # NBA # OKCThunder http://sport-ne.ws/3v4o pic.twitter.com/gkBgq21Lu5,2017-04-10 19:43:25,851581412465618945
"Mareep - 60.0% - 6/7/14 (Thunder Shock - 5,Discharge - 65). Until 17:12:36 (29m 14s). Lacey http://maps.google.com/maps?q=46.99213062123045,-122.79444272576141 …",2017-04-10 19:43:22,851581400067198976
Thunder have zero chance of winning the west because they're trash. Rockets have a chance of actually winning the west. Harden should be MVP,2017-04-10 19:43:02,851581316864905219
"Mareep - 40% (Thunder Shock/Body Slam) till 08:09:03pm (26m 2s). Found at 133 Wychwood Pl (Medway) http://maps.google.com/maps?q=43.0058922529414,-81.29218413517 …",2017-04-10 19:43:01,851581312234213376
thunder roars as i stumble from standing 40 stories tall to first folding over in defeat then splayed out lifeless on the ground,2017-04-10 19:42:50,851581266675867648
Thunder soothes my soul,2017-04-10 19:42:49,851581265547587585
"*her ears flick, catching the rumbling of thunder* *looking down, ponies start moving indoors to escape the rain*",2017-04-10 19:42:28,851581176544407553
you're a bit late,2017-04-10 19:42:23,851581152418779136
Thunder jolt isn't a real move help,2017-04-10 19:42:16,851581123809468416
だから新右衛門さん！！ナムサンダーは南無Thunderではないとあれほど言っているでしょ！私は雷の使い手ではありません！！！,2017-04-10 19:42:11,851581104255508481
"I don't wanna hear talk about harden and his team, without harden they lose, without Westbrook thunder lose, MVP TO BOTH OF THEM",2017-04-10 19:42:09,851581094780600321
Absolutely love listening to thunder,2017-04-10 19:41:58,851581050086150144
Thunder homer and he may have been cracking top 75 or 50 earlier in the year but he's been too inconsistent barely in top 100 for me now,2017-04-10 19:41:56,851581040632246272
"And after strangely little debate, Timmins council awards the $235k contract for Stars and Thunder Fest security to Lowell Security. # timcc",2017-04-10 19:41:49,851581010747719680
Thor: Ragnarok God Of Thunder Unleashed In Crazy First Trailer http://thepeoplesmovies.com/2017/04/thor-ragnarok-god-of-thunder-unleashed-in-crazy-first-trailer/ …pic.twitter.com/iAE9wcagKj,2017-04-10 19:41:47,851581002745090048
Thunder and lightning here on the border of GR and Kentwood,2017-04-10 19:41:46,851580999184109568
"[Leganés] Mareep (46.7%) [Thunder Shock , Body Slam](26m 42s) Hasta 02:08:23am. http://maps.google.com/maps?q=40.321706212535254,-3.78736649103281 …",2017-04-10 19:41:40,851580974966165504
Up and coming talent hits the stage at Country Thunder - http://azfamily.com 3TV | Phoenix Breaking News Weatherhttp://www.azfamily.com/story/35101838/up-and-coming-talent-hits-the-stage-at-country-thunder …,2017-04-10 19:41:25,851580912328257536
"Mareep 66.7% (14/11/5) Thunder Shock/Body Slam [Northside] 807 32nd St 51104 07:09:43pm (28m 24s) http://maps.google.com/maps?q=42.52495823957387,-96.40029072490347 …",2017-04-10 19:41:17,851580877888999425
Thunder's gay,2017-04-10 19:41:13,851580861682130945
Country thunder 2017! pic.twitter.com/bvMFSNa1qK,2017-04-10 19:41:09,851580843952701440
I've seen everyones pics from country thunder and I feel like living in Nash is like living in country thunder everyday...,2017-04-10 19:41:03,851580819479179265
Thunder in 6 https://twitter.com/travismarkluhrs/status/851557803693047809 …,2017-04-10 19:40:52,851580771303268353
# NBA2K13 I just beat Thunder with the Heat 38-31 on NBA 2K13 for iPad Lite version!!,2017-04-10 19:40:51,851580766714609664
I liked a @ YouTube video http://youtu.be/SoqRPPUjpM8?a Thunder Thighs,2017-04-10 19:40:50,851580763174838273
"His numbers are so important because without him the thunder wouldn't be winning, without harden the rockets would still be a playoff team",2017-04-10 19:40:45,851580742035537923
"To end the dispute, who ever wins the # NBA playoff series between # rockets vs # thunder should get # NBAMVP . @ NBAonTNT fair rt.",2017-04-10 19:40:40,851580723588976641
the sound of rain and thunder is so beautiful,2017-04-10 19:40:31,851580685060108290
We just had thunder storms????,2017-04-10 19:40:31,851580682648391680
"Ampharos (F) (IV: 24%, TTL: 29m 45s) (Volt Switch/Thunder): https://pogoapi.co/x/#32.54587,-116.92825 …",2017-04-10 19:40:25,851580658384326657
"Ampharos 24% (3/5/3) (Volt Switch & Thunder) until 17:10:10 (29m 45s).http://maps.google.com/maps?q=32.54587093875377,-116.92825316172015 …",2017-04-10 19:40:24,851580656253452288
Robert Downey Jr in Tropic Thunder is one of the greatest things to ever be on camera.,2017-04-10 19:40:16,851580621977726976
オス岡担だから見に行かなきゃなのにレベル高すぎぃ くくりだけでもかわいく、ね？笑 いくら払えばあのお顔になれますか？ 意識飛ばすwwwなにそれ、睡眠のプロすぎるw,2017-04-10 19:40:14,851580615384113152
"Morena: Mareep 80.0% (10/14/12 - Thunder Shock/Body Slam - s:large) til 17:09:59(29m 46s). http://maps.google.com/maps?q=32.76700473653905,-117.18809663539066 …",2017-04-10 19:40:10,851580595255652352
"Mareep 37.8% (1/2/14) Thunder Shock/Discharge [Northside] 3534 Strawberry Ln 51104 07:06:43pm (26m 34s) http://maps.google.com/maps?q=42.53153318467307,-96.38232643110528 …",2017-04-10 19:40:07,851580586019958784
Bad Bloods: July Thunder by Bestselling Author @ AuthorSAT & @ CleanTeenPub # YA # Fantasy http://goo.gl/fZLe6w via @ NNP_W_Light,2017-04-10 19:40:03,851580569079230464
"Wakefield: Mareep 80.0% (15/6/15 - Thunder Shock/Discharge/normal til 17:06:48(26m 52s). http://maps.google.com/maps?q=32.183279955301316,-110.97669617561193 …",2017-04-10 19:39:58,851580547763544065
Westbrook likely to sit out 1 of Thunder's remaining games # thunder # NBA # OKCThunder http://sport-ne.ws/3v4k pic.twitter.com/8qRtDgVI9z,2017-04-10 19:39:43,851580481716051969
I thought it was thunder when it flew over my school but someone sitting by the window said it was a jet.,2017-04-10 19:39:29,851580422907723776
Everybody knows Jerry Thunder could kick Eric Foreman's butt @ curtisisbooger # that70sshowpic.twitter.com/YEL0gs2xGu,2017-04-10 19:39:16,851580370483064832
it's currently thunder storming and I'm legit so happy about it,2017-04-10 19:38:52,851580271078068224
You know that the Thunder are like statistically the worst team in the NBA when Russ sits right? And then a top 7 team when he does,2017-04-10 19:38:42,851580229290258432
Ik vind een @ YouTube-video leuk: http://youtu.be/pwHi5oOddBo?a NL - War Thunder - US Ground Forces,2017-04-10 19:38:37,851580208318754816
おはようございます(*´▽｀*)ﾉ)) 毎朝楽しみだね(*´﹃｀*),2017-04-10 19:38:14,851580111581102080
Lake Winnipeg High Concentrations of Microfibres: Lake Winnipeg THUNDER BAY – The first… https://goo.gl/fb/byRN74,2017-04-10 19:38:12,851580102739718144
