text,date,id
"I added a video to a @ YouTube playlist http://youtu.be/Ma5WsQjxMYw?a ""Thunder"" by Katy McAllister - Official Lyric Video",2016-10-27 19:59:57,791791578079715329
黒絆のためだけにサキ交換して覚醒させた,2016-10-27 19:59:55,791791567086379009
Please thunder.,2016-10-27 19:59:53,791791560002244608
Thunder Women Looking to Ascend MIAA Standings at Championship http://www.trinethunder.com/sports/wxc/2016-17/releases/20161026p9sknb …,2016-10-27 19:59:41,791791509943136256
OKC Thunder journal: Fan apologizes for gesture toward Westbrook http://www.chatsports.com/oklahoma-city-thunder/a/source/okc-thunder-journal-fan-apologizes-for-gesture-toward-westbrook-12933338 … via @ chatsports # ThunderUp,2016-10-27 19:59:28,791791457501900800
2017 Jaguar XF Sportbrake Is Coming To Steal # Volvo V90's Thunder. Read more: http://owler.us/abLVhs $ VOLV-B,2016-10-27 19:59:20,791791422013788160
"Clément, Léna, Thunder, que des bons bails viens",2016-10-27 19:58:50,791791296725811201
Thunder thighs,2016-10-27 19:58:37,791791242199732224
"On radiohhh_com BLUE ""Love, Put on Your Faces (words adapted from an e.e.cummings poem)"" by Patricia Barber (with the Choral Thunder Vocal C",2016-10-27 19:58:04,791791103569637376
"SABONIS, TITULAR EN SU PRIMER PARTIDO CON LOS THUNDER EN LA NBA http://goo.gl/KfsHRi",2016-10-27 19:57:51,791791049999908864
"Sleepwalking under heavy raining, with bright lightning and aggressive thunder, you can just hear your heart beating so slow....",2016-10-27 19:57:50,791791043595341824
I thought I would actually like having a butt for once but no these thunder thighs are not the look,2016-10-27 19:57:46,791791030068740096
"To bad Trump's plane didn't slide off the runway only to be saved by his thunder thighs, # Hardball",2016-10-27 19:57:44,791791019188559872
"Thunder Road | storm in the Texas Panhandle, just south of Groom, Texas http://pinterest.com/pin/334392341066418866/ …",2016-10-27 19:57:41,791791007222341632
J'ai ajouté une vidéo à une playlist @ YouTube - Fast Eddie - Acid Thunder http://youtu.be/C6V9WBTJlhw?a,2016-10-27 19:57:35,791790980613767168
"Outside of college football, pretty sure it's just us and the Thunder for sports around here right now.",2016-10-27 19:57:11,791790879237341184
ICYMI Views from OKC: The Thunder are Undefeated after One Game! http://thunderousintentions.com/2016/10/27/views-from-okc-undefeated-one-game/ …,2016-10-27 19:57:00,791790836321181696
# NBA Miercoles # Bucks 96-107 # Hornets # Grizzlies 102-98 # Timberwolves # Pelicans 102-107 # Nuggets # 76Ers 97-103 # Thunder pic.twitter.com/0RJTioloKG,2016-10-27 19:56:55,791790813512601604
Ejected # 76ers fan apologizes to # Thunder Westbrook but claims Russell called him 'FAT'. http://thesco.re/2eSihgl https://twitter.com/theScore/status/791788571191455744/photo/1pic.twitter.com/XkUBAaeTkS,2016-10-27 19:56:14,791790644226322432
"thunder do exo, vc ta aonde?",2016-10-27 19:56:04,791790598193868800
"Estou vendendo um carrinho a fricção Thunder Tanque, dos Thundercats. Invejosos vão dizer que é… https://www.instagram.com/p/BMFeiYXARRB/",2016-10-27 19:56:02,791790590694481920
"*pops her head in @ mlp_ThndrBlt's room, possibly surprising him*Thunder!",2016-10-27 19:55:57,791790570255556608
Some evening reading for you on last nights Thunder victory. My take on we saw on opening night in Philly. https://twitter.com/theprospects23/status/791650606041534464 …,2016-10-27 19:55:56,791790565314564097
# OKCThunder # ThunderUp # WeAreThunder OKC Thunder: Can the Thunder win big with the Ada.. http://dld.bz/fcckh pic.twitter.com/HE0FhvEj0l,2016-10-27 19:55:18,791790407092989952
@ CharlieReckless nah no lo paso tan mal (???) Xd,2016-10-27 19:55:14,791790392551374848
From BerryTramel: More to like than dislike in Wednesday night's Thunder opener http://newsok.com/article/5524435?utm_source=NewsOK.com&utm_medium=Social&utm_campaign=NIC-Twitter … …https://twitter.com/NewsOK/status/791790079576453121 …,2016-10-27 19:55:13,791790386427617280
適当にヒーラーおけない場所にポイしような,2016-10-27 19:55:09,791790370648535040
Dreamworld: Teen on first shift on Thunder River Rapids ride devastated http://www.dailytelegraph.com.au/news/dreamworld-deaths-teen-on-first-shift-among-staff-at-controls-when-tragedy-struck-river-ride/news-story/4507cab984eb1711a72d8c46f7d0eea3 …,2016-10-27 19:55:04,791790347940564992
Getting a new MacBook Pro? Check out these accessories first - CNET: The new MacBook Pros and the 12-inch MacBook include Thunder...,2016-10-27 19:54:54,791790304600793088
Getting a new MacBook Pro? Check out these accessories first - CNET: The new MacBook Pros and the 12-inch MacBook include Thunder...,2016-10-27 19:54:53,791790304357601280
Now you know chocolate thunder gone be in the building !!!! https://twitter.com/fineerussiann_/status/791789399738617856 …,2016-10-27 19:54:37,791790237232013312
From @ BerryTramel: More to like than dislike in Wednesday night's Thunder opener http://newsok.com/article/5524435?utm_source=NewsOK.com&utm_medium=Social&utm_campaign=NIC-Twitter …pic.twitter.com/nhYXIhSd4H,2016-10-27 19:54:00,791790079576453121
"nah man they give you 4 THUNDER SHART PORTS! Converters only cost like, $80 a piece. nbd.",2016-10-27 19:53:46,791790022672392192
Sixers Fan Not Happy with Westbrook-Russell's Postgame Response-Thunder@76ers: http://youtu.be/Y5QScgv15j8?a via @ YouTube,2016-10-27 19:53:41,791790001419943936
"oooh. Thunder Ultra Strong, så får døm smaken tå tannkrem rwtt før dem går i bakken",2016-10-27 19:53:34,791789972185616384
"I wish it was dramatically pouring rain, maybe even with some thunder and lightning",2016-10-27 19:53:11,791789872679751680
Thunder tomorrow at 2: 40 please,2016-10-27 19:53:06,791789851515367426
"Billy Donovan, the Thunder coach? Keep up.",2016-10-27 19:52:55,791789805751312384
Thunder Bay Stars and @NipElksJrB are underway at the Tournament Centre! # LJHL,2016-10-27 19:52:51,791789790811217921
"SABONIS, TITULAR EN SU PRIMER PARTIDO CON LOS THUNDER EN LA NBA",2016-10-27 19:51:35,791789469942755329
"SABONIS, TITULAR EN SU PRIMER PARTIDO CON LOS THUNDER EN LA NBA http://bit.ly/2eX17wb",2016-10-27 19:51:34,791789468961214464
Super fun 2 on 5 basketball game today - 1950s style. Bringing the thunder with @CoachAllenSPS @ officialSPS # WilderRockspic.twitter.com/YsOtiyMAwX,2016-10-27 19:51:16,791789392738283520
おはよーございます〜ヽ(´ー｀)ノ,2016-10-27 19:51:00,791789326065479680
@ Thunder_akaashi 좋은 아침~~~~ 오늘도 화이팅pic.twitter.com/jwAnbnMSrE,2016-10-27 19:50:59,791789321086836736
Oh the thunder it speaks of your power But there's something in the sound of the saints. # SoundoftheSaints,2016-10-27 19:50:54,791789301000536064
Twerk Thunder (Vine by @oFoamy) https://vine.co/v/hWgaKxlAZbY,2016-10-27 19:50:53,791789297468837890
Lmao Instagram stole vine's thunder. That's why it's getting shut down.,2016-10-27 19:50:41,791789245279014912
Ocean Sciences Article of the Day - Mystery deepens around historic tugboat sunk near Thunder Bay (CBC News) http://www.cbc.ca/news/canada/thunder-bay/mary-ann-mystery-1.3820798 …,2016-10-27 19:50:39,791789237775499264
"Raise your words, not voice. It is rain that grows flowers, not thunder. - Rumi # quote",2016-10-27 19:50:32,791789208646148097
"Can you tell me why Billy never plays you? I need to be coach of the Thunder, we need your shooting out there.",2016-10-27 19:49:49,791789025921118208
zak and my brother are bonding over war thunder,2016-10-27 19:49:33,791788961140056064
15℃位しかならんみたいなので寒さ対策忘れずに…(￣ー￣),2016-10-27 19:49:26,791788931352174592
# Deals_us # SportsMem_Cards http://ift.tt/1POHWA2 Adidas Swingman NBA Jersey Thunder Kevin Durant Blue Fashion sz… pic.twitter.com/hW55fyj6Ha,2016-10-27 19:49:25,791788928206536705
"country thunder? wtf no, # cravenforever",2016-10-27 19:49:08,791788857259794432
How was Joel Embiid able to score 20 points in 22 minutes vs the OKC Thunder in his NBA regular season debut? pic.twitter.com/Pz97yw6pw5,2016-10-27 19:48:56,791788803409096704
the mighty dog of thunder! BOL,2016-10-27 19:48:14,791788629702107137
Kevin Durant sighting at the Thunder game tonight http://ln.is/HeC8h by # howellk93 via @ c0nvey,2016-10-27 19:48:06,791788593475940354
"Thunders, fireworks, and every sound that would make your heart skip a beat reminds me of you Keep safe little dove.",2016-10-27 19:48:01,791788576409202688
"@ReneeCastle1025 -Kane Brown ,Thunder in Rain!",2016-10-27 19:47:53,791788539428147200
Still living the joy from last night. # okcthunder # OKCvsPHL # Warriors # InRussWeTrust # ThunderNation # thunder pic.twitter.com/JonIRPYPk6,2016-10-27 19:47:52,791788538408730625
"Got any questions about the Thunder? About tomorrow's game against the Suns? Send them over, and I'll maybe, possible use it for tmrw's pod.",2016-10-27 19:47:42,791788494548979713
NewsOK - OKC Thunder: Can the Thunder win big with the Adams-Kanter combo? http://ow.ly/GfRP505TaRs,2016-10-27 19:47:13,791788374382247936
# Autoevolution SharkWerks Porsche 911 GT3 RS (Race Exhaust) Sounds Like a Flat-Six Thunders... Read Blog: http://owler.us/abLUjI,2016-10-27 19:46:22,791788157616345088
You are gonna eat lightning and crap thunder.,2016-10-27 19:46:02,791788074137255936
Just heard thunder and legit thought it was my stomach rumbling,2016-10-27 19:46:01,791788069171101700
that's why you're my thunder buddy,2016-10-27 19:45:44,791788000065781762
The K Man isn't blue at all...it's this fun Blue Thunder at # Mariachis! @ BeachesResorts # BeachesMomspic.twitter.com/y6EalXJuBd,2016-10-27 19:45:36,791787967853592576
"On this day in 2002, @ Hammerfall released ""Crimson Thunder"". Happy 14th! # HeartsOnFire # HeavyMetal # PowerMetalpic.twitter.com/sy63dbdnVM",2016-10-27 19:45:34,791787955845115904
次の @ YouTube 動画を高く評価しました: http://youtu.be/nnfT9Oo5QB8?a Broken Thunder - Full Metal Goddess (remix),2016-10-27 19:45:29,791787938342432769
"Gurl, it's a good predictable. :D",2016-10-27 19:45:12,791787866112139268
"Upcoming Event: Irwindale - NHRA Thursday Night Thunder October 27, 2016 at 05:00PM Irwindale Speedway, 500 Speedway Drive, Irwindale, CA 9…",2016-10-27 19:45:09,791787852740853761
猫を被ると大人しくなるので虎を被って猛々しくなってみましたｗ,2016-10-27 19:45:09,791787850861719552
"In Germany, Thorsday = Donnerstag (Thunder Day) = MY DAY. Heaven shall dazzle around me because I AM THOR. (And so is @ sarahdonner )",2016-10-27 19:45:07,791787844129914880
"Atención, parlay ganador: - Thunder - Warriors - H. Rockets - M. Heat - Benfica - Sporting L - Twente Háganme caso ;)",2016-10-27 19:44:56,791787797866741760
Best part!pic.twitter.com/Tky1rphy8G,2016-10-27 19:44:54,791787788941139968
"you don't need that guy, he's stealing your thunder.",2016-10-27 19:44:33,791787702895116288
"What happened to us? You were lighting and I was thunder, the timing was always slightly off.",2016-10-27 19:44:23,791787659047821312
[News OK] - Jenni Carlson: Why the loss of a superstar isn't crippling the Thunder: ... sugarcoating that. An... http://sh.st/4PVoh,2016-10-27 19:44:22,791787655256125441
[News OK: Jenni Carlson] - Jenni Carlson: Why the loss of a superstar isn't crippling the Thunder | News OK: ... http://sh.st/4PViS,2016-10-27 19:44:21,791787653393809408
넌 번개처럼 잠깐 빛났다 잠시 세상을 밝혔다 온 세상을 마치 내 것처럼 나에게 보여주곤 떠났다 / Thunder,2016-10-27 19:44:18,791787639804301312
Weber on the point for a PP = forecast for thunder in Montreal,2016-10-27 19:44:05,791787583562973184
are those thunders there in purpose? (๑¯ω¯๑),2016-10-27 19:43:58,791787557172445184
Westbrook's near triple-double fuels Thunder http://www.espn.com/video/clip?id=17898321 …,2016-10-27 19:43:46,791787503757819904
luhh,2016-10-27 19:43:42,791787489857896448
thunder,2016-10-27 19:43:21,791787398413881344
OKC Thunder: Can the Thunder win big with the Adams-Kanter combo?: By Erik Horne Staff Writer ehorne@oklahoman.com… http://m.tbnn.it/MXkfhM,2016-10-27 19:43:20,791787397352595456
Of course it is!!!,2016-10-27 19:42:54,791787288778776576
Phoenix Suns vs. Oklahoma City Thunder - 10/28/2016 Free Pick & NBA Betting Prediction - # Suns # Thunder http://cappe.rs/6rb1g,2016-10-27 19:42:10,791787100341309440
[ ˘ω˘ ]◗♪ THUNDER STORM 高中正義 - 虹伝説 THE RAINBOW GOBLINS # nowplayingpic.twitter.com/lmO87Ku8EO,2016-10-27 19:41:32,791786941935214593
My favorite part of this clip is that the Thunder are trailing to the 76ers. https://twitter.com/TheBBALLBox/status/791761396207935488 …,2016-10-27 19:40:56,791786791384735744
"It's so black and white He's stealin' your thunder Baby, blue ain't your color",2016-10-27 19:40:28,791786674258751488
@JrodMarshall @brents167 @ Cook881 Let light this shit up! Be The THUNDER!!!!!!!!!!,2016-10-27 19:39:51,791786518511751170
I liked a @ YouTube video http://youtu.be/JcfpaWPq_Bk?a US and German Cutting a Car Apart and Other Exercises During Angel Thunder Exercise,2016-10-27 19:39:50,791786512983654400
War Thunder - Status Report | 4 aniversario de War Thunder # WT4YEARS: http://youtu.be/pjj_a3AbHwM?a vía @ YouTube,2016-10-27 19:39:28,791786421510082560
behhh,2016-10-27 19:39:27,791786417978388480
Your thunder On a good day Scares them All straight No one gets a Free pass just Because they Too are streaks Of wonder # DrugVerse,2016-10-27 19:39:25,791786408772067328
"I'm tellin u, u don't need that guy it's so black and white he's stealing ur thunder baby",2016-10-27 19:39:23,791786403419987968
"If you ride like lightning, you're gonna crash like thunder. pic.twitter.com/OOvROycu2i",2016-10-27 19:39:08,791786338307739648
Oklahoma City Thunder Vs. Philadelphia 76ers Live Stream: Watch NBA 2016-17 Opener - Hollywood Life http://dlvr.it/MXkbV7,2016-10-27 19:39:04,791786322713194498
"Yuta-kun isn't fond of insects. That's why my companions, Peachy and Thunder, are always helping us ♪",2016-10-27 19:39:03,791786318585966592
"ICYMI OKC Thunder Game One Review: The Good, The Bad, The Ugly http://thunderousintentions.com/2016/10/26/okc-thunder-game-one-review/ …",2016-10-27 19:39:01,791786307521548288
"Oklahoma City trends now: Thunder, Vine, WorldSeries, NoDAPL and appleevent. http://toplocalnow.com/us/oklahoma-city?section=trends …",2016-10-27 19:38:50,791786263606984704
You Put out the fire in my eyes. You cause a thunder in my veins when you're around. You make me wish that I would die.,2016-10-27 19:38:25,791786159777128448
COLUMNA CLANDESTINA: Thunder & Lightning: Dos segundos que cambiaron la... http://columnaclandestina.blogspot.com/2016/05/thunder-lightning-dos-segundos-que.html?spref=tw …,2016-10-27 19:38:24,791786152248287232
Gostei de um vídeo @ YouTube http://ln.is/www.youtube.com/H2eg1 …《TRANSONA》(+18) ( ͡° ͜ʖ ͡°) ft. THUNDER MILGRAU-/-ANIMECRACK #3/,2016-10-27 19:38:08,791786085349199876
"In July, 1908, Thunder Bay in Ontario, Canada became the first location to use DST. Other locations in Canada were also early to introduce",2016-10-27 19:38:05,791786073856749569
RIP Thunder. https://twitter.com/thelandform/status/394912008782364672 …,2016-10-27 19:37:53,791786023822856192
I wonder if @ NASA invented thunder to cover up space battles?,2016-10-27 19:37:46,791785995670650880
Thunder Jack is my dark horse pic.twitter.com/zaX5CS1xc0,2016-10-27 19:37:30,791785925709737984
#5: The Very Best Of: The Very Best Of ~ Celtic Thunder (447) Buy new: $9.78 50 used & new from $6… https://goo.gl/fb/Y8n0JC # World # Music,2016-10-27 19:37:26,791785911776374785
@ WX1BOX thunder lightning Granby MA,2016-10-27 19:36:52,791785767643275264
Former Kiwi and Dreamworld worker defends jokes about Thunder River Rapids deaths http://nzh.tw/11737639 World is full of dicks,2016-10-27 19:36:28,791785668745637888
we have the same bday and he's been stealing my thunder since middle school. Boy bye,2016-10-27 19:35:46,791785492715016192
"What kind of magic spell to use? Slime and snails, or puppy dogs' tails? Thunder or lightning, something frightening?",2016-10-27 19:35:43,791785477904883712
Chinese Rocks w/ original Hheartbreakers lineup and Hell on vocals might be the best song ever. Thunders version a close 2nd,2016-10-27 19:35:41,791785470959157248
"The character of Tommy Thunder was created for the season 1 episode ""Late Night Wars.""",2016-10-27 19:35:25,791785404022136832
あ、あとOKCのゴール裏にいるMr.Thunder！ スワンさん、バスケライダー先輩、そしてMr.Thunderが俺の心の師匠です（笑）,2016-10-27 19:35:03,791785310199746560
wtf I never knew I had these. I've been using the flame and the thunder the whole time pic.twitter.com/Lv8iNsrlhK,2016-10-27 19:35:01,791785303153389570
"http://ift.tt/2dN3m9f Air Jordan 4 Retro - 11 ""Thunder"" - 308497 008",2016-10-27 19:34:46,791785238737420289
Jenni Carlson: Why the loss of a superstar isn't crippling the Thunder: By Jenni Carlson Columnist jcarlson@o... http://sh.st/4PLL8,2016-10-27 19:34:45,791785234152906752
Jenni Carlson: Why the loss of a superstar isn't crippling the Thunder: By Jenni Carlson Column... http://nba.nbalinks.tk/ZyI # NBA # Thunder,2016-10-27 19:34:45,791785234085720066
Jenni Carlson: Why the loss of a superstar isn't crippling the Thunder: By Jenni Carlson Columnis... http://nba.nbalinks.tk/ZyI # NBA # Magic,2016-10-27 19:34:45,791785234056384512
Montréal. Je l'aime tant. Meme quand à steal mon Thunder,2016-10-27 19:34:44,791785231485378560
Craven Country Jamboree will now be named Country Thunder Saskatchewan. Will it come with less STDs now?,2016-10-27 19:34:30,791785170730819586
# OKCThunder # ThunderUp # WeAreThunder Jenni Carlson: Why the loss of a superstar isn't crippling the Thunder http://dld.bz/fccdg,2016-10-27 19:34:07,791785078003212288
"Oct 27 Game Score: MINOR ATOM AE - 4, Halton Hills Thunder - 2 http://tinyurl.com/z42m69u",2016-10-27 19:33:39,791784958629122048
"Es claro mi apoyo por Russ y el Thunder...Pero sabes que nunca voy a odiar ni llamar traidor a KD, lo amo",2016-10-27 19:33:26,791784905453735936
My sister always tryna steal my thunder https://twitter.com/bitchhwhere/status/791780490600673281 …,2016-10-27 19:33:11,791784840328646656
"http://ift.tt/2dN3m9f # shoes Air Jordan 4 Retro - 11 ""Thunder"" - 308497 008",2016-10-27 19:33:07,791784824830844928
"A mighty seer of old, who ""Leaped in haste Upon the dead arena of his age, And shook it by his thunder-tramp to life"" Krummacher # yyccc # yyc",2016-10-27 19:33:00,791784794564603905
# OklahomaLottery OKC Thunder: Can the Thunder win big with the Adams-Kanter combo?: By Erik H... http://bit.ly/2dQKKQP OklahomaLottery,2016-10-27 19:32:52,791784763015081984
I have 5 seats available to first home Thunder game tomorrow night. $20 each. 3 are singles and 2 are together.,2016-10-27 19:32:45,791784733956907008
it will crip. Thunder and Jawn,2016-10-27 19:32:43,791784725413191680
"""You've been in a coma for 5 years sir."" ""Wow, I can't wait to see Durant and the Thunder vs. Lebron and the Heat in the finals."" pic.twitter.com/K3en0G4mpU",2016-10-27 19:32:32,791784677107441664
Ready to go — attending Celtic Thunder at Verizon Theatre at Grand Prairie http://fb.me/1q7BXfgqC,2016-10-27 19:32:26,791784652574826497
"@ Apfelkernchen Mumford And Sons: Dust And Thunder, Konzertfilm, bei uns im November als Stage-Event im Kino. Nur so zur Info :)",2016-10-27 19:31:55,791784522228633601
Congrats to the entire crew at Craven Country Jamboree now Country Thunder Saskatchewan. Proud to be associated w such a great organization https://twitter.com/ccjsask/status/791771655345496064 …,2016-10-27 19:31:49,791784496882298880
@ USNationalGuard @ NationalGuard @ Sacbee_News @ RedHawkCasino @ Thunder_Valley @ PvilleSpeedway @ PlacerNews @ UCDavis @ SacState # korybaker @ acluhttps://twitter.com/SuperWoman26245/status/791784251314147328 …,2016-10-27 19:31:31,791784420550189057
@ thunder_ みっちゃんも? ٩(^‿^)۶（笑） 聖飢魔II… おはミツ,2016-10-27 19:31:25,791784395166273536
WORLD CUP PRACTICE! with Seattle uprising and Seattle thunder! https://youtu.be/JG68ds3Twdw # paintball # nxlworldcup # thegrind,2016-10-27 19:31:23,791784389973647360
From NewsOK: Jenni Carlson: Why the loss of a superstar isn't crippling the Thunder http://ln.is/newsok.com/jenni-car/pCNXm …,2016-10-27 19:31:12,791784341462519808
Getting a new MacBook Pro? Check out these accessories first - CNET: The new MacBook Pros and the 12-inch MacBook include Thunder...,2016-10-27 19:31:10,791784334030086144
Championship game this Sunday is all that I'm thinking about right now. Ready to lead these boys to another championship Win! # thunder,2016-10-27 19:31:09,791784328137175042
THIS IS RELAXING! # thunder # SoothMySlumber # WATERMELOANN # populardemand ... (Vine by @ MarlonWebb)https://vine.co/v/eHl5LiYPKwJ,2016-10-27 19:31:08,791784324014206980
LOVE THUNDER GROW鬼好き。ありがとうりきさん！！,2016-10-27 19:31:04,791784308029534208
". @ APTNNews Home sweet home, students leave Thunder Bay for traditional break http://ow.ly/SRdM505T9bN",2016-10-27 19:30:48,791784241055031296
"http://ift.tt/2fkPHXj Air Jordan 4 Retro - 11 ""Thunder"" - 308497 008 pic.twitter.com/3dIIyqeveB",2016-10-27 19:30:44,791784225712332800
雷さん おはようございます！！ 今日１日が雷さんにとって 実り多き１日になりますように！！,2016-10-27 19:30:43,791784219584245760
"@ SmileyKeith Buy a mid 2012 13 inch. Bulky compared to newer models, but you can upgrade it & it has USB 3.0 thunder & headphone",2016-10-27 19:30:27,791784151741370368
@ thunder_miami @ EoSAbstrak,2016-10-27 19:30:20,791784123195088897
less than hour later you're spilling the beans Keith. Cooney's due a for stealing your thunder. Get to bed and forget him,2016-10-27 19:30:07,791784069306671108
Time to be the thunder! — watching Tampa Bay Lightning,2016-10-27 19:30:03,791784052831481856
FLOREAL NEWS : Shield Of Thunder tape dans l’oeil http://anotao.com/nouvelles/link/mu/2016100341515/www.lemauricien.com/article/floreal-news-shield-thunder-tape-l-oeil …,2016-10-27 19:29:57,791784029267849216
OKC Thunder: Can the Thunder win big with the Adams-Kanter combo? http://www.chatsports.com/oklahoma-city-thunder/a/source/okc-thunder-can-the-thunder-win-big-with-the-adams-kanter-combo-12933279 … via @ chatsports # ThunderUp,2016-10-27 19:29:45,791783978923622400
"http://ift.tt/2fkPHXj Air Jordan 4 Retro - 11 ""Thunder"" - 308497 008 pic.twitter.com/FYgavPjvN5",2016-10-27 19:29:44,791783974456754177
Bridges skies for the dunk. WOWZA. Thunder sla. He has 10. 23-17 MSU 8:29 1st half,2016-10-27 19:29:38,791783947772563457
Another video of Kaitlin and thunder. http://fb.me/1vb6mjNd1,2016-10-27 19:29:22,791783882395783168
Thunder lose a tough one in a hard fought battle with @ tripenAAApeewee 3-2 in Harbour Grace.,2016-10-27 19:28:54,791783764665962496
"I never call weather 'wild' but that was about as close as it gets. I woke up first to thunder, then to a big ol tree coming down in my yard https://twitter.com/PTobeyPSVarsity/status/791776442061246464 …",2016-10-27 19:28:37,791783694017126401
"Also in the package: Black thunder, calpis marshmallow, calpis candy and calpis tablets, tattoo band-aid, baseball cards, cool pens",2016-10-27 19:28:17,791783608180768772
VEM AÍ O NOVO THUNDER OPEN.....AGUARDEM!!!! L Í D E R DA C A T E G O R I A !!! L E G Í T I M O !!! S U P R E M... http://fb.me/7RBiYcIYt,2016-10-27 19:27:59,791783530984595457
Kaitlin riding my horse thunder. So proud of both of these two. http://fb.me/5IrEkX6Nh,2016-10-27 19:27:58,791783528220401664
おはようございます！Thunder-雷-nana民ネタい手さん♪,2016-10-27 19:27:38,791783446448222209
"Bill Wheeler, Superintendent of Thunder Bay jail. Mr. Wheeler reports to Dep. Minister Matthew Torigian. # AdamCapayhttp://www.macleans.ca/news/canada/52-months-of-torture-and-the-4-men-responsible/ …",2016-10-27 19:27:29,791783405184843776
Top show in Southampton tonight! Great to see some oldschool fans coming out and bringing the thunder! Yes! pic.twitter.com/zXvU2uwrji,2016-10-27 19:26:56,791783267091542016
"Really want to be Luke Cage this halloween. On a scale of Tropic Thunder, to full on minstrelsy, how we feelin bout blackface these days?",2016-10-27 19:26:54,791783261185998848
Nice @ colemanhell display @ hmvtweets Thunder Bay. Summerland selling well! pic.twitter.com/s9dFh8IT7S – at HMV,2016-10-27 19:26:52,791783253766275072
Didn't want to steal your thunder.,2016-10-27 19:26:35,791783182379126784
"Raise your words, not voice. It is rain that grows flowers, not thunder. - Rumi # quote",2016-10-27 19:26:23,791783130877267968
"it's fantasy! Who says thunder can't cause fire? :p (if it makes you feel better, I don't recall noticing that during my read...)",2016-10-27 19:26:18,791783107938648064
"BLACK LIGHT, THUNDER BOY AND MAD ICE BOUT TO DROP THE HOTTEST MIXTAPE 2K16",2016-10-27 19:26:16,791783101789773824
Thunder,2016-10-27 19:25:40,791782951067521024
oops stealing thunder from Q5,2016-10-27 19:25:32,791782914325352448
@ SiennaMorgan1 Blackberry Smoke's Waiting for the Thunder (Cover) by Sienna Morgan https://youtu.be/r85ita1ID9I via @ YouTube,2016-10-27 19:25:30,791782906138013696
# NowPlaying: Kane Brown - Thunder In The Rain http://bit.ly/24OBOB5 Listen Now! # revo365 # hhm,2016-10-27 19:25:21,791782870322909184
"Que tal já garantir a sobremesa? Tem # promo nova, tem Thunder! Acesse e cadastre-se: http://www.momentooutback.com.br",2016-10-27 19:25:12,791782831370403840
