text,date,id
Westbrook 'hace lo que quiere' con las Air Jordan: ¡Ritmazo!: La estrella de los Thunder baila al ritmo del t... http://bit.ly/2eAmZR6,2016-10-27 16:30:29,791738863332962304
Westbrook 'hace lo que quiere' con las Air Jordan: ¡Ritmazo!: La estrella de los Thunder baila al ritmo del t... http://bit.ly/2eAmZR6,2016-10-27 16:30:28,791738860510162944
Westbrook 'hace lo que quiere' con las Air Jordan: ¡Ritmazo!: La estrella de los Thunder baila al ritmo del t... http://bit.ly/2eAmZR6,2016-10-27 16:30:28,791738858022969344
Westbrook 'hace lo que quiere' con las Air Jordan: ¡Ritmazo!: La estrella de los Thunder baila al ritmo del t... http://bit.ly/2eAmZR6,2016-10-27 16:30:24,791738844336926721
Westbrook 'hace lo que quiere' con las Air Jordan: ¡Ritmazo!: La estrella de los Thunder baila al ritmo del t... http://bit.ly/2eAmZR6,2016-10-27 16:30:22,791738835256225792
NBA season already lit thanks to Westbrook # Thunder,2016-10-27 16:30:13,791738794928209921
Westbrook 'hace lo que quiere' con las Air Jordan: ¡Ritmazo!: La estrella de los Thunder baila al ritmo del t... http://bit.ly/2eWrAtM,2016-10-27 16:30:11,791738786203828225
Twilight Of The Thunder God http://fb.me/39PDbQPQa,2016-10-27 16:29:58,791738734618173440
Westbrook 'hace lo que quiere' con las Air Jordan: ¡Ritmazo!: La estrella de los Thunder baila al ritmo del t... http://bit.ly/2eAmZR6,2016-10-27 16:29:57,791738728737714176
@annoyingshygirl break a leg guys!!!!!!,2016-10-27 16:29:36,791738641018068992
NetNewsLedger Woman Robbed in Current River: THUNDER BAY = NEWS – Thunder Bay Police are investigating a robb... http://bit.ly/2eWuyi3,2016-10-27 16:29:23,791738585049292800
Eat My Thunder,2016-10-27 16:28:53,791738462491639808
"esp. the smooth transition towards the 20s by a car, what a wonderful idea compared to other films with massive thunder&lightg",2016-10-27 16:28:53,791738459530653696
Days of Thunder meets Momento 100% pure drama,2016-10-27 16:28:49,791738444221411328
fcking thunder T.T staaaaaaaaawp!,2016-10-27 16:28:38,791738396486078465
@ USNationalGuard @ NationalGuard @ Sacbee_News @ RedHawkCasino @ Thunder_Valley @ PvilleSpeedway @ PlacerNews @ UCDavis @ SacState # korybaker @ acluhttps://twitter.com/SuperWoman26245/status/791738210552389632 …,2016-10-27 16:28:19,791738317226160129
Participa en el sorteo CARENADOS GP REGALA UNCASCO MT THUNDER de @ carenadosgp en http://sorteamus.com/r/a8to7 @ sorteamus,2016-10-27 16:28:19,791738317050155008
I just mentioned u in this on FB omg,2016-10-27 16:27:32,791738119104135168
"if some1 steals your private information, &U respond in a brilliant way&they say it costs nothing2steal U thunder..=original sin=suggestSHUN",2016-10-27 16:27:28,791738104725901312
"@ BradyDoesSports LOL, just making sure y'all are paying attention. Lol",2016-10-27 16:27:23,791738083662106624
4pm-7pm-10pm-1am via HRRR has a South Bay focus for rain. Will see if thunder develops later as low approaches (higher odds still south) pic.twitter.com/OVHI5pH6AN,2016-10-27 16:26:20,791737819626561536
"I watched as the Lamb opened the first of the seven seals, then I heard one of the four living creatures say in a voice like thunder, ""COME""",2016-10-27 16:26:15,791737797069664259
@ Micah_Johnson3 hey man great to hear you on air. Follow the Indy thunder on Twitter we practice at PT school we are a blind baseball team,2016-10-27 16:26:03,791737749300654080
@ USNationalGuard @ NationalGuard @ Sacbee_News @ RedHawkCasino @ Thunder_Valley @ PvilleSpeedway @ PlacerNews @ UCDavis @ SacState # korybaker @ acluhttps://twitter.com/SuperWoman26245/status/791737399428587520 …,2016-10-27 16:25:50,791737692287488002
Esordio vittorioso Semaj Christon in NBA con i Thunder https://youtu.be/bzlB-RZBXHc via @ YouTube,2016-10-27 16:25:43,791737661966942208
Kevin Durant sighting at the Thunder game tonight http://ln.is/ybAh0 by # DoveSoars via @ c0nvey,2016-10-27 16:25:23,791737579616043008
"Shango is the Orisha of lightning, dance, thunder, power, passion, fire and sensuality. He teaches us to live a full life! # Orisha # Shango",2016-10-27 16:25:08,791737516684697600
"@ BradyDoesSports we are great, but the Spurs are better.",2016-10-27 16:24:31,791737361797218304
She belong to the kitchen and the other rooms. Davido thunder fire you. Aso rock of demon. APC crisis oregun and... http://fb.me/Eezi68Cu,2016-10-27 16:23:48,791737180699893760
@ reckless can i charge a new macbook with 4 chargers? so much thunder,2016-10-27 16:23:42,791737154707791873
He gone need that nigga to come play for the thunder if they plan on winning a playoff game https://twitter.com/312darius/status/791736899064983552 …,2016-10-27 16:23:38,791737140153462784
"Yes-it's a thunder shirt but I still have to hold her, it does help calm her down.",2016-10-27 16:22:33,791736864889794560
Thunder cloud is soo overrated,2016-10-27 16:22:13,791736781653680129
Tシャツ サンダー THUNDER TRUCKS スケボー スケートボード http://ec48.net/?p=28745 pic.twitter.com/G835KOaoJR,2016-10-27 16:21:49,791736682336755712
The league is really tall. Milwaukee tallest at 80.4 average inches. Thunder at 79.4 are 14th in average height. https://twitter.com/JohnKiwara/status/791735738907762688 …,2016-10-27 16:21:46,791736670433325056
THUNDER DOME 少しだけの雨なら誰も苦になりません。 # TwoDots http://playtwo.do/ts # PlayBeautifullypic.twitter.com/Np41kHazKn,2016-10-27 16:21:44,791736661868621824
lol get out of my tweets!,2016-10-27 16:21:34,791736619032252417
before lightning comes thunder.,2016-10-27 16:20:50,791736434877145089
Country thunder 2017? 21. The need to go is real af,2016-10-27 16:20:47,791736420381503489
"Oh yey, new Macbook Pro, it has a thing you can touch and swipe when paying for dongles. Surface Studio stole it's thunder.",2016-10-27 16:20:41,791736399087173636
yep yep thunder exposed durant carried them a lot,2016-10-27 16:20:35,791736373632000001
Kevin Durant sighting at the Thunder game tonight http://ln.is/pwkkB by # moeager via @ c0nvey,2016-10-27 16:20:26,791736334905929729
# RockTheFolk - Ricky Skaggs and Kentucky Thunder - I Hope You've Learned,2016-10-27 16:20:17,791736295840161793
mmmhmm I'm just letting you know now so you not surprised when that thunder bolt hit,2016-10-27 16:19:51,791736186029105152
"Raise your # words, not voice. It is rain that grows # flowers, not thunder. pic.twitter.com/BGAbZ0fIuW",2016-10-27 16:19:38,791736131922567168
"New Blog: ""What to take from # Sixers opener against # Thunder"" # TrustTheProcess # MadeinPHILA http://phillysportssource.blogspot.com/2016/10/what-to-take-from-sixers-season-opener.html …",2016-10-27 16:19:18,791736049034723329
that won us the FA Cup. None of this blood & thunder 'in the mixer' shite,2016-10-27 16:18:47,791735920466747393
@ moeager @vine thunder won because barely against the 76ers,2016-10-27 16:18:29,791735841467068416
"Meat Department Manager: Loblaw Companies Limited (Thunder Bay): ""Job Description Meat… http://www.eluta.ca/search?ptitle=Meat+Department+Manager&position=53e5db0b9dcf23e9cc12a881ac3c81a5&imo=1 … # jobs # topemployers",2016-10-27 16:18:17,791735793148506112
don't dirgett Pikachu's Thunder ya cuck -_-,2016-10-27 16:17:49,791735674604957696
"Oklahoma City Thunder at Philadelphia 76ers – Oct 26, 2016 http://fullmatchtv.com/oklahoma-city-thunder-philadelphia-76ers-oct-26-2016 …pic.twitter.com/sGjtgXdfDn",2016-10-27 16:17:39,791735635757273088
Gostei de um vídeo do @ YouTube http://youtu.be/VWQemZPnjZM?a DragonForce Cry Thunder Guitar Cover,2016-10-27 16:17:39,791735634817867776
Kevin Durant sighting at the Thunder game tonight http://ln.is/ihqfN by # moeager via @ c0nvey,2016-10-27 16:17:37,791735627033239553
"hold on to your loved ones, hold on for dear life try to walk like thunder leaving footprints that are light (flora holds on to her plants) pic.twitter.com/FcaAj5RaNO",2016-10-27 16:17:25,791735576416378882
That ain't thunder...it's another Lady Braves GOOOOAAAALLLL! 2-0 Field Hockey!,2016-10-27 16:17:03,791735484108070912
Russell Time // # Thunder Basketball is back + Looking ahead in College Football. # sooners # okstate # TulsaFB http://buff.ly/2e0rTq7,2016-10-27 16:17:02,791735480450678784
Para los que se vinieron arriba con la victoria del Madrid contra los Thunders de Abrines. https://twitter.com/pablololaso/status/791728732381777922 …,2016-10-27 16:16:59,791735465619709952
Twerk Thunder (Vine by @oFoamy) https://vine.co/v/hWgaKxlAZbY,2016-10-27 16:16:56,791735453120593921
"MONITORING SPIRITS,THAT WILL JUST BE CHECKING OTHERS PEOPLES G.P.A,THUNDER IS COMING FOR YOU.",2016-10-27 16:16:32,791735354139303936
Kevin Durant sighting at the Thunder game tonight http://ln.is/bkZAd by # moeager via @ c0nvey,2016-10-27 16:16:32,791735351777853441
"I want ALL the archival footage, even World Bobybuilding Federation,Shotgun Saturday Night, & late-era WCW Thunder. https://twitter.com/411wrestling/status/791733198422179840 …",2016-10-27 16:16:22,791735312112201728
"IF TIGER MASK AND JUSHIN THUNDER LIGER HAD A CHILD AND IT BORN FROM A VOLCANO, THAT IS YOUR FINAL FIRE STARTER EVOLUTION",2016-10-27 16:16:20,791735301395939329
en ella-apenas se ve-susurro pero sin darse cuenta estaba sonriendo como un tonto-esta bien?-,2016-10-27 16:16:18,791735292495560708
pic.twitter.com/EZrop279LS,2016-10-27 16:16:18,791735292134846465
-si quiero-Se sento esperando que ella sacase la ecografía.En cuanto ella saco la imagen su vista se quedo grabada +,2016-10-27 16:16:09,791735255736651776
"Thunder go to the finals. Win the fourth set over Park City, play Morgan at 6 tonight",2016-10-27 16:16:05,791735237768118272
"Raise your words, not voice. It is rain that grows flowers, not thunder. - Rumi # quote",2016-10-27 16:15:42,791735143480356864
"Dhills into the STATE FINALS!! 3-1 over Park City. Play Morgan at 6:00. If you leave StG now, you can still make the game! Roll Thunder!",2016-10-27 16:15:36,791735115973996545
Team thunder gun express got out in 53:55! Great job guys! # rypticroomescape # ryptic… https://www.instagram.com/p/BMFFSEAgaBA/,2016-10-27 16:15:24,791735068460982272
not really my best effort,2016-10-27 16:15:16,791735032217948160
Watch new vid for Face Like Thunder by @ Japanesehouse https://youtu.be/_peMDiN6f14 See her live December 1: http://timbreconcerts.com/event/the-japanese-house/ …,2016-10-27 16:15:15,791735031232401408
the Digest-ive System?,2016-10-27 16:14:55,791734945257369601
http://ift.tt/2eApTWf Nike Air Jordan Retro 14 XIV men's size 11.5 thunder yellow Pinnacle foamposites,2016-10-27 16:14:30,791734841813438464
Qm me ve no metro nem pensa q to ouvindo thunder do boys like girls,2016-10-27 16:14:26,791734824826445824
"Park City falls to Desert Hills in the fourth set 25-18, losing the match 3-1. Thunder advance to final, Miners will play for third place.",2016-10-27 16:14:25,791734821307322368
"Immediate Need - Lead Spark Software Engineer - Thunder IoT Cloud in San Francisco, CA http://bull.hn/l/2PQBV/77 # job",2016-10-27 16:14:25,791734820011466753
Ik vind een @ YouTube-video van @ antibodynl leuk: http://youtu.be/JwD92qeaxZg?a NL - War Thunder [1080p/60fps] Ferdinand Het Slome Monster,2016-10-27 16:14:18,791734792652029954
"I was speaking to 2 different workers in thunder Bay one of them being a lawyer and the other a support worker ,... http://fb.me/7jr0D5L9I",2016-10-27 16:14:11,791734761651785728
Come celebrate the achievements of our grads! Join us on Nov 8 in Thunder Bay – new location http://bit.ly/2dH6XnJ pic.twitter.com/P5yKcdOmbt,2016-10-27 16:14:00,791734715849977857
Apparently the exposed conveyor belt on the Thunder River Rapids ride complies with Australian Standards??,2016-10-27 16:13:42,791734639152857088
"I've just finished ""Underground Thunder""! I'd love for you to come and get a gift from me! http://gigam.es/qtw_MM # android # gameinsight",2016-10-27 16:13:34,791734605875294208
"Nowa w Pluslidze jak ja, dzień dobry; ślunski wungiel; miłośniczka Dzika; Hiroszima Thunders; strażniczka języka polskiego (szanuję bardzo) https://twitter.com/tosiaczkowa/status/791734014927405062 …",2016-10-27 16:13:33,791734602780082178
BoxOut Sports is proud to partner with the Oklahoma City Thunder for the 2016-2017 # NBA season. # ThunderUp # TeamBoxOutpic.twitter.com/YiGTS2rU5m,2016-10-27 16:13:25,791734567841464357
The Chicken Salad From Chicken Something Podcast,2016-10-27 16:13:22,791734555765944320
"Little Goblins ages 5 - 13, check out the Pumpkin Carving event at Thunder Lodge! http://fb.me/sSUioBrV",2016-10-27 16:13:17,791734534727405568
"Ako si Thunder ang moabut ug mobunal kaninyo, sa tagsa tagsa! # EvangelicalEndTimeMachine # Repent # JesusSaves http://www.evangelicalendtimemachine.com/ako-si-thunder-ang-moabut-ug-mobunal-kaninyo-sa-tagsa-tagsa/ …",2016-10-27 16:13:12,791734515748175873
@ lekzzycoal the thunder when go fire una still dey Ibadan dey do from jump.,2016-10-27 16:13:12,791734514359930880
"Мне понравилось видео ""War Thunder | Совместные бои | Макс. настройки графики""",2016-10-27 16:12:52,791734429769162755
Salem Thursday - Rain: Salem -- Rain. Thunder possible. High near 15C. Winds S at 15 to 25 km/h. Chance of ra... http://tinyurl.com/ztaa9a5,2016-10-27 16:12:49,791734416259239936
# NBAFinals Golden State Warriors vs. Oklahoma City Thunder - 11/03/16: $300.00 (0 Bids)En... http://ebay.to/2eWu4IW # CavsWarriors # NBA,2016-10-27 16:12:41,791734384936128512
War Thunder \полковые/ 18+: http://youtu.be/OOppHZTQ1Q8?a на @ YouTube,2016-10-27 16:12:38,791734371480924160
"WATCH: Volunteers from Francis Marion University, Rolling Thunder, the Patriot Guard Riders and the American... http://fb.me/NkNckjZ1",2016-10-27 16:12:38,791734369295687680
"MEET MY FRIENDS ""THUNDER"" and ""LIGHTNING!"" pic.twitter.com/JAfWLburuH",2016-10-27 16:12:19,791734291092873216
JF 17 thunder is very powerful n smart jet,2016-10-27 16:12:18,791734288521756677
"Ace Frehley, Slash, Tommy Lee, And Many Others Form Supergroup To Perform ‘God Of Thunder’ Live! http://societyofrock.com/?p=45878",2016-10-27 16:12:10,791734255508303872
lmaooooo he thunder kicked the one bitch and had the other in a chokehold with his leg for a sec https://twitter.com/cjzero/status/791709471856820224 …,2016-10-27 16:11:32,791734093784416260
Paul George on the thunder,2016-10-27 16:11:10,791734003501977600
thunder I had a amazing day!!! I won Omega Rank in OmegaUHCs!!!!,2016-10-27 16:11:09,791733998062018560
"(J.P Tokoto from Oklahoma City Thunder) What´s his favourite Styx lyric? ""Domo arigato, Mr. Tokoto"" XD",2016-10-27 16:11:06,791733986515152896
"millionaire mindset<--- who wants to be? Go ahead and try to ""steal"" the thunder from the sunshine...lol...if U believe in luck Carla GLWT",2016-10-27 16:10:23,791733806650658816
and then like a thunder ripping through a quiet afternoon...my memoirs.,2016-10-27 16:10:21,791733798371295234
"Keyano Huskies vs Concordia Thunder this weekend! Women play Fri 6pm, Sat at 1pm. Men play Fri at 8pm, Sat at 3pm. Free admission! # YMM",2016-10-27 16:10:12,791733757694935041
"Miners TO, trailing DHHS 20-14 in the fourth set. If Thunder win this set, it's over.",2016-10-27 16:10:11,791733754699972609
# NBA Con apuros y muchas dudas los Thunder de Westbrook se impusieron a los 76ers de un gran Chacho. Debutó Abrines # ThunderUp # MadeInPHILAhttps://twitter.com/Capital_Deporte/status/791477038075015168 …,2016-10-27 16:09:41,791733629068140544
"# Giveaway War Thunder Celebrates Four Years With Giveaways, Discounts, And Special Events: T... http://bit.ly/2eWsFSt # free # games # RT",2016-10-27 16:09:26,791733567168524288
"Incineroar is called the Heel Pokémon. Yup, it's based on Black Tiger. I wonder if a shiny looks like Tiger Mask or Jushin Thunder Liger.",2016-10-27 16:09:20,791733539171467264
Thunder Moon in *Cancer http://bit.ly/2eI2yiP pic.twitter.com/XlWNJznafQ,2016-10-27 16:09:18,791733532653678592
This week's Heroes Brawl is calling down the thunder. http://bit.ly/2fbnF1h @ BlizzHeroespic.twitter.com/JISfxFfjDm,2016-10-27 16:09:14,791733516773974016
[Новости] War Thunder отмечает четвертый День рождения и Хэллоуин! http://ift.tt/2fkjWO4,2016-10-27 16:09:13,791733513569595392
"Cassie Logan ""Roll of Thunder, Hear My Cry"" # TashaTrilogyGiveawayhttps://twitter.com/RantingOwl/status/791731683636682752 …",2016-10-27 16:09:03,791733467943874560
"millionaire mindset...carla on the chew said ""it does not cost anything to ""steal"" someones thunder"" Oh really? in a business world it does",2016-10-27 16:08:39,791733369155440640
قطر تفاوض باكستان على طائرتي jf 17 thunder وسوبر موشاك http://fb.me/2Hwyv4Xwo,2016-10-27 16:08:13,791733259302559744
I love sitting by the window with Reizo watching a thunder-storm...,2016-10-27 16:07:50,791733161751220224
Kevin Durant sighting at the Thunder game tonight http://ln.is/TNAlZ by # MMARoasted via @ c0nvey,2016-10-27 16:07:30,791733078716780544
That thunder tho,2016-10-27 16:07:09,791732991303290880
my hormone dr is moving to Thunder Bay sis don't do this 2 me!!!!!!!!! she's so cool,2016-10-27 16:06:47,791732900735684608
"if that makes sense. No matter how great or close they are, unless it's Storm King's Thunder then it doesn't help him.",2016-10-27 16:06:40,791732869819400196
I haven't told special needs sun. terrified of thunder. He will find the news and he will honestly never sleep again. He will never trust,2016-10-27 16:06:32,791732836730482688
"realDonaldTrump: Rolling Thunder Gathering Have a great club, After I will visit in Claremont tonight!! If Trump doesn't win, leaving Akron,",2016-10-27 16:06:29,791732822641938432
Tom Cruise Dances to Ludacris for 15 minutes - Tropic Thunder - HD https://youtu.be/ZPO6dOPxmr8 via @ YouTube,2016-10-27 16:06:04,791732719470448641
What you are thunders so that I cannot hear what you say to the contrary. - Ralph Waldo Emerson pic.twitter.com/PNZUaX0QH9,2016-10-27 16:06:01,791732708263223296
Big Thunder Mountain POV http://youtu.be/v1RyJpfLM2o?a,2016-10-27 16:06:00,791732700021452800
You both are like Ying to the yang! Thunder buddies from the movie Ted. That's the reason why I cheer for you both! Love it! Keep smiling! https://twitter.com/daniellekang/status/791190858896781312 …,2016-10-27 16:05:08,791732485730074624
WAS THAT A THUNDER I AM GOING TO CRY,2016-10-27 16:04:54,791732423675547648
Thunder And Coming to Duncan Falls tomorrow 7:00pm. # PacktheHat # ElectricPrde,2016-10-27 16:04:47,791732396001460225
"Our children and our friends aren't being allowed to walk down the aisle. Ever. There's no blood and thunder, just Love and commitment.",2016-10-27 16:04:41,791732372320452608
"Thunder lagi sibuk,kangen?Dm/mention coba.sekian",2016-10-27 16:04:28,791732317735628801
Participa en el sorteo CARENADOS GP REGALA UNCASCO MT THUNDER de @ carenadosgp en http://sorteamus.com/r/a8to7 @ sorteamus,2016-10-27 16:04:17,791732271942365184
guys is thunder bay likely to get any fallout when world war 3 starts,2016-10-27 16:04:15,791732261733343232
Vine is shutting down... probably because instagram stole their thunder.,2016-10-27 16:04:03,791732211158425601
"# RussellWestbrook puts up 32 points, 12 rebounds, and 9 assists as he leads the # Thunder to a… https://www.instagram.com/p/BMFD-aEh53C/",2016-10-27 16:03:56,791732183731843072
"War Thunder Celebrates Four Years With Giveaways, Discounts, And Special Events https://goo.gl/fb/E1TYzb",2016-10-27 16:03:45,791732136818737152
"War Thunder Celebrates Four Years With Giveaways, Discounts, And Special Events https://goo.gl/fb/Rk4vxv",2016-10-27 16:03:45,791732134490800129
Westbrook reivindica el liderazgo de los Thunder en el debut de Abrines; derrota de Rodríguez … pic.twitter.com/m2jHnB1jiW,2016-10-27 16:03:36,791732098344386561
Steven Adams embraces new leadership role with the Oklahoma City Thunder http://www.newssummedup.com/a/jzqrsd,2016-10-27 16:03:36,791732097580793856
Ya think there is enough people doing Cry More Thunder!? # Wow # Legionpic.twitter.com/PMVmuekSlu,2016-10-27 16:03:30,791732071047671808
Sonic Boom S02E01 - Tommy Thunder: Method Actor (Sneak Peek) (720p HD) http://ln.is/www.youtube.com/CBAqE … via @ YouTube,2016-10-27 16:03:26,791732056229371904
Delays on NJ 29 southbound approaching Thunder Rd/Cass St (Trenton) delays due to http://www.511nj.org/IncidentList.aspx?listType=All&938 …,2016-10-27 16:03:17,791732019193602052
Kevin Durant sighting at the Thunder game tonight http://ln.is/wPpwB by # DoveSoars via @ c0nvey,2016-10-27 16:03:15,791732011090182148
# thunder # crossfyre #drummer # halloween # intothenight # rebel # biker # psycho # dw # deelugnt… https://www.instagram.com/p/BMFD3fgA1ST/,2016-10-27 16:02:59,791731942936944640
"Doha expresses interest in buying Mushshak, JF-17 Thunder aircraft from Pakistan - The Express Tribune http://ift.tt/2eUzDaL # worldnews …",2016-10-27 16:02:51,791731910833823745
"|: it storms, it thunders, lightning may strike wildly: I am a Prussian, want nothing to be but a Prussian.:|",2016-10-27 16:02:45,791731885122605056
go thunder,2016-10-27 16:02:07,791731726389305345
NBA BASKET - Westbrook reivindica el liderazgo de los Thunder en el debut de Abrines; de... http://bit.ly/2fkgi7a # PaginaNuova # Sports,2016-10-27 16:02:00,791731694743064576
@ tandercraft1 e ai Mano Thunder Pode Me Add No Skype Sou Amigo do Shiip me add preciso falar com ti uma proposta enzogamers455,2016-10-27 16:01:58,791731687684268033
‘Sit down f***ing fat boy’: AN emotional fan sitting courtside at Thursday’s 76ers season opener told Thunder star…,2016-10-27 16:01:35,791731590086926336
# RussellWestbrook Arrives for OKC Thunder Game Wearing # FearofGod Plaid # Kilt: Before the Oklahoma City Thunder vs… http://dlvr.it/MXgyZR,2016-10-27 16:01:17,791731515646369792
# RussellWestbrook Arrives for OKC Thunder Game Wearing # FearofGod Plaid # Kilt: Before the Oklahoma City… http://dlvr.it/MXgyF1 # Hype,2016-10-27 16:01:04,791731461392994304
"THUNDER ON THURSDAY: Save the date! Thunder on Thursday will take place at New B East on Thursday, October 27th... http://fb.me/7H14guGIM",2016-10-27 16:00:59,791731439238733824
Игроков War Thunder отправили ночью в лес на проклятых машинах - http://vsem-privet.ru/2016/10/igrokov-war-thunder-otpravili-nochyu-v-les-na-proklyatyx-mashinax/ …pic.twitter.com/hQ8csM8UrO,2016-10-27 16:00:53,791731414899326976
. @ Wichita_Thunder weekend matchup with Greenville postponed due to mechanical problems at the ice rink pic.twitter.com/ElQGtMSSlt,2016-10-27 16:00:48,791731395156586496
Thunder are going 82-0 and Westbrook is getting MVP after this commercial https://twitter.com/Jumpman23/status/791421677750005760 …,2016-10-27 16:00:46,791731383467175936
"LIVE on # Periscope: About last night...Thursday Night Thunder with @ thePeriGirls, @ peridudes, @ JSScope, @joeygiggle… https://www.pscp.tv/w/auEC5Dg1ODUwMDF8MWdxR3ZSTVBXUHFHQs82YR3CdlsWOJmtfR7KHwrZlNiQbZqZ9hPVNKCnEgJa …",2016-10-27 16:00:36,791731344543879168
War Thunder | REALISTA | « T-34 100: PRÓXIMA REVIEW » | Gameplay en Español: http://youtu.be/XD5xzC_EGXM?a vía @ YouTube,2016-10-27 16:00:18,791731266987159552
"Raise your words, not your voice. It is rain that grows flowers, not thunder -Rumi",2016-10-27 16:00:13,791731248326520832
[Let´s Play War Thunder] whiteleif!!!!! #28: http://youtu.be/JF6d5PK4etY?a über @ YouTube,2016-10-27 16:00:09,791731230035288064
Make sure you stop by the @ McDCentralOK Fry Truck at tomorrow's Thunder Alley for your free french fries! Thunder Alley opens at 4 p.m. pic.twitter.com/sSUjd6v8fZ,2016-10-27 16:00:09,791731229729009664
"MTN Be Like; Do you know there are people in your village that don't want you to succeed? Quickly text ""thunder fire them"" to 33505.",2016-10-27 16:00:05,791731212142469120
Thunder post mixed results # Airdrie # News http://pb.fyi/Gmw # parkbenchnews,2016-10-27 16:00:04,791731208589803521
Kevin Durant sighting at the Thunder game tonight http://ln.is/iPa7f by # BleacherReport via @ c0nvey,2016-10-27 16:00:03,791731205981016064
FOX Sports believes some help at the wing is only one call away for the Oklahoma City Thunder. http://fb.me/8mEXKgGEk,2016-10-27 16:00:02,791731202122186753
7D: 60 Splash: 25 Thunder: CLOSED SPC: 40,2016-10-27 16:00:01,791731196908728320
Straight from the Cask! - Drinking a Thunder Dog by @ gunhillbrewery at @ mdbrooklynbar — http://untp.beer/s/c376117488 # photo,2016-10-27 15:59:57,791731179611389956
Oklahoma City Thunder VS Philadelphia 76ers Sixers. # nba # okc # oklahomacitythunder… https://www.instagram.com/p/BMFDfRQjjYB/,2016-10-27 15:59:41,791731110946430977
"Talking Circle @4 pm, at the earthlodges, New Town. Led by Cecilia Fire Thunder and myself. Men's circle led by Greg Grey Cloud. Come heal.",2016-10-27 15:59:30,791731067673653248
"Thunder only happens when it's raining, players only love you when they're playing",2016-10-27 15:59:19,791731021825925129
"Bastante entretenido el debut de Thunder y Sixers, la verdad. Como se la ha sacado Russ pffff",2016-10-27 15:59:11,791730986778259457
Worthing Thunder appears in The Worthing Journal. Full story:... http://fb.me/1qU4fYc73,2016-10-27 15:58:26,791730795882876928
Jealous of your neighbor's elaborate porch pumpkin? Steal their Halloween thunder by using one of our many... http://fb.me/35VSejySG,2016-10-27 15:58:20,791730773875314688
Thunder Gods are back and this time they get to team up against the sentinels. http://whispersareloud.blogspot.com.ng/2016/10/thunder-gods-strike-two.html … cc @ BoyeAdefila,2016-10-27 15:58:20,791730773678252032
