text,date,id
not saying its not stupid but they are all thunder bolt 3 ports heh (I just want a new Mac Pro... please),2016-10-27 18:15:16,791765232456794112
"I liked a @ YouTube video http://youtu.be/3LZVtXKqyGg?a Joel Embiid Full Highlights vs Thunder (2016.10.26) - 20 Pts, 7 Reb, Official NBA",2016-10-27 18:14:58,791765157965926401
preparing my wallet for that anniversary sale on war thunder lol,2016-10-27 18:14:16,791764982547357696
Umm.... last time I checked DSM bring nothing but peace and relaxation to LSW lives... and the occasional thunder when LSW are in need https://twitter.com/missparisi_/status/791764230705782785 …,2016-10-27 18:14:07,791764944928649216
Eu simplesmente amo Thunder do # EXO,2016-10-27 18:14:05,791764937261678593
"A great line up for ""Country Thunder Saskatchewan"" https://twitter.com/leaderpost/status/791764092516196354 …",2016-10-27 18:14:04,791764930605228032
"Loud & clear, The LoudCast, Thunderoos, and Thunder Time are some names I just came up with.",2016-10-27 18:14:02,791764922413625344
"World warships, and War thunder",2016-10-27 18:13:52,791764880445607936
"If the thunder don't get you, then the lightning will.",2016-10-27 18:13:10,791764705496952832
"""She had a need to feel the thunder, to chase the lightning from the sky"" - Garth Brooks",2016-10-27 18:13:07,791764691332792322
How will Kevin Durant feel if the warriors get eliminated by the thunder this year,2016-10-27 18:12:34,791764554820816896
one of my favorite songs of all time. I love the version on the Delicate Sound of Thunder.,2016-10-27 18:12:30,791764537250754560
Kim Blevins reveals the new name of Craven Country Jamboree.... it's now Country Thunder. # yqr # Cravenpic.twitter.com/LMK4ppKPpp,2016-10-27 18:12:29,791764533886844928
Maverick has arrived at the Boo Bash! Can't wait to welcome Thunder families. Where's Goose? pic.twitter.com/UUbggrugsJ,2016-10-27 18:12:27,791764522885320709
Thunder Dragon Breeder! I just bred a Thunder Dragon in DragonVale! Visit my park to check it out! http://bit.ly/A7Dtgj,2016-10-27 18:12:13,791764463846248448
How do you get ready for a @ celtic_thunder concert? IHOP of course! # BreakfastForDinner # BestNightEver,2016-10-27 18:12:02,791764418375716868
"Craven Festival now part of Country Thunder announce Shelton, Keith and Urban as headliners. pic.twitter.com/0jvzH1jEqZ",2016-10-27 18:11:57,791764396997349376
10k views PogChamppic.twitter.com/7oCmvF7pKC,2016-10-27 18:11:52,791764377825320960
"Coming up at 5 on @ kfor, the # Thunder's ""Mr. 4th Quarter,"" Dana Holgorsen on # OkState home field advantage, and # Sooners coach on defense.",2016-10-27 18:11:51,791764373479972864
I AM BLOOD AND THUNDER! I AM A RIGHTEOUS FURY! ...I AM YOUR FUTURE DAUGHTER!,2016-10-27 18:11:47,791764355087945728
"New top up! This is ""雷さまのたいこつり (the thunder god's taiko fishing)""! # JapaneseArt # 独楽 # taiko… http://carvingcommunity-dentouart.com/2016/10/27/%e9%9b%b7%e3%81%95%e3%81%be%e3%81%ae%e3%81%9f%e3%81%84%e3%81%93%e3%81%a4%e3%82%8a-the-thunder-gods-taiko-fishing …pic.twitter.com/GRQD6SsUHW",2016-10-27 18:11:42,791764335538212864
NBA ROUNDUP | Anthony Davis erupts for 59 points in Pelicans win; Cavs rout Thunder # AnthonyDavis http://dlvr.it/MXjZd2 # AnthonyDavis,2016-10-27 18:11:31,791764288062971904
what you playing?,2016-10-27 18:11:11,791764206852997120
Blake Shelton to headline Friday night show at Country Thunder Saskatchewan. Toby Keith on Saturday and Keith Urban on Sunday.,2016-10-27 18:11:02,791764167011147776
I SCREAMED RT @ LBoogieOnSports: RT @ BleacherReport: Kevin Durant sighting at the Thunder game tonight https://vine.co/v/5dFYlVFl7aV,2016-10-27 18:10:44,791764092721721344
War Thunder 4 года http://xgames-online.ru/blog/novosti/war-thunder-4-goda.html …pic.twitter.com/XEfa2bKCXs,2016-10-27 18:10:41,791764078096244737
"The Thunder responds, tied 1-1",2016-10-27 18:10:34,791764051751755776
"Craven Country Jamboree is getting a new name. Its now called ""Country Thunder Saskatchewan"".",2016-10-27 18:10:33,791764044701065217
（≧∇≦）,2016-10-27 18:10:18,791763981673205760
"""Chocolate Thunder From Down Under"" pic.twitter.com/6Xxj3u9wa1",2016-10-27 18:10:10,791763951495344128
When Craven joins with country thunder! # isthisreallife # bestdayever # lifemade,2016-10-27 18:09:58,791763900366589952
Craven Country Jamboree has been renamed to Country Thunder # yqr # sask,2016-10-27 18:09:56,791763890593935361
"Blake Shelton, Toby Keith, Keith Urban, and Terri Clark announced for The Craven Country Jamboree, now called Country Thunder Saskatchewan.",2016-10-27 18:09:48,791763855596593152
Every time there's a storm I think of Garth Brooks' The Thunder Rolls,2016-10-27 18:09:45,791763845341667328
It's so awesome to hear that things are finally going right for you! I still feel bad that I forgot to read Summer Thunder for you,2016-10-27 18:09:40,791763822524571648
Apparently Dobbs and his ilk are just a little jelly that Evan McMuffin is stealing from Trumps dwindling thunder. # TYTlive,2016-10-27 18:09:37,791763813133524992
Soso cantik jodoh thunder <3,2016-10-27 18:09:29,791763777469358080
"http://asoftmurmur.com/ , rain & thunder & fire and some soft jazz from @ Spotify and suddenly the world seems tolerable again.",2016-10-27 18:09:28,791763775334547456
http://ift.tt/2eWL0Pm air jordan 14 retro thunder,2016-10-27 18:09:25,791763762604826624
@ Wichita_Thunder @ SwampRabbits Yep. Alex is super bummed. He had tix.,2016-10-27 18:09:24,791763757483438080
"45 mins to # DisorganizedPlay! I'll recap our latest session of Storm King's Thunder, talk maps & clues and take your questions! Join me.",2016-10-27 18:09:23,791763752580374529
Bon demain je tourne une vidéo sur war thunder ;) Et je publie une autre sur M&W #@Orbital_Game,2016-10-27 18:09:12,791763706803650560
"@ dallassmith has just unveiled the new branding for Country Thunder Saskatchewan, formerly @ CCJsaskpic.twitter.com/j8ZWZLAy16",2016-10-27 18:09:06,791763679658205185
"""“Pain. I seem to have an affection, a kind of sweettooth for it. Bolts of lightning, little rivulets of thunder. "" -- Toni Morrison, Jazz",2016-10-27 18:09:00,791763655796948996
@Thunder_Digest take the ladies advice I have Booker and you have Anderson https://twitter.com/jenjoliver/status/791684640654266368 …,2016-10-27 18:08:57,791763642559508480
"The Craven Country Jamboree will now be called the Country Thunder music festival, organizers have announced. pic.twitter.com/VIkHYkcrEF",2016-10-27 18:08:45,791763592630702080
Country Thunder Campsites: I have 2 campsites in Wild Horse for sale (side-by-side). I am selling them for $6... http://bit.ly/2fkEtSN,2016-10-27 18:08:36,791763553556455424
@ andrewperloff My favorite 76ers player after Barkley was Thunder Bob Thornton,2016-10-27 18:08:31,791763534397014016
Participa en el sorteo CARENADOS GP REGALA UN CASCO MT THUNDER de @ carenadosgp en http://sorteamus.com/r/2mrih @ sorteamus,2016-10-27 18:08:14,791763462254956545
thunder,2016-10-27 18:08:12,791763455984279552
今後も同じようにドロップすることを切に願います(＞人＜;),2016-10-27 18:07:52,791763371242561536
"@ CCJsask is now Country Thunder Saskatchewan. The lineup: Blake Shelton, Toby Keith, Keith Urban, Deric Ruttan, Terri Clark, Dallas Smith",2016-10-27 18:07:35,791763299406782464
"RT declothed: ""what happened to us?"" she was lightning and i was thunder, the timing was always slightly off.",2016-10-27 18:07:23,791763248949432320
http://ift.tt/2eWL0Pm # Shoes air jordan 14 retro thunder,2016-10-27 18:07:20,791763236446097408
"@ AllmericanMayes @ Colby_Daniels I get Morrow doesn't play good defense, but the Thunder don't play good team defense anyway.",2016-10-27 18:07:19,791763230712487936
Celebrating War Thunder’s Fourth Anniversary Gaijin Entertainment Adds Some Halloween Fun http://bit.ly/2fje0oH pic.twitter.com/eQBGFtCkBK,2016-10-27 18:07:02,791763162882273281
頑張ります,2016-10-27 18:07:01,791763156209012736
Watching the doctors with my mom and the thunder from down under group does a performance. Hmm I wonder what the target demographic is.,2016-10-27 18:06:37,791763056871170048
War Thunder отмечает четвертый День рождения и день всех Святых https://goo.gl/fb/MakMKt,2016-10-27 18:06:33,791763041289400320
I really can't see how the Thunder Rapids ride can ever open again,2016-10-27 18:06:25,791763005692190720
知ってる！,2016-10-27 18:05:45,791762836938563584
素晴らしすぎます！これは大人が喜んで買いますね笑( ˶ˆ꒳ˆ˵ ),2016-10-27 18:05:40,791762815258234881
I liked a @ YouTube video from @ thunders7ruck http://youtu.be/c2QQxhZt0dM?a 402Thunder Gets A Brutal N Super Kill On Infinite Warfare - Too,2016-10-27 18:05:28,791762768227659776
Thunder Dragon Breeder! I just bred a Thunder Dragon in DragonVale! Visit my park to check it out! http://bit.ly/A7Dtgj,2016-10-27 18:05:24,791762749613281282
Heir of Thunder paperbacks are available. Got my copies today and they look great! pic.twitter.com/VWcKgBVhRG,2016-10-27 18:04:58,791762642687766530
", I'm talking Shit, I know, but I still like Memphis and thunder",2016-10-27 18:04:49,791762602074439680
". @ CCJsask, rebranded as Country Thunder Saskatchewan, to have @ blakeshelton @ TobyKeithMusic & @ KeithUrban as 2017 headlinerspic.twitter.com/sfOzNlQAfJ",2016-10-27 18:04:30,791762524987195393
➍ Apple event ➎ MacBook Pro ➏ Vine ➐ OKC Thunder ➑ Ben Simmons ➒ Mariah Carey ➓ SAT Scores 2016/10/27 17:04 CDT https://www.google.com/trends/hottrends?pn=p1 …,2016-10-27 18:04:04,791762412382715904
War Thunder va concocter des événements spéciauxpour fêter Halloween http://www.mega-games-le-blog.com/2016/10/war-thunder-va-concocter-des-evenements-speciauxpour-feter-halloween.html?utm_source=_ob_share&utm_medium=_ob_twitter&utm_campaign=_ob_share_auto … # ActuJeuxvidéos,2016-10-27 18:03:52,791762364823695360
"Wow. A year ago today was the ""Bob Thunder: Internet Assassin"" premiere / release. Was a great night with family, friends and LA weirdos! ;)",2016-10-27 18:03:08,791762178621648896
all enemies run & cower in the face of Sora's deadly thunder armatus pic.twitter.com/UTZrRigwe1,2016-10-27 18:03:05,791762165757648896
"I'm yet to find an establishment that does a better Taco Fries than Blue Thunder, Castlebar and Westport.",2016-10-27 18:02:23,791761990582669312
"Hello. PRE-ORDER Deadly Storm Lightning Thunder edisi tanda tangan kembali dibuka. Cek tanggalnya ya, 18… [pic] — https://path.com/p/3yvv5f",2016-10-27 18:02:08,791761928129392640
Super Excited - # Raptor thunders toward # Vegas for # SEMA2016 – ready for her big reveal @ SEMAShow 2016pic.twitter.com/OZ89OyYHKm,2016-10-27 18:01:50,791761853395374084
Such a blunder sometimes it makes me wonder why I even bring the thunder.,2016-10-27 18:01:15,791761705625714688
Check out my broadcast from my PlayStation 4! # PS4live (War Thunder) live at https://www.twitch.tv/volhall1980,2016-10-27 18:01:13,791761697656692736
"Raise your words, not voice. It is rain that grows flowers, not thunder. - Rumi # quote",2016-10-27 18:01:12,791761693290426368
Baby got a face like thunder,2016-10-27 18:00:59,791761636763705344
# Westbrook anota 32 y el # Thunder gana a # 76ers. # Oklahoma City logró una victoria de 103-97pic.twitter.com/NpDeSyPXlx,2016-10-27 18:00:41,791761564579799041
“Girls like her were born in a storm. They have lightning in their souls. Thunder in their hearts. And...” https://tmblr.co/ZbD22x2DxYsJ-,2016-10-27 18:00:39,791761554983251969
Storm King's Thunder (D&D) - E13: Poor Chicken http://youtu.be/Q20rVg6ej7k?a,2016-10-27 18:00:38,791761549966934016
J'ai ajouté une vidéo à une playlist @ YouTube - War Thunder FR | Speed Kill Montage | http://youtu.be/Ahg9g5GSd3I?a,2016-10-27 18:00:23,791761488805556224
Smoke a nigga like a jay of da thunder,2016-10-27 18:00:20,791761474523889668
I Suck. (S2.R19) NASCAR Thunder 2004 Career Mode: http://youtu.be/azalFCIRS7I?a via @ YouTube,2016-10-27 18:00:08,791761424162881537
.@thunder_ck さんの @ YouTube 動画を高く評価しました: http://youtu.be/53MdWrKWVNc?a 【遊戯王】カバ壊獣ヘルテン,2016-10-27 18:00:05,791761411147956225
"Thunder Swamp Beer Soap w/Hemp Seeds-Acne, Skin Abrasions, Psoriasis, Eczema, Dryness http://goo.gl/TFxwSQ pic.twitter.com/90PG7LNoiw",2016-10-27 18:00:04,791761407821778945
"Listen to Wrestlers bring even more thunder to ishi's ""Bring the Thunder"" in this exclusive premiere. http://fb.me/5tJNhdMO7",2016-10-27 18:00:03,791761403803611136
Oklahoma City Thunder star Russell Westbrook showed off all of his moves in this new Jordan ad. http://fb.me/1OZRparMt,2016-10-27 18:00:03,791761401681510400
La dependencia de los Thunder con Russell Wetbrook es brutal. Casi hace triple-doble y sufren para ganar a los 76ers. Jugadorazo Joel Embiid,2016-10-27 17:59:58,791761382064713728
I'm only honest when it rains If i time it right. The thunder breaks When i open my mouth I want to tell you but i don't know how,2016-10-27 17:59:47,791761336602599425
Catch U.S. Cellular and their exclusive Thunder experience at HallowZOOeen or the Owasso Harvest Fest! Details: http://okcthunder.com/promotions .pic.twitter.com/6ht4HiGKO1,2016-10-27 17:59:28,791761256709394432
"RT: Raise your words, not voice. It is rain that grows flowers, not thunder. - Rumi # quote via @tracyturnernow",2016-10-27 17:59:06,791761165961531392
"""And I heard, as it were, the noise of thunder One of the four beasts saying, 'Come and see.' and I saw, and behold a white horse"" # lkldpic.twitter.com/0WJhZ0t1k9",2016-10-27 17:58:52,791761107320967169
"Raise your words, not voice. It is rain that grows flowers, not thunder. - Rumi # quote",2016-10-27 17:58:34,791761031697731586
"that we must be short, cause they blocked the crap out of the Thunders shots",2016-10-27 17:58:18,791760964374802432
2 inches of rolling thunder is all you need my friend,2016-10-27 17:58:14,791760944816918529
Thunder up! https://twitter.com/blackpplvines/status/791741680902864896 …,2016-10-27 17:58:04,791760906229211136
"Giant hands too, wonder what Greg Hands MP thinks of this thunder stealing # bbcqt",2016-10-27 17:57:33,791760773223677952
HOWLING THUNDER,2016-10-27 17:57:19,791760717405786112
(Turns around to see if the Thunder PR are listening to the interview.) pic.twitter.com/UqsXbXMXDy,2016-10-27 17:57:16,791760704168685568
Im in sky were thunder crying young # OnMySoul # MoB http://fb.me/89j7oJnWA,2016-10-27 17:56:13,791760438975344640
Retweeted Thunder Walks About ( @ notaxiwarrior): pic.twitter.com/kP72OvWvsU http://fb.me/8k4AqoaTn,2016-10-27 17:56:08,791760419417235456
Always preferred Dr Pepper (Dr Thunder is superior) over the other two anyway. https://twitter.com/chucknellis/status/791722194422362112 …,2016-10-27 17:56:01,791760389398814720
Can't ya hear can't ya hear the thunder?,2016-10-27 17:55:47,791760331802611716
# NowPlaying Burning Thunder by Lazer Lloyd ♫ http://spoti.fi/2a9BSYz,2016-10-27 17:55:34,791760276492214272
"# AlastairCook # Eng via @ TheSun @ MitchJohnson398 ""THUNDER DOWN UNDER Alastair Cook: Kevin Pietersen row springs to... http://fb.me/7IUaE42Fc",2016-10-27 17:55:21,791760220636778496
"Just Announced: Sarasota, FL - Jan 7 at Thunder by the Bay http://www.bandsintown.com/event/13209293?artist=Def+Leggend+&came_from=217 …",2016-10-27 17:55:17,791760205214261248
don't steal my thunder man,2016-10-27 17:55:16,791760200021585920
Participa en el sorteo CARENADOS GP REGALA UN CASCO MT THUNDER en http://sorteamus.com/r/2mrih @ sorteamus,2016-10-27 17:55:15,791760194741075968
# tubersimulator Feels more like a home now. Add me: iTz Thunder pic.twitter.com/eICQjAvxWN,2016-10-27 17:55:12,791760181201924096
Ae Dil Hai Mushkil Review : Ranbir Kapoor steals the thunder from the two women: This week… https://goo.gl/fb/Hf7ga1,2016-10-27 17:54:50,791760092131622912
I hear thunder,2016-10-27 17:54:43,791760063362797569
thunder sound.,2016-10-27 17:54:39,791760046757588992
"Anthony Davis would fit perfect on the Wizards, Trail Blazers, Thunder, and the Celtics",2016-10-27 17:54:35,791760026574659588
Thunder pic.twitter.com/HW4vjCLULy,2016-10-27 17:54:13,791759933603713024
Gostei de um vídeo @ YouTube http://youtu.be/WPdPBY6EMSU?aPower … Rangers Dino Thunder - White Ranger vs Evil White Ranger (Final Battle),2016-10-27 17:54:04,791759897297838080
I liked a @ YouTube video http://youtu.be/_peMDiN6f14?a The Japanese House - Face Like Thunder,2016-10-27 17:54:03,791759895108390912
"The Thunder will finish top 5 seed isn't a hot take at all, although the GS one I don't agree with https://twitter.com/jewvenn/status/791758009751867397 …",2016-10-27 17:53:29,791759752120377344
NBA viewership comp to '15-16 Tuesday TNT Knicks/Cavs -17% Spurs/Warriors + 38% Wednesday ESPN Thunder/Sixers - 13% Rockets/Lakers -15%,2016-10-27 17:53:03,791759641218781184
War Thunder отмечает четвертый День рождения и день всех Святых https://goo.gl/fb/Q3Y0IK,2016-10-27 17:52:58,791759621681713152
Chris Rumble Scores GW Goal to Give @ Wichita_Thunder 4-2 Victory Over Atlanta Gladiators. Recap @ MinorLgeReport http://minorleaguesportsreport.com/index.php/chris-rumble-gives-wichita-thunder-4-2-comeback-victory/ …,2016-10-27 17:52:53,791759601418973185
Big Thunder Mountain Railroad http://antiquesmall.us/big-thunder-mountain-railroad/ …pic.twitter.com/Q9WZmCtNcd,2016-10-27 17:52:33,791759514664001536
Big Thunder Mountain Railroad http://antiquesmall.us/big-thunder-mountain-railroad/ …pic.twitter.com/0ynm4XfUOL,2016-10-27 17:52:31,791759506514464769
Chris Rumble Gives Wichita Thunder 4-2 Comeback Victory http://minorleaguesportsreport.com/index.php/chris-rumble-gives-wichita-thunder-4-2-comeback-victory/ …,2016-10-27 17:52:30,791759504778010624
Chris Rumble Gives Wichita Thunder 4-2 Comeback Victory http://minorleaguesportsreport.com/index.php/chris-rumble-gives-wichita-thunder-4-2-comeback-victory/ …,2016-10-27 17:52:28,791759496653606912
# apple # tips: Late night question: Is de Mac Pro overbodig geworden door de nieuwe Quad Core MacBook Pro en Thunder… pic.twitter.com/B9EMpQDP4Q,2016-10-27 17:52:18,791759451447492608
# OKCThunder # ThunderUp # WeAreThunder Thunder opener: More to like than dislike http://dld.bz/fcbhD pic.twitter.com/29oe7xgMc7,2016-10-27 17:52:06,791759401103290368
I thought that was thunder!,2016-10-27 17:52:05,791759399274414080
Thunder & Co. - Hydrogen Bonds https://www.youtube.com/watch?v=tdyNiKgJNfU&feature=share …,2016-10-27 17:51:59,791759375144722432
"I don't play the ukulele, but there's a Thunder ukulele here and I want it.",2016-10-27 17:51:52,791759342542303232
Thunder In The Rain http://fb.me/H2wwYb7e,2016-10-27 17:51:34,791759269716758528
"I'm listening to ""Thunder In The Rain"" by Kane Brown on @ pandora_radio. # pandorahttp://pdora.co/2eLpSio",2016-10-27 17:51:31,791759258148745221
Thunder win home opener 9-2 | Tillsonburg News http://www.tillsonburgnews.com/2016/10/27/thunder-win-home-opener-9-2 …,2016-10-27 17:51:31,791759257385304064
which og the gods ooo shey god of thunder or of fire or which one https://twitter.com/PIrichardson/status/791738216307122176 …,2016-10-27 17:51:25,791759228935417856
"State Questions, school report cards, and a Thunder victory! Don't… https://www.instagram.com/p/BMFQPcaBEwRbQ5dZRbbVVF6PzSnQVTLVJd3L7Y0/ …",2016-10-27 17:51:22,791759217736556544
@ YoungGunn33 do you have a job yet? call Thunder Beach 888-710-Sand (7263) Tim,2016-10-27 17:51:09,791759165622366208
"yes, but they get a Sat night game this week. We'll see how the crowd is vs. Badgers, Ads opener, and my 10-year anny w Mrs. Thunder https://twitter.com/Marquette_g/status/791755958359842817 …",2016-10-27 17:51:04,791759143191384067
Opening week reflections and Thunder vet Nick Collison drops in on Episode 255 of The Hang Time Podcast http://www.nba.com/article/2016/10/27/hang-time-podcast-episode-255-nick-collison-kevin-durant …,2016-10-27 17:51:04,791759142872580096
"Huge day tomorrow. Shouldn't have just started watching ""Days of Thunder"".... But hey.",2016-10-27 17:50:53,791759096835895296
"OCAA Thunder MSoccer All-Stars: Dylan Tessier, Maher Hussein, Anthony Legendre, Alex Asmis, Marco Natoli & Yusuf Dahir! @ ALGThunder",2016-10-27 17:50:39,791759040111976448
War Thunder - Night Witches Racing Event Rings In 4th Anniversary https://goo.gl/fb/4ZgZYB,2016-10-27 17:50:39,791759037708832772
Causing thunder and throwing lightning bolts?,2016-10-27 17:50:34,791759018150637568
One thing the Thunder showed Wednesday night: They're putting their trust in Steven Adams' offensive game. http://www.normantranscript.com/sports/steven-adams-shooting-carrying-into-regular-season/article_5aec46b4-9c61-11e6-a0f9-bf3ced73ee85.html …,2016-10-27 17:50:33,791759013847273472
Our Niagara Wonder and Niagara Thunder can each carry 700 passengers into the Falls. # FunFact # NiagaraCruises,2016-10-27 17:50:02,791758884545245184
7D: 60 Splash: 25 Thunder: CLOSED SPC: 30,2016-10-27 17:50:01,791758878195220480
Up/Down: Scott Greenham (G) | Wichita Thunder -> Binghamton Senators | http://eliteprospects.com/t.php?id=292349 # AHL,2016-10-27 17:49:54,791758848289824768
Don't Stop!! https://vine.co/v/iBFeFBwFMWV (Vine por Pup.Thunder),2016-10-27 17:49:52,791758842623238145
THUNDER THE GOD,2016-10-27 17:49:45,791758811145003008
"ahh yess!!! hero/heroine, thunder, five minutes to midnight <3",2016-10-27 17:49:19,791758702466392064
Up/Down: Matt Bailey (F) | Stockton Heat -> Adirondack Thunder | http://eliteprospects.com/t.php?id=292348 # ECHL,2016-10-27 17:49:09,791758662335430656
Thunder Up,2016-10-27 17:49:03,791758637190352896
"Gostei de um vídeo @ YouTube de @ icebohica http://youtu.be/0Y6FIkZBGH0?a War Thunder - Mosquito FB Mk VI ""Nigel's Fury""",2016-10-27 17:49:02,791758632354537473
Thanks to Magnetic Magazine for dropping our new remix of 'Bring the Thunder' by the Wrestlers. Check it:... http://fb.me/7GCMxnC2l,2016-10-27 17:48:51,791758583423574016
"Westbrook, # Thunder spoil Embiid's debut for # 76ershttp://www.sportstwo.com/threads/westbrook-impressive-in-thunder-win.305502/ …",2016-10-27 17:48:49,791758576809304064
Chocolate Thunder thoo (Vine by @ lifeofrickey)https://vine.co/v/OO7xAgFYYAJ,2016-10-27 17:48:27,791758485260238853
kyloween? I feel like Star Wars took a lot of my name thunder.,2016-10-27 17:48:06,791758396529573888
Good Luck to our skipper @ sbelston87 who travels to Bundaberg representing Gold Coast Thunder in Schaeffer Shield this weekend! # pomontour,2016-10-27 17:48:00,791758369606348800
おはようございます。 皆んながデーモン閣下だと、今でも充分驚くと思います(^^;;,2016-10-27 17:47:20,791758203017043969
# thunder # Oklahoma Las Vegas Line Movements,2016-10-27 17:47:05,791758138848358401
Thunder Cyber Cider!!! (http://youtu.be/Cg2SnnYocNA ),2016-10-27 17:47:01,791758124113813504
I was told GS won't get the first seed in the west and that the thunder will finish top 5 seed... https://twitter.com/_njay3/status/791755902659493897 …,2016-10-27 17:46:34,791758009751867397
Un repaso por los productos que ofrece Thunder X3 para gamers y entusiastas http://fb.me/5dS9UpS2b,2016-10-27 17:46:30,791757992005808128
"*thunder thunder* ...!! ... ... ...;;; Umm... Can I sleep with ya tonigh, please? ;w;",2016-10-27 17:46:28,791757985324249088
"RT: TWoSEdm, ""Experience the 100m drop of Victoria falls. Known locally as 'the smoke that thunders' # WildAfricaYE… https://twitter.com/i/web/status/791757741232680962 …""",2016-10-27 17:46:24,791757969314746368
Experience the 100m drop of Victoria falls. Known locally as 'the smoke that thunders' # WildAfricaYEG # IMAX # MyTWOSE http://ow.ly/QOpA3059ARQ pic.twitter.com/dUoRIkoPqI,2016-10-27 17:45:30,791757741232680962
"Practice Roundup – Oct. 27, 2016: Russell Westbrook has talked about it for years: getting stop... http://nba.nbalinks.tk/Zxz # NBA # thunder",2016-10-27 17:45:23,791757710991630337
ソラトちゃん、おはよう(^^)/わ～～いいな！旅行だったよね♪息子君バッグをわすれなかったかな！ 旅行楽しんできてね,2016-10-27 17:45:13,791757671862894592
Today will go down in history 1) offered and accepted a full time position with the Thunder 2) made an offer on a house as soon a I saw it,2016-10-27 17:44:56,791757600442290176
And pray for the thunder And the rain To quietly pass me by,2016-10-27 17:44:40,791757530670239746
Sewing patches on Halloween costume in between War Thunder games. Not bleeding too much so that's good,2016-10-27 17:44:30,791757491453489153
醤油：宗教勧誘が来た。「あなたは神様についてご存知ですか」って言われたから「Eijing Thunderの事だ」と言ってドアを閉めた,2016-10-27 17:44:27,791757478958551040
Gods of Thunder https://youtu.be/JM4_QcUE-IA,2016-10-27 17:44:06,791757389825466373
@ wossy Can you play Thunder In The Mountains by Toyah!? It was my favourite Toyah! song for a month in 1981.,2016-10-27 17:43:46,791757306170109952
"Your thighs are nice and lovely, bring the thunder!",2016-10-27 17:43:25,791757217212936192
The Dog of Thunder - Labrathor! # Thor # Marvel # cutedogspic.twitter.com/zl3EN5dvJp,2016-10-27 17:42:32,791756996349308928
the thunder woke me up from a nice fat nap.. i'm mad,2016-10-27 17:42:30,791756988996870144
*Looks at his hand in shock and horror as it crackled with thunder* Sakura...I swear...I didn't mean to attack you. I'm sorry,2016-10-27 17:42:13,791756916917694464
Desert Strike intro https://youtu.be/HnkXaLmYG34 or Thunder Force IV intro https://youtu.be/HkPa1V-yKDM ? # SEGA # Retrogaming # WhatNintendont,2016-10-27 17:42:13,791756914778574848
